Review_Date,Author,Rating,Review_Title,Review,Review_Url
0,16 August 2004,Quinoa1984,10," My third favorite Kurosawa film- deliberately paced (not painfully so), heavy on tragedy, and glorious in overall artistry","I would agree with Ebert's review on a point, that Akira Kurosawa, legendary director of such samurai classics as Seven Samurai, Yojimbo, Hidden Fortress, and Kagemusha, as well as human dramas like Rashomon, The Lower Depths, and Red Beard, could really best direct this film in his old age. There's something about his version of the doomed King Lear of Shakespeare, his Lord Hidetora Ichimonji that could be truly captured by someone in old age. Not to say that directors can't make great films when they're young, or in middle age, about a man in the dark days of the golden years (About Schmidt, Tokyo Story, Bob Le Flambeur, and Kurosawa's own Ikiru come to mind). But it's clear that Kurosawa must've seen or felt or understood at least an element of Hidetora's character, something that goes beyond tragedy that is stuck with all who are mortal. ",/
1,19 August 2010,Loving_Silence,10, The Best Film based on one of Shakespeare Best Works. This Masterpiece is recommended for anyone that loves movies . Truly one of the Greatest Films of all time!,"Akira Kurosawa's 1985, Ran, is based one of Shakespeare's greatest works, King's Lear. The Film proudly stands along with his other classic such as Seven Samurai, Yojimbo, Roshomon, Sanjuro and the Hidden Fortress. He is a master in the art of filmmaking, no one can film an epic battle scene quite like Kurosawa. This is recognized as the most expensive film ever made by Akira Kurosawa, it was at that time, Japan's most expensive film ever. Being at the age of 75, he still showed us, he's one of the best in the business.",r
2,26 July 2001,smakawhat,9, A film requiring patience with huge rewards for the viewer!,The 'Kurosawa' adaptation of King Lear in his film 'Ran' is a tremendous memorable film.,e
3,3 November 2005,zolaaar,10, Jester and Warlord,"'Ran' is the Japanese word for chaos, riot, dissension. Akira Kurosawa's masterpiece is indeed a feast of destruction and perdition, charged with symbols and powerful in pictures like it is found very rarely in today's cinema.",v
4,3 July 2009,murtaza_mma,10, Greatest rendition of a Shakespearean Epic,"Ran is probably cinema's greatest rendition of a Shakespearean Epic, ironically coming from an oriental film-maker. Adapted by Kurosawa from Shakespeare's King Lear, Ran undoubtedly features amongst the best works of the master auteur. It captures with sheer vividness and surreal resplendence, the true essence of human struggle for survival, highlighting the cruelties associated with life. Ran is strictly indicative of the sole consistency of life i.e. Change, an attribute that not only makes the humans vulnerable but also gives them the hope to rise after a fall.",i
5,13 April 2003,rbverhoef,9, Very well made,One of the last great films directed by Akira Kurosawa. A father gives his land and his power to his three sons. They turn against each other and against their father.,e
6,31 March 2004,Elendil87,10, The Greatest Shakespeare Film,"Throughout his career Kurosawa strove to achieve what he called ""real cinema"", proclaiming that ""in all [his] films, there's [only] three or four minutes"" of such quality. Many would argue that he was his greatest critic. For if not in ""Seven Samurai"", then definitely in ""Ikiru"" and if not in ""High and Low"", then definitely in ""Rashomon"" he must have achieved this plateau of greatness. Well, if not in any of his other films, then definitely in ""Ran"" Kurosawa finally came to the apex of cinematic artistry. With the both lyrical and grandiose tone of its craft, its beautifully spare imagery, its haunting score by Toru Takemitsu, and its lead Tatsuya Nakadai's masterful understated performance, ""Ran"" is perhaps the most fully realized epic ever made.",w
7,7 August 2001,Anonymous_Maxine,10," Sometimes, given sufficient objectives, even the people who are closer to you than anyone else can turn against you.","In another lengthy samurai epic, Akira Kurosawa approaches the boundaries between family members and the damaging affects of one of his rather common themes - reckless ambition. This is very clearly a Kurosawa film, a respectable trait that is most clear in the cinematography, in which Kurosawa uses many extensive shots with little to no camera movement, as well as the common natural setting, characterized by the far-reaching landscapes of sweeping hillsides. ",/
8,5 August 2009,Samiam3,7, Strong but Sloooooooowwww,"I am not certain, but I think Ran was Akira Kurosawa's last big feature. Visually, It might be his most distinctive. Being in color opens a lot of doors to cinematography, and makes it easier to see how much artistic creativity went into the sets and costumes. There is something else distinctive about Ran. It is his slowest picture. You need extreme patience to make it through this very long movie, and you also need to understand the context of the story.",r
9,30 December 2004,O_L_D_B_O_Y,10, RAN - A Classic Of Its Time And For All Time,"Based on Shakespeare's King Lear, this film follows the story of the aging warlord Hidetora who, in an attempt to restore peace, divides his kingdom between his three sons - Taro, Jiro, and Saburo - and retires from his duties. However, one of his sons sees this as unwise and is banished by his father, leaving his two brothers in charge of two of the three castles left in their hands. It isn't long before they are overtaken by greed and eventually betray their father, leaving him in the hands of a philosophical jester and a loyal retainer. This betrayal ultimately leads to war, dividing the family and driving Hidetora insane.",w
10,3 June 2005,FilmOtaku,5, Not as great as I thought it would be,"Realizing that it is practically heresy in the film world to criticize a Kurosawa film, much less downright dislike it, I'd like to precede my review by saying that I have absolutely loved every Kurosawa film I've seen  until now. ""Ran"", Kurosawa's 1985 film based somewhat on Shakespeare's ""King Lear"" is the story of an elderly emperor who hands down his kingdom to the oldest of his three sons. While the oldest and middle son fan over each other, saying that they are not deserving, etc. it is the youngest who speaks his mind about the subject, incurring the wrath of his father and ultimately, banishment from the area. Meanwhile, the two older sons are making a mess of things with the kingdom, leading to wars, fratricide and the dismissal of their father, even attempting his murder. None of their motives are noble or honorable, only avarice and power motivate them, leading to tragedy for all.",4
11,10 June 2012,TheLittleSongbird,10, Akira Kurasawa's take on King Lear,"I loved Kurasawa's Throne of Blood, and heard this was even better. And indeed it was, for me second only to Seven Samurai as his best film and one of the finest movies ever made. As with any Kurasawa film, it is superbly made with the camera work in look and technique masterly and the colour and period detail really sumptuous. The battle sequences are even more epic in scope and emotional impact than Seven Samurai, aided by the spectacle and camera work. The music is rousing and haunting, almost sometimes paying homage to Mahler, the script is literate and thoughtful and the story intensely moving. Add to that Kurasawa's ever immaculate direction and the truly remarkable lead performance Tatsuya Nakadai and you have an even more brilliant film. Rounding off is the truly Machiavellian performance of Mieko Harada as the daughter-in-law figure. The over-two-and-a-half-hour length and slow pacing didn't hinder Ran in the slightest, at least to me anyway, though some not used to Kurasawa's style may be deterred. In conclusion, there wasn't much I really could add to the wonderful reviews already, but I do think Ran is a superb film with much to admire. 10/10 Bethany Cox",4
12,17 July 2012,kluseba,4, Failure at the highest level,This movie came as a big disappointment to me. I really adore Japanese culture and history and I am a big fan of Asian cinema. I was looking forward to see a film that is considered as a masterpiece by many and has risen to world wide fame.,7
13,24 October 2016,Leofwine_draca,9, Kurosawa's late historical masterpiece is one of the best Shakespeare adaptations out there,"This was my fourth Kurosawa film and my favourite to date. Previously, I'd started off by watching SEVEN SAMURAI (a great film), then trying out KAGEMUSHA (which I thought was okay, but too constrained by budget). Next up was an early classic, RASHOMON, which was a fine human drama, and now comes RAN, Kurosawa's final historical epic and the film that he claimed KAGEMUSHA was a mere warm-up for. I can see that. RAN is an epic film, truly epic and one of the best-shot films I've ever seen. Every frame of the film seems to have been painstakingly composed and the result is a bright, colourful, and vivid production that fully brings to life the castles, costumes, and characters of feudal Japan.",9
14,9 July 2005,raistlin_lukas,10, Single. Greatest. Shakespeare. Adaptation. Ever.,Thankee kindly.,5
15,16 September 2009,Hitchcoc,10, A Masterpiece of War and Greed,"This is film that everyone needs to see. It brings home the horrors of war, betrayal, and greed. When the kingdom is divided among the sons in this version of King Lear, we just know that the person who bares himself honestly is going to become an outsider. The acting is sensational, with masterful personal encounters. Kurosawa even managed to keep the fool as an integral part of the story. Others have eloquently dissected this movie. What I have to offer is that there is such a poetry to the visual aspects of this film. While the battle scenes are among the goriest and grizzliest that have ever been put on celluloid, there is a dance here, a wave of the most intense coming and going as we watch the soldiers fall. It tells how potentially good men can be influenced by the forces of evil. The wife of the first son is purely vengeful, and horrifying. She is nearly a carbon copy of the woman who played the wife of Mifune's Macbeth character in ""Throne of Blood."" I have been reviewing the Kurosawa canon and am convinced that this may be his finest work.",7
16,12 September 2005,Lady_Targaryen,10, King Lear adaptation..and Great!:),"Usually, I don't write comments of movies that have too many reviews. But this one is so good, that I decided to break this rule. Ran is an adaptation of King's Lear, a story from William Shakespeare , very tragic and full of treasons.",0
17,6 February 2007,sherbetsaucers,10, Awe Inspiring,"At the core of this movie there is a long running philosophical question. Certain characters continually question what is happening around them, and through these questions, the themes of the movie are forthcoming. The most obvious theme is that of war. Here, once again, Kurosawa reminds us that modern warfare is not a place of honour or duels, but massed attacks on faceless enemies, shooting each other from a distance. I will discuss the battle scenes later in this review; they help us examine the chaos that is again consistent throughout the film. It seems that no one in this movie has any control over the events that are transpiring; not even the ultimate manipulator Mieko Harada as Lady Kaede has true control. This lack of control seems to mirror the idea put forward by the only character who is continually able to tell the truth without ramification. Shinnosuke Ikehata (credited here as Peter) is the fool who says 'Are there no gods... no Buddha? If you exist, hear me. You are mischievous and cruel! Are you so bored up there you must crush us like ants? Is it such fun to see men weep?' Even if god exists then the only pleasure he enjoys is watching mankind destroy itself in the chaotic mess that is war. The final scenes see chaos erupt, as through the good natured actions of one man, 4 armies are dragged into a bloody battle. Which leads us to the idea of futility and death. The pointlessness of life is summed up once again by the fool. 'Man is born crying. When he has cried enough, he dies.' Death comes to us all, yet it is far bleaker than that. If there is a god then they allow everyone to suffer. Even a noble character, like Saburo, dies an ignoble and futile death. Everyone within this movie is both hunter and hunted. It is a bleak world indeed.",/
18,26 July 2020,oakbymaple,6," Maybe a masterpiece, but only to Connoisseurs","The Movie certainly has its qualities: carefully built characters, impressive costumes and scenery and an apparent skill in storytelling, at least in some places: the bigger hollywood productions of these days could probably learn tons here.",?
19,21 February 2009,ebossert,4," Another Display of Directorial Ineptitude from the ""Master""","Review in one sentence: This movie has zero energy. What follows is my fragmented, chronological lambasting of this ""masterpiece."" ",r
20,3 March 2019,Horst_In_Translation,6, Daunting descent into despair and desolation,"""Ran"", which means translated ""Revolt"", bit this is not really used as a title for this film, is a Japaese/French co-production from 1985, so it will have its 35th anniversary next year. This movie is linked inevitably with Akira Kurosawa, by many considered the finest non-American filmmaker of all time, and it is a late career effort by him. He had already been in filmmaking for way over 40 years when he came up with this one we got here thatg turned into one of his career-defining movies. It is of course in contrastg to most of his earlier stuff in color and runs for over 2 hours and 40 minutes. I guess it was a tribute to Kurosawa that the Academy really appreciated this one as it also could have been a film that could have gone completely under the radar. However, it scored 4 Oscar nominations, one of them being for Best Costume for which it took home the award. And I think all these nominations are not undeserving. On the contrary, one or two acting nominations, for Nakadai and Haradai perhaps, would have been appropriate too. Butg lets get into the film. This is the story of an influential old Lord (played by a much younger actor by the way) who hands on the power to his sons. Too late he recognizes thatg he made a huge mistake that may not only endanger his heritage, but also his life eventually. But while the sons are pursuing their violent path, there is a new threat rising with a women full of revenge. Can the last remaining son help his father find a way out of his misery? Watch for yourself. One thing I want to emphasize here is that I mentioned earlier Kurosawa made many b&w films, but the way he uses colors for this film proves without a doubt that it is a shame he did not make more color films. For example before and after this film, there is a break of five years each. Anyway, with colors I was referring to red, yellow and blue mostly here, the colors symbolizing the sons and their armies. Things get heated for the first time when the old patriarch kills one of his soldiers' sons who was about to kill one of the old man's guards. Blood is not thicker than water in this case and the blue son (lets call him that) predicted it correctly. It takes a long time for the father to understand and a really rocky journey during which he turns from one of the most influential men of his country into an old bum you could say that is considered insane by many.",e
21,11 July 2020,clanciai,10, King Lear turned into a monumental epic in Japanese,"There is nothing wrong with treating Shakespeare at large with any licence, which Akira Kurosawa's ultimate masterpiece is a clear evidence of. He sticks mainly to only the skeleton of the play and makes as many deviations as possible, the most remarkable and successful being to let the fool stay on with King Lear throughout the drama to the bitter end, while in the play he is lost half way without an explanation. Instead of troublesome daughters there are troublesome sons, and the youngest proves to be the only true and correct one of them, like Cordelia, and meets with a similar fate but more militarily. In comparison with his earlier masterpiece ""Kagemusha"" there are less horses here and less beautiful music, while the main character of the film with its many devastating battles and massacres is rather apocalyptic, with some marvellous contrasts to the general doom, especially by the female interaction and the blind flutist, who makes something of a frontispiece and symbolic figurehead to the entire epic, adding some profound symbolism. Above all, Tatsuya Nakadai as the troubled old king is the best and most convincing Lear type I have ever seen, transcending even Laurence Olivier's characterization by mere physical acting without speech - his finest part is when he sits totally unmoved while everything around him is burning in the apocalyptic siege of the castle after the first hour. His long white hair, his wild eyes, his impersonation of the ultimate despair by mere movements and expressions - is enough to make this film only for his sake one of the most outstanding and indispensable films in all history - and it was Akira Kurosawa's ultimate masterpiece, made when he himself was 75 years old.",f
22,27 July 2016,SnoopyStyle,8, Shakespearean Samurai Epic,"Warlord Hidetora Ichimonji is haunted. He divides his kingdom among his three sons; Taro, Jiro, and Saburo. The oldest Taro is given the First Castle to lead the younger brothers. The youngest Saburo objects and he is banished. Another lord Fujimaki takes him in and offers his daughter for marriage. Taro's wife Lady Kaede lost her blood family to Hidetora's ruthless conquest and plots to destroy the family from within. Taro and Jiro force Hidetora from power driving him to madness.",_
23,20 January 2006,planktonrules,7, excellent but not among his very best,"I absolutely love the films of Akira Kurasawa and have seen most of them. And, for some reason, this is not among my favorites although it is one of his highest rated films on IMDb. Perhaps I'm just being too picky, but I think MAYBE its popularity is because it was made somewhat recently and some of his older (and I think more interesting) films are sometime forgotten. After all, MOST of the IMDb reviewers are old enough that they could have seen this film on the big screen, while very few could have seen his earlier films in all their glory. The other reason why I think it's a little overrated is that his version of Macbeth (Throne of Blood) is the best retelling of Shakespeare and so Ran, despite it being wonderful, pales if you see them one after another (like I did). And finally, the characters and their interactions are just sterile--with little understanding or life to the them.",=
24,7 April 2017,classicsoncall,8," ""The enemy is everywhere. Inside and out.""","I find myself in the same quandary with Akira Kurosawa's movies as I do with Hitchcock. I find some of them great and others just so-so, even if they're heralded by the professional critics. Having just watched Yimou Zhang's ""Curse of the Golden Flower"", I was pretty well conditioned for another film about Orientals in a dysfunctional family attempting to take each other out. The disconnect I have here is why all of a sudden the three brothers would have turned on each other without their father, Lord Hidetora Ichimonji (Tatsuya Nakadai), having an inkling that they were so mercenary and self serving. I'm also put off by the histrionics and aping aspect of some of the principals. As an example, the facial contortions of Hidetora reminded me of John Belushi doing his eye squints as the Samurai character on 'Saturday Night Live'. Somehow it takes away from the seriousness of the character, as when Hidetora jumps off the cliff and winds up none the worse for wear in the valley below.",t
25,24 November 2014,gavin6942,8, Samurai Legends Meet Shakespeare,"An elderly lord abdicates to his three sons, and the two corrupt ones turn against him.",t
26,3 January 2006,jdoan-4,10, The most provocative ending.,"This film has to be seen. It is profound. It is stunning. It is a work of genius. I love the look of Kurosawa's black and white film. They have so much texture and tone. They have so much depth and character. I just recently watched ""Rashomon."" That is a very beautiful film. He is able to use color equally as effective. Every color is perfectly arranged. Like a painter, he composes each scene, each frame with tender affection. I doubt you can find a better looking film. The ending of the film is the most cynical, the most depressing, the most emotive of any film I have ever seen. It has stayed with me ever since I first saw it. Kurosawa, near the end of his career, has ostensibly lost all faith in human kind. There is no goodness. There is no decency. There is no hope. All that is left is meaningless suffering. That last few images are the perfect images of desolation. This is an excellent film.",_
27,11 May 2022,Tweetienator,8, Excellence,"Just paying my tribute to this fine piece: Ran is a great movie with powerful and superb visuals - the only weakness, if any, is the rather (maybe sometimes too) slow unfolding of the story told. Anyway, Ran is one of those works of Akira Kurosawa that are otherworldly good and absorb the right spirited audience into a different cosmos and a different time.",u
28,6 October 2020,Tanbalarai,1, This is terrible.,"After reading the script written by Kurosawa, the scriptwriter Hideo Oguni advised him as follows
He said, ""The audience is different today than when King Lear was written. In Shakespeare's time, the audience knew firsthand how important a powerful king was. They knew how tragic it was that he was dying and that his sons were fighting one another. In the audience minds, there was always the fear of invasion from another country. But that's not the case for today's moviegoers. The script has to explain that how the King was strong, how he was smart, how he was feared, how he was loved...
Shinobu Hashimoto, the screenwriter famous for ""Seven Samurai"" and ""Seppuku"", also expressed the same opinion in his autobiography.
But Kurosawa ignored their advice and made the film as he had written it. Even though the masterpiece he made in his prime was made thanks to their advice...
And then they made this terrible failure. In the original story, there is a character named Kent. That person tries to protect Lear. It shows how good King Lear was, how respected he was and how important a position he still holds today. In trying to protect King Lear, that means simultaneously trying to protect the nation. Whether it would work or not was very thrilling to the audience at the time.
Shakespeare used this kind of device in his works, but Kurosawa did not. In his script, Kent was reduced in size and the misery of the King was magnified. The reality of the drama as a large scale drama was lost and it became a mere drama about an old man becoming miserable.
If the king, who had been wielding the power, suddenly became an old geezer, the people around him would be more panicked. In the original story, the children were his daughters, so their rash behavior, ignorant of politics, was realistic. And there was prudence in the behavior of their husbands. In the 'Ran', the new kings are acting like morons as the daughters of King Lear. The new king and his entourage should have behaved more cautiously because they were afraid of the former king's influence. If the story was depicted in such a way, the potential of the third son when he teamed up with the former King would be implied and the audience would be able to enjoy the movie to the end even if the former King become more miserable for a while.
... The pictures are not beautiful at all and the acting is at the level of arts and crafts. This is a bad movie of a bad movie.",r
29,12 January 2023,arthur_tafero,9, The Best of Kurosawa - Ran,"Akira Kurosawa has made many great films for international cinema. His first big hit was Rashomon in 1950, and then came Seven Samurai in 1956, which was then exploited by Hollywood in 1960 when it made The Magnificent Seven, an enormous hit at the time. They say imitation is the highest form of flattery. But even Hollywood could not imitate the classic, Rashomon, the thriller made years before The Seven Samurai.",v
30,23 September 2021,briancham1994,7, Epic but drags on too long,"One of Kurosawa's later films shows his mastery of the samurai film. As he demonstrates across his career, the direction of epic battle scenes is definitely his strength. This time, instead of instilling a sense of heroism or justice, it feels like senseless bloodshed, with important characters killed off unceremoniously or stumbling around in a daze. The character drama that underlies this sad, showing the futility of conflict when driven only by personal ambition. The real standout here is the portrayal of Lady Kaede who really is a demon, instigating all the chaos around her for personal revenge. However, the film does drag on at times, involving too many characters. At least the jester was funny.",
31,20 April 2019,Amyth47,9, SHAKESPEARE + KUROSAWA = CINEMA AT ITS BEST!,My Rating : 9/10,
