Review_Date,Author,Rating,Review_Title,Review,Review_Url
188,19 November 2020,sylhan,10, A Masterpiece!!!,"Ran is the story of Lord Hidetora Ichimonji, a man who has won his kingdom through decades of violent and brutal warfare.
There are the similarities between Kurosawa's story and Shakespeare's King Lear.
Kurosawa was able to make the film he had been wanting to for years. Though not his final film, it is certainly his last great masterpiece.",
189,21 March 2021,drz,6, Not a masterpiece,"I like long movies (Satantango is in my top 10). I like Kurosawa (Seven samurai is in my top ten). I have no issue with his idiosyncrasies. Yet this movie was too long, tried imagery too hard and did not engage me either with the King Lear story (and the characters' stupidity), nor the acting (with the exception of a few supportive actors), and even the cinematography (ok, the opening and the closing shots are impressive, and so are the colors in the fight scenes). The war scenes (and man, are there a lot of them) are particularly bad with endless repetition of the same implausible actions.
On balance, watching it is not a waste of time, but don't build much expectation as I did, because you end up hungry at the end of the promised feast.",
190,17 November 2006,yeliz_atc,1, oh my goodness,"OK people, how on the earth can you call this movie as fantastic or the one of the best movie of Kurosawa? how could you even stand to watch it for almost 3 hours? seriously, stop attributing meanings to the poor and overly boring scenes! the actors are so poor, most of the mis-en-scene are extremely poor, especially in the beginning scene!sometimes you don't even realize who is talking because you are extremely distanced to the scene. it is the worst Shakespearean movie ever! get a life and start watching worthy movies! you guys wouldn't even watch a glimpse of it if you see it on the TV or any other place!and admit that it is one of the worst movie ever!",
191,10 November 2018,idodags,9, Masterpiece,The best intrepetation of human Greed and once you insise the circle you became animal with human skin.,
192,17 April 2002,Dark Eye,10, Grab a bowl of popcorn for this one,"Ran is a great movie, because its a lot of fun in a spectacular way.  Much like the Seven Samurai and Yojimbo, its a great mix of serious filmmaking and entertainment, which means you can just sit down on a couch for more than 2 hours, absorbing all the little details while munching on popcorns. I tell you, this is rare since most movies are either too cerebral (not a bad thing) or too bombastic (sometimes not a bad thing). The battle sequences are very, very nicely done, and the characters are so tragic. Seeing someone like Hidetora falling downhill into a crazed, senile old man has never been so much fun. All sorts of characters appear in a form of double crossers, weaklings, manipulators, fools, honourable warriors, tragic victims, heroes... they're all here. Its easy to get convoluted in its plot, dialogue and visual scenes and say ""oh Ran is about betrayal"" or ""Ran speaks on the horror of war."" Look closely, and you'll see that Kurosawa uses the whole film to point out that mankind are foolish and questions our ability to change, even though we are aware of it (Ikiru shares this subtle parallelism on theme). The very last scene with Tsurumaru alone on a cliff is unforgettable.",
193,24 August 2021,danielatala8,9," What a magnificent movie, I'm speechless","I really wish that colour was invented even before so that we could've seen Akira Kurosawa's other movies in colour- cause the way he uses the shots and fills it with so much life is just so gorgeous, even more apparent in Ran.",
194,12 February 2005,Yatesy_2003,9, One of the most moving movies i have ever seen,"Ran was not what I expected, I saw it in my local video shop and thought I would check it out as I have an interest in the time period. When I was finished watching it I was amazed at the genius of Kurosawa. ",
195,9 November 2008,hbdave_77,8, Must watch Masterpiece epic,"The movie is a Japanese adaptation of Shakespeare's 'King Lear' from the legendary director Akira Kurosawa. King Hidetora Ichimonji is 70 years old now. Among all of his three sons-Taro, Jiro & Saburo, he chose his eldest son Taro as a successor of his throne & demanded his other two sons to support him. The youngest son Saburo is prankster but the wisest & he isn't happy with this decision & rejected the idea. So the king banished him from the kingdom. And rest lies royal conspiracy, treachery & human tragedy. The movie is maybe the first color film of Kurosawa & rich with detailing cinematography, epic in its scale. It is also technically sound & polished film by Kurosawa. Watch the violent enemy attack tragedy scene inside the castle- a hall of fame of Kurosawa touch. The movie reflects too didactic in its approach. But without doubt its one of darkest drama he had made reflecting his fascination with history of human insanity. I missed Toshiro Miffune in the film - an inseparable part of almost all his masterpiece films. Must watch if you like Kurosawa films.",
196,30 September 2010,Madluke91,10," Crushing, yet ultimately humane and beautiful film.","Ran is in my opinion Kurosawas most epic films in the mammoth scale of what it tries to tackle. All in one it is a crushing film trying to display the hopenlessness of humanity; the hypocrisy of hierarchy, the lack of morality within our societal structures, the greed and lust for power. Religion gets thrown in, and it's an anti-war film all in one. You might not take it all in, you don't need to, you take what you want from it and no more. It's impossible to sum it all up in one review, and impossible to grasp all in one viewing.",
197,29 January 2009,CerebralInTheCity,8, A must see,"Okay, the story by Akira Kurosawa, Hideo Oguni and Masato Ide is only part of the beauty of this movie.",
198,4 March 2002,miloc,10, Film and poetry.,"I'd like to say, firstly, that I don't generally trust ""visually stunning"" films.  There are a lot of movies that rely on grand special effects, bright lights, and tricksy cinematography to dazzle us past the fact that in the words of Gertrude Stein, ""There's no 'there' there.""  (Or as David Mamet put it: ""But what is it in aid of?"") Ridley Scott, for instance, you can have.  Granted, his movies look spiffing, but a fog machine doth not a catharsis make.",
199,16 December 2007,chong11,7, Splendid battle scene and slow development.,"Kurosawa's movie ""Ran"" basically follows plot that Shakespere's tragedy ""King Lear"" did. It's kind of Japanese version of ""King Lear."" Even though it is based on ""King Lear"" story, this movie approaches me very Japanese style. What I mean is, it follows buddism and rewards in accordance with deeds in our life by showing chaotic battles and betrayal.By watching this movie, it reminds me 'What comes around, what goes around.' Once you betray someone, you would be betrayed. In this movie battle scenes are splendid. I think Kurosawa shooted very unique way that shows well by using wide camera angle that capture both armies. In this movie, Hidetora's make up is too much overdone and I guess it's because influence of Japanese traditional play called ""Kabuki"" Development of movie takes long time form scene to the other scene, so it can be a little bit bored to watch but it's interesting to see how it does reflect our life.",
200,1 October 2006,dabelsoldier,1, Terrible,"Possibly the worst movie ever made. This film somehow makes an interesting concept like feuding samurai warlords horribly boring and slightly stupid. The minimal low quality actions scenes, coupled with wasted scenes that forcibly emphasize one of the character's insanity, added to the poor acting and that horribly annoying jester character , makes RAN a complete piece of crap. Why this movie receives the blind praise it does is something I will never understand. How can a movie this bad be considered one of Kurosawa's best? The only reason I could understand someone liking this movie even a little bit would be if he/she were a die-hard Kurosawa fan. And even then, this travesty should beconsidered beneath some of his better works like Yojimbo.",
201,2 April 2004,unbend_5440,10, The Jester said it best,"Inspired by King Lear, Akira Kurosawa created with this, maybe the most complex and dramatic film of his career, and there's a LOT to choose from. Technically speaking, this was the last great Epic to be made. The scale is massive. Not just because of the huge battle scenes in the end, but mostly because of how massive the story was. There are more than a dozen prominent characters, and within the 2:40, every character is properly developed, and each is very distinct. Tatsuya Nakadai, who plays Hidetora, gives one of the most powerful acting performances I've ever seen. Every second he's on screen, even when he's passed out sleeping, he has your complete attention. But luckily because of the great character development that Kurosawa gave us, each character is equally important to the overall story.",
202,1 February 2021,cmsg-42995,3, Disappointing,I had read a greatest War movie list and this topped it. Having read the reviews and seen the Meta Critic score I thought it would be a must see. I was never gripped by it and in the end I only watched it all because I'd started it. Perhaps others will enjoy but it wasn't for me,
203,8 June 2008,roig27,10, sleep,"The last masterpiece of acclaimed filmmaker A. Kurosawa. The cinematography is stupendous, magnificent, splendid, expansive: Ran if you can backwards or into the past. It's only competition: -BACK TO THE FUTURE-. Fly into these fantastic settings of imagination: Dwellings as high as the Atlantic Ocean floor, your Volvo will dream in Cornell University: Your Audi will fly in Cornell University, you will feel as in Tibet. At this movie you will crouch tiger, and hide dragons: Fire! -SPACEBALLS- is little comparable to this epic: The map of the Oceans is unfinished, it will never end because it is impossible for humans to breath as fish or it Steve Martin: -IF ON A WINTER'S NIGHT A TRAVELLER- knocks on your door, open the doors. Unless and unfortunately you are afraid somebody might hurt you because you are not Catholic: Yet the LAW says they must be maintained ands since we live in uncertain times, where there are no rules, contradictory laws and no clear consensus as to what should be done, the People's Republic of China established contact with President Richard Nixon et al. Since the wonton soup ...",
204,26 March 2023,movie-reviews-uk,7, Dramatic and Shakespearean but maybe not more than that?,"I'm definitely a fan of Akira Kurosawa and would happily watch the ""Seven Samurai"" on repeat. In that essential classic you get to know the characters and to identify with their predicament. At the same time there are some epic action scenes full of blood and vim.",
205,22 October 1998,Squidd,10, Filmmaking at its best.,"Here we see an artist who has mastered his medium and gives to us the passion of his life.  With beauty and delicacy, he paints the screen with a cold emptiness, as only a master director could.  Life is absurd and cruel in this epic, but among the deceitful people who betray and kill even their family, there exists some who care.  The movie is dark, and seems to be without hope, but it is not Kurosawa with a doomsday message.  There is no message, nor an attempt to disillusion.  It is a movie that makes the viewer think and reflect, and consider who we are and how we act, and why we live. Supporting the content is the visual orgasm of colors, composition, and motion.  There are few movies that attempt to stretch the limits of film and human creativity, but Ran breaks past those barriers.  Such are the creations of not men, but truly elevated artists.  We can only stare in awe at the beauty they provide us.",
206,1 December 2016,zaremskya-23761,7, Epic Samurai Spectacle,"Kurosawa, the master of cinema, provides a truly epic retelling of King Lear in ""Samurai format"". Kurosawa has a taste for Shakespeare, retelling much of his works in his films.",
207,23 March 2021,illidian-74757,10, Masterpiece!!!,Akira Kurosawa is a master no doubt. Very few directors in the world could pull a Shakespeare drama on big screen and Akira Kurosawa did that flawlessly without ever letting the audience feel that is not a Japanese tale.,
208,4 January 2004,AdrienneNaylor,10, Ran ruined my life . . . . in a good way.,"I've always been quite susceptible to the tragic nature of Lear . . . . but when I saw this movie, it was DEVASTATING.  Yeah I've known and cried over Lear since I was 14, but seeing Ran . . . . I was just thrown into shock.  I couldn't even cry for the longest time.  The artistry, the imagery, the characters-- just the POWER of it all . . . . whoever made this movie was a genius and that violent chick was so cool.",
209,5 July 2019,Dilanoliver,10, My personal favorite Kurosawa film.,"Synopsis: At the age of seventy, after years of consolidating his empire, the Great Lord Hidetora Ichimonji (Tatsuya Nakadai) decides to abdicate and divide his domain amongst his three sons. Taro (Akira Terao), the eldest, will rule. Jiro (Jinpachi Nezu), his second son, and Saburo (Daisuke Ryu) will take command of the Second and Third Castles but are expected to obey and support their elder brother. Saburo defies the pledge of obedience and is banished.",
210,28 April 1999,JeyKey,10, Pictrorial beauty can never be better than this,"Pictorial beauty can never be better than this. The film is masterfully arranged and provide some of the most beautiful scenes I ´ve ever seen. Shakespeare would have been proud of this adaption from ""King Lear"". This is not the first film by Kurosawa that has a Shakespeare play as inspiration, but I think this is the best one of them all. Just look at the sky in the beginning when troubles occur, the sky and cloud changes to become hostile. This film is in my opinion Kurosawas number one movie.",
211,8 February 2002,ProfessorFate,8, Praise for Mieko Harada,"I just rented the DVD of ""Ran"" and, despite the poor picture quality of the DVD transfer, I was once again knocked out by Mieko Harada.  I don't think I've seen the film since I originally saw it in 1985 but Miss Harada's performance has stayed with me all these years.  Lady Kaede is certainly a great role and she throws herself into it completely.  As for the film itself, Kurosawa's epic story manages to survive the film's overly long running time and preoccupation with stage blood. It's worth the price of rental just to watch Harada's Lady Kaede bully, seduce, and out-wit her male counterparts.  A truly great performance.",
212,21 January 2021,bradh6886,9, Masterpiece,Easily in the top dozen most visually beautiful films ever made. Nearly every frame of this 2 hour 42 minute epic is art museum/film school material. Pacing was excellent; never feet long or boring. Stellar cast is the icing on the visual cake.,
213,30 May 2023,ScottoMac,4, Acting on par w Monkey Magic,"Yes: huge cast & budget. Yes: beautifully shot & superb costumes. Story: tragedy in the realms of Shakespeare. However, the acting is so over the top, it is bordering on the comedic. The script, when paired w this acting combines to make it ridiculous. Ok, it's almost 40 years old, but so is Blade Runner, and the likes of The Godfather even older. Epic scale, beautifully done. But with acting akin to Monkey Magic (which works, as it was supposed to be comedic), it fails badly. Of note, Monkey was made around the same time, so perhaps they had some of the same actors and script writers ;) That is all.",
214,14 December 2007,sungmini89,7, use of colors in the plot,"One thing that really stayed with me after watching this film was the ""colorfulness"" of the movie. Just in general, everything was so colorful; seems as though, the director, Kurosawa, concentrated a lot while he was filming the movie. The expression of the blood was very interesting; it seemed very fake (compared to the movies nowadays), but it still had a great effect to the audience with the bright red color. He also used the color to almost distinguish the sons in the movies; yellow, red, and blue. While watching, I thought Kurosawa expressed himself in couple different characters; one would be Hidetora, who is so majestic in the beginning in the movie but eventually referred as an old senile fool who can't even take care of himself. It seems as though he represented his career throughout the years, and how he must have felt throughout the years. Especially, when he expressed how pathetic Heditora felt when he couldn't even kill himself; just as how he tried to commit suicide but he fails. This film was a representation, from my point of view, of his career, as well as his life before he produced the film.",
215,7 July 2013,Abyss47,10, Kurosawa's last epic is an extraordinary achievement.,"Saw this for the first time today, courtesy of the StudioCanal Blu-ray, which looked and sounded fantastic on my set-up.",
216,9 June 2008,sstransam209,8, vengeance of a woman,"I think it is so interesting how throughout this whole movie people thought there were making their own decisions, when in actuality they were being manipulated. The father was manipulated and betrayed by his own men, or should I say man; when his adviser told him to go to one of the castles, but when he got to the castle there was a trap and there was a battle, or more like a slaughter. The outcome of that was the father loosing his whole following of men and soldiers. While the other brother and the king of that particular castle got killed. which only left two brothers, but by the end of the movie there was only one of the brothers left, who was going to die anyway. And by far the best manipulator was the older brothers new wife, who was fueling his lust for more power, with her lust for revenge.",
217,20 March 2003,mario-rad,10," THE BEST ADAPTATION OF SHAKESPEARE´S ""KING LEAR""","What can I say? It´s a movie I´ve seen dozen times and it´s still exciting and glorious as it was the first time. This is Kurosawa at his best, and as far as I know the best and most original adaptation of Shakespeare´s ""King Lear"" I have ever seen. Superb acting, marvelous directing, brilliant screenplay, make this one into magnificent 3 hours ride. ""Ran"" is simply a work of genius and as important as ""Seven Samurai"".",
218,25 August 2021,jeanblackqueen,10, The Greatest Film Ever Made,If aliens came to Earth and they wanted to know what human beings are like this is the film I would show them. This shows what human beings are like and why we have so much suffering in this world. Please give this a chance it is worth it.,
219,8 June 2008,hawk_ornick0616,10, One of the Kurosawa's Best Jidai-geki,"I have already watched this movie three times. The running time is really long: 2 hour 40 minutes, however, I am always mesmerized by the film and forget such long running time. Tatsuya Nakadai's strong presence as the protagonist, sharp eyes like a beast, and his act which follow to Kabuki draw my attention; moreover, the scenes of Japanese Samurais' wars are represented courageously and beautifully by the Kurosawa's grand directions. Furthermore, it is possible to say that Kurosawa represents his ideas about god and death. Especially, at the last scene, a Buddha picture falls off instead of Tsurumaru. I think that Kurosawa represents the same thing with what Tango says; Tsurumaru can ""choose"" his way, alive or death, after the scene, and the picture of Buddha does nothing to him and just fall down from the top of the wall. That is to say, it is possible to argue that Tsurumaru is the metaphor of people who could choose disturbance or peace, and the Buddha represents the useless gods that cannot save people as Tango says. By the way, as a Japanese speaker, I am disappointed at the English subtitle a little bit because it breaks the presence of the Kurosawa's script which expressed in Japanese sometimes. For example, ""Old age is difficult (Aware, oitari)"" Surely, the meaning of this line is correct and exactly; however, I think the English subtitle does not have the power of the words which represented in Japanese.",
220,12 December 2020,trouble50,10, NoCountryforOldMen,At the end of this film u ll curse to all pedant elders around of u. As we see here cursed old folks are not right and genius. Dont follow the conservatism instead of RATIONALISM,
221,25 April 2003,mrbisco,9, Man oh man oh man...,Some movies are f'd up...like Memento.,
222,15 July 2022,ozguredizavci,7, Slow-paced epic film with huge production,"The film is very slow-paced. In some scenes you can even think that people move in slow-motion, but I think that is the characteristic of Japanese films. It is very hard to maintain concentration for more than 2 and half hours for a slow-paced film, because of that I think it is better to watch this film when you are in a relaxed situation and have lots of time.",
223,24 February 2023,shinrisen,8, Beautifully shot war epic,"Ran is Kurosawa's retelling of Shakespeare's 'King Lear', and although I'm not intimately familiar with any of Shakespeare's plays, the story that this film tells has all the key elements of a true classic drama.",
224,6 August 2003,sergimb,10, The most terrible image ever imagined,****ATTENTION: SPOILERS*****,
225,28 August 2002,letrias,10, War is hell - Kurosawa is a cinematic god.,Massive SPOILER ahead.,
226,6 September 2010,glock38_110,9, A great adaptation of King Lear.,"An old, frail War Lord decides it's time for him to hand over his power to his three sons. The younger son reacts with anger and brutal honesty, telling him to rethink his decision whilst the the elder two are more than happy to accept. The elder two soon turn against the Lord and each other, each vying for full control of the land. ",
227,27 April 1999,geek-4,10," Grace and Elegance, Cruelty and Horror","We of the Western world view the Japanese as a tapestry.  The delicate water-colors, the graceful tea ceremony, and Code of Bushido are balanced elements of the culture.  In this magnificent effort we see the story of Mad King Lear translated into a feudal Japanese society.  The imagery is magnificent; a flight of birds, a flight of arrows, they are all the same. Chrysanthemums and ritual disembowelment are of equal value and beauty. The quest for power ... and the cackling of the Court Jester.  How exquisite the irony.  How beautifully portrayed by a mourned master.",
228,4 October 2000,jminer,10, Kurosawa at his grandest,"Ran means chaos in Japanese.  Instead of taking the story of King Lear and focusing on the central character as that title does, Kurosawa has chosen to name his film after its setting: a world of chaos unleashed by the pride and ignorance of a former warlord. Discovering what it is to be human, while hurtling around in a universe without rules or borders, is a theme that Kurosawa loved.  You can find it most accessibly in Andrei Konchalovsky's film Runaway Train, based on a Kurosawa screenplay.  The strength that evil has, if we allow it; the futility of so many things in which people believe; the redeeming power of love: these meant as much to Shakespeare in King Lear as they do to Kurosawa in Ran. Yet there is great beauty here - most of it associated with the pomp and circumstance of battling armies, and most of it belied by the violence they do.  The background, the universe in which Lord Hidemoto scuttles like a proud, crippled, spider, is blank; brown and grey in colour, but bereft of landmark. Just as, after Shakespeare's Act I, Lear never sets foot in a building; just as Ahab and Ishmael, having left Nantucket, never set foot upon land; so Hidemoto is cast out into darkness. Music, costume, cast, battle action: so good it's hard to remember you're watching a foreign film. This is film-making at its grandest and most universal.  Thank the bold Frenchman, Serge Silberman, who financed it when nobody else would, for one of the great films by one of the great directors.",
229,21 May 2020,Jonah_R,10, A beautiful movie,"I have never read Shakespeares King Lear or watched an adaptation of it.
But I like Akira Kurosawas work and so this was a must watch for me. I mean I knew the basic plot line of King Lear, but thats it.
So obvious there where many twists and moments that I didnt expect or that I imagined to turn out different.",
230,7 November 2001,sunehjalmar47,10, a masterpiece,"Kurosawa created many unforgettable films during his long career, but with Ran he created a masterpiece of all times. The story is paraphrase of Shakespeare´s King Lear, but much darker. The scenography is stunning, the long teleshots reveal the cruelty of war better than any documentary film, and the music nails you to your seat with its bitterness and sadness. Kurosawa must have studied, as I see it, the Italian painter Ucello of the 15th century, to be able to create the battlescenes this original in film history. A beautiful but very very sad story, created by the true master of film: Akira Kurosawa.",
