Review_Date,Author,Rating,Review_Title,Review,Review_Url
61,14 October 2010,Aditya_Gokhale,10, A strong anti-war statement,"Stanley Kubrick's 1957 war film, ""Paths of Glory"" based on a novel of the same name by Humphrey Cobb is more of an anti-war statement. Hence, calling it a 'war film' wouldn't be right, as it does not lie in the same category as other war films, plot-wise.",
62,12 May 2011,valleyjohn,8, A film that spits in the face of authority,"Rated number 50 in the IMDb.com greatest movies of all time , Paths of Glory is not a film that i was particularly familiar with. I'm a fan of Stanley Kubrik and i love Kirk Douglas so it should come as no surprise that i really enjoyed this movie. When a group of soldiers in WW1 refuse to continue with an impossible attack, their superiors decide to make an example of them. I love the look of this film. You can pretty much tell this has Stanley Kubrick's fingerprints all over it. It asks uncomfortable political and social questions and you can't help but be angry at authority which is a thread that runs through a lot of Kubrik's movies. The acting is superb , especially from a super confident Kirk Douglas and like the fact that this does not have a sickly sweet outcome to it which was so common with war films made in the 40's and 50's. It's a film that spits in the face of authority while the common man suffers and i loved it.",
63,17 October 2022,Muelko,8, Paths of Glory - Review,"Low-tier Kubrick, but it's a good movie for sure. This is like a lite 12 Angry Men, so it's, y'know, really engaging and super-fun to watch. Liked the battle in the first half, the performances are strong, the writing is monumental, very Kubricky, so it's very good. Loved the conflict between the soldiers. But it's not much this movie, that's why I'm not very enthusiastic about this one. It's surely a nice little war movie, but nothing more. And holy smoke the movie looks spectacular, and it's from 1957, but yeah, it's Kubrick, what am I even expecting, right? So yeah, I have to watch every Kubrick movie, there are like few of them for me to complete his filmography. And yeah, Paths of Glory is definitely one of the better Kubrick movies.",
64,12 December 2013,christophe92300,3," Great premise, bad storytelling",We're still wondering where Stanley Kubrick wanted to go with this Paths of Glory.,
65,24 December 2004,TooShortforThatGesture,4, Not what it used to be.,"I was very disappointed by this film, given the accolades it generally receives.",
66,19 September 2002,rupie,4, phony,"I had read all the hoopla about this being one of the seminal anti-war films of all times and, upon finally seeing it, was astounded at how overrated and poorly done it is. The movie is less a drama than a Victorian melodrama. All the generals and officers are the mustachioed villain and all the soldiers are the sausage-curled maiden tied to the railroad tracks. The dialogue is farcically unrealistic; General Mireau's lines, in particular, are of the ""Aha, my pretty, at last I have you in my clutches!"" variety. One almost thinks that the director is trying to make the audience hiss. Character development is non-existent, as is subtlety. The ballroom scene, in particular, with the grandly attired generals dancing to Strauss waltzes in luxurious surroundings with elegantly attired women is - get it? - supposed to be a contrast with the misery of the soldiers; the point is made like being hit on the side of the head with 2-by-4. Kirk Douglas does the best he can with a limited part. The denouement with the German girl (a prisoner? a prostitute? a lost civilian? just who the hell is she?) singing is both baffling and unconvincing. One keeps waiting for some kind of closure and - bam! - 'The End' comes up. ",
67,11 January 2017,elvircorhodzic,10," ""Gentlemen of the court, there are times that I'm ashamed to be a member of the human race and this is one such occasion.""","PATHS OF GLORY is an anti-war film based on the novel of the same name by Humphrey Cobb. This is a shocking film, which is inspired by real events, about the shameful incident on the Western Front in the First World War. We've seen the terrifying battleground in the grip of corruption and cynicism.",
68,17 April 2016,bkrauser-81-311064,10, An Anti-War Film for the Ages,"The French Army calls it the Anthill. Mere kilometers away from Paris, German WWI forces have dug trenches and fortified the area for a little over a year. Gen. Paul Mireau (Macready) believes taking the Anthill is nearly impossible and says so within the first frames of Paths of Glory. Yet after the insinuation of a promotion by Gen. Broulard (Menjou), Mireau reconsiders, rationalizing and demurring such a feat of improbability for the sake of glory. Enters Kirk Douglas; cleft chin, movie-star good looks, and despite playing Col. Dax, a Frenchman, Douglas carries a signature American swagger. Surprised by the General's tactical decision, Dax nevertheless strives to carry out his orders.",
69,27 March 2008,hnt_dnl,10, Perhaps the truly greatest war film of all time,"I wish we could give a film more than a 10 out of 10 rating. Because PATHS OF GLORY is one of the very few films that I'd give an 11! It is perfection. Plain and simple. It is a bare bones film, very short, and cuts to the chase. There are several fairly long scenes, yet none of them seem long and there are no wasted words, thoughts, or moments in any of the scenes. They are all perfect. Perfection is maybe an overused word, but not in this film. Directed by the great Stanley Kubrick and coming out in a great year of films 1957, this could very well be Kubrick's true greatest accomplishment.",
70,8 February 2009,sme_no_densetsu,8," A fine, uncompromising war film","Stanley Kubrick's ""Paths of Glory"" wasn't much of a success at the time of its release but it has proved its worth over the years and is today remembered as a classic. The film is set during WWI and revolves around an attempt by French troops to carry out a near-impossible mission handed down to them by their glory-hungry superiors.",
71,19 February 2022,SPZMaxinema,9," Stanley Kubrick always hits it out of the park, and this was one of his first films where he did it!","The ending of this movie and the symbolism of it, along with the drama and acting throughout the movie, made me care about it very much. It seems like only the good things that are seen as the most threateningly influential get censored and banned like this movie has been in the past under many jurisdictions, but it is important for people to see of all nationalities. Absolutely astounding!",
72,15 June 2020,RNMorton,10, Spectacular,"No-flaws story of Douglas, opposed to WW1 suicide charge and to punishment for the unsuccessful, is as good as it gets in cinema. Well-textured characters, real life dilemmas, effective acting and oh so intelligent script adds up to excellence. I had never seen or even heard of this movie until a few months ago, when I watched it in the wake of 1917, which has more than a few similarities, deliberate or otherwise. Timeless cinema.",
73,2 November 2003,TOMASBBloodhound,9, Powerful and to the point.,Spoiler!!!!!!,
74,9 July 2011,ajs-10,9, Classic Kubrick!,"I am a bit of a fan of Stanley Kubrick and have decided to try and watch as many of his films as I can. This one was showing one afternoon and so it was duly recorded for a viewing at a later date. That later date came around today. Set during World War I, this film tells the story of a French Colonel who ends up with the unenviable task of defending three of his soldiers who are charged with cowardice.",
75,23 May 2005,MovieAddict2016,10, Kubrick's best serious film,"Everyone always raves about ""2001: A Space Odyssey,"" but I've never really warmed up to it as a film. I feel it's now outdated, pretentious and showy -- at the time, it worked because people were in awe of its effects and futuristic interpretations...nowadays it is distinctly '60s-ish, with its drug trip ending empty and really just a way of expressing psychedelic visuals.",
76,3 January 2020,K3nzit,9, A timeless classic,"A timeless classic by Stanley Kubrick. Great story, great acting - There are not many war movies better than this one.",
77,18 June 2006,gelman@attglobal.net,10, World War I -- Kubrick Style,"""Paths of Glory"" is a film about the stupidity of warfare, set in 1916, when the French and the Germans were entrenched opposite one another and a ranking officer of the French General Staff (Adolphe Menjou) persuades a field general (George Macready) that it would be good for his career if he made an attempt to capture the ""ant hill,"" a German strong point opposite the French position. Menjou and (especially) Macready are perfect for their parts. I'm of two minds about Kirk Douglas as the colonel instructed to make the attack which he knows is doomed to failure. Douglas was a star of considerable magnitude at the time but he is no more credible as a French officer than he would have been as Lassie. Nevertheless, Douglas could act, and as the central figure in the film, he carries it off. There are a great many outstanding scenes in this movie -- what else would you expect with Stanley Kubrick as writer and director -- but the most telling is when a frightened German girl (Christiane Kubrick, also known as Suzanne Christian) is escorted on stage in a beer hall filled with French soldiers who despise the Germans and forced to sing a sad song in German which when the catcalls die down leave every one in the audience (on both sides of the screen) misty eyed or crying. My own memory of that scene will last long after every other fades away. This is a great film, worthy of its reputation.",
78,3 May 2015,hitchcockthelegend,10, Madness and Patsies Crash Together In Kubrick's Explosive Thunderbolt.,"Stanley Kubrick's Paths of Glory is holding up rather well these days, in fact it's as pertinent and relevant as ever.",
79,17 September 2022,theognis-80821,10, Masterpiece,"This, the greatest war movie ever made, and one of the ten greatest movies ever made, perfectly conveys the vanity of the officer class and the general indifference to the welfare of those that they lead in realizing their war gaming. The screenplay by the great Jim Thompson is perfect as are the camera placements and staging of former still photographer, Stanley Kubrick. This was one of the earliest of Kirk Douglas's magnificent credits as a producer. He has never given a better performance, nor produced a film with more astute casting: Ralph Meeker as a tough, decent man caught in a trap, Adolph Menjou as the effete cynic in charge of the army, George Macready as his mercurial and ambitious subordinate, Tim Carey as the odd ""social undesirable,"" Joseph Turkel as the emotional core of the prisoners, Bert Freed as the coolly practical peasant Sergeant, Wayne Morris as the coward, Peter Capell as the casually psychopathic judge, Richard Anderson as the bootlicker, Susanne Christian (soon to be Mrs. Kubrick) as the bashful German girl offered to a mob of soldiers by the barkeep/pimp Jerry Hausner, and, flagrantly against type, Emile Meyer as the kindly, compassionate priest. The editing is brilliantly designed to shock and the magnificent dramatic structure (screenplay by the unique, great Jim Thompson here and for ""The Killing"" (1956)) ensures maximum suspense despite the inevitable. This film was so great, so powerful that it was banned in France, Spain, Switzerland, Germany and US military installations. Truth hurts.",
80,13 April 1999,Don-102,10," Madness, Cowardice, Glory - War in a Nutshell Kubrick Style...","There is no glory in Stanley Kubrick's PATHS OF GLORY, a devastating anti-war film that looks at the Generals who command soldiers as cowards themselves.  How dare these pampered men who will leave the war without a scratch practically order their soldier's slaughter?  This is the conflict posed by Kubrick with the help of Kirk Douglas, who quite frankly is mesmerizing as the Colonel of the 701st Division ordered to take an anthill they probably have no chance of taking.  Adolphe Menjou is the sadistic General who Douglas must fight for the right of his soldiers' souls as well as his own.  We are able to take an introverted look at the madness of war. Cowardice is frowned upon by governments, but how do you decide what it is in such inhuman conditions.",
81,10 July 2007,StanleyStrangelove,9, Kubrick's first war film - a great film,"It's WWI in France and Colonel Kirk Douglas is ordered to take an enemy position named Ant Hill. But his soldiers are not at full strength and he will not be given any support except for some preliminary bombing. When the attack fails, his superior General is furious so he orders 3 men to be chosen for court martial with the charge of cowardice. Douglas has no choice but to obey, but since he is also a lawyer, he insists on defending the men.",
82,30 July 2011,bob_meg,10," Riveting, chilling in its intensity, and shockingly relevant","I generally don't like war movies, even anti-war movies. To me, they're like Westerns, most of which fall back on the same tired tropes we've seen a billion times.",
83,3 January 2010,wes-connors,10, Stanley Kubrick makes a Mountain out of an Anthill,"In 1916 France, World War II Generals George Macready (as Mireau) and Adolphe Menjou (as Broulard) decide to order troops attack a German stronghold known as ""The Ant Hill"" - even though they are aware the military will most certainly suffer massive causalities, and will most probably fail. When the orders are given, many of the soldiers are aware the mission is doomed, and retreat to their trenches; although some, like Colonel Kirk Douglas (as Dax) attempt to be valiant. After the embarrassing defeat, the Generals decide to court-martial, and execute by firing squad, a random selection of their own soldiers.",
84,10 July 2014,denis888,2," Overrated, Failed Within Test Of Time","This example of younger Stanley Kubrick's cinematography shows also younger Kirk Douglas as Col. Dax of 710 Regiment in 1916 during World War I. There were so many high praises of this film, that I decided to watch it closely, and... and I was deeply disappointed, as this movie surely has not stood the test of time and today is intercepted as a mere bleak, hollow, dark, vapid and rather weak exercise in D - depression, despair, disenchantment, drool and drainage. I agree, was was not all exciting and interesting, but this movie does not deliver any strong message, nor does it succeed to damn war as evil, or nor does it teach us any lesson at all. It is seen as a brisk, but shallow attempt of early film film-making, dire and failed. Kubrick did not persuade us that war is evil, the general ennui and detached air did not help us feel any bonds to main heroes, and even great final scene failed to cement the film reputation. Overrated, boring and zany at places.",
85,21 April 2008,charchuk,10, Anti-war masterpiece,"There's something to be said for watching this after a few hours of Call of Duty (and also followed by Harold + Kumar and something called The Giant Gila Monster - but that's another story), but I'm not sure exactly what it is. Suffice to say, the great disconnect between these two forms of entertainment, both dealing with war, is stunning and affecting.",
86,21 October 2019,fmwongmd,7, War lacks glory,A telling portrayal of the tragedy of war. Excellent portrayals by Kirk Douglas and Ralph Meeker.,
87,18 January 2018,HotToastyRag,7, Riveting and well-acted,"If you liked All Quiet on the Western Front, you'll love Paths of Glory. Told in the same anti-war tone, Stanley Kubrick's film conveys a stark, bleak atmosphere in his black-and-white footage, Georg Krause's stoic cinematography, and Malcom Arnold's minimalistic score. It follows the planning and potential execution of a suicide mission in World War One. If you can use your suspension of disbelief and accept the fact that no one in the movie has a French accent, you'll be in for a very riveting, well-acted film.",
88,8 April 2020,h-28658,8, Paths Of Glory is a one of a kind war film.,"Paths Of Glory is a one of a kind war film. I love the anti-war theme, Kirk Douglas' performance, long shot takes, cinematography, and story. I also enjoyed the finale when the German singer, played by Stanley Kubrick's wife, sang and every French soldier got sad at the end. Overall, Paths of Glory is a WW1 masterpiece filled with horror and guilt.",
89,31 October 2017,JamesHitchcock,9, The paths of glory lead but to the grave,"In 1916 a French regiment is ordered to attack ""the Anthill"", a strongly fortified German position. The attack proves a disastrous failure; the French suffer heavy casualties and none of their soldiers succeed in reaching the German trenches. When a second wave of troops refuse to attack, their commanding officer General Mireau desperately orders his artillery to open fire on them to force them onto the battlefield. The artillery commander, however, refuses to do so without a written order. To try and deflect blame from himself for the failure of the offensive, Mireau orders three soldiers from the regiment, chosen at random, to be tried for cowardice. The task of defending the accused falls to Mireau's subordinate Colonel Dax, a lawyer in civilian life.",
90,18 June 2006,jldmp1,9, Essay In The Master's Craft,"This is early proof of why Kubrick especially loved the topic of war -- it inherently gave him two levels of directorial control: the 'normal' one at the director-over-the character level, and the implied one at the director-over-actor level. Douglas would later give profanely grudging praise to Kubrick about his methods.",
91,13 March 2014,werefox08,10, Fantastic.............Movie,"Most ""experts""...call this an anti war movie. But it is much more than that. Here we have the top brass of an army who are very willing to sacrifice their soldiers for there egos...and political gain. It is 1916 (the First World War) and the French are under pressure to take ground from the enemy. The task they are set...is totally impossible. Here we see the very worst and the very best of humanity. Nobility had no place in the hellish trench war-fare of this war. Yet it was there. Kirk Douglas plays the good in the human race. But the evil... (the Hierarchy of his own Countries Generals)...are evil...and much more. Willing to execute there own men...even fire apon them in the the madness of conflict. This is a movie about what lies in us all...GOOD & EVIL. It is also the best ever movie about the complete madness of war. Because of the disturbing reality of this movie...it can only be viewed...occasionally.",
92,5 May 2020,masoncheek,9, A banger from Stanley Kubrick.,The ending had me dang near tears. War is truly an awful endeavor and it's sad to see all those men who had gone through so much. Also the (SPOILER) Firing Squad scene is heart wrenchingly sad. But to leave on a positive note that battle sequence was epic as frick.,
93,30 April 2008,moonspinner55,6," ""The paths of glory lead but to the grave...""","Director Stanley Kubrick's first real stand-out effort as a filmmaker, an anxious, disquieting, and ultimately sobering account of wartime power and ignorance. Three French soldiers are court-martialled for cowardice in the line of duty during World War I. Emotional drama dealing with the hopelessness of injustice; its impact hasn't dimmed over the years, and there are fine performances by Kirk Douglas, Ralph Meeker, and Adolphe Menjou. Based on Humphrey Cobb's factual novel, which Kubrick co-adapted. Kubrick also co-produced the film, along with James B. Harris and Kirk Douglas. Very fine, but very heavy-going. **1/2 from ****",
94,2 November 2006,ragosaal,9, About Acting ... Adolph Menjou,There's not much one can add here to what has been said regarding this excellent and classic War World I film based on actual facts.,
95,27 April 2008,urntcookin045,10, One of the Best films ever made!,"I feel that still after all its recognition, 'Paths of Glory' is one of the most underrated films ever made. I think it ranks in the top twenty films ever made. Stanley Kubrick's brilliant direction and cinematography go extremely unnoticed, and I think should have won him an Oscar for best direction. Kirk Douglaus gives one of his better performances as Col. Dax. Despite to some belief, this is not an anti-war film. The film is supposed to somewhat of an anti-abuse of power film in a way, as stated by Kubrick. The final scene of the film moved me to tears and is what I consider the most moving and touching scene Kubrick has ever film. If you have not yet seen it, check it out. Amazing film",
96,24 April 2000,Embley,6, horror,i was very impressed with this film - it details the petty politics of war very well.  it is a horrible story.  the acting is great as is the look and feel of the film.  it made me feel as though there were bugs crawling up my arm but there was nothing i could do about it.,
97,4 October 2021,skrstenansky,10," Brutal, Honest, Depressing War Story","This movie is one of the best war movies hands down. The movie has a very good and closely true story of an event in World War I. The movie is very brutal, it is very sad and shows the truth of war. Brutal, depressing, and honestly a really sad movie. The movie is also done very well, perfect shots, great acting, and effects are well done. Amazing and one of the best war movies. Masterpiece 10/10.",
98,3 May 1999,coop-16,10, More than an anti-war film.,"There are only two film-makers who never made a bad film in their careers:Andrei Tarkovsky and Stanley Kubrick.Even though Kubrick's mastery of the film medium was evident as early as Killers Kiss, and maybe even as early as Day of the Fight, his genius was confirmed by this, his second major feature.Some critics even suggest that  Paths  Of Glory was Kubrick's BEST film, and that his subsequent career was one of decline. It would be more precise to argue that Paths of Glory was the film which showed Kubricks complete mastery of TRADITIONAL film grammar and techniques, as first' exemplified by Griffith and Pudovkin, while his later films show him EXPERIMENTING with those techniques,challenging established ideas of narration and characterization. In addition, Paths of Glory is-on the surface- a more 'didactic' and ""humanistic"" film than his later works. He seems to be delivering a conventional ""liberal"" message; ""war is hell', ""men should not be inhumane to man',etc.While Kubrick is indeed a liberal humanist who  looks askance at the military, his film is not simply a pacifist sermon.Kubrick is, instead offering  a close analysis of the meaning of courage , loyalty, and honor. These virtues, so often extolled by 'conservatives' are NOT mocked by Kubrick. Instead he is criticizing the MISUSE of these virtues by ""scoundrels' such as the military brass hats.The true hero of paths of glory is NOT the well-meaning but tragically ineffectual liberal 'hero', Colonel Dax (superbly played by Kirk Douglas), instead the hero is a GROUP of people, the ordinary, suffering 'grunts' of the 'poor bloody  infantry', who, in the films unforgettable closing scene, hum along with a frightened German  girl as she sings a love song in her native language.",
99,24 January 2005,FilmOtaku,7, Very compelling anti-war film,"""Paths of Glory"", Stanley Kubrick's 1957 anti-war film was his first film in the anti-war genre, but not his last. Starring Kirk Douglas as Col. Dax, the commander of a regiment in the French army who fall back on their orders because theirs is an impossible attack. Gen. Paul Mireau (George Macready) is a glory-seeking man who agreed to this attack regardless of the casualties it will cause, and when it all hits the fan, looks for anyone else to be the scapegoats. He and Gen. George Broulard (Adolph Menjou) tell Dax that he must select random men to execute for cowardice, but Dax talks him into only selecting three, and to allow him to defend them. (In civilian life, Dax was the best attorney in France.) All of the events of the film are an exercise in futility, and the entire film's strong anti-war stance is extremely effective.",
100,15 April 2010,hemant_balz,9, Truth about morality in war.,Paths of glory is not a full blooded world war film.Its just so unique.Just tests the morality of soldiers of war.This movie portrays the dominance of arrogance by the generals over soldiers who try to make a mockery of them just for mere pride and satisfaction.This movie shows how generals make few soldiers to pay just to set a mere example for the rest.Kirk Douglas is captivating as Colonel Dax.His speeches in the courtroom of trial are very much captivating.Adolphe Menjou as Gen. George Broulard has given a fantastic performance.Mere soldiers bravery turns to cowardice when they see the casualties in front of them trying to capture Ant Hill.Cowardice is in fact threatening rather than death in war.But just to pick random guys for trial just to create a mockery of others was mockery of the Generals.Colonel Dax tried his best to save his soldiers.But every one was biased.No one listened.This is a brilliant movie by Stanley Kubrick.The ending scene is great where the German girl captured starts to sing and cruelty of men fades into tears.That was the truth about morality in war which opened the pathways for the men to glory.,
