Review_Date,Author,Rating,Review_Title,Review,Review_Url
0,2 July 2006,bkoganbing,10, They Couldn't Take An Ant Hill,"Almost one hundred years later the concept of that static war of the trenches that was the Western front of World War I is almost unfathomable. After the French army stopped the German offensive at the Battle of the Marne, the French and British armies faced the Germans in a line of trenches that stretched from Belgium to Switzerland. About a quarter of France was occupied for four years in that time. The casualties ran into the millions in that stalemate that gains were only measured in meters.",/
1,15 October 2006,Steffi_P,9," ""Let the men have a few minutes more""","Although Kubrick's films are marked by their massive variation of genre and tone, one theme that crops up again and again is a strong anti-war sentiment, and this was never stated more strongly than in Paths of Glory. A relatively early Kubrick picture and, despite coming before what is considered his classic period, it is one of his best.",r
2,7 July 1999,Hermit C-2,10, Kubrick--a fully-formed genius in 1957.,"At only 29 years of age and in only his second major studio release, Stanley Kubrick showed the world that he was a force to be reckoned with. By the time he died 42 years later his films were epochal events waited for breathlessly by his large band of devotees who considered him a director without equal. He seldom disappointed them.",e
3,9 December 2009,TheLittleSongbird,10, Kubrick at the height of his powers- a wonderfully atmospheric film about the First World War,"I saw this movie for the first time on television today, after being persuaded by the reviews I read beforehand praising it. Also I like Kirk Douglas. Although I am not directly familiar with Kubrick's work, a shameful admission I know. Out of what I have seen so far I loved Dr Strangelove and despite only seeing it once while flicking through channels liked The Shining too. Anyway back on target, Paths of Glory was brilliant in my opinion! ",v
4,28 July 2007,WriterDave,9, Stands the Test of Time,An arrogant French general (a superb George Macready) orders his men on a suicide mission and then has the gall to try to court marshal and execute three of them for cowardice in the face of the enemy. A former lawyer turned colonel (Kirk Douglas in his prime) is the voice of reason against gross injustice. This excellently staged and wonderfully acted production is as much an acting showcase for Douglas as it is a directorial masterstroke by a young Stanley Kubrick who adapted this to the screen from a novel based on actual accounts.,i
5,11 May 2004,claudio_carvalho,10, An Anti-War Masterpiece,"In France, in the First World War, the insane and ambitious general Gen. Paul Mireau (George Macready) orders Colonel Dax (Kirk Douglas) to lead his men in a suicide attack against Germans in the unattainable Ant Hill. After a massacre of the French soldiers, Gen. Mireau orders his artillery to drop bombs between the French front line of attack and the trenches, to avoid the soldier to return to the protection of the trenches. The commander of the French artillery refuses to accomplish the order. Gen. Mireau asks his superior, Gen. George Broulard (Adolphe Menjou), to send three men to Court Martial and execute them for cowardice through shooting, as an example to the other soldiers. Colonel Dax, a former lawyer, defends his men in the unfair trial. Yesterday I watched this outstanding masterpiece for the first time and certainly it is among the best movies of the cinema history. The disgusting story shows the insanity of a war, where men are treated like numbers and not as human beings. The reality of the battles scenes is amazing. The cast has a stunning performance, highlighting the trio George Macready, Adolphe Menjou and Kirk Douglas. The lack of sensibility and respect for the human life and the cynicism in the dialogs of the two generals are fantastic. Two other points that called my attention are the fancy reception for the general staff, while their subalterns are fighting in the front and the misunderstanding of the real intentions of Colonel Dax by Gen. George Broulard. A must-see movie! My vote is ten.",e
6,19 January 2000,gbheron,10, Gripping Anti-War Film,"Paths of Glory is one of the best movies ever made, and possibly the best ""war"" movie, period. Paths of Glory does not portray war as conflict between armies or individual soldiers arrayed against one another on the battlefield.  Nor does it portray the acts of great leaders and heroes of war. No this film takes a different tact. ",w
7,15 August 2010,ma-cortes,8, Awesome movie stands as a broody statement against war and man's inhumanity to man,"Sensational antiwar treatise based on facts with a relentless and vivid denounce against the military commanding class represented by two senior Generals (George Macready , Adolphe Menjou ) who order his men a suicidal mission . France 1916 , an upright officer , Colonel Dax (Kirk Douglas), must lead his soldiers against difficult enemy positions called the 'Ants Hill' . Then he's also the Colonel lawyer assigned to defend three (the privates Timothy Carey , Ralph Meeker , Joe Turkel) of them when the attack is lost against charges of cowardice and submitted to eventual firing squad. Never has the screen thrust so deeply into the guts of war! The most explosive motion picture in 25 years ! Bombshell! The roll of the drums... the click of the rifle-bolts... the last cigarette... and then... the shattering impact of this story... perhaps the most explosive motion picture in 25 years! It explodes in the no-man's land no picture ever dared cross before! Now the screen blasts open the bombshell story of a Colonel who led his regiment into hell and back - while their maddened General waited for them - with a firing squad!",/
8,15 November 2006,planktonrules,10, A marvelous film about the STUPIDIST war in history with a dynamic performance by Douglas,"This is a wonderful film and for those who are looking to see a Stanley Kubrick film that the average person can relate to, this is a great initiation to the director's work. Some of his films are a bit hard to understand or frankly make my head hurt (2001 is a great example), but this one is much more straight-forward and conventional than most of his other films while still being a great film.",r
9,9 October 2022,Xstal,8," War, What is it Good For...","You've been posted to the front, to serve your country in the war, now they want you to go over, and face the enemy once more, only problem that you have, is you know it's certain death, there'll be no gains made here today, but there'll be, almighty mess.",w
10,7 June 2002,kamerad,10, Kubrik's First Masterwork,"""Paths of Glory"" (1957) (and this is personal opinion of course) is Stanley Kubrick's first real masterpiece in what would be a long line of subsequent masterpieces.  I know that Kubrick had a reputation for making cold, unemotional films (which is a false impression, but that's the subject for another essay) but I don't believe there are many people who can deny how powerful this film is.  Through the editing, camera movement, incredibly realistic dialogue, and a now more fully realized use of irony, Kubrick creates an unforgettable anti-war parable.  I realize that my love for this film is incredibly obvious, but I'll try to focus on an analysis of the film rather than a review, but the movie is just so good!  ",4
11,31 March 2015,SnoopyStyle,8, One of the greatest anti-war movies,"It's 1916 France. General Georges Broulard convinces General Mireau to send his men on a suicide mission to attack the fortified Anthill. The men are worn out. General Mireau with glory in his eyes downplays the difficulties to Col. Dax (Kirk Douglas). He even threatens to relieve Dax when he gives less than full enthusiastic support. On a 3-person night patrol, drunken lieutenant Roget kills fellow soldier Lejeune and then falsifies the records despite Corporal Paris (Ralph Meeker). Dax leads the attack the next morning. The first wave is wiped out and the men refuse to continue the attack. Mireau court-marshals a man from each company for cowardice. Roget sends Paris as one of those men. Dax defends them in the kangaroo court.",5
12,28 January 2010,TheAnimalMother,10, Glorious Integrity In Every Aspect!!,"Paths Of Glory is a masterpiece without doubt. Usually a masterpiece is the pinnacle of a directors career. However when you are talking about Stanley Kubrick, you are talking about genuine genius. This is just one of his many masterpieces, but Paths Of Glory is probably as good a film as any of Kubrick's other best works. I have seen tons of war films in my life, many great ones. Honestly, this is my favorite of them all. When I first saw this film I didn't expect it to blow me away. After all it is an early Kubrick film, however it blew me away constantly, and completely. This is not only one of the greatest war films ever made, not only one of the greatest black & white films ever made, it is simply one of the greatest films ever made bar none. The film screams integrity, in each and every way. This film is a joy to watch, and in my estimation, Paths Of Glory will remain forever as one of cinemas greatest accomplishments.",6
13,3 November 2000,bmaclach,10, An anti-war movie hitting closer to home.,"I consider Paths of Glory as one of the most memorable of Kubrick's entire output. The most remarkable aspect of this pioneer anti-war film is the complete absence of any persons depicting the ""real"" enemy. Therefore, the significance of the film lay not so much in its anti-war message, but in its brilliant expose of the ""monsters within"" the general staff, superbly acted by Adolphe Menjou and George Macready. The message here is that the enemy lurks much closer to home. In most war films, whether they glorify or condemn the carnage, there is rarely any venturing at all into the darker side of the politics. This film is a tour de force in its unabashed depiction of just how misguided is the quest for glory as an end in itself; and in the portrayal of the leaders who would shamelessly sacrifice others for their own self aggrandizement. Truly, one of my all time favourite movies.",8
14,31 January 2005,Anonymous_Maxine,10, Scary.,"It really is a testament to the power of the story told by this film that it stars the French army and they all speak nothing but English, and yet it is still be incredibly moving and compelling. On the other hand, the movie is not really about war but about the soldiers, kind of like Full Metal Jacket. It is structured almost exactly the opposite, with the first half of the film taking place on the battlefield and the second half off. Kirk Douglas plays Col. Dax, whose platoon is ordered to take a hill called the Anthill against staggering odds, almost surely a suicide mission.",7
15,25 February 2019,Leofwine_draca,8, Hard-hitting anti-war movie,"PATHS OF GLORY is a typically powerful anti-war movie from director Stanley Kubrick, starring Kirk Douglas in one of his most mature roles. The setting is WW1 and the film follows the French army as they attempt to defend and retaliate against a massive German bombardment. Conflict comes from the machinations of an over-zealous officer who is determined to see success achieved at all costs, no matter the casualties taken along the way. An ensemble of fine performances, taut direction and an intelligent script all combine to make one of the hardest-hitting war movies out there.",5
16,15 February 2004,hptaylor,10," The most realistic, most emotionally draining, and most beautifully photographed movie ever made about trench warfare in WW I.","I think that Stanley Kubrick is the greatest of all film directors, and in my opinion ""Paths of Glory"" is Kubrick's best film because:",1
17,16 June 2021,nickenchuggets,10," ""And you can go to hell before I apologize to you""","Paths of Glory is a movie that anybody can look at the cast of and instantly tell that it's going to be worthwhile. As if being directed by the legendary Kubrick wasn't enough to persuade you, Kirk Douglas also plays the main character. The movie is set during the first world war, where huge masses of men are killed in just a matter of seconds due to new inventions like machine guns and more advanced artillery. Douglas plays a colonel in the french army named Dax. Dax's superior officer, General Mireau, is eager to kill germans, but is aware the plan to take a fortified position known as the anthill is unlikely to succeed. Mireau's boss, General Broulard, promises to promote him if the attack goes well. Mireau vows to take the position, and doesn't care how many french soldiers die in the process. The attack soon begins, and colonel Dax leads his men over the top of their trench to attack the germans. It's a disaster. None of the men reach the enemy position, and the others refuse to get out of the trench to advance because they know they'll be killed too. General Mireau watches the action unfold from a distance and is infuriated at the colonel's lack of progress. He tells artillery to fire on his own men in order to force them out into the open, but the artillery gunners refuse. Mireau now blames Dax for the attack's failure, saying he wasn't aggressive enough, and wants to court martial a number of his soldiers for being cowards. Colonel Dax decides to defend his men at the court martial, but it is nothing more than a setup. No matter what he says, the men are found guilty anyway, and sentenced to be shot. Despite Dax's pleas, the men are eventually executed, and the person who gives the order to fire is Lieutenant Roget, who served under Dax in the trenches during the attack. At the end of the movie, Dax's men are in a bar listening to a captured German girl sing a folk song. This is one of the movies that best illustrates how many lives are destroyed by the deadly game called war. The movie conveys to the viewer that while older men declare it and make the plans, plans go wrong and young soldiers die. It's happened in every conflict, and world war 1 was recent enough to make the audience understand how horrific it was to fight through. Sadly, this type of pointless assault that involved thousands of men dying one after another would be the hallmark of the first world war, and the carnage would be unmatched for years to come. As expected, Douglas is superb as the sympathetic but ruthless colonel Dax, who tries to do everything in his power to stop his men from being executed, going so far as to call one of his commanding officers a sadist. George Macready plays the sadistic General Mireau amazingly, and he really does resemble a psychopath when he orders the artillery fired at his own frontline. Just another person twisted into a maniac by his thirst for prestige. Definitely an essential ww1 movie.",/
18,15 November 2003,psychprofessor,10, One of the all-time best antiwar movies,If you can watch this movie all the way through to the final scene in a bar in which a German girl (played by Kubrick's wife!) sings a song and all the grizzled veterans in the room cry--and not cry yourself--then something's wrong with you. This is one heck of a powerful film and makes a better statement against the senselessness of war than many films with vastly bigger budgets. It blew me away the first time I saw it.,?
19,17 December 2003,cfnas,10, One of the greatest anti-war movies eve,"This movie, along with the original screen version of ""All Quiet on the Western Front"" must rank as one of the most tragic versions of what war is really like. The arrogance and total disregard for the welfare of the soldier as beautifully portrayed by Menjou and McReady, in opposition to the care and concern of the Colonel so humanly portrayed by  Douglas adds to the reality of what the world was like in the days of the ""Great War."" Additionally, the roles played by Wayne Morris, Ralph Meeker and the self serving aide to McReady add to the greatness of this memorable motion picture. There is no ""Viva La France"" here.",r
20,30 October 2022,saadanathan,8, The stupidity of war 8/10,Paths of Glory is a remarkable example of how the stupidity and impulsiveness of war takes down those who have done nothing wrong.,e
21,17 September 2022,zardoz-13,10, A Classic World War I Courtmartial Trial about Military Injustice,"Kirk Douglas and Stanley Kubrick united to make two classic movies during their respective careers. ""Paths of Glory"" and ""Spartacus"" were those films. Not only was ""Paths of Glory"" (1957) released before ""Spartacus"" (1960), but ""Paths"" was filmed in black & white rather than in Technicolor. Kubrick wrote the screenplay with novelists Jim Thompson and Calder Willingham. When authorship was disputed, the Writer's Guild said Thompson had written seven scenes and they attributed the bulk of the credit to Kubrick. Anybody who likes to see the books they read turned into a movies that respect the origins of the source material will be happy to know that the film--according to Kubrick biographer Norman Kagan--stuck in large part to Cobb's book. ""Paths"" followed the French Army during the First World War and the court-martial trial of four soldiers accused of cowardice. Mind you, it didn't matter the failure to defeat an impregnable enemy--the Imperial German Army--was the chief blame, not any lack of tenacity on the part of Frenchmen who failed to storm position referred to as the Anthill. The trial is held in part to bolster the backbone of the troops in the trenches. Clearly, ""Paths"" emphasizes the futility of war. Similarly, in real life, in 1915, four French soldiers faced a firing squad for failure to follow orders given by General Géraud Réveilhac. This true-life incident is known as the Souain corporals affair. Interestingly, that quartet of doomed soldiers were later exonerated of all charges! Meantime, Douglas plays Colonel Dax who defends these four guys because he had served as a defense attorney for criminal cases before he buttoned himself into a uniform. Moreover, Dax himself had lead two of the charges, too.",f
22,3 July 2006,theowinthrop,10, The Mutinies of 1917 - a fictional variant,"Although he did the wonderful crime film THE KILLING before he did this, it was PATHS OF GLORY that brought Stanley Kubrick's talents forward. After PATHS OF GLORY he would make all types of films, but he would basically make them as he wanted to (although when working with his star here, Kirk Douglas, on SPARTACUS he would have such friction with Douglas that they never made any other films together afterward). So if it had not been for PATHS OF GLORY there would not have been LOLITA, DR. STRANGELOVE, 2001, BARRY LYNDON, and the other films. The Kubrick stamp of film artistry was born here.",_
23,4 July 2010,gary-444,6, Strong Early Kubrick Anti-War Film,"I watched this, some 53 years before it was made, without knowing anything about it. It transpires that this was a huge advantage in making an objective assessment of a film which has historically divided opinion. The context is important. Made in 1957, it was part of the double feature era when people went to the cinema to see two films, both under 90 minutes. The demand was that a full story be told in that time meaning that far more storytelling ground was often covered then than in modern day films. Certainly here, a longer running time or reduced content would have been a benefit.",=
24,29 June 2009,dromasca,10, the first masterpiece of Kubrick,"'Path of Glory' would not have happened without Kirk Douglas. He not only makes here one of the deepest and most human roles of his acting career, but also put all his influence and some money into determining the great studios to make this anti-war film, which became the first in a series of great anti-war films of Kubrick. The story of the first world war French soldiers sent to an almost sure death by their corrupted generals and then randomly court-martial-ed and sent to death for cowardice when they face the predictable failure is turned by Kubrick into a splendidly built and beautifully filmed pledge for humanity. And it is humanity that prevails despite the tragic destiny of the soldiers. The final scene in which soldiers join a German prisoner girl into humming a simple German love song is a scene of redemption and of pure shaming of nationalism. Kubrick was still, at least at that point in his life and career an optimist.",t
25,12 May 2007,ackstasis,8," ""See that cockroach? Tomorrow morning, we'll be dead and it'll be alive.""","Stanley Kubrick's 'Paths of Glory' is the ultimate anti-war film. Rather than simply showing us the horrors of warfare and declaring that 'war is hell,' this films genuinely fills us with unbridled hate and anger, revealing the sheer folly and uselessness of combat. There are heroes in war, of course  namely Colonel Dax (Kirk Douglas) and his brave fighting soldiers  but certainly not the generals, who sit back in their comfortable armchairs and send thousands of their men to certain death without a trace of guilt or remorse.",t
26,8 April 2009,Movie_Muse_Reviews,10," Kubrick's ""anti""-war film is to-the-point, powerful","War is a horrible thing. That's the general message of Stanley Kubrick's ""Paths of Glory,"" but it's not meant in the sense of people killing other people is bad, it's because war makes us dehumanize ourselves, make poor decisions and devalue human life. This is a war story told on one side. The antagonist in this film is not the other side, it's the people in power and our inability to see clearly because our judgment is clouded by ideas we claim to be greater than ourselves. The film might not seem like a fair portrayal of the military, but it is a masterpiece of showing how war can turn us into terrible people if we're not careful.",_
27,25 July 2011,ElMaruecan82,10," Starts like an Anti-War film, ends like a Humanistic masterpiece ...","""I reject the war and everything in it ... I don't deplore it ... I don't resign myself to it ... I don't weep about it ... I just plain reject it and all its fighting men. I don't want anything to do with them or it. Even if there were nine hundred and ninety-five million of them and I were all alone, they'd still be wrong and I'd be right. Because I'm the one who knows what I want: I don't want to die.""",u
28,2 July 2005,lee_eisenberg,10, the insanity of war,"When people think of Stanley Kubrick making an anti-war film, they most likely think of ""Dr. Strangelove"", but ""Paths of Glory"" is equally as great, not to mention based on a true event. It happened in France during WWI. A platoon of soldiers was sent on a suicidal mission. The battle was essentially an excuse for both nations to try and gain prestige. Some French soldiers refused to go into battle. They were put on trial for ""cowardice in the face of the enemy"". In defending them, Col. Dax (Kirk Douglas) sought to show how they were doing a sane thing by refusing to go into battle, and that the generals cared more about getting promoted than about the men under their command.",r
29,15 July 2015,ThomasDrufke,8, Paths of Anti-War,"Paths of Glory is one of those films that really makes you hate war and everything that comes with it. It's a great film that perfectly portrays the many horrors that go along with war. But it doesn't just address the bloodiness and violence, it looks at the psychological imbalance that it gives people during an awful period of time. World War I wasn't perhaps as terrible as the second World War, but it still was a gruesome time for several countries.",v
30,23 July 2010,khanbaliq2,9, A remarkable anti-war film that retains its impact decades after its release.,"The film is beautifully performed, staged, photographed, cut and scored. In 1916 in the French trenches, three soldiers are court-martialled for cowardice by officers who want to use their case to instil discipline into the ranks.",
31,6 May 2020,marmar-69780,9, paths of glory,"Paths of glory is great anti war film by kubrick and he was able to put film message in people hearts and it also shows us how war is horrible thing and how it just brings pain and suffering to people,it also showed very realisticly how generals and higher ranking officers only care for their reputetions and how they would left common soldiers to die or killed just to achive their selfish ambitions,kirk was great in a film and he was in acting part highlight of film,and he also give some hard but impactful speeches,paths of glory is a proof that kubrick even in his early days was able to make a great film and how he can take any genre and make a film gem out of it",
32,27 June 2022,daoldiges,8, Interesting Paths to Glory,"Visually Paths of Glory is interesting and creates a uniquely atmospheric film experience. Wonderful cinematography and some great tracking shots help to engage the viewer in this film depicting the follies and false motives that can propel wars. Kirk Douglas gives a solid performance and his most interesting character portrayal here. Many of the supporting cast are quite good as well. One of Kubrick's earlier films, Paths of Glory is definitely worth checking out.",
33,12 May 2020,r-48240,8, A movie worth watching,The rhythm is tight. Kubrick first touched upon the subject of the institutions devouring individuals.,
