Review_Date,Author,Rating,Review_Title,Review,Review_Url
314,30 December 2018,nilstockglobal,5, A very good anti war movie but not a great movie,Unlike many others I cannot rate this movie very highly. The script and acting is almost ridiculous at times. At the start of the movie the general in command of the 701 heaps high praise on his men and tells the other general that no offer of promotion could make him risk any of his men in a useless effort to take the enemy position. Then within a nano heart beat during the failed attack he calls them all scum and wants to shoot them all.,
315,13 December 2005,vishal_wall,9, Gem of a film,A French colonel is asked to take a crucial position from Germany in the First World War. The only problem is every one from top to bottom knows that it's an impossible task. The reason this campaign has to be carried out is that some promotions are based on the favorable outcome. In the middle of the campaign half the soldiers decide to back out and General in a personal vendetta orders the stationed army to fire at its own army. The orders are never carried out but army loses the campaign. The general can't take the defeat and asks colonel to pick three men from each battalion and court marshals them. This initiates a crude and realistic drama of personal politics and human misery.,
316,6 September 2007,Cocacolaguy912-2,10, One of Kubrick's best films...the young genius.,"""Paths of Glory"" is proof that by 28-29 years old, Kubrick was the genius as we remember him. This film is a masterpiece considering it is one of Kubrick's first films...that is all there is to it. That is simply astonishing to me...a man who wasn't even 30 is credited for making Paths of Glory, not only one of the best war films ever made, but one of the most compelling and ferociously angering films ever. Kubrick's ability to make the evil of characters so blatantly obvious and yet so subtle is brilliant, playing tricks on our mind and making us really think about what is happening. Kubrick is dark and intense, and that is why his films are so good. This film makes you realize, if you didn't already know, that you can't, you simply can't make a war movie or for that matter, any movie about such a controversial subject and not have it be in your face and mean...and dark...and insane.",
317,7 May 2020,InlyCii,8, Respect is not won by sitting but waiting to win with your own hands!,"This is not just a successful sports film, it also successfully transplants historical issues and social ideology to all aspects of the film story, so that the film has a tenacious force beyond the plot in the Hollywood dream.",
318,27 March 2023,kaaffilm,10, Kubrick's 'Paths of Glory' is a masterclass in the perils of war and the corruption of authority,"""Paths of Glory"" is an unforgettable masterpiece, a war film that combines the brutality of combat with a scathing indictment of military bureaucracy and the toxic patriotism that fuels it. Directed by the legendary Stanley Kubrick, the film stars Kirk Douglas as a principled colonel who defends three soldiers against trumped-up charges of cowardice, only to find himself embroiled in a ruthless power struggle with his own superiors.",
319,5 January 2022,Shilo_R_A,8, 8.3/10 - Kubrick Delievers Once Again,"""-They have skimmed milk in their veins instead of blood.",
320,11 February 2020,AgustinCesaratti,10, Stanley Kubrick ladies and gentlemen.,"This is the best (anti)war movie of all time, and also has one of the best endings of all time. Stanley made this masterpiece at 28 years old. My only complain is that is wasn't long enough.",
321,14 January 2020,amanbirsingh,6, Review No.5,"Stanley is a bold chap, and does a fair amount of over-communication with his lengthy and obvious scenes for a British director.",
322,28 July 1999,Chuck-149,10, An incredibly real movie about military injustice declaring that Kubrick is a genius.,"This is no normal war movie.  It isn't even a common type of movie because it declares the stupidity of a war that wasn't the Vietnam war but the World War I.  12 years after WWII, Kubrick went back to the roots of the previous war and showed the downside of the war which should be the one side everybody should see.",
323,5 December 2020,cebolamaria,10, More than a war movie,"I wouldn't have watched a war movie if it weren't by Kubrick, who's always anti-war, and always great, whatever the subject.
It's not just an anti-war movie, but also a big drama about humanity. Besides all the power games, vanities, inequality between top officers and soldiers who die, it's about human beings and how we choose to react in extreme situations.
I am not aware of technicalities, as most of us viewers aren't. But who can't recognize a narrative that's skillfully built with acting, images, soundtrack, etc with such perfection?",
324,25 January 2000,miken-3,10, Probably Douglas' best film!,"I saw this film in a college course on film and I realize why. It is one of the best-directed films ever made. The black and white works to perfection. This is my favorite Kirk Douglas film about the French military during WWI. A group of French soldiers are sent on an impossible mission. When they obviously fail, the General afraid of losing face for a stupid decision decides to court martial some of the soldiers as a punishment. Three soldiers are singled out. One obviously fought very bravely and another was hit on the head and knocked unconscious during the battle. Their stories are futile against the kangaroo French military court. Douglas tries valiantly to act as their legal council and present their defense in vain. From what I understand this film is still banned in France! I guess the humiliating loss during WWII did nothing to sway the French military from its self-conceived notion of being a great military power!",
325,18 March 2023,fredrikgunerius,10," Every scene and segment is tight, telling and technically proficient","One of the great anti-war movies, a sub-genre Stanley Kubrick would return to time and again over the course of his career. With its subtle variations in tone and temperament, Paths of Glory evokes a broad spectrum of emotions in its relatively sparse running time, ranging from ridicule and amusement to suspense, anger, sorrow and, ultimately, a glimpse of hope. This is certainly one of Kubrick's most economical movies, and it's remarkably well-made. Every scene and segment is tight, telling and technically proficient. Kubrick creates realistic scenes of battle with very simple means and is able to make the more academic subject matter in the second half of the film come alive and feel palpable, well helped by a passionate Kirk Douglas. Paths of Glory was a bold film, aesthetically and artistically. And like most of Kubrick's films, it holds up remarkably well. It's still one of his best. The evocative score is by Gerald Fried.",
326,13 December 2021,Farzad-Doosti,9, The heroic commander is sitting at the table!,"World War I was one of the conflicts for which there was no purpose, now think of falling victim to a corrupt military system in this worthless and aimless war!",
327,7 June 2021,Naoufel_Boucetta,9, A timeless Kubrickian piece.,"Stanley Kubrick takes on the theme of war for the first time, and once again, it was perfectly mastered and totally successful. While with ""Full Metal Jacket"", Stanley demonstrated the absurdity of war by focusing on all the traumas of those who live it, with ""Paths of Glory"" he denounces the politics of those who lead it. He presented in this film an authentic and scandalous incident that occurred within the French army during the First World War, and he served it with a powerful, cold and horrifying realism. Also the absence of the enemy (we didn't see any Germans) was uncustomary at the time. For the technical aspect, the work of cinematography had a huge impact on this picture, the Camera movements made the story more dynamic on the battlefield sequences and more static in the headquarters sequences. We can also add the very successful cast of this film, led by Kirk Douglas' huge performance.",
328,27 April 2019,robhingston,10, Years ahead of its time,"This might of been early days for movies but this movie as everything you won't from a war film,",
329,16 June 2021,alirezazamani-73059,5, A medium anti-war movie!,I think this movie didn't show many scenes very good & complete such as the scenes from war but it showed injustice and the comparison between being pusillanimous or courageous very well!,
330,22 November 2003,Steve-496,3, grossly overrated,"The occasional standout performance (none from the principals) can't change the fact that, as a whole, THIS MOVIE IS BAD.",
331,12 February 2003,the_mad_mckenna,10, A brilliant disconnect,"This is another film that I earegly awaited to view in a cinema, and not on TV, and the reactions to certain scenes are not what you'd think. The scene where the soldiers lie on their bunks and talk about how they'd prefer to be killed was met with laughter; this is because of the absurdity of it all, men calmly comparing the better way to die. You almost have to nervously laugh.",
332,15 January 1999,hedgehog-10,10, One of the best war films of all time.,"A superb Kubrick film which show the politics which ran throughout the armies of the time. The contents of the film could so easily apply to the politics and class prejudice which is clearly reflected in some of the courts martials of British troops during WWI. Like all brilliant film, Paths of Glory has superb direction, photography, script and the right actor in the right part.",
333,25 November 2013,donuthaters12,10, A Film Rivalling Kubrick's Best And The Other Films Within It's Genre,"This film is one of Stanley Kubrick's overlooked films, others include the films that came out before it, but just because the film is overlooked doesn't necessarily mean it's good. Paths of Glory is the best of his overlooked films. Before watching this, I heard so many great things about it but I always try to be objective when I come into a movie to avoid unrealistic expectations and prevent myself to be too excited or disappointed.",
334,25 August 2014,KingBrian1,10, Best WW1 Movie.,Stanley Kubrick's Path of Glory is an Epic movie depicting military life in France during the First World War. Kirk Douglas plays the Colonel who leads his men into battle. An honest portrayal of the conditions that the men in the French uniform had to endure. The movie asks the audience to decide for themselves the morality of the officers show in the film.,
335,13 January 1999,critic-22,10, Fine picture,This is a great movie with some fine camera work and good use of tracking to make the audience feel like they are in the trenches,
336,31 March 2000,critic-22,10, A classic war movie,Paths of Glory,
337,6 March 2003,fergusonchip,4, Huh?,"I was not drawn into this movie at all.  The acting was stiff (no, not stiff like you would expect soldiers to be) so I really did not find myself caring that much about the characters.  I have no idea how this movie is ranked above ""Bridge on the River Kwai.""  It isn't even in the same league.",
338,21 July 2021,monaa-18715,8, Slow Pease,"At first I felt a little bored , the shooting of the explosive sequins was not magnificent ... that's the idea it is war film that dos not glorify the war but the opposite it speaks about it greed.",
339,5 December 2017,sudip_rulz,8, Kubrick: The Genius,"Kubrick is a real connoisseur, a genuine masterclass. Just think about the execution level of this movie, with the presence of tension and emotion, how skillfully he shifted the essence of the story-line from the war zone to the trial scene. How gifted and talented Kubrick was in his early days!! The movie has only 85 minutes of running time. But considering the short span of time, the whole movie was quite intense and engaging. The script was excellent, the story-line was brief and concise and the whole casting ensemble was marvelous. The best thing about the movie was, the singing from the German girl at the end sequence. How brilliantly it changed the tone of the whole movie from a War movie to an Anti-War. This is Magic of Kubrick. Hats off!!!",
340,20 September 2021,Wwmbrd,7, An early Kubrick success,"The droning of artillery fire and crackle of machine gun fire as the wave of soldiers plunges forward is incredible. Some of Kubrick's finest cinematography for sure. The long shot of Kirk Douglas' colonel Dax walking through the trenches before the assault, looking onto the huddled, grayed, faceless men in the smoke and dirt is also a beautiful shot, and could have only been achieved in black and white. Color would have entirely ruined the visuals of a total miasma/fog of war.",
341,8 November 2005,chabbott1,6, Big Disappointment,"I've been reading the member comments about Paths of Glory and I don't know why this film is so highly rated. It's filled with clichés, bad acting and one-dimensional characters. It's talky, and everyone seems to be rushing through their lines. Even the editing is sub-par. Some nice b&w photography, a few good lines and a couple of interesting set pieces are wasted in this predictable bore . As for its anti-war message, it's heavy handed and preachy. Dr. Strangelove is infinitely more effective. I find it astonishing to read comments claiming that this is one of Kubrick's best. It doesn't hold a candle to Strangelove, 2001, Clockwork Orange, etc. Second-rate Kubrick, at best.",
342,6 February 2011,i-talk-way-too-much,1, Do Not Waste Your Time On This Exercise In Depression,"I just finished watching Paths Of Glory. I now wish I could have those two hours of my life back. This film is nothing but an exercise in the depressing. I kept thinking that the film would show some purpose, some justice, something to cheer for. But instead it starts off dark and depressing, and it ends dark and depressing. I don't know if the makers of the film want us to feel that all military generals are evil sadists, or just the French Generals. I don't know if they want us to feel that there is no justice in the military, or just no justice in the French military. If I could have given less than a 1 star rating, I would have done so. Don't waste your time on this film, you've been warned.",
343,14 March 2021,judemcrobbie,8, Not Bad nor Kubrick's Best,"The highest rated Stanley Kubrick film somehow. Compare this to some of the most iconic movies ever (The Shining, 2001, Barry Lyndon, Dr. Strangelove, A Clockwork Orange: the list goes on) this is relatively unknown about.
To touch on the visuals still, the black and white nature of the film doesn't help but the subtlety of the cinematography helps the movies a lot as the little hints of theme throughout (As with Full Metal Jacket, it's clear the theme is that of a serious distaste of war, much like the majority of war films). These hints are the lack of narrow, personal shots making for dehumanised characters; and the few narrow close ups there are always focus on the war badges again reducing the soldiers to their rank, merit or battalion.
It doesn't have the century defining visuals of any of the others, nor the iconic plot, but compared to the rest of his movies it is incredibly wrote. Whereas the majority of his movies are long-standing because of the psychological torment the movie places on you, this (while having a sense of torture) is far funnier and is written and framed like a comedy, through hilarious writing and the obscene ideas of the generals, clearly taking inspiration from the slapstick comedy of Charlie Chaplin. On the note of the absurdity of the movie, very few characters are explicitly named: often characters will go out of their way to not name them, not only making it humorous but also the anonymity ties into the dehumanisation.
The tracking shots that, may as well be known as the Kubrick shot, make a cinematic debut in this film as he had not quite mastered it yet and it still brings a joy to watch.
Considering the mammoth lengths of other war films, this clocks in at 87 minutes but the suffocating pace of this movie helps it to extend that run tins into what feels like an eternity the pacing works beautifullly for this in three separate ways: firstly, it helps us feel the time these soldiers in the trenches and the men awaiting the firing squad are feeling. Just like birdman and 1917, them being one shot and this being long holding shots with the aforementioned tracking shot, they feel much longer than their respective run times and we feel it in this too. Secondly, the suffocating pace helps to feel the suffocating nature of the war and how there is no way out. And thirdly, to help amplify points. These are usually to empathasise with the ptsd soldiers as they feel everything wiring around them in an otherwise fast paced environment.",
344,7 August 2015,donbrown-16800,9, Close to Home Anti-War Movie,Is this not one of the best films that Stanley Kubrick has ever made This film was a pioneer in its time probably the most remarkable aspect of this film was its exposures of what you might call the monsters within and not particularly the anti war message itself. Two of the most stand out members of the cast for me are Adolphe Menjou and George Macready they are just superb. The message is our enemy can be at home not just in some far off battlefield and given what's going on these days with home grown extremism i think its very apt in today's world.,
345,3 March 2021,LaundryMatt20,10, Display of Mastery,"In my top 5 favorite films of all time, and my favorite WWI film, PATHS OF GLORY completely shocked me with its intricacy, emotion, humanity, complexity, and unflinchingly realistic portrayal of human darkness, selfishness, and corruption. It's a completely unflawed film.",
346,13 November 1998,rc223,9, A 1950s Saving Private Ryan,A powerful anti-war film. There's nothing like WWI for angry movie making but that doesn't mean it's easy. Douglas is superb and Menjou thoroughly hate-worthy. Terrific battle scenes. (9/10),
347,16 February 2021,VirusL4D,10," I'm not afraid of dying tomorrow, only of getting killed.","It is 2021 and the first time I watched Paths of Glory, with excitement and high expectations after having seen several of other classics by Stanley Kubrick. But even though it is one of his older works, it is also one of his finest for sure.",
348,23 February 2019,FrankNSteinSinatra,10," Existential, playlike","This movie must have one of the best dialogues of all times. It has so much philosophy on it that it is not realistic to suppose any soldier to talk like them, but at the point of view of the art, it works.
On the other hand dialogue doesn't feel heavy maybe because of the battle scenes that equilibrize the movie, or because of very existential scenes where the soldiers are waiting in a dirty cold cell for hear the sentence or when they are taken to be executed, in a very long take where the camera is examing the expressions of the faces of everyone present.
A perfect, believable tragedy.",
349,4 May 2019,maue-19674,9, Kubrick's Masterpiece on the utter folly and horror of war,"Very few Films have ever quite captured the true misery and horrors of the First World War. Having studied Military History, I had always imagined the I would never see a film that would portray the awful conditions, the sheer waste of mens lives and the terror of a n attack by Infantry against machine guns and artillery. Then, I saw Kubrick's 'Paths of Glory' and sat stunned through a film that avoids the usual Hollywood 'heroics' and shows us the 'human' side of this conflict - from the French High Command, most of whose Officers are drawn from the wealthy classes - and who hardly care about the scale of the casualties, Colonel Dax (Kirk Douglas) an Officer who deeply cares about his men and who doesn't wish to expose them to unnecessary danger, to the ordinary soldiers - just carrying out their duty - and trying to come out alive. Shot in Black and White, which really gives and authentic look to the trenches, Kubrick's tracking shots as the Officers walk down the trenches hoping to 'spread morale', show you the soldiers 'eye-view' - with incessant shell-fire throughout. What makes 'Paths Of Glory' such a powerful film is the sheer idiocy - and almost childish - reactions of the most senior French Officers. The Court Martial scene shows this more than anywhere else - the 'verdict' has already been decided and, as such, the Court is a farce, simply there to verify the wishes of the Commanding Officer.
The main attack against the 'Ant Hill' is one of the most brilliant, and accurate, depictions of such an assault in the First World War. All through the film the 'enemy' are never seen - not a single German Soldier is ever shown. The Irony being that the final scene, where the French troops are drinking and singing before returning to the front, shows a frightened German girl, who is forced to sing for the Troops. As she slowly, and faltering, sings a sad, melancholy, song from home, the troops stop their initial hostility and begin to hum along - painfully aware that soon, they too will return to the hell of the trenches.
Kubrick's film is one of the very best Films about any war and is amongst my favourite films of all time. Highly recommended",
350,12 April 2019,Gov_William_J_LePetomane,6, Disappointing,"It could have been so much better. So much more powerful. I was left feeling there were missed opportunities here to really turn this into a great film. My biggest problem: where was the outrage from the protagonists? Everyone just seemed to go along with events, the show trial, etc., without doing much to challenge them.",
351,10 August 2002,twiglet-1,3, AVERAGE AT BEST,"I heard from a few people that this was a good movie.  Then I saw it, and I was very dissapointed.  I thought the acting was very average at best.  It seemed they were all over acting!  The plot was simple, very easy to follow. If you are looking for a good WAR movie, don't look here.  There are alot of movies out here that are a whole bunch better than this.  It got to the point, in the movie where I am thinking this has got to get better than this, but it doesn't.  I wouldn't recommend this to anybody. I would give it a 4 out of 10.",
352,19 November 2014,BlueFairyBlog,10, Glory Glory,"This is the true story of how those in power took advantage of it and put three innocent soldiers on the stand for cowardice, during World War I. One of Kubrick's earlier classics, this film deals with the savagery of violence, and how the common people are made to fight others' wars. The visuals are so empowering, and the film hits you right in the gut with its emotional prowess. The lives of these men are decided by the higher powers and their decision making, over what is just. Col. Dax (Kirk Douglas) tries to save the lives of the three men in question but he has to fight against bureaucracy time and time again. Even when he has a chance to right the injustice he is thwarted by his government and unfair officials, who fight them in purely evil and sadistic ways. We don't know until the final moment whether or not the three men will be saved, and it's a long and painfully aware scene. The very ending, with the German girl in the bar, singing a familiar tune, sparked such a human empathy within myself that it made me cry. A very emotional and quintessentially moving film, it's obvious that Kubrick has made the seminal war film.",
353,2 June 2014,matic-boh1,8, A thought-provoking critique of the military,"Not only does one get an opportunity to appreciate brilliant directing and stunning cinematography, Stanley Kubrick's Paths of Glory also examines highly significant themes of morality and integrity, making it a very powerful and truly great film. By focusing on the exploits of the French army during the years of the First World War, Kubrick successfully manages to expose flaws within the military system, highlighting the immoral behavior of the commanding officers, as well as the unjust treatment of the soldiers. Kirk Douglas' terrific acting skills are on display in the leading role, as he portrays a colonel that challenges the conduct of his superior officers, thus epitomizing the ideas of justice and ethical behaviour. Due to its flawless execution, the film serves as a very thought-provoking critique of the military and again proves Kubrick's distinct ability to confront delicate themes with a simple, yet impactful approach. Paths of Glory is perhaps the most realistic cinematic portrayal of the grueling trench warfare endured by millions during the Great War, and undoubtedly one of Kubrick's finest.",
354,7 June 1999,RIO-15,10, Powerful anti-war movie,"During WWI,the French High Command order a suicide attack on a German position.The attack fails and in order to save face the commanding officer orders the trial and execution of three soldiers for cowardice.",
355,8 July 2000,plsj,10, Kirk Douglas's best movie,This is my second favorite war movie behind all quiet on the western front. This I think is Stanley Kubrick's best movie. Kirk Douglas is excellent as colonel Dax.I think this should have gotten the academy award for best picture in 1957.Overall 10/10,
