Review_Date,Author,Rating,Review_Title,Review,Review_Url
176,11 February 2021,briancham1994,9, Beautifully shot war film,"This film was far ahead of its time in terms of cinematography. The monochrome shots are bursting with intense details and dynamic movement resembling the newsreels of old. The use of tight shots in the trenches adds to the sense of claustrophobia and discomfort, while the wide shots in the luxurious palace add a horrifying contrast. The main highlight is the characters and their actors, who display a sense of stubbornness and idealism that ends up costing three soldiers their lives. This film is about the true horrors of war beyond the conflict.",
177,25 February 2019,jamesrupert2014,10, Searing anti-war film from a master director,"During WW1, three French soldiers are chosen, ostensibly at random, to be court-martialed as representatives of the units that failed to take a key German outpost during the trench-warfare stalemate of 1916. Defending them is idealistic Colonel Dax (Kirk Douglas), who finds himself facing an indifferent and callous court as well as cynical, self-centered senior officers. Kubrick's camera work is outstanding, with long, fluid tracking shots of officers walking through the trenches, stopping to both congratulate and berate the exhausted men. The battle scenes, as the infantry struggle though the shell craters, barb wire and bodies of no-man's land, are masterful, as is the beautiful, poignant imagery of the long walk to the execution site. The cast and script are equally excellent. George Macready plays Gen. Mireau as a heartless, self-aggrandising martinet while Adolphe Menjou's cynical Gen. Broulard, while more thoughtful, comes across as even more pernicious. The three soldiers (Ralph Meeker, Joe Turkel and Timothy Carey) who find themselves being scapegoated for the poor military decisions of their leaders are also excellent: at times weak, at times strong, and the dialogue between soldiers (such as the discussion of death by bayonet vs. shell vs bullet) has a feeling of authenticity often lacking in war-films. The film has an interesting release history: it strong anti-war message and criticism of both military mentality and military justice, got it banned in a number of venues, especially France. All-in-all, a superlative film from the early years of one of the industry's most talented directors.",
178,9 September 2006,Hildebrando_Martins_Almeida,10, The best film produced by the star Douglas through its called producer Bryna,Notices for the editors: I don't know how to write in English language. This text was translated by electronic translator of the Portuguese for English. ,
179,3 May 2021,didbecu,9, So this is war....,"You don't need Stanley Kubrick to remember that war is stupid and that it only causes deep inhuman traumas, but Paths Of Glory surely is a great reminder of that. It's a big mistery why this movie is rarely mentioned when people come up with big Kubrick-titles as this rather short film (80 minutes) is just perfect from the first tot he last second. Kirk Douglas stars as the officer who refuses to send his soldiers from the trenches into the field of death. The contrast between the privates who are just bullet meat and the officers who keep on partying like there's no war around are mindblowing. The ending scene with the singing German girl says it all. Still one of my all time favourites and I already lost the count of my rewatches.",
180,8 March 2012,billcr12,9, Anti war Kubrick,"Kubrick' s first military drama, predating ""Full Metal Jacket"" by thirty years was the 1957 World War One film ""Paths of Glory."" Kirk Douglas stars as Colonel Dax, who is ordered by his commanding officers to continue an impossible attack on the German enemy who are holding a position which will only result in sure death for his soldiers.",
181,26 April 2000,the dude-3,10, A genre unto himself.,"I was originally going to say that a third of Stanley Kubrick's films were about war, but that wouldn't be accurate.  A third of Stanley Kubrick's body of work were anti-war films.  Considering he only made 12 major films (not counting the five theatrically un-released) this is pretty significant.  He practically invented the anti-war genre with this film or at least made the first nationally recognized anti-war film.  His four major anti-war films could even fit the traditional genre cycle model.   ""Paths of Glory"" being his first anti-war film established the genre and thus was its novelty period.  His next anti-war film was ""Spartacus"" and this could be the classic period of the genre.  Next was ""Dr Strangelove or: how I learned to stop worrying and love the bomb"" and this could be the revisionist period of the genre in which it takes a comedic turn.  Lastly was ""Full Metal Jacket"" which could fulfill the parodic period of the genre as it makes fun of itself.  These 4 films might have better fit the genre cycle if ""Dr. Strangelove"" was made after ""Full Metal Jacket"" but I'm not sure.  Anyway, it's a very interesting view of the four movies if you compare them. ",
182,27 August 2003,Angry_Arguer,6, Elaboration,"While Paths of Glory is certainly one of Kubrick's best (it certainly ranks above The Shining and Full Metal Jacket), it is only an elaboration on the darker aspects of Milestone's All Quiet on the Western Front.  Such concepts as cowardice, insubordination, and prejudice are thrown in to keep things different, but Kubrick can't help hiding that fact.",
183,16 January 2018,travisyoung,10, Which Path Will You Take?,"War produces the true natures of men: some lose their humanity altogether and become monsters, while others embrace a kind of moral courage that cannot be defined or explained. So it's astonishing that a considerably intellectual filmmaker like Stanley Kubrick could distill this principle in such a visceral way.",
184,23 April 2021,gustaslietuva,10, Second masterpiece,Kubrick's second masterpiece. It is one of the best and effective war movie that I've ever seen. Just everything about this movie is just great. It's stood the test of time and became a classic.,
185,7 March 2006,fowler-16,10, One to Remember,"This film is a treasure. I first saw it in the local movie house in Ashland, Oregon, in my second season with the Oregon Shakespeare Festival. The theater owner screened it for one night only, I believe, as an ""art film"" that might appeal to a small off-beat crowd. The whole Shakespeare company showed up, and we were enthralled by the acting and stunned and moved by Kubrick's lean, masterful story of an historical cover-up perpetrated by autocratic generals in collusion with lower-ranking opportunists and cowards. Based on a blatant miscarriage of justice in the French army of World War I, the film had a powerful impact on our generation--in the post-Korea, pre-Vietnam era. It is a classic indictment of the corruption of men in war. I believe it holds up very well and that no one who sees it at the right time of their life will ever forget it.",
186,6 March 2021,elision10,5," OK, but why so adored?","Well, another movie that everyone seems to love and I don't. It's all right, but certainly nothing that deserves such accolades. There's no subtlety, everything is flashed to you in big black letters. The villains are so villanous, the heroes so heroic, and the downtrodden soldiers so downtrodden that there's little suspense. Kirk Douglas can be great as he was in Ace in the Hole; but here he is the high-minded, flawless man that becomes more irritating than admirable. The ending is highly effective, but that for me was the only highlight.",
187,19 March 2021,ritera1,6, I have a very unfair review,"Even though I am a huge Kubrick fan, I was not thrilled by this and actually very disappointed. But that's not fair, considering.",
188,11 April 2020,guisreis,10, Anti-War Masterpiece,"Early masterpiece by genius Stanley Kubrick. With extremely inteligent dialogs, it is one of his great anti-war movies, probably the best of them. Cinematography, acting, script, everything is perfect. Kubrick and Kirk Douglas's partnership gave us to of the best movies ever made, Spartacus and Paths of Glory, and both were able to discuss political issues deeply and seriously while accomplishing amazing artistic achevements with historical events as background. When France and Germany fought each other in WWI, the film is clear about who was the bad side: those who gave orders, all the others are victims. It ia not only one of the best war movies ever but also one of the best court films. The movie was already remarkable until the latest scene, which changed its status from excellent to absolutely brilliant. That perfect scene shows another important lesson: dehumanizing is necessary to make wars, otherwise nobody would do something so dire.",
189,29 June 2019,iquine,8, Kubrick's Take On War: His 2nd Film,(Flash Review),
190,26 July 2010,markbellamy,9, Not really a war movie,"In reading other reviews I see a lot of them saying this was one of the finest ""war movies"" ever made. I agree that it is one of the finest movies but I do not believe it is a war movie. The war is merely the backdrop for the drama that is human politics, selfishness and greed. The backdrop could be a corporate board room, any place in government, anywhere in which a bureaucratic system is in place with little accountability at the top. The lessons in this film extend far beyond the battlefield. I would say it is a must see to anyone interested in movies about moral inconsistencies, abuse of power, and the realities of the way the world operates.",
191,26 November 2019,davidmvining,10," Okay,...This kid from New York has real talent.","This is Stanley Kubrick's first great film, and it has the kind of emotional punch that many find sorely missing from his overall oeuvre. Dealing with themes that Kubrick would explore for the rest of his career, Paths of Glory is one of the great anti-war movies.",
192,6 November 2006,ennyman,10, Early Kubrick film displays his profound skills of storytelling in film in remarkable and poignant World War One film.,"I have placed this early Kubrick anti-war statement on my top ten list both for its originality, great acting, compelling story line, plot twists, and surprisingly beautiful and inspired ending. This one is a heart-breaker account of a moment in history that repeated itself endlessly in that horrific bloodfest called the trenches of World War I. To some extent Kubrick returned to the theme in various ways with Full Metal Jacket, but Kirk Douglas as Colonel Dax is perfect here, demonstrating the challenge of maintaining honor within a system that has turned values on its head. It is a crisis in the life and career of Colonel Dax, who has lived by the watchword of Duty with a capital D throughout his career, but has remained idealistic and faithful to his men. The army's absurd effort to capture ""the Anthill"" results in a tear in the fabric of his idealism. The ugliness he sees is an eye opener for both Dax and the audience, who sees the truth with tragic clarity.",
193,30 July 2005,Captain_Couth,9, The World of Stanley Kubrick: The Paths of Glory.,"Pathes of Glory (1957) has to be one of the greatest anti-war films ever made. The cast is excellent, everyone from Kirk Douglas to Timothy Carey Jr. (who steals the show). Stanley Kubrick solidifies his film career with this film. Their would be no turning back for this young and head strong film maker.",
194,8 November 2013,Arriflex1,10, Stanley Kubrick: His First Masterpiece,"PATHS OF GLORY: Here, Kubrick establishes an important thematic component that is present in many of his great films. The idea of entrenched authority answerable only to itself and running amok with cruel insensitivity would seem like the fearful concerns of a paranoiac except that Kubrick is informed by reality. The film is named after and based on Humphrey Cobb's 1935 novel which was based on actual events, making Kubrick's depiction of the sadistic generals unassailable. Their ill-advised forays into the battlefield are horrifying. When their folly turns into unimaginable tragedy we enter the realm of the demented. Willing to maintain their status and power at a terrible human cost the depraved military leaders persecute brave men who are guilty only of following orders. From a moral stance, the viewer is poised to watch hopefully as one man steps forward to begin the search for truth and the fight for justice. ",
195,1 October 2016,PetarNeo,10, Great war story,"Kubrick is definitely one of the greatest movie directors and it also shows us here what he's capable of. As one of the characters is driven by the mad will for promotion he commands an attack that has completely killed the whole squad and then he tries to turn things around and blame it on three guys. It was just outrageous how they got sentenced to death and it all goes down as officers try to do everything what they can to get Staff in sparing those man, but he is just trying to get everyone to believe him. Those man are executed, next morning it all goes down as Mireau finds out about how he was set up and thing starts unravel what every office desired to accomplish. It was shown how everybody wants something in war but also some want what is best for their man and some will do anything when they are offered right thing. Ending scene is absolutely magnificent and you can't help but to start getting overwhelmed and getting sense that everything is going to be all right. 3.5/4",
196,22 July 2019,PWNYCNY,6, Not that good. The movies fails to make a case against the general.,"It is World War One. France is fighting Germany. The Germans occupy a certain hill. Higher command ordered Mireau to take the hill, Mireau obeys, devises a plan to take the hill, knowing that casualties will be high, and gives the order to move out. Some soldiers move out, then (without orders) retreat and some stay in the trenches. To get the soldiers to obey, Mireau even orders French artillery to deliberately shell the troops. What a mess. Of course, the attack fails. Mireau refuses to accept responsibility for the failed attack and blames the failure on the troops for refusing to obey orders. Mireau orders one hundred soldiers to be immediately executed for cowardice, but is persuaded to reduce that number to three. Three soldiers, each one an enlisted man, are selected. A court martial is quickly convened, finds the three soldiers guilty of cowardice in the face of the enemy. and sentence them to execution by firing squad. The next day the order os carried out. the movie attempts to depict the three soldiers as victims of an nasty and incompetent general who uses the court martial to cover his own incompetency. The movie tries to depict Mireau as the villain and the three soldiers as his hapless victims. Kirk Douglas stars as Colonel Dax, Mireau's chief of staff and the person responsible for leading the attack, who is the personification of righteous indignation. The movie fails to make a case against Mireau. At the court martial, one soldier admits that he never left the trench, another that he moved out only to the French barbed wire, and the third that he retreated without being ordered. The movie makes a case that the the three soldiers were afforded less than adequate due process but fails to make a case that Mireau was a villain. First, the troops refused to obey his orders. Second, selecting individual solders for collective punishment was standard practice at the time. Third. higher command knew that the attack would result in lots of casualties. Fourth, Colonel Dax, who was the officer placed in charge of the actual attack, failed to rally the troops. Fifth, Mireau was doing his job. Sixth, it was war. Seventh, Mireau's orders were lawful. Eighth, if anyone should have been assigned blame, it was Colonel Dax whoi harbored personal animus toward General Mireau. Kirk Douglas received top billing, but the principal character was General Mireau, played by George Macready. The movie was about injustice - against a General who was set up to fail and then take the blame. UNFAIR.",
197,22 October 2005,PWNYCNY,6, Scapegoating is such a dirty business.,"This is a great movie. The story is compelling, the acting powerful, the theme sublime. This movie is about how the individual person can be reduced to the level of a mere statistic, a mere dot on somebody's organizational plan, a mere object to be sacrificed and never be missed by those in charge, who have their own personal agendas and will do ANYTHING to avoid taking responsibility when things go wrong. A military operation fails, and the general in charge is angry and he will not be the one stuck with the blame. As far as this general is concerned, the soldiers are a bunch of lazy, cowardly slackers who don't want to fight - even though the soldiers are dying by the thousands. But that is of no concern to the general who wants to blame someone for the failed operation because if the general takes responsibility he will be revealed for what he is: an egocentric, incompetent martinet who is interested in only one thing - furthering his career at the expense of the soldiers under his command. To pursue that selfish goal, this general will throw away the lives of the soldiers entrusted to him. This movie stars Kirk Douglas. But the real star of this movie is Adolph Menjou who plays the French general. On July 1, 1916, the British lost over 57,000 men killed or wounded while the Germans lost 8,000, with no appreciable gains, tactically or strategically. What an extravagant squandering of human life. But the generals in charge, who did the squandering, lived to fight another day.",
198,28 August 2015,brianberta,10, A powerful anti-war film,This is one of the most powerful and moving anti-war films ever made.,
199,25 March 2020,aakashm-36316,10, Stanley = GOAT,One of the best war film ever made killing announce his arrival but this one made the statement for him making of the GOAT,
200,27 July 2004,brad-draper,10, Paths of Glory - A Movie Review,"""Paths of Glory"" is one of those movies that movie making is all about. It is one of director Stanley Kubrick's earliest movies, indeed, it is his first really important film, and it is a masterpiece. ",
201,12 March 2023,frankde-jong,9, A very cynical view of the First World War,"Chronologically ""Paths of glory"" belongs to the traditional part of Kubrick's oeuvre that lasts until ""Spartacus"" (1960). In style it foreshadows however the more experimental part of his career that begins with ""Lolita"" (1962). It foreshadows in particular ""Dr Strangelove"" (1964).",
202,12 December 2006,zootrouble,10, A masterpiece of Kubrick,"The movie is horrifying in its portrayal of the men ordered to die. As far as I know, this is one of the earliest films to portray war as it actually is, or as I understand it actually is. A true, disgusting, Hell. Men are disposable and there for one purpose, to feed the war machine.",
203,25 June 2016,avik-basu1889,9," War, what is it good for?","Adapted from Humphrey Cobb's novel of the same name, 'Paths of Glory' is generally regarded as Stanley Kubrick's first masterpiece. Kubrick's fascination with war is apparent if one explores his filmography. It is an issue that he tackled on multiple occasions throughout his filmmaking career. 'Paths of Glory' has to regarded as a very bold piece of work considering the uncompromising way in which the film critiques the concept of patriotism and the military as an institution which was a taboo concept during the 1950s.",
204,16 January 2021,Kdosda_Hegen,10, Great war drama about humanity and lack of humanity.,This film is all about the characters. It questions the human decency and has a moral dilemma. It's more about war crimes than about the war in action. I had fun watching this classic.,
205,23 July 2022,fisherray,10, Best Anti-war war movie ever!!!,"If you hate war as most of us should, this movie is the ultimate in how utterly ridiculous war truly is as it only benefits the brass at the expense of the soldier!!! Perhaps exaggerated for affect but really??? Only the brass know for certain!!!! Best part of movie was the end making the humiliated lady sing amongst the catcalls of the derelict soldiers, is this an improvement??? Would any person wish this on anyone???",
206,18 December 2018,invisibleunicornninja,5, Not for me.,I watched the first 20 minutes and then stopped because I got bored.,
207,25 October 2007,slokes,10, The Enemy Is Us,"Stanley Kubrick reportedly said ""Paths Of Glory"" was not anti-war so much as anti-idiocy-in-power. Yet it's hard to tell when the idiocy begins and the war ends, one of many striking impressions left by this singularly striking film.",
208,14 May 2000,Jim Crotts,10, A flat out full bore 5 star masterpiece. Kubricks jewel.,"I have nothing to offer that hasn't already been said about this magnificent and powerful film. I will suggest one thought. What elevates PATHS OF GLORY to such heights is not the answers it gives(really none)but rather that it manages so clearly to pose, frame and context the right questions. Answers are easy, and most often wrong. Genius consist largely in finding the right questions. Well done, Stanley. Thank you!",
209,14 February 2019,Enchorde,7, Stuck with me... but the movie kept it's distance,"If a movie really sticks with you, that counts for something. If it does, there was something in the movie that made me think and reflect. The problem with Paths of Glory is that I'm not sure what it was...",
210,22 January 2012,davidgkimberley,9, Very near Perfection,"What first struck as being most impressive in Paths of Glory, was the way in which trench warfare and life in the trench was shot. Usually I find there's some sort of gloss over the reality of the situation, and whilst here, there weren't mountains dismembered bodies and discarded heads, the emotion of the place was just so brilliantly conveyed. In the shots in which the camera glides through the trenches the emotion of every man is conveyed and felt, its seriously powerful. Though obviously not intentional, the fact that this film was in black and white actually helped it to feel more real somehow. That's probably just a personal opinion and its quite hard to explain but I just don't think the film actually would have been so effective if in full colour, it is far more a film of message and emotion than of beautiful scenery and an array of rainbow like effects.",
211,28 December 2004,tvalstar99,8," This film is very good, but not as good as the ratings on IMDb",I think this movie has a myth surrounding it. The myth has grown bigger over the years.,
212,18 February 2021,tonypeacock-1,9, A path to a Great War story. Superb.,Think director Stanley Kubrick and most people's minds will immediately spring to films such as 2001: A Space Odyssey and A Clockwork Orange.,
213,24 February 2021,doomedmac,9, Overwhelming,Paths Of Glory proves that a movie can be deeply disturbing without nudity and graphic violence. Damn.,
214,13 March 2002,Spleen,7," Kubrick is master of his craft, but the overall result is second-rate, especially by his standards",Spoilers below.,
215,28 October 2020,tomsview,10, A brave coward,"One of the strongest memories of this film is the contrast between the lives of the soldiers at the front and the detachment from reality of the staff behind the lines. But more than just putting the French Army of WW1 in the frame, ""Paths of Glory"" says a lot about all wars.",
216,16 January 2006,randeclip-1,10, Wow!!!,"Many films preach to us the horrors of battle and tout the slogan: ""war is hell"". Most only serve to give the viewer two hours of grand battle scenes interspersed with mostly forgetful introspective moments by the main characters. Then there is the film Paths of Glory directed by Stanley Kubrick. It could have been a grand World War I spectacle with a cast of thousands and sets rivaling the war itself. Instead, Kubrick brings us a story of a failed battle told from a personal side rather then the often used long shot of war, shown on a grand scale, so often used in lesser films. Paths of Glory is the story of an egotistical Generals failure and the lengths he is willing to go to protect his reputation. ",
217,9 July 2006,iamingozi,9, simply put.,"Everyone else will tell you about the story over and over again. So I won't need to do that. But, what description I'll give is one in its most simplistic form. One that summarizes the overall feeling, because to put into words such emotion for each scene is not possible. You will understand what I mean once you see this masterpiece of heartache. For it is just as impossible to put into words the emotions of any soldier during wartime. I should point out that I saw this movie on an old B/W set and give my review from this standpoint. To me it was seeing this movie minus the color that really maked it stand out. What makes it timeless. Anyway, to give you a feel for this movie here is one simple sentence. Black and white, and red throughout.",
218,27 November 2021,Johnny-the-Film-Sentinel-2187,10, As strong as any anti-war movie can POSSIBLY get!,"Paths of Glory implies the possibility of getting something worthwhile and wholesome in the face of war; but the film shows that warfare, especially those fighting an honest fight for right-vs-wrong, is anything but glorious for those on the frontlines of modern warfare dying for somebody else's political cause. It's not easy stuff, but totally necessary viewing; it's also one of Stanley Kubrick's pioneering pieces that showed Hollywood had an up-and-coming cinematic mastermind ready to change the world.",
