Review_Date,Author,Rating,Review_Title,Review,Review_Url
139,31 March 2012,kiran-sh,10, Separation awesome cinema,"From last few days i was waiting to watch this movie. And finally yesterday i made it. This is one of the best Iranian film i was till date. I does not mean that other Iranian movies are not so great but this one stands apart. This movie has everything best performance, best direction, best story etc etc it is perfect in all aspect of film making. This has everything in it love towards your family, thriller you will not feel like getting up from your seat. And most important it is an intelligent movie and it also the rich culture of Iran. Even if you are not interested in global cinema still you will love this movie. Watch it once you will not be able to get this out of your head.",
140,25 February 2012,meeza,8, I am feeling SEPARATED!,"And I ran, I ran so far away, I just ran, I ran all night & day, I couldn't get away Sorry to get all ""Flock of Seagulls"" on you in the beginning of my film review of the Iranian foreign film ""A Separation"", but I had to since there will be a flock of puns in this review as there normally are in all my movie reviews. ""A Separation"" has received mucho critical acclaim and even received Best Foreign Language Film and Best Original Screenplay Oscar nominations. I thought the movie was very well-crafted by Writer-Director Asghar Farhadi and was very deserving of its Best Foreign Language Oscar nomination, but I would not separate ""A Separation"" as one of the best screenplays of the year; so yea, I do not think it was worthy of its Best Original Screenplay nomination. Hey ""A Separation"" lovers- before you separate from my review, please let me explain why. Before I do that, I have to do the ""explain the movie plot thing"" in my review. ""A Separation"" is primarily about Nader and Simin, an Iranian couple on the verge of a separation (ya, that is the title of the movie) because Simin says that she wants to flee from Iran to a better land, and Nader does not want to join his cousin Ralph Nader in America and therefore wants to stay put in Iran to take care of his ailing father. Due to the separation, Nader hires the deeply-religious Razieh to take care of his father. An argument between Nader and Razier on the caring of the father turns ""A Separation"" into a tailspin of turmoil for the characters involved. Director Asghar Farhadi directs this downward spiral with cerebral supremacy an authenticity; I did enjoy Farhadi's direction far more than his screenplay, which was solid but not of Oscar nomination material due to its basic verbal exchange between the film's characters. Peyman Maadi and Leila Hatami excelled with their starring performances as Nader and Simin. And teen actress Sarina Farhadi was astounding as their teenage daughter Termeh, who does not want to be the Termehnator of her parent's marriage. I am going to give you the good fortune of a separation from my puns as I end this review, but please do not separate yourself from ""A Separation"" viewing. **** Good",
141,26 January 2021,baighamza,10, Pure brilliance,"I've watched a lot more movies than the average person has, I've been rating movies on imdb for years now, never have I been compelled to write a review. I never would've thought that an Iranian movie that I had to watch with subtitles would force to write a review about the brilliance of it's depiction of fragility and complexity of human emotions and relationships, this is perhaps the most realistic dialogue the most realistic emotions I've seen in all the movies I've ever watched. Do not watch this movie would be a crime in my book...",
142,24 May 2017,eyeintrees,5, Depressing,"An ambiguous miserable soap opera. As a study of how people behave, it's possibly a fairly accurate depiction. Everyone lies, everyone has an agenda, poor people do things they must in order to survive... and get taken advantage of, in the process compromising themselves, becoming less than their better selves and becoming less autonomous and more attached to the absurdity of religion... same story told again and again. And wealthier people appearing to be educated and beyond reproach are quite willing to be less than their better selves for the ends to justify the means.",
143,15 February 2014,grantss,7, Interesting,"Interesting Iranian drama. Has character depth and the central plot is intriguing. At times you feel true empathy with the characters, no matter what the cultural differences (if any).",
144,21 May 2013,brillmongo,2, A bizarre and pointless film that refuses to work within its limitations and suffers badly for it,The premise is simple enough; A woman wants to split from her husband in order to leave the country since he won't leave with her in order to care for his terminally ill father.,
145,19 June 2012,prafuln518,9, breathtaking!,"i was left speechless after watching this film..this movie puts the audience in the seat of a juror who has to pass a fair judgment for a complex case of human values, adherence to one's core principles, and setting basic priorities in life, which here becomes unusually tough...this is no thriller, but i was on the edge of my seat for two full hours...this is no horror movie, but it gave me goosebumps...this is no romantic movie, but i fell in love with the plot and all the characters involved..each character is thoughtfully well-defined, and everyone play their parts to perfection.. this is a classic example of intense film making...asghar farhadi & the entire crew, take a bow!!!",
146,16 May 2013,wotsonurmind,9, Breathtaking movie but hard to watch!,"The movie was suggested to me by a friend and I am glad I took the advice. It is a magnificent movie in portraying real emotions and real people,something that resonates throughout the world. Although made in Iran, the movie could be set almost anywhere and will still have the same impact.The characters are real;not just black or white but always a touch of grey and brilliant at that.It is hard to watch at times as it is a honest portrayal and leaves a lasting impression.So many movies one hardly remembers once you step out of the theatre except for one or two scenes.It also raises the issue of why movies from other countries with similar non-Hollywood budgets aren't focused on story and characters.Admittedly French and Korean movies are exceptions to this rule.This movie is a must see and hopes it makes the list of everyone's list.",
147,8 January 2013,narenp89,10, One of the most intense movies I've ever seen....Films like this are the reason why i love foreign cinema.!!!,THIS FILM IS TRULY A MASTERPIECE!!!This is one of the best movies I've ever seen in a very long time!!,
148,17 December 2011,arya_zangi,9, The Last Of Farhadi's Trilogy,"A Separation is the Asghar Farhadi's last movie from the trilogy: Fireworks Wednesday, About Elly and A Separation. All these movies have the same themes: Love, Family, Truth; and these themes are displayed through a social and ethical platform. Directing, Writing and Actings of the movie are flawless and perfect and it deserves all the prizes it's winning. Farhadi's Fireworks Wednesday is an easier film to understand: within the movie you struggle to find the truth and in the end everything's clear, somehow nothing to doubt. About Elly, the second movie in trilogy is more complicated: it's hard to find out the truth, relationships in families are more complex and the movie ends with almost an open ending and many answers to questions in viewer's mind remain unknown. A Separation, which has more powerful ethical and social context, is the most complicated and mind-involving one. After watching the whole movie even several times, it's almost impossible to blame anyone and it's Farhadi's goal to create not easy to judge characters, just like the real world. What is the truth? What is happening through Nader and Simin's minds that leads them to divorce? What if Simin is right about Nader's changed emotions? These questions are still with me when I think about A Separation. But if you haven't seen the film, don't hesitate; just enjoy perfection of Farhadi's work.",
149,25 November 2018,Vartiainen,6, Fascinating glimpse into a culture,"In modern day Iran a couple is seeking a divorce. Simin (Leila Hatami), the mother, wants to move abroad because she wants better prospects for their daughter. Whereas Nader (Peyman Moaadi) has an elderly dad suffering from Alzheimer's, who cannot leave and for whom he is responsible.",
150,26 September 2014,panchodh_12,9, Painfully realistic,"After one day of watching this movie, its characters and plot are still with me somehow. I haven't been able of getting rid of them, I still think about this movie at randome times of the day. It is such a good movie, the acting is so good and the characters so real! The plot, above all, is breathtaking. It just get getting more complicated, and you never know whose side to be with, and somehow you feel pity for every single one of its character! This is a very sad movie; but realistically sad. It's not sad in the way movies like Life is Beautiful or 12 Years a Slave are sad; the pain that the characters of those movies go through is somewhat spectacular. But the pain of this movie's characters is much more easy to relate with; is as painful as life itself. Because the problems they face are not Hollywood-esque; they are real-life problems. I guess that, being myself a child of divorced parents, I could really relate to the problems involved in the characters' separation.",
151,22 July 2012,cat_ranchero,8, An enthralling drama...,"Very well made with the look and feel of, what we Brits call, a 'Kitchen Sink Drama'. Lots of very naturalistic dialogue showing people how they actually are. Great performances all round, particularly from Peyman Moadi as Nader, Leila Hatami as Simin, Sareh Bayat as Razieh and Shahab Hosseini as Hojjat. I should also give a special mention for the young Sarina Farhadi, who played the daughter Termeh with great feeling.",
152,15 January 2021,enis-basol,10, My Theory of How Things Started,"Simin looks after Nadir's father for some time and she just wants to hear some kind words and feel she's not taken for granted. Nadir, on the other hand, is too proud to tell his wife he loves her because she looks after his father. He can't admit that. It's not in his character",
153,26 June 2013,TinyDanseur27,9," Incredibly depressing, yet I didn't hate it. It was brilliant movie-making.",A Separation is about a couple in Iran struggling with their marriage. The wife leaves the husband temporarily in the hopes of eventually leaving Iran with their daughter. In the midst of this trouble the husband is accused of assaulting the woman he had hired to look after his elderly father (with Alzheimer's). There is a lot of arguing and crying. There is a lot of helplessness. Basically this movie is just one upsetting situation after another.,
154,21 August 2012,capone666,8, The Vidiot Reviews...,A Separation,
155,28 December 2011,poisonman1980,10, Iranian cinema at its best !,"I'm a big fan of cinema and TV, of course not just any movie or TV series but the best. I've watched lots of movies and series and I just can say, I've never seen anything like this in a long time, at least amongst Iranian movies! As an Iranian I was watching a part of my country people having their daily life and problems. Everyone from their point of view, thinking their problem is more important than the others. I had the pleasure of watching it on DVD (unfortunately I missed it when it was on big screen) and I couldn't believe that it was just a movie and the characters weren't real or they were just acting! Actually, I have to say that they weren't acting, they were living their roles in front of the camera. All of the cast from the little girl to the ill old man, they were real to me as my family members are. As the movie was approaching to the ending minutes I was just wishing that it didn't end. I don't want to spoil anything and I want everyone of you to watch this masterpiece and live every second of every minute of it. I assure you, it will remain on your mind for a long time. Just watch it and spread the word.",
156,25 August 2021,hasanxenith,10, Just Wow!,"Wow! Foreign language film or not, this is just an excellent, excellent drama. You can't get a more Oscar worthy material than this. To me what makes A SEPARATION unique is that writer/director Asghar Farhadi takes conflict, secrets, relationships and other elements that we're familiar with and mixes them with the culture, religion and gender elements from that specific region. This film, to a certain extent, lets you in on how the justice system works in a place where some of us may be ignorant about. And it's really not about our way is better than theirs or vice versa, it's just how different some things are done.",
157,16 January 2012,alikian,9, Very nice movie,Very deep and moving talking about one of the most important problem in young educated Iranian.,
158,15 March 2012,onumbersix,4, Unbelievable Oscar,"Unbelievable! This film won the Oscar for best (foreign) film in a language other than English. Frankly, In Darkness and Mr Lazhar are far more deserving with better stories and far better acting. The Academy members were probably fascinated by this glimpse of daily life in today's Iran. In fact, it does fascinate but disturbs also. Seeing all these submissive women wearing the chador, even in their own home, is very disturbing. These women asking for spiritual guidance from Islamic law is revolting to anyone who cannot imagine a society where equality of the sexes is absent. The men on the other hand live a fully contemporary life without any shame. The story is weak but the elephant in the room has to be this heavy repression which is felt in the daily lives of these women. That is the true drama here. I was eager for it to end.",
159,14 March 2012,newjersian,1, Wasted Oscar,"I started to watch that movie in a company of several friends. We all agreed that it was a waste of time after 30 minutes of watching. The movie is just boring, and I can't believe that the Academy gave that movie an award. 'Forrest Gump', a brilliant American movie, has a rating of 8.7, and 'A Separation' deserves 8.6? Also, in very rare cases I have seen a voting distribution of movie scores, where 57% of voters give a movie a score of 10, like in case of ""A Separation"". It is equal to distribution for the best movie of all times, the 'Shawshank Redemption"". This makes me think that something is wrong here. A 'Separation' is very far from being a masterpiece, so what's going on here?",
160,27 March 2017,peter-laganis,4, Average movie like many in Slavic countries,"I've hesitated for a long time, but yesterday I ""finally"" watched this movie with my wife.",
161,5 February 2017,MaesterFilm,10, It puts the D in Drama,"This is what all drama films should be. I went into this movie not knowing anything. The intro credits showed some names, I didn't recognize a single one of them. Doesn't matter.",
162,30 April 2021,khalid-85774,10, A masterpiece,"I am typing this review after my second watch to the film , and all what I can say is the this is what you could call it a film because this show you what a separation really means it takes you to a trip while you can see a process of a broke and destroyed family breaking apart it all this could start from just a small thing that even yourself couldn't notice it's film that goes inside you and let think about your self and give a clear picture of what could happen to you or any one else in time while are not ready for it and you think you are ready for it ,while you are totally the opposite and in the You will know and see what acting really means , one of my best films ever.",
163,7 October 2012,brent_abrahams-496-812650,10, Farhadi is a genius,Great screen play. Perfectly acted. Perfectly directed. Exceptional editing. This is how films should be made.,
164,8 August 2011,lmikaeily,10, A Sample of Current Iranian Life,All reasons and excuses have piled up there over years. ,
165,25 May 2012,misc250977166,9, Brilliant simple life of Iranians,Hi all moviegoers...,
166,30 June 2012,Alireza_khansari,10, brilliant film,"Iran won Oscar !wow!this is amazing.A Separation is a great movie .it's the best story the best cutting, the best actors you've ever seen!I would give it 11 out of 10 if possible .this film is about 140 min, but you don't feel pass of time at all. the drama of film is very strong. Asghar Farhadi is a smart director and all of his movies are human conception he knows what to write and what to direct!I wonder why Hollywood is incapable of making similar films.The cost is minimal !""Sareh Bayat"" had the best play as supporting actress. There is also another nice movie by the same director - 'About Elly (2009)', but I think I liked this one more",
167,25 January 2021,alpheusthelover,10, Superb writing,One of the best screenplays of the decade. The acting was great. I loved the direction. And the ending was amazing.,
168,8 April 2011,yousef_m_yegane,10, PoLiTiCaL or Others,"Well, we can say that it's political or not! but no one know why people voted this movie. so in one word, it is good and i think previous comment is a little bit political, so i support this movie. i mean look at ""Dark knight"", i have no idea why people voted that movie that MUCH! it is good movie but i think that it's not right! you know! ""The Godfather"" is awesome! but look at the vote numbers! that is awful",
169,29 September 2013,ghostninjafire,9, A must-watch,"Little sins that change a life. Who wants to have all the reason will suffer and cause suffering. A fantastic movie with immaculate direction and sublime acting, the tics of elderly well caught (the trembling hands, etc..) and the curiosity and innocence of children, but with attention to every detail equally amazing. Using arguing as an art and as a subject which few filmmakers successfully did and after all, this is a film where tension comes from personality conflict, dialog and body language, not action. And it is not worth it asking how is the end. The answer is irrelevant. The tragedy happened long before you reach the end and there is no happy solution.",
170,22 January 2012,h-eghbalz,9," A movie about justice, family and The conscience","I saw ""A Separation"" after it won the Golden Globe. This movie, is a very good tragedy and can makes you cry. But it's not a depressing movie, but talks about justice, family, relations and The conscience. By watching this movie, you can take a look at Iran's society, that almost never see. Given the harsh conditions prevailing in, it seems Mr. Farhadi has been able to release this movie in Iran with a smart view. ""A Separation"" shows life of people who have problems and personal situations in Iran much like people all around the world. I strongly recommending to everyone watching this movie and I think watching ""A Separation"" change our views in life.",
171,20 February 2013,cathalokane,7, Enjoyable but over-rated film,The rating that this film has on IMDb gives one a false sense of what is good in this particular picture.,
172,19 September 2014,braddugg,10, A very important and a highly realistic film that is a must watch.,A very important and a highly realistic film that is a must watch.,
173,31 July 2012,socialmedia-437-956449,10, A True Masterpiece,"This year's Oscar winning film in the Best Foreign Language category is Asghar Farhadi's fifth feature, the absolutely thrilling 'A Separation'. The victory in February marked the first time a director has taken an Academy Award back to Iran.",
174,7 December 2013,jboothmillard,7, A Separation,"This Iranian film was one listed in the book 1001 Movies You Must See Before You Die, I had seen the DVD cover a few times and certainly wondered what it was about, but I didn't know that it was the nominated and won awards in the foreign film category, so I was definitely watching it. Basically middle class Iranian couple Nader (Peyman Moaadi) and Simin (Leila Hatami) are on the verge of divorce, despite still loving each other somewhat Simin has exit visa valid for only forty days and he wants to move for a better life with ten year old daughter Termeh (Sarina Farhadi), but Nader will not leave his father (Ali-Asghar Shahbazi) who suffering Alzheimer's disease, despite him not knowing who he is most of the time. Simin eventually moves out and goes to live with her parents, Termeh stays with her father in an action to try and bring her per divorcing parents back together, and he meanwhile follows advice from Simin hires a man called Hojjat (Shahab Hosseini) to be his father's carer while during the day he is at work, but Hojjat can't make it on the first day. Instead Hojjat's wife Razieh (Sareh Bayat) is desperate for the money, being mother to infant daughter Somayeh (Kimia Hosseini), and shows up to do the work, a few days pass and she continues in her husband's continued absence, and between her and Nader an incident occurs that could threaten their place in the community. Eventually all adults and children make their decisions as what is the best thing to do for themselves, of course the decisions bring justice, humanity and well-being into consideration as well, the poignant end of the film is the divorce between Nader and Simin being finalised, and Termeh is left alone to decide which parent she wants to live, the parents waiting in the character lasts through the end credits. Also starring Shirin Yazdanbakhsh as Simin's Mother, Kimia Hosseini as Somayeh and Merila Zare'i as Miss Ghahraii. The performances are all fine, I admit I lost my way a little with what was going on between particular characters, but overall I got the gist of the story, it is an interesting take on a domestic situation and how all facets of it will change and affect others in the mix, a watchable drama. It won the Oscar for Best Foreign Language Film of the Year, and it was nominated for Best Writing, Original Screenplay, it was nominated the BAFTA for Best Film Not in the English Language, and it won the Golden Globe for Best Foreign Language Film. Very good!",
175,2 December 2015,Rickting,9, Wow....,"A Separation is an Iranian drama following the breakdown of a marriage. The wife wants to leave Iran with their daughter for a better life, while the husband refuses to go since he needs to look after his father, who has Alzheimers. Just read that simple set up and watch it. A Separation will knock you off your feet. It looks like just another marriage drama. It is so much more than that. The film is slightly slow paced at first, but once it gets going it doesn't pause for breath. Despite being a simple story with no big shocks, no massive emotional breakdowns, no explosions and a story which stays entirely grounded in the real world, it's more intense than most action films and more compelling than any Summer Blockbuster. The film is realistic and everything feels like it could happen, and this is enhanced by the excellent direction. The strength of the direction is that it's completely invisible and its devastating effects hit the audience with brilliant subtlety. Even if you don't normally watch foreign language films you should be able to relate to this. It's a universal film with, thanks to its complexity, something for everyone.",
176,16 November 2011,eagle-eye_1990,10, Marriage Problems,"It is a most watch movie brilliant , make sure you see it with a loved one!",
177,2 June 2012,TheSheykhi,9, Great Masterwork,It was a perfect drama movie.,
178,15 April 2011,info-28-586211,10, A Fantastic Drama,"Separation is one of the most rare cases in Iranian Movie Industry created by Farhadi , this new talented director who started from TV and now has the golden bear in his hand for such an artistic film.",
179,22 September 2012,Counthaku,8, A slow-building feast of moral ambiguity and dramatic turns,*Spoilers Contained Within*,
180,8 April 2011,Goodmanjoon,9," Good screenplay, brilliant acting.","I watched this movie just a few hours ago. It was wonderful, because of Mr Farhadi's useful ability to guide his actors/actresses. The main subject (i.e. divorce) is very common in here in Iran, but screenplay has made it very interesting and dramatic. Mr Kalari (movie's Director of Photography) has an extremely important role (which may be neglected) in this film; His pictures are very real and generally have a fast tempo that corresponds to actors' acting. But one of the few faults of this movie in my view is insignificant role of music , although it (lack of music power) can not be felt easily and director have filled the gap with good dialogues and excellent acting. Mr Farhadi's movies go deep in the heart of Iranian lifestyle and generally are true representatives of this complex society, so if you can watch ""Jodayie Nader az Simin"", never miss it.",
181,16 December 2019,andrewchristianjr,10," SIMPLE, YET SO COMPLEX.","Incredibly original. Dramatic with so much realism. A slice of life in modern Iran. Simple, yet so complex. A well deserved Oscar's Best Foreign Language Film. Brilliant.",
182,28 April 2011,mahdad_mhsh,9, A Situation Drama or a Thriller?,"Farhadi is not only the best filmmaker in Iranian cinema of today, but he is also one of the most important currently active directors in the world. His last film before ""A Separation"", ""About Eli"" (original title: Darbareye Eli), was surely a very good film (perhaps even better than ""A Separation""), but I had understood that I adore it much more than a very good film. After watching ""A Separation"" (Originally known as ""Jodayiye Nader az Simin"", literally means ""The Separation of Nader and Simin""), I know why I respect these films so much.",
