Review_Date,Author,Rating,Review_Title,Review,Review_Url
0,13 January 2012,claudio_carvalho,10, Mankind Is Flawed,"In Tehran, the teacher Simin (Leila Hatami) has requested the divorce from her husband, the bank clerk Nader (Peyman Moadi). Simin wishes to live abroad to give a better life to her eleven year-old daughter Termeh (Sarina Farhadi) and Nader, who is a family man but very arrogant, wants to stay to take care of his father (Ali-Asghar Shahbazi) that has Alzheimer. Simin moves to the house of her mother and Nader hires the religious Razieh (Sareh Bayat) to take care of his father while he is working. ",/
1,2 September 2011,krisrox,9, Do yourself a favor - make sure you see this movie,"Caught ""A Separation"" in Amsterdam last night, fully unprepared for its greatness. I hadn't been swept off my feet for a while, but this Iranian Hitchcockian drama sucked us in for 123 minutes and left us very, very impressed.",r
2,10 October 2011,stensson,9, Maybe the movie of the year,"And it comes from Iran. The first thing you read on the screen is ""In the name of God"". Well, anyway it's the best story, the best cutting, the best actors you've seen for long. And few films are that stomach-turning, although there's hardly any physical violence.",e
3,16 February 2011,Radu_A,10, The Swan Song of Iranian cinema?,"Asghar Farhadi's new film after the ingenious 'About Elly' is running for the Golden Bear at this year's Berlin Film Festival and, with half of the competition done and the rest of the program not looking too promising, appears to be an almost inevitable winner. Although maybe it won't for that very reason: Jahar Panahi's repeat inability to attend his jury duties because of Iran's government refusal to issue him a travel permit, a retrospective of his works including the 2006 Silver Bear-winning 'Offside', a variety of other Iranian productions and renewed demonstrations in Iran proper put the spotlight firmly on that country's elaborate, yet constrained film industry. All that buzz may outshine the film's artistic value, and prompt the jury to go for a less favored competitor. I should hope not, for Farhadi manages once again to embed lots of social criticism into a straight-laced, realistic narrative.",v
4,28 December 2011,Ramascreen,10, Wow! Just.. wow!,-- www.Ramascreen.com --,i
5,28 February 2012,ElMaruecan82,10, A gripping and heart-pounding universal masterpiece ... made in Iran ...,"""A Separation"" is an intense and powerful examination of the eternal conflict between human emotions, personal convictions and Law, whether political or religious, and it happens to be –I believe- the best film of 2011.",e
6,9 July 2011,markgorman,9, Iranian cinema lands in the west with a bang. Phenomenal.,"I've never seen an Iranian move but the country has a rich movie culture that has broken through with A Separation which won the Golden Bear, best actor and best actress awards at Berlin earlier this year. And I can understand why.",w
7,25 March 2011,mrbarooee,10, unsaid words can turn into a separation,"It seems that a court room drama could be the best place for Frahadi to recreate his very own world and confront us with a short and somehow faraway situations and incidents in life. We think these kinds of happenings and conflicts would not take place in our lives but with his realistic world and characters they seem so close and possible to anyone. Asghar Farhadi loves to put his audience in place of judge, as his other pictures like About Eli or Fireworks Wednesday and here with no fear he takes us straight to a court room. But the thing is that the judge does not provide any help for us to make a clear judgment and surprisingly makes the situation even more complicated. Yes Farhadi doesn't want us to make a judgment, He makes us watch and observe and leave the theater with a big fork in front of us.It Seems that any single decision creates another world full of forks and not taken ways.",/
8,1 February 2012,planktonrules,9," While not especially pleasant viewing, it's a very complex film--the sort that will get you and your friends talking.","Over the years, I have watched perhaps thousands of international films. And, I've come to be impressed by the films of three countries--France, Japan and, surprisingly, Iran. In fact, although I've seen far fewer Iranian films than either Japanese or French, the Iranian films have always been exceptional...always. Their track record with films you can see here in the States is amazing. Part of it is because the nation has produced Majid Majidi--a truly brilliant filmmaker who, oddly, has only received on Oscar nomination and no wins. Yet, easily, he could have won several times with such brilliant films as ""Chidlren of Heaven"", ""The Color of Paradise"", ""The Willow Tree"" and ""Baran"". I have also seen several other wonderful film by other Iranian directors. So, I was quite interested in seeing ""A Separation"" when it arrived at a local theater. And, I am glad I had a chance to see it.",r
9,7 April 2013,TheLittleSongbird,10, For me A Separation is definitely one of the best films of 2011,"Hearing how highly regarded A Separation was among my IMDb friends, I knew I had to see it. My only question is how on earth did it take so long for me to do so? I can only put it down to being behind with my film watching because of uni, because A Separation is a fantastic film and deserves all ounces of praise it gets and some. That is my opinion though, because I know people will find that it is not their cup of tea and have no problem with that. What was it I loved about A Separation? A lot of things actually. It was a very well made film. The scenery is striking and authentic, and the cinematography is intrusive and relentlessly, but this adds to the impact of the story rather than detracts from it. Asghar Farhadi's direction similarly is supremely controlled. A Separation is remarkably written as well. The writing is intelligent and insightful, avoiding any kind of melodrama or moralising. Not just that but it succeeds also in exploring the characters without any kind of prejudice, and that is including Hodjat. The story is quite a complicated set-up, but compelling and moving. It gives the audience time to breathe, but with the tension and drama that fuels what is happening in the storytelling I found myself never being able to look away. The characters are sensitively explored, and while I've not seen About Elly in a while I do remember that I didn't relate as much to the characters there than I did here. The acting is wonderful, Leila Hatami(especially good), Peyman Moadi, Shahab Hosseini and Sareh Bayat give performances that wholly justified the sharing of the Silver Berlin Bear. One mustn't forget Sarina Farhadi, whose increasing intensity in her acting is what makes A Separation's storytelling and the case it depicts even more engrossing. In conclusion, one of the best of 2011, considering how hit and miss that year was for films that's saying a bit. 10/10 Bethany Cox",w
10,2 December 2011,jsrees,10," thoughtful, brilliant film","This is the first Iranian film I've seen, and I'm recommending it to every-one I know. It is so well-crafted; the twists of the plot throw up new moral dilemmas for all the protagonists, which are explored sensitively and without judgement - so refreshingly unlike mainstream American films. I felt sympathy for all the characters, even the threatening Hodjat, full of misplaced rage which often erupts volcanically. And as a footnote, the film felt like an intimate view into a society that our news media portray as monochromatic and extremely foreign. (I am writing this a few days after the UK embassy in Tehran was ransacked)",4
11,28 May 2012,CrisPat,10, right or wrong. right and wrong.,"I wouldn't have been more glued to the screen if I watched a blockbuster action movie. I've seen too many of them, I forget them before the credits roll. Now, it's a film without any nudity, crime lords, drugs or swearing to pin me down for a breathless, profound two hours.",2
12,24 March 2011,hideous_stranger,10, You be the judge...,"I'm an Iranian, but I've never been interested in Iranian cinema. I only watch Iranian films when they win awards or receive international recognition. I'm a fan of Kiarostami and Majidi, but I can't really say that I like all of their films. I watched Farhady's previous film (About Elly) about a year ago, and the first thing which struck me was how culturally detached the movie was in its depiction of an event. At the time, I believed this to have been the cause of this director's success. Watching Nader and Simin, however, proved that I was terribly mistaken.",1
13,4 March 2012,lee_eisenberg,10, inside Iran,"While most reports about Iran have centered on its nuclear program, ""Jodái-e Náder az Simin"" (called ""A Separation"" in English) takes a look at the lives of the Iranian people. It focuses on a family falling apart, and how events proliferate from this. Every character is flawed but well-meaning, and so the audience can't really ""side"" with one character over the others. The basic gist of the movie is how this moral conundrum affects every person.",1
14,5 July 2011,tait_tait,10, A Perfection,"If mainstream cinema leaves you soulless, see this film. ",0
15,30 December 2011,Chris_Pandolfi,10, A Story of Responsibility and Truth,"Nader (Peyman Moaadi) and Simin (Leila Hatami) are a middle-class, modern, urban Iranian couple. They have been married for fourteen years, but they're separating. They were going to divorce, but the court ruled that their situation wasn't dire enough to warrant it. They each have their side of the story. Simin desires to leave their country, as she does not want her eleven-year-old daughter, Termeh (Sarina Farhadi), growing up under current conditions. Nader, on the other hand, wants to stay so that he can look after his elderly father (Ali-Asghar Shahbazi), now in the advanced stages of Alzheimer's disease. Their situation becomes much more complicated after an incident, one directly involving the caregiver Nader hired to watch his father during the day. What begins as a simple argument between two people quickly escalates into arduous legal action and a heated battle over what really happened.",8
16,20 January 2012,wbeeman,10, Fantastic film!,"This film won the best foreign language film for the Golden Globes. It blows just about everything this season out of the water. Don't, don't miss it. For all the hate-filled rhetoric spewed about Iran, this film should show the world, like so many other Iranian films, what brilliant artistry exists in this nation, what sensitive beautiful people Iranians are. Iranian actors have been honed and trained since the 1970's when the modern era of Iranian film began. The principal actors: Leila Hatami, Peyman Moaadi, Shahab Hosseini, Sareh Bayat, and Sarina Farhadi (the director's own daughter) are superb. From the first moments of the film you believe them and the truth of their existence. The stark intimacy of the film is stunning. The complicated plot is gripping and holds one's attention to the very end. It will also be fresh and novel for non-Iranian audiences. It is true in every instance to Iranian society and cultural life. Watch it and learn why American politicians have been misleading Americans about Iranian life.",4
17,15 September 2011,pattikawa,9, Asking difficult questions,"Have you ever been watching a movie where you could not take your eyes of the screen, not even for one second to take a zip of your wine? This movie is for me a thriller, even though labeled a drama. The shoots were artistically taken; I see a beauty in a scene when a woman is walking with her long vein downstairs. Couple arguing in front of a judge where when she was asked whether the man beats her because she wants a divorce saying: no, he is a good man, but I want a divorce.",/
18,6 November 2011,vijayarya,10," Masterpiece, go watch it","I think our day to day life has more than enough material for a good movie. 'A separation' engrosses you into the life of a small Persian family and shows you what happens there. You get to watch this very closely and the final result is a superbly simple and beautiful film. The story is so real, this could have happened anywhere. ",?
19,21 January 2012,3xHCCH,8," A Peek into Iran's Family, Religious and Justice Systems","""A Separation"" is the foreign-language film of this year's awards season. After it won the Golden Globes last week, you know it is a cinch to earn an Oscar nomination for Best Foreign Film and most probably win the coveted prize for its country of origin, Iran.",r
20,6 January 2012,eerereps,9," you will be ""awed"" in amazement THROUGHOUT!","I'll just get to the point,",e
21,21 January 2012,howard.schumann,9," A powerful, realistic, and beautifully acted drama","""Love does not consist of gazing at each other, but in looking together in the same direction."" ~Antoine de Saint-Exupery ",f
22,26 February 2012,Hellmant,9, A powerful realistic drama about arguments and pride and how they can easily get the best of us.,'A SEPARATION': Four and a Half Stars (Out of Five) ,_
23,4 April 2015,Quinoa1984,10," you'll leave feeling so many things - maybe, a little, hope","A Separation is a film by Asghar Farhadi that keeps things to being about the personal - what it means to be a married couple, apart, and still being a family unit, or units. How does one give care to a loved one, especially if they're older and unaware where they are (as happens to the old grandfather in this film)? What about how things don't happen on-a-dime, so to speak, but feelings of betrayal and distrust grow eventually, piece by piece? In Farhadi's hands, and through his actors, people are trying to figure things out, trying to make sense of the people around them, about the trust, about people's behaviors, about things that can be taken for granted like love. There's not much, if at all, sentimentality in this approach, which makes it so affecting and effective.",=
24,5 March 2012,joeaneal,10," A lot of complexity of life, relative to all cultures",I was expecting an excellent film and got even more than I expected. I was lucky enough to have an Irani friend for about six years before I moved from Northern California. During those six years I began to see a humanity in my friend that I did not expect. Like almost everyone in America we have been taught that Iran is our enemy. That their religious beliefs were so different than ours that there was little hope of closing that gap. That reconciling those differences would forever cause us a chasm. Or at the very least a great tension.,t
25,9 January 2012,SheldonChau,10, A Separation (2011),"Gripping, tense, heartfelt, powerful, painful, and stirring, Asghar Farhadi's A SEPARATION is an intense drama that captivates like a thriller by boasting astounding performances and a truly compelling narrative arc. It is an Iranian film that centers on intimate domestic issues in the midst of extremely difficult circumstances - a purely humanistic narrative that gets better and better as it progresses, building upon layer after layer after layer of dense situations in which these poor characters are helplessly engulfed within. In creating a plethora of deep emotions that are carried out honestly and never over-the-top by the ensemble's pitch-perfect performances, Farhadi manages to weave together multiple angles that are both morally complex and excruciatingly truthful into each and every one of his primary characters (all of whom exist in the middle-to-lower class) . The plot is patiently set up with its pieces slowly establishing in place in the first few scenes before snaring the audience into a wonderfully played 123-minute thrill ride that places viewers right beside its characters - a feat that is executed through its seemingly naturally-crafted hand- held cinematography in conjunction with genuine acting that rarely calls attention to itself. ",t
26,17 January 2012,estebangonzalez10,9, Strong Iranian film,"¨What is wrong is wrong, no matter who said it or where it's written.¨ Critics have been raving about this Iranian film and after finally getting the chance to see it I can see why they were so pleased with this social drama. It is a very well told story with great performances. Filmed mostly with a hand-held camera, the movie feels very authentic and real. At moments you forget you are seeing a movie, and feel like you are watching a real family with real problems. Iranian director, Asghar Farhadi, knows what he is doing and delivers a near perfect film. He captures a glimpse of an Iranian family and lets the camera tell the story. What at first seems like a movie that's going to focus on the separation between the husband and wife later becomes more complicated and interesting when the main character is charged for murder and we see the way the Iranian law system works. We also experience how the entire situation affects the different members of the family. I also liked the final reveal near the ending as I wasn't sure how the story was going to pay out, and it worked really well. Most foreign films tend to deal with social issues since these movies are cheaper to make and they don't count with the costly productions that Hollywood films have to create spectacular visual effects and action scenes. That is why more emphasize is put on the storytelling in order to capture the viewer's attention. The storytelling here is the center of the movie and we truly care for what the characters are going through. We can relate to these people despite their different culture and beliefs. They have to deal with similar issues that most families need to deal with, and that is what makes A Separation a universal movie.",_
27,21 February 2012,evanston_dad,10, Shades of Gray in a Black and White World,A complex and blisteringly intense screenplay distinguishes this Iranian film about the path of destruction a rancorous and failing marriage can leave in its wake.,u
28,3 January 2012,Ryan_MYeah,10, 2011 at its finest. Nothing in this movie is less than great.,"I may not have terribly much to say about A Separation, but I can say this much, it is a wonderful movie that I found nothing to truly complain about, even nit picking.",r
29,3 March 2012,jadepietro,9, Truth and Dare,This film is highly recommended.,v
30,19 March 2012,Vincentiu,9, Puzzle of small things,"a drama. a brilliant movie. picture of Iranian society. exploration of love, error, religion and innocence. out of rules. or definitions. a film as a mirror because the crumbs of sin are parts of every life. because solutions are only illusions. because Nader and Simin and Termeh are images of same man/woman at different level of self definition. the values are universal. and the fragility of Razieh is way to understand root of pain beauty, nuances of sacrifice. the world of characters is same like many others. frustrations, need of escape, fake refuges, isolation in self circle, empty words and cowardliness as only door. so, it is not image of far Iran but, in same measure, it is a travel to East, West Europe, to hunt of shadows of America, to fear lakes of each land. ordinary fear, ordinaries solutions. or just verdict of a very long judgment.",
31,12 April 2012,cultfilmfan,10, A Separation,"A Separation is a film from Iran in Persian with English subtitles. The film takes a look at two families through the course of the film and a situation that develops between them. This situation will ultimately test all of them and their families and watching each individual and trying to ultimately piece together as a viewer on whether who is telling the truth, or not is a large part of the film, but by doing so and as time goes by we get to learn more about the characters in the process as they also get to learn and see different sides of themselves that perhaps they did not know were there. A Separation was an emotionally gripping film that takes hold of your attention very early on already and takes us through quite an ordeal. We can see the pain and frustration the characters in both families are dealing with in this film and how a lot of what they are feeling must really be bottled up, or internalized inside of them because each of them has so much stress and confusion going on, that it is hard to imagine them not finally reaching a breaking point. When the conflict between the two families enters the film it is done in quite an ingenious way. As viewers we don't quite see everything, so in trying to make up in our own minds of who is in the right and who is in the wrong, the film never allows us to do that because it keeps bringing forth evidence from both sides. The way these families act and up to their conclusion about how to settle this feud is done in rather a brilliant way also. We have characters here who are very stubborn and want to get back to just living their lives normally as well as characters who are strapped financially, so they may have to decide which move will best suit them. My favourite aspect of all is the devoted part of one's religion and culture playing a large role here as well. With one character wanting to tell the truth, or even perhaps bend the truth a little bit, but unsure of what to do with the situation their family is in and also doing what is right according to their culture and religion. The story told in this film is a story that basically could be told in any country using any two families basically, but I found that the fact that the film is set in Iran, where they have a different way of life and beliefs than say the Western countries made this all the more fascinating. The fact that a families honour and one's devotion to their religion were very admirable qualities. Please do not take what I say out of context when I say that Iran is different from Western civilizations because I am not trying to be racist in the least when I say that. In fact the characters in this film have such a loyalty to their families, their culture, religion and way of life that I actually found it quite admirable and I don't think it would work as well, or translate as well had it been done and told in an American film. The acting in A Separation is all superb from the entire cast. I have never seen any of these actors in previous films, but they all do such incredible jobs with their characters that I hope I will see them in other films one day soon. The amazing script and direction by Asghar Farhadi is utterly compelling. Some may find this film a little tough to watch because of all the grief and heartache these two families are going through in their day to day lives, but for me it was more of an eye opener than anything else and I could really empathize and sympathize with both families with the situations that they were both in. I think that is one of the best things about the script and film. It allows us to feel and ultimately to care about the situation and what is going on in both these families, so no matter what the final verdict is of their outcome and dispute we really do want to see it ended, but at the same time we want both families to be okay and move on to bigger and hopefully better things in life. We are not biased against one or the other, but rather just made to understood their situations and why they behave the way they do and instead of getting angry over these choices they have made we just as an audience feel pity for them and wish that things had gone a different way and didn't have to be this way. The film from start to finish was absolutely compelling and made us care because of well written characters that made us be allowed to identify and care for them. By allowing us to do so, we can look at their situations differently rather than if we hadn't been introduced to them in this way and just flat out did not care. But the thing is we do care and the subject of honesty is brought to the table here and altogether this is a morality play that will have you talking about it long after you see it. This is an emotionally powerful film with superb performances, a captivating and well developed screenplay that involves the viewer on so many levels and we thank them for that. This certainly did deserve the Academy Award it received for Best Foreign Language Film. One of the best films of last year and a true masterpiece and triumph of cinema.",
32,28 January 2012,Turfseer,9, Superb Iranian domestic drama and suspense thriller deserves all the accolades heaped upon it!,"With the release of the superb 'A Separation', director Ashgar Farhadi has done much to open peoples' eyes that Iran is a much more complex society than has generally been perceived in the West. The film's title might lead one to believe that this story is merely about the separation of a husband and wife but it's much more than that—at times I felt I was watching a Hitchcock-like thriller, with all the attendant twists and turns associated with the suspense master himself.",
33,21 August 2012,StevePulaski,10, Morally complex and impossible to emerge silent,"Asghar Farhadi's A Separation is my first experience with Iranian cinema and it for sure won't be my last. It reminds me instantly of a quote said by American director Alexander Payne, ""...I think there may be a problem with a world in which making small, human[...]films is 'an achievement.' It should be the norm."" Just from this film, I would be justified in saying that Farhadi is Iran's Payne.",
