Review_Date,Author,Rating,Review_Title,Review,Review_Url
69,21 November 2012,pc95,8, Serious and Engaging,"""A Separation"" directed by Ashgar Farhadi, and winner of the academy award for best foreign film is a serious and engaging drama giving the world a story of Iranian life replete with excellent cultural nuances and originalities. (spoilers) The movie starts out running with what seems to be a break-up between a couple but really masks the true story of social class fighting. The narrative is superbly written - especially the main conflict where the truth is nicely obscured to create suspense and tension for the audience. We're wondering what exactly happened, and yet some important questions even as the credits roll are left unanswered. Worthy of it's award and one of the better movies of late.",
70,10 August 2020,ssssgelojun,9, A Separation,Let's talk about kids from two families.,
71,10 March 2012,JSL26,10, An exquisitely balanced film.,"""A Separation"" achieves a perfect balance. A balance between husband and wife (with the daughter as the fulcrum) and two disputing families (with the truth--and the other daughter--as the fulcrums). But there are many more balances; between: staying and going abroad, taking care of the infirm elderly and the budding child, modernity and tradition, devoutness and disregard, frustration and acceptance, stubbornness and compassion, the employed and the unemployed, truth and lies, and the known and the unknown. So well balanced, it is impossible to choose which of the many sides to take.",
72,14 November 2014,brchthethird,9, Morally complex and gripping,"This is my first film from the Middle East (Iran, specifically), and I am amazed at the dramatic complexity and commitment to realism that Asghar Farhadi created in A SEPARATION. The story concerns a couple who divorces when the mother wants to leave Iran, but the father decides to stay behind with his Alzheimer's-suffering father. What follows is a compelling drama about divorce and its effect on the people involved, even how it can reach beyond the immediate family. There are many other complex issues discussed, and all of it is through the lens of Muslim culture, which I found fascinating. Thematically, the central issue is about making tough decisions in the context of a culture where religion and government are so intertwined. As far as acting is concerned, it was some of the best I've ever seen. Every performer gave their all, and it felt like I was watching a documentary with real people. This tone was also reinforced by the hand-held camera-work and (until the closing credits) a lack of music. Overall, this is not just one of the best foreign films I've ever seen, but one of the best period. The only minor issue I take is the rather ambiguous ending, but after watching the problems that the characters go through for two hours, it's probably just my personal desire for a more clear-cut resolution. Overall, if you love foreign films or complex, realistic dramas then give this a try.",
73,28 April 2011,farhangpark-40-66371,9, The best product of Recent Cinema,"Asghar Farhadi amazes me. When I first heard about ""About Elly"" I wasn't sure what it was going to be like but when I sat down to watch the movie I was literally blown away by the writing, acting and the direction of course. Still, I wasn't sure if he could repeat the same success with ""Nader and Simin"" and yet again I was blown away.",
74,4 November 2012,lionmoonfilms,9," Between caring for a fragile life of the elder and securing a better life for the daughter, the middle-class couple have to make the tough decisions.","This wonderful film is about a middle class family in Iran, of which the middle-aged parents living with a 11-year-old daughter and an elder who suffers Alzheimer's disease. ",
75,11 August 2012,tim-764-291856,9," Oscar winning Iranian drama...,","A domestic drama set in contemporary Tehran. Yawn, no thank you. I love my World Cinema but usually too much politics and religion take over and gets too heavy, masking the story.",
76,29 January 2012,zetes,8," Good, very good, even, but I don't see the greatness that everyone else apparently does","I'm having a hard time reviewing this film. I just can't help weighing my reaction to films against the consensus. It seems shallow, because, the thing is, I found this to be a very good film, but, compared to the general reaction, I found it merely that and not ""OMG BEST MOVIE EVERRRR!!!!"" The film is quite complex. Nader (Peyman Moadi) and Simin (Leila Hatami) have reached an impasse in their marriage. She wants to leave the country with her daughter, but Nader cannot consider it at this point, because he's taking care of his disabled, Alzheimer's suffering father. After Simin leaves Nader, he must find someone to take care of his father while he is at work and his daughter is at school. Having little money with which to hire someone, he hits upon a desperate, pregnant woman, Razieh (Sareh Bayat), whose husband, Hodjat (Shahab Hosseini), is unemployed. Hodjat is the one Nader wants to take care of his father (Razieh is, for religious reasons, not allowed to physically engage the old man when he needs to use the bathroom or whatever), but Razieh must do it for the first few days. Unfortunately, she's unable to handle to huge responsibilities that come with the job, and she quickly runs into some horrible troubles. Those horrible troubles lead to other horrible troubles, and soon she and her husband are in court suing Nader, with Nader counter-suing them. In some ways, the film plays like a really good episode of Iranian Law & Order. That's definitely of great interest, because Iranian courts are quite different than our own (some may say more corrupt, but, honestly, probably not by much; I think a lot of this situation would play identically if it happened in the United States). While the issues presented are quite interesting, and the moral and class issues are entertaining to contemplate, I had some fundamental problems with the story. First, no matter which way you slice it, Simin comes off as a terrible human being. Nader would have agreed to leave with her and their daughter if he hadn't been forced to take care of his father. Presumably, if Simin was still with Nader, she'd be the one caring for the old man. Now, we all know how much that would suck, but Simin really couldn't help take care of the father for a year or two until he passed? Instead, she dumps the entire crappy situation on her husband (and daughter, whom she wants to steal away, too) to deal with on his own. The film never provides Simin with a realistic reason for making this decision, instead treating her like she's being reasonable, just because the director wants to seem unbiased. And then there's the whole issue of the lower class Razieh and Hodjat. Without spoiling the story, I must say, I was always entirely on Nader's side for the whole court case. Sure, he made some poor decisions, but the accusations against him are fairly unjust. The film gives him some baggage when he lies about a key element of the story, but, really, the lies seem pretty minor compared to the other side's lies. It's all very intriguing, but, I must ask, where is this ""BEST FILM EVER!"" stuff coming from? It's very blandly filmed in a hand-held documentary style, with maybe only one or two good shots and edits. The performances are pretty good, especially Peyman Moadi. All in all, though, good, but nothing revolutionary.",
77,30 December 2011,sahlawi,7, So far the best foreign movie in 2011,"I just saw this movie and I highly recommend it. The way the story was going totally unexpected and many surprises occur throughout the movie. There is a lot of dialogue and over talking, which makes it a bit hard to read the subtitles, but you will manage to understand regardless. The story of the movie is a one that everyone, no matter what the background is, will relate it. The acting in the movie was extraordinary, all the women and girls did a great job, both young and old were superb.",
78,13 April 2021,Misss25,9, Just mind blowing,It was my first Irani movie and I just loved it. I really didn't have any interest of watching of though it is a high rated movie. But frankly speaking I don't regret at all. I have never seen such a family movie in my entire life.,
79,11 February 2012,fahadkashmiri7,10, 8.6.....? Are you kidding me? It deserves a 10.,"Those who think that movies can't change lives, should watch this film. Its one of the most beautifully crafted movie ever made in cinema's history. It stands there right at the top with The Shawshank Redemption as my all time favorite film. The lead actor ""Peyman Maadi""... OMFG what an actor he is. He deserves a lot more recognition and appreciation world wide. He's a gem of an actor. I am an Indian, but i am an huge fan of international cinema including Hollywood. I have seen many bollywood actors with great acting prowess like Amitabh Bacchan, Aamir Khan, Shahrukh Khan etc... I have seen Al Pacino, Marlon Brando, Robert De Niro, Sean Penn... who are powerhouse performers. But this guy... He can give all of them a run for their money. Iranian Cinema wont be the same after this movie. Its a one time experience which should not be missed. If you want to do a favor to yourself and your family this summer, go and watch A Separation. I promise you'll not be the same person after watching this.",
80,10 February 2016,SquigglyCrunch,9, A Near Perfect Film,"I purposely went into this movie knowing only the highest award that it got (Academy Award for best foreign film of 2011). I decided just to see what would happen, and boy am I happy that I did. ",
81,30 June 2015,gavin6942,7, This is Iran!,A married couple are faced with a difficult decision - to improve the life of their child by moving to another country or to stay in Iran and look after a deteriorating parent who has Alzheimer's disease.,
82,19 February 2012,isaias adames,10, Simin was selfish and cold,"I have always been in love with iranian movies since I saw Children of Heaven and The Color of Paradise. I was a little disappointed with Song of Sparrows, from the same director of both mentioned films and neither was I blown away with About Elly, despite its critical acclaim. But A separation reminded me why iranian films are among my favorites.",
83,12 February 2012,uttiyo-sarkar56,9, Great Story And Great Work From The Director And Cast To Make this into one of 2011's best.,"At First I Was a bit hesitent to watch this movie,as I've not seen many Foreign Language films in my life,But this movie convinced me to see Foreign Language films more. A Great And Intense Movie along with a great and realistic script and great direction by Writer-Director Asghar Farhadi, boosted by excellent performances from the whole cast to make this into one of the best movies of 2011.",
84,12 November 2011,hyder_sagg2003,9, A Good One,"A Separation is a pretty decent movie, Very well made! The performances are brilliant by the entire cast. The story is not very focused on the TOPIC but its done on purpose, to get the attention of the audience. ""ugly truth,sweet lies"".....",
85,8 March 2012,goran-saravanja,9," Splendid, Extraordinary, Wonderful... you name it!","One of the best movies I've seen in the last couple of years. It just shows you that life is not only black and white. Great characterization, one of those movies where you don't have good and evil characters. It is so deep and well developed, simply filled with greatness and if there was more justice in this world this movie should have won more than ""only"" one Oscar. Every character is well implemented in the story and it just keeps you in front of the screen until the end. Please see this movie, you won't regret it :) Iran seems to have very talented actors and directors. I'd give 10 to the acting, especially to the young girl Somayah and Peyman Moadi as well. I'm glad I discovered this actor and I hope so to see him in more movies. Really really talented. I promise you, you'll enjoy it. Prepare for the greatness and please see it in the cinema because you'll enjoy it more.",
86,29 January 2012,gotmachine69,10, Phenomenal,"Leading up to the Oscars, I like to give my attention to the films nominated in the main categories. Foreign Language is usually a favourtie of mine since foreign films seem to capture the genuineness of human character so much better than ordinary American films. A separation is no exception.",
87,21 April 2012,stratsz28,10," Absolutely captivating, a flawless film","A gripping, dialogue-driven film about the struggles of two Iranian families, A Separation stands out as one of the best films I've seen in at least two or three years. ",
88,10 January 2013,SchimoCro,9, Drama at it's best,"Last Asghar Farhadi's family drama is definitely one of the best films of recent years what is evidenced with 59 awards won by the movie including Oscar and Golden Bear, and a total of over 80 nominations. Farhadi is highly respected Iranian filmmaker who has in the past ten years gathered over 20 international awards and was this year ranked among Time magazine's 100 most influential people in the world. A Separation is the story of an ordinary Iranian family. Mother (Simin) believes that it is better for the life of their daughter to leave Iran and move to the west, while the father (Nader) wants to stay in Iran and take care of his sick father. Conflict leads to the separation of Simin and Nader. Then father's new guardian steps into the story. She accuses Nader for a physical attack in which she lost a child. Although story is seemingly very simple, screenplay is definitely one of the best in recent times. Deep, complex, with great characters that are hard to forget and with authentic depiction of lately demonized Iran. Although a good portion of the cast is relatively amateurish, except Leila Hatami (Simin) and Shahab Hossein (guardian's husband), acting is flawless. The technical part is just as we expect form Farhadi, almost no complaints. One of complaints that goes to technical part is unuse of music, but although some scenes would made better impression no one can say that Farhadi's movies aren't great just as they are. Special strong scenes are the ones from courtroom, starting from the first scene of dialogue between Simin and Nader with the judge which lasts for more than three and a half minutes and which immediately announces way of filming that is only possible with perfect acting. Characters that look so realistically is almost impossible to find. Brilliant movie that is definitely one of the best of 2011.",
89,25 April 2014,jackasstrange,10, Simply Fantastic,"Wow, oh ho. That's how it's done, boys. Simply breath taking. Is easily one of the best films I've seen in the last 6 months or so.",
90,28 May 2012,dierregi,2, A – yawn – separation – yawn – is hardly about a separation,"Probably one of the most boring movies I ever watched in my life. Even the title is misleading, because only the first and last scene have something to do with the actual separation. We see Simin (the wife) and Nader (the husband) in front of a judge debating the reasons why they want to split. Actually, Simin wants to split, Nader seems not to care one way or the other – which certainly does not give much motivation to continue a marriage.",
91,9 January 2015,MikeyB1793,1, in a Loop,This film is in a loop – a vicious circle. The couple argues – they go to court – they argue some more. They bring more and more into the argument – the care-taker woman caring for the son's senile father. Then the care-taker woman's husband joins the fray. Their children join in. They all argue – and they go to see the judge – which is incidentally like Grand Central Station.,
92,16 January 2012,s-arasteh,10," Shredding!! multilateral in metaphors, prevaricate in portraying life...","Where there is limitation, lurks beauty and art. This best justifies why ""A Separation"" engulfs the viewer to contemplate on more than meets the eye on screen. In a cinema (Iran), which barely leaves any room to openly debate, or perhaps pitch into beliefs and disbelieves, this gem ingeniously sneaks out from dilemmas involved in matrimony state of a couple, depreciated and devastated enough to take refuge in a separation. ""A Separation"" is about inability of judiciary system when it comes to moral phenomenons, while ironically implies on corrupted legal systems and its vicious regression. We are being asked by many complicated questions during the entire movie. A predicament where an immaculate child is condemned to confess what is not ethically right, nor is true, just in order to sustain the union of her semi-disjointed family viable. Farhadi masters the story while developing it in such a way which incapacitates the viewer to make unequivocal and straightforward judgments by asking labyrinth-like questions within a situation where all of us could have been through. Last but not least, through the entire movie the viewer is somehow being interrogated about the inevitable intersection of religion, faith and beliefs.",
93,23 March 2013,chunkmeal2,10, One of the best movies ever.,"This movie won the 2011 Oscar for ""Best Foreign Film"", but really it should have won the Best Picture, as it was easily far better than ""The Artist"" or any of the other nominees that year.",
94,22 January 2012,thegodfathersaga,9, an un-stylish film examining human interaction,"there's nothing stylish here; no beautiful cinematography or amazing shots that takes ones breath away.. the attraction here is the characters and the way they are built throughout to lead us to their actions; one example is when Nadir, the lead, sends his daughter to return the tip back from the gas station worker, because it simply isn't fair.. this kind of character establishment indicates and assumes a lot of what is to come. the storytelling and the story in itself are extremely enthralling and gripping, addressing, but never allowing for a definitive statement on its subtly raised themes, truth, honesty and the characters' self-interest. the story is tangled up and weaved real intricately, causing the characters to be in difficult and challenging moral positions. however, to me, the film was perfect in the first two thirds in its course, until it took a slight turn away from where i was hoping it would continue. nevertheless, the film ultimately handled itself laudably till end.",
95,26 April 2012,paudie,9, An amazing movie. One of the best I've ever seen,"I have never been as tense watching a movie as when I watched ""A Separation"". But is not a political thriller or an action movie filled with car chases. When we watch those types of movies we know that the events we see will never happen to us so we can sit back and enjoy them.",
96,3 March 2012,mm-648-568816,10, Who is right? Who is wrong? Isn't that the cause of all killings?,"This movie is an absolute success from the cultural point of view. First of all U have to understand that making movies in Iran is NOT easy! Lack of funding is the main reason, and then the red tape with all the government prohibitions and censorship.",
97,17 October 2012,oanaioan,10, a masterpiece,"Watching this wonderfully simple and subtle film I realized that cinema as an art is alive and well in the world and all you need is to know where to look for it. It is the story of a couple,Nader and Simin, who want a divorce. They do not hate each other, they just want different things from life, amongst them, the most important one : where to raise their daughter.Simin wants to emigrate, probably to the West(we find out at the end that she is an English teacher)whereas Nader wants to stay in Iran and care for his ailing father. The facts are simple enough and the film takes on the task to peel this onion and show us the layers of the story. Nader is an intransigent and moral human being who doesn't want to leave his father and his country(the Alzheimer stricken father is such a symbol for a country that lost its way and identity). He cant't relinquish the past in order to build the future(the daughter,)he wants to reconcile them. Simin, on the other hand is portrayed as more materialistic( she counts the money)and superficial(she wants to leave everything behind and start anew. In the end Nader is forced to realize that he doesn't live in a Greek tragedy,that life is full of compromise,that you need the support of the others that truth is not absolute and being a hero seems impossible in the modern world. Simin, on the other hand reveals her humanity, her love of her husband and daughter but she ignores Razeh's plea,either from selfishness or disdain for her superstitious type of religion. The child is the one to chose in the end what kind of future to have, what country to live in, what kind of human being she wants to be.Whichever way she goes I feel that she understands better than her parents that we,human beings,have to struggle to remain pure but cannot do so at the expense of our compassion and humanity.",
98,20 May 2012,DevikaSethi,9," Of many, many shades of grey...","A great film does not require special effects. It does not require a suspenseful plot, action scenes,famous faces,dramatic twists and turns and an unexpected ending. A Separation is a triumph of the art of storytelling over the glitz and gloss of these other elements that are so much easier to find in today's films. The film is not for children, but it is about children, and about children who grow up into people who look like adults, but whose conflicts are enlarged versions of playground scuffles, but with much more serious consequences. A couple decides to separate, and there is a child involved, as well as an ill parent. How formulaic this could have been. But Farhadi has created, with these basic elements, a narrative of such power and meaning that it carries the viewer with him. It is impossible to remain detached while watching this film, which is as much a commentary on class and gender in modern-day Iran as it is on the power (and spaces outside) of the state, and on changing dynamics in modern families. Simin, the wife who wants to leave Iran, never spells out clearly her reasons for wanting to do so; her claustrophobia is implied, and her husband is not the major cause. Simin has choices of which Razieh, the maid, cannot dream. Yet, Razieh for all her troubles, is less troubled that Simin. Nader, played brilliantly by Payam Moadi, is clearly a good man, but his actions are questionable at times. This a film about the human condition, its dilemmas and conflicts; it is not about resolution of these, but rather about the impossibility of resolution.",
99,13 March 2021,christopher-underwood,9, Remarkably effective and affecting film making,"Initially this is seemingly a simple and straightforward tale of a couple with a vulnerable father and teenage daughter seeking a divorce. Being from Iran, this is interesting enough as an insight into the surprisingly modern world of that country. But this subtly develops into so much more and although all appears to happen before our very eyes, all it seems, is not what it seems. The central performances are amazingly affective and it is almost as if we were a fly on wall and as for everyone around the main characters are as if part of a documentary. It reminded me of some of Ingmar Bergman's work in that the drama seems to come out of the very people we are watching and we find ourselves struggling to get a firm grip on what is truly going on and what has really happened. Remarkably effective and affecting film making.",
100,29 January 2012,asilanee,10, A haunting masterpiece.,This is unlike any movie you have seen. ,
101,12 March 2013,bob-790-196018,9, Relentless Series of Misfortunes Driven by Male Pride,"This is a gripping movie in which emotions run high and personal animosities generate one conflict after another in an ever-intensifying series of troubles. The result could have been dizzying and confusing, but ""A Separation"" is so well-written, and the characters so vividly portrayed, that the course of events is clear and the outcome inevitable.",
102,10 February 2012,giriayush,10, Absolutely Brilliant!,"I would give it 11 out of 10 if possible........I mean this movie is perfect.......Though the story is quite simple the way the complexity arises in this simplicity is superb and engages your mind through the film This movie will someday be listed as one of the greatest films ever to be made.........I mean this movie is flawless and computerization is so good.......Direction, Screenplay and Performances are unquestionably better than great........A MUST WATCH",
103,20 February 2013,kaljic,10, Simply Riveting. An inspired masterpiece.,At the time of this writing there are twenty-seven five-star reviews of this movie (twenty-eight including this one) and no zero-stars. There is little this reviewer can add to the reviews already on this website without repeating what has been said. This work is an inspired masterpiece. It hosts a well-written and constructed script; full dimensional characters which are not cardboard caricatures given to us by Hollywood; real-life situations that are totally believable and to which anyone can identify; the acting is; perfectly executed and convincing acting; and strong direction.,
