Review_Date,Author,Rating,Review_Title,Review,Review_Url
261,29 April 2020,h-28658,8, A great movie.,"How does the director make you feel sympathetic towards each character?How do we judge others-law,religion,personal experience,morals?How do our decisions affect others?The movie continues to twist and turn and I enjoyed the ride.",
262,26 May 2022,SajjadMdoost,10, Still worth to watch,Nearly a decade after effluence this movie is still new to me. I recommand you to watch other Farhadi films as well. Farhadi movies shows the reality of iran Society.,
263,20 April 2021,sinadelsinagood,10, The best,"As an Iranian, I am proud of this film that has passed 10 The year is still one of the best movies. An excellent drama film mixed with beautiful Persian culture. With unique actors .",
264,3 May 2020,zeekwunlau,8, Painful life is a mess,"As the final dispute gradually unravels, and the daughter's final entanglement, it is still very deep to look back at the whole plot, but it is still a bit of a test of endurance through the whole article. Why is this so?",
265,10 January 2020,Dr_Mark_ODoherty,10," Great Iranian film, with a very profound and complex plot.","Great Iranian film, with a very profound and complex plot. The issues of immigration, divorce, child custody, separation amd miscarriage - and also care of parents challenged with Alzheimer's disease - are not unique in Iran; but of course also apply to so many other families in today's world.",
266,19 December 2018,vahidn,9, A separation,"Great plot ,directing and acting
A pure drama movie you can touch
You must watch it.",
267,8 December 2012,movie4545,1, An Oscar....really? Overrated.,I thought for sure this would be a good movie as a ranking of 8.5 would imply so. Not even close. A Separation is boring with a horrible storyline. I have no idea how this movie is within the rankings of other great films. I almost turned it off within the first 20-30 minutes but held on for a great ending that never was. I will not be joining the bandwagon on this one. Don't waste your time watching it.,
268,21 December 2021,redbear_8968,1, Who lies better?,"Farhadi uses lying games in his movies often, but it just worked well for "" Firework Wednesday "" and "" About Elly "". Here in "" A Separation "" it's become boring.",
269,28 March 2022,sumanth-05484,10, Speechless,I am Speechless .,
270,27 April 2020,krational66,8, Plain,"It has always been said that a master's film is just not the same as a small-budget film, and that it must be compared with a movie that is often worth billions of dollars and is full of slick techniques. But when terrence malick came close to science and dissed covery, and woody Allen dropped his book bag and went to Paris, it was a rare, quiet, story-telling movie. With a budget of $300,000, it is estimated that tintin will cost less than a second.",
271,30 April 2013,gusauyeung1,10, to be or not to be,"A very thought provoking film. It asks the audience to be in the young daughter's shoes who was charged with the question which demanded a King Solomon's wisdom. And the audience went back over the film frame by frame and each according to his or her religious belief, cultural background, philosophical persuasion and social class would come to a different conclusion. Who is right and who is wrong? Or is there a winner no matter what is the decision? The film starts with a choice- personal fulfillment or filial duty overlaid with matrimonial complications. People from the west would vote for individual freedom and aspirations-maybe and folks from the east would frown upon a dereliction of filial obligations-maybe. Then the film introduced a compromise by a religious woman to earn income for her family. Again certain religious people would forbid such an arrangement- woman taking care of a man no matter how elderly or infirm and lay people would approve of her diligence. Then the film brought in a civil matter. Was he guilty and deserving the harsh sentence imposed by the law of the land and if not was the victim not deserving to be compensated? Did the parties involved not stretch the truth or hide the truth? Folks with European background might prefer the truth and nothing but the absolute truth and likewise folks with less stringent legal culture might prefer a folksy conclusion. Then there is the social class angle. Does the victim from poor background have the right to resort to violence or the well-off can hide behind legal wrangling? Then there is the middle ground but religion would complicate it and civil laws would not recognize it. And the teenage daughter with all the innocence of a newborn and the conscience of a common man would be required to make a choice and she is us the audience. The film did give us a hint. A man might win the war but lose the world and that might be the universal truth –east, west or middle east. A must see film.",
272,3 February 2018,aronsmithier,9," Nice movie, heavy on the heart","I've a friend from Iran, so I asked her to suggest me some Farsi movie. Though it wasn't her favorite movie she suggested me this one.",
273,27 January 2012,amir-single0098,10, This is a great Drama film,"This is the best Drama Film If mainstream cinema leaves you soulless, see this film.",
274,10 May 2020,kuangzao,8, The gap between people,"The gap between people, the confrontation between classes, the dilemma between faith and reality. There is no right or wrong, only the difference in position and helplessness of the status quo.",
275,28 April 2020,f-57307,8, great!,"""Very light movie and heavy life"". There is no perfect life.",
276,28 March 2021,ansharora-12638,8," Absolutely amazing, but...","Yeah it was amazing, realistic and filled with brilliant acting, but it wasn't what I expected, at all. Well, I expected an emotion and music driven movie about, well, ""a separation"" which I guess is too much to ask given the title of the movie right? A courtroom drama filled with upper and lower class fight was not what I had in mind before starting this movie.",
277,17 July 2013,navid_kia94,10, A Masterpiece,"What I love about this movie is the fact we all have genres that we are not a big fan of , some of us like the movie to be as complex and as dark as it gets and some of us want the movie to be plain and simple however as I left the theatre and talked to the people who saw the movie with me I was baffled to find out that it didn't matter if you are a movie buff or rarely watch movies . A Separation has this magnet-like quality to it,that makes you so connected to all the characters as they all are standing up for something that you could sympathies with . Nothing is black and white as there is no such a thing as pure evil or pure good and this masterpiece directed and written by Asghar Farhadi couldn't have shown and proved this point more elegantly. In words of the late Roger Ebert A Separation "" will become one of those enduring masterpieces watched decades from now.""",
278,24 November 2020,Naoufel_Boucetta,9, What's morality ?,"Very intense and dramatic Iranian piece that brings the perspectives of ""morality"" into question. Throughout the film Asghar Farhadi didn't show his own opinions he used instead his excellent narrative and dialogues to manipulate and test the audience's moral judgements. A great achievement.",
279,13 February 2012,cynthia_a_salloum,1, sorry but this is ...ABSOLUTE RUBBISH....,"I could nor believe myself watching this movie, and i don't understand the rating , I mean 8.8 , come on people, what happened to the great international movies, if you have seen ""flower of war"" which is also nominated, you will know what I am talking about, no comparison whatsoever, we have seen masterpieces, the best example I can give is "" the lives of others"" and many more, but this, is a waste of time, no plot, so storyline, very poorly directed , and least of all, so boring, I kept on watching just to see or maybe expect a twist or something but nothing good came out of this movie and i ended up wasting 2 hours of my life for this, a complete waste of time. It does not measure up to the list of movies competing with , which makes rethink of the whole golden globes, Oscars, too bad we do not have a taste anymore in movies.. sorry to say but considering myself as a great movie critic, i was very disappointed..",
280,9 April 2020,r-48240,9, This movie is very engaging,"The Golden Bear best film is a masterpiece dedicated by a country surrounded by war and religion. A large number of hand-held lens, with objective and cold lens, tells the trivial and conflict of two ordinary families. The characters are created successfully, and the suspense of the story depends on the appropriate control. Until the end of the movie, the audience is still in the mood",
281,30 April 2020,IreneWatsonC,9, Tragedy,"In the movie, the law makes people have to tell lies, and the belief makes people dare not tell lies. In the final analysis, it is all for the sake of profit and avoiding misfortune. After watching this tragedy, I was silent. Love, affection, and faith are all beautiful emotions. But when these beautiful emotions conflict, people also have to endure painful choices. After tearing away the mask of warmth in life, we will eventually find that we are not embracing life but are enduring it. Don't say love easily, and don't say goodbye easily. A separation may mean no longer meeting for life.",
282,7 April 2011,nimanourbakhsh,8, about vote film and vote,"its a film by asghar farhadi.he is e one best Iranian directors now and in this film we can see he's progress so clear.In he's two previous film's we think about a sin or mistake and after see the film we think about the others reaction's but in here we are in our life and we can feel all of the peoples who live in the story. we can feel ""Terme"" and farhadi could show his choice and we can enjoy of see that. but about the vote I see some of IMDb's user's are surprised and some of them are nervous ,i want to say to them Iran have a feeling people and today we have so political space about all of issues.This film is on of most political issues who this vote is a reaction about that who cant decrease the value of if it.",
283,21 July 2015,zalouteacher,4, Another brick in the wall,"Although I enjoyed the movie since it's a part of my learning of Farsi, I didn't really find the catharsis that I expected in the beginning. the movie was quite rushing to the end without a careful consideration to what we, commoners, could have caught with these accelerating events. In my opinion, the producer couldn't implicate the viewer to be a accomplice in his project of depicting the under world of the Iranian family, namely, the ghost of divorce. What are we supposed to do as viewers? the cast didn't let us in. Also, the climax was a little mountain that took but minutes. Added to that, the movie hints at the cultural breach or xenophobic trend toward what is Arabic. In one of the scenes when the daughter was rehearsing some vocabulary with the help of the father she came across some words that are from Arabic and she chose them. The reaction of the father was negative by stating that it should not be Arabic. Yes, Farsi is considered among the oldest languages in the world but that didn't prevent it from borrowing or loaning new words like "" mother"", ""father"",..etc.",
284,1 November 2020,sudhirkumarpal8,8, To the point and thought provoking.,"A must watch for anyone who is planning to get married soon. The expectation in a marriage and in a family. What it takes to make it work just like any other job.
Earlier I used to think the marriages were simple and smooth and the movie debunks that myth so clearly. Explains the behaviour of my parents some years back. But overall it's a big change from the bachelorhood to the family thing. And one should go for it only when one is prepared for that other wise it'll make life worse, if not the same.
Well! back to the movie. The storyline was amazing, especially the way some different plots were intertwined together. The story transitions so smoothly between the plots and at one point one is hardly able to tell the one from the another. The movie feels whole and complete with no loose ends left. At the end what we are left with are our own expectations and decision with the corresponding consequences be these good or bad. It's shocking to see that people still make the wrong choices many times despite the obvious consequences. Nothing can put it so good as this movie. It's like a mirror to the family life.
The characters were so perfect to tell if they were acting at all or may were so natural that they didn't need that. Living and stuck in an orthodox country run by the religion, where you have to call the priest to ask for permission to help one elderly incapacitated man. The pain of the same was so clearly visible on the faces of the characters, especially Simin's. In this case, for the unprepared the choices can get really tough and confusing. 8/10 for #ASeperation2011 8/10.",
285,22 February 2020,ali-fakouri,1, Nothing special,"If you haven't seen , it there are plenty of good movies to watch, don't waste your time.",
286,18 January 2020,tejrahul,10, My vocabulary is failing me.,"Here are some cues for why I deem it to be a GREAT(really great) film:
>The performances( literally everyone's) were breathtaking. Just felt like watching the not so simple lives of entwined people.
>And the directing, editing, and cinematography effectively constitutes it to feel very, I mean very real.
>The absence of background score seriously add to its aim. And it finally comes at the end, but it is nothing but our heart strings.
Keeping aside the technicalities;
>The film predominantly works on its complex and humane DILEMMAS.
>The portrayal directly makes you feel the complicated and nuanced nature of connection of human actions and their situations and intentions.
>It presents the moral paradoxes associated with a law which is too rigid(or incapable) to examine the nuances of actions in a way that it deals more with questions rather than answers, because the film doesn't want to make the situation look clear and simple, because it's not.
> The symmetry present in self-examination of conscience of the characters.
>The things we do are direct or indirect results of our situation and need. This is what makes the story and characters self-reflective which creates complications.
>The situations presented often lead to blurry judgement.
>Those are nothing but a thread which is so entangled that it is impossible to make it straight and clear. AND SO IS OUR LIFE.",
287,22 July 2021,vaishavjoge,10, I am speechless,I cried at end of movie...such a emotional story..talented actors..hearttouching dialgoues...developed huge respect for iranian culture...love from India❤❤❤,
288,21 March 2020,jieer-95276,8, The world is not black or white,"In fact, we have encountered many things that are not absolutely right or wrong ...",
289,16 April 2014,xzcgb,8, AN EXCELLENT watch,"a great indeed excellent film full of idea that keep the film moving and grips the (i.e. this) viewer. It has a twist in every other scene, -- quite unusual as one associates 'twists' in film with the horror/thriller genres - But this is a brilliantly told story, as realistic as it could be, and like I say, rolls along like a dynamo. Some of the critics on this site seem to expect more from it because it's a foreign language production or a 'world' movie; but that's subjective. If I was Iranian, and I went to the local cinema and saw this I would be very proud. Also, I disagree with those who say it's sexist; the male characters portrayed are flawed to say the least.",
290,1 July 2022,meegancheyeneos,5, American hegemony,"On the one hand, the United States relies on technological hegemony to eavesdrop on secrets and unscrupulously spy on citizens' personal privacy; on the other hand, the United States recklessly generalizes the concept of national security and unreasonably suppresses high-tech enterprises in other countries. This ""double standard"" is a typical manifestation of ""American hegemony"".",
291,23 May 2020,o-43050,7, A separation,"I really like this movie so much that I do n't know what to say to evaluate it. This is my consistent state of embarrassment in front of things I like.
Keywords Iran and realism, stacked together was originally a blank area that I haven't known too much, but after watching it, the just plain bland throat was choked, and my heart slowly became calm again.
The story that the movie tells is the kind that everyone may encounter, and like many things we experience, in the end, I do n't know or say no one is right or wrong, and there is no happy or regretful ending to define whether it is comedy or Tragedy, because it does n't matter, our life continues after each decision. What kind of decision does not seem to change the life itself. For example, the last daughter said the name of the mother or father. The ending may be separation.
Reality is added to the color and temperature of the movie, and the director can also present it as it is. The clothes hanger he saw in his daze and the corner of the clothing were slightly raised by the wind. These empty mirrors have nothing to do with the main line of the movie Instead, it presents life itself.",
292,31 December 2013,qanqa,9, An Iranian Family story for All families,"I will confirm any praise to this movie. In a non-European, non-western, 'Islamic' society, a global issue in a family could hardly be portrait better and would be served to the clear comprehension of anyone without any bias and irrelevant conceptualization. There is no politics, no propaganda -at least not like the explicit ones in Hollywood.- You can read the plot but don't do it; you will face a simple family week just distracted with behaviors led by inner psychological situation which sides do not want to express. A though decision (divorce) and events taking place aftermath are narrated without any explicit expression of what is lying beneath. You are experiencing a clear picture of the wisely and pure logically knitted incidents without any intervention and comment by director/narrator/writer. People are to manage the crisis with 'compulsory' communication with various means to convey the messages; including perfect catchwords and dialogues. This simple story will make you reconsider: 1. Family relations 2. Role of daughter between parents especially during the period of adolescence 3. What can be a concrete reason to a divorce passing over abstract reasons and the shared past to stay together. 4. Elder-care at home 5. Law, court and justice .....",
293,13 May 2015,yaizapez,9, An exciting thriller disguised as a realistic movie,"I had not idea what to expect when I started watching this movie. The title suggested something like a romantic story, and as the film is Iranian, I thought maybe it was about a forced separation of two lovers because of political reasons? It's quite the opposite. And the fact that it is from Iran gives only a background: This is not an ""exotic"" movie. And it's not romantic at all. At least not in the traditional way. This is a movie about how two people grow apart, how a relationship deteriorates because of the circumstances and communication gives way to misunderstandings, about how hope and a project together turn into disappointment and exasperation. And this is told in a way that makes the film so original and thrilling I'm still thinking about it some days after I watched it. There is a brilliant dialog in the movie that condenses all the drama of a separation: - But you said it wasn't serious. - Well, it became serious. Perfect.",
294,15 October 2012,cldcls,1, Disappointed,"I was very excited to see this foreign film as I am a big fan of non-Hollywood movies. I saw the movie thinking it had a fresh and different theme for an Iranian movie. Most of the Iranian films I've seen relate to religion and traditions in the Arabic countries. I was also surprised to see Iranian women having a very different life style- The last Iranian movie I saw was ""The Stoning of Soraya."" Again, I was pleased to see a different movie. The photography was also great. The actors performances were very realistic. The grandfather really looked as if he was suffering of Alzheimer. However, I was really disappointed with the ending of this story. I was left with the feeling of an unfinished product. Who did the girl choose to live with? Whatever happen with all the lies told by the everyone involved in the abortion? What about the poor grandpa? Is the woman going to leave the country with her daughter? Did they finally get divorced? Anyway, very disappointed.",
295,17 April 2011,bhomaii,7, It's only good when compared to other Iranian films.,"Last week, despite the fact that I normally despise Iranian movies, I went to see Asghar Farhadi's ""A Separation"". To make a long story short, the film was more or less disappointing. It's not that it was not good, but that it had nothing to offer internationally. I've seen movies by Fellini, Truffaut, Godard, Chabrol, Bergman, Korosawa, Tykwer, Kubrick, Lynch, Fincher, Burton, Allen and other genius minds in the universe of the seventh art; and this movie didn't even have the potential to be compared to their works. ""A Separation"" had a better script in comparison to ""About Elly"", though, to my idea, the ending was pretty immature and not as sophisticated as the rest of the film. Acting was OK, but cinematography, mis-en-scene, editing, and direction still needed massive improvement. Sound, music, use of colors and etc. have utterly been neglected by the director.",
296,3 February 2020,joesiegel,10, A portrait of Iranian society and the consequences of its blind devotion,"I am probably not the best person to say this, I have never visited Iran, and the only information I have had about them is what the media that tell me things at their convenience provide, however I have read enough about this movie and I know that it is a fairly accurate portrait of Iranian society, especially in regard to the dogmas and religious devotion of the Iranians who constantly put it above the laws and feelings but it is something that cannot be done so easily and obviously will bring complications, this film addresses that universal dilemma, but that feels much stronger in eastern society where religious dogmas are even more sacred, the film is not against this, it just proves it, this makes this movie quite risky since this type of countries prefer that their truths are hidden.",
297,15 March 2012,mohebbi1992,10, the Oscar-winner movie and its brilliant story,"everything and also all the success gained by this movie lies under its brilliant story,",
298,6 January 2016,pahus-538-854139,3, 3/10 spoiler alert,If you wanna see movie which has nonstop yelling and arguing this is for you. Seriously I got headache when I was watching this. This movie is so overrated. I don't understand. I had some really big thoughts about this film....and now I'm really disappointed. This is my first review and thats exactly why I'm giving it to this flick.,
299,5 April 2023,cksquare,9, Didn't you say it's not serious?....... It got serious.,"When i read the synopsis before watching the movie, i thought it was going to be a simple plain husband-wife story about incompatibility and their need to divorce.",
300,9 August 2012,Navid94,10, A great mystery thriller made in Iran,"A separation is a suspense thriller like previous asghar farhadi's movies ;such as firework Wednesday and about Elly , a separation is a highly recommended film which won numerous awards such as academy award for best foreign language film as well as golden globe for the same category and golden bear for best film from Berlin film festival and so on...",
301,1 January 2020,robusm,10, Still one of my fav movies even on the third watch,"It's holiday season and I'm feeling extra masochistic and watched this one and cried bitter tears to the end. As an Indian guy, I understand the religious and societal pressures everybody goes through in this story and the nuances that carries. Love this movie!",
