Review_Date,Author,Rating,Review_Title,Review,Review_Url
100,30 March 2020,Massimovic,10, Perfect,"Turkish drama film You may be able to swim in a quiet river without waves or swim in a waterfall and do not pursue the waves The hero was swimming in the ocean amid the tsunami The film tells the sad story of a young man who gave his life for the press and his country, and during the coup in Turkey 1980 come symptoms of the situation on his wife and forced to descend in the height of the crisis and on the night of curfew there are no ambulances and cars, forced to move to the hospital fails the husband and tries to generate in the street to save the situation, and his wife falls dead after birth and keeps his infant son becomes sick and remain sedentary next to his wife find military police officers are arrested in the breach of curfew breach and is being interrogated by the military police, which constantly attacked his policy as a journalist to be imprisoned for a period of Time to come out of He was imprisoned to find his son who was taken care of by a neighbor and received his son and he remains to find him after the successive slaps of life so he decides to return to his family in the countryside. To his family and leave the country and his father's estrangement to marry the mother of his son, who died and works in what does not love his father and now surprised the hero",
101,7 December 2005,sencanoytun,5, Perfect..,"""Men don't cry"" a Turkish Proverb.",
102,10 February 2020,erginaylak,10, True 10/10,"No movie has ever moved me as much as this one! I cried like a hysterical mad woman. The acting is superb, the little boy is amazing !",
103,11 May 2019,ovgu,10," Don't miss any moment with beloved ones, never!",Best movie and script of all time. This is undoubtly true for most of the watchers of rhe movie.,
104,31 January 2006,baglioglu,10, it is worth to see- a family tragedy,"The best Turkish movie I have ever seen. You will taste all kinds of feelings at the same time. The relationship of grandfather father and sun is illustrated excellently. Also the structure of Turkish family is described well. The local accent is used very well. Also the scenario is well structured and reflect the Turkish culture well. The beauty of Izmir is also worth to see in the movie. This movie will make a revolution in Turkish movie sector. I hope the director of movie will be a world wide director soon. If you liked this movie see the director's other movie ""Mustafa Hakkinda Hersey"". I will be looking forward to new creative movies...",
105,5 May 2019,rydan-00086,10, True Story,I Love This Movie Because Of True Relation of one father and son i strongly recommend to every won please watch at least one time you must proud of your father and son bounding,
106,3 January 2016,kristianinataleli,9, The story is very deep,"Its story is very deep,after as real life. Çetin Tekindor's acted was represent. More again, when Fikret Kuskan aka Sadik was dead. Visible he was hurt with Sadik's death. Its film is as puzzle. First, when Deniz was born. Not hot, not rain, suddenly Sadik was prison. After more far, I know the reason Sadik was prison, because his activity as journalist. Can accepted mind. Two, after death Sadik, when Deniz tried video camera from his grandpa. This really dream or not. For this,I can't more speak.",
107,20 January 2006,xeynep-1,10, touching,"you will have a lot of fun, an also tears in your eyes... it's a touching film about family, son-father relationships and the political history of Turkey through 80's. Character dialogues and family scenes are so natural that it's inevitable to appreciate Irmak's success. Actor's performances are also clearly outstanding! The film talks about a close history of a country, by perfectly harmonizing the historical and political history with a totally personal and emotional relationship between sons and fathers. In Turkey, the film made such a great success that for months, it was really hard to find any tickets before reservation. Cagan Irmak is a great director who manages to make the audience feel the warmth of relationships and life, by creating natural scenes of village and city life, affairs between people and struggles of human with himself or outside.",
108,20 November 2016,DogukanGultakti,8, mopey story and family relationship,"On an individual basis, I like this movie because it includes everything about the family relationship as dram, sadness, humorous, compassion, hatred which are actually explain family relationship. Besides, movie starts from 1980 Turkish coup so we can learn Turkish history as well as we can understand difficult situation on that time in Turkey. Also, we can enter the child's world who is a motherless. I do not know someone who did not cry in this movie. I remember my grandpa and my father when I watch this movie, I remember my childhood with amazing soundtracks. Both ""my father"" and ""we will meet again"" songs are so emotional and mopey and these songs help me to trip down memory lane because all childhood memories are actually mopey for me.",
109,16 July 2019,tylerberryman-70101,7, Turmoil indeed,Man this was on the verge of being one of the best movies ever made and then it just stumbles to a weak climax in the end. OVerall i still really liked it but it had more potential. The story was awesome,
110,5 July 2020,danielpereira-ramirez,9, A common feeling to many in this world.,"An excellent film, not extraordinary, but it appeals to a feeling that many of us who belong to countries that have suffered dictatorships have: the intense pain inflicted on thousands of families with loved ones who have disappeared, tortured and massacred in the most cruel way. Fortunate are those who have not suffered closely.
By far I liked Salim's role more, apart from the boy whose acting is compelling. The other aspects of the film are of good manufacture.
PD: Translated with google, you shoul enable posting in other languages.",
111,6 April 2020,paulvarghesedu,10, Live Life on Screen,The people are so original like they are really living on their life. Makes me cry through out the movie.,
112,6 January 2019,s_isildar,1, Umm..no,"Am I the only one here who finds this movie pathetic?
Full of cliché and overacting.. total waste of time. Sorry..",
113,24 April 2017,rafi-jif-202-341132,10, Par beyond Excellent,first of all i don't understand Turkish but with the help of sub i watched it simply its the best movie i have ever watched and i assume it will stay the same until end of my lifetime !! every single character in the movie was so perfect i was speechless ,
114,8 June 2017,mehmeticme,10, The Best,"""When people grow up, have they shrink your dreams?"" Babam ve Oglum is the movie for who say i never cry. This is not just a movie, This movie is as real as real life. The film is so emotional. You will be both happy and upset when watching the movie, because you will understand the value of life, decisions, family. I have watched a lot of movies but never felt that much. This movie really manages to connect with the audience. You should don't think, you just watch.",
115,1 March 2017,azizkayihan,10, An amazing film that shows coup and post-coup issues!,"Babam ve Oğlum (My Father and My Son) shows the post-coup relations between people and in families in Turkey. In Turkey, on the countryside having higher education have been seen as an act of communism by many during the 50s and 60s. This brought families, and family members against on another. ",
116,18 February 2006,bloodbilge,8, Great Actor ; Cetin Tekindor and Very Good Movie for Turkish Cinema,"Classic Turkish Cinema Style, different from Hollywood, far away from commercial tags, and more talented about showing the feelings in reality. there is no such pre-rendered emotional attacks , and yes sometimes -specially in comedy parts- so many absurd acting and personalities are popping up, but it is so natural end embedded into story and characters very realistic and pretty.",
117,30 July 2022,adibullahadib,8, Masterpiece of Turkish cinema,"When I started the movie I had not good feeling about this movie because of Turkish series and I guessed maybe this movie is like them, but it is not. It touched my soul! Made me cry and made me laugh.",
118,22 January 2006,volkan1542,10," As usual, I was determined not to do what everyone does while watching this movie, but I couldn't resist myself when the second half of the movie started...","As usual, I was determined not to do what everyone does while watching this movie, but I couldn't resist myself when the second half of the movie started...This movie is probably one of the best cultural artifacts to represent the sentimental complexities related to the 1980 coup and afterwords. Çağan Irmak, the director, and many of the cast members who work with him are already successful in show-biz and I really appreciate their work and this movie might be their best. The movie has become a blockbuster in Turkey and i think it deserves this. I suspect most of the movie-goers are not that interested in the political engagement but find something that touch their sentimental systems... Oh my literal translation of the movie title is: My Father and My Son. For more information, the movie has an official site and there are many comments in the IMDb site. So here is the crying ratings: Sündüz, Çetin's wife, cried most, then came Çetin and I was the third in the amount of crying....I find this as a progress since I and my father would cry all the time in melodramatic Turkish movies and my mother would make fun of us:) ",
119,12 September 2020,tarlatanci,10," Whatever you write, words are insufficient to describe","I live in turkey. I have been following Turkish cinema and other countries' cinema for a long time. I bet this movie is the most important movie in Turkish cinema history. The audience has been watching over and over again for years. He lost a lot who didn't watch. The script and casting options are enormous. You understand that the players play sincerely. Everyone will find a piece of themselves in this movie. This movie is the story of you, me and all of us",
120,1 May 2018,cwmikebirmc,9, A story of Turkish people,"One of the important pieces of Turkish cinema. You can feel different emotions during the picture. One time you feel sad and then it makes you smile. You can see all the aspects of Turkish people and culture in the movie. Main characters are well played by great Turkish actors. To sum up, a fine piece to watch.",
121,15 March 2006,vaga-emre,10, excellent,"i saw this movie and it was great i think... i don't want to tell about this movie because you must watch... you must absolutely see this movie... this is the best film i have ever watch... i think if this movie was a Hollywood movie, it certainly take a lot of Oscar (best picture, best actor , best actress...). Especially Çetin Tekindor has a great performance...at one scene i was crying, after this scene i was laughing... i was feel all of sense... sadness, happiness, love, anger... in the end i was feel satisfaction... i will say again and again, this is a best movie of the world...this is a best movie of the world...this is a best movie of the world :)",
122,5 April 2019,HawkeyeXXX,10, The Best Movie in the Turkey,In Turkey this film is still remembered and missed. And also hard to watch again because of its realistic scenario. People tried to hide their tears from others. Friends had gone together to cinemas but at the and of the film they left in a big silence.,
123,13 September 2018,ttsailor,10, The best drama film I've ever seen,It's the only movie that made me cry. I've never been bored watching.,
124,1 October 2006,abdulkadir-ersin,10, This film is unbelievable...,I never cried on a film unless i have seen this film..This film shows how is important the family for Turks..i have seen this film 10 times and i cried all times..it's really perfect film...And this film has a lot of points..it's great thank you Turks..,
125,7 February 2019,raghavmittal2003,10, It's a must watch movie ! Will be always in my top 10,This movie is a story about a dieing father and his relationship with his son and family. This is a rollercoaster of emotions and crying will happen for sure. But I would recommend this movie to every individual,
126,31 March 2017,kaankiska,10, Beauty of being plain pure and sincere...,Great loss if still didn't watch... Art is in the most cases hidden in the reality. It is mostly diversity that makes the cast attractive. İf that makes you lough a second after you cry it is something. A very kind approach to human kind. A clue to hold back to cultural ties. A movie never been boring for even a second.,
127,12 September 2018,utku_kobe_1993,10, A masterpiece,Such a great movie with the Turkish traditional relationship with the family members and the movie gives the audience the best feeling of drama. One of the movie which should be watched!,
128,4 May 2019,timucinhatipoglu,9, AWESOME,This film is so emotinoal. The only film which I cry. Cetin Tekindor is very succesfull artis in Turkey and aslo Director Cagan Irmak is very popular in Turkey. I strongly advice you to watch this masterpiece.,
129,18 August 2017,ilhanparlak,10, cry & smile,"as a man who has watched this film a few times, i fill with tears even as i read the comments here. just watch it, u will have a very special experience. just to fill the lines needed:), another thing that i find out from this movie and the comments about this movie is that people from different cultures and geographies can feel the same emotions about family, father&son etc. this film can touch anybody's heart as i see",
130,20 April 2020,mohamedmohsen-67491,9, Touching !!,Definitely one of the most touching and emotional movies to watch .. could be considered as best or maybe one of the best movie to represent the Turkish cinema.,
131,2 November 2018,azadav,10, An emotional masterpiece,An emotional masterpiece.An extremely special way of presentation.must watch...,
