Review_Date,Author,Rating,Review_Title,Review,Review_Url
49,27 October 2018,krenaras,7, This movie will pull your emotional strings.,"The beginning of this movie wasnt so great for me, it seemed like a cheap drama series. The music was overbearing trying to make you emotional, and it felt kinda cheesy. But as that was over and the movie started you got an actual feeling of the movie that was more authentic than the first part. Even then the music could sometimes be overbearing but it fitted more since we got to know the characters and things had more weight for us. Overall it was well shot, the acting was good. I expected this movie to be more political but it was mostly family drama about relationship between father and son. Although some things were exaggerated for the sake of emotional impact, the movie still held together without being a typical spanish or turkish soap opera, but it still has elements of them none the less. Although it pulled my emotions, I cant rate it very high overall. It gets 10/10 for emotional manipulation but it falls on other parts. Its a 7/10 for me.",
50,11 July 2006,econom-1,10, I have cried first time watching a movie in my life!!!,"The film is famous with its ability to make people cry from beginning to an end. Although it may not affect a foreigner in the same way, for people who lived the era described in the film are moved. The film focus on the coup d'etat of 1980, and how it ruined the lives of idealist people, especially leftist. However, there is more than that... The drama of the small family is based on a contradiction between the traditions of the Turkish rural families and the thoughts of the youngsters of these families. This contradiction is in the minds of these young people as much as it is in their relationship with their parents. Thus, the film both judges and defends the Turkish traditional family structure, first by showing how cruel they can be when a family member is against the ""tradition"", and secondly by showing how compassionate they are when the same member of the family is in trouble. Consequently, the film may not mean much for foreigners but I should mention the fact that I have cried first time watching a movie in my 28 year long life!",
51,3 February 2006,viyola,10, Great movie from a genius director-writer...,"""When people get bigger, do their dreams get smaller..."" Great movie from a genius director-writer...",
52,19 October 2019,selomania-08335,10, Cry cry more cry :(,Best movie if you want Cry and hug your father. Çagan Irmak is perfect director.,
53,29 September 2020,Ahmad_pilehvar,8, Emotional and very heartbreaking movie,"It was a real emotional and heartbreaking movie about a father and a son relation,through the watching movie in couple of scenes I couldn't control myself and it made me weep. sometimes as father you should make right decision but you can't push your child very hard cause it could have an opposite effect. this movie has a great story and almost with good ending. the actors and actress were acting just perfect like it was part of a family real life.",
54,16 February 2006,mustafa-30,10, The best drama of Turkish Cinema of all times.,"The director Cagan Irmak, who became famous after TV Series ""Asmali Konak"" invites audience to late 80s of Turkey. Movie is recorded from eyes of a 7 years-old kid, Deniz. Deniz's father (Salih) knows that he is going to die, and wants to leave his son to his father. But Deniz's father and grandfather have not been talking since Salih's politic conflicts with his father. Salih's father wants his son to be an agricultural engineer and gets the control of the their farm, but Salih becomes journalist and writes against government.",
55,26 February 2020,mujtabasaif786,7, What a bounding of father and son,"This movie is really emotional, it made me emotional. The relationship between father and son portrayed awesome. It was my first Turkish movie that I have seen and I liked it. The movie shows the bounding between family and relatives. I wish everyone lives like this.",
56,30 January 2023,kingturkey-18695,10, I watched the movie crying.,"The script and acting are spectacular. I don't know how the script was written, but it affected me a lot. Especially with these acting talents, it was a great film. I'm one of those people who watched the movie crying. It's been 1 hour since I saw the movie, but I'm still under the influence. At the end of the film, I thought of my father when Sadik told his son, ""When you grow up, you won't need me."" Even though I'm growing up, I need my dad. I lost him at a very young age, I want him to recognize me and i want to recognize him too... every time. But it is impossible... I would like to thank everyone who contributed.",
57,25 January 2019,JakeBrinkman,3, An emotional drama that never hits hard,"This is an emotional drama that, after the opening scene, was never quite able to hit my heartstrings. The story has two, or arguably three, main characters. Some movies are able to pull this off, but this one never seems to provide quite enough background or personality behind the characters to make me feel emotionally attached to any of them.",
58,14 August 2020,yadavanita-18093,10, These stories with happy endings should always be told to others,"Perfect blend of reality and fantasy in a heart-warming flick from turkey, which has elements that many of us could relate and find us in the characters shoes.
The acting is done beautifully by the cast which seems just like everyday household talks with turns of happiness and sadness.
Everyone should once try to see this movie, stepping aside the language barrier and enjoy it's charm.",
59,24 December 2018,Leo_de_Aetas,10, Best family movie ever made,"From the acting and cinematography, the story was stunning and heart touching from the first to last scene. Must watchable movie for everyone",
60,29 July 2018,InTheBackdropOfOblivion,9, Tends to exploit basic and common human feelings.Otherwise powerful.,"I believe every Turkish Citizen living inside Turkey shall watch this film.It's a tragic thing,to watch is to be stumbled and lacerated continually yet it possesses some powerful scenes with serious implications.I must admit this film monopolizes on human feelings that are raw and the director expects a normal,social being watch it.That also means,tragedy orchestrated here doesn't uplift the soul(thus is hollow) and is nothing sublime if we run parallel to the definition of Tragedy put by Aristotle.Yet political overtones are real especially for the present day Turkey that faces brutal rule.Initial antagonism between the father and the son didn't seem very much convincing but this could yield something greater and penetrating in the later parts.In the end,I must admit one more thing.I CRIED.",
61,11 March 2019,dejohan27,2, Medicore,"I felt really sad as this is supposed to be on the highlights of Turkish cinema. I understand every country has its own ways of making movies, own accents and they can be different than the standard American way. The acting is very childish and amateuristic. The overall feeling is over-sentimental and pathetic. The plot of the movie is interesting, universal and something everybody can relate to but the execution is very poor. At the moment of writing this movie is at place 132 in the top 250 and I consider it not to be in its place at all. Unfortunately this is very mediocre cinema, interesting to see out of cultural interest.",
62,18 April 2020,mehadialamsajib,9," The best family movie yet, it's a masterpiece","One doesn't can do all the things, but the Director of this film has. What a realistic story man! What a story! I cried so many times while seeing this though",
63,25 December 2005,hilook,10," The new ""Life is beautiful""","Çagan Irmak, famous Turkish director did it again. His own scenario looks the 1980's from the Egean side of Turkey. The plot organization looks simple, The father decides turning back to home which he left after he had a big argument with his father because of his political choice at the school. Then we learn that he is going to die and the drama leads to an endless crying session. The performance of the grand father (Cetin Tekindor), the grandma (Humeyra) and the father (Fikret Kuskan)is great.",
64,12 December 2005,unalsedases,9, excellent,"The film was excellent. The atmosphere of Agean District, the accent people speak, the cars they drive ( Renault 12) was so original Particularly the performance of Cetin Tekindor (father) in having regret about the relations with his son after his funeral was outstanding. It was so effective that most of the spectators including me watching the film in the cinema could not help weeping. I think Sadik's son will be a great actor in the future. Because his performance at he age of 7 was remarkable. ",
65,12 May 2020,a-65018,8, Incredible,"Very rarely can you find a movie that can make a person shed tears of sorrow one minute, then laugh out loud the next. This is a heart wrenching tale that will make people look at themselves and how they can better their own family units.",
66,14 August 2021,jack_o_hasanov_imdb,8, Very Good,"A lot of people cried after watching this movie. I never cried, but it is a beautiful and touching film. But the little boy in the lead role was always repulsive to me, maybe that's why I never got emotional while watching the movie.",
67,30 December 2005,hndblcn,10, excellent,"This movie is the most dramatic film I have ever seen, I advice you to see Babam and Oglum. Excellent actors were in this movie. There is another excellent point is that you can both cry and smile. Very interest emotion you can taste. The theme was very dramatic, There were a grandfather, a father and a son. I'm strongly advice you to see Babam and Oglum.This movie is the most dramatic film I have ever seen, I advice you to see Babam and Oglum.Excellent actors were in this movie. There is another excellent point is that you can both cry and smile.Very interest emotion you can taste.The theme was very dramatic, There were a grandfather, a father and a son.I'm strongly advice you to see Babam and Oglum.",
68,20 July 2018,MasterShifu,9, Relevant and touching,"This is absolutely one of the best family movies I have ever watched. Actors did a good job in portraying as a family (the love and hate, the comedy) especially the kid (Deniz) that's why they are part of the Top 250 movies of all time.",
69,6 February 2023,erkancmbz,10, A masterpiece that every man should watch before he dies.,"""My Father and My Son"" is a movie that presents its audience with an emotional and thought-provoking story. The plot revolves around the father-son relationship and depicts this relationship through a journey filled with challenges. Particularly, the psychological state of the characters and the impact it has on their relationships stimulates thought among the viewers. Additionally, the music and visual effects of the film also create a captivating atmosphere that draws the audience in even more. Overall, ""My Father and Son"" is a production that will win the approval of audiences as it presents a sentimental and contemplative story.",
70,1 December 2016,hamidullahgenc,10, This Movie Has Now Gotten Its Place,"In Turkey, the leftist and rightist groups were set against each other in the early 70s and later on these ""revolutionists"" and ""idealists"" not only killed each other but also engaged with the police in clashes of arms. Both groups went as far as to do bombing (or they say it was the work of the Western ideologies in play along with the secret state in Turkey). Then the Army staged a coup on September the 12 in 1980 and made thousands of arrests and significant amount of torture went on in the prisons... They even hanged 50 people that were found guilty(!) as they tortured hundreds of people (at least 171, proved) to death... And to this day the good people of Turkey suffers the consequences... Now, if we say that this movie tells one of the many stories of that era, it is absolutely true as ""the father"" had seen the torture and mistreat in the prison for what he had done nothing wrong... His heartbreaking story also reveals so many levels of the culture of Turkey and the bigheartedness of its people... Last but not least, if you ever claim that you have seen ""drama"", and your eyes won't just stop ""shedding tears""; I kindly dare you watch this piece of art!.. I say it is gut-wrenching as well as mesmerising!.. So, no point in denying that the top 250 it belongs to!..",
71,29 February 2016,Ilkerincirci,10, the most emotional film,in the history of Turkish cinema one of the best film. while you are crying you see yourself you re laughing! film starts the coup times in Turkey one morning a baby was born in a day of curfew when military has management of government he lost his mother in his birth after all dramatic fast scene you see the main character he grow up he became five years old he live with his father who has not good healthy during the time curfew he was judged and he spend a lot of time in prison to be journalist a day father (sadik) learn that he is cancer and he will die he decide to leave his little boy to his family when they arrive to house of grand father you see traditional friendly family from Ege region after all conversation father and dad you see your family inside of film you feel all intensive emotion in your all cellular there is a moment in the film you stop breathe ...story go on with the relation son and grandfather ...,
72,5 August 2019,rachelrose-87356,7, Movie Review Profits,Play Babam ve Oglum! It is fast and easy to view! A good way to spend your time. Be the best!,
73,7 August 2006,ozcanfiliz,10, Perfect mixture of drama and comedy!,I had rarely seen a movie which makes you cry and laugh at the same time. This movie shakes your emotions. The crew of the movie is perfectly selected. All characters without exception fits the characters they play. And also the adaptation to the local language spoken at the west side of Turkey is very successful from the side of the players. The musics are also well embedded. It accelerates the flow of tears from your eyes. Wherever you hear these musics you will get emotionally dramatic after all. I can say that this movie is at the top 10 movie ever played in Turkey. The writer/director deserves the best comment.,
74,25 August 2021,briancham1994,6, Slices of life that don't add up to much,"This film has true-to-life feel that makes the viewer feel as if they are part of a great family reunion. I loved all the small moments with the child's imagination, the falling out and the happy memories. The acting felt naturalistic and joyous, without any melodrama. However, I don't think these moments truly cohered into a whole. While there was a compelling narrative arc that developed the characters and the family's backstory, it didn't amount to much for me by the end.",
75,17 February 2009,gumby_x2,1, Do Not Be Fooled,"Based up reviews on IMDb I purchased a copy of Babam Ve Oglum from Turkey with English subtitles. It was not, as hyped, ""One of the best movies ever."" Instead, it was a poorly done, trite melodrama that I forced myself, and I mean FORCED myself to watch for about 35 minutes. I'll admit, one does take a chance when he buys based upon the recommendations of other IMDb users, but sometimes the risk is worth the reward. I suspect that the movie was ""ramped"" up by users in order to increase its appeal, and it certainly caught my interest due to its seemingly high ratings. But let's not be fooled. The $30 I spent for this title, yes $30!, was a complete waste of money. Usually I will try to resell those purchases I make on Amazon and Ebay that don't meet my expectations, but in this case the movie was so poor that I threw it into the trash, not desiring to foist the same foolish film on others. My warning: stay away from this movie at all costs, even if it is offered to you for free!",
76,21 April 2012,tatliperi_asli,10, My father and my son,"My father and my son is very important movie to me.Because I watched this movie with my father.I cried and I was very sad after the movie.My father and my son is telling real life.If you watch My father and my son, you will take napkins.Because you will cry.But some people didn't cry.Perhaps, you the one of the some people.I think Çağan Irmak is the best writer.He is making very beautiful movies.Now, I will give some information to movie.Sadık went to İstanbul for the university.Then on 12 of November,his wife dead but his son,Deniz born.Deniz was a little boy when he went to the farm of the Aegean.There was many adventure in this farm for Deniz.And there will be a lot of events this farm.You should watch this movie.I think,My father and my son will be best movie for you...",
77,18 May 2006,yummy_fruitsandnuts,10, great movie..,"Such a great piece of work is not something usual for Turkey. It's a touching film and as said before nothing to do with super-human powers, fantasy or effects. ",
78,7 June 2020,nnjimdb,10," Very Emotional, Sensitive and Excellent. True feelings of Human beings!","This movie is directed very nicely. It brings us to the true word of emotions. Made tears in the eyes. Deeply shows the feeling of people, effection in a family and how attached everyone In a family is. Every actor gives their maximum to be a success. Very well satisfies of this movie!! A must to watch! Spread love in the short term of the life.",
79,11 February 2006,enginsane,10, A Real Masterpiece,"Even if I'm a prejudiced person on Turkish movies, beyond some other great Turkish movies like Eskiya and Gonul Yarasi; ""Babam Ve Oglum"" is the greatest one i have ever seen. Not in only Turkish Movies criteria, above all else i have seen ever, I can easily consider this movie as my top five. The movie contains the exact Turkish family realities and anything ""Turkish"". The players in the movie are so flawless and perfect on their job; like Cetin Tekindor as a famous actor (I consider him as Antony Hopkins of Turkey) and the great actress Hümeyra are in the leading roles. Besides the players, the creative director Cagan Irmak is one of the greatest young directors in Turkey. A few cheer-up-scenes are not missing even though the movie affects the people with the very dramatic ambiance. This is a really must-see movie for the Turkish people and for foreigns, do not ever miss it if you find this movie somehow. It may be seen as i'm exaggerating the whole thing but i really think that this movie is a turning point in the Turkish Movie History.",
80,5 November 2022,SHEINOL22,10, That's what it had to be,"They explained the relationship between father and son extremely well, the movie is very close to perfect, but some scenes are ridiculous and boring, still this movie is great.",
81,23 March 2023,moritzherz,5," Great, emotional drama!","To be honest I expected nothing from this movie, i just watched it because it is on the Top 250 movies list, but how else should you have ever heard of it? It is my first turkish movie, so I did not know what to expect and I have to say I got surprised how good it is!",
82,17 March 2006,skarasu,10, This movie is one of the best ever made.,"I can just say : ""Shame on you IMDb."" You are scared about that this movie can be the best ever with our votes. So you just change your way of grading. Shame on you. This movie is wonderful. Just watch it and you will understand what i mean. It is better than the most of your top 250. But it is a Turkish movie and thats a reason enough to ignore it isn't it. I thought your site was one of the best sites on the Internet but now I see it is just a site that is not fair enough to accept that a movie made outside the US can be very good. I will never vote again for any movie here. Really I am very disappointed about you. You have to be honest. Just be that. This movie is unbelievable good. The actors are outstanding and the feelings i have had as I watch it makes me cry like i never did before. JUST WATCH IT.",
83,24 May 2020,zzhhhqing,9, The two loves between father and son deeply moved me,"The two loves between father and son deeply moved me, especially when the old man finally opened his arms to make a hug gesture. Through the gaps and contradictions between father and son in an ordinary family, let us experience the warmth of the family, no matter how far away from home, I believe that people who wander outside, whether they have their own new home or not, The inherent sense of belonging can only be truly felt at home. The gap between children and parents is also easy to eliminate, because no matter which side, they are deeply in love with each other.",
84,17 May 2020,h-28658,8, Nice family movie.,A very emotional film about a man who returns back to his village home with his kid. The father son relationship is beautifully captured.,
85,17 February 2023,Drawmort,6, Only for drama lovers,"The film focuses on a small peasant town, in the shadow of a large family. This brings out the humble and warm life of rural Turkey.",
86,4 May 2020,zeekwunlau,8, Crying mess,At first I looked at it a little,
87,25 February 2006,rasim-1,10, Perfect,"This is the best film I have ever seen. I watched 3 times in cinema, but still feeling bad and spirited as the first time..",
88,7 May 2020,krational66,9, Me and my father.,"In fact, until Sadik died, Sadik's father did not understand why his son rebelled, why he left home without hesitation. To close the gap between father and son with Sadik's death is another form of tragedy. This scenario is still played out in this world, because in the face of death, any form of ethical conflict has to give way, and any form of competition is meaningless. Death is the most powerful force and the most powerless.",
89,18 March 2016,sinefili,9, Easy and deeply impressive,Çağan Irmak is the face of the drama genre of Turkish Cinema. Always a simple narrative films. But deeply affect us. Because the handling is as simple as the fact of our lives. We see ourselves in the mirror while watching his movies in theaters. As all Çağan Irmak movies Babam & Oğlum has managed impressive as all this its is deeply.,
90,1 September 2020,a-07779-75123,8, The father son relationship is beautifully captured.,A very emotional film about a man who returns back to his village home with his kid.,
91,28 March 2020,spicy_bee,9, A simple yet complicated life,This movie is setup like some regional Indian movies except there are no songs to dampen the mood. It is a beautiful depiction of simple rural life in Israel following a contrast in city life that is mixed with turmoil and conflict. It covers three generations of a family coming together.,
92,6 May 2020,drmuhammedsamiduru,9, Sadik and Salim,"""My name is Sadik, my brother Salim. Have you been so scared of us, have you wanted to give direction from the beginning?""",
93,22 June 2019,mmustafad,9, Magnificent!,"Director Cagan Irmak has already proven himself in Turkish cinema.I think that's his best film.
One of the most epic Turkish drama films I've ever seen. Maybe even the best.
The acting and cinematography was nice.",
94,12 November 2018,engony00,10, Must-see!,"Being in top 250 is not a coincidence. Extremely emotional. Sadness, happiness, love, family relationships, in a brief, you can find every emotion that we have in the movie. Well acting, good screenplay, enough picture. One of my favorite.",
95,29 March 2020,Rifat_Rock_Don,9, Never Felt Like This In a Movie,"This is the best Turkish Drama I have Ever Seen. In fact this is the best movie of Turks. Story, Acting, Music etc. everything was perfect. It is about 3 generation. Father, Son n Grand pa. Most of the theatre cried many times and in the same scene we suddenly start smile sometimes they were more than smile. This is my reaction in a scene :) => :( => :(( => :("" => :)I would like to celebrate Cagan Irmak and all the actors even children Turkish Movies are commonly made for money but this is not one of them but this will be the most movie ever watched in Turkey this year. I think this is also better than Gonul Y arasi which is a nominie for Oscar nominies.",
96,15 July 2017,khalid_ssb,8, A must see Movie by all family Members,the movie tells the story and the suffering of a Turkish rebellious left-wing journalist who left his village where he used to live long time ago and went to Istanbul,
97,28 June 2019,i_Raj,9, Touches deep inside the soul,"Son, father and grandson - the relation of this three generations with the family was knitted very exquisitely by the producer Cagan Imrak. Big thanks to him for this masterpiece. There are not many directors who could portray this type of intense realism into movies.",
98,13 August 2021,dcec-24641,3, Fell off my chair laughing after around 90 minutes,"The overacting.and clichéd melodrama just became too much. I'm not sure why this is being hailed as some great cinematic masterpiece, because it is anything but.",
99,8 February 2006,mahirs99,10," One of the best Turkish movies I have ever seen , perhaps the best.","A great film by Cagan Irmak.Before watching the film i was suspicious about the film. should i watch or would it be waste of time?.At all this is a Turkish film.But i am so glad that i have seen that Turkish Producers and directors also can make excellent movies. This is the second film of Fikret Kuskan I have seen , and i think i am being a fan of him.Greaat acting , just as real life.Also the other ones acting in film was great.Humeyra,Cetin Tekindor and the child.While watching the film you are not only watching , feeling living those times.If this film was an Hollywood production i am sure Cagan Irmak an Cetin Tekindor would be able to win Oscar.But unfortunately they give Academy Awardas only to US productions...",
