Review_Date,Author,Rating,Review_Title,Review,Review_Url
0,3 April 2018,classicsoncall,8," ""When a person grows up, do his dreams become smaller?""","I'm gradually becoming less and less surprised when I see a foreign film that's every bit as good as those produced by Americans or the Brits. This was my first Turkish film, and for those of you struggling to find it, I would direct you to Youtube where you can find it in it's entirety with English subtitles. As the translated title suggests, the story is about a man struggling to come to terms with a father who disowned him, and his feelings of growing away from his own seven year old son. The back story of Sadik's (Fikret Kuskan) personal history does not fully come to light until well into the picture, when we learn that he became an anarchist journalist, much to the dismay of his father, who had designs for his son to take over the family farm upon attaining an agricultural degree. For viewers with a Turkish background, the conflict that resulted in Sadik's jail time and torture will probably be understood better within the context of that country's history, so for someone like myself, a lot of that perspective is lost. However that doesn't affect the impact of the story when it's finally revealed that Sadik's reconciliation with his father occurred because of his impending death due to a pulmonary edema condition. The man did a noble thing for his own son Deniz (Ege Tanman) by returning him to the village of Sadik's childhood to remain with family and friends. I would challenge the viewer to maintain a dry eye as the mystery of father/grandfather Huseyin's (Çetin Tekindor) 'secret room' reveals Sadim's happy and hopeful youth before he left his family. One comes away from the film with a serene sense of family bond that transcends nationality, as in the end, we are all humans subject to the same emotions of love and loyalty.",/
1,1 January 2010,denpolites,10, A masterpiece that must be seen by everyone!,A masterpiece that must be seen by everyone!,r
2,5 December 2005,ydurgut,8, One of the best Turkish movies ever,"The movie starts on the days of military government, which started Sep.12th, 1980, and lasted 3 years (Effects of this action against democracy lasted more than 15 years). A young socialist newspaper writer (Fikret Kuskan) loses his wife on birth of his only son on the very first day of the military action, because he can not find any help for delivery of the child. After 6 years past, the father was desperate to find any jobs on the papers, which are now supporters of the new order, and decides to return his father (Çetin Tekindor)'s home in a small village near Izmir: A house that he has left years ago fighting his father's wills to make him a person that his father would like him to be.",e
3,2 October 2006,matrixus-1,10, This movie will touch your soul and will not let go!,**** 10 out of 10 for this movie **** One of the best movies ever made worldwide.,v
4,12 December 2005,ethernaldreams,10, An Incredible Movie,"As I watched that movie, I saw the Turkish relationships in the best way that it could be shown. A very good choice of cast is the most powerful criterion of the success of the movie. Humeyra, the grandmother is a very talented woman in acting. Emotional scenes become more frequent while we see the movie to get to the end. Unfortunate events make the Turkish people get closer to each other. The movie shows that perfectly. Hospitality, love, grief, laughs... Everything is included in this movie. An emotional breakthrough. The movie also points on the elderly reality -now an impossibility- the torture, made by the cops.",i
5,28 December 2005,scanan,10," Clever, poignant, brilliant and ""human""..","A simple story becomes a sad and poignant movie about ordinary people.. Every person I know who had the chance to watch this wonderful movie have cried -especially during the second half.. I applause everyone involved in the production of this magnificent piece of work.. Really brilliant work, presenting some top-notch performances (esp by Humeyra and Cetin Tekindor) and a clever collection of spectacular moments. No special effects, no superhuman strengths no fantastic landscapes.. Just human and the ordinary feelings. I felt some rush to call my mom and dad just after the movie to be sure that they are OK and to make them know once again that I really care about them. This movie makes you think deeper on values that make us human and also etches itself irreversibly to your memory by touching the deepest possible regions of your soul.. Highly recommended; a must-see! Do not forget your tissue papers because you probably will not be able to keep your tears from flowing...",e
6,9 December 2012,curreir,10, A Must See!,"Having seen a lot of Turkish films, I do agree with someone writing in this site that this is perhaps the best Turkish movie ever and one that can hold proudly its place amongst the best worldwide. Everything is perfect, direction, photography, acting, you cannot help but feel for its characters and identify with them, especially if you share the same location in the map, similarities in history and personality traits.",w
7,1 March 2009,aswins,10, AWESOME - the word is not enough,"I have never seen a movie ever before, that brings a tear to anybody who sees it, at the sound of a violin, or a single word uttered.",/
8,30 June 2006,snoopx,10, An emotional roller-coaster of epic proportions!,"Very rarely can you find a movie that can make a person shed tears of sorrow one minute, then laugh out loud the next. This is a heart wrenching tale that will make people look at themselves and how they can better their own family units. ",r
9,31 December 2014,ligertigon26,10, Haven't seen it? oh watch it already.,"I am always in search of great foreign movies.I had never seen a Turkish movie and then I decided to watch The Bandit(1996) and loved it! Without any effort i was able to find this masterpiece. I laughed, cried, loved every single minute of it! I first watched it in 2013 and today decided to watch it again. ",w
10,12 January 2008,delasalsa,9, The Mediterrenean way of life..,"This is a very good movie without any doubt! During the recent years there have been made some movies that clarifying Turkey's 70s - 80s. As a person who has been experienced those years, the film became a very big sentimental burden for me. Those were the tough days for many. It is a very touchy story..",4
11,27 January 2006,bane_13,7, Simple and Remarkable,"Anyone who watches ""My father and my son"" will eventually relate the movie to a family relationship they have lived. It is a perfect visualization of what people do because of their ego and what can actually destroy that ego. The movie makes the viewer ask ""what if"" questions about almost everything and the answers will be different for everyone. The acting is definitely remarkable with less experienced characters (including the little kids) putting on a display to remember when aiding patriots of Turkish movie industry. Overall I can say that ""Babam ve Oglum"" is a blending of great acting, wonderful script, and a real life story.",4
12,13 January 2012,ashim_smile,9, great movie,"i am from India and i saw this movie at Bangalore film society, its the most emotional drama i have seen till date and there wasn't one moment where i didn't have tears, i do feel though that the end was dragged. i feel the movie should have ended when the kid videotapes's his dad's exit in the end nevertheless its a beautiful movie with wonderful actors and a great director and every human should watch it",3
13,31 October 2020,Xstal,7, The State as a Tool of Terror...,"The profound consequences that a state, in fear of its people, can have on those people. Achingly sad and sincere, riven with sorrow and emotion, the tragic effects on a rural family in Turkey in the1980s as a result of tyranny, despotism and control. Be prepared to bleed tears into a bucket as your outrage, sorrows and disbelief take hold, in a wholly believable story that could be retold in far too many places around the world, still is unfortunately and, most sadly, still will be while true democracy is ignored - although it is particular poignant the way it's performed here.",4
14,30 March 2006,deg-12,9, Life as it is...,"This film was a real surprise for me. I only saw one other Turkish film before this one (Vizontele Tuuba). The story may not be all that original but the way it is told is just wonderful. Lot's of humor (we laughed a lot) and real tragedy (we really needed that handkerchief at the end). I love the parts where you get carried away in the little boy's dreams. That surreal view shows us the differences in thinking between an adult and a child. The music is what you can expect from a Turkish film. You either like it or you don't. But it's never overwhelming. I really recommend this movie to everyone. And no, I am not Turkish!",3
15,19 December 2005,onel,9, Great acting in an entertaining drama,"The acting was perfect in this movie from the kid (Deniz) to Çetin Tekindor (Hüseyin Aga). All player did their job in a great performance. Also the places the film shot was great. My grandfather lives in a similar village, and I used to go to there in summers in my early ages. I went to back again to my childhood when I was watching the movie. It reflects the life style of those places in a very good manner and reality. No detail was skipped. Also the director mixed the drama and joy in the movie very well so that you can laugh suddenly when you pity for something you see in the movie. This was, I think, a great directing success for the new generation director, Çagan Irmak. So, this a ""must to see"" film I think, especially for the Turkish viewers (It includes so much domestic features). But international viewers can also get a real good taste of it, because main themes (such as family bonds, love of son) in the movie are humane things.",9
16,22 January 2016,l_rawjalaurence,8, Unabashed Melodrama with its Roots in Yeşilçam,"A huge hit on its first release in 2005, BABAM VE OĞLUM (MY FATHER AND MY SON) is an unabashed melodrama with the emphasis on excess.",2
17,2 January 2006,izmirlierman22,10, Never Felt Like This In a Movie,This is the best Turkish Drama I have Ever Seen. In fact this is the best movie of Turks. ,/
18,22 May 2011,princebansal1982,5, An intense emotional drama,"At its core ""My Father and My Son"" is another old man - young kid story done just right. While it is not as amazing or as stunning as many reviews proclaim it is still a very good movie. It is prone to sentimentality sometimes, but that is more of a cultural thing. While acting wasn't spot on in a couple of places, mostly everybody has done a very good job and though it may appear that the actors are overacting you have to keep in mind that different cultures have different norms and different ways of expressing emotions.",?
19,23 February 2007,bbuysal,10," Simply amazing, drama at its best!","It's one of those films which really affect you deep. The movie somehow makes ordinary places, ordinary people and ordinary events become interesting. I think it's due to the way Cagan Irmak (writer and director) cleverly and carefully blends everything. The movie is definitely not like a Hollywood production, maybe more like a European film. The film has many enjoyable moments but it's mainly emotional. The actings are magnificent, the story is heart-breaking and the places are so real. All performances were remarkable, but I should say I was over impressed by Cetin Tekindor's (Huseyin Aga) acting. While the bitter truths about life and family relations are portrayed perfectly, the movie also reflects life from the innocent eyes of a child. Personally, the local rural village life took me back to my some good memories. There is no need to tell what happens in the film as enough is said in the plot summary. More would only spoil it. But, it should be noted that even though the plot may sound political, the film is actually not.",r
20,1 March 2006,Yolas,7, Amazing movie,"I've never really been a fan of Turkish movies.I always thought they weren't good enough, but I knew that some good movies were done in recent years.And I heard everyone talking about this movie, low budget but a great movie they said.I wanted to see it myself, and so i did.",e
21,4 January 2006,irosh_cal,10, please watch this film..,"I think,this movie is very special for Turkish cinematography.Cagan Irmak(If I were you,I would be careful with him.He is great man) told us dying for opinions and the importance of the family.While I had watched the movie,I perceive that I want to believe my imaginations in my childhood and never want to grow up.Congratulations Cagan Irmak!Because of you touched our hearts in a very beautiful way.In addition,I should thank Çetin Tekindor( If he was born in an other country,he will certainly be an actor such as Anthony Hopkins),Fikret Kuskan(no comment),Hümeyra,Serif Sezer,Ege Tanman(Sadik's son)..",f
22,17 December 2005,mehmetyaci-1,10, One more chance for fathers and sons,"Give him a room dad, he do not have any else place to go... ",_
23,14 October 2009,mj_882,6," Although this film has it's moments of magic, it's riddled with overly-sentimentality and melancholia","As a Turkish viewer residing in the United Kingdom, promising word of mouth/reviews of Turkish films are always a delight for me to hear. After much hype and recommendation of Babam ve Oglum, I was pretty anxious to watch it.",=
24,24 February 2006,ovd07,10, Bored of those genetically modified tomatoes?,"What makes this film ""exceptional"" is the diversity of human state. It bares the drama, the comedy and the tragedy in every single frame. One of the only titles I can think of is the Korean make ""Memories of murder"" in same sort.",t
25,19 May 2006,muhammed85,10, A perfect portrait of family and problems associated,This is a movie that has a crying guarantee on almost anyone who would watch it. It portrays a family in turkey in the early 70's mainly concentrating on the relationship between the dad and the son.,t
26,30 December 2005,pelin-albayrak,10, Wonderful Film!,"The director of Babam Ve Oglum is Cagan Irmak.Cagan is the best and the youngest director of Turkey.I believe that one day,all people will notice his ability.Before Mustafa Hakkinda Hersey and than Babam Ve Oglum... I don't remember crying like that before.Subject of the film is not only Turkey's problem,all families' problem. Subject is wonderful,music is wonderful,actors and actress are wonderful,director is wonderful so the film is wonderful! I hope most of people in the world saw that film and put in order their family's life.Picturegoers must saw that film....You LOVE this film like me!(don't forget to take with handkerchief to go to the cinema.)",_
27,10 September 2017,SnoopyStyle,8, emotional eruption,"Sadik struggles to find help as his pregnant wife gives birth. There has been a military coup and no one comes. His wife dies in the streets. He is a leftist writer and the military tortures him. Years later in poor health due to the torture, he takes his son Deniz back to his rural family home. He has been estranged from his conservative father since leaving for school in Istanbul. Intending to leave Deniz with his parents, his mother forces him to stay. The father and son struggle to come to terms in their relationship.",u
28,7 July 2020,SAMTHEBESTEST,9, May God Bless Turkish Cinema for delivering The BEST FAMILY-EMOTIONS FILM EVER !,"My Father and My Son (2005) :
Brief Review -",r
29,27 September 2011,eyeslikeyours7,10," Simply, a gem",Moms say it all what they feel for their children. but father-son love is always silent.,v
30,24 February 2007,cgnkyx,8, Really good but overrated for sure..,"i don't know if you watched the movie but i can easily say that this movie is one of the best of Turkish movies ever seen..good acting, good directing..etc. However it is not a perfect movie. I watched this movie 4 times.I enjoyed all of them but if i give a 10/10 it can be unfair. Nice traditional things, Good actors and actresses, very good directing and one of the movies which really enforces you to cry! I did not cry when i watched it but i m not gonna say that it will not make you cry..İt will probably..So watch it..Enjoy it..And for sure wait the director Cagan Irmak's real masterpiece!..He is really talented and gonna show you the real Turkish cinema..",
31,5 September 2017,851222,8, Good movie,Greetings from Lithuania.,
32,19 March 2006,dr_mleysi,10," A spectacular movie which deserves to be seen all over the world. , our hats are taken off !","Although that I am an Egyptian and I was not a fan of the Turkish movies until I watched this movie, I felt while watching the movie that I was in Egypt. The village life and the relations between the family members which are sometimes full of contradictions between the old and young generations of the same family. The role of the strong mother (Hümeyra) who is trying to do her best to retain the relation between her husband and her son into its normal course and how she is keen to get her family back together was brilliant that she make you cry and laugh in the same time. The father (Çetin Tekindor) whose sorrow when he lost his son made me cry although I tried to control myself. The oldest brother (Çetin Tekindor) his natural simplicity which he conducted in his role of a loving older brother whose ill youngest brother was being fed by his own hands while he is waiting for his destiny at the hospital. The little boy (Ege Tanman), no one can deny the ability of this young boy who is living in his dreams that his father is his hero even after his death, his maturity in acting is quite spectacular. Finally, I would like to that the brilliant director and the writer (Çagan Irmak), his control over his cameras and conducting the actors accordingly was above imagination. Sincerely, all the members who worked in this movies deserves our hats to be taken off for them. It will be a pity if that movie is not nominated for Oscars. Simply a spectacular movie which deserves to be seen all over the world.",
33,9 May 2008,Muratcan3,10, Stunning Film Ever Made,"As a men that don't like dramas much, I really have been impressed so much. What a great film about a rebellious men, facing reality of life and his past. Maybe best style of expression cultural abyss between somebody and family. Almost all cast has strong background of theater of cinema. Huseyin (father of rebellious men) and his naive brother really acted worldwide quality. Especially naive brother was played so naturally. I wish, if it were nominee for Oscar as best film. In Turkey film awarded so many prizes in film festivals as best film, best actor, best actress, best supporting role ...etc. I think this film is really a milestone of a Turkish Film Industry. One of the best film ever seen without a doubt. I recommend everybody to watch.",
34,5 December 2007,muhacir,10, never-to-be-forgotten,In Turkey this film is still remembered and missed. And also hard to watch again because of its realistic scenario. People tried to hide their tears from others. Friends had gone together to cinemas but at the and of the film they left in a big silence.,
35,7 June 2006,kayabay,10, A warm drama almost no one can resist to cry...,"Probably the best Turkish movie of the season 2005-2006. With very less public announcement, the movie grabbed the audience and the rest is history. I couldn't find the opportunity to watch it on the silver-screen, but the recently published DVD is also awesome with all aspects.",
36,17 February 2021,Kdosda_Hegen,5, Very soap operish.,"This film while not bad, but was just cringe soap opera alike. Yes it has some good morals, but the cheesyness ruins it.",
37,4 December 2019,Vartiainen,10, About the meaning of home,"Babam ve Oglum, or My Father and My Son, takes place at the start and in the aftermath of the 1980 Turkish coup, where the existing government was overthrown and a military junta took power. This took place on September 12th, and on that same night a left-wing journalist, Sadik (Fikret Kuskan), lost his wife in childbirth. We jump some years into the future as Sadik returns back to his childhood home in the countryside with his son Deniz (Ege Tanman).",
38,29 June 2020,ssssgelojun,8, my father and my son,"I thought I would never forgive my father, and when I came out of jail in October, he came to see me. We met at Liuliqiao. His hair was white and his eyes were cloudy. The man full of power had disappeared. At that moment, I forgave him.",
39,31 March 2007,asenkron,6, Not spesific as it is exaggerated,"In our country good films are shown as excellent because the absence of really good films.Certainly,this film is a good film but not deserve concept of ""cult"" or ""excellence"".I watched this film and thought that such stories are available in all of us.I don't understand why these kind of films are demanded in high density when adapted to moviescreen.",
40,1 April 2006,user-1134,10, This is victory of Turkish Cinema History,"What can we say about Babam V Oglum... Tears and sometimes smiles narrate to us everything about movies. Thanks Çagan Irmak to present us what a great life story. By the way, Have you ever watch Tim Burton's movie of Big Fish??? If you watch to Babam V Oglum, You should see Big Fish. I mean both of the movies try to explicate father and son disagreement. Big Fish contains much more fantastical components then Babam V Oglum. If a foreign citizen watch the this movie, He or she can understand the real Turkish lifestyle and real warm-blooded society. We can not introduce ourself to foreign societies perhaps this movie introduce ourself more then us.",
41,3 December 2005,mervei,6, above average,"indubitably, cagan irmak is one of the best directors in Turkey. It is quite clear that he is a talented person whose films are discernible from the other junk films. His TV-series called cemberimde gul oya was his masterpiece. Even though i am not a cry-baby, every Friday when it is aired, i cried so much that i usually have headache after each episode. His first short-cut film was also quite remarkable called bana old and wise i cal. When all of these considered, i went to babam ve oglum with high expectations yet i could not find something just above the average. The performances were perfect but the movie itself exploits feelings. If you want to cry do not miss it because it is nearly one hundred percent possibility that you will.",
42,4 September 2018,alansabljakovic-39044,7, Average,Emotional but i find nothing special about it. Good story but I think it is very average movie so its a 7/10 from me.,
43,6 June 2007,sorunsal-1,9, Warm and human,"If you liked ""Life is beautiful"" you will love this movie too. My suggestion is to forget everything you heard about it before watching. Just let yourself to the warm effect of the movie without any prior expectations. ",
44,4 December 2021,StanleyMarshall_,6, Simply Life,"As unique as it was made, this film's message was simply about what life is. People were born, have families, dreams and have conflicts along the way as they grow up. We get to see life in the perspective of a child who lives a life full of fantasy, an old men who lives his life in the past, and the man who contemplates about his old life and decisions but also looks forward to the future of his son. Though sometimes scenes were a little over dramatic, this is one film which was simple but meaningful.",
45,19 December 2005,kalay,9, melancholy and vigorous emotion,"Cagan Irmak seems to stir drama and comedy in correct dose. When you live intense emotion, there is comedy right behind. In this way, you are giggling, right behind when you fell with great sobs.",
46,11 June 2021,Gunnar_Ingibjargarson,10, Truly remarkable!,"Plot: After a young disgraced left-wing revolutionist loses his wife, and after a dark military coup goes to his fathers farms and try to reconcile with his own family, old family bitterness and tearful joys comes together. Cagan Irmak's Father and Son, is like watching a good painting, it's get your feeling all messed up, with joy, tears and loneliness. The most powerful thing about the film is the great script and a incredible actors. Movie about loneliness, family problems and lost of loved ones. It's in my book of the best films of the 21st century, surely not to be missed.",
47,17 January 2009,milesdrawmer,5, If your father treats you like rubbish you should still respect and love him (apparently)!,"OK, this is a good film. Lots of people have already commented that this is a good film so I don't need to add to that, but I did have some problems with it.",
48,24 March 2006,uhus,10, the triumph of unconditional love,"The story of how people can love without expecting a return, unconditionally and how sacrifices can be done for this aim. A story which is an ode to family bonds. The movie is a superb mixture of splendid acting, touching script, divine melodies and unspoiled landscapes. Although it is closely related to the last 20 years of Turkey's realities and Aegean culture of the country, the story is highly above any borders, a true universal praise of humanity. Both laughter and tears exist and are very deeply knitted in almost every scene, resembling real life: you can find something of yourself in every character of the movie, you can watch your childhood within the eyes of Denis and realize that you have lived similar pains, sorrows and joys. A must see for everyone who considers her/himself to be a humanist.",
