Review_Date,Author,Rating,Review_Title,Review,Review_Url
559,3 February 2020,raonadia,10, It's so metaphorical!,'Parasite - an organism that lives in or on an organism of another species (its host) and benefits by deriving nutrients at the other's expense.',
560,9 December 2020,Surjio,4, What's all the fuss about?,"I watch a lot of films. Many are good. A few are great. Sadly, this one was barely watchable. I persisted until the end, but it actually got worse. Odd film.",
561,7 March 2020,aidanratesmovies,10, A Truly Remarkable Work of Cinema,"With a fantastic cast, fabulous sense of direction, and a truly wild sense of storytelling, Parasite checks all the right boxes for a best picture winner, and proves to be something truly new, by also relying on things found familiar. The main cast is truly spectacular, with Kang-Ho Song and Cho Yeo-jeong providing for the best of the supporting performances. The dialogue is rich and relatable, and the humor in the film is well executed and surprisingly often. The film's pacing is by far one of its most brilliant remarks, with you never truly feeling bored throughout the almost 2 and a half hour runtime, and thoroughly entertained without. The film simply never stops, it doesn't shy away from different styles and genres of storytelling, but embraces them as one story and does it so cleanly, it truly is quite impressive. The cinematography is outstanding, with some truly beautiful visuals and captivating points of view. Though there are many interesting twists and turns that you may never truly see coming, the film can be a bit predictable at times with certain situations, and makes the film seem slightly less special in doing so. In the end however, Parasite is yet another brilliant work from Director Bong Joon-Ho and is one of, if not, the best work he has made to date.
My Rating: 9.75/10",
562,21 February 2021,lbournelos,1, Politics and art,"A movie without weight, with poor and rather unrealistic story, with childish directional mistakes, was awarded Oscar, I suppose, dictated by politics to the Academy according to ""politically correct"" idea.
Unfortunately in the real world of free people, artists do art and politics do politic.
Mixing them is disastrous.
I made the mistake not to turn it off after the first 8 minutes, losing 2 hours of my life.",
563,2 June 2019,mot-stephane,9, Social satire on steroids,"Bong Joon-ho's Parasite is perfectly written, filmed, and played - a bit too much at times (did we need this Ri Chun-hee's impersonation, or was that a bonus for Western audiences?).",
564,18 January 2020,jmiodrag,10, Parasite is one of the most emotional movies of all times,"Parasite leaves a strong and lasting effect on viewers. It has surprising and funny story that turns out to be more than a life it self. Actually, it is a life, painted in all colors. In a film industry, Parasite is a Vincent van Gogh.",
565,26 January 2020,vishnuashokknightz,10, Extra Ordinary Drama Movie,"Never Expected this kind of Movie...This movie literally contains all elements.... Brilliant Direction,Music,and acting....Must watch movie",
566,27 November 2019,colinbilling,10, Fabulous film,Ranks as one of the best films I have ever seen and I've seen many .,
567,28 December 2020,zyclunt,6, Disappointing,"It's not a bad movie. But maybe not for me? The story about poor family attaching themself to rich people like ""parasites"" is good. I realy liked first part of the movie but don't understand the dark turn in the second part. Ok so the Kim family lost themself but still they get evil a bit to fast. And the worst of all the party at the end. Why did the father Ki Taek killed Mr. Park? Because he was a bit selfish? Ki Taek just standed there doing nothing when his daughter was dying and his wife was fighting. Mr. Park just wanted keys to the car but for both his son and Ki Taek son. Sorry I know this movie have a lot of allusions and social commentaries but it's presented poorly for me.",
568,19 February 2020,BandSAboutMovies,6, Questions,"There's been some anger over this movie winning an Academy Award. It's hard for me to judge if a movie deserves to be considered the best film of the year, because the majority of movies that I love always end up being Italian end of the world movies or Mexican ripoffs of American horror tropes. Who am I to judge quality, I asked into the abyss, ignorant of the fact that I've created an entire site where I do exactly that.",
569,12 February 2020,adi-patil1993,10, Masterpiece..,The Korean drama and thriller written & directed by Bong Jong Ho is truly a masterpiece. It is entruguing thriller. And every bit of the screenplay keeps you in the movie till the end... Outstanding work of modern art,
570,12 February 2020,westsideschl,4, Not Memorable,"Two families of people; one poor, poorly educated; unemployed, and willing to lie to get money. The other wealthy, loving family, existing in their own world. What happens when they cross paths? Well, for one, a weird ending that didn't fit w/the rest of the story.
Overall impression: I'm not going to remember this movie unlike, first & foremost, ""The Lighthouse"", then ""Once Upon a Time ..."", ""Joker"", and ""Judy"". Relative to the those creations I'm not sure why this movie garnered so many awards.",
571,3 November 2019,juregreenday,10," Just a perfectly done movie, in every way.","It's a perfect movie in every way, words can't even decribe this satisfying feeling I got right now after I've seen it. It's an emotional rollercoaster that everybody need to experience. I can't even begin to describe it. Just watch it.",
572,26 September 2019,brkic-ja,10, Modern masterpiece!,"This is , no doubt, modern masterpiece. Talent, imagination, wisdom, combined with actual theme make this one of the best movies in the 21-st century. Go and see it!",
573,1 February 2020,2001ASOfan,3, Surprisingly shallow,"Gorgeous, memorable, and even startling cinematography, but surprisingly underdeveloped as the ""deep"" character and class study it pretends to be. Depressing nihilism. Director/writer clearly has given up all hope of modern civilization ever rising above the swamps of despair and manipulation. That's his right to an opinion, of course, but in this particular film his vision feels simplistic and seems to exist for no other reason than to provoke and wallow.",
574,2 July 2019,JerylBlazikerKoh,10, The Best Bong Joon Ho Movie So Far?,"A common factor between movie director greats such as Kubrick, Hitchcock, Wes Anderson, Tarantino and more are that they tend to make movies so unique that you cannot just categorize it into just one genre. Bong Joon Ho should be considered to join those greats on the list.",
575,21 June 2019,BlizzyFoxTF,7, Innovative but messy and over-the-top,9 star rating from YMS and a Palm d'Or. What have we here? A dark comedy from a great Korean director going back to his roots? Nois. I'll make sure I pay close attention to this one.,
576,12 January 2020,shyk-19404,10, Perfect. Nothing to say,"Yup. I've been Watching Bong-Joon-Ho's movie, And this is an end result.
I won't say more. THIS IS A MASTERPIECE",
577,6 March 2020,narendradeshmukh-98406,9, Masterpiece...,"Emotional Story...
Perfect Picture, Screenplay, Editing etc
Claimant Of Oscar...",
578,4 March 2020,dealchic,1, Did Not Like,"Maybe it's because I watch KDramas but I did not like this movie. One doesn't leave this movie and say, ""Oh, I wish there would be a sequel!"". Or, dream happy thoughts about the joy of watching it. All I can think about is who reviewed this movie and what were they thinking when they awarded it? Is this ""Top Drawer"" for what people want to see? Is this ugly, uninspiring and violent film one we want the next generation to prolificate? I hope not! Give me, ""Crashing Down On You"" as a movie and it would probably bring in as many dollars as Downton Abbey. This movie hasn't gone off the charts with numbers of viewers. It was slow, off kilter, bad language and unreasonably violent at the end - it was like a bad ""Chuckie"" movie. This film has probably ended some to watching Korean films.",
579,14 February 2020,caelum-natura,4, My goodnes...,"4 oscars? 4? For what? This is what you get when you falsly sue real movie makers and let amateurs work. I'm shocked seeing thos mediocre movie gets such praise. Did we truly lost our minds? This just shows how political everything got. 4 oscars for this? This is average B production movie. It is not comoplete garbage, but 4 oscars. You lost your mind.",
580,27 August 2019,Cinematic_Bullshit,7," Suspenseful, but...","Parasite is a South Korean Movie directed by Joon Ho Bong, who also directed Snowpiercer, Okja, and most brilliantly Mother. Now this movie probably has more twists and turns than any of his other films, which is saying a lot.",
581,16 February 2020,oneill2424,10, Brilliant!,"I didn't know what to expect nor did I have any expectations. This is brilliantly written, acted and directed. The viewer gets sucked into thinking it's a comedy, then there are subtle messages in the beginning that turn dark, then the entire scenario changes and it's nothing like you expected. I love when a movie takes you to places you didn't see coming and this does exactly that. I haven't seen anything like this in a very long time and this will be a classic. It deserves all the awards and acclaim. Just brilliant.",
582,5 November 2019,sueharriz,7, I WAS EXPECTING A 10 STARS MOVIE,"Many plot holes, illogical scenes at times...
i was hoping for a better plot twist, to be honest..",
583,12 July 2020,hofmanla,5, Average,"Don't get all the fuss about this film, it is very average in every possible way. Started interesting but mid-way through it became boring and not compelling.",
584,17 February 2020,pete-murphy97,8," A versatile, metamorphic thrillride","Parasite seizes our expectations, breaks them down, builds them up, and knocks them down once more.
This Korean masterclass assumes no clear genre, refusing to pigeonhole its ambition.
Straddling the line between comedy, thriller, and horror, the production presents the conceptual 'parasite' as the underlying motif; it's a profound, tragic social commentary on classism as much as it is a satirical, sardonic throwaway remark on a parasite and its host.
Decorated with multidimensional metaphors, signs and symbols, it would be criminal to not have a second or even third viewing to fully soak up Bong Joo-ho's flavoursome visual poetry.",
585,6 February 2020,nevenahers,10, Mind blowing,"A true masterpiece, 10/10! I don't think I will get to watch a better movie soon!",
586,25 January 2020,BA_Harrison,7, A tad underwhelming.,"A down-on-their-luck, low-class family con their way into the employ of a rich household, but events turn sinister after they find a secret in the basement.",
587,11 February 2020,Pjtaylor-96-138044,9, Tonal tightrope.,"'Parasite (2019)', like many South Korean efforts I've seen, essentially starts out as one thing and ends up another, constantly tightrope walking a razor-thin tonal line. Indeed, this balance between light and dark is probably its best aspect. The piece delivers moments of humour alongside moments of horror, each as genuine as the other. It's always entertaining, whether comedic or unsettling, and it's very well-made, to boot. Interestingly, the focal family aren't really all that empathetic once they start taking things a little too far, attempting to usurp the innocent and hard-working staff of the rich family they're 'scamming'. This isn't really detrimental, though. It's a distinct decision meant to keep us questioning who is really in the right, no matter whose perspective we're in. What it also does, however, is somewhat dampen the impact of the picture's proposed theme. Its comments on class perhaps don't quite come full circle - at least, not in the way you'd expect. Another issue is the fact that the initial protagonist sort of gets lost once his family moves further into the picture, but this isn't detrimental as the flick plays out in an ensemble fashion and the initial lead still gets a decent amount to do. Each member of the focal family has a decisive personality and their dynamic is believable. For me, the movie's second half - marked by its biggest tonal shift - isn't necessarily as successful as the first, despite it being the 'real beginning' according to director Bong Joon Ho. Of course, the film is always compelling. It's astutely crafted, too. Despite a few issues, it's an entertaining experience throughout. It's fantastic. 9/10.",
588,17 February 2020,FeastMode,7," creative, different, and intriguing","This movie grabbed my interest immediately and never let go. well-made all around. a memorable experience. (1 viewing, 2/15/2020)",
589,26 April 2020,jmbovan-47-160173,4, Social satire retread. Nothing new.,"Social satire retread that brought nothing new to the topic. It seems to have brought the topic back to the basics and to the beginning again, and that leaves me feeling as if we haven't learned anything. Maybe that is the ultimate point: class warfare is neverending. Heavy handed storytelling with moments of what I'm assuming are to be ""nuggets of wisdom"" giving insight to motivations in the class struggle. This has been done better and done with more thoughtfulness.",
590,20 July 2022,ramonster_uk,6, Didn't live up to the hype,"Finally got around to watching this movie, even though being a long time Korean movie fan.",
591,11 February 2020,slikts,8, Myth of meritocracy under a looking glass,"The responses this film draws are often a study of internalized propaganda; specifically, the smoke screen of meritocracy that attempts to cover the systemic injustices of the world. The common thread is to object to the impoverished characters as being portrayed as too capable; the ""If you're so smart, why aren't you rich?"" saying being an epitome of this mindset. It's a saying that you could hear in a schoolyard, because it betrays a childish level of understanding, or lack thereof: not considering unearned wealth transfer; not considering the disparity of opportunities; and not considering that the wealth gap is particularly large in South Korea.",
592,10 February 2020,Robertt1997,8, A brilliant movie!,"If you want to see why this move took the Oscars, you should check it and give it a try. Maybe you would like or not. Just watch it!",
593,16 February 2020,slmn-114-251365,10, Film of the Year,"In this movie Bong Joon-ho directs like Billy Wilder plus Alfred Hitchcock... the result is just unique. The plot is not only original but contemporary, funny, scary and poetic at the same time.
Remarkable.",
594,6 December 2019,prenalrai,10, The best flim of the year 2019....a masterpiece,"This movie is easily the best of the year in the entire world. The legendary director Bong joon-ho known for his movies (memories of murder, the host, snowpeircer, okja) churns out yet another masterpiece "" parasites"". The movie completely engages you through its brilliant storytelling. The comedy , humour, suspense , thrill and drama elements keeps you hooked into the screen. The peformance of all the actors are top notch. The flim is a visual treat filled with lot of suprising moments. Its very rare to see such kind of story telling on the screen kudos to the director bong joon ho and his team for experimenting with such theme. The movie is by far the best in its genre and will be remembered as a classic. It wont be wrong to say that this movie is definitely among the finest movies made in this decade.",
595,10 May 2023,Mymoviediscography,10," ""Parasite"" is a Thrilling Social Commentary That Will Leave You Speechless","""Parasite"" is a cinematic masterpiece that kept me on the edge of my seat from start to finish! It's an expertly crafted thriller that comments on class divides in a way that feels both timely and timeless. The film's tension is palpable, and the direction is masterful. I found myself holding my breath through some of the more suspenseful moments.",
596,3 November 2019,tipodaspiaggia,10, A masterpiece.,"This movie has it all. Great script, outstanding acting, the drama, the comedy, the thrill, the cinematography and an amazing director. Incredible movie.",
597,17 January 2021,vad19894,9, a true masterpiece,"Plot is perfect. there is just no flaw that is even slightly noticed. acting of all cast members are good. music accompanies scenes very well. the movie covers all genres without making any too much. funny, touching, suspending, sexual, family moments are all there, even horror ones. what left in your mind is a subtle yet powerful message about class discrimination in Korea. It truly deserves the Oscar without needing to employ politics or racial issues.",
598,31 January 2020,ahamedfahimq,9, Twist after twist will create cold waves inside your lumbar spines.,You will experience twist after twist while watching this movie. It contains very mild but catchy dark humour. Some scenes will create cold waves inside your lumbar spine. You will be thinking the ways to get rid of the troubles along with the characters of the movie.,
599,20 August 2019,mihajloradojevic-02515,10, Masterpiece,"The Parasite is nothing short of masterpiece, proof that asian directors are one of best in the world. It is also well acted. All actors did amazing job. The main theme is social classes. Some scenes, especially the evening when it rained, were devastating. But beside that I found family relationships to be very good represented.",
600,20 May 2022,tomsly-40015,6, Good but not worth best picture,"So, I finally watched Parasite. While the film was not bad and had a different view on social disparity between rich and poor, I still think that this film did not deserve to win best picture at the Oscars.",
601,13 April 2020,calebcalebwhitney,2, Revenge of the Noble Savages,"I gave this film two stars because although the story is garbage, it's beautifully filmed and the set design is absolutely brilliant. Kudos to the cinematographer and the set design people. That being said, I found the story to be trite, boring, predicable and disappointing. Caution, spoilers follow.",
602,11 January 2020,steffanyzimmerman,9, Love these kind of movies!!!,"Cinema at its best. Hi I'm Steffany. World Cinema has got to be apprecited. Enough of Titanics, and Avengers already!!",
603,10 April 2020,johnleolee,2, Below average movie,Whoever calls it a masterpiece just don't know meaning of masterpiece at all. I don't understand how this movie got oscar. It's just very normal average movie. Too much hype for this average movie.,
604,17 February 2020,sebastianschlicht,10," When the lights come on, they crawl away quickly!","After watching some good films in 2019, there were only a few that really blew me away. I'm a big ""Avengers - Endgame"" fan, but ""The Irishman"" and especially ""The Lighthouse"" really touched me. And now we have ""Parasite"" by Bong Joon-ho, the South Korean director of ""The Host"" and ""Snowpiercer"". ""Parasite"" was the first South Korean film to win the golden palm at the Cannes Film Festival and garnered tons of good reviews. Recently it also won four Academys, amogst other things of course ""Best Picture"". Logically, I was interested.",
605,29 November 2021,paul2001sw-1,9, A very funny film about corruption of the soul,"Being a Korean language film was not the only reason Bong Joon-ho's 'Parasite' was an unlikely multiple Oscar winner; it's also unusually dark. A vicious black comedy, it tells the story of an impoverished family who think they've found a meal-ticket for life when they manage to displace the servants of a gullable rich one; but it turns out they're not the only desparate people in town. Everyone can enjoy its ingenious plot and wonderful sense of aesthetic; but at heart, this is a serious film about how both wealth and poverty corrupt the soul. As such, it has no heroes; and its victims are either not innocent, or, if they are, have no right to be. There's no question it deserved it's awards.",
606,20 February 2020,d-ramseeey,10, Amazing!,"Wow, I'll make it short and sweet. A must watch! Paradise is the best movie i've seen in a long time. Thank you for making this.",
607,19 February 2020,dacorn-00765,6, I'm baffled by the over the top praise.,"The film is interesting, but that's about it. The first hour was really slow, the whole class thing seemed quite familiar. I'm not sure why people are falling over themselves about this film, maybe since it was Korean yet with an accessible story and familiar film language that it suddenly moved westerners to 'see the light'? Anyway, the second half twists and turns struck me more as a wacky story line I would have seen on a soap opera back in the day like Young and the Restless or Days of our Lives. Overall, I'm more critical of the critics than of the film. I recommend seeing this, it's worth a look but all the Oscars and 'best film of the decade' stuff is incomprehensible.",
608,18 February 2020,af-27543,3, Heavy on Style Lacking in Substance,"Once again the Academy Awards get it wrong. Awards for film are meaningless and superficial. I've never been a fan of the art house genre. However, I do appreciate the films of David Lynch, and I believe he's the only one that has turned art house into a fine art form. I bet five dollars that the six hour long sequel to this film never sees the light of day at HBO. It's too soon after the disaster that was GoT. Parasite was too slick and packaged for mainstream consumption. Much like the human branding it so desperately tried to spotlight. I could think of a hundred foreign films the Academy passed over for Best Picture for some American made drivel. This film was not one of them. Down with all awards shows!",
609,12 January 2020,q-48389,1," Overrated, non-logical events","I really do not know how is it rated over 8. Too many plot holes, too much drama and lack of build-up make this film very hard to watch. Is it rated that high because the majority of voters are Korean? A waste of time.",
610,27 October 2019,omear3265,10, Entertaining!,"A must see if you are tired of endless Hollywood sequels and super hero movies. A can't miss if you are into Quentin Tarantino type of movies (although, without a heroic central character). This is a very entertaining story that's beautifully shot and told with many twist and turns, at a nice and tight pace, from start to finish.",
611,4 March 2020,southdavid,8, Won Direction,"The Best Picture win for ""Parasite"" finally convinced some local cinemas to me to give it a whirl. Though I enjoyed it, I'm not sure I know genuinely know enough about South Korea class systems to be sure that I fully understood it. (Also, I apologise in advance for butchering South Korean Nomenclature in the next paragraph)",
612,16 August 2019,Soufiane-R,10, Believe The Hype,"Bong Joon-ho strikes again with this modern art masterpiece, this movie literally blew my mind with its great combination of comedy and tragedy.
One of the finest, perfect, enjoyable movies of this decade, Thanks to Bong Joon-ho and thanks to the seventh art who allows us to witness such beauty like this.",
613,29 December 2019,samirmonir,10, Great Plot,This movie only describes how good to be a writer and how good to direct such type of movies. Best movie ever created 2019 I think and by far from the closest chaser.,
614,25 June 2019,kikio_,10, really awesome,"Best movie i've ever seen in decade, everything is so brilliant",
615,28 November 2019,explusest,4, Overrated movie.,Sometimes I really believe people are high when them watch specific kind of movies in festivals.,
616,7 March 2020,curtwylde,6, Overrated :(,I don't want to be a troll but this movie is a bit overrated i think. We have much better dramas in Turkish cinema.,
617,8 July 2020,briancham1994,8, Modern day parable,"This film starts out like a comedy but gets pretty dark. I can definitely see Bong's signature style that we can also see in Snowpiercer, especially the social satire. Both of the families in this film have their own issues that really come out. The main point is the overall setting, portrayed visually through the architecture. Everyone is trapped by the class system and cannot escape except by ruthlessly attacking each other for what amounts to not much in the end.",
618,25 January 2020,marcelosichonany,9, Masterpiece,"Parasite is, if not the best, definitely one of the top 5 movies of 2019. The film is almost perfect in every aspect possible.",
619,18 April 2020,harshagarwalhv,1, Don't understand why it deserved an academy award,"Predictably stupid
Irritating characters
Unnecessarily hyped
Bad screenplay",
620,27 June 2019,DrunkenSoju,9, My kind of tea for an amazing film~,"This film was incredibly well shot and thought out! It had basically everything to have in a drama thriller film. Its my first Joon-ho Bong film and my god it was perfect! I love drama, I love thriller and crime. It hit the perfect spot for my liking and the story was perfect and emotional throughout! The awards given to this film were well deserved and after watching the film I can see why. I think I have became a fan of Mr. Bong's films and im off to watch his other hits!",
