Review_Date,Author,Rating,Review_Title,Review,Review_Url
0,5 July 2019,Jeremy_Urquhart,10, One of the best films of this decade,"I am remarkably stingy with my 10/10 ratings. I'll be the first person to acknowledge this. Of the roughly 2600 titles I've rated on here, only 34 have a 10.
Parasite is one of them. If this isn't a masterpiece, then I don't know what is.",/
1,6 October 2019,jtindahouse,8," You name a genre, this movie covers it","I can't remember the last time I saw a movie that contained as many genres as 'Parasite'. The movie starts out almost like an 'Ocean's Eleven' heist film and then expands into a comedy, mystery, thriller, drama, romance, crime and even horror film. It really did have everything and it was strikingly good at all of them too.",r
2,25 August 2019,nehpetstephen,10, Meritocracy: it's metaphorical,"In a meritocracy, success and fortune are reserved for those who deserve it--those who develop solid plans according to their talents and abilities and who execute those plans through hard work and determination. Anyone can rise to the top, and for some lucky Cinderella, plucked from the cinders and gussied up in gowns, the meritocracy represents the heights of perfect egalitarian society: ""I started with nothing and ended up with everything I ever desired; you, too, can achieve you dreams, if only you try.""",e
3,1 November 2020,Leofwine_draca,10, Thoroughly entertaining,"PARASITE is an excellent effort from Korean director Bong Joon Ho, a talent I've long admired since seeing THE HOST over a decade ago. He's had his ups and downs over the years, although they've generally been ups rather than downs, but this is perhaps his towering masterpiece. It's a quiet and reflective work, his maturist yet, a parable playing out which looks at class divide in a scathing and extremely telling way. The issue is universal, which is why this film did so well abroad (and at the Oscars), although I've been championing the quality of South Korean cinema for a long time. The technical qualities are exemplary and the acting is particularly astounding, with an unusual storyline building to an unexpected climax. A film that thoroughly entertains as well as making you think.",v
4,18 October 2019,mysticfall,10, For those who didn't like the movie because of its second half,"It's not really a review but my attempt to explain how I interpreted the movie to those who complain that the film is overrated, especially if the reason is that they didn't like the second half of it.",i
5,19 August 2019,keezo9uno,10, A true masterpiece.,"This movie is a gosh darn masterpiece. It will make you belly laugh, it will chill you to the bone, and it will make you shed a tear. This movie will stay with you long after the credits are over.",e
6,9 December 2021,boblipton,10, Thought It Might Win Best Foreign Movie,"When the buddy who got into college tells him he's moving to the US, and he's passing on the 14-year-old he's been tutoring -- just tell 'em you're enrolled in college, even though you aren't -- the son of a family so low class they've sunk through the foundation finds them very nice, very accepting, and very clueless. So he and his layabout family get all the help fired; his sister is hired as an art psychologist to help the sister, the father as the new chauffeur, and the mother as the cook/housekeeper. Yet even though you don't see them, there are vermin living in the foundations, and they come out when the people in charge aren't around.",w
7,12 January 2020,impeyrules-54634,9, An original dark comedy about class struggles,This is a well written and well perfomed original film. With a lot of repetitive cinema these day i felt this was something new. I felt connected and engaged with the character throughout the film. There are several well directed tense moments throughout the film. A popular topic of class struggled well portrayed. Its always nice to see foreign language films having worldwide success.,/
8,7 August 2020,Hitchcoc,9, Totally Unique,"Usually I don't read reviews before seeing a film. This one, however, I did, and happily so. First of all, it was good to know what cinema in Korea is all about. We need to shed our cultural biases, including ""how"" to make films. This had a very clever plot and an engaging group of characters. The title, I assume, means the principle figures have managed to infest a body and then use it to sustain themselves. I hope to see more from this director in the future.",r
9,16 January 2020,perica-43151,9, Multilayered portrayal of the real Korea,"This is a movie about a class struggle in South Korea, like what movie ""Us"" attempts to do but done properly. It is a stark reminder of what true living standards for most South Koreans look like, and its realism is very painful. Few are aware of the fact that up to the 1980s, South Korea was in fact more impoverished than North Korea, and it was only late that the situation reversed with famines of the 90s etc, but many people still live miserable lives, and situation is very similar to that in China, where a few got gloriously rich but the urban masses still live in bug infested cheap dwellings.",w
10,28 December 2019,CineMuseFilms,8, A black comedy on social inequality,"There is no shortage of films that depict the injustice of social inequality but originality is scarce. With a large proportion of its population below the poverty line, it is noteworthy that a filmmaker from South Korea has produced a work that has attracted almost universal acclaim. Parasite (2019)generates a great deal of conversation but be warned: it is not a film for everyone, especially those averse to gory endings.",6
11,2 July 2019,DJKwa,9, Achieves what Jordan Peele set out to do with Us,"As a film about a family imposing on another, and keeping dark secrets hidden beneath the surface, Parasite achieves what Jordan Peele set out to do with Us: tell a multi-layered story in a widely entertaining manner, but without sacrificing the believability of its central narrative.",2
12,19 August 2019,sandeepventrapragada98,10, A brilliant piece of art which will slowly grows on you!,Well written and performed also technically shines cinematography & bgm are too good and there's not even a single lag it's perfectly edited. Probably the best experience in recent times. Its pure art resembles the modern society the emotions they had shelved are insanely exceptional a layered masterpiece. If you like dark thrillers then you shouldn't miss Mr. Bong joon-ho's Parasite. Definitely tops the list of best movies in 2019.,5
13,5 March 2023,avindugunasinghe,8, True Horror,"If any creation is able to make an unforgettable imprint of what needs changing in this world, that production has fully achieved it's purpose. Through precise acting by the cast the movie imposingly justifies the desperation of the neglected. A well written story with imaginativeness of the highest quality. Excellent visual effects and use of colour tones to portray the decaying of the society's core. Excellent design of characters capturing many traits of personalities. There's alot to gather from this movie and what's truly interesting when it's viewers turn to decide who the real parasites of the society are.",3
14,4 February 2020,Fella_shibby,10, Thy shall not ridicule fellas with body odor. Definitely deserves the best picture award.,"Finally saw this much talked about film. As a fan of Korean thrillers, this film surpassed my expectations.
The film is about a poor family who cleverly n cunningly become employed by a wealthy couple, posing as unrelated, highly qualified individuals.",4
15,9 February 2020,robfollower,9," Parasite Review: Comedy, drama, suspense, and yes, even horror.","A family who doesn't have a lot of money or opportunities in life, starts working for a wealthy family. But will this change the life of the poor family?",4
16,24 February 2020,Prismark10,7, Parasite,Parasite became the first foreign language film to win the Best Picture Oscar. The first third of the film had me wondering why.,7
17,4 November 2019,jmholmes-73727,10," FUNNY, TURNS SUDDENLY TWISTED, THEN SAD","This movie is so masterfully written and presented with a large cast that older audiences will realize how rare movies like this have become. Its enjoyment comes from getting to know the members of two extremely different families, one very poor, the other very rich. How their lives come together is the wickedly enjoyable first half; then, in the second half the house of cards begins to shake and finally collapse with a fury we both dread - and perhaps even enjoy. Though our enjoyment probably has as much to do with the movie-making skills than with the nasty turn of events in the violent final scenes.
If you see only one foreign language film this year, this should be it. Exciting and provocative throughout, it is wonderfully acted and packed with significance for all who live in a polarized society where so many live in luxury, while others live in comparative squalor just a few blocks away. Deserves all the accolades it has already - and surely will continue - to receive.",/
18,7 May 2020,Sleepin_Dragon,10, Incredible.,"Possibly the best film I've seen for some time, yes I have a few lockdown blues, and needed something to cause a bit of escapism, Parasite was the answer. It's one of those films that's almost impossibility to classify, it doesn't really fit into any specific genre, but covers almost all of them.",?
19,26 January 2020,classicsoncall,8," ""If you make a plan, life never works out that way.""","This film's ranking here on IMDb is somewhat of an anomaly. Usually, when a hot new release makes it's way into the Top 250, it manages to remain in it's general range for a while and then slowly decline as more and more reviewers add their vote. ""Parasite"" entered the list in the mid Fifties if I correctly recall, and since then has managed to improve it's position to #26 as I write this. No one knows if that will hold obviously, so I'm curious to see how the movie rates over time.",r
20,15 October 2019,howard.schumann,7, Lacks any realistic human dimension,"South Korean director Bong Joon-ho (""Okja"") says that he always tries to overturn viewer expectations and hopes that his latest film succeeds in this way. Palme d'Or winner at the 2019 Cannes Film festival, Bong's Parasite (Gisaengchung) does indeed thwart expectations, but the question is - to what end? Defying any strict genre classification, the film is a conglomeration of comedy, drama, satire, crime, horror, and anything else you can throw into the mix. Bong sees the film as a statement about the ""ranks and classes"" inherent in capitalism that are invisible to the eye, and says that the film ""depicts the inevitable cracks that appear when two classes brush up against each other in today's increasingly polarized society."" Unfortunately, the characterizations are filled with so many stereotypes that the lack of any realistic human dimension leaves Bong's statement without much impact.",e
21,9 June 2019,FrenchEddieFelson,9," Class struggle. After Karl Marx and Victor Hugo, here is Joon-ho Bong","This cinematographic gem has been recently rewarded by the prestigious Palme d'Or at the Cannes Festival. If I have one and only one advice to give you: go savor this fabulous movie with a strict minimum of information! Indeed, this film might schematically be split in two parts, the second one being quite surprising and unpredictable. The script is excellent and the casting is globally sumptuous, especially the gorgeous ",f
22,22 January 2020,view_and_review,8, Bong's Brilliance,"When it comes to foreign films I tend to be a little biased or lenient. They are such a welcome break from traditional Hollywood. When I see a decent foreign film I can't help but want to praise it more because they don't have the multi-billion dollar Hollywood machine behind them. Usually, they have to be more creative, more ingenious, and more resourceful.",_
23,3 February 2020,tm-sheehan,9, The Privilege Class crashes into the Working poor,"My Review- Parasite
My Rating 9/10",=
24,5 December 2019,EdgarST,10, Family Affairs,"Winner of the Palme d'Or for Best Film in Cannes 2019, to say «Parasite» is to speak of five shining stars in the cinematic firmament. When you have to spill blood in a film, you have to dose it with genius, hit the target and know where and when to spill it with cunning and, above all, understand well why we spill it and get the viewer to understand that reason as well.",t
25,6 December 2019,TheVictoriousV,10, One of the decade's most clever and original,"South Korean film crews may be World Cinema's most painstakingly dedicated; the movies are detailed and creatively daring in ways that would be impermissible under Hollywood supervision, on top of letting the actors give their all and show their most unflattering selves. As is the case with Bong Joon-ho's Parasite, they might also produce some of our time's most impressively original stories and supply timely commentary in the process.",t
26,26 February 2020,ajikude,5, totally overrated,Good but definitely not worth an Oscar for best movie or best director.,_
27,21 June 2020,Waedliman,5, Neither fish nor foul,"I am not Korean and maybe I cannot judge every aspect of artistry in this film, beginning with the acting which was a bit shaky for me. In some scenes I saw an actor or actress pretty weak, in the next rather strong. Sometimes I had the feeling they were no professional actors at all. And I can judge acting and I know that that was not on purpose. The camera work was good, I really enjoyed the little details that were presented to my eyes, some misleading, others very clear. Would the storyline have been as thorough as that, this would be a great movie, in my opinion. But it wasn´t. None of the characters was really likeable yet all of them hat their catching moments. The dichotomy of a society, here in lower class people and the rich, worked well yet a little stereotypical. The poor were poor but witty, the rich were super rich but a little stupid or naive. Would the world be a better place if we turned reality upside down? No, it wouldnt, that´s what this film tells us. It´s a satire, of course. For a film that pretends to be on the intellectual side, the violent solution seemed like fraud rather than a well-thought script. Like some others here, I don´t know why this got an Oscar for best movie. Was this another season that was so bad that a movie like this could win?",u
28,20 December 2019,jadavix,6," Poor pacing, too few twists, too unbelievable","I think there's a really good movie buried in ""Parasite"" somewhere, but I gave up trying to find it. It has the same problem the director's previous ""The Host"" had: the pacing is broken.",r
29,4 August 2020,elliotjeory,5, Average,"I didn't think this film was particular good it's not as smart as it thinks it is, the infiltration of the house was unrealistic and the so called twist was predictable. The oscars have no credibility these days.",v
30,30 January 2020,joesiegel,9, It's so metaphorical,"""It's so metaphorical"" is what Kevin says when they show him Da-Song's paint, he makes a statement without knowing absolutely nothing about what he is talking about, most critics of this movie say exactly that ""It's so metaphorical"" obviously Most know what you are talking about, when writing something about a movie I have to be 100% sure that I have understood.",
31,11 January 2020,ketgup83,8, Parasite is nail-biting and intense thriller that is going to give you goose bumps,"The Oscar fever has started and it is my favourite time of the year where I get to watch the films which is engaging, clap-worthy, entertaining and relatable.
Parasite was already in buzz for sometime which caught my attention and to my surprise turned out to better than expected after seeing it.",
32,12 November 2019,kluseba,10, Food for thought delivered with exciting wit,Parasite is the best movie of the year. This Korean movie won the renowned Palme d'Or of the 2019 Cannes Film Festival. It has been selected as the South Korean entry for Best International Feature Film at the ninety-second Academy Awards.,
33,26 December 2019,MandalBros-5,10, A MUST WATCH,"Finally watched the most talked film of the year, and now I realise why it is the most talked film of the year. Yes I'm talking about Parasite, Directed by Bong Joon Ho. One of the best thrillers I've seen.
Now talking about the story, it was going straight in the first half and was wickedly funny and then suddenly the twist arrives and it'll grip you edge of your seat. After that you can't move from that seat, and at last only sad.
This masterpiece is also technically brilliant. Cinematography by Kyung-pyo Hong is damm good for a gripping thriller. And the BGM, it's not like the natural thriller, but the violin and the piano playing is perfect with the situation. And of course the outstanding performance by the ensemble cast.
At last the film speaks about the differences between the higher class and the lower class people and also says ""You know What kind of plan never fails?? No plan at all "".",
34,5 February 2020,iquine,9, Well....I didn't expect 'that' after the first half. That's for sure!,(Flash Review),
35,19 February 2020,Sasha_Lauren,1, Not for me,PARASITE (2019),
36,3 April 2020,harshit001,2, What a pathetic drama.,Maybe people get too emotional in West. May be that is why it got an Oscar. There's nothing special about this movie; the story so average.,
37,16 January 2020,michaeltrivedi,7, Great,"I tried to watch this movie once, and faded out after the first ten minutes. It's surprising too, as the first scenes with the slacker family were very, very funny and entertaining. It reminded me of the beginning of Old Boy in a way. Upon my second viewing, I was stunned. Fully engrossed, and entertained all the way through. This is perhaps the best film of the year (I haven't seen Little Women or 1917 yet).",
38,22 January 2020,shimenpf,8, Plot and tension at its best.,"What a great movie. No words. For very long moments I was so immersed that I forgot I was watching a movie. The plot is greatly crafted. It always moves forward and escalates. When the story requires it, the tension is remarkable. I think the father's reason to kill Mr Park could've been established a little clearer, but anyway the movie is great.",
39,14 November 2019,Movie-ManDan,10, The Best Film in Years.,"Maybe it's just me, but I have known a decline in film quality since 2017. 2016 was a very good year for film--the last great year altogether. Have I simply seen too many films? In 2016 and earlier, There were a whole bunch of films that I could say ""now that is one of the very best films I have ever seen."" Since 2017, the most that I could say about I film I love would have been ""I love this film. But I don't adore it...One of the best of the year, not ever."" Finally near the end of the decade comes a film I can comfortably say is one of the finest motion pictures I have ever laid eyes on.",
40,21 January 2020,billcr12,9, Bong Joon Ho Directs another Winner,"Bong Joon Ho directed one of my favorite movies of 2017, Okja, and has done it again in 2019 with Parasite. A working class family worms their way into the lives of a wealthy family with unexpected results. Ho has written a sardonic satire which loses nothing in translation from Korean to English. Koreans, like we American counterparts, have a 99% and a 1% who look down on the rest of us with disdain. The script is right on point and the entire cast is excellent. Easily one of the ten best films of 2020.",
41,14 November 2019,RforFilm,10," Without spoiling it, Parasite is the amazing film equivalent to ""Is it wrong to steel bread to feed a starving family?""","If there's an argument that's been a part of society since the dawn of time is that of class. From the days of cavemen, the Roman Empire, the Enlightment, and even modern times, philosophers, scholars and storytellers have explored the ideology of the wealthy and poor. It's something that people have wanted to fix to create more equality and people that discuss whether things should be equal at all. It's hard to give my opinion because we have so many viewpoints that's its challenging to paint who exactly is in the wrong. There are good wealthy people and bad poor people and vice versa. This is also something that many movies has dived into.",
42,30 December 2019,thebricks,1," One of the worst movies of 2019, I don't get the hype","I'm sorry, am I missing something here? Every celebrity, message board poster and even the former President of the United States Obama are saying this was the best movie of the year.",
43,16 January 2020,pavlomir,8, You know is Korean movie when something like this happen.,"From my exposure to Korean Drama/Horror I know that something at some point will go horribly wrong and the end there is no happy end for nobody. And yet this was so unexpected when I watch this movie. Great drama, 8/10.",
44,3 January 2020,statuskuo,4, I'm Going To Ruin This Movie For You,"I had to delete my previous review after considering it for a day...
So folks...here it is...
It's ""Married With Children"" meets ""The Three Stooges"" told with great style and eventually dark violence.
Yes, friends..you've been fooled and somewhat charmed, but it seems the people who've rated this a masterpiece just got a dose of cold reality.
They even mention Chicago, Illinois in the flick. Which is where the 90's show took place. Critics are too dumb with short memories to draw this conclusion, which is why I'll fill you in.
Dad who is underemployed/unemployed, former gloried athlete
Wife has no aspirations to work, has bad housekeeping skills, crass
Son, distances himself from the low-life world of his low life
Sister, street wise and pretty. Uses her sexuality to get things",
45,7 December 2019,alansabljakovic-39044,10, Bong you did it,"This is the best movie of 2019, over.
RESPECT, over.",
46,22 November 2019,Irena_Spa,10, Perfectly done!,"At first sight I gave 10, but being close to the end of the movie I was thinking...""no, no 10, but 8"", because I doubted how they could miss what was with Moon-gwang, and then the story mentioned what was with her and I moved back to 10. :) The whole concept is great, from the story, music and photography to acting and style. Next to that is there are many genres in one. Also, in several moments it drives you to think about many things how would you react, gives mockery and shows the human nature, essentially.",
47,31 January 2020,cricketbat,8, Bong Joon-ho's drama/thriller/comedy is definitely worth seeing,"It's hard to nail down what type of movie Parasite is, but this drama/thriller/comedy is definitely worth seeing. Bong Joon-ho tells this story in a way that keeps you engaged and keeps you guessing, with protagonists you can't fully like and antagonists you don't really hate. Even though I may not agree with every decision this film makes, I enjoyed the journey and I'll be thinking about it for a very long time.",
48,15 January 2020,kosmasp,10, Not a leech (?),"Of course Parasite could be anything ... which is why you should avoid Spoilers at all costs. Many have made a point about this and they are right. If you like movies with social commentary, this one is for you. It is so good, you want to talk about everything. Performances, story and all of it.",
49,5 February 2020,fntstcplnt,9, Parasite (2019),"Directed by Bong Joon-ho. Starring Song Kang-ho, Choi Woo-shik, Chang Hyae-jin, Park So-dam, Cho Yeo-jeong, Lee Sun-kyun, Lee Jung-eun, Jeong Ji-so, Park Myung-hoon, Jung Hyeon-jun, Park Seo-joon, Park Geun-rok. (R)",
50,24 August 2019,TheDyingGirl,10, A commedy/horror/thriller Makjang !!!,Best movie of 2019. I am in awe. In fact it's one the best movies i have ever seen in my life. What a masterpiece no wonder it won the top award at the cannes film festival. You can never guess what is going to happen next or how it will end. Damn !! Wow and it begs the question who is the victim here?,
51,26 January 2020,Pairic,9, Brilliant Dark Satire,"Parasite: A con-artist family preys on an upper-class couple and their children. That's the bare bones of this film but it is a multi-layered black comedy thriller which heaps the satire on with a trowel but never falters as the brilliant script and direction by Bong Joon-ho keeps things going at a brisk canter. A tale of class war as the condescension shown to the servants is all too obvious, there is a line which must never be crossed by the hired help. The way the Kim family inveigle their way into the wealthy Park's home is a joy to observe. First the son as an English tutor then the daughter as an art therapist followed by the father and mother as chauffeur and housekeeper, the existing servants just cast aside. Something odd then happens which would be a spoiler if revealed but it alters the tone of the film. Things proceed towards a dark climax which ventures into the area of quotidian horror. Another masterpiece by Bong Joon-ho which he (partially) based on his own experiences as a maths tutor to the son of a well off family. 9/10.",
52,31 December 2019,Mustang92,5, OVERRATED - OVERRATED - OVERRATED,"This movie is not a ""masterpiece"" by any means. And all the apparent hype it's getting? Why? Is it because this is a foreign film trying to be an ""American film""? (That is, trying to be an American ""genre"" film?)",
53,19 December 2019,AlexanderFitzmeyer,10, Parasite 2019,"With this tough genre mix, South Korean cinema has created a masterpiece. The complex and fascinating examination of the class struggle once again underpins the ingenuity of its director Bong Joon-Ho.",
