Review_Date,Author,Rating,Review_Title,Review,Review_Url
402,16 February 2020,jonaswilmann,3, Nonsense,"A veteran chauffeur, his wife and their kid wonders, one fluent in English, the other an art wiz with expert computer skills and mastermind deception skills, are all unemployed (!) and lives in a scummy basement, where they fold pizza boxes for peanuts. With wildly implausible easy they con a rich family (ridiculous caricatures of rich people who apparently got rich by being soooo stupid) into employing them. First the son, then the sister, then the father ... you get it ... sleep-inducing snail's pace to the predictable setup where the entire family has leeched their way into the rich people's home. Once inside the home, the rich family goes on a vacation, and the poor family literally start ripping the home apart in a stupid drunken frenzy?? The old housekeeper (which they got rid of in a horrible way, causing a dangerous allergic reaction) shows up, and for some reason they let her in?? Turns out the old housekeeper is keeping her husband in a hidden basement under the house, where he has been living for four years (best explanation to why is that he is hiding from loan sharks). He has been flickering the lights morse code-style which the small boy of the house has deciphered (but he never tells anyone and it is therefore utterly pointless). Each family now knows each other's secret, so they are in a stalemate. Right? Movie apparently forgets this, an instead we end up with a big fight. A lot of nonsense. A flood. Then a lot more violence. Poor father kills wealthy father (because of his arrogance towards the poor which have a certain odor), then leaves his own two wounded children to die, running to hide in the basement (he would actually have to step over his son, who lies half dead in an enormous puddle of blood in order to get to the basement, but I think the director forgot this - add it to the five million other plot holes!). At some point near the ending - where the movie takes another tonal shift towards the sentimental - I realized that we are actually supposed to sympathize with the poor family, despite how EVIl they have acted the entire movie ... This movie is wildly implausible, first half wildly predictable, full of weird tonal changes and plot holes. Everything is overly constructed to underline some muddled point about social inequality, but nothing really makes sense. I loved ""Snowpiercer"" but this is total crap.",
403,3 December 2020,auuwws,6, parasite,"The film's story was excellent and the characters the director tried to convey were great, but he didn't deserve a Best Picture award. Acting in the movie was good especially for the rich wife. The angle and camera were excellent and the director in the film was excellent. In conclusion the film was accepted",
404,11 February 2020,johnnygs,9, One of the years best,Glad that I watched this movie before the Oscar nominees were announced. I feel a number of people Judge it harshly bcos it won a film over other equally excellent movies,
405,22 January 2020,tgrafflin,10, Plato Would have Loved,"I spent some time with the movie ""Parasite"" tonight. It captured me in it's symbiotic web. I'm sure there is not a single adjective that could describe it adequately...so I won't attempt that magficent accomplishment. Parasite tugged on every ounce of my acquired knowledge in philosophy, literature and Korean (yes...I do have a very tiny bit of that :) ) The set design was amazing...and it may give 1917 a run for it's money.",
406,4 September 2019,alexsong88,10, Kinda messed up,Didn't expect the ending...which is why I enjoyed it. Shades of the cult classic 'Old Boy' in the sense that there were elements that were so disturbing..,
407,29 February 2020,panoscharalabidhs,4," Still wondering ,why this got 4 oscars","I wanted really to liked it ,but I couldn't.
I liked only the last scene ,but I could not like any of the characters.
I don't know if that was the purpose ,but for me at least one character has to be likeable.
And all the poor-rich thing has been told better from soap operas.",
408,29 January 2020,brightest-fairy,10, Superb casting and direction,"All the actors were convincing, intense performances by all of them. Great directing, art and photography. Some of the most beautiful shots I have seen , specially considering the places they were showing.",
409,7 September 2019,victorjonel,10, One of the best of 2019,"Excellent writing, acting, direction, drama, suspense and action. A must see this year.",
410,2 March 2020,arshdeep-61438,10, Masterpiece,Bong Joon-ho delivers an engaging film that continues to get more engaging by the minute and lives up to and exceeds it's hype. The story goes from funny to thrilling to dark in the 132 minutes of a genius plot.,
411,20 December 2019,Pretentious_Viewer,10," One of the few films that can be granted the title of ""masterpiece"".",That's it. That's all I'm writing about this film. Now go watch it if you haven't already.,
412,17 December 2019,teodoreh,8, Parasite is not a valid title for this brilliant movie,It's a nice-to-watch movie and nice-to-think afterwards of what you've just saw.,
413,9 February 2020,zibubu,8, Omg,Simply amazing! One of the best movies I watched in 2019. Keeps you on the edge all the way. Great flow. The end was something.,
414,11 February 2020,darius_sutherland,8, Thouroughly Enjoyed,"Parasite is slow to start but an enjoyable movie that takes you on a ride. It is a contender for the awards definetly and even though it won I am happy it did as I don't think there was a huge choice to be made. This year for me it was Joker, Richard Jewel and this.",
415,22 May 2020,danushkabm,1, Not Good to me,"I started to watch this movie because it has 8.6 IMDB Rating,I cant believe how this movie get that much high rating,
Sorry guys this movie not good for me,very bad storyline,wasted my time,",
416,2 January 2021,bret-bannerman,1, So..,Dumb. Fact that this was oscar winning is as sad as our world's current state.,
417,10 February 2020,linasharar,10, A Masterpiece,A must watch .. mesmerising with mixed overwhelming feelings throughout the two hours.. it doesn't leave you after it ends; you cannot help but continue think of what if!,
418,18 January 2020,shakoor-ans,10, Best movie of 2019,"My favorite movie of 2019..
Hope it gets Oscar for best Picture",
419,17 September 2021,Christopher_Reid,5, Frustrating - tense at times but pointless,"Parasite failed to grab my interest near the start. Later on it picks up momentum and becomes quite engaging. But this is less because I liked it and more because it manages to keep the plot moving in unexpected directions. By the end, it felt like the exercise was a waste of time or worse. Worse because I worry that the filmmakers and many fans actually sympathise with the murderers, just because they're apparently poor.",
420,8 January 2020,CroMarduk,2, The reviews are misleading,"Ludicrous movie. I can't understand the reviews. This movie is full of insane people acting completely illogical. The poor are lazy and threacharous, while the rich are naive and simple. Don't believe the hype.",
421,13 April 2022,DUTCHY_BOY_1,6, WAY OVER RATED,"This is way way over rated, its a 6 at best. Yes some bits are funny. But others it just drags on. The actings okay. Plots okay. Its just really an okay film overall. Nothing special.",
422,9 November 2019,sumeerm-18507,10," Thank you, Bong Joon-ho for this tour de force masterpiece!!!!","PARASITE
Directed by Bong Joon-Ho
How often does one get the opportunity to see a film, on the silver screen, which leaves you enriched by the immaculate craft of the filmmaker's original voice and style of storytelling? How often does a movie leave you inspired to just grab a stack of paper and a pen, and begin writing your very own story? Bong Joon-Ho's Parasite is definitely one of those movies which left me moved and inspired. It's one of those movies which beautifully broadened my view towards the world. This film tackles social issues in a visually visceral and cinematic manner; it doesn't rely on preachy monologues and melodramatic action to convey its underlying themes of class discrimination, greed, family, and morality. Bong Joon-Ho and his writer, Han Jin-won, craft the screenplay in a subtle style in order to convey the social issues that are revolving around the film.
Parasite tells the story of the Kim family, which is made of four individuals: a father, a mother, a teenage boy, and a teenage girl. This family takes interest in the Park family, who are incredibly rich and wealthy, when the teenage boy, played exceptionally by Choi Woo-shik, takes over his friend's job as an English tutor for the daughter of the Park family, who is a sophomore in high school. The film proceeds with the Kim family obtaining the various jobs around the house of the Park family, who are unaware of this. From there one, Bong Joon-Ho and his writer, Han Jin-won, tell a beautiful story of family, class discrimination, empathy, and morality in a satirical and dark manner.
Parasite embodies a countless number of flawless moments of storytelling, which can leave one entertained, thrilled, and moved. Bong Joon-Ho utilizes visual storytelling to not only heighten the thrills, but using minute details to depict the discriminations that are made between the rich and the poor. There are two scenes which depict the way the rich and the poor perceive heavy rainfalls. The Park family are enamored by the sight and scenery of the rain from their window. Whereas the Kim family, struggle to grab their personal belongings due to their basement apartment being flooded by the rainfall. Yang Jin-mo's editing immerses the viewer in these visually engaging scenes. There is one moment where she uses the shot of the overflowing water transitioning to a bird-eye shot of the Kim family and their neighbors struggling to take the water out of their homes by using buckets. This is what makes Parasite shine as this visual experience, where we as an audience, understand both sides of the coin. The audience is able to grasp a sense of the struggles that the poor have to face, and this is done with incredible cinematography by Hong Kyung-pyo.
The performances of Parasite are incredible. Each actor provides a nuanced and authentic performance; they faithfully portray the psychology of their characters. Another incredibly refreshing aspect of this film was how Bong Joon-ho and his writer, Han Jin-won, portray the Park family. They aren't portrayed as stingy rich people, they are kind, caring, and naïve. They are naïve to the point where they are baffled by the smell of a poor individual. Bong Joon-ho authentically depicts the humanity of both the wealthy and impoverished characters of the film. The way the characters are crafted and portrayed is what allows the film to augment Bong Joon-ho's original voice as a storyteller.
Parasite is not only the best film I have seen this year; it is the best film I have seen this decade. Thank you, Bong Joon-ho for crafting a tour de force of a film. Thank you for reassuring me, as an aspiring storyteller, that stories build bridges of unity. Thank you of inspiring me to write a story that is original and deeply resonates with my memory and my heart. As the great Japanese filmmaker, Akira Kurosawa once said, ""If you genuinely want to make movies, start writing screenplays. Take a lot of paper and a pen, and just write, write, and write."" Bong Joon-ho's masterpiece, Parasite, inspired me to go home and take a lot of paper and a pen, and just write the stories I want to tell. Thank you, Bong Joon-ho for shrewdly crafting a masterpiece that beautifully depicts the themes of class discrimination and filiality.",
423,9 April 2020,radrobd,7, The movie was entertaining but not Oscar-worthy,"I found the movie entertaining. I was expecting more duplicity and schemes from the Kim family once they infiltrated the rich family. It moved slow at first but picked up pace towards the middle. While I was entertained, I was shocked that this movie won the 2019 Academy Award for Best Picture over the far superior 1917.",
424,2 November 2019,Strivingforfairness92,10, Palme d'or? It's a gem!,"This is a very rich film ""with metaphors"" as the young hero of it might say. It is very compeling viewing from its first minute as the direction, writing and acting are very cleverly done. The themes of the have-nots against the haves and the cold-hearted versus the warmer-hearted people dominate the plot, which is thick. There is a lot of symbolism in it. Who are the real parasites, anyway: the poor or the wealthy, the caring or the indifferent? The tone takes a turn three-quarters of the way through from French-farce style to almost a horror film. However, it is worth engaging in until its conclusion, as it has some serious messages for the viewers and is a very wise work indeed. I can see why it won the Palme d'Or at Cannes in 2019; it's a gem.",
425,2 October 2022,bregund,5, Falls apart in the second half,"3,511 reviews, most of them seem to adore this flawed film, I know no one is going to read my five star review because it isn't a ten star review, but this isn't a ten star film. I just don't see a rich family instantly hiring four new employees without thoroughly checking them out first, this would never happen anywhere in the world. The first half was intriguing, and I began to think if they are a family of skillful grifters, then they wouldn't be living in a basement. I began to wonder if these people were family members at all or just a random assortment of con men who got together and pulled off cons, that would have been a neat twist, but no it doesn't go in that direction. Then I thought that the rich family would turn out to be parasites themselves, which would have been intriguing, but it doesn't go in that direction either. For some strange reason there's a violent attack towards the end that doesn't fit in with anything else that happens in the story up to that point, it's just random and there's no cognitive flow or context or continuity to any of it, it's just a disconnected series of events. The house is gorgeous and the acting is good, but there's ultimately no point to the story.",
426,9 January 2020,jjhone,10, A masterpiece !,"This movie is so great . In my opinion , parasite is one of top 10 movies of the last decade .",
427,2 November 2019,cgoodwin1991,10, Brilliant,"I reserve 10 stars for only the cream of the crop, and I can safely say after one viewing that this was just that.",
428,23 December 2019,george-801-726596,10, Must see!,"Original, creative, involving story.",
429,5 June 2020,k_fogleman,7, Good but Not Great,Best movie of the year full of suspense and white knuckle moments is the hype. Not the reality. A unique story that misses a lot of opportunities in it's execution. A highly unsatisfying ending. Lots of loose ends. Didn't live up to the hype at all. An enjoyable watch but less suspenseful as The Hand That Rocks the Cradle.,
430,16 January 2020,bryankhalid-92551,9, Shocking!,"My first ever Korean film and the film lives to its expectation after seeing the movie trailer. It was mixed of comedy, suspense and even horror, go see it you'll be suprised!",
431,16 July 2021,camjace-45174,6, I don't get it...,"Maybe I'm dumb. But given that this movies on paper is a masterpiece to me (I'm a big fan of Memories of Murder and Chaser ) but as execution, I feel like I'm fed a messege. And that broke the fourth wall for me.",
432,1 March 2020,qui_j,6, Interesting but certainly not spectacular!,"The movie covers a variety of genres and social issues that rapidly developing countries like South Korea are facing, a sudden but unequal distribution of wealth, and inequality between classes. It revolves around a family of Grifters who feel they must take back power and exact revenge on a wealthy class family. The problem with the film is that it tends to drag out and become boring after a while. The viewer loses interest. The story could have been told in a much shorter time. It does tend to show what lengths people will go to if they feel they are the underdog, and what they are capable of doing to extract revenge.",
433,4 June 2020,feistywench,3, Expected More,"The film won four Academy Awards and received praise from so many critics, it had to great right. With its thinly disguised story line about class warfare, it's no wonder Hollywood embraced it. I watched it all the way through and when it was over I felt nothing. Didn't love it, didn't hate it and frankly as Im writing this, I really don't remember much about it",
434,14 August 2019,alvintalavera,10, One of 2019's best.,Parasite (noun) - a person who habitually relies on or exploits others and gives nothing in return.,
435,6 February 2020,khizernawaz,10, What a great masterpiece movie,Fantastic gtreatest movie. Win the best motion picture award really.,
436,6 March 2023,epistimistavrou,8, oddly unique and great movie,"This kind of interrogation might still feel as effective in a gloomier, more self-serious film, but Bong has somehow mastered the art of mining powerful messages in the midst of hair-raisingly entertaining set pieces, breathtaking action sequences, and daffy character development. The balance he strikes between the grave sincerity of his subject matter and the agile levity and stimulating smarts of his filmmaking gifts regularly reveals a deeply spiritual artist, one who wants audiences to pay attention, but who also knows that getting audiences to transform often requires age-old stories to be told in freshly affecting ways.",
437,25 February 2021,keithtkelly,1, Unwatchable.,"This movie is flat-out horrible. Not funny, not interesting, a hard watch. Way over-hyped. Had to shut it off half way through. Zero interest to watch it again.",
438,10 February 2020,koushikdas508,10," PARASITE: Dark, Socially themed, Multi-dimensional, Highly thought-provoking and an incandescent cinematic roller coaster!","Korean films are love. Yes, they are! 'Oldboy', ""The Man From Nowhere"", ""I Saw The Devil"", ""The Chase"" etc. etc. You name it. Korean directors are masters when it comes to deliver messages about social taboo or to execute a thriller on screen in possibly the most perfect way. 'Parasite' adds and in fact stretches the legacy of Korean films in even broader perspective.
Genres can be deceptive at times for some cinematic creations. And for films like 'Parasite', it spans over a wide sphere for sure.
Kudos to the director Bong Joon-ho for giving this masterpiece which is multi-layered and shows the economic inequality in the pro-capitalist society of South Korea in a way which consists so much mixed emotions, sense of humour, lots of adrenaline rush, few nail-biting moments as well; all revolve around primarily two economically contrasting families. It pin-points out the drawbacks of extreme capitalism and plutocracy in its usual neo-noir black comic style, which will eventually grows on the minds of the audience.
No wonder why this cinematic gem has got almost 10 mins of standing ovation at the Cannes and has won 4 Oscars at the 92nd Academy Awards including ""The Best Picture"" award as a Non-English film for the first time ever in the history of the Academy Awards.
It's rightfully the MOVIE OF THE YEAR OF 2019!",
439,21 January 2020,Keallach,10, The hype is warranted.,"I've wanted to see this awhile, but the consistent rave reviews actually made me hesitate and put it off, for fear of disappointment...nothing is ever that good... but I genuinely and thoroughly loved this!",
440,19 August 2019,popcolin,4, Really not great,Just like with Snowpiercer and Okja when I think back on this movie I am forgetting it faster than I can remember. There are just too many different Genre's happening here to really give anything any sort of devoted attention.,
441,5 January 2023,hashirzz,10, Parasite: A Must-See Film That Will Keep You Guessing Until the Very End,"Parasite is a South Korean film directed by Bong Joon-ho that tells the story of the impoverished Kim family, who are struggling to make ends meet in a society marked by economic inequality. The film follows the family as they become involved in the lives of the wealthy Park family, ultimately leading to a series of unexpected and explosive events.",
442,16 October 2019,homeslice2311,10," Best Film of The Year, if Not The Millennia.","This movie without a doubt is the best movie I've seen in years. 2019 has been a slow year for movies, and the 2010s in general - jam packed with superhero movies that are all the same and hundreds of sequels. But this movie is quite the gem.",
443,17 February 2020,byron-116,8, A most enjoyable colorful comedy/thriller/crime/drama,I liked Parasite very much and had predicted that it would win the Oscar for best foreign language film - as it rightfully did !,
444,8 March 2020,rajdoctor,3, Is PARASITE a Tamil movie remake?,"Apart from Hollywood I like seeing International movies, Iranian, Korean, French, German etc. movies",
445,9 January 2020,uwalvin,10, 132 minutes of perfectly measured film,"Like a five star dish, every minute of this film is superb, respecting the time it asks of you, the viewer, as it takes you through a roller coaster of highs and lows. It is not overly dramatic nor does deplete you emotionally, which is my typical fear with Korean dramas and thrillers. I must reiterate that you will not leave this movie with a sense of innocence lost, like your first reading of The Lord of the Flies or your first watching of Oldboy. The comedy cuts through the perfectly balanced two hours and change experience that Bong Jong Ho has prepared for you.",
446,23 December 2019,edsfsousa,10, Best Film of the year 👏,"It took me while to be able to sit and review this movie. It has been difficult, almost impossible to put down into words anything about it. I truly lacked the right words and was even afraid not to be true to its core.
Here's a film which leaves no one indifferent. It is certainly metaphorical in every aspect: the water that is both a blessing or a catatrophe depending on which side of the social pyramid one stands; the smell inpregnated in old people's clothes which both disgusts and arouses the rich couple; the large window in their house in comparison to the poor family 's basement window.
The question starts with a simple title:""Parasite"". Who are they? The ones in the basement, at the bottom of the pyramid? The ones in the middle trying to strive, even if they cannot get rid of the smell? The ones on top of that pyramid who pretend to accept others yet lack total RESPECT?
Or aren't WE all parasites somehow and loose perspective so often? Wasn't a camera leading our eyes all the time?
For the first time in my life I had a feeling of real movement while watching a film. Sometimes I was moving left, right, up or down. Sometimes I was watching. Others I was being watched. The window could be either a screen to the outside world, inside the house. I often felt watched in the movie theatre
Was I the parasite?
If this isn't the Best Film of the year, I don't know what it us.👏👏👏",
447,17 December 2019,victorjonel,10, I had to see it twice.,Definitely the best movie of 2019. Everybody who loves cinema must see this film.,
448,15 February 2020,Artimidor,9, Parasite(s) and where to find them,"With ""Parasite"" Bong Joon Ho goes for another exercise of social commentary, not unlike his praised ""The Host"" (2006) - for those who cared for a monster movie dealing with social issues. It wasn't for everyone, though. Both films are 'so metaphorical' as ""Parasite"" protagonist Kim Ki-woo likes to put it. But different strokes for different people, no? Certainly, the metaphors aren't on vacation this time around, it's just that they learned to profess some subtlety. As back then, Bong pulls out all the stops in ""Parasite,"" and while the former picture's literally Godzillish rendition matching its ambitions makes it borderline, the new approach is hard to skip. It takes on the shape of a pitch-dark comedy with coarse edges when it counts. One might as well let one's self get immersed in it, enjoy the ride and laugh along, relish its twists and turns before receiving a blow from left field. ""Parasite"" comes across as less pretentious, settles on the more down-to-earth (pun intended) side of things; it plants its seed with a much smaller dose of horror, is whimsical, ironic, even cynic at times; and it substitutes CGI for clever story-telling and cinematography measuring the highs and lows of the social ladder with visual precision. In short, ingredients for a less in-your-face, decisively creeping-up-on-you kind of comedy drama of caliber, falling into line with Bong's other early outstanding effort ""Memories of Murder.""",
449,28 March 2020,Garhwal-vikas,5, People going crazy like it's otherworldly!!!,"Just won Oscars cz concept was new, but this itself doesn't make it a better movie than Joker. Over hyped, Mediocre and people reviewing it in mob mentality. Nothing against Korean movies.",
450,7 May 2021,AdrenalinDragon,8, The Overrated-ness is getting to me,"Not gonna lie, the Overrated-ness of Parasite is starting to get to me. When I first saw it at the cinema I was very impressed, but after some thought I think it's probably closer to an 8 objectively. The last 30 minutes in particular drag it down somewhat. Not really a huge fan of the direction it takes. I simply don't get what on God's Green Earth made this one of the highest rated movies of all-time on some websites and listings. It's pretty baffling and far from being a flawless movie. That being said, I still like it. The Black and White Version added nothing to it though. If anything it made it pretentious for absolutely no reason.",
