Review_Date,Author,Rating,Review_Title,Review,Review_Url
202,25 October 2019,GODZILLA_Alpha_Predator,10, A devilishly delicious and twisted tale of class dynamics,"After hearing so praise much about Bong Joon-ho's latest film when it premiered at the Cannes film festival this year, I went in not trying to know too much about it. And it definitely lived up to the hype.",
203,26 December 2019,Ynocrozplatfom,10, Masterpiece,"Perfectly told story with perfectly logical plots and motives for every character, justification for every frame and accompanied by a thought-provoking message that lingers long after you leave the theatre. Surely one of the best of cinema.",
204,8 January 2020,LynneK100,10, SIMPLY THE BEST OF 2019,"Just wanted to register my ""10"" for this movie. I'm late with this review and have nothing to add to the many other reviews previously posted.",
205,4 March 2020,euplay1220,6," Fine, but Overrated.","This film doesn't allow easy reviewing because it has many aspects, many ways to look at. Is it thriller? Comedy? Drama? Societal critique? It's all of it; and therefore none of it. All in all, I was underwhelmed and mildly frustrated.",
206,14 January 2020,kingkass,9, It's nature.,"This film shows humanity in all its glory. We can try to claim the rich are evil and the poor deserve better but these are delusions we create to make us feel better. People are terrible. They are selfish. They are greedy. They are unkind. It's part of human nature. No matter how much you have, or how little, humanity still exists, and humanity is the problem.",
207,12 October 2019,michaeldoud,10, First Hit: I really enjoyed this story as it dives from the hilarious into the absurd.,First Hit: I really enjoyed this story as it dives from the hilarious into the absurd.,
208,30 January 2020,amarjaat-88279,9, amazing movie.,This movie shows desires of poor which is all same in any country of world. well acted and well made film.,
209,31 October 2019,adecio,9, Great allegory,"I predict a strong hard campaign to make this South Korean movie become a hype until to get its deserved Oscar. The allegory is pretty awesome. I recommend to get a blindly watch, because this could be very useful. I'm gonna pay attention more on next Joon-ho Bong's projects.",
210,14 November 2019,YourAverageReviewer,10, Truly masterful film mixed with metaphors galore.,"This is something that stays with you for life. Whether good or bad, it shows it. Never have I seen a movie about classic stereotypes and used them in such a creative way that it's almost something entirely different.",
211,10 January 2020,zachary-68690,9, Another great Korean film.,"This was one of my favourite films, great acting, I liked the characters and there was lots of suspense.",
212,3 February 2020,catchuanbu,8, Masterclass film,"Parasite is a film that brings together a plethora of genres that all coalesce effectively. But this is truly a story that has many layers and the shifting tones create an atmosphere that is both eerily terrifying as well as holistically captivating. If you like movies with social commentary, this one is for you. It is so good, With pitch perfect performances from the entire cast and the smartest script of the year.",
213,14 January 2020,appu_hariharann,10, Parasite (Gisaengchung),Stunning screenplay and wonderful acting by the whole team members. Director took the story to the next leave of film. The ending and the start of the story is obviously awesome. Thanks I enjoyed this Movie and loved it . The best Korean Film I have ever watched in this decade.,
214,7 February 2020,matthewssilverhammer,10, It really is as great as everyone is says.,"A haunting parable, with so many stark images that will forever be burned into my brain. A pointed highlight of the differences between the haves and have-nots. A sublimely original movie that's full of surprises and unnerving but hilarious anxiety.",
215,10 February 2020,ferdinand1932,9, Masterwork,"It is demonstrably an excellent film within the first 15 minutes and it gets better. It has a very good script, one which is honed with good characterization and motive, together with fine structural exposition. No other script in the 2020 Oscars has the qualities that this one has in terms of writing skill.",
216,7 February 2020,masonsaul,10, Masterpiece,"Parasite is a masterpiece, an unpredictable film about class division that skillfully manages to easily combine different genres and create a truly unique and complex experience that's smart, funny and tense. All of the performances are incredible with Kang-ho Song, Woo-sik Choi and So-dam Park giving the standout performances. Bong Joon-ho's direction is incredible, it's beautifully filmed and the pacing is superb, constantly extremely engaging for the entirety of its run time. The music by Jung Jae-il is amazing.",
217,16 November 2020,Ed-Shullivan,6, The Prince and the Pauper ........ I've seen this scenario play out a few times before,"Mrs. Shullivan and I finally decided to sit down and read (English sub-titles) this 2020 Academy Award Best Picture winner and both of us felt it was decent enough, but to win ""Best Picture"" against a great film like ""Once Upon a Time In Hollywood"" I think director Quentin Tarantino was absolutely robbed. I guess when the USA is losing a lot of its film credibility with powerhouse producers such as Harvey Weinstein finally being put behind bars and the decades old USA social justice upheavel the Academy felt it was about time to suck up to foreign countries and give the Best Picture to another country to start showing they can be inclusive, so why not send some awards to South Korea?",
218,10 December 2021,baunacholi-86159,5, Didn't buy it,"Agreed, an interesting, original and twisted story. Here and there bits of social criticism but overall way too constructed for my taste. Ultimately I didn't get the hype and glowing reviews, leave alone true wow moments.",
219,30 December 2019,aboodakram-48692,10, The Best Original Story of 2019,"Easily, one of the best movies of the year, because of many aspects: First, the acting is awesome, really strong performances by everyone. Second, the story is very interesting. And last but not least, the sequence of events in this movie is one if the year's best. I mean, every act is great on its own, but if you put them all together, you will witness a Masterpiece, and if you watch any of them by itself, you will get an amazing short-film. Considering thd Oscars, this one is a strong nomination for Best Foreign Language Picture and I wouldn't be surprised if it gets a nomination for The Best Picture award.",
220,17 January 2020,angiedisa,8, You gotta watch it.,"The only reason I'm giving it a 8 it's because I wouldn't watch it again.
Gave me so many emotions, it was a whole rollercoaster. I felt anxious, worried, sad, and even happy at some point.
Made me feel fear at so many scenes, it really plays with your mind.",
221,8 February 2020,jeroboam-26661,8, Glad this movie was recognized by the academy.,I don't watch many non-english language films but I think Parasite is worthy of worldwide recognition for being an exceptional film. Although I don't see it as a masterpiece I think there are a lot of high-level elements of filmmaking in this. The plot seems simple enough but there is a lot of depth in the writing and storytelling to warrant multiple viewings. The acting is great as well as the direction but I'm always feeling like I'm missing the full experience when subtitles don't convey the subtleties of the language and cultural references. But that just goes with the territory if you happen to be from a foreign country. 8/10,
222,15 February 2020,borgolarici,8, The emotional truth of class struggle,"Being poor sucks and there is no poetry in misery: it stunts your emotional and sometimes even physical growth. Sometimes you can fight back and improve, sometimes you are just have to suck it up and surrender, which makes you bitter and angry.
This is what this movie is about: the loss of innocence of the poor and the blessed naivety of the rich.",
223,5 January 2020,srk08914,10," Worth the hype,.....,",Saw this movie today after keeping it for shelves for 2 months......a reality in today's world...... acting was top notch. Don't have any words to explain the story. It's simple mind-blowing. Keeps you on hook till the end. One of the best korean movies of the last decade. Hopefully no one will remake it and spoil this classic,
224,22 September 2019,sepetcenk,10, Unbiased art,"When we were student in art faculty, our teachers use to say to us ""art or artist can't be unbiased, you pick a side and tell your story."" I never agreed. This film approved I was right.",
225,1 August 2022,silicontourist,10," A Subtle And Meticulously Scripted Masterpiece In Its Very Calm Portrayal Of Comedy, Corruption And Murder!","This will most likely be in the top 5 list of Korean films for all time. Its an absolute masterpiece of genre subtlety that had me engrossed from the very beginning. It had already been out quite some time before I got to watching it because, I just wasn't drawn to it in any way. It came across as boring to me whilst reading the studio advertisement blurb. Luckily on one of those rainy day moments, not knowing what I fancied watching, I finally opted to watch it; and so pleased I did.",
226,6 January 2020,MovieRiffing,10, The Best Film of 2019,"Parasite stands atop the rest of the competition as the best film of 2019. Director Bong Joon-ho delivers his masterpiece, a film that has you hooked from the very beginning. Over the course of Parasite's runtime, it draws you deeper and deeper into its world, demanding more and more of your attention. Just when your investment in the characters peaks, Bong Joon-ho takes Parasite off the rails and delivers a striking message on the innate struggles between classes. Add in fantastic performances and cinematography, and you have the must-see film of 2019.",
227,16 January 2020,sebastiantorrestodd,10, if you haven't seen it for the first time I envy you,"Delightful from beginning to end, opening is way in between genres, loved the pace, the comedy, the ending, the twist, the characters, pretty much everything.",
228,4 February 2020,Hawkeleven,9, Movie of the year,"This film is completely out of the box, a social critic that doesn't choose sides. An absolutely brilliant masterpiece that takes us to a roller coaster of emotions with some kind of new cinematographic genre, that shudder and leave us groundless in a state of deep reflection about the model of society in which we live in. For those looking for an innovative film, with an unusual style, and with a necessary and relevant reflexion, Parasite is the right and the better choice. Impressive work by the director.",
229,18 September 2019,bijanadhikari,10, A film that manages to interrogate the choices every class makes while delivering a roller coaster of emotions for the audience,"I will just say this first. If you are planning to watch this film, stop right here and watch it now before reading anything regarding this film because trust me you want to watch this without knowing anything not even the synonyms.",
230,17 December 2019,HBSmith_Reviewer,10, Every film lover needs to see this at least once or twice,"Director Bong Joon-ho, the wildly innovative foreign director behind ""Snowpiercer"" and ""Okja"" has outdone himself with ""Parasite""- An original and profound look at class warfare that among many things is meticulously crafted, seamlessly blends drama and dark humor with several of the best performances I've seen all year.",
231,17 November 2019,jg_1977,10, The masterpiece of cinema 2019 desperately needed,"There have been a sparse few films in recent years that have melded genres seamlessly, performed at the absolute top of their game in technical craft, offered a scathing sociopolitical commentary, all while telling an airtight and compelling story. Luckily for us, Parasite (Gisaengchung) checks all of these boxes, in a year where we couldn't have needed it more badly. Bong Joon-ho's latest absolutely blows all else out of the water (at least compared to the other 30+ movies I've seen in theaters this year), and in a highly organic and original way. The issue of class and the struggles of the poor climbing the ladder to become wealthy is one that Bong Joon-ho is well-known for using, for instance in 2013's Snowpiercer, yet Parasite never at any point feels like it borrows from any of its predecessors or overlaps with them in any way. This is the film's greatest strength, in my opinion, that it so flawlessly weaves together all of its components, including an interesting and nuanced take on class-structure, originally and in such a way that it feels perfectly natural for the story being told. The same can be said for how Bong traverses from one genre to another. From minute to minute, Parasite will have you laughing uproariously, and then suddenly, have you dead-silent and on the edge of your seat. The comedy is dark and laugh-out-loud, while the suspense will make you want to lean in, if only to try and pull the characters out of the scene, so as to relieve the tension. It should be no surprise, that everything else also falls into place wonderfully, from the poignant performances, to the razor sharp editing, to the stunning cinematography. In a year with both high-budget and indie takes on class-struggle such as Joker and Us, Parasite still manages to stand out, in a class of its own.",
232,7 November 2019,trelerke-politics,10," instant classic, this generation's Rules of the Game","As Jordan Peele is to race, Bong Joon-ho is to class. He creates strange, shocking scenes and stories from the seemingly mundane. A fancy house with an underground, with an underground prisoner. This is about how human civilization is the Parasite that drives everyone absolutely crazy. There will always be those few who essentially live off everyone else, the main point though, is we all suffer, maybe there is no solution but it really is this ugly, ultimately. The pin-head wife lives in oblivious vapidness, going on about the swan formation of tables for her spoiled son's birthday. A birthday party called the day after a hellish flood, well, at least a hellish flood that drives everyone in a working class ghetto to an evacuation center. Sewage backing up, blowing out the toilet,it's like the last scenes of the movie Titanic, except far less tidy, while the rich family enjoys the rain on their mountain top mansion. But far more is happening in a very small space, the con family is trapped under the coffee table as the rich couple watches their son's little Indian idyll play on in the Teepee on the lawn in the beautiful rain. (this focus on using American Indians as the spoiled child's play, forcing the fraud family to participate or else, is a masterstroke, as the play became real, toy symbol turned into actual violence). Switching back in time, the fraud family and the underground family essentially fight to the death. Bong Joon-ho mimetically has above ground and the underground and the naive disgust the wealthy have for how the poor smell. It's a little over the top, but in a way that is Brechtian, in showing the contradictions of our materialistic existence. Major props to Bong Joon-ho, it will be a classic.",
233,7 January 2020,genosypheus,5, The only horror about this film...,"Is the fact that people who voted for it to win the Cannes film festival award and those who gave it anything higher than a 7/10 on this platform, actually exist.",
234,4 October 2019,majgotra,10, This is what I call a proper korean movie,"After watching the most overrated korean movie ever ""the burning"", I almost lost the trust on imdb reviews but this movie put my trust back. It has everything, comedy , thrilling elements, suspense, emotional moments, satire and each and every actor played their role perfectly. It was treat to watch this movie. Highly recommended, just go for it.",
235,23 January 2020,ShanTeaTime,9, Class Struggle and Deception The Visual Representation.,"Directed by Bong Joon-ho. ""Parasite"" follows the members of a poor household (Kim) scheming to become employees of a much wealthier family (Park) by posing as unrelated, highly qualified individuals.",
236,11 February 2020,Brainscreens,9, A well deserving oscar win.,"The way that this film respects its own characters is mind blowing. I really enjoyed watching this movie it's such a brilliant story with brilliant storytelling, it made me laugh cry and be scared in that order.. loved it, definitely gonna watch it again.",
237,3 January 2021,cupid_shot_you,1," Hugely overhyped, a disappointment in the end",I have been watching (and trying to watch) Korean movies and TV in the past year and my biggest two issues with Korean style movie making are that they overdramatize the mundane and they make the police/authorities hilariously incompetent. Both of which (no surprise) showed up in this film. They spend so much on the emotional part of film making and none on realism.,
238,14 September 2019,grantpaulsen,10, Bong Joon-Ho's Masterpiece,"Bong Joon-Ho is a filmmaker whose work I've admired since I saw Snowpiercer (2013). I've had my eyes on him ever since and I'll watch pretty much any film he directs. His newest film Parasite (2019) is not only the best film I've seen from him so far, but it might also be the best film I've seen so far this year. He may have crafted his own masterpiece. This film is sharp, it's tight, and hooks you till the very end. It's very fast paced, it's an extremely intense edge of your seat thriller, and its comedic at times which adds some levity to the film. The performances are all excellent across the board, the script, the dialogue, and the writing are all brilliant, and the score is very intense and enthralling. And to top it all off this film is shot very well, the cinematography and directing are great, and the shot composition is very interesting. And above all else this is just a very fast paced and interesting film that was incredibly fun to watch. I can't wait to see it again, I can't praise this film enough in words. See it as soon as you can, I highly recommend it, and it might be the best film I've seen so far this year!",
239,1 December 2019,cshelton-86906,6, Overhyped,"The hype surrounding this film is too much, hearing people rave about it, calling it a masterpiece, movie of the year, even film of the decade. With all that praise, I expected it to be on par with films (in terms of storytelling, acting, script etc) like The Godfather, Pulp Fiction, The Shawshank Redemption or Park Chan-wook's Oldboy, but no, it didn't even came close. But still it was a very entertaining movie, people only overrate it.",
240,28 December 2019,filmesfodasticos_by_jorgemarin,10, UNLIKE EVERYTHING YOU'VE EVER SEEN,Parasite is such a fantastic movie that even its comparison with other amazing works can be dangerous. Korean director Bong Joon-ho has such control over the narrative and the camera that we often feel in a Hitchcock or Tarantino movie or even Italian neorealism. And it all flows smoothly.,
241,23 December 2019,desperado_here,10," This is a very very intriguing movie, See it!!","In some ways its kinda scary and its because you never know who you think you know. Also, this movie in some ways reminds me of Sweenie Todd and The Family in one. Anyway, better than both and is a must watch!",
242,11 February 2020,philipposathina,9, Deserves every single award of it...,"I already have a good experience of korean movies, and this one has surely been one of my favourite, though to be honest, having a vague idea of what its plot is about when i decided to watch it, i was not that certain of what i could expect since films dealing according to critics and reviews with allegories and social messages always face my instinctive mistrust. Well, these elements are there too, but all slipped and fitted in a very intriguing and solid storyline which though starting as a light, almost comedian style plot, ends up in a bloodshed and furthermore in a very bitter truth, the realworld truth which is too hard to break free from. The film will capture your interest and attention within its first five minutes and this attention will be constantly increasing throughout its duration, a feature rather typical in this kind of stories where a rather insignificant and innocent act leads to a complicated and difficult to deal with situation like in many Cohen brothers films. Taking this in consideration one could say that the twist of this story is not that original after all, however this one, resulting in an escalating complication and a very bitter ending, is really irresistible, and certainly one of the best and most indriguing one you should expect from a movie! P.S Yesterday, global celebration of the Day of Greek language under the motto: ""Do you know you speak Greek?"". So, here's the tip of the day: Did you know that among plenty of others in your own whichever language, the title of this movie too, is actually a 100% greek word?",
243,20 January 2020,bradyoconnell,10," All-encompasing, unpredictable, engaging",This movie had it all. The premise was so strange and unique. I never knew what was going to happen next. It touched on important issues around class and family. Overall just excellent. One of the few movies that deserves 10 stars,
244,3 February 2020,tomfeller,9, Story of two Korean families,"This is the first time I can remember that a Korean-language film has been nominated for the Best Picture Oscar, and it is also nominated for Academy Awards in the International Feature (former Foreign Language Film), Original Screenplay, Production Design, Editing, and Director (Bong Joon Ho) categories as well. It is already the first Korean film to win the Palme d'Or at the Cannes film festival. This movie was funnier than I was expecting. Set in Seoul, it shows a poor family, the Kims, ingratiating themselves with a rich one, the Parks. The members of the rich family are actually quite decent, although somewhat condescending and gullible, and the Kims are likable rogues. The Kims, consisting of a father, mother, son, and daughter, live in a semi-basement apartment that looks out on an alley where drunks urinate. The father and mother are unemployed, the son Ki-woo (Choi Woo-shik) has failed the entrance exam for the South Korean university system, and the daughter Ki-jung (Park So-dan) has failed to get into an art school. They fold pizza boxes for cash. When a friend (Park Seo Joon) tells Ki-woo that the Park teenage daughter Da-hye (Jung Ji-so) needs a tutor, Ki-woo applies for and, with the help of documents forged by his sister, gets the job. Then when he learns that the Park toddler son needs an art therapist for a recent traumatic event, Ki-woo recommends his sister, without disclosing that that she is his sister. (The traumatic event that the boy suffered becomes important later.) With the help of Google, she bluffs her way into obtaining the position. Then Ki-jung figures out how to get the Park family chauffeur fired, and the Kim father Ki-taek (Song Kang-ho) gets the job. Using the cook/housekeeper's (Lee Jung Eun) peach allergy, they manage to get her fired as well, and the Kim mother Chung-sook (Jang Hye-jin) takes her place. By halfway through the film, the Parks are employing all four of the Kims without knowing that they are members of the same family. Complications ensue, of course, and there is a plot twist that I did not seek coming. As a social satire, this film is excellent, although the violent ending seemed incongruent with the rest of the film.",
245,27 November 2019,nivethanin,10, It's hands down one of my top five,The movie is delivered so artistically while being interesting the whole way through. The hole the characters dig themselves into get deeper exponentially and you're completely on edge the last twenty minutes. Immediately after the movie I was shook to the core. Afterwards I had to do a lot of thinking to fully process what I just watched and understand the social messages. Amazing movie and I know for sure this is not going to get the attention it deserves because it is a Korean film.,
246,18 January 2020,Anass-gfx,9, ACT LIKE YOU OWN THE PLACE.,You'll watch knowing you're in the hands of a master filmmaker,
247,4 February 2020,JK-WhatsUpWeirdoPodcast,10, Just wow,"Glad I watched all the other best picture noms first because now I KNOW they all pale in comparison to this one ... I couldn't even move for like the last hour, and the last 20 minutes my hands were over my mouth and didn't drop once.",
248,28 December 2019,raranoff,10, Perfect film,"This film contains everything you want in a movie. Characters who are complex - not all good or all bad, interesting homes, humor, suspense, surprise, sex and depth. I was on the edge of my seat for much of the movie. It's the best movie I've seen all year.",
249,7 February 2020,Ami65,8, An amazing movie,"Parasite is an exceptional, innovative and unforgettable movie in expression and form. Movie music is quite fit and suitable in every scene. It elaborates the dark side of social disparity masterfully. I have not seen such a intense and impressive movie for a long time.",
250,3 November 2019,Cmiller75,10," Ineffably great, hard to classify film focused on class warfare","It is hard to talk about this film without spoiling it surprises, so I will basically write a love letter to Bong Joon Ho's brilliant new movie. He effortlessly builds tension, while bringing so many other elements (Slapstick! Horror!) in telling the story a poverty-stricken family climbing for higher ground on the backs of the elite. It is a moving, funny, and above all else enlightening take on how the war of the classes leaves many, many casualties. Best film of 2019.",
