Review_Date,Author,Rating,Review_Title,Review,Review_Url
123,13 September 2015,willcundallreview,10, A short film but a masterpiece,"You might not expect the world greatest detective in the middle of a Buster Keaton silent movie but here he is, although he is apparently Sherlock Jr. This is one short silent film that is just shy of 50 minutes but its all perfection and such a masterpiece. This movie is just more than fantastic it is just flawless with its humour, its direction but also its use of technical cheats to make it look as if Keaton is for example jumping into the cinema screen or the camera work of a rather famous motorcycle scene and it's great to see in a movie made in the 1920's. The reason I think I and I think others can and have connected to this is because it is so simple yet so lovely, it is like a piece of art plastered onto the screen and made to move, a joy to watch and look at and is probably one the smartest ever silent movies.",
124,25 September 2019,ltdragonpress,9, Sherlock Jr. is a fun masterpiece of early American cinema,"I really liked Sherlock Jr. as an entertaining and innovative movie from the earlier days of cinema in America. While it was cheesy at certain times, it was still very much a classic love story. Too often nowadays I find that that cheesy comedies have no story or plot and rely entirely on comedy. Which is often times bad. Sherlock Jr. however integrated comedy into the narration of its story near flawlessly. I was also struck by the innovation of Buster Keaton. Due to the lack of special effects, the movie had to come up with more interesting ways of surprising the audience to both keep them engaged and make them laugh. They couldn't just add anything they wanted in an editing room. Having said all this however, I think it's a good thing that the movie only has a 45 minute run time, because I think that cheesy/slapstick comedy is only funny for so long. On the other hand, if the movie was longer, maybe Keaton would've just come up with some other crazy things to wow us.",
125,8 August 2000,paul.guimond,10, 45 minutes of sheer genius!,"A film that is often copied, borrowed from and imitated but can never be surpassed.  The technical special effects teams assembled for today's movies couldn't possibly capture the nuances or spirit of Keaton's truly astounding stunts all performed with a precision that would shame a brain-surgeon.",
126,20 October 2014,mmallon4,10, Silent Perfection,"I'm not a silent film aficionado, I'm more of a tourist when it comes to this era of filmmaking. Sherlock Jr. is the only silent film I've ever awarded a perfect five-star rating and I doubt I will ever come across another silent movie as fun, thrilling, inventive or as mind-blowing as Sherlock Jr.; in my view Buster Keaton's crowning achievement. Most of Keaton's silent output is great but even by his impeccable standards, Sherlock Jr. goes beyond the call of duty. It's more surreal and avant-garde than his other work with Keaton plays a wannabe detective who gets to go into the cinema screen and live out his fantasy as a great detective. Like an audience member watching a movie, Keaton's character gets to escape the real world and be what you can't be in real life. Sherlock Jr. captures the magic of cinema like few other films have and at an economic length of only 44 minutes, it's a film you can pop on any time.",
127,29 July 2018,AnonymousbutDilpreet002,8, Good comedy,Don't try to do two things at same time and expect to do justice with both . This is the the message that appears at the start of the film . But the film is not much related with that.,
128,15 April 2020,zeekwunlau,8," ""Cold Smiley""","Comedy is a favorite decompression method for people under high-intensity pressure. It has to be said that nowadays, the popular comedians have the same characteristic, that is, ""being happy"".",
129,12 June 2020,ssssgelojun,10, Sherlock,"Poor Keaton is misunderstood by the girl he loves again, this time as a movie projectionist who aspires to be a detective. He sat gloomily in the screening room, watching the screen sink into a dream in which a film of the same kind had been framed.",
130,7 December 2020,bruhgmger2,7, Hasn't aged badly at all,"I gotta say, the lack of dialogue wasn't as big a deal as I thought it would be. The film still flows very naturally. And for a film released 96 years ago, this one hasn't aged badly at all. There were several times watching this where I thought to myself ""wow, I can't believe they actually pulled that off!"". With the constraints they had, it's remarkable all the things they were able to achieve. And of course, it was pretty funny too, though I can't say there was anything that was laugh-out-loud hilarious. Still, this was definitely not a bad film at all, I'd say it was pretty good. Probably going to watch some other silent films after this because this was a good time.",
131,3 October 2015,nicolechan916,9, Creative story with great comedy and gags.,"Sherlock Jr. might be a silent film, but it raises the roof with laughter. This film is classic comedy at it's best, and incorporates movement and gags with no dialogue at all. I am amazed at Keaton's stunts and wonder how he even thought of them, and even more how he survived. His body is thrown about like a puppet, and seems like he feels no pain. ",
132,8 October 2005,guslinton,10, Close to Perfection!,This is as close to a perfect movie as you will find. ,
133,24 July 2009,Rindiana,9, Buster's Wondrous Daydreams,"Keaton's first feature-length masterpiece may not be as coherent and emotionally bittersweet as some of his later work, but scene for scene it's filled with ingenious gags and wonderful directorial touches.",
134,25 July 2018,carlos37andre,9, Definitely one of the most influential movies ever,"It's amazing to see, how many stunning technics Buster Keaton used here. This is definitely one of the most influential movies ever made, from the moving camera to the visual effects (such as the men's ""soul"" - or something like that - leaving his body), this movie has everything, and man, it's almost 100 years-old!",
135,28 May 2020,krational66,7, Classical Film,"Old films, especially these silent films. Rely on the actors' physical movements to show the plot. So it is far beyond the superficial performance level of today's beautiful women and beautiful men.
Especially in that era, many aerobatics also made us amazing today. The plot of riding a motorcycle on a motorcycle is more alarming than the current theme of speeding. I don't know how it was shot. Especially the idea is really unique. Even the actions of Jackie Chan, a juggler, can't be compared with this old movie. It is simply playing in the sea and the sky.
The efforts of small people may be a kind of heroism. American films basically have this theme. They do n't have the same celestial theme as the celestial dynasty film. It is only the life of the individual and the pursuit of the value of life. Perhaps this is the essence of American culture. Only by guaranteeing each individual can we guarantee the creativity and vitality of a country, a society, and a nation.
So watching American movies sometimes feels more direct. It won't let you thank Dade for a big brother. Individuals are individuals, without the pressure and sorrow of being attached to a certain social authority.
Therefore, whether it is success, failure, dream come true, or illusion. American films are all manifesting the publicity and striving spirit of this physical life.
Even if you are the most insignificant grassman, there will be your spring.
In addition, some of the film's dubbing has the characteristics of American culture, but also very beautiful.",
136,4 September 2015,robsta23,7, Delightful,"The only other Buster Keaton film I have seen is The General, which I know is regarded as his best, and I really love that film. With Sherlock Jr. we get a simple tale (which is always a better way to go with silent films) that is delightful in that we root for Keaton who plays the underdog of the story. Sadly, it doesn't live up to the status of The General.",
137,30 October 2009,blacklist-1,6, Surprisingly enjoyable for a silent movie!,"I'm currently a student at university and one of my modules I am studying is introduction to film. The topic I have been studying for the last few weeks has been The Origins of Cinema and how films have established themselves with the technology available to film companies and directors at that time. I watched a couple of silent, black and white movies from the early 1900s, one which included The Great Train Robbery and two weeks ago I watched this Sherlock Junior, which to be honest I wasn't really looking forward to.",
138,25 May 2019,mohit_sinsniwal,8, Through the Movie Screen,"Buster Keaton's most surreal movie sprang from his insistence on logic and realism. His tribute to cinema was inspired by stage magic tricks he remembered from his vaudeville career. His most dazzling and original movie is also one of his least formally perfect. All these paradoxes belong naturally to this ""through the looking glass"" work, which examines the dream-like nature of film-or is it the film-like nature of dreams?",
139,6 February 2020,MovieJunkie5,8, Sherlock Jr.,"Not my oldest movie but my first one of Keaton and I really enjoyed it. Can't find any better of his era. This one and A Trip to the Moon (1906), although from different not-so distant eras, served as inspirations to future, now past and present generations to all types of movies and directors styles. It's a must-see to all cinephiles and movie fans. Even though it's only 45min, it's packed with so much adventure and genuine funny scenes. It makes me think about cinema and why we love this art form so much. We are transformed and carried away by movies in such a unique and positive manner that it almost feel like a dream. Can't believe this movie is almost 100 years old, it feels fresh and different from what we see today. Definitely spiked my interest in more of Keaton's work that I can't wait to see. I recommend you go see it!",
140,17 August 2019,moviebuf-814-739607,9, A masterpiece that aged remarkably well,I was fortunate enough to watch this movie with live accompaniment from a brass band. This added a layer of entertainment to an already very entertaining movie.,
141,11 June 2011,Kubris,8, An out of body experience,IMDb Top 250: 229,
142,16 March 2020,Ahmad_pilehvar,8, Marvellous and Astounding Creativity,Marvellous and astounding creativity. that's hell of a job and also what Play by Buster Keaton he was one of the pioneers in cinema industry and of curse everybody knows along Mr Chaplin they were top 2 actors back then. I believe for a picture that belong to a some 100 years ago it was amazing and as matter of fact marvellous job. this movie just show me you can make a good piece of Art even without sound.this was silent movie that cried the story out loud. and to me it wasn't a silent movie.,
143,3 February 2004,callmebob,10," Flawlessly beautiful, achingly simple keaton masterpiece",This film is one of the zeniths of an art of silent cinema sadly lost on most filmmakers today. Keaton's ability to have your sides aching with laughter one second and your heart breaking with empathy for this little lost man the next is unsurpassed.,
144,30 May 2012,Koundinya,9, Sherlock projected!,It's hard to try and not chortle every time Buster Keaton's face appears on the screen. It's even harder to not reveal the plot while appreciating this movie.,
145,6 May 2022,film_poster_fan,10, A Minor Masterpiece,"Another amazing film directed by Buster Keaton that runs a mere 45 minutes, but is full of wonderful stunts and sight gags. Only Keaton could pull this off successfully. One reviewer (planktondrools) whines about the music on the Kino soundtrack which is not to his liking. Of course Keaton had no control over that and I heard the same thing with no complaints.",
146,19 May 2018,antoniokowatsch,6, It was all a dream...,"Quick synopsis:
A young man who is working as a projectionist in the local cinema tries his hardest to become a detective. His favorite pastime activity is reading books about said topic; ""how to become a detective"". When the father of his romantic interest lost his watch he applied himself by trying to figure out who stole it. By a twist of fate he ends up being accused/framed for the crime. With the now blemishing reputation he has all the more reason to reveal the real thief.",
147,16 April 2023,sunnylight-05563,8, So Much Fun and Joy!,"Sherlock Jr. (1924) is funny, heartwarming and cute. Buster Keaton gives an excellent performance as the comedy, cringey and awesome main dude. There is a romance, great action and very laughable scenes. The movie is only about 45 minutes long but long enough to tell this cute little story.",
148,10 July 2011,supernma,9," Keaton's finest hour (well, 45 minutes)","I'll admit that I am still rather unacquainted with Buster Keaton's greater body of work, but after having seen ""The General"", I was a tad disappointed; not that his stunts and staging weren't impressive, but I found the story uninteresting and the whole film not even as funny or entertaining as some of Chaplin's lesser works (and I realize I'm in the minority on this).",
149,17 April 2001,Leopard_Gecko,9, Great movie!,"This movie contains many many great stunts and effects beyond its day. WHile making this move, Buster Keaton, being the person he is, broke his neck! The stunts are completely terrific and so is the acting. It is hard to apreciate some silent films, but this is a step above the rest!!!",
150,12 February 2023,Olakinocritic,7, Silent movie,"Cool movie, next year it will be 100 years old, the editing is great, especially the scene where the main character comes out of his body, something like a ghost, there are a lot of locations in the film, the film itself is a dynamic soundtrack in the film is good, I liked the main character from the actors, maybe it can be a good comedy, but I didn't get humor from here at all, the only joke that I liked was when the heroes got away from the gang and flew into the river, leaving part of the car on land, and the rest turned into a boat, there were a lot of moments in the film where the main the hero could break his arms or legs or his whole body, but I understand that there are no graphics and the actor performed all the tricks himself, and there are a dime a dozen dangerous tricks.",
151,21 May 2020,MusaShinwari,10, Buster was genius,Buster Keaton was incredible actor very ahead of his time,
152,23 January 2015,IowaJammer,7, Technically Amazing. Cinematically Adequate.,"A film like Sherlock Jr is one that unexpectedly baffled me. I found myself sitting closer to the television while watching in attempt to pick out the cut in film that made a special effect possible. This created an issue as I was far more interested in how the film was made than the story being told. There were its fair share of gags and shticks, but even at 45 minutes I found the plot to be disjointed and uninteresting. The film felt more like a tech demo for Keaton's directing and stunt ability than as a complete story. Overall, I was very impressed with Keaton's ability to amaze and look forward to watching more of his latter films (Ex. The General) to see how his creative ability grew with experience.",
153,10 January 2019,dndad-56330,9, Entertaining even for today,I had to watch this for a class in college and I'm very happy that I did. What a breath of fresh air! Truly funny and no over-sexualization of any elements in the movie,
154,9 March 2015,b-carter6,6, Not that good,"In my opinion, this is not that funny of a movie. To me, it was very slow to start. I was often confused on what was actually going on and whether or not it was the main character's dream or real life that I was watching.",
155,1 October 2014,Emillion,8, A comedic masterpiece,Buster Keatons innovative technique and comedic styling aid greatly in the success of Sherlock Jr. The plot was simple and easy to follow and the comedy was fast-paced and entertaining. The dream sequence and the theater bit were very well done. The special effects used were very unique and interesting to watch especially the scene where Keaton is in the movie and the scene keeps changing. The motorbike scene was also was well shot with complex stunts that were performed perfectly. ina addition the movie had several wide camera angels that were able to capture interesting point of shots. Overall the film is a very successful and innovative.,
156,20 September 2012,stillnessbreaker,10, Brilliant!,"Buster Keaton is brilliant and hysterical! Not only did he do a brilliant job directing this film. Right off the bat he reels you in with some basic, but very funny actions. The part I loved in the beginning of the film was when he was sweeping up trash and there is a paper stuck to his broom, so he tries to take it of but it keeps getting stuck to him, finally he hears his boss coming so he leans down and puts it right where his boss is about to step. Making it so that it comes off his hand and onto the boss's foot. Loved it. My other favorite part in the beginning that I loved was the missing dollar, every time someone comes looking for there missing buck he asks them to describe it, which is really funny, and they all give him a weird look, but then describe it. Brilliant film from start to finish!",
157,28 January 2013,BatmanAndRobyn,9, Very entertaining!,"I really enjoyed this film! The special effects were incredible for the time period that this was made in. From the bike scenes to Keaton popping in and out of the movie screen and adapting to the changing locations, the stunts and timing seemed impossible and Keaton made them seem effortless. The plot was average, but the way the film was executed made it very entertaining- at no point did I become bored with this movie. ",
158,14 March 2013,katiehughes,8, To watch or not to watch!,"Sherlock Jr. is cute and quirky- exactly what you'd expect from a silent movie! However, it stands out with it's unique plot of a movie theatre usher who dreams of being a detective- and often misses what's going on because he has his nose buried in a book on how to do just such! However, what I found really neat about this movie were the special effects that are used considering the time period it was made in. To this day, I am always amazed looking at old movies and seeing what was created with nowhere near the technology that movie makers use in today's world. While this silent-film craze has been fairly new to me, I feel like Buster Keaton's adaptation of Sherlock Jr. (1924) was a great one to watch early on because it just reinforces in my mind what a great form of art old silent movies are, and that they are something that we as a society should have more exposure to.",
159,10 September 2014,tabbyharwood,7, Understanding Silent Films,"Buster Keaton's Silent Film Sherlock Jr. was my second silent film and it kept my interest. The movie projectionist's desire to be a detective brings us through visual scenes with music to understand his passion. The movie kept my interest because from the scene changes you never really knew what was going to happen next. From the beginning of the film until the end, the music used throughout the film helped the audience connect with the scenes and feel what was actually going on. I didn't quite understand the image scene changing from cliff to jungle to sea etc. I thought from those that it was to portray how he felt at that moment about becoming a detective. There are some funny parts of the movie that takes you away from the direction of what the main character is trying to become. There are also some parts of the film that I didn't think went with the plot, which made me lose a little interest from time to time. The parts of the film when the detective went to the house and was playing film was very interesting. I showed us that he was a good detective because he was aware of what the other men were trying to do to him. Then later in the movie, towards the end, he used the #13 cut ball to get rid of the police. The most intriguing part of the film for me is when the movie projectionist falls asleep and his dream actually puts him in the role of the film. To me the movie portrayed dreams can become reality.",
160,9 February 2015,kendalllynn,8, A hilarious 'mystery',"Buster Keaton is the director of this 1920's silent film. The films amazing sense of story line keeps the watchers interested and thoroughly entertained. There are so many different scenes in this movie that make it seem so amazing for being a silent film in an era where films were so brand new. The skills of the filmmakers was incredible. They were able to focus on certain aspects in different scenes and they found a way to make special effects look so realistic. Buster Keaton was also a star in this movie. His character is corny and lovable, while also being very intelligent and shows how he refuses to give up. Sherlock Jr. has many humorous stages while following a story line that would be watchable for years to come. This film is easily one of Buster Keaton's most amazing films, and greatest achievement.",
161,5 February 2015,lhug74,7," Sherlock, Jr.","I enjoyed this movie just as much as I enjoyed the circus. Who knew silent films could be so entertaining. Sherlock Jr. started out a little slow for me but it didn't talk long for me to be interested in it again. I thought it was funny and entertaining. I liked how he was trying to save up his money to buy the girl he liked some chocolate but couldn't afford the one he wanted because he only worked at a movie theater and dreamed of becoming a detective so he changed the price on the box from one dollar to four dollars. I felt bad when he was framed by the other man who was interested in the girl he liked too. The other man stole the girl's father's watch from their house then went and pawned it and bought her a gift with the money. He makes it look like Buster Keaton's character is the one whole stole it so he is banned from the house even though he didn't actually steal the watch. When he returned to his job at the movie theater, the movie showing was one about a theft who stole a pearl necklace. He fell asleep at the theater and dreamed that he was in the movie as a detective and ended up beating the real thefts and saving the girl. When he woke up, the girl was there to apologize because her and her father found out that he wasn't the one who actually stole the watch. I liked the ending how he was doing everything to the girl that the actor was doing to the girl he liked in the movie that was playing but he was confused as to what to do when the movie flashed to the future and the two had a family of their own. I think some of the camera work in this movie was advanced for it's time. For example, when Buster Keaton falls asleep and a ghost of him comes out and walks away. I thought that part was pretty cool considering when the movie was made. I really liked this movie and thought it had an exciting and interesting plot.",
162,30 January 2019,htimme,9, Dreamy and a little sad,"Personally I really enjoyed the movie. It was funny of course, but I was surprised by how well they created the dream effect. The sequence where he falls asleep and travels into the screen and then subsequently is transported into random environments felt very much like a dream. The music surprised me as well, although it was probably added later, it made the movie feel much more dreamy. I thought the scenes when he's hiding and running from the criminals were very clever. Overall a very enjoyable movie even thought it was a little sad at parts, the ending was good",
163,2 February 2016,c-fronk,7, A comedic take on detective stories,"Sherlock Jr. is yet another impressive silent film. The stunts and effects were remarkable and never failed to entertain. Some of the cuts seemed a bit odd to me, but they did not take away from the rest of the performance. The action is fast paced, with many comedic points. The music exemplified the mood of every scene, and really complemented what was happening on screen. Buster Keaton delivered an engaging, lighthearted performance. We are able to feel for his character in several scenes, but he also makes it easy for us to laugh. The story itself may seem simple at face value, but the technical aspects of the film were breathtaking, given the time period. Definitely a great film to refer to those new to the realm of silent films.",
