Review_Date,Author,Rating,Review_Title,Review,Review_Url
36,18 July 2021,parkerbcn,9, Pure magic,"Even when it's not one of Keaton's best regarding character development and story, it's undeniable the historical importance of this film and how absolutely modern it looks even today. Including some of the most amazing tricks and stunts in his filmography and the influential ""getting inside a movie"" moment, it's a pure delight and a must-see for any movie buff.",
37,4 February 2022,REXNE,10, Beyond Time.,"Big stone face, a master, I am in awe and admiration. Just watch and see the history of the film industry. The innovative ideas in the film are astonishing, I can't help but wonder if the current film industry is not developed enough.",
38,2 February 2008,vovazhd,9, Brilliant,"After watching The General, I couldn't wait to get my hands on another Buster Keaton film. Minute for minute, Sherlock Jr. packs in just as many stunts and laughs, all while exploring the boundaries of cinematic creativity.",
39,22 February 2000,contronatura,10, Inventive comic masterpiece,"This is a film that starts out as a very simple story, and then elevates itself to a level of manic hilarity that has rarely been duplicated. Buster Keaton, as he does in every film, has three or four sight gags that are so shocking and startling that you'll be rolling on the floor with laughter (I particularly liked the ""dive through the barn window"" - I won't give it away, but it's insanely hilarious). This is well worth seeing again and again. This is one of Buster's finest films.",
40,2 October 2013,Nothinggrandproductions,9," A genuine, fun silent comedy","In Sherlock, Jr., Buster Keaton plays a movie theater projectionist and a janitor who is also studying to be a detective at the same time. He is down on his luck and everything just doesn't seem to work out for him. He is in love with a girl (Kathryn McGuire) but he also has someone also trying to get her as well (Ward Crane). The first 15 minutes of this 45 minute film is filled with wonderful, genuine gags and pieces of comedy that just feel so right. If you aren't laughing or at least cracking a smile, something isn't right. Buster Keaton with his deadpan face carry this film from simple gags of slipping on bananas to the complexities of a billiards ball that is a bomb, that is the range of comedy in this film. ",
41,5 May 2016,rmax304823,6," Speedy, Funny.","Only an hour long and full of zip. Keaton is a projectionist at a movie theater who dreams of becoming a detective. He's in love with the demure Kathering McGuire but is framed by a rival for having stolen and pawned an expensive watch. While the dynamics of this situation are being unraveled, Keaton falls asleep during work at the theater and imagines himself a renowned detective who outwits the no-goodniks for kidnapping McGuire. When he wakes up, the story behind the frame is solved and he and McGuire hug each other.",
42,17 May 2006,planktonrules,8, one of Keaton's better full-length (?) films,"The above ""?"" was inserted because this film isn't exactly full-length or a short--it runs at about 44 minutes. I would have to say it was very enjoyable and fun--better than most comedies of the 20s, though not as good as Keaton's very best films (such as OUR HOSPITALITY, THE GENERAL or STEAMBOAT BILL, Jr.).",
43,3 February 2019,jgoodhand,10, Brilliant,"This short silent film is in my opinion Buster Keaton's best work and also very funny, showing off his great physical comedy skills. Not only that but people don't seem to realize that this silly short comedy actually invented a ton of special effects that became common in film for the rest of the century.",
44,17 December 2021,Samual-M,10, 10/10,Tremendous talent.,
45,20 September 2012,ChristophCinema,8," Short, Silent, and Satisfying","""Sherlock Jr."" is a movie that isn't very strong in story, but makes up for it in comedy. The story is a simple mystery (nothing groundbreaking), but the mystery isn't the reason to see this movie. The reason to see this movie is for Buster Keaton. His stunts are so incredible (even by today's standards) and perfectly paced that you're not only laughing, you're also on the edge of your seat. The highlight of this movie is definitely when Keaton falls asleep at a movie theater, and he dreams that he's in the movie that's playing. This is one of the most imaginative scenes in movie history, and many fantasy movies afterward probably took a lot of inspiration from it. To me, this is Buster Keaton's best film (even better than ""The General). It perfectly showcases everything that made Buster Keaton great; from his stunts to his perfect timing, there is not a dull moment in this film. This is a film that shows exactly why Buster Keaton is one of the greatest movie stars for not only his time, but for all time. ""Sherlock Jr."" is often overshadowed by other movies of its time, but it's one of the best films the silent era has to offer.",
46,9 June 1999,B.B.-2,10, The Greatest,"There is a special effect in this film - made so many decades ago - that still amazes viewers.  In one scene, Keaton is chased through a house, wearing men's clothing.  He dives through a window, in a continuous tracking shot, and emerges fully dressed as an old woman.  Watch it in slo-mo on your VCR.  It will astound you.",
47,3 April 2019,Pjtaylor-96-138044,8," Elementary, my dear Gillette.","It's a strange choice to have most of the story be housed within a wish-fulfilling dream-sequence but, thankfully, Keaton pulls it off with style. See, while the most entertaining aspects of 'Sherlock Jr. (1927)' are, indeed, found within this, frankly, loosely-connected segment, it's the bookending 'real-world' sections that hold all the real narrative weight, as limited as it may be. Without these parts, the picture probably wouldn't be as good because it wouldn't get you connected to its almost instantly likeable protagonist and you wouldn't really have a nicely set-up - though, admittedly, poorly paid-off - conflict to be concerned with. Of course, there is an argument to be made that the affair could have been set entirely within the dream, thereby being a more wholistic film with the conceit that Keaton really is the world's greatest detective. Nevertheless, what we have is a fantastically fun, effortlessly endearing silent action-comedy that moves at a break-neck pace (literally) and is stuffed with more blink-and-you'll-miss-them stunts and special (practical) effects than you can shake a stick at. Seriously, some of the stuff here is almost certifiably insane and Keaton shows it all off so casually, to the point where it just seems... well, easy, I guess. It most certainly isn't. The amount of practice, acrobatic skill, technical knowledge, teamwork, ingenuity and just sheer daring needed to pull even the simplest of this stuff off is nothing short of staggering. You're often on the edge of your seat just watching the shot, hoping Keaton will be okay. In this way, the excitement isn't overly 'manufactured' - though, it obviously is to a degree. The gags aren't just impressive and nerve-racking, though, they're also often funny - whether it's because of their joke-like structure or just because of their straight-up originality. You'll often laugh at the simplest of things, which is a testament to the brilliant physical acting on display. The flick, which plays out like one of Keaton's more traditional shorts (for the better), also moves quickly enough that its story doesn't wear thin, even if it threatens to, and you'll never be even close to bored. It's just a joy, really. 8/10.",
48,23 June 2005,bigsleepj,5, Certainly not Keaton's best,"I'm afraid that the legendary ""Sherlock Jnr"" has left me cold. It just not as good as Keaton's other movies (Our Hospitality, Steamboat Bill Jnr, The General) which doesn't feel as forced as this one. It's not that I have anything against surrealism but from the beginning of the ""surreal"" part of the movie (i.e. when he enters the cinema) the movie just stops being good (not that the beginning was all that great as well).",
49,2 September 2022,cricketbat,8, A fantastic introduction to the silent film genre,"Despite the fact that Buster Keaton expressed his disappointment in this film when it was released, I think Sherlock Jr. Is one of his best comedic works. Even with an extremely short runtime of only 45 minutes, this movie still packs in plenty of laughs and tons of visual gags. It's been almost 100 years since this film was made and I'm still impressed by many of the stunts. I also still have no idea how they pulled off some of the more spectacular tricks. It's a simple & sweet story with a likeable cast. If you've never seen a silent movie before in your life, this is a fantastic introduction to that genre.",
50,21 September 2007,dkncd,4, How not to be a detective,"""Sherlock Jr."" is Buster Keaton's film about a movie theater employee who aspires to be a detective. Keaton handles his role well and the supporting cast is solid as well. The film has impressive cinematography, but a generic score.",
51,9 January 1999,Jeremy-124,10, Sheer genius,"This is, in my book, Keaton's greatest film -- even better than ""The General,"" and that's saying a lot.  It's hilarious and technically dazzling, especially when you consider the state of special effects when it was made. See it and understand why Buster Keaton has to be considered one of the geniuses of the 20th century.",
52,23 July 2006,Cyke,10, Movie Odyssey Review #009: Sherlock Jr.,"009: Sherlock Jr. (1924) - released 4/21/1924, viewed 7/31/05.",
53,24 January 2016,ninabruzdzinski,7, Well done,"I thought this film was very well done. The effects that were used in it were really impressive, and it is interesting to see that filmmakers today are still using those same effects that first started back in the 1920's. This being a silent film, I did not expect to enjoy it, but I actually did. the music adds so much to it, especially emotion-wise. It allows the audience to feel what the characters are feeling and gives us a sense of what is going on in their head, and perhaps examples of what they might be saying. It allows for the imagination to take the reigns while watching and go along with the story in your own head. Even without their words, the actors actions, behavior, and facial expressions really enhance the film and make it enjoyable to watch.",
54,14 February 2003,mrbisco,9, Buster was the man,Buster Keaton is absolutely brilliant.  I've now seen 4 of his films/short films and am amazed by his work.  He was doing stuff that was way ahead of his time.  That plus his stunt work make the films worth seeing.,
55,27 July 2007,Boba_Fett1138,7, Not Keaton's best but very creative!,"As much as everybody seems to love this movie, I just don't count this among Keaton's best. It's a very creative movie but I feel that it also could had been made more fun.",
56,1 October 2003,Ben_Cheshire,10," Thankyou, Buster.","Truly, wow.",
57,4 January 2022,QueenoftheGoons,9, The Original Dare Devil,"His stunts are so mind blowing. Its a wonder he lived to see 50. I mean i was speechless when i watched his great motorcycle chase. Now i hate Charlie Chaplin in every way possible, from his raping little kids to trying to make you life etc. Someone should have murdered him. But i love Buster. He's so cute and he makes you laugh without trying. He could put old Evil Knievel to shame because on here - he does. And to think all Vic Morrow had to do was cross a river.",
58,4 August 2001,elf67,10, Underrated silent classic,"I'm one of those people who rates Buster Keaton above Charlie Chaplin, and ""Sherlock Jr."" is one of the reasons why. Keaton's stony-faced modernist holds up better than Chaplin's Victorian crowd-pleaser. In this film, Keaton is wonderful as a film projectionist who imagines himself as a movie hero even as he tries to woo the girl he loves. Although it's only 1924, Keaton evokes the dreamer's love affair with movies as well or better than ""Walter Mitty,"" as the film explores the tenuous boundary between reality and fantasy. It also has a perfect ending. I rate it a 10.",
59,10 January 2013,busterbuff61,10, Buster Keaton is his own best special effect,"""Sherlock Jr."" is a glorious 44 minutes in the history of silent film. It is Buster Keaton taking to the absolute limit the fun you can have with a movie camera, and the movie's viewers are the lucky recipients of Keaton's over-indulgence.",
60,9 September 2014,leonrach95,4, Buster is a bore!,"To get myself prepared on watching this movie, I read up on Buster Keaton so I had an idea of what I was getting myself into. I read great things about his acting skills and how well he has done. Once I actually watched the movie I was not as impressed. He acting skills were mediocre compared to watching other actors of his time. When it came down to a joke or a punch line I was not impressed. The story also went too quickly and I felt it was hard to keep up with the story line. I would have to go back to catch what was happening and ask myself what was happening. The story line was not my favorite either. It doesn't seem like they brought the story to life. Even though I was not impressed by busters acting skills I was impressed with the scenery they used. The background was pretty impressive and where they chose to shoot really helped with the story line.",
61,8 July 2018,cinephile-27690,4, I thought it was boring.,"This 93 year old movie tells the story of Sherlock Holmes's son. That sounds awesome, but I could really say otherwise. I found the nearly the whole thing to be dull. 
 There are simply better mystery movies I have seen:
The Great Mouse Detective.(Disney Movie.)
Sheerluck Holmes and the Golden Ruler(VeggieTales show.)
Monk(TV show about a detective with OCD.) 
Nancy Drew(assuming it's still good, it's been like a decade since I last saw it.)
 There are better mystery movies than this. See my bulleted titles instead of this.",
62,10 November 2014,SnoopyStyle,9, Silent era classics,"A meek projectionist (Buster Keaton) is studying to be a detective. He and The Local Sheik (Ward Crane) are competing for The Girl (Kathryn McGuire). The Sheik steals her father (Joe Keaton)'s watch and pawns it to buy expensive chocolate for her. He leaves the pawn ticket in the projectionist's pocket and The Girl's Father finds it. He banishes the Projectionist from his home. The Girl discovers that The Sheik is actually the one who pawned her father's watch. As the projectionist sleeps, he dreams himself walking onto the movie screen where he is Sherlock Jr.",
63,12 September 2012,miss_flowers,7, Brilliant,"First off I'd like to say that the cinematography in Sherlock Jr is amazing for its time. There are hardly any jumps and the camera is relatively steady. The editing and effects are amazing for the time, and I found myself amazed by the little stunts that Buster Keaton did throughout the film. In terms of the story itself, Sherlock Jr has many interesting concepts. It seemed to me that Keaton's character's life was intentionally made somewhat dull and boring so that the action sequences when he slipped into a dream/the movie he was screening (Another brilliant scene, perfectly set to the sound track of the film) would seem even more thrilling. The 'love story' seemed to be more of an overarching plot that sandwiched the real story and provided an interesting beginning and a happy ending. In the scene where Keaton's character entered the movie, the music controlled the scene rather than the other way around. Sherlock Jr. Just puts forth amazingly innovative ideas for the time and is really a joy to watch.",
64,26 January 2021,Prismark10,9, Sherlock Jr,Sherlock Jr is a tour de force of early film special effects and creative editing. The trickery from Buster Keaton rivals pioneers like Georges Méliès.,
65,11 May 2023,Horst_In_Translation,6," Billiard balls, bananas, bombs and the crime-crushing criminologist","""Sherlock Jr."" is an American English-language (in terms of intertitles) live action film from 1924, so this one will have its 100th anniversary next year, which sadly means that everybody who worked on it is no longer alive, but the memory remains and they left their art to us you can surely say. It also means that on the occasion of said centennial anniversary the film will again be shown at movie theaters, which is not a bad thing at all, even if I cannot agree with the fact that this is rated so highly by many that it still sits comfortably inside the imdb top250, in fact is even inside the top200. Not by much though. It is maybe the shortest film there as it runs for 44:33 if I am not mistaken and this only reaches full feature territory by a minimal margin of three seconds if we look at imdb rules and standards. Without these, it could not have been included. But yeah, let's look at the basics here. Needless to say that it is in black-and-white and that the star and driving force behind the project is lead actor Buster Keaton. I like him at least as much as the more famous Chaplin and the less famous Lloyd perhaps who were the defining stars of this film era. Arbuckle too, but he got ousted, still a very underrated talent. As for Keaton, acting was his primary profession, but here and there he also wrote and directed.",
66,8 March 2018,classicsoncall,8," ""As a detective, he was all wet...""","With a film like this made in 1924, you have to wonder why some of the creative effects Buster Keaton developed for this story have never been seen since. They may be out there, but I've never seen anything before like his stroll right into a movie screen to take part in the story that he's projecting for an audience in a theater. He then pratfalls his way through a number of scene changes, remaining in one spot while the action around him hurriedly continues apace. One of the best bits had him nosedive through an open window and into a woman's dress for a stunning visual effect. The question on the tip of your tongue will be 'How did he do that?', or alternatively, 'How can anyone do something like that'?' ",
67,12 March 2012,lee_eisenberg,10, solve the case,"This time, Buster Keaton plays a projectionist who dreams that he enters one of the movies. The movie-within-a-movie has what must be one of the greatest sequences ever filmed, as Keaton's character has a wild ride.",
68,28 May 2009,jboothmillard,10, Sherlock Junior,"I had never seen a Buster Keaton film, and from what I could make out he was the American equivalent of Sir Charlie Chaplin, so I decided to try this interesting looking silent comedy. Basically a film Projectionist (Keaton, also directing and producing) studies to be a detective, and in love with a Girl (Kathryn McGuire). After he proposes to her, his Rival (Ward Crane) steals the pocket watch of her Father (Joe Keaton, Buster's father) making him look guilty. The Projectionist feels disappointed and returns to work projecting a film, and he feels asleep, dreaming that he enters the film playing. In his dream it starts with him entering many numerous scenes as they switch, and then he becomes Sherlock, Jr. to solve the mystery of some stolen pearls by the Villain/Sheik (Crane again) and The Butler (Erwin Connelly). After solving the mystery, and saving the Fiancée (Mcguire again) they crash into a lake, and this is the point when the Projectionist wakes up to to have the Girl come to tell him she knows the truth about the watch, and he follows the film playing to have a good kiss and cuddle. Filled with some fantastic editing and special effects moments really revolutionary for its time, it is a brilliant and fun comedy. Buster Keaton was number 21 on 100 Years, 100 Stars - Men, and the film was number 62 on 100 Years, 100 Laughs. Outstanding!",
69,25 October 2009,gavin6942,9, The Greatest Introduction to Silent Film,"A film projectionist (Buster Keaton) longs to be a detective, and puts his meager skills to work when he is framed by a rival for stealing his girlfriend's father's pocket watch.",
70,7 May 2023,Mymoviediscography,9," ""Sherlock Jr."" - A Timeless Classic with Enduring Charm","Buster Keaton's ""Sherlock Jr."" is a silent film that will keep you on the edge of your seat with its non-stop physical comedy and daring stunts. This timeless classic tells the story of a projectionist who dreams of becoming a detective and finds himself embroiled in a real-life mystery involving stolen jewels and a femme fatale.",
71,6 May 2010,bobtaurus,6," Has Its Moments, But It's Not ""The General""","Having recently enjoyed Keaton's ""The General"" for the first time, I was looking forward to ""Sherlock, Jr.,"" which I understood to be another of his very best. Unfortunately, I was disappointed.",
72,25 May 2000,Norm-30,10, Keaton's BEST film!,"This incredible comedy is far, far better than his (oft over- hyped) ""General""!  The special effects and trick photography are astounding for it's day.  There are sooo many incredible bits:  Keaton on the motorcycle, ""jumping thru the window"" (mentioned in other reviews), and actually ENTERING a movie are classic!",
73,11 August 2017,JohnHowardReid,8, One of Keaton's best!,Producer: Buster Keaton. Buster Keaton Productions. Executive producer: Joseph M. Schenck.,
74,28 May 2011,tavm,9, Sherlock Jr. is one of Buster Keaton's most creative of his movies,"Today was my off day from work so I decided to take advantage of that by going to the Baton Rouge Gallery Center for Contemporary Art to watch their first of their Movies & Music on the Lawn monthly series of what is being referred to as ""Slapstickers"" which would devote the last weekend of each month-until October-to a silent comedy classic of various comedians of which this particular one was the first. Since I wasn't a member of the BRGCfCA, I had to pay $5 for the admission but the experience of sitting on a bench during a cool breeze at night while enjoying a $4 slushie drink and seeing many other groups having their own picnic on the ground while viewing was well worth it. And the live accompaniment of a local band called The (New) Zeelanders-with their electric guitar dominating much of the score-brought a fresh perspective to the happening. Before I review the movie proper, I have to admit to being a little self-conscious when I laughed loudly at many of the scenes since the audience didn't seem to laugh as much or at such a volume as I did but then maybe I would have been accused of doing it too much or too loud by some. Anyway, this was indeed mostly hilarious from beginning to end especially when Buster Keaton found himself in a movie as scenes keep changing. Other highlights include whenever he was on that motorcycle on the handlebars and he kept acting normally not knowing the driver had fallen down during the chase before narrowly avoiding many vehicles and disconnected bridges and especially that whole trying-to-but-keep-on-failing-to-kill-Buster-as-the-title-character by the butler and Keaton's rival. One more thing, if I hadn't known about the ending by reading an earlier book that showed photos of that particular sequence, I probably would have been just as surprised as he was when that happened! So on that note, Sherlock Jr. is highly recommended. By the way, Buster's girlfriend's father here is his actual dad, Joe Keaton.",
75,13 August 2008,Doylenf,7, Highly enjoyable and clever Buster Keaton silent film...,"BUSTER KEATON certainly didn't disappoint his fans when he made SHERLOCK JR. so full of inventive slapstick moments and tricks (such as joining other characters by stepping into a movie being screened). He's in his element here as an inept projectionist wrongfully accused of stealing a watch and then having to prove himself to ""the girl."" He's really the sole reason for watching this silent comedy, nicely restored and shown recently on TCM.",
76,17 January 2019,HotToastyRag,8, Very inventive for the time,"Sherlock. Jr. is a total classic in silent film history. Not only is does it star silent film icon Buster Keaton, but it utilizes very imaginative filmmaking during a time when it wouldn't have been necessary. In 1924, anyone who went to see this movie would just be looking for a cute romance, some laughs, and a dangerous stunt or two. No one was expecting magic tricks, special effects, and inventive storytelling that would influence filmmakers 90 years later. If you liked Christopher Nolan's Inception, you should know that the idea of a film taking place inside a dream first came from Sherlock, Jr. If you liked Woody Allen's The Purple Rose of Cairo, the film-within-a-film technique first came from Sherlock, Jr.",
