Review_Date,Author,Rating,Review_Title,Review,Review_Url
0,13 September 2006,imogensara_smith,9, Through the Movie Screen,"Buster Keaton's most surreal movie sprang from his insistence on logic and realism. His tribute to cinema was inspired by stage magic tricks he remembered from his vaudeville career. His most dazzling and original movie is also one of his least formally perfect. All these paradoxes belong naturally to this ""through the looking glass"" work, which examines the dream-like nature of filmor is it the film-like nature of dreams? ",/
1,17 September 2020,Xstal,8, Anything but Elementary...,"You can only marvel at the craft of Buster Keaton. The choreography and precision in coordinating these stunts and sequences would be astounding and breathtaking whatever period of cinema they came from but more so here as the medium was still in its infancy. For an imagination to conjure up such things, with the practice and patience to perfect them, can genuinely be considered genius. A performance by an absolute legend of silent picture perfection.",r
2,16 September 2006,didi-5,9, marvellous and inventive,"This Keaton classic is both funny and extremely clever in its construction. Our hero is a cleaner but dreams of becoming a detective, always with his nose buried in a book on the subject.",e
3,5 March 2006,up2u,10, A World of Possibilities,"Not only is this Buster Keaton's best film, but it is among the greatest achievements in the history of cinema, period. While it is not a feature-length film--and thus barred from most critics' lists of great films--it invented just about every single basic special effect known to movies (except for morphing). The story itself, about a film projectionist who desires to become part of the movies, and then does, by walking right onto the screen, made palpable the desire that we all have to be in the movies: To get the girl, to be an action hero, to outsmart the bad guys. Keaton invented meta-cinema before anyone even had a phrase for it.",v
4,14 September 2005,Polaris_DiB,10, Intensely Poetic and Creative,"Though a lot of older films tend to be neglected, Sherlock Jr. definitely isn't a film that could be called obscure. I imagine most people at least know OF this movie with its famous movie-in-a-movie surrealist scene.",i
5,8 January 2002,Damfino1895,10, A hard act to follow,"As I sat reading the other reviewers comments I wondered what I could add. Oddly enough I watched Sherlock jr only this afternoon, after so many viewings it still amazes me how far ahead of his time Buster Keaton was, often copied, rarely equalled never surpassed. I would hate to be the kind of movie fan who never watches silent or black and white movies (you'd be surprised how many there are). So if you are like that do yourself a favour, get hold of a copy of this movie and enjoy, it shocks me that films such as 'Something about Mary' are rated higher than this masterpiece of comedy, there is nothing wrong with 'SaM' even I laughed at it, but, watching it once was enough, however I watch Sherlock jr again and again in pure amazement at Buster Keaton and his cameraman, Elgin Lessley's achievements without the aid of modern technology, like most other's the scene where he dives through a window to reappear as a little old lady gobsmacks me, how did he do it? Keaton can only be described in one word, genius. I have to add that I have the Kino version on DVD with the appalling soundtrack, but, luckily I also have it with a more appropriate soundtrack, which is far superior and adds extra enjoyment to an already fabulous movie.",e
6,11 October 2020,AlsExGal,10, Very inventive short feature,"Sherlock Jr., is only 45 minutes long. It actually failed when it was released, but today it is considered ground-breaking. Keaton performs some stunts such as appearing to jump through a woman backed up against a fence that remained a secret for years. He also, at the beginning of the film, jumps into a motion picture that is running in the theatre where he works as a projectionist. Once on the movie screen, Keaton has to adjust his strategy as the scene changes from the front steps of a house, to the edge of a cliff, to a lion's den.",w
7,9 March 2019,TheLittleSongbird,10," Footage of laughter, romance and technical audaciousness","Am somebody who likes humour with wit and sophistication when it comes to comedy (that's why so many pre-1970 comedy appeals a lot to me), while appreciating comedies with a broader style providing it doesn't become too vulgar and the risque kind. Have found though that in recent years that there has been those that are very juvenile, crude and even puerile to the point of offensiveness, which is as one may have guessed appeals to me far less.",/
8,15 November 2003,Nich-merry,10, A rare treat :),I have to say that this is by far Keaton's finest work. I have seen and own about 19 of his films/short films and this is the one that truly stands out.,r
9,14 July 2018,grantss,9, A classic of the Silent Era,A young man works as a projectionist at a movie theatre but dreams of becoming a famous detective. His studies toward this goal are put to the test when visiting his girlfriend. A rival steals his girlfriend's father's watch and frames him for the crime. He is forbidden from seeing her again. Now he must fight to clear his name.,w
10,13 May 2015,JimDenney,8," short, silent, and really funny","My second silent film for the class that I viewed for my class was just as entertaining as the first, which was Charlie Chaplin's The Circus. Buster Keaton playing the role of the movie projectionist Sherlock Jr. was very entertaining. The story is simple, yet interesting and fun, and the movie comes in at much less than one hour, 44 minutes to be exact. While there are a few points in the movie that are disjointed and not as fun, overall you can stay engrossed enough until you get to some really cool and innovative special effects, which given the technological limitations when this was filmed in the 1920's are simply amazing.",2
11,23 September 2019,evanston_dad,10, Very Special Movie,"""Sherlock, Jr."" is a very special Buster Keaton movie about a projectionist who wants to be a professional detective and plays out his fantasy by entering one of the movies he's projecting.",6
12,3 September 2019,gbill-74877,10, Masterpiece,"Buster Keaton shows such genius in this film. It's a breathtaking moment when he walks into the screen for the movie within a movie, and one of my favorite in all of silent cinema. From there we are treated to lots of impressive stunts, many of which were quite dangerous, as well as nearly nonstop visual playfulness and misdirection. Loved the slick pool play too. An absolute gem.",7
13,29 December 1998,Taz750,10, Absolute Magic,The best silent I have seen yet.. Buster Keaton's a film genius for making a movie like this.. the scenes where the film surroundings change while Buster is in the film is hilarious and even seems hard to make as a realistic special effect today. His stunts are great and its amazing that he did them himself. They're all perfectly timed and done and look as hard as they must be. This movie is one of the best.. Not a single sound the whole movie and I enjoyed it greatly.. Keaton is without a doubt the best comedian.. better than Chaplin or anyone else.,1
14,6 May 2014,estebangonzalez10,6, Magical FIlm,"""We are lost! He is sending for the world's greatest detective - Sherlock Jr.!""",7
15,5 June 2000,zetes,10, Almost certainly the funniest comedy I've ever seen.,"Yes, counting all the comedies I've ever seen, silent or talkie, this is probably the funniest. I was lucky (boy, was I lucky!) to see this in a theater with a live piano player. Ever scene is brimming with comic genius, cinematic inventiveness, and just plain perfection. I laughed almost nonstop from beginning to ending. Jokes that seem liked they lasted 10 minutes were funny for their entirety. After the performance was done, I think the audience clapped for 10 minutes, and they (the pianist and Buster Keaton) deserved at least that much, if not an hour more. 10/10",5
16,26 September 2019,saraccan,7, Brilliant for its time,"If you watch some of the other movies that came out in the 20s, you will quickly notice how innovative this movie was. It brought so many new and interesting ideas into what film making can achieve. I really think its worth seeing just for its uniqueness even if silent films aren't really my thing.",7
17,28 April 2020,sean-ramsden,8, Brilliantly Worked Out Gags,"Sherlock Jr. is one of Buster Keaton's best films, and possibly his greatest. The film starts somewhat slow as it sets Keaton up to be a struggling wannabe detective. There are some comedy moments that play well and the opening is rather enjoyable.",/
18,26 September 2008,Quinoa1984,10, one of the seminal Buster Keaton comedies,"Buster Keaton has cajones the size of watermelons. This isn't just to say in the stunts that he executes- sometimes, apparently, to great physical and personal risk- are at big comic peril, but that he's fearless with what he wants to try as a filmmaker and scenarist. Jokes that I thought would never really be fresh are taken in 1924 in ways I didn't think could be funny, but are. Take a small bit where Keaton's character (one of them, anyway) plans to sabotage a nefarious guy with a slip on the banana peel. For a moment this is groan-inducing, but watching how it's executed it becomes something really, really gut-busting. There are little bits like that, and then those huge scenes of choreographed mayhem: a blast by water after hanging off of a moving train, a chase through a town that includes a sudden chance of a road connected, jumps through small holes and windows at the nick of time that are half pure Keaton and half exciting editing.",?
19,5 February 2012,secondtake,10," Conceptually brilliant, easy to like, and compact...don't miss this!!!","Sherlock, Jr. (1924)",r
20,21 November 2000,Paul-271,10, Astounding,"This movie is breathtaking and astounding. You've heard those things before, but not from me. Today we have few films that combine special effects with a riveting story. Some would say Star Wars did so, and I'd agree to a certain extent, but no movie that I've ever seen work a story integrated with special effects like this one. If you aren't as amazed by this tour de force as I am, check your pulse. You're dead.",e
21,2 February 2023,I_Ailurophile,10," Timeless & essential, a classic, must-see treasure","Whether it's a matter simply of preservation or also of restoration, the first aspect of the film to catch one's attention is how astoundingly crisp and clean the image is; I don't think I've seen ANY other silent picture that was so extraordinarily pristine. There's a small part of me that would easily believe this was actually made in at least the 40s or 50s, not the 1920s. That's before we consider, of course, the unmistakable visage of Buster Keaton in his cinematic prime, and all the joy that follows therefrom. The storytelling is simpler, and perhaps a little more kitschy, and so is the film-making, yet full of heart and good comedy that truly never gets old. We can always rely on Keaton for robust situational humor and delightful sight gags and performances, if not also outstanding stunts, and that's certainly what we get in 'Sherlock Jr.'",f
22,3 October 2018,weezeralfalfa,7, Keaton blurrs the distinction between movies and dreaming,"At only 45min., this silent comedy isn't that much longer than some 3 reel comedy shorts, yet, it apparently qualifies as a feature-length film. I don't see this film as being greatly superior to the many Keaton comedy shorts I've seen. .......It starts out very slow, with Keaton and his girl sitting together for an eternity, not knowing what to say to the other. Finally, Keaton gives her a cheap engagement ring. Keaton is a mere movie projectionist, who dreams of becoming a detective in the class of Sherlock Holmes........I thought the $1.00 bill caper was cute, if unrealistic. Keaton wants to buy a $3. box of candy for his girl, but he only has $2. Luckily, he finds a $1 bill in his sweepings, also being the theater janitor. Unluckily, a women comes, complaining she lost a $1 bill in the theater, and he gives it to her. Then, another woman shows up claiming she also lost a $1 bill in the theater. Keston gives her his $1 bill. Then a mean-looking man shows up wanting to look through his sweepings. Keaton hands him his last $1. bill, but he refuses. Looking through the trash, he spies a wallet with some greenbacks in it, and goes off with it. Keaton then spreads the trash out, looking for another wallet. But, of course, he doesn't find such. Thus, he goes to the store, and buys the $1. box of candy. However, he converts the $1. price tag into a $4, to impress his girl. But, this deception will return to haunt him........While Keaton is talking to his girl, his competitor(villain) , in the form of Ward Crane, arrives, in a splendid outfit, and bringing a bigger box of candy, as well as a more impressive engagement ring. Keaton is relegated to the hall. Soon, the girl's father reports that his gold watch is missing. The Villain slips the receipt for the watch he hocked at the pawn shop into Keaton's jacket pocket. Then, Keaton says he will act as a detective, and search every one. The Villain requests him to also search himself, and he finds the pawn receipt, which says $4 for the watch., which matches the $4 price tag on the candy box. Keaton is requested by the girl's father to leave and never return. ........Still imagining himself to be a detective, Keaton shadows The Villain, as the most likely suspect, in his mind. Eventually, he winds up in a boxcar, locked in by The Villain. Luckily, there is a hatch in thr roof. Just then, the train pulls out of the station. Keaton runs along the top of the cars to keep him near the water tower. When he runs out of cars, he jumps onto the tower dispenser, which lowers and begins to release water, which practically drowns Keaton(Keaton suffered a serious neck injury in this event.) . He then runs back to his projectionist job, where he soon dozes off.......Meanwhile, his girl goes to the pawn shop with the receipt and asks the pawnbroker what the man who traded the watch looked like. He was tall and had a black moustache, which fit the description of The Villain, but not Keaton. She was satisfied that Keaton was telling the truth that he knew nothing about the watch pawning........Some reviewers say they are confused which events take place in his upcoming dream, and which really happened. According to my notes, the dream begins about the 20min. mark and lasts until the 41min. mark, just a few minutes before the ending. Among other things, Keaton dreams he walks into the movie sceen and interacts a bit with the actors. Then, he is thrust into various odd or dangerous situations, in which his pose at the end of one situation carries over to the beginning of the next situation. ......He dreams that the Villain steals a pearl necklace from his girl's mother. He takes this to a shack where his confederate thieves hideout. Keaton shows up at the hideout. Initially, captured, he breaks loose, and grabs the pearls The Villain is dangling before him, and runs.........The next gag has Keaton cornered in an alley by several of the gang. He jumps into the belly of a tie salesman, standing behind him and disappears. The gang finally find him hiding behind a rotating section of the wood fence behind. He runs, and the gang chases him. A cop on a motorcycle appears and invites him to ride on his handlebars. Soon, the cop is bumped off, without Keaton knowing it, and the cycle negotiates around various obstacles without Keaton's help, until it comes to the shack where Keaton's girl is being held, where it rockets him into the shack, he hitting the guard. Soon, the gang arrives in a car. They trick the gang, and take their car, which ends up in a lake: just the top part, which sails a ways before sinking. Keaton wakes up, and his girl arrives to tell him she believes him innocent of stealing the watch.. The movie on the screen is about to end, with the man hugging and kissing the woman. Keaton imitates what they do on the screen , with his girl. The end.",_
23,27 October 1999,alice liddell,10, Hilarious and philosophical - what more could you want?,"Along with SUNRISE, the greatest movie from the silent era.  While not stinting on extraordinary sequences of slapstick - the bicycle scene is justly admired and unsurpassed - it is the growing richness of Buster's persona, and the breathtaking analysis of the medium itself that today astonishes.  An anti-detective work ahead of its time, it both celebrates film as a repository of our dreams and desires, and critiques it for engendering passivity.  Crucially, it is very, very funny.",=
24,11 January 2022,springfieldrental,9, One of Keaton's 'Trickiest' Films,"In his earlier 1924 film, April's ""Sherlock Jr."" Buster Keaton came up with the idea of having his film projectionist character, through a dream, jump from a theater's audience into the screen, becoming an actor in the projected movie. Being in the movie gave the former vaudeville actor the opportunity to insert a variety of tricks he performed on the stage years earlier. His writers scripted a plot where his girlfriend's father has his watch stolen, and Buster's love rival frames him. As an aspiring detective, the film projectionist dreams of being the hero of the movie he jumps into. Perfecting each stunt required an inordinate amount of preparation time, so much so it took four months to film, double the normal Keaton production.",t
25,28 January 2010,TOMNEL,10," These jokes stand up 85 plus years later...despite it's age, this is a timeless comedy.","Director and star of this film Buster Keaton really knew how to get a laugh. This guy's physical jokes were really great, and instead of going for stupid over the top acting, he actually gives a fairly straight performance, relying on the wackiness and humor of the situation to provide his laughs. And despite being a black and white silent film, this thing still stands up today, and it's still genuinely funny!",t
26,2 August 2017,alexanderdavies-99382,10, One of many Jewels in Buster Keaton's crown!,"""Sherlock Jr."" is one of many masterpieces made by Buster Keaton and he established himself as a force to be reckoned with in the Art of Silent Comedy. Dare I say this but the best of Keaton narrowly surpassed the best of Chaplin. The story of ""Sherlock Jr."" concerns Buster who works as a projectionist at a small town cinema. He has dreams of becoming a detective and avidly reads up on the subject. Whilst projecting a film, Buster falls asleep and ""Sherlock Jr."" enters fantasy via a dream scene.There is some excellent camera trickery but I don't recall the exact details of how it was done. In this fantasy sequence, Buster proceeds to the big screen in the cinema and appears to enter the screen itself. It is a dazzling and original piece of filmmaking and I doubt if Keaton's rivals could have created this. Eventually and after he's awake, Buster has a chance to prove he can be a fully fledged detective. His attempts at tailing a suspect are absolutely uproarious. There is a chase scene involving Buster sat on the handlebars of a policeman's motorbike. The film isn't a long one, 45 minutes but it is an undisputed classic.",_
27,18 November 2022,jamesjustice-92,10, Cool head above the hot madness,"Not everything we see is really how it is in reality: the way we imagine things tends to be more romantic, idealistic or vice versa, over the top and nonsensical - the power of imagination is truly unlimited and pretty much everything we can make up in our heads can be materialized. All we need is a little kick in the behind.",u
28,9 December 2006,Igenlode Wordsmith,8, Back to Buster,"Having consumed every on-screen frame of Buster Keaton I could get myself exposed to, from the good and the bad to the occasional cameo and the outright peculiar (yes, that would be you, Samuel Beckett...), I find myself in the position of starting to re-watch the films that I know -- and in the absence of a DVD player, that means seizing upon screenings as and when they show up! Having been subjected to various dodgy projections and mediocre musical accompaniments, I was beginning to harbour a secret, guilty fear that maybe Keaton's comedy, so skilled at taking an unsuspecting audience by surprise, might be lacking in replay value; having had a couple of disappointing experiences with films I'd originally reckoned to be among his second rank, I was getting a little paranoid at the prospect of re-viewing the ones I'd enjoyed the most in the first place.",r
29,28 August 2021,bretttaylor-04022,7, Very short but very good silent comedy,At just 45 minutes long this is more a long sketch than a feature film. Buster Keaton plays a cinema protectionist who is learning about becoming a detective in his spare time. After being accused of stealing a watch he falls asleep at work and dreams of being in the movies. Full of hilarious stunts and catching out the villains without realising this is a very good short movie.,v
30,16 November 2012,romanorum1,10, Impressive Imagination: Movie-within-a-Movie Surrealism,"A timid young man employed as a ""moving picture operator"" (projectionist) in a small town theater studies to be a detective. He is not too attentive in his job duties. At a confectionery shop he buys his girl a one-dollar box of chocolates. At the house of his girlfriend, he gives her a tiny ring (along with a magnifying glass) and the small box of chocolates. Then his rival – a cad with a mustache – intrudes and cunningly steals a watch from the girl's father's jacket. He goes to the local pawnshop and uses the funds to buy Buster's girl a four-dollar chocolate box. Back at the girl's house, he sneakily slips the pawnshop receipt into Buster's jacket pocket. When the father discovers his missing watch and later the pawnshop receipt in Buster's pocket, he kicks Buster out of his house. Buster, though, shadows his dastardly man real closely until he is discovered and tricked by his adversary. Now we have one of the all-time classic movie scenes. Buster – without a stunt double – runs along the tops of moving train boxcars. He leaps and grabs the release cord of a large water tank spout, gets soaked, rides the water stream down to the ground, and runs away. Years later he learned that he had sustained a fracture of one of his neck bones. No wonder he had headaches! ",
31,29 January 2023,moritzherz,3, Today nearly unwatchable,"When I first saw this movie in the 250 list I thought, well 40 minutes is worth a try. Then the movie came to Prime Video and I watched it. Well what shall I say about it. I watched the best Charlie Chaplin movies without tone and colour and I really liked the Goldrush for example. But in comparison to this Sherlock Holmes Junior is just nothing. I quickly turned away and did something else meanwhile the movie run in the background. It's just not for me. I'm sure that some people will like the movie because they love this old pieces of art but especially younger people just like me will have some issues. I watched it because it's on the list and that's it.",
32,12 September 2005,rdjeffers,9, David Jeffers for Tablet SIFFblog,"Monday September 12, 2005 7:00pm The Seattle Paramount Theater",
33,27 March 2022,emryse,7, Buster Keaton is a Genius,"I was massively impressed by this film, it managed to convey it's story in a way that was easy to follow without very much dialogue, it had some of the best stunt work I've ever seen and to top it all off really solid cinematography, not to mention a good cast. It seems Keaton was involved in almost every aspect of this film from directing and starring to filling in as a stunt double and he certainly knew what he was doing. He steals every scene and managed to make a film that feels truly timeless. We're approaching the 100 year anniversary and I'm sure people will still be talking about it in another 100.",
34,15 December 2018,patriciogl10,9, Magical.,"While this isn't even my favourite Buster Keaton film, it is still groundbreaking material. In a time period where there were endless possibilities because films were relatively new, Buster was exuding creativity, most notably from a technical standpoint. There are many stunts on this film that account for his ingeniousness and inventiveness, for example Buster leaping through the body of his assistant, Gillette in order to escape the gangsters; the 'movie within a movie' part which was absolutely brilliant; the motorcycle stunt which was
phenomenal; to name a few, I mean Buster was an incredibly talented performer, you could even say he was a magician, for the work he did on this film feels ethereal, dream-like and magical, even though it is essentially
a detective story. Or better yet, a story of an enthusiastic man who dreams of becoming a detective. He is kind of sloppy and above all things, he's been blessed by luck.",
35,26 October 2005,claudio_carvalho,8, Ahead of Time,"A projectionist (Buster Keaton) is studying to be a detective and is in love with a young lady. When he proposes her, his rival steals the chain watch of her father and incriminates him. The disappointed young projectionist returns to his job and while projecting the film, he dreams on being the detective of the story. Meanwhile, the girl finds the truth and acquits the guilty of the projectionist to her father.",
