Review_Date,Author,Rating,Review_Title,Review,Review_Url
0,10 April 2022,PedroPires90,9, Real world,"I'm completely tired of people who think films should only have black or white characters, people who think films should not show racism, homophobia, stupid people, like that is not...the fu****' real world? That's why I think I like this much. It's not afraid to shock and it's not afraid to make you think. Good people make some bad things. Bad people make some good things. People can change. I know this is a lot for this new world order where you are right 100% of the time or wrong 100% of the time, but this is what being human means.",/
1,7 December 2017,blanche-2,8, Anger begets more anger,"Frances McDormand is a grieving mother who puts up ""Three Billboards Outside of Ebbing, Missouri"" in this 2017 black comedy directed by Martin McDonagh.",r
2,4 December 2017,tyson-hunsaker,9, A thought-provoking and darkly comedic drama with lots to say.,"""Three Billboards outside Ebbing, Missouri"" marks a milestone for writer/directer Martin McDonagh and is an idea piece on a mother's struggle with her town after posting billboards containing a call to action in regards to her murdered daughter. With outstanding screen writing and near perfect editing, this powerhouse of a film is easily one of the best all year and is driven with force and intensity by its lead, Frances McDormand.",e
3,17 February 2018,Semisonic,9," Anger, what it begets, and what to do about it","When you think about great cinema, you often imagine some grandiose epic setting which all that greatness builds upon. The likes of Gone With the Wind or Godfather or The Shawshank Redemption, such films span through decades or cover the major historic events.",v
4,21 June 2021,ronakkotian,10, This is how a drama should be!,"Martin McDonagh has made critically acclaimed throughout his career. I haven't seen In Bruges but I liked Seven Psychopaths. However, it's with Three Billboards Outside Ebbing, Missouri that made me realise what a talented writer and director he is.",i
5,9 February 2018,TheLittleSongbird,8," Comedy, tragedy and morality rolled into one","Saw 'Three Billboards Outside Ebbing, Missouri' on the promise of one of the year's best trailers, the immensely talented cast, the intriguing subject matter, the receiving and pending of numerous accolades and being familiar with Martin McDonagh's previous work. ",e
6,16 October 2017,rubenm,9," Extremely funny film about grief, anger, revenge and violence","It seemed that the pregnant police detective Marge Gunderson from 'Fargo' would forever be the most memorable character of Frances McDormand's acting career. But now I'm not so sure. Mildred Hayes, the heroine from 'Three Billboards', is a serious contender. This might well be her best performance ever.",w
7,25 November 2017,chicagopoetry,7, Beware the p(l)ot holes near the billboards,"I will say that I enjoyed this film, mostly due to Frances McDormand's performance. It was surprisingly funny given its subject matter. But after thinking about it for a few days after watching it, I have to say a few words about the writing, because it seems everyone is raving about how ""Oscar worthy"" the writing here is, and at first glance, I thought so too. But thinking back on it, I'd have to say the writing is actually pretty sloppy. There's a lot of stuff here that doesn't make a whole lot of sense, and I mean a lot. I can't explain this without revealing spoilers, so be warned.",/
8,30 October 2017,FallonTimberlake2016,10, A comedic masterpiece with a stellar leading performance from Frances McDormand.,"Three Billboards Outside Ebbing, Missouri is a dark comedy that has an a-list cast with names like Frances McDormand, Woody Harrelson, Sam Rockwell, John Hawkes, and Peter Dinklage. It centers around Mildred Hayes, a woman whose daughter was raped and killed, and who believes that the local police have not done enough about it. In reaction, she erects three billboards outside of her town that send a message to the sheriff about the state of the investigation.",r
9,19 April 2018,bkoganbing,9, Inconsolable grief,"It's ironic that the first of Frances McDormand's Oscars came for her portrayal of a
sheriff in Fargo. For her second one she plays the antagonist to a sheriff she
feels isn't doing her job. The sheriff is a most popular individual in the town,
Woody Harrelson. But this is a woman with a mission.",w
10,18 September 2017,GODZILLA_Alpha_Predator,9," A dark, twisted comedy about grief, tragedy and three billboards","Having recently won the People's Choice Awards at TIFF, Three Billboards outside Ebbing, Missouri is very easy to see why it won.",4
11,28 December 2017,MongoLloyd,4, Is this a masterpiece?,"Pretty cool cast, and interesting premise muddied by oddities, implausibilities, and a juvenile sense of story. Is this a film set in a world where crazy stuff happens as a matter of course, or a normal every day world where crazy stuff happens every now and then? In this film, I see pretty normal people doing normal things and having normal things happen to them, so why is it the writer/director chose to litter what could have been a very good film with SO much bizarro bs? And with literally ZERO character development? ",4
12,4 December 2017,damian-fuller,9, Fires Of The Heart,"Frances McDormand is, without question, one of the very best actresses of hers or any generation. Wow! And like most of the greatest she goes for characters who don't ask for sympathy. The truth is in her eyes, always. So, naturally, I followed her every inch of the way. She is surrounded by a fantastic group of actors. Woody Harrelson is just extraordinary but perhaps the biggest surprise is Sam Rockwell making his one eighty not just believable but very moving. Martin McDonagh's writing is the magic potion that keeps everything together and when I say everything I mean everything. Humor and horror as if it were practically the same thing. The dialogue is brilliant and Frances McDorman deserves the last paragraph. Her face is a wonder. Superb performance. Don't miss it.",9
13,4 February 2021,Sleepin_Dragon,9, A powerful film that draws many emotions.,"Mildred refuses to give up in her fight for justice for her murdered daughter, she puts up three billboards blaming The Police incompetence.",5
14,2 March 2018,gradyharp,10," 'All this anger, man, it just begets greater anger.'","Martin McDonagh (In Bruges, Seven Psychopaths) wrote and directed this very tough but brilliant story about anger, revenge, agony, prejudice - and redemption. Every character in this dramatic tour de force is drawn with equal parts hate and anger - with a dollop of hope and forgiveness and reconciliation in the end. It is a phenomenal achievement. ",2
15,10 January 2018,claudio_carvalho,7, Deceptive Ending Without a Conclusion,"""Three Billboards Outside Ebbing, Missouri"" is a great crime movie in an environment of grief, anger, remorse, racism, violence, sympathy and a sophisticated black-humor. The performances are top-notch and it is hard to point out only one or two names in the cast, indeed a constellation of stars. Maybe the performances of Frances McDormand, Woody Harrelson and Sam Rockwell may be highlighted since they are the lead. Unfortunatelly the deceptive ending without a conclusion throws cold water in this film. The redemption of Dixon finding the rapist killer would have given some hope to the story. But the author decided to keep a dark ending without conclusion. Claude Chabrol was a master in mystery films with open end; however his conclusion were subtle and ambiguous, giving the chance to the audience to discuss possibilities based on his or her interpretation of the storyline. But the conclusion of ""Three Billboards Outside Ebbing, Missouri"" is indeed a cliffhanger usually used in TV series or films written for franchise or at least a sequence. My vote is seven.",3
16,2 December 2017,Turfseer,3," Overrated quirk-fest from playwright turned screenwriter, seeks redemption for vigilantes","Combine the quirky characters of the master of quirk, Wes Anderson, and sensibility of adolescent wish fulfillment fantasy director Quentin Tarantino, and what do you end up with? The year's most overrated ""black comedy,"" Three Billboards Outside Ebbing, Missouri. It's the work of playwright by trade, Martin McDonagh, who's been quoted as saying that he prefers writing for film over theater (why couldn't he stick with the stage if that's his primary area of expertise?).",8
17,16 February 2018,ramfat,4, The best way to express your grief is by committing multiple felonies.,"First, let's all just accept the premise that police beat up random black people for no reason whatsoever. Also, police are inept, because they can't find someone to arrest for the murder and rape of your daughter, even though there is zero forensic evidence. Next let's take a moment to reflect on the time you told your daughter ""I hope you get raped on the way too"". Now it's time to start lashing out at the world because you are angry. Start by committing 2 felonies against a dentist. It's also a good idea to go into a police station and tell them what horrible people they are. When your signs get set on fire, climb onto one of the burning signs and stand at the top of the flames. Next, fire-bomb a police station, because you are still mad, even though there is still no evidence or suspects. Finally, if you can't find the actual person who committed the crime, instead go murder a complete stranger on a hunch. This is all very profound and heart-wrenching...can't you tell by the music?",/
18,1 April 2018,areatw,8, Unusually deep for a crime drama,"Original, deep and thought provoking films like this one are hard to come by these days. 'Three Billboards Outside Ebbing, Missouri' takes a completely different approach to the conventional crime drama. Instead of detailing the story behind the missing girl, the focus is instead of the mother's way of dealing with the disappearance and how she handles her grief and anger towards the authorities.",?
19,3 June 2018,Lejink,1, Ebbing away,I'm not much of a fan of the whole Coen Brothers non-linear method of film making I have to say and identified quite early on that this particular movie fell squarely into whatever category that might be. I guess I should have known from the offbeat title and cast that things would go every which way but loose and so it proves.,r
20,10 November 2017,cdcrb,4, bitterness and hate rolled into one,"it's unfortunate to use the word comedy, dark or otherwise, with regard to this film. unpleasant would be a better adjective. if you've seen the trailer you know what the billboards are about. if not, you'll know when you see the movie. revenge and guilt are being served up cold. deep down, apparently, every one has a heart of gold. racists, wife beaters. whatever. I did not buy it. others have.",e
21,23 February 2018,Fella_shibby,10, Awesome film. Very entertaining inspite of the matter being serious n dark. The mamma's boy deserves an Oscar.,"Saw this in a theatre. Very entertaining film with relevant social issues. The film deserves best film Oscar n Rockwell best supporting actor.
The best part about this film is the character development and the awesome ensemble cast and their performances. 
Frances McDormands performance is solid but Sam Rockwell cannot be ignored n Woody Harrelson is always a treat to watch.
Another great aspect is the writing. McDonagh did a terrific job. He tackled the films serious dark material very well n made the film bearable to watch by adding enuff humor, unpredictability, tension n beautiful locations. The editing n cinematography is good too. This film was captivating n mesmerising n not at all slow as compared to most Oscar nominated films.
Havnt seen the directors previous films but will definitely check it out as after watchin this film i can b sure of em being good.",f
22,18 March 2018,SnoopyStyle,6, so many issues,"In the town of Ebbing, Missouri, Mildred Hayes (Frances McDormand) rents three billboards on an isolated road to berate police chief Willoughby (Woody Harrelson) for his failure to find her daughter's killer. Willoughby is actually dying from cancer and the town ostracizes her. Dixon (Sam Rockwell) is a volatile racist deputy living with his overbearing mother.",_
23,29 August 2018,gbill-74877,6," Entertaining, but flawed","There is so much pent-up rage over the handling of rape, and police behavior in general, that I think Frances McDormand's character in this film really struck a chord with people. She's on a crusade for her daughter who was raped and killed, and yet no progress has been made in the investigation. She doesn't care who she offends, she won't be intimidated into silence, and she'll stand up for herself in some violent ways. In an interesting twist, the police chief (Woody Harrelson) has pancreatic cancer, so aside from being called out on his investigation, he's dealing with that. The scene McDormand and Harrelson have in an interrogation room, and a specific moment of that is easily the film's best. Harrelson provides a voice of wisdom in the film, and the three letters he pens are also quite touching. There is humor as well, in just how boneheaded one of the policemen (Sam Rockewell) is, and the gem of a moment when Peter Dinklage, otherwise largely wasted, utters the line ""Penelope said 'begets'?"", in a subtle burn of the 19-year-old now dating McDormand's ex-husband.",=
24,5 March 2018,ElMaruecan82,10, So 'Ebbing' Great!,"Billboards... Ebbing... So many ""B's"" but a B-movie it sure ain't... far from it actually, this is high-level film-making, a movie meaning ""B"" for excellence, B as in Business!",t
25,19 December 2018,ewgers,6, Had legs but runs out of steam,"This film leaves you extremely frustrated .
The Idea of the storyline was different but sadly fails to deliver",t
26,19 February 2018,novagirl11,7, great acting!,"Slow but not boring. dark, intense and complex and not predictable. incredible cast but still felt realistic. powerful and engrossing but not a feel good film",_
27,27 February 2018,Coralknight,2, A LOT to overlook,"OK, let's just forget all the plot-holes here; like the fact that two people sitting in front of a burning police station would not simply be ""free to be on their way"". Or like a police officer throwing another man out a window and being witnessed by the police chief would simply be asked to turn in his badge and gun. Or that a woman who has an apparent blood-lust, capable of fire-bombing a building and watching a man on fire simply crawl out while doing nothing would let another strange man threaten her, break her items, then just let him walk away without reporting it. Yes...let's forget these and the MANY other plot holes in this entire mess...and what are we left with? Just a sad, bitter sermon on how all men are just plain evil if left to their own devices...yet white women must always get a pass in life (just because...don't ask why or you're a misogynist!) What this campy, meandering, cartoonish and pointless film DOES confirm is that most people are idiots, and will ""love!"" any film that confirms their belief or opinions.",u
28,12 February 2018,dirty_chords,4, Far from a great movie,"I can understand how one can adore this film. Of course it had some very interesting ideas and tried to make certain points, but in the end it was a tonally indecisive mess. Here are some of my main reservations:",r
29,3 March 2018,richard-1787,9," Remarkable for the creativity of the script, among other things","I just saw this movie, and I found it remarkable. Yes, there is some very fine acting in it, which I will leave to others to praise. What I found remarkable here was the script, not the dialogues so much as the plot development. There are several surprise developments, twists and turns that catch you - or at least me - of your guard. But they never struck me as forced, they always made sense within the context of what had come before. The lead characters were allowed a complexity that I appreciated.",v
30,2 March 2018,Darth_Osmosis,9, Amazing!,"Three Billboards Outside Ebbing, Missouri - It's a bleak movie, and I do mean bleak! But it's so well made that it never becomes overbearing or depressing to sit through. In fact it's interesting, moving and entertaining throughout. The script must have been really tight, the writing is some of the best I have seen in recent years and acting is superb. Everyone brings their best(or close to) in this, but Frances McDormand steals the show with an amazing performance. If she doesn't win best female actor then something is really wrong.. It's also my pick for the best picture.",
31,1 January 2018,grantss,6, Not bad but lacks focus,"In an effort to track down who raped and murdered her daughter, Mildred Hayes has three billboards erected outside her town of Ebbing, Missouri. They accuse the Sheriff of doing nothing to catch the killer. This causes a largely adverse reaction amongst the town's folk , not least one of the sheriff's deputies, the hot-headed, irascible Jason Dixon.",
32,4 March 2018,secondtake,10," A great movie, in many ways flawless",Three Billboards outside Ebbing Missouri (2017),
33,30 December 2017,jtindahouse,10, How can one film be so perfect in so many ways?,"Last year I had the unfortunate duty of giving the eventual Best Picture winner at the Academy Awards a negative review. 'Moonlight' was not a movie that sat well with me. Now this is a very early call on my part but I have a sneaking suspicion I'm writing the review for the 2018 winner as we speak, and I can assure you it's not going to be a negative review this time around. 'Three Billboards Outside Ebbing, Missouri' is the finest film I have watched in a long time. How a film that can break your heart so effortlessly can also manage to be so damn funny and charming at the same time is simply beyond me. It shouldn't be possible. However writer/director Martin McDonagh proves that it can indeed be done.",
34,17 February 2018,tedd0093,9, Drama and comedy at the highest level,"I went to see this movie because I hadn't seen any trailers to it. It's something I do because trailers are unreliable and spoiling, but also this case was based around the sheer number of good reviews. I can't even describe how surprised i was when i started to invest in the drama, and I really got my money worth when seeing it in the theaters. This is a movie that grips you good from the start, and holds the tension of the backstory right up until the end. The characters are phonemically written, and the actors did a hell-of-a-good job portraying them. This is a movie that could have been written off with a ""strong protagonist""-cinda-story, but unfolds to a much more deep and philosophical tone. To be honest! not much happens in this film, but because of the powerfull characters within - every little detail about their lives, becomes of great importance throughout. I can say without a doubt, that this is my favourite movie of the year (2017...Ofc.)",
35,2 March 2018,lesleyharris30,9," An Immensely Suspenseful, Brilliantly Performed Journey,","Three Billboards Outside Ebbing, Missouri is a fantastic movie with a very well developed plot and an outstanding cast. While it is slowly paced and dialogue heavy, the film never manages to get boring, I cared and was intrigued by these characters from beginning to end, wanting to see them develop. I expected it to be a lot more thrilling, it certainly moves a lot slower than Martin McDonagh's previous films, but it did not bother me one bit, the pace actually adds to the suspense and the mundanity of these people's lives. ",
36,19 July 2018,perica-43151,9," An almost perfect exploration of justice, revenge and redemption, with amusing and extremely witty dialogue",This is a great movie whose only fault is that dialogue is sometimes too witty for its own good. ,
37,1 March 2018,mitrapourmand,1, Excuse me ??? what ???,"Really ? This is a comedy ? In what universe this is considered funny ? I'm not sure but perhaps , rape , murder and battery is very funny in some parts of this planet . Do cops really acts this way in USA ? I'm one hundred percent sure that they don't.
And yeah guess what attempted murder and arson are real crimes , hell they are felonies yet characters in this ....ah very artistic movie do them without any consequences . And for Gods sake , joking about midgets is so not funny , it might have been funny in medieval times , not any more . Very bad very very idiotic , if this thing wins any Oscars , i will set up three billboards reading : 1 ) After almost one hundred years of movie making 2) still confusing absurdities
3) with edginess ? How come Hollywood ?",
38,3 December 2017,jbarrow-27014,6, Seriously overpraised,"The actors are superb, but the script fails in several ways. My immediate reaction, seeing the opening shots, was that this was not Missouri. I guessed it to be the southern Appalachians (where I have spent a lot of time), and so it was. The characters did not behave or speak the way real Southerners speak or behave. Martin McDonagh has written his fantasy of what he thinks Southerners are like. He got it wrong. He works in film sort of the way D. Trump works in politics--he shocks, he amuses, he appeals to our base instincts. But he doesn't tell a coherent story. ",
39,5 December 2017,justinwfirestone,8, A nice change of pace from universe destruction films,"To suggest Three Billboards Outside Ebbing, Missouri, is contrived is to ignore that the entire town is contrived. In fact, Ebbing, Missouri, does not exist, I know, because I looked for it on Google Maps, and if Google does not know where something is, it simply does not exist.",
40,30 July 2020,Agent10,1," Please, stop saying this film is great.","Some days I wish Martin McDonagh would watch In Bruges again and remind himself why he was deservedly placed on the Hollywood map. Along with Seven Psychopaths, it just seems like he is phoning it in and just not trying anymore. 3 Billboards is a twisted and unmitigated mess filled with inconsistency and bad observations. Maybe it's because he knows very little about the United States and thought the portrayal of the US through the lenses of Buzzfeed articles and cable news channels that this film would work. It just doesn't.",
41,30 July 2018,joachimokeefe,1, Looks like twenty people wrote the script and gave up at the end.,Divorced woman (Frances McD) whose daughter was raped and set on fire hires three billboards (conveniently in her road) to goad the police chief (Woody H) into action after several months of nothing.,
42,2 November 2017,kjproulx,10, One Of The Best Films Of The Year,"It goes without saying that dark comedy is very difficult to accomplish. I would almost say it's harder to pull off than regular comedy because you need to be able to keep people invested in the dramatic aspect of the film, while still keeping them laughing throughout the majority of the duration. Director Martin McDonagh has matured as a filmmaker over the years, starting off with In Bruges, which was pretty much a flat-out comedy, to Seven Psychopaths, which placed him a little further into the spotlight, but I must admit that Three Billboards Outside Ebbing, Missouri is not only his best film to date, but also one of the best films I've received the pleasure of witnessing all year. From laughter to genuine tension and heart, this is a film that's pretty much perfect all around. Here is why I can recommend this film to everyone.",
43,5 June 2022,fernandoschiavi,8," The aftermath of a crime and how it transformed every single person in the city in a singular, sensitive and complex movie","Bittersweet films are by far the least preferred by a large part of the public. The fact that it has a more real feel, and that it disappoints expectations of happy endings, is a sign of frustration in the experience available to the common viewer. However, for their target audience, they are the best films, after all, writing a story that balances the happy and sad so well is something worthy of applause. And that's what Three Billboards for a Murder proposes, and brilliantly does.",
