Review_Date,Author,Rating,Review_Title,Review,Review_Url
866,9 January 2018,cks1900,8, It exceeded my expectations.,"It's getting harder and harder to get a good movie coming from Hollywood, expectations are coming down and it's really good when you're surprised.
That was the case with Three Billboards Outside Ebbing, Missouri.",
867,1 January 2018,jackosmithy,9, We need more Martin McDonagh,"It usually takes about 4 years for Martin McDonagh to release another one of his films. We waited 5 years this time, and it was totally worth it.",
868,30 July 2020,a-07779-75123,8, Wonderful movie.,"Powerful and satisfying. However, the ending was very disappointing. They definitely could've justified another half an hour of runtime to make a better ending.",
869,30 July 2020,a-07779-75123,8, Wonderful movie.,"Powerful and satisfying. However, the ending was very disappointing. They definitely could've justified another half an hour of runtime to make a better ending. I would give the movie, 4.5 stars, but because of the dissatisfying ending, I feel 4 stars is appropriate.",
870,30 January 2018,justi00,9, Unpredictability is something rarely found in films,"Three Billboards is wonderfully unique in the way that it could change my mind about characters and expectations of the plot multiple times during the film. The audience is always guessing, never sure of where it will go next. It is better to go into this film and know as little as possible about its story so its twists and turns can have their full surprising impact. So it's your choice as to whether to even bother reading on. ",
871,8 January 2020,andrewmerritt-31652,6, At least I had the whole theatre to myself.,"I had the whole theatre to myself. So that's something. Three Billboards Outside Ebbing Missouri stars Sam Rockwell, Woody Harrelson, and Frances McDormand, which is also directed by Martin McDonagh. This is about a woman who decides to post an advertising to let everybody know that her daughter was raped and murdered. I wanted to see this movie for two reasons: One: I like the work of Martin McDonagh, and Sam Rockwell, who I think is an underrated actor. And I watched this movie and it was different from the movies that Martin McDonagh has done in the past like In Bruges and Seven Psychopaths. And those movies had humor as well as a great drama, but this one it doesn't have that much humor to it. There is a little bit of humor, but not much as his other works and I miss that and I wanted to see more of that. Now that isn't to say that this isn't a bad movie. There were moments that were fun to watch and other times where do we need that scene to explain everything. Sam Rockwell and Frances McDormand carry the movie for sure. I think she's a good actress and I haven't seen her in anything in a long time so it was good to see in her in the spotlight. Sam Rockwell is the comedy relief in the movie and the scenes that he's in are fun to watch. You start to hate this character because he's a violent psychopath but later on you start to like him and realize he isn't a bad person. Overall, this was an average movie with good actors, a solid script, and a fun time to watch every now and again.",
872,14 June 2021,tinabugvi,9, Excellent story & execution!,"I don't give very may 9s. This movie is sooo good, it will make you laugh & cry. I love Rockwell even though he plays such a Dick. Harrelson is so lovable in this role. McDormand is amazing as usual. Great cast & acting, A+!",
873,10 December 2017,bp29,8, mixed bag,"If you can look past a policeman throwing someone out of a second story window and walking back into the police station across the street without any repercussions, despite there being eyewitnesses everywhere",
874,5 August 2018,three8s2013,6, A Dark and Strange Movie.,"A well acted movie but not quit sure what to make of it. 
Halfway through it real turned dark. Suicide, molotov cocktails, arson, and throwing people out of windows.
Frances Mcdormand was great but her character went off the rails. You betcha.
Sam Rockwell also great but his character as well was difficult to understand. Some of his actions made no sense. You don't throw a person out of a second story window and punch a woman in the face without repercussion..
A good slow burn movie. 'Burn' maybe i should have used a different word. Oh yah? Yah.",
875,19 January 2021,martinrey-15593,8, Good But Bizarre.,"The story is a serious and morbid subject of rape and murder and it does the serious stuff really well thanks to a superb cast and script. Its when it goes a little bizarre it tends to turn into a comedy which devalues the point.
People going over the top without a caution or arrest make it a little unrealistic.
As good as the movie is, and it is, it does have its faults, but its still worth a watch as a whole its good.",
876,22 January 2018,ja-160,3, Would have been a good movie if it had an ending.,"I really hate watching movies that go along fine and you're enjoying it and then suddenly it just ends. It's like they ran out of money and just decided to call it a day, even though they hadn't gotten to the actual end of the movie! This movie is like that. I enjoyed most of it. It's funny but dark and I enjoyed the acting.... right up to the point where it ended and the credits started rolling. What the heck. No resolution as to if they go through with what they've started, and no resolution as to who the killer is. How do you make a movie about someone being killed and the victim's mother trying to do what she can to get the killer caught and then they never show it. Very disappointed! I feel like I wasted 2 hrs of my time for nothing.",
877,29 December 2017,jkdreams,9, Thank You,Three Billboards...is a movie that depicts true nature of humanity and the feelings that lies beneath the external emotions. It's a perfectly cast movie with solid script and direction to back it. ,
878,11 April 2020,r-48240,9, A story full of humanity,"MacDonald is really good at writing dialogue. Every time the hostess scolds, she scolds brilliantly. The more she scolds, the more she has the courage of ""one against the world""; the stronger she is, the lonelier she is. The more desperate she is in her search. It's a moment of ordinary hero / anti hero belonging to small people. It was MacDonald who once again told a heavy and human story in a very good absurd tone.",
879,8 June 2018,v-ley,6," Pretty good, but should have been better","I love every actor in this movie, but I am sadly disappointed by the outcome. I had hoped for a stellar performance but got a ""B"" movie.
The storyline had so many ways to top all of the contenders but just didn't get there. No wonder Harrelson didn't get nominated enough, his part was outstanding but hardly went noticed. I love that Sam won at least one award as well as Francis. I don't however, think this movie was Oscar-worthy.",
880,31 December 2018,nancy-793-228879,5, Loved it until the end,Someone explain what happened at the end. What was the point of that character in her shop and in the bar if it had no relevance to the story. Weird way of changing police behaviour if that's was the point of the film. Was that the point of the film? So annoyed and disappointed!,
881,16 February 2020,msudude22,8, Mildred's son,Mildred's son is too old to still be living at home with his mom. Also Mildred's ex husband has a huge nose.,
882,29 January 2022,halfxbreed23,7, Not what you think,"I highly encourage anyone to watch this movie. It's not what I expected and the trailers portray it more as a drama, which it is, but it also has its share of understated action. There is a true heart and dark wit to it that few movies achieve. The balancing act of hard-as-nails fighter and caring mother the protagonist is capable of only speaks to the masterclass in writing and acting. I just hope audiences don't misinterpret the message and take it for the love letter and rehabilitation piece that is is.",
883,7 May 2019,cui_yinglan,9, http://bananamv.com/three-billboards-outside-ebbing-missouri/,"It's really a good script like a textbook. It breaks many routines and creates vivid characters. In addition, the director has a sense of humor and good social observation. The discussion of hatred and anger is quite in line with the current social situation.",
884,16 March 2018,GeorgeEc,8, A memorable experience.,"You go to watch a movie. Usually you see fancy stuff, maybe a fateful coincidence and things that you can predict. This movie tramples this recipe and brings to us something great.
It is realistic to begin with. And it also ends in a realistic way. The characters are built step by step and there is more than meets the eye to them. The movie tells a story that could have happened.
One of the greatest movies of 2018 for sure.",
885,6 March 2018,itstimetorecover,1, An insult to the oscars.,"I had high hopes for this movie. Sadly these were quickly dashed.
This movie is just a deluge of swearing of the worst. A minute doesn't go by without the use of an f or c word. 
To call the movie moronic is an understatement. 
It's a travesty that a movie such as this should even be nominated for oscars. For it to actually win them only serves to show the paucity of moviemaking talent that exists today.
Enough said",
886,9 February 2022,atkinsonlouise-73873,9, The Dark Side Of Grief,"Damn this film was hard hitting. It touches on some heavy themes like loss, murder, racism and grief, but in such a well done way. It's a very human film and while there is no characters to root for, the characters here are ones to get invested in. Frances McDormand is fantastic in the lead role and truly shows the effects of grief on a mother and the emotional reactions it can result in. Her toxic family relationships highlight the pain that her daughters death has caused, but also how her reactions to this pain have caused hurt for those closet to her. Her actions may not be those of a stable 'good' person, but they feel human and they show how she hasn't got over this pain. Watching how the film concludes and her finally coming to terms with her grief, is an emotional moment. Sam Rockwell is brilliant here too, at first as this horrible and bigoted police officer who uses his power to benefit him, with his reactions to trauma affecting others and having consequences of there own. While you don't quite forgive this character by the end, you see he has changed and that maybe he has some humanity after all. Woody Harrleson is the film's moral compass and plays the role well, with his characters death, providing the next step in the story and leading to much of what happens later in the story. The relationship between these three different people, provides the insight into the different ways trauma is dealt with and people eventually finding peace in their grief. The music is pretty good here too and the film is well paced and feels just right in terms of time length. A great human drama and our two main characters are well deserving of their Oscar's.",
887,15 March 2018,bnzayid,7, Nice and touching movie,"Nice movie but the ending was surprising to me!
Also, Anne was speaking with British accent!",
888,26 September 2019,norbridgehigh,1, Astonishingly bad,Never written a review before but felt compelled to after seeing this abomination. Oscar worthy??? Seriously???,
889,5 June 2020,a-78738,7, Fantastic film,"Film director Martin MacDonald, as the representative of the circle of western drama face to face with the drama itself, not avoid violence and plasma and choose directly with fantastic technique to depict the anger, the violence, prejudice, such as dark parts of the human nature, lines with lots of swearing, borrow edge of evil evil, lend itself against violence, violence crime types anti crime types. It blends humor, absurdity and pain with emotion, humanity and virtue to create this black humor film full of dramatic tension and arousing the audience's deep thinking. In the process of watching, you must pay attention, because every line has a subtext, and every piece of humor has a double meaning. The director is good at using metaphors, cultural symbols, slang, puns, awkward situations, funny situations and so on to create suitable and varied Settings for the characters to enrich the drama on the characters.",
890,7 July 2018,the_donnie,10, A masterpiece of 2017!,"Do you want to laugh, be scared, cry, feel rage... all at once? This masterpiece gives you all of that. Thanks to one of the best cast ever put together in a movie. This movie is all about life and its beauty and darkness. I simply loved it!",
891,10 January 2018,cinema-32,9, mini review of #3Billboards,"Mini review of: 3 Billboards Outside Ebbing,Missouri",
892,31 May 2020,anxietyjunkie,2, Why did this win Oscars??,"We just finished watching this movie, and my husband is currently yelling at the screen because this was such a ridiculous film. It didn't go anywhere, there were plot holes you could drive a truck through! The acting was good of course, that was a given with this cast, but they couldn't save it from awful writing. Why were all the young women in this movie complete idiots? I suppose this is what the people in the business call a 'film'. I call it a waste of time.",
893,19 January 2018,teninchhero,7, Pick a lane,"Meh. I got in the theatre, didn't expect to be blown away and I wasn't. The characters build-up isn't enough compare to their storyline, which make it less convincing. The movie got no real story to tell, most things happens just because of the right or wrong circumstances, and the whole movie seems kind of pointless in the end. The directors idea I think was to produce the same kind of atmosphere and bizarre humor as in ''In Bruges'' but instead of letting the story itself be the source of laughter much of the jokes are forced in place (some of it very funny though) I get the feeling that the movie think it's both better and funnier than it actually is. 
The acting is good, but to narrow. The characters are actors instead of real life people.",
894,5 December 2021,richcastles,1, My number 1 most hated movie ever,This review does not contain spoilers because it would be impossible to spoil it any more than the pile of crap it is. Unless it is some deep parody of how crap and out of touch Hollywood in its vulgarity has become it should be charged with some sort of crime.,
895,18 March 2018,wbarrow8,7, This is the end?,"Very good movie. Sam Rockwell was tremendous in this role, about as good as he was in Green Mile. Frances McD was also great as her pure realistic role of a mother on the verge of snapping but keeping her cool despite knowing that she'll be in mental agony for the rest of her life. Now, WHY could they not just give us 10 more minutes and show the ending that everyone wanted. Too many films today are getting too cute, too artsy, too above the conversation and too proud with this ""unknown/unspoken"" trend in Hollywood movies. Just play it in favor of the crowd. Jeez",
896,29 April 2018,herbsmpl,10, almost flawless in my eyes.,This film is so damn good the acting the directing and the script this film is a prime example to make a drama just amazing.,
897,6 January 2018,kaminskynicholas,6, A Compelling Story Told in an Unconvincing World,Http://nickkaminskysblogspot.blogspot.com/2017/11/review-three-billboards-outside-ebbing.html,
898,4 July 2020,legionofthesnowzombie,9, A sad story well told.,"This movie draws you in and keeps you watching to the end. Good character development and some interesting surprises.
The ending will have you questioning what justice is and what's moral.",
899,24 April 2020,IreneWatsonC,8, The most authentic and multifaceted people,"This movie shows the audience the most authentic and multifaceted people. There is no one or the other in this world, especially when we are talking about a person. To understand a person's many aspects is precisely to understand the possibility of life. Only by understanding the versatility and possibilities of yourself and others can you create such more diverse possibilities.",
900,7 January 2018,katz6,9, Rich characterizations in this near-perfect black comedy,"Martin McDonagh's new film gives us a glorious Frances McDormand performance (I believe she is incapable of delivering a bad performance), a tight script that is funny and riveting from start to finish, and surprising character development. The film plays like a tribute to a Coen Brothers' film (change the location to a larger town in Missouri, and it could have easily been called ""Joplin""...) ",
901,28 February 2018,jcjs333,7, ok,"Wow...this is way over rated and i don't understand why the 'experts' give such high marks like on Rotten Tomatoes...i suppose it's a matter of taste...the acting is excellent and the show is well worth watching...without the quality actors in this the show would be a dud...wonderful 'messages' , fine acting and directing...the story is good enough...but, it is 'slow' and there's none of the big deal violence i've seen others say there is...the ending is a dud also...but, i think it's a worthwhile flick to see better than most but not nearly as good as it could have been.",
902,25 January 2018,montylowther,10, Outstanding Film..... WOW !!!! .... Oscars All Round ...,"With a cast like this has, I would expect a good film, but to my delight, this turned out to be one of the best movies I've seen in years, not since Fargo (Frances MCDormand Won An Oscar for that and deserves one for this) have I been enthralled in a film and with performances like Woody Harrelson, Sam Rockwell and Peter Dinklage gives makes this film a must see.... Black Humour is not out of place and overall the film keeps you enthralled throughout..... Thank You to All who made this film possible..... Excellent.",
903,2 January 2022,carolamahoney,1, This movie sends a horrible message,"What a messed up message this movie sends. It would have been much better without Mildred (McDormand) being domestically abused by her ex-husband, kicking teenagers in the crotch, (assault), and burning down a police station, (federal felony). Not to mention men & women being punched in the face and thrown out windows. It's appalling. She comes out of all the violent crap unscathed, and her arc is murdering an alleged out of state rapist??? That's way too dumb for me. Rockwell's one of the best actors around, but should have gotten the award for another movie. It's painful watching him play a 1 dimensional nitwit. What a waste of his talent.",
904,2 February 2018,chip-60581,10, A true art,"As for me modern Movies are boring because they likeness for example marvel series or transformes they have great graphics and action but they have lack of maintain of movie artwork which are: plot,actors playing,and uniqueness of idea.
If you want to watch something that worth your time you better watch this than avengers for example",
905,10 March 2018,tsfms,9, What the Whole Society Needs,"At this point where we are divided and strongly involved in all kinds of social debates, this movie provides almost every thing we need to know about conflicts, about treating strongers with different ideas, and about ""love"". 
Should have won an Oscar for screenwriting.",
906,8 February 2018,scottduffus,7," Three swear words, I mean Billboards outside Ebbing, Missouri",In reviewing this movie I feel the need to declare that I grew up in a very caring family. My inability to relate to the family dynamics in this story may mean that my judgement of the character's intentions is somewhat clouded. Having made this disclaimer let's get down to the movie itself.,
907,29 November 2022,hmartin-15450,10, understand the point of the directors work,"If you dont find or understand why this film is described as a 'dark comedy' dont make a review
if you don't understand that its an exaggerated/caricature example of small town america/ global short comings regarding serious crimes then dont make a review!! This filme is not for you...
if you want to see a top tier film that has all main and supporting characters shine like everyone in the real world does then give this a watch
if you enjoy great cinematography to give this a watch
and finally appreciate cinema thats not just for the majority but for those who can understand a great film doesnt always have a happy ending or completed story, you'll be pleased you watched this.",
908,23 January 2018,eojeda-96198,1, Boring,"Boring, Boring, Boring, more of the same. I have seen this plot a lot of times.",
909,2 March 2018,The_Polish_Commoner,10," Great movie, the viewer is fully engaged and can't wait for what is to come next","The acting in this movie is phenomenal. The main character, whose daughter is raped and killed, is phenomenal. Her life has lost meaning, she does not smile during the whole movie, and does not care about any legal repercussions of her actions. McDormand is absolutely believable in her actions and behavior. You just want to keep on watching.",
910,31 January 2020,robsinbox,4, The woman who'll play Woody Harrelson's next wife hasn't even been born yet,"Great movie, right up to the end, then it was like they couldn't think of an ending. Do the deadbeat cop and the bitter crone just go around the country now, and clean up crime? Such a disappointing end. It ruined an otherwise good movie. Good story, good character development, awful ending. Was Woody Harrelson's character some kind of  predator that married a child he'd groomed many years earlier? Why are his wives getting younger in movies as he gets older? It's like he and Kevin James are having a competition.",
911,11 March 2018,bharaths-435-14892,9, Simple and Messy - but very beautiful,"'Three billboards' isn't what you think it will be. IMDb calls it a 'crime/drama' film. I went in expecting a story centering on how a vengeful and distraught mother exposes laziness and/or incompetence in the police force, spurs action from the authorities, and through the sheer absurdity of having erected billboards, manages to achieve her objectives. ",
912,2 August 2018,rizwanrichuzz,10, just feel it!,"A Well crafted movie with a serious message !
BGM-10/10
Visuals-8/10
Acting-8/10
Story-6/10
Feel Good -9/10",
913,23 February 2018,joelwarends,9, Clean crisp scenes where actors are left to tell a brilliant story,"It's the story of a griveing mother desperate to get closure on the rape and murder of her teenage daughter. Played by Frances McDormand, Mildred Hayes tries to provoke the local police into action by erecting three billboards lambasting the local Police Chief. In this dark comedy she is what all of us wish we could be so often. Ruthless ",
914,23 August 2018,compudy-1,1, What a nasty movie!,I watched the whole thing and still don't know what ur was all about and who committed the murder.,
915,21 March 2018,stfaustina,3, Crap!,Overrated movie!!!! I do like artsy movies and all the actors in this movie but the script was just doodoo.,
916,5 July 2018,xmike-25541,9, Phenomenal drama 9/10,"Suprise of the year so far. Perfect acting from MANY people here , fanstastic story elements crafted scene by scene.. There is no boring second in this film. One thing i dont understand though, is why in Ebbing is practically legal throwing people from the window.. i really didnt understand that nobody even cared to jail Dixon.",
917,18 March 2018,OzcerP,10, 10 stars,"Movie is such a twist in a good way , it's funny and exciting. One of the best movies of the year hands down.",
918,12 May 2020,achmoye,6, As interesting as 3 billboards can be.,"I saw that movie because of its 8.2 rating, and now I can say it's clearly overrated.",
919,21 February 2018,ModishMovies,7, The Best of the Year? Not Quite.,"Engaging, interesting, deep, but poorly-paced. Those are the best words that come to mind after I finished re-watching Three Billboards Outside Ebbing, Missouri.",
920,21 September 2019,darryl_hj,8, Brilliant!,"Not much to fault; but the script is absolutely fantastic, the lines are realistic, believable - and more often than not hilarious.",
921,25 March 2018,zwcummings,1, Entirely unsatisfying.,I wanted to like this movie. It started off so well!,
922,27 September 2020,jasonberkeley-96356,4, A story lacking purpose,"Not because of the acting. The acting was actually pretty good. The main actors did a good job of portraying their characters, even though they become caricatures of stereotypes and therefore lose credibility. It was the script that bothered me the most. It seems to lack a purpose in the storytelling. As a viewer, we are led to believe (or at least hope) that the local police will actually put in the extra effort to solve the case and maybe reach a breakthrough as events unfold. But we never really see them put in the extra effort, except for one short scene with Woody Harrelson. In stead, the story focusses on senseless anger throughout the movie from police, the mother and father and people from the community, that all underline a sense of powerlessness. On top of that, the script is filled with plot holes and character errors.",
923,8 March 2018,rshwab,6, Good enough for entertainment,"Some fine performances and well directed and shot, Set in a dark and sinister small town, with a corrupt police force, and typically anti-everything middle America in the eyes of the writer. Seems like the writer got confused by around page 90 of his script as he spreads a wide net of subplots and themes and then struggles to resolve them in a believable or satisfying fashion, So, some of the scenes are disjointed and the dialogue forced.",
