Review_Date,Author,Rating,Review_Title,Review,Review_Url
572,11 January 2018,trelerke-politics,9," sublime, funny, violent, unpredictable","Nothing goes where it's suppose to in this movie, well done! The director of ""In Bruges"" does it again here, sardonic, well written, and you get rape/murder, suicide, heavy violence and unexpected moments of humor, kindness and bad behavior. The acting was faultless/inspired, editing spot on, music just right and characters changed and hard to characterize through out. Only real problem is that the supposed ""bad guy"" plotting was off, it's not clear why this guy showed up in the gift shop, no backstory, why this guy from Idaho is in Missouri. The only possible explanation is that it doesn't need an explanation, violence in the US is so ubiquitous and sometimes random, and linking it to unspeakable acts perpetrated by US troops in foreign lands that clearly has an effect back in the US is important. So when Dixon responds to the place with sands comment by saying ""that doesn't narrow it down"" the director is making a point. Still, I don't get the gift shop threat. Also, Abie Cornish had a silly accent, not sure what was happening there, and she was far too young to be the wife, sorry, getting sick of such huge differences in age as if that is ""normal."" These are quibbles though, this is a movie that matters, art versus simple entertainment. You feel the director's power and choices here. Oh, btw, the Guardian hit on this movie that it doesn't properly address African american issues properly is a category error, poorly reasoned and almost purposely obtuse in it's analysis. Go to this movie, run don't walk.",
573,19 August 2018,geekerr,6, Not funny at all,"With America being so divisive 
 violent , crime ridden and 
 many murders with its sick fascination 
 and love of guns.
 This gratuitously violent movie 
 is not the least bit funny.
 Overt celebration and glorification of violence
 might5 sell tickets but is a disservice to America",
574,11 October 2019,Tweekums,9, A search for justice... or vengeance?,"Seven months after the rape and murder of Mildred Hayes's daughter the police are no closer to catching the killer. One day Mildred drives past three billboards on a quiet road outside town; it doesn't look as if a new advert has been but up in decades. She goes to the advertising agency in town and tells them she intends to hire all three for a year. Her three adverts say: 'Raped While Dying', 'Still No Arrests?', and 'How Come, Chief Willoughby?'. This immediately gets the attention of the police; Willoughby tries to explain that he has done everything he can but the killers DNA doesn't match any on any national database and there are no other leads, he also tells her he has terminal cancer. His deputy, the violent and bigoted Officer Jason Dixon is angrier and starts threatening Mildred and those close to her. Other townspeople don't like being reminded of the incident and side with the police. As tensions rise things get dangerous and people get hurt... but will it bring Mildred any closer to getting justice for her daughter?",
575,10 May 2023,Mymoviediscography,9," Three Billboards Outside Ebbing, Missouri: A Darkly Comic Masterpiece","Three Billboards Outside Ebbing, Missouri is a brilliant and biting film that leaves you reeling long after the credits have rolled. Frances McDormand gives a tour-de-force performance as a grieving mother seeking justice for her murdered daughter, and she is matched by an outstanding cast that includes Woody Harrelson, Sam Rockwell, and Peter Dinklage.",
576,10 March 2018,searchanddestroy-1,8, Very offbeat drama,"I won't add much to what have already told the other reviewers. I find this very interesting picture a total surprise from beginning to the end. No clichés at all, if you consider the film from a certain distance, and not whilst watching it. Of course, you could say the local sheriff is some kind of a cliché, but after a certain time in the movie, all this collapses. This kind of scheme and characters would have been perfect for e TV series. I don't think it is an open ending. SPOILERS SPOILERS SPOILERS SPOILERS 
 After all, the main lady character and the ex cop decide not to kill the supposed rapist, so far his DNA proved it was not he true rapist one, and the supposed guilty was not in the USA when the rape and murder of the lady's daughter occured. They just decide both to begin a new life elsewhere. 
 Yes, the more I think about it, the more I am sure all this would have been perfect or a TV series, the frame is really the same.",
577,9 March 2018,beqaxitiri,6," Amoral and Boring, though with good acting","The movie itself, as well as the reviews make it seem like we are watching a heroic mother fighting to get justice. This is not even remotely the case. Our protagonist is a reprehensible creature, who is so absurdly selfish and plainly disgusting, that she won't stop at anything to somehow sate her feeling of guilt. This is not about justice, or even about revenge, her motivation is purely selfish. Therefore, the entire point of this movie is watching a horrible person, as well as a terrible mother, attempt to lie to herself and try to blame someone else.",
578,15 October 2019,Friendship_express,3, Really weird,"Really weird movie, felt like a high priced B movie.",
579,4 May 2018,mihaivl,5," Good idea, stupid execution","The movie have some big logical flaws, which I can't get over, it's like they are living in the medieval age where there are no laws whatsoever. The ending was also so disappointing, leaving it open being such a non-sense,",
580,25 January 2018,Alexander_Blanchett,8," Great performances and characters, but flawed","Its a good movie. Excellently acted and with a lot of good symbolism and a strong message. But it is sadly also a flawed film. I liked it and i would watch it again at any time as it was enjoyable, tense and had a lot of grew character development and dark humor. And here is the first problem. The story itself was incredibly serious and were the characters and while I do not mind dark humor in a heavy weighted film like this, here it was a bit too much, sometimes Martin McDonagh lost himself in that and it often felt like he did several scenes or made several decisions just for the sake of the humor.Another flaw the film had were some lose ends and some weird decisions. Now you have a great character like the one Woody Harrelson plays. You build him up extremely well just to kill him randomly off after less than half the film, just because you don't really know where to head with that character or because it doesnt serve any more purpose. Sure there are some critical moments of the film that are still influenced by that character after his death, but still, it felt weird. 
Other than that it was a great film that served as a showcase for some of the best performances of the year. First you have Frances McDormand who turns into one of this years most memorable and outstanding performances. She really becomes he role and you feel that hatred and broken heart she has. Great performance and one of the most perfect casting decisions in a long time. Woody Harrelson as mentioned was also good and had a great character. The Oscar nomination he received for it overrates the performance a little though. Sam Rockwell is definitely the stronger supporting role. What a character! And I love the way they developed him, which was unexpected and felt so real and good, because although it was hard to like him, you still kind of felt sorry for him. Wonderful performance. Abbie Cornish was the weakest link of the film. While Rockwell, McDormand and Harrelson were perfect casting coops, she was not. Totally miscast. Good to see John Hawkes and Peter Dinklage in significant supporting roles. Lucas Hedges was all right and I really liked Caleb Landry Jones who gave one of the best performances of his career. Great score, great atmosphere. A very good and watchable movie.",
581,20 March 2018,view_and_review,7, Mercurial Mildred,"Three Billboards Outside Ebbing, Missouri starts off with Mildred (Frances McDormand) renting these three abandoned billboards for a full year with monthly payments of $5000. On the billboards she's calling out the Ebbing police chief, Chief Willoughby (Woody Harrelson), for not solving the rape and murder of her daughter. That's jarring in any place but it's especially jarring in a small town like Ebbing, MO where everybody knows everybody.",
582,7 April 2019,JBlaze78,2, Highly overrated,"This is the exact reason why I try to avoid movies that critics say are ""instant classics "". The flick starts off decent and the actors definitely did a great job portraying their characters but it quickly becomes ridiculous. Other than Rockwell,the characters are annoying and completely uninteresting. The movie just kind of drags on and on and then they just leave you hanging as the movie just comes to an abrupt end with absolutely no answers or payoff. Yes,the writer/director did the thing that I hate most,put out a film with no ending. I know what some of you are thinking,""that makes it artistic and it lets you draw your own conclusion"". No,it's crap and it's a cop out ending. Have enough creativity to conclude your own stupid movie that people are wasting two hours of their lives on.",
583,3 October 2018,ptadzio,1, Three nails on the coffin of the american culture,"This movie is bad on so many levels that I don't know even where to start, specially in this set up with the rating of 8.2 in imdb which shows also about nowadays standards of quality appreciation. 
A mass produced copy of another meaningless hollywood movie, the americans trying relentlessly to prove to the world that they do/still have some kind of character and that being a redneck is a cool thing, the good thing that at least outside of America people do not really buy it, the bad news is that most of the americans do, which is even worst, due to the fact the americans choice making is being scripted by Hollywood for ages already anyway, now it's going to get even worse thanks to this ridiculous trashy movie, if in the past it looked like at least there is some kind of quality supervision in hollywood, what one can say after watching this trash is that there is definitely no more.",
584,19 December 2022,bignuts-06245,6, Decent film with a disappointing ending,"The film stars Woody Harrelson, Peter Dinklage & Sam Rockwell & is about a mother's anger at the local law enforcement's inability to solve the rape & murder of her teenage daughter. She tries to give them a kick up the backside by renting 3 billboards on which she very publicly begs the question why the case hasn't been solved. This provokes a reaction from a sheriff who's terminally ill, a deputy who's gone off the rails, the woman's idiot ex husband aswell as a psycho who becomes suspect number 1! The film was pretty good overall but I thought the ending was incomplete which disappointingly ruined it for me but I did like it up until that point!",
585,7 April 2019,WoodcuttingLVL99,10, Drama done perfectly,This engaging story leaves you rooting for all the characters. Everyone has their intriguing motives and the character development is done flawlessly. Every decision is mostly rational but not at all unquestionable which leaves the viewer contemplating on the real moral values one should follow.,
586,4 February 2018,nikhilrampal,6, INTENSE,This movie tells the a simple and dark story of an unfortunate event. However unlike most movies this movie taken on the perspective from all the characters and instead of forcing on a side it leads us to empathise with no one.,
587,22 August 2018,makleen2,8, Martin McDonagh needs to write an ending to this otherwise stellar film,"A woman seeks justice for her daughter by battling indifference in a small Midwestern town in Three Billboards Outside Ebbing, Missouri (2017), written and directed by Martin McDonagh. This dark dramedy was enormously successful, raking in over $157 million worldwide on a $15 million budget. It goes to show what can happen when first rate actors play well-written characters in a compelling storyline.",
588,29 May 2020,nabil-yal,10, What can I say.... A masterpiece,"Well the first question that comes to my head after I finished this movie , is why it took me three years after it release to watch it , an outstanding cast; two Oscar winners and a very important and touching story , the required elements that makes a great film are all here in this one , this may seem exaggerated to some of the readers but I think ""Three Billboards Outside Ebbing, Missouri"" is a perfect movie",
589,22 July 2018,nicb2011,8," Great movie, sad but great","Very emotional movie. While the story is engaging and really pulls you in, the true greatness of this movie is the acting. One of the best overall performances I've seen in years.",
590,21 February 2018,mirkobozic,10, Fargo-minus the snow,"Frances McDormand seems to be the perfect cast for tough women with a mission, which goes both for Fargo and this one. Technically, when it comes to character, you could almost describe this as Fargo minus the snow. McDormand plays Mildred, an embittered woman on a quest to find her daughter's murderer. When the local police makes no progress, she decides to take things into her own hands and upsets everyone in the little town of Ebbing along the way, especially through the provocative red billboards asking questions that sheriff Willoughby(Woody Harrelson) isn't really trying to solve the case at all. The movie turns into a gallery of colorful characters, from the man who rents Mildred the billboards, to James (Peter Dinklage), a midget who put Mildred into her place at a dinner date that wrong. Although it's Sam Rockwell's cop Dixon who a wins you over quite easily, it's his beer-drinking mother who is left the biggest impression on me as the archetype of white trash almost bordering on comedy.",
591,23 July 2018,DigitalBlade,9," Don't expect a laugh, but wow what a great flick","After seeing most of Martin McDonagh's work, this piece is not really a dark comedy piece, but rather a very ""personally"" heavy piece, really dark at times, always heavy to digest. Of course if you look up the actual events after, it differs, but it never claimed to be based on true events.. Very moving and worth a watch, but what you will see may surprise you (which movies should!)",
592,6 March 2018,eagandersongil,8, Impedoso and visceral,"""Three Adverts for a Crime,"" a visceral film that tinkers with the viewer's entrails, blending comedy, drama, and suspense, the film is both ponderous and intriguing, full of social criticism and great acting and directing. best film among the nominees of ocar the category of ""best film"". When we talk about the script, something that awakens our attention, we expect the script to be adapted, but we are surprised to know that it is an original script, which makes the film even more interesting, since it opens many margins for the good director and screenwriter Martin McDonagh, telling the story of a mother indignant at the death of her daughter unresolved by the police, the film creates a context, and within it inserts its characters, some very caricature, but all very deep, or at least with some development, in addition, the long builds characters to then break, weaken and raise them again. The film talks about racism, violence, abuse of authority, homicide and domestic violence, of course, a pure feeling of impotence to be fought, the film is a machine gun for criticism, even though they are all exaggerated in absurd contexts. it is no longer a critical movie. Technically, the film is very good, with a greater emphasis on its great editing, composition of scenes, and great angles, open, with planes sequences, traveling, the camera of the film behaves perfectly, in addition to a photograph that warm, remembering a good old western. Frances McDormand is completely amazing, frightening and crazy, the character scares, and makes the viewer buy his idea, besides showing his sweet and ferocious moments, the other highlight goes to Sam Rockwell, who for me is the best character of the film, a character broken by nature, a class on how to build an antagonist, without vanity or modesty, Woody Harrelson too, is charming and captivating, even having little screen time. Finally, ""Three ads for a crime"" is not perfect, far from it, has problems, has scenes explained that do not need to be explained, has moments that is disconnected with the context that created, but still, it is a very good movie .",
593,14 May 2020,watcher2019,4, 4 stars for the acting,This film went nowhere fast. Like 2 seperate films. I never liked films which use comedy in very serious matters. So many dead ends. Some great names in this film so such a waste of talent.,
594,20 January 2019,DoctorStrabismus,10," At one level a mish-mash, at another a masterpiece. Who am I to judge?","I have seldom found myself so torn in evaluating a movie, nor have I ever so much felt the need to scan the comments of other reviewers.",
595,3 October 2019,cherold,9," complex and fascinating, with a brilliant lead performance",Fascinating drama about the complexities of the life and the way in which people deal with tragedy and pain. Frances McDormand is absolutely brilliant as the flinty protagonist.,
596,24 December 2019,saptesh786,4, Long and boring revenge with meaningless end !,"The story is taking revenge by mother for her daughters killing. Her styles of sticking three billboards of accused is looks unique, but actual revenge drama missed thrill at all. For final climax you have to wait more time. Moreover end is not right for such revenge story. What is in such end ? I don't understand. I also wonder about high ratings whereas there are many good revenge movies to name like ' Peppermint' of Jenifer Garner etc. If you wish to best revenge then must see Peppermint and avoid Three billboards instead for boring drama. 4 stars is enough.",
597,28 December 2018,cricketbat,8, Complex characters with evolving motivations,"One of my favorite things about Three Billboards Outside of Ebbing, Missouri is that I had no idea what was going to happen. The cast is full of complex characters with evolving motivations and the story is unique & compelling. Also, despite the serious subject matter, this film is darkly comedic. Well done, Martin McDonagh.",
598,23 April 2018,bradykid-26060,9, great drama,I m really not into drama movies but this movie was Excellent. Frances and the rest of the cast did a fabulous job.,
599,3 March 2018,ilfordcabs,9, singed up just to rate this,"A really great film. 
ending could have been better",
600,9 February 2019,Thessalonian31n,10, You don't see these movies so often.,"Interesting, hilarious, drama, and southern taste.",
601,3 November 2022,paul2001sw-1,7, A dark (but unmoored) take on America,"'Three Billboards Outside of Ebbing, Missouri' won various awards, and it's not an awful film, but I'm not sure it's a great one. A very black comedy about a small-town community consumed by grief and hatred, it works at the micro-level. But is it actually a portrait of small-town American life, and if so, how did things get so bad? I spent the first half wishing it was based on a true story; as pure fiction, it's hard to assess if it has anything real to tell us, or if it isn't just some imagined fantasy of the monstrous nature of life out in the sticks. I follow some American blogs where some commenters talk about the hostility they feel whenever they venture into the so-called Heartland of their country; but the film doesn't have anything to say about how things may have gone so wrong. I prefered the second half, where it becomes a subtler (though familliar) story of the slow journey to redemption undetaken by its protagonists. In my book, however, plus marks are gained for the use of Townes van Zandt on the sountrack!",
602,1 October 2018,scb_coldsteel,9, My favorite movie of 2017,"Just got out of THREE BILLBOARDS OUTSIDE EBBING, MISSOURI. Overall I was very impressed with the movie. The movie was a nice mix of a dark comedy and a crime drama mixed in. The writing was smart and original.",
603,26 February 2018,dingxueying,8, Love this movie!,"I was touched by the music! Even I am a layman in music.
I was touched by two scenes, one is billboards are in fire, one is police office gets fired.
Sad but inspiring movie!",
604,2 December 2017,kkboyd-603-991354,6, WARNING! This film can be boring!,"What? Boring? Not according to the critics who can't seem to praise it enough. For them, it's full of pathos, violence, and rough guffaws.",
605,21 February 2018,BibleMaster,7," Great, Unpredictable Story, But Poorly Paced","Engaging, interesting, deep, but poorly-paced. Those are the best words that come to mind after I finished re-watching Three Billboards Outside Ebbing, Missouri.",
606,5 March 2018,oenogrl,10," Wonderful story, great acting","It's a movie, people, not a documentary and if you want to argue about verisimilitude compare with the fantastically unlikely facts and events of the current White House.
Anyhoo, this movie manages to take an almost unrelenting series of terrible events yet inject them with characters that are fleshed out not just with pathos but with humor that is often hilariously funny. And I love that it deals with issues of love, redemption, crime and forgiveness with a lot of finesse and complexity. And ambivalence. 
Loved it.",
607,27 August 2021,jack_o_hasanov_imdb,9, Very Good,One of the best movies of that year. Performances were great. I liked it very much.,
608,11 April 2023,jordondave-28085,7, Truly an actors movie,"(2017) Three Billboards Outside Ebbing, Missouri
DRAMA",
609,1 March 2018,TigerHeron,8, McDonagh's American Commentary,"Martin McDonagh has his virtues and his flaws. His virtues are quirky, not entirely realistic but engaging characters, his talent for irony and surprises, and his ability to tap into the darkest recesses of human emotions. His flaws are his lack of ear for dialogue and his mommy issues. All are on display here.",
610,4 July 2020,SAMTHEBESTEST,7, An anger begetting about culprits and cops in much needed revolutionary act.,"Three Billboards Outside Ebbing, Missouri (2017) :
Brief Review -",
611,7 June 2018,Edvis-1997,9, AmAzInG!,From first look I though this movie is going to be boring and not interesting but... I was fucking totally wrong. This film took my attention from first minute I enjoyed each moment of this film it totally deserved Oscar.,
612,10 August 2021,youcefhamdoud,9, Thrilling movie with great performances that drive the multiple narratives so well with their impeccable performances and great comedic experience,"This movie is great at aligning to the main premise but at the same time branching out to keep you engaged. With great dialogue, neat performances and a very engaging storyline it just became one of my favorites.",
613,16 January 2018,adrian-43767,7," Ultimately uneven, despite superlative acting","THREE BILLBOARDS is a well-intentioned film that exposes social wounds and, above all, what individual anger and vindictiveness can do. The idea is great, putting up three large billboards to draw attention to a young girl's rape and murder, but the plot begins to falter quite rapidly, with far too many actors with individual problems and not enough drive to air them, let alone solve them.",
614,22 August 2020,damianphelps,8, Good Times!,This is an easy movie to review.,
615,3 February 2018,Deathstryke,7," Entertaining, but a little forced in parts","Three Billboards sets up its protagonist's reputation as an unfearing ball-breaker right from the start; A hard-faced Frances McDormand swaggers into the office of an advertising agency, and with a wad of cash and a toilet-mouth, obtains three disused billboards with the plan to shame the police officers responsible for her daughter's murder case into action.",
616,9 March 2018,bbewnylorac,6, Could have been much better,"The camera loves Frances McDormand, and she gives a riveting performance as the angry, very stubborn and half crazy Mildred Hayes. Many of the things she does in trying to bait the police into reopen her daughter's murder case are almost understandable, if a little mad. But she later crosses the line morally and legally. Like drilling her dentist's finger. And destroying the police station. And yet she isn't arrested. Why not? Similarly, Sam Rockwell's police character is clearly insane, committing all sorts of crimes, and yet he goes largely unpunished, because it suits the plot. The change in his character he undergoes later is completely unbelievable. He's been Mildred's evil nemesis, and now he's her friend? The ending is quite underwhelming.
I found the nasty comments about the dwarf character, played by Peter Dinklage, offensive. The characters make joke after joke about how unattractive and freakish he is. In the 21st century, aren't we past being that nasty?
I guess they were trying to be daring but no, it was just mean.
The scenery in the film was lovely and the direction was good. Writer and director Martin McDonagh is clearly talented. It's just that he seems to rely on swearing and unnecessary violence to make an impact.
Which is just lazy.
I didn't hate this movie. But it needed much more work before it was made. Instead it's gone for, 'let's throw in a lot of the F word and people getting shot and punched, and people will love it.""
But it's no substitute for a great script,",
617,16 January 2018,mt-95256,9," Five Stars for Three Billboards; Dark, Gritty, Funny, Thought-provoking",TL;DR,
