Review_Date,Author,Rating,Review_Title,Review,Review_Url
285,5 March 2018,phagunocd,5, Irritating ending and boring plot,"Yup! There I said it. While the character of Frances McDormand was great and very well played, and so was Sam Rockwell's performance, everything else just fell so flat. I kept watching this movie hoping it would build to a great crescendo resolving all of these great performances and this twisty sort of storyline but I was so disappointed. This movie's ending is garbage. Yup! its an absolutely garbage half a**ed attempt at resolving this plot that seems to keep thickening. Very disappointed by this movie. Wish I hadn't bough the bloody 4K version on release date. What a let down.",
286,18 February 2018,MarcSchmarc,9, Result of Real Writing ... a great film,"I only give 10s to films I watch over and over and over. This would come close though: characters with actual depth, personal problems, nasty quirks but somehow managing to be sympathetic. This could have so easily been turned, in other hands, into a standard, tear-jerking melodrama ... but because of great acting, and the decision to have everyone speaking dialogue that resembles what people think but never say, it turns into a roller coaster of black humor, pain, anger, misunderstanding, and love ... and in so doing defining a form of truth. It does deserve awards in many categories, but surely for the script.",
287,19 February 2018,pritenpatel-07134,3, Overrated.,"Overrated Overrated Overrated.
Watched it because it had 8.5+ ratings. But as Said it is Overrated. Not at all entertaining. Wasted my time.",
288,15 January 2018,nogodnomasters,9, Violence begets Violence,"Angela (Kathryn Newton) was raped and burned outside of Ebbing, Missouri. There are no clues. DNA evidence doesn't match any known criminals. It has been seven months since Angela's mother Mildred (Frances McDormand) has heard anything so she erects three billboards which questions the quality of work by Police Chief Willoughby (Woody Harrelson). This leads to an unexpected series of events in a small town. ",
289,3 January 2019,StevieG338,3, Over hyped,"Sat down to watch what I expected to be quite a good film based on all of the amazing reviews and I am still trying to figure out all the gushing.
The plot is so bad it made me angry, a lady commits serious crimes and they are ok fornsome unexplained reason.",
290,13 February 2018,capone666,6, The Vidiot Reviews....,"Three Billboards Outside Ebbing, Missouri",
291,23 January 2018,manders_steve,5, Unpredictable strays into confused,"This film came with high expectations, fresh from its Golden Globe win for best picture. But while evocatively shot on location in Sylvia North Carolina and featuring a stellar performance from Frances McDormand as Mildred, I just couldn't get into the vibe of the story. There seems to be a fundamental disconnect between the steely determination of grieving mother Mildred Hayes, seeking police action to find and charge her daughter's murderer some months after the event, and supporting roles which came across as heavy handed caricatures or slap stick stupidity. ",
292,5 March 2018,parameswaranrajendran,8, Thought provoking,"Three Billboards Outside Ebbing, Missouri is a story of a mother went rogue to look for the rapist and murderer of her daughter. Loads of drama, crime & thriller with some good performances by the cast. That three billboards idea were freaking awesome.",
293,9 January 2018,Prismark10,7, Vengeance is mine,Martin McDonagh has directed a clever crime drama with black humour which tips a wink to the Coen brothers. Although as a writer McDonagh's screenplay also has some holes which are difficult to gloss over.,
294,4 March 2021,aboiement,8, 2021-3-3,"Sheriff Willoughby killed himself and left 3 letters. One for Mildred who was not very happy about him. The other one for Dixon which really turned him to a decent person. Anger begets greater anger. Yeah, and very tiring actually. But I think when you were in anger, you wouldn't know it was also painful until you got a hint and starting to forgive and let go. And then you finally felt released. It's too tiring to be in anger as much longer as you want.",
295,30 March 2018,rklemm05,2, Still don't get why all the infatuation around this movie,"Really, you think Margot Robbie didn't deserve an Oscar way more than Frances Mc Dormand? ",
296,1 March 2021,Mrbigham13,9, Great Writing!,"There is so much more here than meets the eye. Genuine characters and performances galore. Beautiful scenery and writing sure to make this a classic in the coming years. I've always felt strongly that good movies make you think and this movie really achieved that. I also feel the most beautiful thing about it is that it didn't quite have the storybook ending all would hope for but then again it's an ending worth seeing. Much like life, everything isn't always worked out like a textbook yet the little intricacies make it worth living. I highly recommend this movie, sure to be a classic in the years to come.",
297,27 December 2017,Jithindurden,9, World is a dark and comic place,There is the tragedy all around you but there is something darkly comical about all of it and yet the way world is turning out to be who can live not being a cynic.,
298,13 May 2021,motrous,9, Three Billboards,"There are no bad actors in this film and they all do a tremendous job, but Frances McDormand is on another level here.",
299,4 December 2017,emailbillphillips,4, Desensitivity to Violence,"Could have been a good, even an important movie, till the plot completely disintegrated into senseless violence that voided the credibility of the leading characters. Again, reviewers have so lost their sensibility to pornographic violence and believable character development, that I have to be very skeptical of most of them. ",
300,3 March 2018,mfivejude-1,10, brilliant!,"I can't believe the negative reviews from some people.FINALLY A MOVIE WITH A WELL THOUGHT PLOT.characters with depth,dialogue that's sharp and witty.The casting is tremendous,Woody harrellson has come so far from Cheers mcdormand depicts a woman insane with grief yet still likeable and believable.I have not seen a movie that every one in the cast,star or walkon,so believable and realistic.the ending could not have been more of a depiction of the two main characters redemption and logical.I can't remember the last time I left a movie so provoked to analize,and relive every morsel of story and character development.If you LOVE movies, this one is it !",
301,10 December 2021,luismamepo,9, Overwhelmed by everything in this movie,"The music, the performances, the pacing, the writing, the editing. It has some flaws here and there, but overall it's such a phenomenal story about hope, and how hate and anger can cloud a person's soul and and hide who they really are.",
302,15 February 2018,valadares,9," Harrelson, Rockwell and McDormand at their best","Very powerful performances of the trio, and some very consistent performances of the rest of the cast. Brilliant script, well directed, great dialogues, fine cinematography... it's a good film in almost every aspect. Touching but not corny, harsh and funny, all at the same time. I strongly recommend this film to anyone who enjoys a good plot and appreciates astonishing acting performances.",
303,30 January 2018,tm-sheehan,9, STUNNING! asks so many questions about human behaviour.,"Three Billboards is a stunner in more ways than one, stunning screenplay, stunning performances and stunning direction!
It's a thought provoking very confronting story at times and takes you on a journey where you don't know what's going to happen plot wise next.
Francis Mc Dormand and Sam Rockwell give career defining performance and both deserve their Academy award nominations as do Martin Mc Donagh the director, every second of this movie is used beautifully and shows what great directing and editing can add to a superb script.
No spoilers but this movie will provoke a lot of emotions and ask a lot questions about human behaviour without giving clear answers .",
304,27 November 2017,pyrocitor,9, The Twit and the Pendulum,"Between Bruges and Missouri, if being a writer/director weren't enough, Martin McDonagh could seemingly easily find an alternate calling as an unorthodox travel agent. Of course, Three Billboards Outside Ebbing, Missouri is as much a straight- faced travelogue of the Midwestern United States as McDonagh's In Bruges is a gentle comedy of tourism - namely, not at all. McDonagh's films defy easy categorization with as much flamboyance and vitriolic wit as they subvert narrative expectation, with twists and inversions as wacky as they are devastatingly human. And Three Billboards may be his sharpest, most tenderly sadistic cross-section of human behaviour yet, exemplifying his customary deftness for unpacking the weird, terrible, and unexpectedly graceful decisions people make under intolerably extreme circumstances. Even more impressively: he fans the flames with a seasoning of searing sociopolitical urgency amidst the salty banter and unexpected bursts of extreme violence, before pulling the rug out from under us once again for something altogether more moving and raw. ",
305,15 November 2017,ccorral419,8, Stagy dark comedy with good acting,"Three Billboards Outside Ebbing, Missouri. When a film is so highly spoken about it can mean one of two things: 1) It's going to be a great film, or 2) the praise is being overstate. Unfortunately, ""Three Billboards..."" falls into the later category, as director/writer Martin McDonagh (""Seven Psychopaths"" 2012) presents an intriguing dark comedy that ultimately comes across as a variety of individual scenes put together to make a story. Featuring Frances McDormand (""Fargo""), Woody Harrelson (""The Hunger Games""), Sam Rockwell (""The Way Way Back""), Luca Hedges (""Manchester by the Sea""), Caleb Landrey (""Get Out""), Zeljko Ivanek (""Argo"") and Peter Dinklage (""Game of Thrones""), the acting is not the problem here. McDonagh's sets are stagy, his writing is lackluster, he tends to add in scenes/character in order to oddly move the story along, and the ending does nothing for the flow of the film. Standing out in this heavily star packed film is Caleb Landrey. Landrey is initially had to understand, due to an unexplainable accent, however, he over comes this weakness by graciously playing the victim. ""Three Billboards"" is far from a clunker. I guess I just expected a more tightly woven and satisfying production.",
306,30 May 2021,sue-06239,9," Different, quirky and brilliant","What a great film this is. Excellent performances by Frances Macdormand, Woody Harrelson and Sam Rockwell in particular but an all-round excellent supporting cast too.",
307,15 June 2021,cagebox111,9, Should Have Won Best Picture,"Three Billboards Outside Ebbing, Missouri is among the best movies of the 2010's and I find it shocking that the Academy could give a vastly inferior movie like The Shape of Water the Best Picture nod over a fantastic movie like this. The acting here is superb and the story is emotionally gripping from the very beginning. The best thing about the movie might be Sam Rockwell's character and how quickly he can go from being hated to being loved by the viewer in a matter of a few scenes. This movie is raw, doesn't pull punches, and is a must watch.",
308,21 January 2018,n-kefala,9, Wonderful dark comedy,"A story of desperation and revenge as darkly funny as it is tragically bleak, ""Three Billboards"" pushing characters far beyond their traditional archetypes. The movie is one of the angriest films in recent memory and a wonderful dark comedy. It has moments of hilarious comedy and sincere tenderness, along with acts of nearly unwatchable violence. Despite Martin McDonagh's magnificently rich story filled with complexities and twisting turns and the well written dialogues, it's the strength of the performances from Frances McDormand (whose expressive eyes show every thought and capture the depths of her pain), Woody Harrelson and Sam Rockwell that keeps ""Three Billboards"" up. A great movie!",
309,21 January 2018,evrivali,10, Unusual but AWESOME,"We saw a lot of great movies in 2017 and I can confidently say that Three Billboards Outside Ebbing, Missouri is one of them. Written and directed by Martin McDonagh the movie is a winner in every category . It's original, it has great performances and a plot full of brutal, funny and sad moments. It's balance of humor, violence and drama is remarkable and not easy at all to find in today's movies. The real asset of this movie though is Frances McDormand. She plays a non likable and very complex character and delivers one of the greatest performances I have ever seen. She manages to make you like and fully understand a violent character, basically the 'villain' of the movie something that I have experienced very few times and that's one of the reasons I gave the movie 10 stars. The truth is ,not everyone can appreciate and understand the bizarre style of the movie and I am very disappointed to see that this movie is hated by a lot of people. Love it or hate it there is no denying that Three Billboards Outside Ebbing, Missouri is a unique movie and definitely something that you don't see everyday. I believe though that even more people are going to love it and that's the reason I decided to write this review. To maybe push people to watch it and see with their own eyes McDonagh's great achievement.",
310,18 January 2018,senan-gilsenan,9," Denial, anger, bargaining, depression, and finally acceptance.","The writer & director, Martin McDonagh, has managed to capture the subtle dark sense of humour which often seems to accompany death and grieving. He recognises how it is used as a coping mechanism to deal with the loss of a loved one; yet the line between drawing offense or being funny is thin. 
McDonagh mastered this in his first film, In Bruge, which was marketed as comedy, even though it dealt with murder and suicide. A lot of the audience see 3 billboards as a comedy too, but it is not. Truthfully, it is another film which deals with grieving and loss, all five stages of it, with all the myriad expressions of denial, anger, bargaining, depression, and finally acceptance.
The small town setting in Missouri works really well. It could almost be a small town in Ireland , or anywhere for that matter. Small towns are small pools in which the big fish are always the more louder and brashist characters. Enter Sam Rockwell, who plays the role of a racist policeman who redeems himself in the end. He is the equal to Colin Farrell's characters in 7 Psychopaths (another McDonagh film which they both starred in) and In Bruge. 
Frances McDormand is commanding in nearly every scene playing a local anti-hero who everyone is polite to on account of the recent loss of her daughter, yet behind her back they all judge. 
Woody Harrelson is just getting better and better at playing yet another role in which he almost sucks in both respect and empathy. 
This is such a fine film that I watched it again, the very next day. It is a non-Hollwood production which despite winning Best Picture at the Golden Globes, it seems to be getting it fair share of 'haters' in America. I would guess that this is because of the dissmissive way in which the narratve deals with racism in the Southern States. It seems to say that at the end of the day, people are just people and that a person's colour is irrelevant.",
311,9 February 2018,clark-ingleton,6, Wasn't quite convinced,"Three Billboards Outside Ebbing, Missouri stars Frances McDormand, Sam Rockwell, Woody Harrelson, Caleb Landry Jones, Abbie Cornish, Lucas Hedges and Peter Dinklage, and is directed by Martin McDonagh, who brought us the sensational In Bruges, and Seven Psychopaths.",
312,27 December 2017,CANpatbuck3664,9, Three Billboards Keeps You Guessing and Boasts a Sharp Darkly Comedic Wit,"I didn't fall in love with this movie immediately. I found it funny from the get go but I had to work my way into it. The biggest reason that this movie won me over was how daring and unpredictable the plot was. Every time I was getting settled in, it felt like the movie slapped me awake with some new twist. I mean this in the best possible way. Everyone complains when it comes to Hollywood, there's nothing new under the sun so if someone does something original, its only fair to heap praise upon them. Three Billboards is certainly its own thing, we go from extremely vulgar humour (cleverly written but vulgar) to a character committing murder in a heartbeat. This could have been jarring and it was, but the movie is written so well that I ended up appreciating it because it was different, and it worked far more often than it didn't.",
313,15 February 2018,DVR_Brale,8, Contains an important message underneath all profanity and mayhem,This is my more of a commentary on the movie rather than a review. ,
314,9 March 2018,JMaccabeus,1, Tedious garbage masquerading as art.,"Boring and slow but I watched it in its entirety in the same way one morbidly looks at a bad highway accident because the movie is enlightening as to how low functioning, ignorant and racist Hollywood perceives the average person (you & me) to be. The police are portrayed as stupid to the point of mental retardation, openly committing violent & utterly pointless felonies in front of countless witnesses. They are inexplicably not held accountable for their actions. Likewise, when our almost equally ignorant hero firebombs a police station, the entire community knows she did it, and yet nothing comes from it. Such a crime would be an international news story that would mandate a major FBI investigation. The point is, this movie is completely detached from reality in every regard. Real people don't think or talk this way. People don't act this way. Reality dictates that there are unavoidable consequences for bad choices that don't apply in the fantasy world of this movie. Although this movie is not unique in this regard, I don't know that I have ever seen one so overtly contemptuous of common people. Ironic given the lack of education and real world experience that most of these Hollywood elitists actually have. Here is a tip for Hollywood on how to make real art instead of this garbage masquerading as art: in reality, the differences between the average person and the smug elites is negligible. A few bad choices for those without a safety net can create a life trajectory very difficult to recover from. Enough with the smug disrespect for customer base.",
315,23 December 2020,badoli,9, I loved it.,"Seems a lot of people concentrate on the plot holes, which is sad. Because none of those actually influence the story of the movie in any meaningful way. Some seem to get stuck on political views, which is silly. I was just here to see a heartfelt story and that's what i got: Great drama and comedy.",
316,7 December 2017,glavonnetay,3," Dark, Yes - Comedy, Not So Much","Another reviewer summed it up when he/she wrote: ""it's unfortunate to use the word comedy, dark or otherwise, with regard to this film. unpleasant would be a better adjective"" This sentiment was echoed not just by me, but everyone I personally know who's seen this movie.",
317,12 February 2018,michael_balsdon,9," Three Billboards. A funny, depressing ride.","Three Billboards manages to be funny while it concentrates on its dark and serious subject matter. The cast turn in amazing performances with Sam Rockwell's Dixon being one of the standouts as his character arc is one of the most interesting in the film. The film reflects the harsh reality of the world we live and while the film does paint the police force in Ebbing Missouri as incompetent, it also shows the hard task that they face when trying to catch killers and rapists. The films premise and story aspects feel relatable as the tragedy that befell Frances McDormand's characters daughter, has most likely happened to someone else and the characters act in way that feels real and their reaction to certain events in the film are justified. Overall, the movie is fantastic and is definitely worth every one of its Oscar nomination's, boasting a powerful story , great performances and genuinely funny and sad moments.",
318,29 January 2018,msbreviews,9, Rating: A,"The movie with the biggest title of 2017 (I think?!) tells the story of how Mildred Hayes (Frances McDormand) handles her daughter's murder, which still does not have any suspect after several months. She pays for three billboards with a clear message to the chief of Ebbing's police, William Willoughby (Woody Harrelson).",
319,12 August 2021,whineycracker2000,2, Tear them all down please,"There seemed to be a time when a film's politics were unintentional byproducts of a filmmaker's vision, not the sole intention. When art comes from an honest place, any hidden revelations or latent ideas can't help but naturally emerge and eventually become open to interpretation. Genuine artists create because they have no other way to thoroughly communicate what stirs within them. The last thing that anybody wants is for them to eschew intuition and inspiration for the sake of a cause or to let ego inform the process.",
320,19 January 2018,MovieSoup,10, The Best Movie Of 2017!!,"I have now watched this film twice and I can honestly say that it is perfect in everyway. Im going to try and explain why this movie is great but my explaining could not really do justice to this film. This film has all the key things a film has to have to be great like a strong engageing plot, strong characters, great camera work, great sound track all of it. ",
321,10 April 2018,kalyan-srinivas,4, How did this trash received so much praise?,"Cannot understand how Sam rockwell received an oscar for this, I know no one is taking oscars serious anymore but still he is wooden and can't act to save his life. Coming to the story, this is a poor film with an idea that the director thinks is greatest ever, not. The storyline is weak and inconclusive and it does not even know where it was going. Don't bother watching this and waste your time please!",
322,28 December 2017,Roxie99,4, Lost it's way in the middle and no real ending.,This movie had great potential and very good acting but the foul language was too much. Then the liberal biased BS started and never stopped. Why ruin a good movie with your biased opinions? When was this movie taking place? Newer type cell phone says at least 2000's but the police department was more like 1960's or earlier. I just felt this movie was all over the place and never figured out where it was going. But it is exactly what Hollywood likes so if you are into that.,
323,22 February 2018,mopar-50246,1, A movie about self loathing,"I was expecting a psychological thriller, instead I got a psychological bore. All the characters do is bitch and moan about how victimised they are, even the dead raped daughter(well before she died). There is very little plot to this movie, so don't expect any closure, I found the ending predictable (nothing happens TADA!). Funnily I don't blame the actors, I blame the writers, the main actors are brilliant in my opinion but they couldn't save this film. I'm knocking 1 star off for the badly animated deer, did it have to be so bad? Did they animate it on a PS1? Why not get a real deer? it's not like they are extinct or dangerous",
324,23 February 2018,julenpadilla,7, Better than expected,"Three Billboards Outside Ebbing, Missouri is a different take on a crime/drama film filled with bits of dark comedy. What stood out for me in this film mostly was the acting, it was phenomenal. Frances McDormand plays this strong independent woman who fights for what she believes in. She does a great job of coming out as a cold person with no fear. Sam Rockwell stole the show for me, he brought most of the humor in my opinion. Overall the film had a thorough and entertaining plot which had you captivated, especially once the movie picks up pace. Someone in this film definitely deserves to win an oscar, whether it be Frances McDormand for best actress or Sam Rockwell for best supporting actor. If you despise drama films, I would skip this, if not, watch it and you won't be disappointed.",
325,1 January 2018,beispsyd-18523,3, Emperor's New Clothes syndrome,"Not that good. Just because you see a ""Wazneack"" label, or collectively known as the ""Wachowskis"" since now are both trans women, or misfit acting using an odd hand gesture, or 'energy"" style in performing (and performing they certainly are spotted as doing)... it must be avant garde and chic. Therefore, must watch and agree is good (don't want to speak otherwise...may be thought of as ""un-chic"" if tell the real reaction).",
326,8 March 2018,nodif,1, Monster circus art house movie in a disguise of quality drama,Warning. This review contains plenty of spoilers but I don't think this movie is worth watching.,
327,3 December 2017,dansfvr,4, Wait for on demand! Save your money!,"I cannot understand why the reviews are so good. Yes, the acting is very solid. Woody is his usual good, interesting and funny self. Both Frances McDormand and Sam Rockwell are good too. The story is unique too. So it drew me in. And then this is what killed it for me. There is NO ending whatsoever! Nada! Boo!",
328,6 February 2021,Alex_Lo,9, There are still real Surprises,"A tragic but also funny story, in which sometimes the laughter get stuck in the viewers throat. Frances McDormand is terrific, and I have taken Sam Rockwell into my heart. The surprises and the handling of the prejudices of the audience prove the clever staging. And despite the serious and sorrowful themes, the film offers an amazing entertainment value. A real surprise!",
