Review_Date,Author,Rating,Review_Title,Review,Review_Url
530,26 July 2013,rvoccerace,9," An inspiring story of a true underdog,","""Rocky,"" is the compelling story of a down and out Philadelphia boxer named Rocky Balboa, who gets a shot at fighting against the world heavyweight champion Apollo Creed. ""Rocky,"" has always been an appealing movie to me ever since I was young. There's just something about underdog stories that makes people cheer and root for them. ""Rocky,"" is no different, you could easily compare it to a David and Goliath type of situation. The movie is very inspiring if I must say. Sylvester Stallone does a great job encapturing the spirit of Rocky Balboa. But this movie is not just about a championship fight, its also about Rocky attempting to strengthen a new relationship while attempting to cope with the nerves and worries of his soon to be championship fight. Overall I love and always have loved ""Rocky,"" and with that being said, it is definitely a must see for everyone.",
531,24 September 2013,knadir83,10, A Master Piece About What Life Is!!!,First of all i would like to say that it is one of the best movies i have ever seen in my life.,
532,20 October 2017,lbeattie-65122,10, A Philly girls perspective,"I have two favorite movies so far in my life. Movies so good that if I pass them channel surfing, I have to stop and watch them. These would be Jaws and my all-time favorite Rocky. Don't think that because I'm a woman that Rocky is anywhere near a chick flick, but it's not a jock boxing movie either. This movie is personal to me because I've walked the streets it's filmed on. I've lived the struggle of Philly life. This movie touches my soul and makes me proud every time I watch it.",
533,31 December 2005,williameyewtiger,9, 'a million to one movie',"this is one of my all time favorite movies. I love nearly all parts and elements of this film: the underdog catching up, the lonely tough man, his will to fight.etc,and also the the plot; 'a small time boxer gets his one in million shot of becoming a world champion'. Rocky has a potential to motivate people to lift, work hard and finally achieve a great result. Slyvester Stallone, in his own production, has done a very good job at being a tough and motivated prizefighter. The soundtrack within this film is also cleverly made which suits the emotional aspects of this film. I would say that the highest point of this film would be the final scene which captures many people's hearts. this film is surely one of the best movies of the 70s; there is no doubt to it being a Oscar-winning film!",
534,28 April 2014,nicolefe92,3, i have no idea why this is called a classic.,"Honestly, i don't get whats the big deal about this movie. Other than the happy ending- all is good- fulfill your dreams theme, it doesn't have anything.",
535,15 May 2004,FilmOtaku,7," Basic, yet inspiring","Although I saw this film at one point during my life (as a child if I remember right) I figured it was time to see it again as an adult, and as with many films I have seen again, though decades apart, it held entirely different meaning to me.  When I was a kid, my Dad used to go out jogging, and I used to laugh at him when he would play the theme song to Rocky on the turntable while he stretched.  It's still a little corny, but I partially realize the meaning behind it, because `Rocky' is indeed a very inspirational film.",
536,23 July 1999,OPERATOR-4,10, My Favorite Sports Movie,"The first ""Rocky"" film is proudly my favorite sports film.  Stallone is brilliant as young Balboa in a triumph of the human spirit.  The music from Bill Conti is stellar, in additon to the directorial work of John G. Avildsen. I can say right now that I would pay theater money to see this masterpiece on the big screen.  ""Rocky"" is just as enjoyable as the original ""Karate Kid"".",
537,30 April 2021,Schenkenberg112,9, Why do you wanna fight? -Because I can't sing or dance.,'Rocky' has been held a special place in my movie lover's heart since my early childhood. Most of those I knew back then thought that the first 'Rocky' was mostly boring. Everyone preferred Stallone's more action-packed movies and performances. I too love the movies like 'The Cliffhanger' and 'Tango & Cash.' But it was 'Rocky' that I truly loved and this is the film that turned me into a fan of Stallone.,
538,24 May 2007,starwarskid1992,10, Review By starwarskid1992,"""ADRIAN !""-Rocky Balboa ",
539,29 April 2000,Eraser81,10, The Greatest Film Of All Time,"When it comes to charisma, heart, determination, and love, nothing can beat the Academy Award winning Rocky.  Great cast, great direction, and great script rises this above the rest.  And the 4 sequels were good too, something not all sequels can say, like Lethal Weapon.  Not that the sequels to Lethal Weapon were'nt any good, they were.  But when it comes to a film series, Rocky is champ.",
540,11 May 2004,nmayers,10, Sweet and Uplifting,"How Sylvester Stallone managed to go downhill after this, his first film (which he also wrote), is a mystery -- he showed the greatest potential so early in his career.  Don't think Rambo here...think stuffed teddy bear! The world of boxing is really just a device for the story's reason for being -- courage, love, and the fulfillment of dreams.  Rocky doesn't have a chance against the world heavy weight champion, and he knows it...but that's not what matters.  He just wants to prove he has the heart to go the distance.  Women love the movie for Stallone's endearing characterization, and men love it for the boxing scenes.  The Rocky series -- all films -- are the only movies I ever attended where the audiences stood to their feet and cheered and applauded wildly.  I've never seen a reaction like that for any other movie -- and I doubt I'll ever see it again.  Don't miss this one...it's an experience of the heart.",
541,16 February 2005,a15haddad,9, Raw emotion wins out,"Rocky is one of the most famous movies ever and spawned one of the cinema's most popular franchises. Much of it forms one of the cornerstones of film history, and it has one of the most famous scenes ever. But many people disregard it as a great movie. Even now I am utterly insulted that it is not even in IMDb's top 250. That's just an outrage. Rocky is a true classic in its field.",
542,6 June 2023,richardrocha-91828,10, This Is Not a Boxing Movie,"For the rare folks out there who haven't seen this movie, please don't think of it as just another underdog sports film. There's so much more to this film than that. You have to look past all the cliches we have seen in modern culture about this film. The silly ""Yo Adrian"" bits and running the stairs. Instead, watch it with a different perspective.",
543,4 March 2012,twk00,9, Hollywood at its best.,"Before Stallone diluted the brand with a series of increasingly ridiculous sequels before finally bringing the franchise back to respectability with ""Rocky Balboa"" there was this little film which is a fine example of the Hollywood formula executed to perfection. The classic underdog tale combines the gritty realism of the 1970's, with the uplifting story of a down on his luck boxer who gets the chance of a lifetime when he gets a shot at the World Championship. At its core ""Rocky"" is really a touching love story and working class drama featuring great performances by all the principles (Stallone has never been better) and great direction by John G. Avildsen who won an Oscar for his work. Stallone's screenplay hits all the right notes and it is impossible not to be fully invested in the story by the time the emotional climax hits. There are scenes in this film that left their mark in film history and the film became an inspiration to people around the world. The only downside was that Stallone decided to cash in his characters popularity and made 5 sequels that had varying levels quality. Rocky 2 was entertaining but unnecessary, while Rocky 4 was so utterly ridiculous that the movie has become nothing but an entertaining joke. It's best to forget the sequels because the original is truly a classic example of Hollywood cinema at its absolute best.",
544,29 January 2007,pnikari,9, Wonderful,"Wow, this movie is just great. Rocky Balboa is a fantastic movie about a man trying to become a famous boxer, or at least ""go the distance."" Rocky (Sylvester Stallone) is a poor man and calls himself the Italian Stallion. Anyways, he meets this ugly-at-the-moment girl named, Adrian. She is very shy and gets nervous when he comes by. Eventually he dated her and they began to start a very cute relationship.",
545,24 February 2017,charlesvine-75968,3, Eh....it was alright.,"I didn't particularly like this movie. Dimwitted athletes don't especially interest me. I realize many liked it, but there is no accounting for the public's taste. I generally enjoy most sports movies, too. I realize that this wasn't a pure sports movie, but I just couldn't get into it. The music irritated me, too. I can't believe they are still playing that annoying music.",
546,2 March 2023,Cinema-reviewer321,8, His whole life was a million-to-one shot,"The movie that became a classic and the movie that we know Sylvester Stallone for as the character Rocky Balboa. The movie is rewatchable, and it still holds up for a movie that came out in 1976, which is great.",
547,2 December 2005,Imay_37,10, Absolutely Fantastic !!!! All 5 are great !!!,Stallone pulls it off again....... what a great actor........ definitely the best actor in the world!!!!!!!!,
548,17 October 2000,Andy Spring,10, My Inspiration,"This Movie gave me something! I was 7 Years old, when I saw it the first time, And now I'm 18 Years old and train Full-Contact Karate. Without that Movie I'd never had done such a lot things in my life, and I keep watching it to get the courage to look in my enemy's eyes, and say, I will give my best. If I lose, I won't be hurt. But I know, that I can win, and will give everything to reach the victory. It's just a movie, but it's able to give you an open way. I love it!!!",
549,4 December 2000,mr_hook_it_up2000,10," If you feel like you can't make it in life, this movie will change that.","This movie is the greatest most underrated movie of all time.  I am not ashamed to say it. Each time I watch this movie I cry at the end.  It is one of those movies that never gets old. This movie is older than me, but it still ranks up there as one of my favorites.",
550,7 June 2005,samundar_2001,10, you will never be the same,"once you've watched rocky your life will never be the same.i can tell you by personal experience that my life changed completely. rocky is one of the best, if not the best, movie ever made. i was really shocked to see that it was not in the top 250 list of IMDb. however for me it will always be the best of the best. Stallone gave probably his best performance in this movie. Micky's character was great too and burgess Meredith was the best guy for the job. one thing is for sure that rocky isn't a boxing movie. it will touch your heart and will make you chase unfulfilled dreams. the climax of the movie is great and the closing moments will bring tears in your eyes.in all rocky rules. 10/10",
551,4 April 2001,Asmodeus Night,10," What is there to say, it's Rocky!","A true American classic and possible the ultimate ""guy"" movie.  It doesn't get better than this.  Rocky Balboa, Apollo Creed, these are the things legends are made of.  Yeah the story may be unbelievable and the fighting choreography poor but if there's one guy who can watch those 15 rounds and not get goose bumps when that music comes on, buddy you got something wrong with ya.",
552,11 February 2023,HabibieHakim123,7, Rocky Is A Pretty Good While Also Cheesy Sports Film That Are Very Entertaining And Enjoyable To Watch And I Still Like It,"7.5/10
Rocky wasn't a boxing film that you will expect as the movie mostly follow Rocky's undergrounds life, preparing, and the most notably his love story with Adrian, so don't expect to be a back and forth boxing sequence here and there, Rocky was for me not one of the best thing ever, and in terms of a sports movie i can see why it's iconic but i'm pretty sure if i watch the film when it was release i will not gonna be so amazed by it, mostly by the cheesy acting by Rocky himself, Sylvester Stallone, i feel like he's was just not acting except when he scream Adriaannn!!!, anyway, he wasn't all the way through bad, there is still a good scene with him, but mostly it's cheesy entertaining, and the rest of the cast was pretty good, and for the rest of the film, Rocky is a pretty good while also cheesy sports film that are very entertaining and enjoyable to watch and i still like it.",
553,25 May 2021,Rinrnhay,10, More Than A Sport Movies,Sly Stallone has written one of the heartbreaking story about real boxing match. The characters of movies is one of the acclaimed about Rocky,
554,11 October 2006,santaclausenovak,10, In my top 10,How can you not have this movie in your top ten...What I mean is this..Have you ever been an underdog in your life??..Have you ever fought to better your odds in a no win situation when it feels like you are going to fall so hard that you might penetrate the Earths crust to its core then incinerate to dust??May sound a little over the top but you the picture..Well I have come close to these circumstances and 9/10 times I prevail!! I owe it all to Rocky Balboa..Although Rocky is a fictional character his spirit and essence lives in all of us..When you think he is down and out or defeated for the last time he gets up and keeps going win or lose..winning or losing is never an issue Rocky..but getting to the finish line with honor and bravery is..His character has inspired a whole generation and maybe the next to keep up the good fight!! If you could grant a fictional character sainthood...Then Rocky would be the saint of lost causes coming out on top..Long live Rocky Balboa!!,
555,8 January 2007,alex_83132,10, Greatest story of all time,"This movie has it all. Drama, excitement and action are all included in this fabulous story about a underdog boxer who gets the opportunity of a life time. We follow him through the tough and happy moments of his journey towards the big fight against, Apollo Creed, the heavyweight champion of the world.",
556,6 January 2009,bartendammo,10, Great in countless ways,"This movie is so great there is very little suspension of disbelief to engage in, if any. So well written and acted that it could be passed off as reality . Setting this story in 70's Philadelphia is absolute genius. Some of the set locations are so bleak and hopeless that if I was Rocky I wouldn't even get out of bed no matter how bad the apartment stinks. I wish I had written the scene where he asks Adrian to go to the basketball game. She gives no answer and he immediately changes the subject and acts like it never happened. What guy cannot relate to that? And how can an actress so completely embody nerdiness and hotness in one character? Definitely on the very short list of NO BRAINER great films.",
557,8 May 2023,vithiet,9, The ultimate underdog story!,"I've seen Rocky many times over the years but it had been a while since last time but it's always a pleasure and while obviously it does look like it was made close to 50 years ago, it really doesn't age badly. If you've never seen it, you should know going in that is not really a boxing movie per se; it's more of a tale about overcoming adversity with a sprinkle of a love story, and boxing as a backdrop. The fact that this was also Stallone's gamble that would either make him successful or break him can be felt through the whole script that he wrote himself. And it doesn't matter how many times it's been used and everyone has heard it, but that now iconic theme during the training montage will get anyone pumped!",
558,16 January 2021,davidcdaum,10, Inspires Motivation with each Viewing,"Rocky is the ultimate underdog story. His journey makes one believe that the phrase ""hard work beats talent"" really is true.",
559,4 October 2001,anton-6,6, Good but nothing to remember!!!!!!,I don´t like Sylvester Stallone at all but he has done two good roles: This and Cop land.,
560,19 June 2005,Alz_Benjamin,10, The Best Movie!,"Rocky is the best movie ever made. I first heard of this movie in 1999 when I was at a friends house but did not watch Rocky as I disliked boxing. In December 2004, I saw this movie at cable TV because there was not any other show on TV. At the end of the movie, when Rocky lost to Apollo Creed, I was emotionally touched. Then I realized Rocky was the best movie in the world. Soon after, I checked about Rocky over the Internet and found out about other Rocky series. I bought them all in a DVD set. I began liking boxing and started to train to be a mid-weight boxer. Today I am a mid-weight boxer. The Rocky series touched my heart and inspired me to work harder if a lose any fight. My life has changed ever since I watched Rocky. All my friend are influenced by me and they are a Rocky fanatic just like me. I am looking forward for the making of Rocky 6 if anyone ever makes that movie. I sure hope there will be a Rocky 6. For anyone out there who wishes to be a good boxer or have lost will and spirit in any aspect, please watch ROCKY, it will change your life forever. God bless everyone and I hope the movie Rocky will inspire others to a better life.",
561,18 March 2007,dajuice632,9, One of the great sports movies.,"""Rocky"" is probably the most heartwarming movie I've had the chance to view. I absolutely love the characters that Sly Stallone has created in the ""Rocky"" universe, and the first movie is certainly the best. The romance between Rocky and Adrian is genuine, and I find myself smiling throughout every scene they have together. They're definitely one of the great movie couples of all-time.",
562,1 March 2008,RobertDupea70,10, The Acting? Riveting. The Story? Riveting. The Script? Riveting.,"There aren't many films like this. Forget the sequels except the most recent one which was good. This film is dear to me because I feel for this character. Coming home to his turtles.. talking to them.. asking them why they weren't at his last fight cuz he ""did good."" The guy isn't bright but he's got morals and values. No one really gives a damn about him until suddenly he gets a shot at the title and everyone wants to be his friend. Brilliant scenes that come off honest and desperate, yet very charming. Another thing is the way Philadelphia is shown. Nothing is glamorized. Everything is as is without any bullsh*t. I've seen many boxing movies, but the story and sheer rawness that this one has just cannot be beat. ",
563,9 August 2001,TERMINATOR180,10, The greatest Boxing movie of all time,"Even if you don't like Boxing, you will enjoy Rocky. It is a film about Courage, and proving to yourself that you're not ""just another bum"". This film might even get you into boxing! Not only did Rocky have to try to go to the distance, but Stallone did also. This was one of his first films, and he had to prove himself as an actor. I'd suggest buying the whole DVD set, I did, and it is a magnificent collection of the greatest movies to hit the silver screen.",
564,7 April 2022,tfgqmscp,10, Classic,"Whilst the boxing is very unrealistic , this is perhaps the most inspirational film in all of cinema and with the great story and music and an iconic protagonist portrayed by Stallone, amazing actor !!",
565,11 December 2006,Cal Hawks,10, Amazing,"I first watched Rocky when I was around 8 I guess. Ireally liked it, but at the time III would have been my favorite, because of Mr. T.",
566,19 December 2002,StevensonCD,10," Truly ""Million to one shot""","This film, as well as it's four sequels really gave me hope.  I have always strived against the odds, and ROCKY was one of my sources of motivation. Anyone can really connect with the underdog, as we all have been one in our life at some point.  This film is a must see for anyone that enjoys a story of triumph.  10 out of 10.",
567,14 June 2003,PekkaTurunen,10," Well, what can I say...?","First of all, Rocky-series is (as well as 007) my favourite movie series of all time. I like every single movie of them even though the other films from II to V have been somewhat smashed by the critics and audience, except the die hard Rocky-fans.",
568,15 June 2013,Sboyer2101,8, Just watched this...wow.,"I know it's a bit crazy I am JUST now watching this. I was born 7 years after the film was made, but, I do enjoy watching films that the general public have pegged ""classics"", not matter when they were released. I've heard about this movie for years, but never got around to watching it. To be honest, a lot of films that were made decades ago, sometimes lose their appeal a bit on me. I think its because movies were filmed a bit different back then, in other words, film making has evolved...its changed. Not that I don't appreciate or respect them or understand their appeal to audiences back then. ",
569,3 May 2004,pendragon679,9, Simply Brilliant,"Probably the second-best boxing movie ever made, Raging Bull being the best (in my humble opinion), this is the picture that made Sylvester Stallone a star, and a household name.  His bravura performance as Rocky Balboa, ""The Italian Stallion"" who gets a million-to-one shot to fight the heavyweight champion is at the heart of this rousing film.  Never mind that such theatrics simply don't happen in the world of professional boxing. Stallone's writing captivates and draws in the audience such that we cheer along with the crowd in the climactic (and brilliantly choreographed) fight scene.  I remember seeing this in its first theatrical release and being so caught up in the moment that I was cheering as loudly as anyone else; I never heard half of that final sequence until I saw the picture on HBO years later.",
570,20 November 2005,bad_habitt,10," ""Ain't gonna be no rematch! ""Don't want one!""","This is seriously one of the most amazing, astonishing and 'insert another 1000 superlatives here' films in the history of cinema.",
571,24 January 2016,fraencu,7, 40 years old and still a good movie,"*WARNING* My English is bad, because i started learning English 2 years ago at school. So this review contains some English errors.",
572,12 March 2020,Sleepwalker04,10, Inspiring people since 1976.,"I first saw Rocky when I was around 18 years old. Almost 16 years have passed since then. Rocky is not only a film about boxing. It's much much more. It inspires you to be a better person, the movie has so much to offer- compassion, loyalty, gratitude, love, hard work, discipline, friendship. I think if every kid in their teens watch this movie it would do them more good than any lesson from school, society or parents. I loved it the first time I watched it and still enjoy it whenever I stumble upon it. I am glad I saw the film at the right time in my life.",
573,29 October 2015,ToiletHumorist,10, A movie that speaks to the underdogs of the world,"Rocky has been on of my families favorites for forty years now, and it still speaks to the modern viewer in a way that is as powerful as it was in 1976. ",
574,12 October 2015,kylecerrito,10, My Favorite Screenplay ever.,"I love this movie. Sylvester Stallone had a specific idea of who he wanted Rocky to be, and he played it to perfection. The dialogue is refreshingly original, witty, and charming. The creativity in the story and the characters is evident from the first moment you see Rocky talk to himself in the mirror. The low budget nature of the film only accents the authentic performance of Stallone, while Talia Shire and Burt Young tackle their roles with grace and believable sibling chemistry. ",
575,23 April 2004,Sisiutil,10, A great film sullied by its sequels,"I really think this is a great movie, and belongs in the IMDB top 250. But I believe its lustre has been badly stained by a number of formulaic, mediocre sequels. Sylvester Stallone seems like an intelligent guy, but if he had any sense, he would have let this film stand on its own. ",
576,4 February 2023,OMTR,10," Sly is Rocky, Rocky is Sly","Sylvester Stallone was in his late twenties and lived in an insalubrious bedroom, where the Hell's Kitchen native could open the front door with one hand and the bathroom door with the other, counting pennies to eat either white pasta or rice, once a day, when he wrote the script for 'Rocky' in three days.",
577,8 January 2006,jakemsn4,10, I don't understand how so many people love Rocky Part 1 but find the other four no good,"I love the first Rocky much more than the other four, but that doesn't mean the other four ""sucked"" as so many people put it. Many people love the first one and dis the other four, I don't understand. Please enlighten me. Since my comment is to question why people love the first one and dis the other four, I thought it would be more appropriate to post it in the Rocky part I users comments section rather than in the other four Rockys' user comments sections.",
578,18 July 2020,kunde-96691,10, Masterpeace,Every scene a classic! Love It! Just watched it the 5th time in the last 20 years. I know a movie is good when I dont mind rewatching it!,
