Review_Date,Author,Rating,Review_Title,Review,Review_Url
0,2 January 2010,classicsoncall,10," ""He doesn't know it's a show. He thinks it's a damn fight!""","One gains a certain degree of perspective with the passage of time, and one of the things I like to do is watch a movie that I saw upon it's original release and compare my feelings for it now to those I experienced back in the day. I thought ""Rocky"" was a great and inspiring movie back in 1976, and with only the slightest bit of hesitation, I think it delivers the same feelings today. I throw in that slight hesitation part because over the years, the sports underdog theme has been worked to death in cinema. But the thing about ""Rocky"" is that it's not so much a film about boxing as it is a film about life in general. A direction-less man with no goals suddenly finds the gold ring handed to him on a platter. Not that there isn't a whole lot of work involved to make that dream come true, but one has to recognize opportunity in the first place. I read with some amusement the negative reviews of the picture on this board and have to wonder how many of the nay-sayers consider themselves so intellectually superior that they trash the film for that simple lack of recognition. Because criticizing Rocky Balboa for talking like he had a mouth full of marbles is missing the point. He talked like that because he was a street punk working as an enforcer for a local mob boss, and the people he dealt with on a daily basis weren't exactly magna cum laude types. Nor was he going up against members of mensa whenever he climbed through the ring ropes at a local boxing joint.",/
1,24 February 2016,BA_Harrison,10, Yo!,"Rocky Balboa (Sylvester Stallone) is a struggling Italian/American boxer who also earns cash collecting debts for shady Philadelphian 'businessman' Gazzo (Joe Spinell). When heavyweight boxing champion Apollo Creed (Carl Weathers) finds himself without an opponent for his upcoming match, he offers the unknown fighter a chance at the title as a gimmick, but doesn't count on Rocky's determination to go the distance.",r
2,6 July 2015,utgard14,10," ""I ain't no bum, Mick. I ain't no bum.""","A first-rate film that's about as close to perfect as any movie about boxing (or any other sport) that I've ever seen. The plot is very simple -- small-time boxer Rocky Balboa (Sylvester Stallone) is given a chance to fight the heavyweight champion Apollo Creed (Carl Weathers). It sounds no different than a ton of old movies about the sport. But this film proves that it's not always how fresh or unique the story is but how well it's crafted. Rocky is a masterpiece of filmmaking with dynamite acting from Sylvester Stallone, Burgess Meredith, Talia Shire, Burt Young, and Carl Weathers. Many classic scenes, lines, characters. Bill Conti's score is one of the all-time greats. It was nominated for nine Oscars, winning three including Best Picture. It was director John G. Avildsen's best film and many would argue it is Stallone's best as well. Certainly his best screenplay. The fight choreography is terrific. Followed by a string of enjoyable sequels but they were just solid entertainment. This one is very entertaining but it is also something much more than that. It's one of those movies that becomes part of culture in a big way where everybody recognizes something from the film even if they've never seen it.",e
3,5 May 2003,MovieAddict2016,10, The Raging Bull Named Rocky...,"""Rocky"" is about a man. It is the story of a man who exceeds past all normal expectations and makes the most out of what he is doing. What is he doing? Boxing. Why? As Rocky says in the film, ""You have to be a moron to want to box.""",v
4,3 November 2015,ivo-cobra8,10, A classic! the best and the original movie of all time - Rocky !,"Rocky (1976) It is still today one of the best action, sport, drama and a cult classic low budget films ever made in history. It is an underdog story telling about a men and his struggle in his life. Sure, I know that without it, there'd be no sequels for a ranking, but compared to III, although this Best Picture of 1976 was great, it just dragged a bit for me. I'm no brainless action-goer, mind you. I love real human drama portrayed on screen. I've got to say though, at times, you feel like you're watching a documentary on a real man's life. It's that much realistic. This to me is a no brainier. You get introduced to an insecure Rocky who works for the mob as a collector, but has too big of a heart to go around hurting people in an awesome heartfelt movie. Adrian and Rock meet, You get introduced to the lovable A-hole Pauly. Introduced to Creed. Introduced to Mick. And BUTKUS! And Rock goes the distance with Creed! This movie has a Heart . As a kid Rocky III was my favorite best movie ,but this one is my second best movie. YO ADRIAN I DID IT!!!",i
5,27 November 2020,zkonedog,10, Everything About This Film Is Iconic--And Inspirational,"Every once in awhile, a movie comes along that sort of breaks the mold. By almost all accounts, ""Rocky"" never should have even been made, much less developed into a cultural phenomenon. Fortunately, the stars aligned in just the right places to produce what is truly one of the most iconic, inspirational films of all time.",e
6,17 December 2004,JFHunt,10," ""But it's Thanksgiving. Yeah to you, but to me it's Thursday.""","It's hard to explain what this movie means to me. Words could never. I remember when I was a kid, I never liked the first Rocky, was too obsessed with III and IV. It happened when I was 11 and I went to see V in the theater. I never been to a movie like that before. People were screaming and cheering. Shook the whole damn place. They were dancing in the isle's and celebrating. It was then I realized the true power of Stallone's vision. The realization that only the original would ever really matter.",w
7,11 August 2019,BandSAboutMovies,10, A perfect movie,"Sylvester Stallone wrote the screenplay for Rocky in three and a half days after watching Chuck Wepner take world champion Muhammad Ali to 15 rounds, a feat that no one saw coming. Stallone was also inspired by two boxers named Rocky - Marciano and Graziano, as well as Joe Frazier.",/
8,18 February 2005,rbverhoef,9, A great Sylvester Stallone film,"If you think Sylvester Stallone has made nothing but stinkers you just have to see 'Rocky'. This is a brilliant film, based on Stallone's own screenplay, where he plays a complex character in such a terrific way it is not strange people thought this was going to be a great actor. Compare it to another great film about a boxer, 'Raging Bull', and 'Rocky' will be better at some points. It goes without saying that it's quite an achievement.",r
9,15 May 2020,marcin_kukuczka,10," The older it gets, the better it is... Wonderful Movie!","It seems that those movie productions that had to fight the big fight with the expectations, somehow, turned out to be timeless, not only for the fans of the genre but for the general audiences as well. That is, undeniably, the case with ROCKY not yet directed by Sylvester Stallone but by late John G Avildsen (who comes back with the direction of ROCKY V in 1990). ROCKY, after all these years and a lot of sequels made after, including the recent CREED films, proves to be one of the very best films about sport, a sportsman and, most importantly, a personality - formerly 'nobody' rising to the top-notch fame and popularity.",w
10,24 December 2015,Uriah43,8, Intense Action and Drama,"""Rocky Balboa"" (Sylvester Stallone) is a boxer who struggles just trying to make ends meets in the city of Philadelphia. Although he certainly isn't the brightest person around he has a big heart and does the best that he can. Yet even then he realizes that he is going nowhere fast. Then one day he gets a call from a man who wants to schedule a fight between him and the undisputed Heavyweight Champion of the World who goes by the name ""Apollo Creed"" (Carl Weathers). At first Rocky refuses because he doesn't believe he is in the same class as the World Champion and doesn't deserve the honor. However, he eventually comes around and gets more serious about his training. But even then he has grave doubts about his chances. Now rather than reveal any more I will just say that this was a very good movie which really highlights the importance of never giving up and always trying to do your best in spite of the odds. Admittedly, the first hour or so is quite slow but during this time it provides the character development necessary for the intense action and drama in the second hour. This is especially true for Talia Shire (as Rocky's girlfriend ""Adrian"") and the aforementioned Sylvester Stallone. At any rate, I thoroughly enjoyed this film and recommend it to those who might be interested in a movie of this type.",0
11,30 March 2013,planktonrules,10," The film cost a million and grossed over 100,000,000 domestically.....'nuff said.","I am not a huge boxing film fan. Well, that's not exactly true. I am not a fan of films that glamorize boxing. Movies like ""The Harder They Fall"", ""Requiem For a Heavyweight"" and ""Champion"" and ""The Set-Up"" are all wonderful films about the brutality and vicious nature of the 'sport' and are great indictments about what a terrible thing boxing is--and I heartily recommend them. However, ""Rocky"" is a rare film that glamorizes boxing (for the most part) and manages to deliver a film that you can't help but admire. Think about it. It was a small film, costing only about a million, and earned TONS of money and won the Best Picture Oscar!! No matter what you think of the later Rocky Films (as they got progressively worse) or the other films of Sylvester Stallone, you cannot take anything away from this tremendous achievement. It is a great film and it's amazing that it was made by folks who no one really heard about up until then. Plus, when you read about how quickly Stallone penned the script, you can't help but admire it. A terrific film.",9
12,9 April 2001,mm-39,9, Stalone's best,"As much as the media mocks Stallone, he won best picture for this film. He will never top this film, which made him a icon.  It's a story about a down on his luck loan collector/ boxers who gets a one time shot at the heavy weight championship, because of a late pull out by a contender, and the champ does not want to lose his money on the deal.  There is romance between Rocky and his new girl friend who lives just as hard of a life as Rocky, and together they make life livable. The rest of the cast is other down and outers who give the viewer a feeling of hopelessness until Rocky gets his chance.  This film is touching, and unforgettable.",6
13,28 July 2016,colm-hearne365,8, Rocky through the ages,"For this review, I'd like to go through all the Rocky movies (including the most recent Creed) and talk about their good points and their bad points. ",0
14,14 May 2000,forsaken999,10, NOT A BOXING MOVIE!,"The first common misconception about Rocky, and something that's almost inevitable when you put a half-naked Stallone with boxing gloves on the cover is that it's a fighting movie.  In that time it would fall into a category including Jean-Claude Van Damme and Jackie Chan.  Now don't get me wrong, I like both of these actors a lot, they're among my favorites, but Rocky is not just another cheap movie about a man who like to win a fight or tournament because he deserves it (Bloodsport, Quest).  Instead of a fighting movie we should say that it is a movie about a fighter.  That changes the context altogether, it means that sure he has fighting on his mind but has other personal issues that are demonstrated throughout the movie.  In fact in the whole movie there are two fight scenes (at the beginning and at the end) which together add up to about 15 minutes.",6
15,28 December 2003,TheSixthChild,10, His whole life was a million-to-one shot...,"When I was a kid there were only three major things in my life: food, wrestling and `Rocky'. My brother and I followed the numerous Rocky Balboa struggles religiously, and even today, there is no exception. Although the latest efforts of Stallone have been pitiful, the movie that made his career is the 1977 Academy Award Winner for Best Picture, `Rocky'. On top of that, `Rocky' also earned two more Academy Awards for Best Film-Editing and Best Director (John G. Avildsen).",5
16,26 March 2016,marcrice,10," Great movie, great soundtrack a classic","What can you say about a this movie that has not been said already? It is my all time favorite movie series ever and I could watch every movies back to back time and time again. I have owned this movie series on Video, DVD, Blu-ray and owned just about every version going.",6
17,11 March 2020,morrison-dylan-fan,10, Tribute to Guy Morgan:Rocky (1976),"In the last few weeks,I've been thinking about all the incredible films family friend Guy Morgan introduced to me,before he suddenly passed away at age 46 on March 11, 2019 of a brain aneurysm. One running joke we used to have was Guy saying ""Oh you watch all those French films,but you've not seen Rocky!"" On the first anniversary,I marked it by finally stepping into the ring.",/
18,20 November 2020,dk777,10, Rocky,The story of a man who fights for himself and his self respect.,?
19,20 December 2016,Hitchcoc,10, What's Not to Like,"Rocky is the consummate boxing movie. But it's also the story of a man who had pretty much wasted his life. Sylvester Stallone's boxer has thick head and a good heart. He depends on other to kind of look out for him. Unfortunately, he has worked with crooks because it's the only living he knows. He does hard manual labor. He likes to box and because he is intense, he catches the eye of the world champion. He gets a gig as a sparring partner and eventually a fight with the champ, Apollo Creed. Of course, it's a circus. Because Rocky is not bright, Creed is able to abuse him emotionally. Rocky is a bruiser, taking as many hits as he gives. Not a good way to have a future. There are subplots, involving MIck (Burgess Meredith) and Pauley (who is disrespectful of his sister Adrian) and then there is the romance developing between Rocky and Adrian. What happens is that Creed thinks Rocky is a joke while Rocky begins to train seriously for the first time in his life. What eventually happens is one of the best choreographed fights in all of cinematic history. A masterful movie.",r
20,14 November 2006,ccthemovieman-1,8, The Rocky Movie With Character Studies,"After not seeing this film since it had come out in the theaters in 1976, I was almost shocked at how little action this movie had compared to what you see today....or in the Rocky sequels, for that matter. It's okay. It was needed to give us character studies of the main players: Rocky, his wife, his brother, his manager, etc., people we would see in subsequent films. Also, the fight scenes in those sequels went on too long, anyway. Frankly, I've enjoyed all the Rocky movies, beginning with this one.",e
21,29 December 2020,auuwws,8, Rocky,Excellent movie The movie story was not great. I experienced moments of boredom in the first half of the movie. Sylvester Stallon's performance in the film was excellent. The last fight in the film was great. I was very excited as I watched the last fight. The film affected all the sports films after it had a positive effect.,f
22,4 March 2002,b_u_n_44,10, The fact that Rocky isn't on the top 250 is kinda sad.,"Rocky is one of two great boxing movies. Only Raging Bull challenges Rocky as the greatest boxing movie of all time. Not only is there great action inside the ring, the story and drama outside the ring makes for a movie worth watching over and over again. There is no doubt in my mind it should be at least in the top 25.",_
23,21 July 2009,kosmasp,9, Underdog,"The making of the movie, seems to mirror the movie itself. As much as Sylvester Stallone struggled to make the movie, as much is his character Rocky in a struggle in life. And that's what makes the movie so great. The boxing reflects the life of it's characters. And Sly believed in this movie, which is why he wanted to star in it too. His choices were right.",=
24,26 February 2003,Obi-Wan Wilson,10, One of the greatest movies of all time.,"I don't remember exactly when I first saw this film, but for a long time I thought that the second of the series was my favorite.  Well, I recently bought the DVD box-set and after I watched the first movie again I knew that it was definitely the best in the series, and also one of the best movies ever made.  Rocky is very much more than just a boxing movie.  It's a movie about the unbreakable human spirit, determination, and the will to ""go the distance.""  Rocky(Sylvester Stallone) is a second rate club-fighter and a debt collector for a loan shark(Joe Spinnell).  He becomes involved with a shy girl working in a petshop named Adrian(Talia Shire), and also becomes friends with her brother Paulie(Burt Young).  Rocky's life really isn't anything of interest - until the World Heavyweight Champion Apollo Creed(Carl Weathers) gives him an unexpected shot at the title.  An old boxer-turned-trainer named Mick(Burgess Meredith) offers to be Rocky's manager.  Although the whole film is outstanding, what follows are some of the greatest and most memorable movie moments of all time.  Rocky striving to go the distance in the training scene, the final fight, and the closing moments of the film are so emotional and inspiring that they perfectly demonstrate the human spirit and can bring out the will to win in anybody. Add to this an excellent music score and you have  a classic and unforgettable movie.  Without a doubt deserved the Best Picture award in 1976.   Exceptional performances by all the cast members, notably Burgess Meredith and Sylvester Stallone.  **** out of ****",t
25,8 December 2018,josephellis,7, More than a boxing movie,"This film is very different than the sequels. It's more of a Drama that explains Balboa's early life. It's cool to revisit, seeing him before his success. For those who just want boxing, you won't get too much of it. It focuses on the drama and character buildups more than action. You still have to watch this before you watch the others.",t
26,19 July 2017,ironhorse_iv,9, What a knockout! This underdog boxing film was amazing! It went the distance!,"Opening with a black screen, following by giant white letters, the word, 'Rocky' scrolls across from right to left, accompanied by the iconic theme song 'Gonna Fly Now' from composer, Bill Conti ; this Bi-Centennial sport film, tells the story of a down on his luck, boxer, Rocky Balboa (Sylvester Stallone) on his quest to achieve success in the boxing world, by accepting, the role of replacement opponent for world champion, Apollo Creed (Carl Weathers) in an exhibition match in Philadelphia, PA. Without spoiling the movie, too much, while many of film historians & critics, labelled this, as the 'greatest boxing movie of all time'; in truth, this film directed by John G. Avildsen has little fighting in it. When it did, the punches look a bit fake and hokey, despite Stallone and Weathers suffered injuries during the shooting of the final fight; with Stallone suffered bruised ribs and Weathers suffered a damaged nose. Nevertheless, the fight scenes are not really, the heart of the movie. Instead, this film written by Sylvester Stallone works best, when focuses mostly on the titular character, trying to seek the love of a mousy pet store employee, Adrian Pennino (Talia Shire), by proving his own self-worth. If anything, this movie should be label as 'one of the greatest love stories of all time'. Because of this, I wouldn't say, this is action-packed film. The love story takes a big part of the movie, making the fight with Apollo, somewhat secondary. I know, that some people might find this choice in direction, a bit slow paced and somewhat boring, but if you can push through that, you would find yourself, loving the dramatic, more, because how awkward, and real, the love scenes, seemed, between the simple-minded, Rocky and the somewhat recluse, Adrian, even if Rocky is a bit, too dumb to taken serious, while Talia Shire's character, can be a bit off-putting, with her close-minded introvert attitude. It's worth it. You get, a lot of iconic unforgettable scenes like the ice skating sequence & the climatic 'Yo Adrian!' call-out. However, the best scenes in the film, had to be, the training montage. The sequence in Rocky uses meat carcasses as punching bags, and jogs through Philadelphia is very memorable. Yet, the best, out of these training sequences is the scene, where Rocky run up the Philadelphia Museum of Art's flight of stairs. It got so famous, that tourists, around the world, often mimic Rocky's famous climb, as a metaphor for an underdog or an everyman rising to a challenge. The site also got Rocky statue, situated just northeast of the steps as a memorial. Nevertheless, one of the most common misconceptions about this movie, is that, Rocky's trainer, Mickey Goldmill (Burgess Meredith) help Rocky, train for his fight. In truth, most of that training, including the infamous 'catch the chicken' scene was, in 1979's 'Rocky II"". In this film, Mickey barely does anything, but make Rocky's life, a living hell. So, don't bring up, your hope, in, seeing them, connect with each other. As for other supporting characters, like Paulie (Burt Young). He was alright, but his character hasn't yet, became the famous comic relief, that he would become, in later movies. In this, he just a big fat jerk, most of the time, who doesn't know, if he wants to hook up Rocky with his sister or not. It's a bit confusing. As for Apollo Creed, Weathers really has the charisma to pull this role, off. I really don't think, the movie's original choice, real-life boxer, Ken Norton, could do this. As for the main character, Rocky, I really couldn't see, anybody else, playing the role besides Stallone, because how much Rocky mirrors his real-life. However, I do have to say, the original choice, James Caan does look the part of a fighter when, parodying himself, in 1976's 'Silent Movie'. He was very close, in becoming the title character, before the studio took a chance with Stallone in the lead role. Nevertheless, I still think, every actor in this movie, played their roles to the fullest, despite how mean-spirited, their characters, were, even the cameos from real-life, boxer, Joe Frazier. However, I do have to say, some supporting characters were a bit, pointless. A good example is little Marie (Jodi Letizia) who pretty much, disappears for the rest of the life, after Rocky's life talk. Her character doesn't really come back, until, much later, in the sequels. So, what was the point of having her!? It's filler. It's weird, that this movie won, Best Editing & Best Screen writing at the Oscars, that year, but they kept scenes like that. They really could had cut her from the movie. Anyways, I still kinda glad, the film script was somewhat influence by a real-life fight, between journeyman boxer, Chuck Wepner against controversial, charismatic, and overconfident champion Muhammad Ali. I just kinda wish, Wepner didn't take it, so personal. There wasn't no need to file a lawsuit with Stallone for an undisclosed amount. Rocky acts and looks nothing like him. Anyways, with its Cinderella 'feel-good' crowd-pleasing story, 'Rocky' was the highest-grossing film of 1976. The film was nominated for ten Oscars and won three, including best picture; which 'Rocky' became the first sport film to do. The film also spawned six sequels: Rocky II (1979), Rocky III (1982), Rocky IV (1985), Rocky V (1990), Rocky Balboa (2006), and Creed (2015), the latter a Spin-Off about Apollo Creed's son, with hit and misses results. Nevertheless, overall: Despite some goofs in production, this low-budget movie was indeed, a huge hit for me. It's a movie, I will watch, time and time, again. I highly recommended seeing it. It's worth going to the distance for.",_
27,9 January 2005,lilt13098,10, Changed My Life,"""Your gonna eat lightning and your gonna crap thunder"" ",u
