Review_Date,Author,Rating,Review_Title,Review,Review_Url
348,25 March 2007,duraflex,10, Tough man with a tender heart,There was something very genuine and likable about this character when Stallone created ROCKY in 1976.,
349,27 May 2003,phillafella,9, A Knockout!,"ROCKY tells the story of club boxer Rocky Balboa, who gets his shot at fame and the championship title thanks to the current heavyweight champ. Sylvester Stallone is surprisingly awesome in his first lead role and it is definitely Stallone at his best.  The other characters are interesting as well, including Talia Shire as Rocky's girlfriend Adrian, Carl Weathers as the undefeated champ Apollo Creed and Burgess Meredith as Rocky's trainer Mickey.  The training sequence and the climaxing match are also great moments.  Brilliant entertainment.",
350,7 May 2022,Denno1972,8, Stirring stuff,This boxing drama is not really a film about boxing at all really.,
351,11 June 2020,antoniobba,8, great movie,"What a great story. How kindness Sly was. Rocky as a lonely rider, looking for an opportunity. How people could help him, with support, with money. That kind of things you see sometimes and believe in changes. Not too emotional, not too rational. Good job.",
352,12 November 2013,cwbellor,8, Rocky will touch your heart with one punch!,"In the 1970s, a film had to emerge to squash all the Italian American stereotypes perpetuated by The Godfather. Instead of murdering criminals, we get a much more dignified depiction of this ethnic group in the slow-minded, loan shark enforcer who looks like he probably smells. Rocky is a simple, lovable, and soon to be heroic type who only has two talents – ice skating with no ice skates and boxing. When cheerful champ, Apollo Creed seeks to stroke his ego by stroking an amateur boxer across the face, Rocky is the one with the lucky number. Apollo is appropriately named considering that his ego is certainly of God-like proportions.",
353,18 March 2018,jaredmgant,10, One of the best,This film is one of best of all time. A legacy of a story.,
354,26 September 2020,erim-11082,10," An ""underdog"" story from top to bottom","Rocky, is a completely ""underdog"" story with itself and its production's background. Sylvester Stallone's intention while writing this story and his sacrifices to play Rocky character, are fascinating as movie. Although Sly's acting was not appreciated from the authorities, his acting was quite good despite Rocky was one of the his first movies. According to most people, Rocky's story is simultaneously with Sly's life and this makes movie more special. That's why, reading the background of filming process is highly recommended before watching Rocky.",
355,21 September 2019,dominikweidinger,10, masterpiece,"Philly, the characters, the music, the quiet scenes, the training, the fighting, the boxing. underestimate masterpiece.",
356,14 October 2020,dunnanddusted-71057,10, 10,They don't make movies like they used to anymore... This is one of the best movies ever made - end of story.,
357,17 September 2006,funky_cherry86,10, A Sylvester Stallone Classic,I've seen Rocky on television a few times as a kid and it was a great boxing movie filled with so much emotion that it's still popular nearly thirty one years later.,
358,20 January 2014,veryape-887-913905,9, Do you believe that America is the land of opportunity?,"This 1976 best picture winner inspired a nation! A struggling Philadelphia club fighter called Rocky Balboa gets a once in a lifetime opportunity to fight for love, glory and self respect as he gets the chance to fight the world heavyweight champion Apollo Creed after his opponent drops out through injury Creed hand picks Balboa to be his opponent. Featuring a legendary musical score and thrilling fight sequences this rousing crowd-pleaser scores a knockout. The first time i seen Rocky i didn't really enjoy it but once you get older and watch it, it definitely lives up to the 8.1 rating it received on this, when i was young and watched this the reason i didn't like it as much as i do know is probably because of the lack of action as this film shows Rocky how he was before he got the shot at the title!",
359,6 September 2022,dstan-71445,9, ' I've got pain and experience too ',"Rocky Balboa , a struggling boxer in his late 20s and a part time mob enforcer is given one's in a lifetime opportunity to change his life for the better. The question here is , will he just give up on himself and waste this opportunity or will he literally fight till his last breath and make something out of it ?",
360,28 February 2007,leplatypus,10," Rocky, the « fist » one (TV)","Sometimes, memories and the spirit of a movie are better than the movie itself. This is the case with this Rocky. ",
361,21 September 2005,jason_13,10, Stallone's best performance,"This is no doubt one of the best movies ever made and I am really mad, cause many people think it's overrated and that Scorsese's Taxi Driver was better. The movie's purpose is not showing a boxer's life in details. It's a sad and realistic movie. I don't know how many of you realized that many parts of the movie were like a documentary of the life of an average American and if we cut the whole sport thing, the movie would have been a documentary that make us think and realize how lucky we are. Rocky's life sucked and boxing for him was something more than just hobby or something he likes to do. It's the thing that destroyed the bad thoughts in his mind. He might have seemed stupid and careless about what is going to happen to him, but I don't think so. Haven't you ever met a person who doesn't show he cares about something with facials, actions or words, but he just feels it inside him and he doesn't feel the need to release it. That was Rocky's character and that is why I love that movie. Well one of the many reasons. The supporting characters are wonderful as well and the original Rocky is something not to be forgotten ever while the sequels are just entertaining. Once again - a wonderful motion picture I will always love, with great atmosphere, score. Well some bad editing and direction, but who cares. A movie with no flaws wouldn't be a movie.",
362,8 December 2001,Tresix,10, The 25TH Round: ROCKY at the quarter-century mark.,"It's hard to believe that it's been twenty-five years since the original ROCKY played in movie theatres!  By now, most people know about the behind-the-scenes story that was just as interesting as what happened on the screen:  Sylvester Stallone was a character actor who was having a hard time finding roles.  Till then, his biggest part has been as one of THE LORDS OF FLATBUSH.  With a pregnant wife and little money in the bank, Stallone wrote a screenplay about a down-on-his-luck heavyweight boxer who gets a million-to-one shot at the championship of the world.  When he pitched his story to United Artists, such names as Robert DeNiro, Ryan O'Neal and Burt Reynolds were brought up to play the lead.  But Stallone was adamant about one thing:  Either he played Rocky Balboa or he would destroy the script. The studio relented and a classic was made.",
363,7 August 2019,theterminator-92378,8, The best sports movie ever made and a story about dedication and going the distance,"When people think about sports movies Rocky usually the movie that first comes up in the discussion and rightly so because Rocky is the greatest sports film of all time it has a timeless message and it's a story about how you don't need to win or lose it's about in Rocky's case going the distance against Apollo Creed the heavyweight champion of the world and rocky will do what ot takes to go the distance against Apollo.
The Cast includes Sylvester Stallone {Rocky Ballboa} Talia Shire {Adrian} Burt Young {Paulie} Carl Weathers {Apollo Creed} and Burgess Meredith {Mickey} I can't think of a better cast for this movie Rocky and Adrian's relationship feels so natural and they have some great on screen chemistry and another great relationship is the father/trainer bond between Rocky and Mickey they have some great moments and it shows how Rocky's hardwork and determinaton pay off in the end.
Bill Conti deserves a mention as well for doing the iconic score and theme for the movie and let's face it it is probably the most iconic score of all time because you instantly know that it's Rocky and also the going the distance track is also very good and something that i can listen to casually and still enjoy listening to.
Rocky is iconic it's such a amazing story of a boxer from Philadelphia who is down on his luck but he gets the shot of a lifetime and Rock doesn't want to win and he doesn't care if he loses either it's about going the distance and at the end of the day that's a great message you don'r always need to win and Rock teaches that if you put in effort and you are willing to give it you're all then you are a winner no matter what and that is why Rocky is so great and one of the best sports movies of all time.",
364,8 May 2016,DJ_Shilo,10, Adrian! Adrian!,"May 8, 2016",
365,18 December 2006,Jsimpson5,8, One of Stallone's better films,May contain spoiler.,
366,13 April 2019,markrdaniels,10, Perfect film,"Not just about fight: it's about Rocky's relationships with his friends, his girlfriend, his trainer. It's about Ricky's emotional growth and his development of self respect. You have to respect and love yourself before you respect and love others. But yeah, it's a fight film too. Low budget big success. Stallone is Rocky!",
367,8 April 2022,martymoves,8, It's Rocky,"If you don't know the story of Rocky Balboa, watch this film and enjoy.",
368,24 December 2018,shiloh-404-973318,10, Loved this film,Just a great all around film. Still totally holds up today just as much as the day it was released. You don't need to be a fan of boxing to appreciate this film.,
369,12 April 2004,Sabre_Wolf,10, This is the first and one of the two best of this series,"This is a marvellous film that is well known to have been inspired by the Muhammed Ali/Chuck Wepner fight, this is unquestionably one of Sylvester Stallone's best ever films.",
370,25 December 2013,Asentiff2004,9, All i've got to do is go the distance...,Rocky Balboa is a small time boxer whose life is going nowhere until fate intervenes when the heavyweight champion of the world Apollo Creed issues a challenge and gives Rocky the chance of a lifetime. A fight in which Rocky strives to not win but to just go the distance.,
371,24 June 2017,jamesbamesy,9, A sports classic that would spawn the career of a legendary movie icon.,"Ah, Rocky. What else is there to talk about that hasn't already been said? The movie that put Sylvester Stallone on the map and won the Oscar for Best Picture back in '77. As a movie goer, I wanted to explore the Rocky films, as I got the Blu-ray collection of the original 6 movies. It was a truly great experience watching these films and made me a fan of the series. But with that being said, how does the original hold up compared to the sequels? Well, the answer may be obvious, but let's just start anyway, shall we?",
372,25 December 2002,enmussak,8, Everyone loves an underdog,SPOILERS,
373,12 March 2002,fugu_286,10, Not So Far Fetched...,"I have heard people question the plausibility of this film and I had to say something. Back when this film was made, there was mostly one boxing champion in each weight division. There was, for example, one middleweight champion, one heavyweight champion. The days of numerous sanctioning bodies each claiming their own champion had not yet come. In this sense it was a matter of PRESTIGE for a fighter to hold a championship. And before the days of guaranteed multi-million dollar contracts, a champion might have taken on ""all comers"" to try and cement his reputation. A case in point would be when Joe Louis fought Tony ""Two Ton"" Galento, a short stout and overweight beer salesman. Galento was a 30-1 underdog although he did manage to knock Louis down before getting cut to ribbons. Muhammad Ali often defended his title against no-namers like Jean-Pierre Coopman and Brian London.",
374,28 March 2014,PartyGirlSkank,8, One of My Favorite Sports Dramas,"Sports dramas, what can you say about them? Well, I'm not the biggest of them. For me, the majority of sports dramas are boring, overly- schmultzy, and extremely cliché. I won't say that sports dramas is a sub-genre that I really DESPISE as there are films that I DO like in there but for me, if Hollywood just unexpectedly stopped producing sports dramas in general, it wouldn't be that big of a loss for me. However, there is ONE film in the genre that I happen to really love, and that's Rocky.",
375,10 September 2003,SUPERNOVA HEIGHTS,8, Stallone's Best role in his career,"Rocky is a film about boxer's life in the seventies,the film tell us the rise of a poor man to the Top of the hill. Perhaps it has not good screen but the plot is universal,a man who gets the glory with the help of his friends,girlfriend and coach.",
376,3 March 2023,nathangoffnett,10," Yo, Adrian! It's a Masterpiece!",Rocky is an inspiring story about an ordinary man who takes advantage of a once-in-a-lifetime opportunity.,
377,10 December 2006,wereuat06-1,9, A true underdog story,"This is truly an all American excellent movie! To know that this production was not only in on film, but also in real life, a ""win or lose"" project for the then unknown Sylvester Stallone only makes this film more lovable. It tells the story of a unknown prize fighter who doesn't really have a life worth envying. Suddenly he gets his big chance when the world champion seeks a new challenger, as the challenger he had has to bail out, due to an injury. Rocky goes for it, but in the end he knows he's not in the same league as the champ. The true victory is Rocky's new gains self respect and love for his girlfriend Adrian. This film has a really cool 70's vibe and for me the locations use (Philadelphia) fit the film perfect. It was filmed during winter 1976 and that's something you can actually see. The true realism and great acting performances (plus the unforgettable soundtrack) makes this a film worthwhile. A must see definitely!! My favorite scene is still the one where Rocky goes out for his first morning run. He gets up at 4 A.M. and sets out into the cold, frozen streets of morning hour Philadelphia. The mood, music and the winterish landscape of a city frozen up are brought to the screen with such a transparentThis is truly an all American excellent movie! To know that this production was not only in on film, but also in real life, a ""win or lose"" project for the then unknown Sylvester Stallone only makes this film more lovable. It tells the story of a unknown prize fighter who doesn't really have a life worth envying. Suddenly he gets his big chance when the world champion seeks a new challenger, as the challenger he had has to bail out, due to an injury. Rocky goes for it, but in the end he knows he's not in the same league as the champ. The true victory is Rocky's new gains self respect and love for his girlfriend Adrian. This film has a really cool 70's vibe and for me the locations use (Philadelphia) fit the film perfect. It was filmed during winter 1976 and that's something you can actually see. The true realism and great acting performances (plus the unforgettable soundtrack) makes this a film worthwhile. A must see definitely!! My favorite scene is still the one where Rocky goes out for his first morning run. He gets up at 4 A.M. and sets out into the cold, frozen streets of morning hour Philadelphia. The mood, music and the wintery landscape of a city frozen up are brought to the screen with such a transparent touch.. It still chills my skin every time I watch it! If you haven't seen this one, shame, shame shame!!! Go out and rent or (even better) buy the DVD! One of the best American films of the 1970's (and that's something no one can deny)! touch.. It still chills my skin every time I watch it! If you haven't seen this one, shame, shame shame!!! This is the greatest underdog story in history. I give this movie an outstanding 10 out of 10.",
378,29 January 2007,gcd70,7, A winner,"From director John G. Avildsen comes a very good story of down and out fighter ""Rocky"" Balboa, who, against the odds, takes the world champ, Apollo Creed, fifteen rounds; something never before achieved. This film made Sylvester Stallone the household name he is today; forever synonymous as he is with the lead character.",
379,25 March 2011,declan-979-506418,10, inspirational,"To sum this film up in one word, its inspirational, iv seen this film many times and i'm actually building a website about it by choice, for a college assignment. Before watching this film for the first time, i thought it would be just another boxing film but the acting was superb as well as the chemistry between the actors. This film gave me goosebumps and may actually be the film to encourage people to go after their dream.",
380,26 November 2015,vav-61764,9, It's Not Just a Boxing Movie,"Even with a plot attached to boxing, what makes Rocky stand out is not strictly focus on the fights, but also develop a dramatic side, thereby allowing the characters to be built. Especially the relationship between Rocky and Adrian played by Talia Shire, that gave a more sentimental and emotional tone to the film. Sylvester Stallone as Rocky Balboa is spectacular, a common person, by many considered an underdog, who has received an unique opportunity. By taking it, see the chance of stop being a failure, as he wants to feel relevant and become someone in life. Another interesting idea was putting different views and intentions regarding the fight between the fighters. The story is very inspirational and with a striking soundtrack, left as a legacy, several iconic scenes, such as the training scene where is playing ""Gonna fly now"" and has a beautiful sequence of shots with the city of Philadelphia in the background.",
381,6 March 2021,robertloftusiii,10, Greatest Holiday Movie of All-Time,"I don't care what anybody says, Rocky is a Holiday movie. It has all the elements of a great story. It is the ultimate Underdog American Dream love plot that takes place during the Thanksgiving & Christmas season. My favorite movie all time. Has me in tears every time.",
382,10 September 2021,dreadd-71047,10, Family favorite,"This is the beginning of our family bonding for me. Whenever rocky came on my siblings, grandma and mom would gravitate to the television screen and before you know it we are glued to our seats and eyes stuck on the movie. My grandmother always referred to Sylvester Stallone as rocky even when it was a completely different movie. Eye of the tiger is one of my favorite songs now because of rocky lol.",
383,12 January 2023,mrwankynq,7, I love it,"This movie brought me to a completely different atmosphere... The calm world and the character of Rocky himself was good.... I liked the idea that you can do the impossible and beat those above you if you believe in your dream and strive hard.... I loved the music.. I loved Sylvester Stallone's performance And how did he perform this character with all sincerity and creativity .... The negative that I saw in the movie .. The punches when fighting are very clear that they do not touch his face and it is very clear that they do not hit each other, so this is a negative for the director .... The second negative is that the movie Most of the time it made me feel empty, as if nothing was happening, and in some scenes I wish there was music... Overall the movie is great, and I loved it a lot. My rating for that is 8/10 🔥👑✨🥀",
384,8 April 2022,lcgames-08413,10, My fifth favorite movies of all time,Rocky definitely deserved to get best picture. Sylvester Stallone is my favorite actor and Rocky is the most consistently great movie franchise. Bill Conti does an amazing score on this movie and the rest of the series. The characters are great. It is my fifth favorite movie ever.,
385,12 October 2013,silva-w-pius,8, A true underdog story,"""In comes this big lug who weighed 220lbs, didn't talk well, and acted slightly punch drunk. He said he had an idea for a boxing script and wanted to star in it"" - Rocky Producer Irwin Winkler.",
386,24 July 2007,ilovesouthpark01,10, can't believe is not in in IMDb's top 250.....,"this is one of the most entertaining sports movie ever...first of all, i can't believe that the WHOLE rocky saga..not even 1 of them made it to the top 250 in IMDb..is really disappointing..",
387,21 December 2001,moviemachine,10, Stallone's best!,"Rocky has been one of the best Sylvester Stallone movies I have ever seen. This movie is all about boxing. The ice skating scene is my favorite part in this cool movie. I also like the part when Rocky (Stallone) was talking to Adrian (Shire) while he was walking to his home. In my opinion, Rocky has been one of the excellent excuses of the film overall. **** out of **** stars. 10 out of 10 stars.",
388,10 May 2003,heywood100,8, Better than Raging Bull,"OK, that's not strictly true, but it grabbed your attention. And while Raging Bull is most probably a better piece of film art than Rocky, it's the latter that holds the title in the enjoyment stakes. And although Rocky is essentially one great big cliche, as Appollo Creed says: ""A lot of other people are just as sentimental"". And it's true, we are. And Rocky manages to stay just the right side of sentimental to stay charming rather than mawkish.",
389,16 August 2022,iarunpandey,10, Thankyou sylvester stallone,From this review i just want's to Thankyou sylvester stallone for making this master piece i can never forgot this film.,
390,7 March 2023,davilima-50857,10, All men need to watch this brilliant movie.,"""Rocky"" is a classic movie(1976) which has his main character called Rocky Balboa (Sylvester Stallone) who is a struggling Italian/American boxer, being a down on his luck philadelphia man, he works as a ""second-rate"" loan collecting cash of the loan shark Gazzo(Joe Spinell). Living in a beat-up apartment, as any average tough guy and turning around 30 years, this man is constantly humiliated, especially by his boxing trainer Mickey(Burgess Meredith), who puts Rocky's stuff away from his gym. Rocky is in love with the shy Adrian(Talia Shire), a pet shop worker and sister of Paulie(Burt Young), who is his friend who tries to help them to get together.",
391,3 May 2019,aeowen-03398,10, One of the best...,"..sports movies out there, but it was good enough to rank #3 of my top five in that category.",
392,22 November 2008,tehck,3, The most overrated movie of all time,"I went to see this movie when it came out. I had never heard of Sylvester Stallone and had no expectations or preconceptions other than it was supposed to be a good depiction of boxing. I hated it when I walked out of the theater in 1976, and I hate it even more now. The film is one of sappiest pieces of melodramatic tripe I've ever seen. Every character is a stereotype, and every turn of its derivative, amateurish plot can be anticipated from 50 miles away. Now for the boxing -- a Popeye cartoon has more realistic action. It rivaled the most ludicrous exhibitions staged in professional wrestling matches, and any combatant who endured two minutes of the kind of pummeling depicted in the title fight would be brain dead. My contempt for this trash reached even greater depths when I watched it beat out three outstanding movies -- Network, Taxi Driver, and All the President's Men -- for the best picture Oscar (I've never seen Bound for Glory, but I have no doubt it was also a far better movie than this drivel). I can somewhat understand that a portion of the public would enjoy Rocky, but I can find no excuse for the voting of the Academy members. Shame on them for elevating this sorry excuse for a movie above such worthy contenders. It makes about as much sense as a punch-drunk bar-fighting buffoon landing a title fight with Muhammad Ali.",
393,24 January 2011,meliachild,10, Yo Adrian.,"What can i say about Rocky.....Simply the greatest movie ever committed to celluloid. Writer & star Sylvester Stallones own life mirrored the movie itself so closely that you can feel every emotion & heartbeat as if it were his own & you get the feeling that the movie in essence wrote itself. To me the movie is pure poetry & one of the most beautiful love stories of all time. Filled with outstanding performances by a stellar cast Talia Shire,Burt Young,Carl Weathers & Burgess Meredith are all magnificent. As for Sylvester Stallone himself he produces a performance of such heart & soul it brings a tear to the eye..He is magnificent & in my opinion should have walked away with an academy award for best actor.The gritty urban streets of 1970s Philadelphia offer the perfect backdrop to the characters plights & the now iconic Mighty Micks gym & Rocky steps stand out in the midst of the drama.The music by Bill Conti is a classic score filled with sadness & triumph. The movie has everything....Heart,soul,pain,fear,love & laughter..A masterwork of cinema. Hats off to Sylvester Stallone & thanks for giving us Rocky.",
394,11 February 2014,silverketchup,6, Not that big of a deal,"I hate to be one of those this-film-is-overrated people, but that is really the case for this film. Seeing this film for the first time (2014) I expected a lot more from it. I've heard so much about how amazing this film is and I just don't see it. It is a good film, but not great.",
