Review_Date,Author,Rating,Review_Title,Review,Review_Url
151,26 April 2017,KingBrian1,9, A Powerful Story,"This is Sylvester Stallone's greatest work of art. 70's period piece set in Philadelphia about the strugglers of a down on his luck amateur boxer. One day the Champion of the World Apollo Creed enters his world and gives him an opportunity of his life. Rocky must rise to the occasion, overcome life obstacles fight in the biggest contest in the world against the greatest Boxer of them all. The drab setting of Rocky is somewhat hard to get into at first but as the movie progresses you come to admire Rocky more and more until finally you see him as a cut above the rest with his love Adrian and determination to prove he is a champion. Never quit, never lay down and always aim for the stars is the Rocky story. The fact that it so happens to be a boxing movie and the violent nature of the sport just goes to show how good drama is that people who would normally dislike such a sport can get invested in it.",
152,12 November 2011,StevePulaski,10, By the end it isn't a movie,"""Ya wanna come inside?"" - Rocky. ""No, I gotta go."" - Adrian. ""I gotta go too. I gotta go to the bathroom."" - Rocky.",
153,16 May 2007,DKosty123,8, Solid Film for the Underdog,"This is the original film that launched a series. While the series has hit rocky bottom (pun intended), this film & the second film are the best ones in the series. I prefer this first one as it is the most original.",
154,29 January 2007,disdressed12,9, classic underdog story,"Rocky is by now considered a classic movie,and well it should be.if you like underdog stories,you will love this movie.i won'y go to much into the plot,except to say this is a story of an unknown boxer who hits the big time when he gets the chance the fight the current world champion.Sylvester Stallone wrote the script and starred as rocky.the underdog theme in the movie mirror Stallone's life somewhat,as he was down and out prior to the film.Stallone shot to stardom after Rocky,becoming a household name.anyway,as for the movie itself,the story is well developed and the characters are well written.the dramatic moments are well done as are the action scenes.the movie is very inspiring,but stops short of being maudlin.you really care about Rocky and want him to succeed.more than a movie,Rocky has become a part of pop culture and will likely remain so for a long time to come.a strong 9/10",
155,27 February 2010,Mister_Marklin,10, Rocky - Best boxing movie of all time,"In my opinion, Stallone stars in the greatest boxing movie of all time. Raging Bull, arguably the 2nd, does not even touch it. Stallone is an Italian hack boxer, in the underbelly of Philadelphia's rough boxing scene, fighting over the hill has been's, never-will-be's, and never have been's until his name is almost drawn from a hat, so to speak, by Apollo Creed's (The current world heavy weight champion) management at a time when the boxing world lacks solid contenders and Apollo figures that it will make him more popular with the fans if he gives a nobody a shot, but his manager thinks he might be barking up the wrong tree by picking a south paw that he knows nothing about. Apollo, being a business man, selects Rocky based on his ring name ""The Italian Stallion."" Rocky is in an inner city friend to the Italian Catholic community who stands behind him as he trains on the streets of the bicentennial city, in underground boxing gyms and in a meat locker, where he works for his future brother in law, by punching large slabs of meat into submission, in cold freezers. It's also a story about a simple man, in love with his city, culture, church and a simple girl, Adrien, who is the clerk at a pet shop below his apartment where he shops for turtle food, that he does not need, in order to have conversations with his future wife, who I might add, he never cheats on through 5 Rocky's (Refreshing). It's a blue collar story about the American dream. If you have not seen it, I insist. If you wonder how Sylvestor became a star. Stop wondering. Rent the movie and you will get the answers to your question.",
156,11 March 2008,sddavis63,9, Definitely One Of The Greats,"This is not only one of the best sports movies ever made, it's got to rank as one of the most impressive films ever made. Rocky Balboa must be perhaps the most memorable character Hollywood has ever come up with. Really - is there another character that could compete? Maybe James Bond - except he wasn't a Hollywood creation; he came from novels. The memorable thing about Rocky is that he's everyone - everyone who has ever been down and out, everyone who has ever felt that life didn't give him a fair shot, everyone who has regrets about not having lived their dreams - and who doesn't fit in there somewhere? Rocky Balboa (whom Sylvester Stallone was absolutely born to play) is a bum. There's no other word for it. He's uneducated and crude, he lives in a rundown apartment in a rundown part of Philadelphia, he makes a living by collecting for the local loan shark and sometimes by being a club fighter, and from the opening scenes of the movie - featuring a depiction of one of his club fights - he's a club fighter who's even outclassed by the other club fighters, except that when he gets mad, boy can he punch! And - when he wins, bloodied and bruised, he gets the winner's share, which amounts to all of $40.55, if I remember correctly. But there's another side to Rocky. You see it early in the movie when he returns to his apartment after that club fight and he stares at a picture of himself as a young boy. It's in his eyes - ""What happened to me? What happened to that young boy?"" And you keep seeing it. There's a gentle, even playful side to him. He can't bear to break the thumbs of a guy who owes the loan shark money, he looks out for a young girl who's hanging out with a bad crowd, he picks up a drunk passed out on the cold streets outside a bar and carries him inside to warm up, he likes animals (he has pet turtles and a goldfish) and he plays with the animals at the local pet store. And - most important to the movie - there's a sweet sort of innocence to him as he struggles to come up with the words to ask the equally shy Adrian (Talia Shire) - who works at the pet store - for a date. Rocky is a far more complex character than most people think.",
157,16 December 2004,joliet-jake,10, Great movie,This is a great movie. This is one of those movies i watch every time it is on. I think that Sly was made to play Rocky and the whole movie was done very well. the fight scenes are great the music is great. If you have not seen this movie you should most definitely check this one out. I think that this is probably the best one out of the five that have been made but they are all pretty good. If you want to see a great movie that deals with sports then you should see this one. It is great. I really don't know what else to tell you. It is about an underground boxer who is given a chance to win the heavy weight tile. Burgess Merrideth plays the trainer and does a fantastic job. This movie is strongly recommended. 10 out of 10,
158,13 July 2020,cricketbat,8," A slow, yet inspirational underdog tale","Rocky is a tried & true underdog tale. It's also very slow. I think they could have trimmed 20 minutes off this film and it would have held up better. Nevertheless, it's still an inspiring movie, and features iconic performances by Sylvester Stallone, Talia Shire, Burt Young, Carl Weathers, and Burgess Meredith. Plus, it launched the greatest sports film franchise of all time. Way to go the distance, Rocky!",
159,18 December 2020,djetm,9, ROCKY BALBOA,"It's kind of difficult just reviewing this first film, but I thought that was the best considering this is still the best.",
160,17 May 2020,SAMTHEBESTEST,8, That one Inspiring sports drama which always leave you pumped up..,"Rocky (1976) :
Brief Review -",
161,11 June 2022,imbluzclooby,10, A unique classic that works in every way.,"Without rehashing all the plot details, we already know, the deep personal importance to me is the love story. The love story aspect is what anchors this inspiring movie. Without this, it simply would not nearly have the same impact. Two lovable losers, Rocky and Adrian, meet regularly in an innocent and tender way. She's shy enough to be afraid of her own shadow and he's a gregarious Paluka who talks a lot. When he takes her to his apartment it's about as awkward a date as can be after having a brief outing on an empty Ice rink. Adrian has concealed herself from the world by wearing layers of clothing, spectacles and a Mitten cap which covers her almost completely. As Rocky lowers her guard in his boyish and earnest way, we aren't sure how this will unfold. He asks her softly to take off her glasses. Then her hat. We see her natural and inner beauty blossom before our eyes. The kiss is sincere and feels so real.",
162,18 June 2006,ctrout,10, Passion and Inspiration,"Rocky is the story of a down and out boxer who's actually really good. People don't recognize this, but finally a trainer takes him under his wing. Apollo Creed, the world champion boxer, decides to get an unknown to fight with him in the ring and chooses Rocky. Now Rocky has his chance at the top and he'll work harder than ever to be the champion.",
163,23 November 2015,leosmith-11166,8," ""Yo Adrian ""","Rocky, the best picture winner of 1976, is a film about courage and trying hard to achieve your dreams. In Sylvester Stallones script, a Boxer, who ""running out of steam"", gets a shot to fight the champion, Apollo Creed. Then the fight of the century is on- Apollo Creed VS The Italion Stallion. Rocky trains very hard psychically and mentally for the fight. What makes the movie all the better is the use of Steadicam in the fight scenes. Beautiful Cinematography and an inspiring score make for the greatest boxing film of all time. Sylvester Stallone is brilliant as rocky(maybe his only brilliant performance of his life), and the supporting cast are excellent, and act out their characters truly and superbly. ",
164,17 October 2010,g-bodyl,9, Very Good Sports Drama!,"This has to be one of the better movies of the 1970's. I am not a big fan of movies from that decade unless it's Jaws, Close Encounters, Star Wars, Alien, The Godfather, Grease, now this. This is truly defined as an American classic. This movie also got the great action junkie Sylvester Stallone from a name nobody heard off to a Grade A actor.",
165,10 January 2017,xenazues,9, Back when people had great Original Ideas,"I must say this idea isn't new but its original to filming. I guess I'm a little bias. All new movies involve comic book characters or some cartoon. This was back when star wars, jaws, and the godfather were around. Great movies which seem written by people, not the production company ripping off someone else's idea. Yeah rocky was based on a fight ali had. And its a lot of stereo types clearly all over the place. And yes most of what is in this movie will at the very least get you slapped and probably honestly arrested (loan sharking big no no). ",
166,26 December 2019,mdf-87936,10, Gives me chills to this day,"If anyone out there wants an adrenaline rush, watch Rocky. I was too young to see it when it first came out, but I remember hearing my father tell me that he couldn't sleep that night after he saw it back in 1976. To this day he says that is the only film that had that impact on him. When I finally saw it later, it had the same impact on me. From the inspirational score, to it's climactic ending; this is my ""desert island"" film.
The scene that gets me every time? When the fight is over. The scores are being announced. And Rocky could care less about the results. Instead screaming at the top of his lungs for Adrian. The only person in his life who ever cared about him as a man and not the dumb punching bag he is perceived to be by so many in his life.",
167,17 April 2013,lesleyharris30,9," An Absolute Classic,","Rocky is a brilliant movie with a great story line and a fantastic cast,not to mention a brilliant,Oscar-Nominated performance from Sylvester Stallone,this actor hasn't done many fantastic movies,but this movie is fantastic and its all made so great from his impressive script and truly inspired acting.The movie was a Best Picture winner for 1976 and it completely deserved this Academy Awards,maybe the sequels weren't very necessary,they don't live up to this movie,but there still pretty good.",
168,11 August 2020,briancham1994,9, Inspirational,This is a very uplifting film that really cemented Sylvester Stallone as a star in the public eye. He is perfectly cast here as the downtrodden boxer who ends up punching above his weight (pun intended).,
169,1 August 2020,mikerudakov,10, BEST MOVIE OF ALL TIME.,Absolutely Flawless. BEST SCREENPLAY EVER. FANTASTIC ACTING. SKILLED DIRECTOR. IT's A CLASSIC.,
170,9 July 2022,AvionPrince16,7, The big fight,"Nice movie . I like the performance of Sylvester Stallone and give a lot of more charisma to the character and i enjoyed the man that he represents : a stranger that have a second chance in life by the fight against Creed and the way i see Balboa its a man who give everything for his dreams even if its seems impossible at first but hard work always pay . Balboa is single and lost confidence at first but with a new girlfriend ,new perspective and that opportunity make him pretty interesting to all the world and make him interesting to follow because we know his objective and we can identify ourself with that character and i really enjoyed to follow the movie and that character who fight in his life . Nice movie and nice lessons in life .",
171,23 September 2019,jashezilla,9, Dun da dun da dun dun dun da dun!,"The best underdog, comeback story ever. By the end you'll be crying tears of joy and go out running with a spring in your step and the theme music playing in your ear-buds.",
172,11 April 2009,johnnyboyz,8, Unashamed underdog story about an everyday man destined to get his chance.,"Is Rocky really a 'sports movie'? You might see it that way because it's one of those films that boils down to a showdown – of the sporting variety, in which the man of the hour Rocky Balboa fights high-prize fighter and king of the boxing world Apollo Creed for the right to be the best. But getting there is the joy in Rocky; getting there is not about sports but about life, companionship, living, just generally surviving less than pleasant conditions but most importantly: belief, the belief and eternal optimism that something good might well lurk around the corner. Sure, Rocky boxes but it's a hobby, a hobby that he can't really nail for whatever financial or lack-of-skills reason. But what the film is, is a rising through the ranks of life; a look at an individual whom nobody would usually batter five-seconds worth of an eyelid to, and his rise to a chance at something.",
173,4 May 2006,robb_772,8, The original still packs a mean punch,"I cannot tell you how many people make fun of me for loving this movie. Never mind the fact that it was the top grossing film of 1976, and won a whole slew of industry awards, including the highly coveted Academy Awards for Best Picture and Best Director. Perhaps it is the eventual deterioration of Sylvester Stallone's career (I still sympathize with the mental anguish that anyone who saw 1995's JUDGE DREAD in it's entirety suffered), or maybe it's the endless series of glitzy sequels and imitations that the film inspired (which did become numbing), but, for whatever reason, the reputation of this film seemed to get permanently soiled along the way. This is a shame, because ROCKY remains possibly the best underdog romance ever.",
174,16 February 2020,sauravjoshi85,9, Rise of Sylvester'Rocky Balboa' Stallone,"Rocky is a sports drama movie directed by John G. Avildsen and stars Sylvester Stallone, Talia Shire, Burt Young, Carl Weathers and Burgess Meredith in the leads.",
175,4 June 2020,Pierre-Andre-17,10, A reflection to Stallone.,"The reason why I give high scores to this movie is that it really reflects Stallone's hard-to-achieve success.Rocky in the movie is actually Stallone himself-it's not only because they are all muscular,but also because they are all boxers and always have superman-like perseverance.
This is a praise for Stallone's hard work-he never gave up and finally succeeded.",
176,15 May 2007,Petey-10,10, The fight of Rocky Balboa,"Rocky Balboa is an unknown boxer who lives in his Philadelphia apartment with his two turtles.He gets some extra cash as a debt collector.He visits at the pet store to meet the lovely, but very shy Adrian.Finally he gets her to go out with him and things start to happen.Things start to happen with his boxing career, too when the heavy weight champion Apollo Creed wants to box with him.Rocky starts training hard, he keeps pounding the meat and he runs up the stairs.He gets help from Mickey, an old boxer who's now a trainer.Rocky gets in the ring and...then what happens? John G. Avildsen's Rocky (1976) is an ultimate sport drama.It has got just enough of blood, sweat and tears.It's filled with fantastic characters and just the right actors to portray those characters.The main character is played by Sylvester Stallone (also the writer).He was born to play the part.Talia Shire is perfect as Adrian Pennino.It's really charming to watch the first date of Rocky and Adrian.The great Burt Young is her brother Paulie.Carl Weathers makes a great opponent to Rocky.The late great Burgess Meredith is Mickey Goldmill.The ex-boxer Joe Frazier visits as himself.The relatives of Sly, father Frank Stallone and brother Frank Stallone Jr. appear in the movie.Butkus Stallone is the dog.After this Rocky came back in four sequels and everybody thought that was it.They all thought Rocky was a washed up boxer and therefore finished but Stallone knew it wasn't so.This now 60-year old actor who's had his ups and downs brought ""The Italian Stallion"" back for one more fight last year in the movie Rocky Balboa.Haven't seen it yet but it has been somewhat critically acclaimed.Rocky is a movie that makes you believe in yourself.It's a total self-confidence movie.If Rocky can do it why not I.",
177,16 October 2021,xanderlm,10, Iconic and great movie!!,"What can I say that hasn't already been said about Rocky. Rocky is one of my all time favorite films and that's not just talking about Stallone's filmography. Sylvester Stallone (Rambo Franchise, Cobra) was born for this role, Sly is excellent in this role and portrays the southpaw boxer from an Italian neighborhood in Philadelphia perfectly. Carl Weathers (Predator, Happy Gilmore) is fantastic as Apollo Creed, and I liked that he wasn't a generic bad guy and was just a guy that really loved doing the sport despite being rich and everything. Burgess Meredith (Batman the Movie, GI Joe the Movie) is fantastic as Mickey and pulls off the whole instructor you don't want to piss off character perfectly. Burt Young (Chinatown, Blood Beach) plays Paulie and is great in the role of sore loser. Talia Shire (The Godfather Franchise, Windows) plays Adrian, Rocky's love interest, she was great as well and I liked how she was shy at first but became less shy towards the end. The final showdown is great, no spoilers but it's fantastic. I love Rocky so much and is one of my favorite Stallone films and films in general.",
178,11 July 2022,gianmarcoronconi,8, Beautiful,"First chapter of the saga that launched Stallone into the stratosphere, a really beautiful film that has an enormous atmosphere of sacrifice and that gives the viewer a wonderful feeling of revenge in sport. Very entertaining and enjoyable movie.",
179,26 June 2019,FeastMode,6, my notes,"I was absolutely stunned that I liked this movie, watching it for the first time almost 40 years after it was made. it was very well done for an old movie. great characters, especially Rocky. they made you feel for the guy and root for him to win. he was also ridiculously funny and had me cracking up a bunch of times. lots of old movie qualities but mostly forgivable (2 viewings)",
180,2 June 2020,gavinf-36675,9, Great,This movie shows how being an underdog doesn't mean you can't come on top how rocky keeps fighting back and coming back from being down is the best part of the movie and it shows why they made more Rockies cause it was a great start to these movies,
181,20 August 2019,TheMovieDiorama,8, Rocky delivers a knockout performance with a script more balanced than the southpaw stance.,"The underdog story of all underdog stories. Allowed Stallone to climb more steps to stardom than Philadelphia's Museum of Art. Accumulated enough box office to make it one of the most profitable features of all-time. And, upsettingly, won the Academy Award for best picture back in '76, punching the likes of 'Network' and 'Taxi Driver' out of the ring. It was the start of the quintessential American dream, the sporting franchise to dominate the boxing sub-genre. And it all started with this. A drama so personable, with a surprisingly minimal amount of actual boxing, that it cemented itself as a timeless classic. Rocky Balboa, a good-natured working class boxer who trains/fights in small gyms, is offered a chance at the world heavyweight championship against current champion Apollo Creed.",
182,28 February 2012,gwnightscream,9," Inspirational, One Of Stallone's Best!","Sylvester Stallone, Talia Shire, Carl Weathers, Burt Young and Burgess Meredith star in John Avildsen's 1976 drama. This is the story of Rocky Balboa (Stallone), an underdog fighter from Philadelphia with heart nicknamed, ""The Italian Stallion"" who is given an opportunity to go the distance with heavyweight champion, Apollo Creed (Weathers). Rocky also finds love with pet shop worker, Adrian Penina (Shire) who is the sister of his best friend, Paulie (Young) and the late, Meredith plays ex-boxer & trainer, Mickey Goldmill who trains Rocky. This is an inspirational film that's definitely one of Stallone's best, he & the cast are great and who can forget Bill Conti's classic score. I highly recommend this.",
183,25 January 2020,marmar-69780,8, rocky,"Rocky is one of most inspiring movie ever made,story of amateur boxer who gets a chance to fight a champion for a title is one of most heartfelt stories that were written and put on screen,this film is perhaps the best role stallone was ever in and maybe his best performance ever,the good thing about this film is that it doesnt focus on boxing match until last 10 minutes to some people that can be dissapointing but for it was great to see more personal story of rocky life and his rise to fame,rocky is the best film of this franchise but that doesnt mean i dont like other films i enjoyed them but this one had the most heart in it",
184,11 November 2008,Anonymous_Maxine,10, The Forrest Gump of the 1970s.,"In watching Rocky I'm reminded that every once in a while a movie comes along that just seems to fit together so perfectly that it seems perfectly natural that someone had to have made exactly that movie at some point. Other times I am pleasantly surprised at how good a movie is, or irritated at how bad, or just amazed that someone would think to make something so bizarre or cheesy. But with Rocky, everything is exactly what it should be, the movie knows exactly where it belongs and exactly what it wants to say, and so it comes across as a perfectly natural piece of storytelling. ",
185,23 December 2017,Vartiainen,9, The underdog story,"A breakthrough in Sylvester Stallone's career and still a role he's most known for, after all these years. A tale of a Philadelphia man down on his luck. He's doing odd jobs, mostly collecting money, trying to get a girlfriend. In his spare time he boxes, but even that is going only so so. Until the heavyweight champion of the world, Apollo Creed (Carl Weathers), offers him a shot at the title, as something of a curiosity event.",
