Review_Date,Author,Rating,Review_Title,Review,Review_Url
32,29 January 2004,Andreas-S,10, One of the best movies ever made,"One of the best Chaplin movies, which means one of the best movies ever made. Good structure and a lot of  excellent classic scenes such as `Eating the shoe' and `The Roll Dance'. Both the original version and the second release have their own charm.",
33,16 May 2005,sveknu,5, An 80 (!) year old movie,"Personally, I don't think that this movie is as good as most people (and the IMDb-ranking) says that it is. Don't misunderstand me, I enjoyed the movie. But it wasn't as interesting as ""The Kid"" (one of Chaplins other movies), for example. I think this movie is a bit too long. It's a mute movie, after all. I'm really glad that I watched the newer version, where all the text boards were removed and replaced with a narrator. Fortunately, this made the movie a bit shorter. The movie consists of two almost separated plots who are tied together at the end of the movie. Both plots are somewhat interesting, but personally I liked the ""wilderness/cabin/gold digger-plot"" (the first part of the movie) much better. The ending is fortunately quite good in this movie.",
34,17 May 2023,jordondave-28085,9, Influential and groundbreaking,"(1925) The Gold Rush
COMEDY",
35,3 October 2007,icet2004,8, Legendary Film,"Charles Spencer Chaplin AKA Charlie Chaplin was the most popular silent movie actor.this movie is strange,but still a timeless classic what even nowadays can't beat.the movie story Alaska 1898 a lot of people looking for a pure gold and it's not easy. without a doubt one of the greatest comedy what ever made on planet earth.funny.and of course characters are very interesting. carving up a boot scene is very famous maybe the most famous scene in silent movie history.some scenes are maybe not in nowadays realistic,but it's still very funny.my opinion the greatest silent movie is Napoleon(1927)and Metropolis(1927)and third is definitely Gold Rush i recommend it to watch it.",
36,11 August 2005,cohen-phil,10, Chaplin's delightful bonhomie & innocence,"We follow ""the little fellow"" (Chaplin), in his trip to Alaska to find gold - which he ends up succeeding in, finding love at the same time. The first half of the movie reunites Chaplin, another lonesome gold seeker, and a moral-less scoundrel in a shelter, under a particularly horrendous snowstorm. There happens one of the most memorable scene of the movie: Big Jim's delusion that Chaplin's is a giant (of course bearing Chaplin's manners) chicken, and his desperate attempts to eat him; but Chaplin is saved by a bear showing up which they finally eat. Then, parting their ways, begins the second half of the movie: the one-sided romance with the beautiful Georgia, met in a dance hall. How funny was the scene when she invited out of despair our little fellow to dance to avoid dancing with an invading Jake! How genius showed Chaplin to use Tchaykovsky's...Beauy & the Beast's waltz! Bringing to tear and laughters at the same time. As Georgia plays nastily and mocks and fools Chaplin, with her friends, and secretly discovers his love, her heart swings. But Chaplin is taken away by his former colleague, Big Jim, to ""become millionaires"" (i.e. find gold). And they find it! All ends well as the little fellow & big Jim, now millionaires, leave on a ship. While dressed poorly as in his earlier gold seeker day for a photography, he falls upon Georgia, who indisputably is happy to be with him, and even more happy to find him multimillionaires, as she hears from the ship crew. The moral? Women love damned $$$...",
37,16 March 2020,filipemanuelneto,10," The most striking film in silent cinema, for me.","This film is, for me, the most striking of the silent film era, for all reasons. Her story is deeply touching and tells of a love story between a vagabond (the famous Charlô, as he is called in Portugal) and a young woman, in the context of the Alaskan gold rush.",
38,9 September 2010,secondtake,9," Terrifically funny and original, even now. A small wonder.",The Gold Rush (1925),
39,15 September 2017,sol-,7, Cabin Fever,"Improperly prepared for Klondike's harsh weather conditions, a lone gold prospector has to share a cabin with another prospector, whose hunger often drives him insane, in this Charles Chaplin silent comedy. Proclaimed by Chaplin as the film by which he most wanted to be remembered, 'The Gold Rush' has gone onto much acclaim, but those expecting the charm of 'City Lights' and imaginative sets and situations of 'Modern Times' may be disappointed. To be fair, 'The Gold Rush' starts off quite well with lots of humorous situations at the outskirts cabin, including imagined chickens, persons blown in and out of doorways and a hilarious sequence in which Chaplin keeps trying to dodge a gun barrel during a fight, only to find the gun pointed in his face wherever he goes. Around a third of the way in though, Chaplin leaves the cabin and what follows is far less innovative as he becomes the subject of tricks and falls in love upon returning to town. There are some funny town sequences for sure (dancing with a dog leash) and there is a great bit involving a tilting cabin near the end, but the final two thirds of the film never recapture the magic of the first third. With so many jokes and ideas that have since been imitated (bread roll forks), this is an undeniably iconic comedy, but those keen on seeing Chaplin at his finest may wish to look elsewhere.",
40,5 February 2020,marmar-69780,9, the gold rush,"It is a shame how before even in early days of cinema comedys were far funnier then todays,and the gold rush is defienetly one of most famous and funniest ones,lets just say something chaplin was a brilliant mind behind camera i mean how many people can direct,write,star and compose for their films todays that is impossible to do,but chaplin was one of a kind and one most influental masters of his work,even if this film is silent and black and white it is still relavent today and it hasnt aged a bit,jokes are funny and use of comedic situations is in a right timing,the gold rush is one of earliest masterpieces of cinema made by one of greatest charlie chaplin",
41,9 August 2020,robfollower,9, The Gold Rush(1925),"D: Charlie Chaplin. Charlie Chaplin, Georgia Hale, Mack Swain, Tom Murray. Immortal Chaplin classic, pitting Little Tramp against Yukon, affections of dance-hall girl, whims of a burly prospector. Dance of the rolls, eating leather shoe, cabin tottering over cliff--all highlights of wonderful, timeless comedy. Chaplin reedited film in 1942; that version, with his narration and music, runs 72m.",
42,24 July 2006,Cyke,10, Movie Odyssey Review #013: The Gold Rush,"013: The Gold Rush (1925) - released 6/16/1925, viewed 8/4/05.",
43,16 December 2019,zutterjp48,10," Genial, touching and funny.","All the genius of Charles Chaplin !! The Gold Rush is a brilliant mute comedy about this moment of the history of the United States !! All the adventurers became crazy for gold.And then Charles Chaplin made this touching and funny comedy.I remember very well the dance of the breads, the cooking of the shoes, the illusion of chicken , the cabin going up and down and also the romantic part of the film.
Absolutely genial and entertaining.",
44,24 April 2014,estebangonzalez10,8, It has some of Chaplin's most memorable scenes,"""We must get food. One of us must brave that storm.""",
45,7 September 2010,Steffi_P,10," ""A Mountain of Gold""","Sandwiched in between the failure of his non-comedy A Woman of Paris and his final days as a silent star in which he was up against the coming of sound, Charlie Chaplin made his most stupendous and expensive film to date, aptly named The Gold Rush. It became the work of which he was most proud, and the one he wanted to be best remembered for in years to come.",
46,29 August 2014,Seraphion,6, Nice fuse of decent comedy and elaborate story under 90 minutes,"Like all Chaplin movies, the earlier work has the significant distinction of having many studio-shot scenes with contrasting details. A feat that's quite elaborate and full of effort for the time. Like all Cjaplin movies, The Gold Rush depicts his signature character The Tramp, although here he was named the Lone Prospector. I like how the movie depicts the poor man rising up to betterment of his life, an image that many can relate at the time. Chaplin's story telling also comes out as he did all the narratives himself in this movie. The other cast did quite okay here. Georgia Hall nicely complete the angles for this movie.",
47,31 January 2021,jewelch,9, Amazingly good and funny yet with a good love story.,"With some great theatrical, yet genuine performances, outstanding humor, and some outstanding editing, The Gold Rush manages to be one of the best films of Chaplin's career. Like all of his films, The Gold Rush is a great representation of both the harsh realities of life and the hope that comes along with that. It's a beautiful movie, and one that still stands the test of time almost a hundred years later. Yes I recommend It James Welch Henderson, Arkansas 1/31/2021",
48,24 July 2020,gab-14712,9, Charlie Chaplin At His Best!,"When Charlie Chaplin's The Gold Rush was initially released in 1925, the director exclaimed, ""This is the film I want to be remembered for!"" Well Mr. Chaplin, we definitely remember you for this film. Even though he made many excellent films after this film's release, pundits consider this his greatest achievement. I was enamored with the film myself. For a silent film, it had a character-driven narrative and did not solely rely upon Chaplin's familiar humor, which remains excellent as always.",
49,13 October 2008,CitizenCaine,9, Chaplin Does An About Face In The Gold Rush,"After his box office failure with A Woman Of Paris, Chaplin edited, wrote, produced, and directed The Gold Rush, which spent almost a year and a half in production. Chaplin did an about face from his previous film with The Gold Rush, realizing the public would not accept serious drama with his name attached to it. Instead, he returned to the little tramp character and his tried and true formula of an everyman at odds with the world around him. Although, in this film he seamlessly combines comedy and drama, as he did in The Kid. It was his first film with a prepared script before shooting began. As with The Kid, it was also another film beset with personal turmoil. Lita Grey, who eventually became Chaplin's second wife, became pregnant after being selected as the female lead in the film. As a result, Georgia Hale, Grey's friend at the time, was selected instead. Filming was delayed considerably, but the film was finally released in the summer of 1925 to instant fanfare. ",
50,8 September 1999,Jared G.,7, Good but not great,"First of all, I fall into the Buster Keaton camp when it comes to silent comedy.  I'll take Keaton's stone face over Chaplin's sentimentality anyday. But this still is a very good film that anyone interested in film history ought to see. The boot eating scene and the potato dance are classic scenes.",
51,4 June 2021,PCC0921,9," The California Gold Rush began on January 24th, 1848","It's all about the pioneers. Charlie Chaplin had already been a seasoned veteran by the time he got to this film and it was only 1925. Motion Pictures were only 30 years old by this point in time. His body of work had already filled up a decade before this (and that isn't including any theater work he did before the films) and he was well on his way as being a film pioneer, visionary and an icon.",
52,11 October 2006,jluis1984,10, Chaplin reaches perfection,"In the early years of cinema, actor and director Charlie Chaplin rose up to become one of the most important artists of his time, however, his attempt to make a serious drama in ""A Woman in Paris"" lead to his first major failure. But two years after that, Chaplin was still at the top of his game, and he decided to go back to what he liked the most and delivered a movie that would take his trademark style of pantomime to a new level. A film that would not only surpass the critical and commercial success he had with the Little Tramp's previous feature film, ""The Kid"", but would also become one of the most important silent films in history, and the highest grossing silent comedy film: ""The Gold Rush"".",
53,22 January 2008,SmileysWorld,9, Most enjoyable in it's original silent form.,"There are two different versions of this film.I was unaware when I rented the DVD that this was true,and the first of the two versions I viewed was the edited for sound 1942 rerelease.This has none other than Chaplin himself narrating the film.While I found the film to be good,I found myself being slightly annoyed and distracted by Chaplin's chatter,though I am sure he had the best of intentions.After viewing this,I decided to rent the bonus disc which included the original totally silent release from 1925.Though it is a restored version (the piano soundtrack is brand new),I found myself able to enjoy it a lot better.Charlie Chaplin was a genius as a film maker and performer,and it shows here.The Gold Rush is typical Chaplin with its combination of humor and romance,and it even has an edge of the seat thrill toward the end that will rival anything you see today.It's a great film,but when you see it,see it in its original and best silent form.",
54,11 September 2003,AlanSmithee0,10, Chaplin's Complete Comedy Classic!,"This little film is a great display of the true comedic genius of Charlie Chaplin and his ""Little Tramp"" character. The film isn't powerfully dramatic but still stands the test of the time in terms of comedy. Chaplin's elaborate and well-prepared sight gags really show how his style differed from the frantic & wild pace of Max Sennatt's silent films. Plus his ""Tramp"" character is a very sympathetic and human character as you do feel his emotions as he tries to win Georgia's heart. Overall Chaplin did a fantastic job on this classic and it deserves recognition as one of the best comedies of all-time. Without a doubt, a solid 10/10!",
55,26 May 2020,mahmus,10, One of Chaplin's greatests,"While I still mantain that City Lights is my favorite Charlie Chaplin movie, The Gold Rush is a close second.",
56,26 October 2010,rmax304823,9, Splendid Comedy,"Chaplin joins the gold rush over the Chilkoot Pass to Dawson, spends some time with a couple of rough-hewn miners, undergoes dangers of monumental proportions, falls for a dance hall girl and vice versa, becomes rich, rediscovers the girl on the ship home, and all ends happily.",
57,9 September 2010,faithnomore41291,3, Silent Films: Silently passing by.,"This is the first silent film I have ever seen, so I really was not use to having absolutely no sound (other than the piano in the background) in a 90 minute movie. So it was neat to see the actors using over exaggerated expressions to get their feelings/ideas across.",
58,25 May 2020,zzhhhqing,10, A storytelling genius,"How lonely can a person design such a moving plot? Chaplin's eyes are so beautiful, one is this one, and the other is the light of the city. When he stares at you with a slightly sad and sincere look, no girl will be melted by him? In the New Year, we are very touched by the long chorus of friendship, and everyone is singing the trapeze on the bus in the night. I especially like this kind of bridge.",
59,16 February 2009,PudgyPandaMan,9, My college class MADE me watch this movie...,"I was taking a History of Film class as an EASY elective. I was not excited when this silent film was slated on our itinerary. I thought, ""Boy, I'll sleep through this one."" But BOY WAS I WRONG.",
60,16 December 1998,SMK-4,7," Aged, but with some great moments","Chaplin was a great director in his time but many of his films have aged badly, simply because his sentimentality has completely gone out of fashion which puts a modern audience in a rather uneasy relationship to the Tramp character.  This problem also applies to this film which for a long time was regarded as one of the very best ever made.   It probably is no more.",
61,14 April 2020,zeekwunlau,8, Wealth and wisdom,"Regarding Chaplin, future generations should have many fabricated stories, not just true Chaplin events. The story is nothing more than to highlight the wisdom, humor and hard work of the film master, at least a successful role.
""The Gold Rush"" at first started to think that Chaplin's character is very dumb and unlucky, and also has an unusual comedy humorous irony effect. I had to keep searching and fighting with each other, but also to fight against the bad weather and snow mountains at any time. Being accidentally besieged in the snow mountain hut, and competing with the big bear for food, the plot of one door in one door was arranged by Chaplin very interesting. When there was no food to eat, Chaplin began to think of leather shoes, eating leather shoe laces as noodles, untiring leather shoes and nailing them to eat noodle cakes, eating with relish. Finally, the snow stopped, Chaplin came down the mountain to find food, but found the girl who was happy, but had no money, and had to eat some food to continue to go up the mountain to make gold, and had such a sweet dream. It happened to meet the kind owner, who had sufficient supplies, and went far away to trust him to keep his butler, and just saw the girl who came down the mountain. Chaplin even had the illusion of love, no matter whether the girls were just jokes, at Christmas On the night of the festival, a simple but generous dinner is arranged. Simple is for girls, and rich is for gold prospectors. So there is a classic scene, Chaplin hasn't waited for the beloved, he is looking for fun to pass the boredom. He used two forks to fork a piece of bread, such as human legs and feet, jumping a kind of interesting The dance seemed so vivid, as if there were dancers who went on stage after rehearsing. Unfortunately, the girl didn't come until the night, and even more unfortunately, the avalanche on the mountain and the competition in the house. Fortunately, it was not Chaplin who fell with the crumbling house on the cliff. His life was saved, and his wealth also gained. The fame and women who came with wealth were so common to him as if he never got it.",
62,24 May 2018,MJB784,9, Comedy gold,"This is my choice for the best silent comedy! It is surprising that Chaplin would re-edit this in the 40s with voice over narration and removal or the intertitles and terrific ending. I keep alternating on my favorite Chaplin since Modern Times and City Lights are classics, too, but this seems like a win-win since it's stylistically groundbreaking, hilarious and with heart. The other two have that as well, but the jokes here are more relevant to the story and it ends with everything going Chaplin's way with friendship, romance and, of course, gold.",
63,17 June 1999,Mr_Ram,9, Our (cinematic) World needs more Chaplins.,"The Tramp truly was, and still is, everyman.  Simpleness is key.  Georgia barely touches the true essence of Chaplin when she says, ""He's wonderful!"" The brilliance lies within his ability to create cartoonish and surreal atmospheres, and imbue them with precise human nature and emotion.  The ending was a bit 'ehh', however thoughts may change as a second viewing -- the 1945 re-issue (with Chaplin narration and score) -- is forthcoming. Our (cinematic) World needs more Chaplins, and  reality needs imagination to inspire greatness.",
64,8 July 2011,ElMaruecan82,10, When gold is easier to find in the mountains than in hearts ...,"""The Gold Rush"" is the quintessential Chaplin film in many aspects. It depicts the tragedy of isolation in the middle of a hostile and selfish environment while providing some of the most sumptuous comedic moments you'll ever see in a film. It's the perfect marriage between slapstick, and social commentary under a nuptial humanism. And one other thing, the movie gets better after each viewing. ",
65,29 June 2020,ssssgelojun,10, the gold rush,"Every movement and every expression of Chaplin, the master of mime, is flawless.",
66,20 February 2021,ga_cum197,10, Definitely one of the best movies I have ever seen in my life.,"Why something simple like this movie can make us feel so much?! I mean nowadays, movies are oversaturated with big budgets, visual effects, advertising campaigns but more than 50% of them can really deliver.
Charlie Chaplin's films are indeed true cinema. Given it was made in 1925, it's perfect to me. I have nothing to criticize or analyze it. Sometimes, we just forget what a film is supposed to be. It's supposed to make us feel, to make us acknowledge that it's a film, and to age well
There are some so called movies that I never consider them movies: Transformers 2,3,4,5. Twilight 2,3,4. Justice League....and so on.
Those just make me appreciate the classics even more.",
67,22 February 2021,leoshamaroc,10, Couldn't stop smiling.,"Beleive me friend simply beleive, no matter what hard times youre going through The little fellow would kindly bring that delighful smile into your heart once again, I was laughing and smiling through the whole of it, i dont even want to say what a genius Charlie Chaplin was, because after this movie any kind of doubts about that would simply disappear. Do yourself a favor, a little gift i would say, get the criterion disk and you won't be disappointed.",
68,16 October 2005,lasanya2004,10, Hilariously Captivating Gold Rush Comedy,"Charlie Chaplin's The Gold Rush is one of his best loved films. The Gold Rush, directed by and starring Chaplin, is a wonderfully captivating historical comedy about a lone gold rush prospector. The story is set in the Colorado Rockies during the Gold Rush. It was originally made without music or dialog during the silent film era, in 1925. It was an instant hit and became a success all over the world. In 1942, Chaplin had the idea remake the movie with sound and narration and to release the new version to a public that was now used to films with soundtracks. The release of the new Gold Rush followed the box office flop of his previous film, The Great Dictator, and Chaplin desperately needed something to pick up his career. The Gold Rush was just what he needed and has remained a much-loved classic to this day. The film is both touching and funny at the same time. Chaplin's character is quirky and sympathetic.",
69,21 June 2020,Ahmad_pilehvar,8, A lovely movie,Of course this movie was on of the best movies of Mr Chaplin. he was a great actor and in this movie he show's us who pure love and believing on that could change your life. and the life have a lot of up and down all you do is never give up and always try to make life better for yourself. thanks to Mr Chaplin it was one of most beautiful 70minues of my life and I enjoyed to spend my time to watch this masterpiece.,
70,6 May 2023,jlspenc-84630,10, Worth its weight in gold.,"Of 1925's THE GOLD RUSH, Charlie Chaplin said this was the one movie he always wanted to be remembered by. Chaplin was my father's idol as a boy, and when I was ten during the summer of 1975, the Canadian Broadcasting Corporation began airing Chaplin's classic features on Sunday nights. As we sat in front of the television, my dad introduced me to the Little Tramp, beginning with THE GOLD RUSH, followed by CITY LIGHTS, MODERN TIMES, THE GREAT DICTATOR, and MONSIEUR VERDOUX.",
71,9 March 2009,Captain_Couth,10, The Cinema of Charles Chaplin: The Gold Rush,"The Gold Rush (1925) was a big undertaking for Charles Chaplin. A lot of his time and effort went into the production of this film. During pre-production, he tried to shoot in the Yukon but that proved to be not a sound idea. So he shot the opening scenes in Truckee, California using some local vagabonds as extras. Charlie Chaplin stars as a prospector who tries his luck looking for gold in the Great North. What he discovers is a lot of other things and a little something about the human condition.",
72,19 February 2016,roystephen-81252,10," One of the greatest movies ever made - nearly 100 years old, but it has lost none of its potency",This movie will always have a special place in my heart. This was the first 'long' feature film made by Charlie Chaplin that I saw and the first time I got to see his familiar gags (like the Tramp eating his shoe or 'the dance of the rolls') in context. It surpassed all my expectations and left me speechless.,
73,16 June 2001,anton-6,10, what more can you say then: A MASTERPIECE!!!!!,The tramp ventures into Alaska looking for gold. He gets mixed up with some burly characters and falls in love with the beautiful Georgia. He tries to win her heart with his singular charm.............,
74,2 March 2021,calyeager,8, Were people in the 1920's funnier than in the 2020's?,"Were people in the 1920's funnier than in the 2020's? Nearly 100 years later, The Gold Rush reminds the audience that ideas inspiring levity and tomfoolery have been always been around. This was my first Chaplin film but it's easy to see why The Gold Rush is still regarded a classic. The Criterion Collection version is easy to watch with super solid camerawork, great audio quality, and nicely balanced lighting. This film is exemplary as a silent film, not wasting time on reading for audiences unless it's absolutely necessary but still telling a whole story. I give The Gold Rush an 8/10.",
