Review_Date,Author,Rating,Review_Title,Review,Review_Url
153,8 May 2020,krational66,7, The best in the wandering series.,"""Gold Rush"" is a sign that Chaplin's ""Vagrant Series"" comedy film has matured and reached its peak. The film embodies all the advantages of this series of films:
1. Successfully shaped the image of Charlotte, a small person with a distinctive personality. Although this character is not handsome, he has the kindness of being kind, helping others, loving and holding unequal and valuable qualities. The shaping of this character has also been quite successful in the history of the film. of
2. Created a screen comedy style of ""tears of laughter"". Many wonderful passages in the film, such as ""Little Bread Dance"", ""Duck Down Flower Dance"", ""Cooking Leather Boots"", ""Cliff Chalet"", etc., are ridiculous. stand up.
3. The film has mobilized almost all comedy wisdom to express the three themes of the film: labor hardship, hunger, and greed. The film combines comedy and tragedy, and becomes the best representative of J ""tramp"" image.
4. Was awarded the first place in the ten best films in the United States that year",
154,30 August 2021,Filmdokter,6," Funny and charming, but not Chaplin's best film","The Gold Rush is a well made film. It is a typical Chaplin film: funny with a heart of gold. The Oceana Roll dance and the final 'cliffhanger' scene are memorable and classic Chaplin silent comedy. But apart from those scenes, The Gold Rush as a film is a bit too much a combination of individual scenes / sketches and therefor misses some overall strong narrative that you do see in for instance The Kid.",
155,27 December 2014,JaydoDre,7, Solid funny Chaplin film,Gold Rush is a breed between a silent movie and a talkie. Characters are not talking but there is a narrator talking instead of there being title cards.,
156,29 January 2013,kurosawakira,8, Boisterousness,"For me, Chaplin's ""City Lights"" (1931) has been the quintessential work by the great man, yet lately I've been inclined to revisit his early works. As such, ""City Lights"" serves as a kind of watershed. His prior work basks in certain boisterousness and hyper-energy that his later work, whilst impeccably refined, does not exhibit to the same degree. Perhaps there is a sense of self- consciousness that many later works display. Perhaps these early works, now that I'm revisiting them so consciously in retrospect, contain more of Chaplin's exuberance. Or then it's just me projecting, aggressively.",
157,14 August 2017,arturmachado-29588,7, One of the best films by Charles Chaplin and of the silent movie era,"One of the best films by Charles Chaplin and of the silent movie era about a man in the late 19th century who goes to Alaska in the gold rush. The story is, as always on Chaplin's part, very beautiful and touching, conveying a positive message and strong moral values. This movie contains some of the most iconic scenes of silent movies. The only snag I have with this movie is its sudden end about Chaplin's love interest for Georgia, and Georgia has not convinced me. The impression she gave me was that she did not love him but rather felt sorry for him, which at least is already a step in becoming more human, and when finding that he became millionaire she seemed only more relieved (financially) than properly happy - unless both money and happiness are the same to her. And this is the only reason why I cannot score this movie more than 7/10.",
158,5 May 2023,freethinkingworld,6, After Thoughts,"Nice Chaplin Film, not his best but good enough if your a fan of his. If your not a fan of Chaplin, you don't have to go out of your way to see it. It's on the lines of a Looney Tunes Bugs Bunny skit. The tramp is lovable as ever, and the overall stunts and gags were great for 1925 and can even bring a chuckle to the modern audience. But I think it lacks the heart that some of his later films had. The romance is sweet and lovable, and it's pretty interesting because they actually had a ""bad guy"" type character at a few times in the movie. But overall it's a little forgettable compared to his other works.",
159,27 April 2000,andreslo2000,9, Did you know shoes taste delicious?,"One of the unforgettable film by great genius Charles Chaplin. His situation comedy is unique and I think nobody can ever reach him. Just think about scene where he was eating his own shoes. Shoe nail-delicious bone full of meat, shoe laces-tasteful Italian spaghetti, and the bottom-wonderful rare baked steak. But that's not enough for Charley. He's not satisfied with ""his stomach full"". He needs to dance a folk dance with forks and bread. Even this film would contain only this scene it would be more than enough to remember it together with ""our Charlotte"".",
160,28 May 2012,Koundinya,10, The tramp rambles on.,"The tramp sets out to Alaska in search of gold. He gets lost in a storm and takes shelter in a deserted house, which already has an occupant Black Larsen, who is wanted by the police. Another deserter, Big Jim joins them. They starve for many days without anything to eat. The tramp satisfies his raging tummy with a piece of candle. They cut cards to decide who will have to venture the storm and find food for the other two. Black Larsen leaves the men to their destiny. The famished men feast on the tramp's shoe. The men resume their journeys once the storm has abated. The tramp goes to a town seeking a job and a living. He falls for a woman but she doesn't love him. He vouches her that he'll make a good fortune and then marry her. He and Big Jim find the place where Jim struck gold and they become millionaires.",
161,30 June 2006,Incalculacable,9, Not to be missed,"This 1925 Chaplin film is probably the one I enjoyed most. I don't know what it was about this film, but I was laughing out loud constantly throughout it. Sure, it doesn't have the strong romance of City Lights (1931), but it is as funny  perhaps funnier. But when it comes to any film, it is all up to personal preference. Yep, now I think about it, this is my favourite Chaplin movie.",
162,2 January 2023,jlspenc-35519,10, Worth its weight in gold.,"Of 1925's THE GOLD RUSH, Charlie Chaplin said this was the one movie he always wanted to be remembered by. He was an idol of my father when he was a boy, and when I was ten during the summer of 1975, the Canadian Broadcasting Corporation began airing Chaplin's silents on Sunday nights. As we sat in front of the television, Dad introduced me to the Little Tramp, beginning with THE GOLD RUSH, followed by CITY LIGHTS, MODERN TIMES, THE GREAT DICTATOR, and MONSIEUR VERDOUX.",
163,8 July 2016,the-fearless-america,10," Yeah ! Another Chaplins, Another Masterpiece !","The gold rush, an early work from Chaplin after ""The Kid"". This one, integrally one of the most humorous and lightest. A story of a tramp's adventure to a mountain. He meet so many things in the trenches, bear, hunter, and of course a romance, which Chaplins best at. In this masterpiece, which Chaplin prevalent made, consist one of the best performance by the exalted Chaplin. A performance at the dinner, yeah guys, these dancing bread !! Nowadays, you can't call it as acting, we call it as pure talent.",
164,19 October 2018,whatever-32088,10, Ever been so hungry you can eat a shoe?,"Chaplin takes his audience on an adventure to the great gold rush. Imaginative, and brilliant classic comedy suitable for any age. Chaplin's ""prospector"" character takes his luck to the mines and (of course) coming up with some bad luck, gets himself stuck with Big Jim who eventually tries to eat him, then to him falling for a beautiful girl who mocks him. A great story through and through.",
165,1 January 2023,elect_michael,8, Masterpiece,"8.0 of 10 stars. Most respected Film Historians would say that Charlie Chaplin Directed 15-20 masterpieces during his career, and this would certainly include 'The Gold Rush' from 1925. No argument here, this is a truly great piece of filmed cinema, a masterpiece. His 15-20 masterpieces are about an even mix of full length feature films and short length films, probably 9-10 of each.",
166,19 September 2020,liammitchellHVCC,10, A True Triumph of Early Cinema,"This 1925 version, although cut together, displays the absolute genius that was the young Charlie Chaplin. It is a perfect display of everything that makes silent film incredible; intense action interspersed with hilarious comedy, vivid story telling through action alone, and an incredible early understanding of lighting, framing, and stage arrangement. I highly recommend this film for anyone that's looking to get started watching some old silent classics.",
167,14 January 2015,JosephPezzuto,8, Reel Look: 'The Gold Rush',"""But I'll dance the Oceana Roll!"" In Chaplin's 1925 silent comedy classic 'The Gold Rush', the Lone Prospector (Charlie Chaplin) is faced with a whole slew of hardships and challenges, such as biting, blistering winds, near starvation and leaping out of a cabin right before it plummets off of a cliff! And all for the sake of seeking fame and fortune, respectively. To upset matters worse, his ill-gotten attire market him as the mockery for the buffoonery of his comrades and the ruthless rigors of the frigid trek northward. However, real prospectors of the late nineteenth century as part of the Klondike Gold rush faced somewhat similar predicaments. Some came from many walks of life, some as far as the United Kingdom, South Africa and Australia. Most were perfectly aware that the chances of finding significant amounts of gold were very slim and just went along for the adventure, despite what hardships they might face, even through if it meant trenching up the discouraging but enduring Chilkoot Pass in the hopes of gaining their own individual fortunes. Prospectors had to build rafts and boats that would take them the final five-hundred plus miles down the Yukon to Dawson City, near the gold fields. Also, they had to carry a year's supply of goods over the passes to be allowed to enter Canada. About a ton, more than half of it, was food. Regarding history, I believe that some of it matches what 'The Gold Rush' portrays in the film. During the picture in the beginning, many men were carrying goods on their backs or pulling them on sleds, just like during the real Klondike expedition. However, do the prospectors that endure the frigid winds and blinding snow in a vain search for valuable, shiny nuggets depict the accuracy of what occurred in real life back then? Let's take a look.",
168,8 January 2021,nukisepp,8, Comedy Gold Rush,"'The Gold Rush' might not hold that much of an emotional punch like some other better Chaplin's movies but it is innovativeness, fast-paced story and action make it a captivating movie. The opening shot where the miners head up Chilkoot Pass, composing a trail similar to ants. That was a nice metaphor for how pathetic humans are when left at the mercy of mother nature.",
169,21 May 2013,paulsrobinson,8, Charlie Chaplin is a legend,"The Gold rush is the second Charlie Chaplin film I've watched recently the other being Modern Time, and both have blown me away. I remember watching scenes of Chaplin as a child but i never watch any from beginning to end as i can remember.",
170,17 October 2020,lordmaserati,10, MY FAVORITE FILM OF ALL TIME,"Honestly, I have tradition where I watch this film once ever three months, and on New Years Eve; just like in the movie. Making you think this was Shakespearean adaption, you'd be wrong.",
171,16 September 2010,m-bailey8,9, the gold rush,"The 1925 movie ""The Gold Rush"" is a very good movie for its time. Even though this is a silent movie, it still told a very funny comedy. Though there were no words, it was still funny through Chaplin's facial expressions and various scenes that didn't need words. For example, when Chaplin thought he hit the bad guy, but actually hit the beam instead. Also, when Chaplin thought he was tying his belt on he actually tied a dog on a leash and was leading the dog around.",
172,14 September 2010,n-racicot,7, a man on a mission,Gold Rush was my first silent film. i never thought i would have enjoyed having to read to know what was going on in a movie. The Gold Rush was a box office hit currently still being the 5th highest grossing silent film in cinema history. Certain points in the plot of the film confused me but the general idea was visible. The movie is about a man on a pursuit for wealth. He ends up discovering more than he was searching for after making a few friends along the way. Charlie Chaplin plays a very comical character that makes the movie easy to/fun to watch. the movie covers all of the human emotions and feelings. The intertwining paths of the characters sets the change of the mood often and sporatic. He is the guy who started a style that many followed over the years like the three stooges to current slap stick comedies.,
173,24 January 2015,Patti-Gaston,8, Heartwarming & Funny,"Another classic by the great Charlie Chaplin! Gold Rush includes everything from Chaplin's classic humor, danger, murder, love and a very happy ending that I didn't think was going to happen. Charlie stars again as the Tramp and finds himself in Alaska to prospect for gold and along the way he finds himself in a variety of situations and he meets a lot of characters along the way. Regardless of the situation, the Tramp always manages to stay true to himself and his ideals and Chaplin's characters always stand up for themselves and for the leading lady, in this film her name is Georgia. Despite the dangers that the Alaskan frontier poses, from bears to storms to murderers and falling cabins, Chaplin always manages to bring his unique laugh out loud humor to nearly every scene. At the end of the movie when Big Jim and the Tramp sail home as millionaires and the Tramp was asked to dress up in his prospecting clothes for a photo shoot I thought for sure the authorities were going to arrest him as a stowaway but happily he wasn't and he even reunited with Georgia. The last scene with the two of them kissing was so touching it made me think that maybe Chaplin had an affair with the actress in real life. I hope so because they looked great together. Also impressive is the scenery and the special effects. I loved the storms which seemed very real and the snow covered mountains which could be an image even today's sophisticated person would associate with Alaska. A well done and enjoyable film, I would recommend to everyone.",
174,9 September 2010,b-kelly13,8, Loved the comedy!!,"""The Gold Rush"" has very realistic effects for being filmed in 1925. For instance even though this movie was filmed on Hollywood sets, it really looked as if all the characters were actually in the mountains of Alaska. The cabin, the clothing, the town, everything really helped to set the mood that they were actually there. The effect when the house is hanging off the mountain actually seemed real! Whenever there was too much weight on the side of the house which was over the cliff, the house would actually tip, with all of the items inside it sliding. This seems very good effects for the '20s. I also enjoyed the effects when Charlie Chaplin's character faded in and out from being a chicken, to the tramp.",
175,10 September 2010,jrippz,10," "" ""","""The Gold Rush"" is an excellent film and an example of a kind of genius that you wouldn't find today. Chaplin's performance as ""The Lone Prospector"" isn't just funny, but endearing and personal as well. It's clear that a lot of soul was put into the performance. The scene where Chaplin anticipates Georgia(Georgia Hale) and her crew's arrival on New Year's Eve, for instance, is both funny and deeply sentimental. Chaplin has the charm and presence of a cartoon character. Nintendo's ""Super Mario"" comes to mind(who was undoubtedly(at least indirectly)influenced by Chaplin's Little Tramp character). About 25 minutes through the film, Chaplin's character makes himself a ridiculous looking new boot(after eating his old one), and it remains with for the rest of the movie. It's very humorous, and it's just one of the subtle charms of the character(and the movie). Mack Swain as Big Jim Mckay is hilarious as well. Him and Chaplin are great together.",
176,15 September 2010,k-plekan,8, Great Movie for a 1st time Silent Movie watcher,"I have never seen a silent movie before I watched this. At first I was skeptical about how it would turn out, especially considering the era that it came from. However I was surprised to see how well together it was considering how low key technology was back then compared to today. The over acting and the music had me both laughing at the comedy and paying more attention to the serious parts, even without the spoken words from the actors. ""The Gold Rush"" kept my attention from beginning to end and made me interested in seeing more silent movies. The storyline was well put together and I can see that type of story happening even today. Overall it was a very good experience to watch this movie and I would recommend it.",
177,14 September 2010,JoshuaC96,8, Gold Rush is a great movie.,"The Gold Rush is the first silent film that I have scene. I've seen short clips from other Charlie Chaplin films, but I had never watched a full length movie. I have to say I really enjoyed it. I was very impressed with both the writing and acting in Gold Rush. Going into it I was somewhat expecting see a lot of random slapstick comedy and a disorganized story. However, the movie actually had a very coherent and entertaining plot. Charlie's acting was phenomenal in my opinion. His facial expressions and demeanor were really effective. Also, just the way he moved and his behavior were hilarious. I also thought all of the gags and physical comedy in the movie were great. While watching it I noticed that a lot of the jokes were predictable to me because I've seen similar things in so many other films. (For example; when Charlie and the minor, who had been looking for Charlie, crossed paths without noticing one another.) This is really interesting because guys like Chaplin were pioneers in film comedy and were the first to use a lot of these comedic techniques.",
178,16 September 2010,alexv1208,8, My thoughts on The Gold Rush,"After viewing the Gold Rush, my initial thought was ""that was a pretty good movie for a silent film"". Honestly, I had my apprehensions at first. I thought that a silent film wouldn't be too exciting, however, I had never really seen an entire film of this sort. The Gold Rush was confusing for me at first, I didn't understand what was going on when the scenes switched from being in the middle of nowhere, to being in a small town. Other than that, I appreciated the fact the Charlie Chaplin was so innovative, and his camera skills were impressive for the 1920's. The acting was humorous and understandable. It was surprisingly easy for me to relate to the characters because of their exaggerated facial expressions and body language. The only part of the film I did not like was when the house was falling of the cliff, it was a little too obvious that it wasn't real, but then again there weren't the same technological advances then as there are now. Overall, The Gold Rush was a great silent film for my first experience.",
179,14 September 2010,JamesDean1955,8, Charlie Chaplins performance takes the plot by the hand.,"Upon review, i was instantly captivated by Chaplins charisma. I had heard of Charlie Chaplin in my travels but never could truly understand what the craze was about until i saw him in action for the first time. His Ability to capture the audience in a spell of wonder, excitement, and laughter is nothing short of amazing, considering its release date and the fact that it is a silent film. Chaplin is an artist, and entertaining an audience is simply his canvas. His over-exaggerated gestures, facial features, and appearance all add to the magic of his character. The movie itself didn't so much stand out to me, I knew it was about a Gold Rush but, I was more interested in Chaplins performance and his interactions with other actresses and actors of that time period. The film itself held pleasing visuals, once again, considering that it was 1925. All in all the film was delightful, it was my first silent film and was enjoyable. Just imagine if some of todays blockbusters were dubbed silent, most of the ""actors"" wouldn't be able to hold the shortened attention span of the present day audiences for more than thirty seconds!",
180,21 September 2010,dwanehoyt_jrstaff,8, Amazing silent film,"This was the first silent film that I've ever watched all the way through and I'm sure glad I did. I've always thought that Charlie Chaplin was a genius and it shows in this film extraordinarily. This film is the perfect film to start with if your a beginner in watching silent films, or even classic movies in general. The film keeps the viewer entertained and it's hard to find a boring part although some points are rather repetitive. One of the best parts of the film is that dialogue is not necessary, the antics in the film speak for themselves. All in all I would give this film an 8 out of 10 because it's such an entertaining movie that anyone can watch, it doesn't matter if your not into classic films, or silent films for that matter, the comedy featured is classic and transcends time and CC is an absolute comedic genius and icon.",
181,1 October 2018,jackfull,10, Good Old Original Humor and Story!,"Living in an age where the norm in cinema is heavy action, verbal comedy, and almost all the visuals are done with special effects, Charlie Chaplin's Gold Rush is something I watched out of boredom and did not expect to be as good as it is. It is one of the few films out there that received a 100% on Rotten Tomatoes. It was a film released in 1925, originally silent, then later music and a voice over was added and it was re released in 1942. It does not matter which version you watch, although I suggest that if you want a more immersive experience, the 1942 version is the way to go. In its original release alone, it pulled $1 million dollars into United Artists, and $2 million to Chaplin. This was in 1926!
Getting into the nitty-gritty of this film, this is some of Chaplin's best work in my opinion. Although the story is basic and scenes are easily predictable, it is still a great laugh to watch. This film has some great examples of how Chaplin liked to direct and make his films.He takes a basic scenario where we as the viewer think we know exactly what will happen. ""Oh his pants are falling so he'll take that rope he eyed on the table and tie it around his waist."" This is the first step of reality. Then in typical Chaplin fashion, he flip reality on us. ""He's used the rope to hold up his pants, but its the leash to a dog!"" That's how most if not all of Chaplin's jokes work. Camera angle also plays into effect here. We only see the rope on the table Chaplin wants to use. But what we can't see from this angle is the dog laying on the floor, tied to the rope. This how the majority of the jokes play out in this movie and although it is a bit old school to do it this way, it makes the movie great!
The characters and story in this film are also fantastic! You have the prospector (Charlie Chaplin), the disposable bad guy(Tom Murray), the friend(Mack Swain), the love interest(Georgia Hale), and the cocky ladies man(Malcom Waite). Like I said before, the story is at its root pretty basic,(boy meets girl, boy gets girl, boy loses girl, boy gets girl back) but its the jokes and how the story is played out that makes this so enjoyable. 
Closing up, this film is not only a great work of Chaplin, but of cinema. Chaplin some years later had said that this was the film he wanted to be remembered for. The filming is good, the characters, the visuals, the story. Its all a hilarious classic adventure. Definitely watch this if you have time, it will be time well spent.",
182,1 February 2021,TabithaNoel,8, Charlie Chaplin's Best,"I would recommend this movie for a first-time silent movie viewer like myself. Charlie Chaplin is a legend when it comes to silent movies. Him and the actors and actresses in this film are spectacular in showing emotion such as sadness, happiness, and going a little bit insane since no words are said in the actual film. I enjoyed the comedy in this film; it was simple yet affective to put a smile on my face at some points and it kind of reminded me of ""The Three Stooges"" at one point. The music did a great job in expression as well when there was a fight, a sad moment, a happy moment, or a moment that is supposed to be a little silly. I also like how they included folk songs such as ""Loch Lomond"" in the middle of the film and ""Auld Lang Syne"" in the dance hall scene on New Year's Eve. All in all, this was a great movie and I would highly recommend it to a person who may want to see a silent movie.",
