Review_Date,Author,Rating,Review_Title,Review,Review_Url
0,28 April 2006,planktonrules,10, Chaplin's best--what a film!,"I've seen both version of this film--the original silent version from 1925 and the re-release by Chaplin in the 1940s. The difference is that the re-release was designed to appeal to a new audience that expected sound from their movies. To do this, title cards were removed--having Chaplin narrate the film. In addition, Chaplin-created music (for the most part--some were classical pieces), sound effects and singing were added to make the movie more palatable to the average viewer. I personally like BOTH versions and the one you watch is up to you if you get a copy of the Warner Brothers release on DVD--it has both plus excellent DVD extras. Otherwise, there have been a lot of public domain versions on video out there--many with terrible quality prints or music or both. The Warner version is the most pristine and beautiful silent print you can find. The version usually shown on Turner Classic movies is the 1942 re-release.",/
1,13 May 2005,lee_eisenberg,10, You just can't beat Charlie Chaplin!,"The 1898 Gold Rush to Alaska may have been harsh, but Charlie Chaplin makes it hilarious. As an unnamed prospector, Chaplin goes through a series of gaffes while seeking gold in the Yukon. Most famous of course are the shoe for dinner, the dancing roles, and the cabin teetering on the edge of a cliff. His companion, Big Jim McKay (Mack Swain) at one point is so hungry that he believes Chaplin's character to be a chicken, and before long, a bear enters their cabin. In the midst of it all, the prospector falls in love with dancer Georgia (Georgia Hale).",r
2,15 May 2001,Anonymous_Maxine,10, Charlie Chaplin at his best.,"The Gold Rush is one of Chaplin's best films, as well as one of his most famous. It has been said that it is the film that he most wanted to be remembered by, and it's not hard to see why. Chaplin plays the part of the lone prospector, a young miner during the gold rush. After getting caught in a storm, he hurries to the only shelter that he can find, a wood cabin in the middle of the storm. It turns out that it is already inhabited, and by a tough criminal named Black Larson, no less, and the scene in which Charlie and Big Jim, another prospector, insist to Black Larson that they are going to stay is one of the countless memorable scenes in the film.",e
3,10 September 2020,Xstal,9, Silence is Golden...,"Then came the dawn, and with it one of the standout scenes in any silent movie as the cabin teeters on the brink. There are so many elements in this film, elements that would be reused and recombined in various presentations over the years and on so many occasions - the gold standard.",v
4,30 March 2005,didi-5,8, Little Tramp makes good,"Charlie Chaplin's silent film (also re-released with a narration in the early 1940s) focuses, as usual, on the Little Tramp, and in this case, his attraction to a chorus girl (Georgia Hale). This is the one where he eats a boot, along with its laces, and manages to make it appear a sumptuous meal; as well as creating a dance with bread rolls.",i
5,17 May 2020,ma-cortes,8, Classic Chaplin movie with unforgettable scenes as the pantomime sequence of eating the shoe,"Very good Charles Chaplin in which he proves his excellent skill as an actor and director . The Little tramp searches for gold and romance in the Klondike , Alaska , in the mid-1800s . Along the way he gets mixed up with some burly roles and he falls in love by the charming dancer Georgia , furthermore , he finds in competition with a jealous suitor who has his eyes on Georgia , as well . And while facing off other prospectors and suffering extreme starvation, and anything else.",e
6,4 January 2005,ACitizenCalledKane,10," Possibly Chaplin's best film, certainly one of the greatest comedies of all time!","To see Charlie Chaplin's The Gold Rush is to know enjoyment. One cannot help but enjoy a film as well-done as this! Chaplin said that this was the film for which he wanted to be remembered, and I can see why. It is a masterful blend of comedy, drama, and romance, among other genres seamlessly brought together in one extraordinary picture. Like all great movies, The Gold Rush has more than its share of memorable moments, from the Thanksgiving dinner to the dance of the dinner rolls to the cabin teetering on the edge of the mountain. All of these scenes are brilliant because of The Tramp's flawless physical comedy. He was a master of comedic timing, and he was one of the most graceful physical comedians I've ever seen. Don't get me wrong, this picture is not just three fantastic scenes amongst filler. The film moves along at a brisk pace, following the misadventures of our hero, The Lone Prospector (Charlie Chaplin, of course), as he attempts to hit it big by discovering gold in Alaska. Along his journey through the elements, the prospector meets the notorious Black Larsen (Tom Murray), a wanted criminal willing to do anything to get his hands on some gold. Fortunately, our friend also comes across a fellow prospector, Big Jim McKay (Mack Swain), who has finally defied all odds and struck it rich. But the Lone Prospector's adventures take place not only out in the middle of nowhere. When he is forced back to civilization, he falls in love with Georgia (Georgia Hale), the most beautiful girl in town. Of course, it would be all too easy if no one else was interested in this beauty. Jack Cameron (Malcolm Waite), the handsome lady's man who is not content with every other woman in town by his side; he must have Georgia, as well. Competition arises between the disappointed prospector and the ego-maniacal ""lady killer."" All of this would be too much for any one of us, but the Lone Prospector handles it all with his uncompromising resilience in the face of insurmountable odds to bring us one of the greatest comedies of all time! I will not lie, I am a fan of Charlie Chaplin's movies, but as objective as I can possibly be, this IS one of the great movies...Essential viewing!",w
7,26 January 2002,lugonian,10, Charlie of the Yukon,"THE GOLD RUSH (United Artists, 1925), written, directed and starring Charlie Chaplin, may not be the very best of the Chaplin feature comedies of the silent era, but has become the very movie in which Chaplin wanted to be most noted for by future generations. So proud of his achievement, Chaplin reissued this silent film in 1942 with a new music soundtrack which introduced a narration written and spoken by Chaplin himself, eliminating the use of title cards. Then in the summer of 1971, THE GOLD RUSH became the initial movie presented on public broadcasting station's 13-week series of ""The Silent Years,"" as hosted by Orson Welles, from the Paul Killian collection with a new and excellent piano score by William Perry.",/
8,7 June 2004,PhilipJames1980,10, Gold is the operative word here.,"The Gold Rush is pure gold.  It was Charlie Chaplin's third feature-length film, and marked his comeback of sorts following A Woman of Paris (1923), which he had directed to great critical acclaim but which had been unsuccessful at the box office because it lacked his signature character The Little Tramp.  ",r
9,14 October 2005,Nazi_Fighter_David,10, The Little Fellow is simply superb!,"If any single figure can fairly be said to symbolize the glory years of the silent filmsthe cinema's truly international epochit is Charles Chaplin's indomitable tramp The Little Fellow, as millions came to call him, was at once tatty and debonair, brow-beaten and irrepressibly optimisticand he was, without question, the best-loved international star in all of film history ",w
10,23 November 2001,llltdesq,10, One of the all-time classics!,"If anyone doubts that Charlie Chaplin was one of the funniest comedians ever or that silent films did not require acting ability, t you a commend this film, as well as City Lights.  Modern Times isn't, strictly speaking, a silent film, although Chaplin had no dialogue there.  The Gold Rush, while not Chaplin's best film, does feature his best performance and has so many classic bits, it must be seen.  Excellent film.  1942 version redone by Chaplin is a bit better, but either will do.  Most highly recommended.",3
11,7 May 2023,Mymoviediscography,9, The Gold Rush: A Classic Must-Watch Film,"The Gold Rush, a film by Charlie Chaplin, is a timeless classic that every movie lover should watch at least once. The story follows the adventures of a lone prospector during the Klondike Gold Rush in Alaska, as he struggles to survive the harsh winter, find gold, and win the heart of a beautiful dancer.",8
12,15 February 2007,dataconflossmoor,10, Licorice Shoes and Critical Acclaim!!!!!,"Just like Orson Wells, Marlon Brando and Katherine Hepburn, Charlie Chaplin is a classic in the movie industry!! The king of silent films is attributed with making slapstick humor one of the stellar accomplishments in the entertainment business!! Slapstick comedy is predicated on a lot of physical humor, often times, slapstick is underrated in terms of the immense amount of talent it actually requires!! Lucille Ball got her start by emulating slapstick icons such as Buster Keaton and Charlie Chaplin, and later, she instilled slapstick stunts in her renowned comedy series ""I Love Lucy""... The film, ""Gold Rush"" is hilarious in it's exaggeration of calamity!! Charlie Chaplin is tremendous in engaging in a befuddled demeanor about his basic struggle for survival!! ""Gold Rush"" was listed by one movie critic's list as the best film ever!! Why do you suppose this is? I would say that it is mostly on account of the cunningly successful aspects of silliness that are incorporated in the making of this movie!! Another big reason would be the flippant approach slapstick artist Charlie Chaplin orchestrates when encountering one predicament after the other in this film!! These actions are so overdone that they are hysterically funny!! Charlie Chaplin executes all of the necessary acrobatics of chicanery very effectively!! In the case of ""Gold Rush"" Charlie Chaplin is so intense in his ludicrous actions, that he effortlessly makes ""Gold Rush"" a masterpiece!! Take into account that it is 1925, before the film goer was barraged with a bevy of special effects, and you, (being part of the movie audience) will recognize how well put together this movie really is!! The innocuous charisma of a Nicklelodian style film is often times mollified, and is discarded by many people as being cavalier in it's attempt to attain a recognizable prowess as far as being an assertively marvelous flick is concerned!! Nothing could be further from the truth in the case of the film ""Gold Rush"" This film is outstanding!! The licorice shoes were an added whimsical element to making ""Gold Rush"" funny as well!! I strongly recommend that you rent this movie and watch it!! This is without a doubt, an extremely top notch film!! It is not always rated #1 on every critic's list, but, it is always listed as one of the best movies ever made by virtually every movie expert!! The latest review list that AFI came out with ""Gold Rush"" was rated 58th out of the top 100 American films ever made!!",1
13,11 March 2003,GTDMAC,10," Is It Better Than City Lights, though?","The eternal question for many Chaplin fans is is The Gold Rush better than City Lights?  There are some who would argue for Modern Times or maybe even The Great Dictator.  There are even a few who like Monsieur Verdoux.  But to say this film is better than City Lights is definitely inviting controversy. As a statement on social mores and values City Lights is far more indicting.  As an important piece of film City Lights shows us many things that had never been done before and perhaps may never be done again on the big screen.  But as a sheer enjoyable romp in The Little Tramp's world City Lights falls short.  It is buried in social commentary whereas the Gold Rush has some social issues to deal with but nothing much new from previous works until the end where it neatly summarizes what ""Charlot"" has been all about all along. It is that ending which makes the Gold Rush the best of Chaplin's works and the one I will watch just for the sheer joy of seeing the artist in his prime. 10 out of 10.",7
14,5 April 2006,nnnn45089191,8, You don't need sound to make a great film.,Spoiler Alert:,5
15,2 January 2022,nickenchuggets,10, Chaplin's best,"Charlie Chaplin was mostly known for his terrific silent films he made in the 1920s which were hugely popular with audiences. The one he himself said he wanted to be remembered for was The Gold Rush. It's technically a comedy, but its plot is much more complicated than most others in the genre. This doesn't mean it's bad in any way, it's just not what I was expecting from a film where the primary focus is to make people laugh. The story in this is centered around Chaplin's character, who doesn't have an actual name. He's a prospector during the gold rush that took place in Alaska at the end of the 1800s, and he is trying to make a huge sum of money very quickly. A snowstorm arrives, and in the confusion, he ends up in a cabin occupied by Black Larsen, a criminal. Jim (Mack Swain) also shows up in the cabin, and the three men reluctantly agree to live together (for now). Later, the cabin's food supply starts to diminish, so Larsen is sent outside to look for food. A bear strays into the cabin and is killed by Jim and the prospector, providing them with meat. Meanwhile, Larsen, still outside in the blizzard, finds a gold deposit and decides to use it as bait to lure Jim close enough so he can kill him. Larsen attacks Jim with a shovel and is knocked out, and Larsen is later killed by an avalanche. When Jim eventually wakes up, he wanders into a town, but can't actually remember where his gold deposit is. The prospector also shows up at this town and meets a girl named Georgia (Georgia Hale) at a dance hall, to whom he is instantly attracted. Georgia later goes to his house to eat dinner, but shortly after, Jim shows up to make the prospector guide him to the cabin. While Jim and the prospector are sleeping, a snowstorm blows half of the cabin precariously off a cliff, and it teeters back and forth dreadfully. Jim and the prospector manage to escape, and many months later, the prospector unexpededly encounters Georgia while on a boat back to America, and they're united again. Because this is (believe it or not) the 5th most profitable silent film ever, I had little doubt that it was going to be good. Not only that, but Chaplin is in it. Even almost a century later, there's an abundance of funny and fascinating things in this movie, such as when the cabin is about to fall off the cliff and they show the interior of it rotating. I wonder how they did that. There's also the scene where Jim is going insane with hunger and sees Chaplin's character as a giant chicken that he desperately wants to cook. I know it's a guy in a suit, but it's still funny. Films like this prove that physical comedy is something that will always be amusing, no matter how old it gets. I'm sure people many decades from now will still enjoy these timeless movies featuring one of the most iconic actors in history.",4
16,3 January 2009,pyrocitor,10, Peerless Chaplin masterpiece; comedic gold,"After an unsuccessful attempt at melodrama in A Woman in Paris, a conscious attempt to break away from the silly and simplistic entertainment of his early cinematic career and say something important as a serious artist, Charlie Chaplin was forced to return to just the sort of crowd pleasing comedy he had just unsuccessfully made a bid to deviate from. The crucial difference was, despite his return to his defining genre, Chaplin had not abandoned his newfound sense of cinematic grandeur or determination to accomplish something more worthwhile than throwaway entertainment through film. This rekindled cinematic ambition, combined with inspiration from a series of slides detailing a vast march of Klondike gold prospectors and a gruesome account of an expedition leading to cannibalism, led to The Gold Rush, a picture just as grand, vast and engaging as any of the dramas Chaplin might have initially wanted to emulate. However, it is through Chaplin's commitment to mining the most humane and heart-warming of comedy out of the most unlikely sources that the film is firmly cemented as an abiding classic of the era. ",1
17,21 December 2007,Beta_Gallinger,8, A comedy still worth watching after over eighty years,"I never actually sat down to watch a silent movie from start to finish until earlier this year. Right now, I still haven't seen too many, but recently, for the first full-length silent comedy to see, I chose ""The Gold Rush"", a film written, directed by, and starring Charlie Chaplin, a highly renowned filmmaker of his time, as I was aware of this movie's wide appeal, as well as the wide appeal of much of Chaplin's other work. I wasn't as impressed with it as much as many others have been, but all in all, it was a good experience.",/
18,23 March 2021,RodrigAndrisan,10, Masterpiece!,"Soon, in just 4 years, the film will turn 100 years since it was made. And after so long, it's more than current, it's overwhelming. The scene when the two fight with the rifle pointed to Chaplin, the scene when they eat the boot, then when the big guy thinks that Chaplin it's a chicken, when Chaplin is burying the rifle in the snow, then the dance scene when Chaplin's pants fall off, followed
by the dog which is tied to the end of the rope with which Chaplin tightens his pants, and more, all are scenes of reference in the history of world cinema, scenes that inspired many other filmmakers from then until today. And they
certainly will inspire and from now on. Georgia Hale was very beautiful!",?
19,14 August 2010,TheLittleSongbird,10, A golden treasure,"I love Charlie Chaplin and I love his films. As much as I love The Tramp(his most touching), City Lights(my personal favourite of his movies), Modern Times(has my favourite soundtrack of all the Charlie Chaplin movies, love Smile), Limelight(a beautiful film) and The Great Dictator(love the speech at the end), The Gold Rush is one of his more light-hearted films.",r
20,16 April 2014,lukelandry1,7, Surprised,"I'm just an 18 year old dude in high school that was assigned this movie in a class at my school. When I first saw the genres of this movie I was not looking forward to it at all. It was the first silent movie I was seeing and also the oldest. It had originally seemed like everything I didn't look for in a ""good"" movie. At the conclusion of this movie I knew that my original thought process was entirely wrong. This movie has certainly changed my view on both silent and older films, especially on a comedic standpoint. There was so much about it that was appealing to the viewer. I recommend this movie to all looking to expand their film genres of interest.",e
21,27 June 2001,caspian1978,9, The American comic tradition,"Make them laugh, make them laugh. The American comic tradition and American movies were made for each other. Gold Rush is one example that Charlie Chaplin was the father of American comedy. Even though Chaplin loves to press political, economical, or social messages in his films, The Gold Rush remains true to its genre. It is a comedy non the less. Even at the end of the film when THE TRAMP receives a kiss, Chaplin reminds the audience that she has ruined the picture with the kiss. This is suppose to be a comedy!",f
22,15 June 2005,ffinixs,10, One of the Greatest Silent Comedies,"What a delightful film. I can see the imagination bursting on the screen in riches. Each scene contains surprises and bits of magic. I love how the film shows visually that the liquid is alcohol and how the cabin ended up on the edge of a cliff. This masterpiece is not just a comedy but there are parts that make me laugh just thinking about them, like the eating shoe scene, fighting over rifle while Chaplin tries to hide from gun, and when the cabin is tipping over the cliff scene. When the Lone Prospector finds Georgia the film unveils some truly touching dramatic moments. I love the image of Chaplin standing still outside his open door listening to the crowd on New Year's Eve knowing that he was stood-up. I genuinely felt for him. Chaplin is a auteur who can make me laugh and cry at the same time. Brilliant.",_
23,13 September 2010,d-jacobs1,6," Fun, full of feeling, and enjoyable. A good show of Chaplin's range","The Gold Rush is a showcase of sorts for Chaplin. In it, he provides audiences with a wide range of cinematic elements from his signature slapstick routines to dramatic relationships. The rags to riches plot was interesting and witty, but felt dragged out. While Chaplin is good at emotionally engaging the audience with relate-able situations, like getting stood up or competing for a woman, the lack of serious conflict makes the film seem simple. The special effects were handled nicely even by todays standards, but the true enjoyment in the film comes from watching the tramp endure hardship as he accidentally progresses into wealthiness, and sees his life fall together by favorable coincidence.",=
24,27 September 2005,ctrout,10, The Best of 1925,"All the best Chaplin films have one unique scene that's very memorable because it's either very funny or very touching. In this film, it's one of the funny ones.",t
25,28 August 2007,Boba_Fett1138,8, Sweet classic Chaplin movie.,"It's a sweet movie with some really sweet moments, thanks to Charlie Chaplin's character and of course the way he portrays him. Chaplin always has been great putting effective emotions in a purely comical movie. You always feel and sympathize for his little tramp character.",t
26,19 October 2005,Zzx1988,9, A masterpiece of early cinema....,"In Charles Chaplin's 1925 film, ""The Gold Rush"", a lone prospector travels to California looking for gold, and entwines himself in adventures and finds Georgia, the woman of his dreams. After many hardships, including a relocating cabin, the lone prospector, played by Charles Chaplin, finds gold and becomes rich, ending in success and unity with Georgia. The time period in which this movie was shot, compared with the technological innovation and the state of the art filming techniques, give this film an undoubted masterpiece feel. The use of up-close shots combined with comedic imagery also brought a new feel to the style of silent cinema. The scene with the cabin shifting, and the camera tilting to reflect the inner cabin, was one of the many stylistic filming techniques that gave ""The Gold Rush"" such artistic and ingenious appeal. Chaplin's ideas and his vision that he brought to life in the movie ""The Gold Rush"" make it a great landmark in the beginning of silent films and in film history. The intricate but simple story of ""The Gold Rush"" brought about many distinct feelings when viewing. It gives feelings of happiness, during scenes where there is comedic relief and slapstick comedy, and also can bring about sadness or pity for the lone prospector when he waits for Georgia on New Year's but she never shows up. It reveals how silent films can become in touch with a person's feelings, making them feel for the protagonist, without having to have dialogue to explain the gestures and plot. These aspects of ""The Gold Rush"" make it a milestone in the film industry of the modern world.",_
27,31 October 2014,grantss,8, Classic Charlie Chaplin,"Classic Charlie Chaplin movie. Complete with the usual incredibly creative visual comedy and romantic angle. Very funny. Contains some of Chaplin's most memorable and iconic scenes: the stewed boot, the dancing bread rolls (revived for a modern audience by Johnny Depp in Benny and Joon), the cabin on the edge of a cliff (which must have inspired scores of cartoon scenes).",u
28,9 December 2005,evanston_dad,9, One of Chaplin's Best,"""The Gold Rush,"" perhaps more than any other Chaplin film, best captures that elusive, sad quality about the little tramp that permeates so many of his films. What is it exactly that's so sad about Chaplin, given the fact that he's always doing something zany and laugh out loud funny? It's that he always seems to be an outsider; he never quite fits in. There's always someone bigger, stronger, richer, better looking than him. And I think that's what movie audiences responded to during his hey-day and what they're still responding to now.",r
29,20 April 2014,TBJCSKCNRRQTreviews,8, Warmth,"A lone prospector(Chaplin, shy and kind, giving the best of all the great physical performances of anyone in this; he also wrote the narration he provides for the version I watched(of this otherwise silent film, and one can see how it worked purely from its visual storytelling), which is 68 minutes long, or 69 if you count the ending credits) goes to Klondike on the titular gold rush(albeit ironically, this is more of a backdrop), meeting new friends, enemies... and perhaps love?",v
30,18 February 2013,StevePulaski,9, I think I've struck gold...,"NOTE: The version of Charlie Chaplin's The Gold Rush that is being reviewed is the full-length, uncut ninety-six minute version released in 1925, as opposed to the seventy minute cut released in 1942 with updated narration, music, and several story cuts.",
31,16 May 2007,DKosty123,9, Essential Little Tramp,Saying classic about this silent film is certainly the most over sued term for it. This is a must for Charlie's fans & for students of film to show how much imagination Chaplin had as a film maker in this era.,
