Review_Date,Author,Rating,Review_Title,Review,Review_Url
434,12 July 2019,Real_Review,7, Extreme. A Classic That Requires A Huge Investment From The Viewer.,"This was my favorite movie for a couple of years in high school, followed by 'The Godfather' (1972) for a couple of years as I matured a little (very little). There was a time where I would have just clicked 10 stars for this film and moved on to another film to watch and review. Realistically, I have probably started this movie (and watched at least 80 minutes) over 20 times... I have probably finished it over 10 times. As an honest movie reviewer in 2019, I can admit that I used to have a hard time finishing the film that I told the world was my favorite...",
435,17 November 2019,forbfletcher,10, Greatest mob movie that i watched.,There's nothing to say too much.I was 14 when i saw this movie for the first time.Even now when i get bored i open that movie to cheer up.,
436,26 August 2005,dickback,7, Er... soundtrack...?,"I don't have much to comment about this film, but I'd like to say a word on the soundtrack. Be it nice or not, it's the most inappropriate music ever written for a film, in my opinion. It almost made feel its intrusive presence and, while I usually like to watch a movie in its entirety --- end titles included --- I really felt like cutting it at the last scene, because of the soundtrack. What have a I seen --- I thought --- a rock musical or what?",
437,11 May 2019,RossRivero99,10, One of the greatest gangster movies ever made,"Brian De Palma is arguably one of the greatest filmmakers of the last 50 years with classic films such as ""Carrie"" (1976) and ""The Untouchables"" (1987) to his name with this movie he has made his masterpiece and one of the finest movies about the mob ever put on film along with ""The Godfather"" (1972), ""The Godfather Part II"" (1974), and ""Goodfellas"" (1990), but unlike those movies it doesn't touch on the Italian mafia. Al Pacino stars in perhaps the finest and most manic performance as Tony Montana a Cuban exile who ends up in Miami and is desperate to find a way to make a living in America by any means necessary with his best friends Manny (Steven Bauer), Chi Chi (Angel Salazar), and Angel (Pepe Serna) in a refugee camp and as a result becomes a part of the mob. in order to make money and survive. Montana then meets a drug dealer named Frank Lopez (Robert Loggia) who gave them green cards and a pardon for a murder they committed in Cuba. Then Montana becomes friends with another drug dealer named Omar Suarez (F. Murray Abraham), and falls in love with Frank's wife Elvira (Michelle Pfeiffer). This movie focuses so much more than Montana's life of drugs and crime it also focuses on his family relationships with his mother and his sister Gina (Mary Elizabeth Mastrantonio) disgusted at the fact that he lives a life of crime, and is really a study on Montana's character but mostly doesn't portray him in the best way throughout the movie. The performances in the movie are rock solid with Pacino and Pfeiffer being the biggest standouts, and De Palma's direction is top notch with a very masterfully written screenplay by Oliver Stone. The movie is a remake of Howard Hawks' 1932 gangster film of the same name with Paul Muni in the lead role which I still have yet to see. This is a must see film for anyone that calls themselves a film buff and is a masterpiece of the crime genre.",
438,25 May 2005,objesguy,6," Pacino is great, but the rest of the film is overrated","Oliver Stone has a habit of writing extremely controversial films that are either extremely well done (e.g. JFK) or extremely corny (e.g. Natural Born Killers). Scarface is one of those corny ones unfortunately, even though it seems hard to believe that this film could be mediocre considering it has one of the greatest directors ever at the helm (Brian De Palma), and one of the greatest actors of our generation gracing the main role (Al Pacino). Unfortunately, while Pacino's performance is one of the best (and maybe his most overacted)of his career, the film itself is filled with mediocre performances, a cheesy and linear storyline, and bland, one-dimensional characters that prevent this crime movie from being anything more than a popcorn action flick.",
439,26 August 2020,nicorip22,10, Really good classic,"This movie is perfect, has it all. Don't hesitate and watch this movie, watch al pacino at one of his best roles.",
440,10 September 2020,jessy_mena,8, My fav film,This is my all time favorite film ever!! I have seen it so many times and I will continue ti watch it.,
441,6 September 2021,ronakkotian,8, Very over-the-top but consistently entertaining,"I love gangster dramas so I've been meaning to watch Scarface for a long time. If there's one reason to watch Scarface, it's for Al Pacino's performance.",
442,2 August 2022,Frazzle22,3, An ugly film for ugly people,"The fact that ""Scarface"" is the favourite film of every low life, wannabe criminal-thug you'll ever meet is reason enough not to watch it.",
443,3 May 2021,TheHonestCritic,10, This is a another one of those rare remakes that's better than the original film. How does it hold up today?,"""Scarface"" (1983), the original movie from 1932 really helped pave the way for crime and gangster films we know today. As much as I enjoy the original movie, the remake is superior and elevates the concept of the story to the next level. Also, it happens to be one of my top ten all-time favorite crime/gangster films! It has a perfect story, perfect acting, perfect sets/locations, perfect special effects, and also a perfect soundtrack to tie it together. The plot is similar to the original film with a few minor changes. In this film, our main character is named Tony Montana, instead of Tony Camonte. The story takes place in Miami instead of Chicago. Also, the plot in this film is heavily focused on drugs. All of those aspects add a stronger layer to the story and add more complexities to the plot itself. I remember when I first saw this movie, I didn't know how long it was. Once it begun, I was fully invested from beginning to end. Then, I looked at the clock and noticed that nearly three hours had gone by! I thought to myself: ""that was three hours? Wow, it didn't even feel like two!"" That's the sign of brilliant storytelling. When a long film goes by fast, then you know it's a winner! Plus, it has one of my top ten favorite lines in all of cinema, which is: ""say hello to my little friend!"" It's so good, that you can still hear it being quoted today! People say it in real life, plus, characters in movies and TV shows have said it on numerous occasions. I don't know if that was the script writer's intention, but he has written a brilliant line. Props to you, Oliver Stone! I don't want to go into any more details about the story, because I don't want to spoil anything. But, let me assure you, it's one that you'll never forget as long as you live. As far as the acting goes, it's equally as phenomenal as the storyline itself. But, of course the shining star in this movie has got to be Al Pacino as Tony Montana. With any movie he stars in, Al Pacino never disappoints, no matter how prominent his characters are. But, his performance here, in my opinion, is one of his absolute best! Another thing I like about his portrayal is that he is not cowardly like Tony Camonte in the original film. Now, hear me out, Tony Camonte was not a coward throughout the whole movie. His fear came out near the end. However, Tony Montana showed no fear and stayed strong all the way to the end and went out like a real man that never ever backed down. That just makes him a better and stronger character than the one in the original movie. Another thing, he really nails the Cuban accent. Usually, I don't like it when an actor or actress plays a character with a different accent from their real-life one. When that happens, their attempt at the accent is either too over the top, not believable enough or they don't even try. If I were a casting agent, I would try and find an actor or actress from that country with the accent that the character is supposed to have. Think about it, now this is an example, if the character in the film you're going to make is, let's say German. (I'm just making a point here). You wouldn't hire an actor that isn't German. If you cast actors or actresses who are actually from whatever country, then their accents would be authentic. Unless your actor can nail whatever accent they're doing, you should cast someone of that nationality. However, in the case of this movie, Al Pacino does an excellent job with the Cuban accent. If you didn't know that he was Italian-American, then you would honestly believe he was from Cuba! Give the dialect coach and Al Pacino an award! As for the rest of the cast, they're just as outstanding with their acting performances. The chemistry between the whole cast is impeccable and definitely shines on the screen. All of the sets/locations are stunning and give the film a beautiful atmosphere. As far as the special effects go, they are all well-done and still hold up today. Finally, the soundtrack composed by Giorgio Moroder is perfect and it really helps bring the movie to life! The film score sets the tone immediately and elevates the emotion of the story even further. Some people might say it's cheesy and overblown, but, for a plot like this, a soundtrack like that is warranted and it helps to tie everything together. ""Scarface"" is a triumph in the field of crime/gangster movies. Like I mentioned before, it's one of those rare remakes that's even better than the original. I'm giving this film 5 out of 5 stars on my scale, which equates to 10 out of 10 IMDB stars. If you haven't seen ""Scarface"" yet, go and see it today. Or else, Tony Montana might hunt you down!",
444,28 June 2021,ScarletX7,10, a Masterpiece,"This movie is definitely one of the most beautiful and shiny creatures that ever created and, in my opinion, it has been underestimated and Pacino should have won the Oscar for create this character. However, I can't even describe my feeling about this, all I can say to you guys is just see this masterpiece and understand how touchable and fantastic one movie can be...",
445,16 September 2009,The_Light_Triton,10, Bring me the popcorn,"in the spring of 1980, thousands of Cuban immigrants set sail for the united states, most in search for the American dream, the rest either trying to escape their past, or find family members from the past. one of those immigrants was Tony Montana.",
446,29 April 2023,deadbull-95171,9, Skip this review and read Paulene Kael's,"The main reason I read Every New Yorker magazine during the 70's was for Paulene Kael's reviews. She said in a few sentences what most professional reviewers turned into essays, and she said it better. Her review of Scarface, the DePalma version and not the 1931 original, are surprisingly, to me anyway. Negative. She seems to think that Murray Abraham is the best thing in the movie and that the best that can be said for Pacino, is summed up in her reference to the overhead shot of him laying in the huge circular tub, a cigarette butt in a huge ashtray"". She was referring to his lassitude and immobility, that the camera has to move since he doesn't. The Stone /De Palma collaboration, she found stifling to the potentials actualized in 1931, and found all the supporting talent suffocated.",
447,2 February 2020,ramunniarestaurant,10, The Best Scarface film,I have seen the original and this current one and they rock. Scarface is such a good movie that it delivers a great performance. The actors and the script wer eso good.,
448,9 August 2019,rachelrose-87356,8, Movie Review Profits,Play Scarface! It is fast and easy to view! A good way to spend your time. Be the best!,
449,6 October 2021,rafaelloskipros,7, Is connected with evereything in life,"When you will firstly see the movie you wont really realise its meaning. Personally almost everyday since i watched it i allways think abount people and things that had been at its ""finest"" but slowly they were decreasing their ""force"" and finally been destroyed.",
450,24 August 2006,spartakus49,6, Over rated,"Caution Spoiler. I have found that gangster movies, violent movies, or movies with criminal or non law abiding characters are generally over rated. Goodfellas and The Godfather are wicked movies even with the traits I had stated previously. I had heard from a fare amount of people that Scarface is one of the best movies ever made. Now that I have seen Scarface I can say I was a little disappointed. I am aware of Pacino's brilliance but I was not that impressed at the over tanned white Cuban. Al Pacino was awesome as Tony Montana and Pacino is responsible for a good number of the star's in Scarface's overall rating. His mother hates him, he kills his sister, he kills his brother and he also gets killed. Id rather be partially mentally or physically handicapped then end up like Tony Montana. Cocaine is a cancer on this world and is one of the worst narcotics. Cocaine even for a non addict or anybody for that matter makes your penis shrink, makes you impotent, causes some pretty bad paranoia, makes your heart beat out of control, I see no need to elaborate but have just scratched the surface of the negative attributes of cocaine. Cocaine is not a drug, the high you get from cocaine is not even close to being enjoyable and I am considering it a tax on the stupid.",
451,16 November 2021,gabriel_sanchez,4, An almost 3 hour ride about a dislikable thug's climb and fall,"Although Al Pacino steals the show, even his over-the-top performance can't make Scarface stand the test of time. What was probably remarkable back then, seems more like a Tarantino's parody now. 38 years Scarface is nothing more than a long movie about one selfish and arrogant man's decent into his ultimate doom.",
452,22 November 2021,browns-78804,10, 10/10,Best movie. Is a 10/10. Al Pacino's best movie. Is about a Cuban gangster. The original is good too. Scarface 1983 is better than the 1932 original. The 1932 Scarface has Boris Karloff. Scarface 1983 is directed by Brian De-Palma. This is Brian De-Palma's best movie............................................................................................................................................................................,
453,28 May 2018,Darth_Osmosis,10, Push it to the limit!,"A bloody and violent rags to riches story about a Cuban immigrant and how it all ends. Pacino was the perfect choice to play Tony Montana, nobody swears like him! Even though he is clearly a bad man, he still has his own sense of honor and is likeable. It's easy to wish for him to succeed.. Soundtrack has kind of become part of the pop culture!",
454,27 October 2019,harryplinkett14,8," Fun, but flawed","The subplot with the anti-hero's family was shoehorned into this film to give it more 'depth', probably so critics wouldn't butcher it as nothing but an excuse to show violent scenes. But we didn't need that subplot to like Tony or to enjoy his journey to success and ultimate demise. I just hate it.
Also, the scene where they attempt to assassinate him makes no sense. The assassination attempt is so amateurish, and on top of that, the man who ordered it watches sports rather than waiting to hear what happened. He also forgets to put any guards on duty, so Tony can just walk in. Killing Tony, who always walks alone, often drunk and drugged up, would seem like a fairly easy thing.
And then no one ever seems to investigate that assassination attempt or the fact he had two guys, one of them an important police officer, killed. In this film, the police never seems to investigate any murders, at least not when it's convenient for the plot.
Then we have this narco-boss from South America, who for some reason needs Tony's help to kill a guy who has no protection whatsoever. As we learn, every important person in the country is being threatened by this guy, and for some reason, not only have they not had him killed a long time ago, but they need Tony to drive a car so they can kill him. These are the same guys who sent a team of what appears to be 100 guys to kill Tony, within hours. Why would they need Tony to be the driver?
Finally, the romance between Tony and his wife is non-existent, and I don't now whether it was meant to be non-existent, or the script fails to make us believe these people ever had true feelings for one another.",
455,20 December 2022,xiaoli7377,9, Frustrating,"Al Pacino's Tony Montana is one of the best and most quotable movie characters of all time, by far the highlight of this movie. The screenplay (at least in terms of character dialogue) by Oliver Stone is also excellent. The finale is iconic. That's what makes my appraisal of ""Scarface"" very frustrating, because there are so many great things to love about this movie. So many great individual scenes. But there's something about it that feels a little hollow, like a sense of cohesion that's missing. We're taken all over the place in the plot, some of the tone shifts from funny to sad to psychotic rage in the span of something like five minutes. Most of the other characters aside from Tony feel severely underdeveloped. Like much more dialogue was needed between them in a familial way. It's not even necessarily a runtime thing because this movie is almost three hours already.",
456,1 August 2014,rajatdahiyax,8, Seen many movies of same genre but this is mother of all!!!,"Al Pacino stars as Tony Montana, an exiled Cuban criminal who goes to work for Miami drug lord Robert Loggia. Montana rises to the top of Florida's crime chain, appropriating Loggia's coke-head mistress (Michelle Pfeiffer) in the process. Howard Hawks' ""X Marks the Spot"" motif in depicting the story line's many murders is dispensed with in the 1983 Scarface; instead, we are inundated with blood by the bucketful, especially in the now-infamous buzz saw scene. One carry- over from the original Scarface is Tony Montana's incestuous yearnings for his sister Gina (Mary Elizabeth Mastrantonio). The screenplay for the 1983 Scarface was written by Oliver Stone",
457,28 October 2001,PyrolyticCarbon,9, Hard and violent film with stunning performances,"An astounding film. Brian DePalma does his usual magic and produces a slick and gritty portrayal of a lowlife hitting the streets of America and rising up through the ranks to the top of the Gangster ladder and, ultimately, his fall back down.",
458,16 August 2020,lleuadserenmor,9, Still reeling,"It'll take some time to recover from being privileged enough to have accompanied Al Pacino through his fabled journey here...from his ill fated decision to give up his humble existence scratching out a living washing up, to rising to the dubious heights of Miami's darkest side through the 1980's drug fuelled excesses. This astonishing , visually gory, rollercoaster of a film challenges the idea of wealth and machismo to an extreme level, pushing Pacino's apparently endless, limitless and glorious acting abilities from one experience to another, as we witness with excruciating accuracy the demise of misplaced and ruthlessly executed ambition, whilst being under the all consuming influence of a steadily rising and utterly reckless drug addiction. Pacino's sunny and kind of innocent good looks and natural determination slowly diminish as the Miami sheen and tropical beaches corrupt and corrode his cheery survivalist instinct s as the whole film exposes with some savagery the underworld which Pacino's character Tony is initially tempted into, only superficially rules for a short time, before becoming it's slave again. The brilliance lies within Pacino's demonic performance, at times sublime, conveying brutally raw speeches to himself, his doomed confidants, to anyone, actually, who is caught in his mesmerising web of limitless ambition and apparently achievable aims. Even when he's in one of the most anguishing scenes, unable to stand, furious at his once awe inspiring wife, in a restaurant, he publically humiliates himself, his wife, his life, at the realisation that it's all gone to hell,. yet he still manages to jump back just in time for the last scenes, which are as inevitable as they are appalling, with Tony struggling to get his head out of a pile of cocaine whilst surrounded by the shot out remains of his decadent villa, black marble and gold pillars crumbling around blood stained bodies and carpets. He is defiant and scathing and full of bravado right til the end. The parts of the film that are the most telling are also the most moving, the return to his family, who know who he really is, his expensive suit offending his astute and frightened mother, who despises his lifestyle as much as his inability to be honest, from the almost funny refusal by the banks to refuse the funds Tony ends up supplying them with. The lack of technology here also, becomes one of the films best features, with no props needed for Pacino to shine. This hangs on machismo instincts working overtime, direct, brutal communication from one trusted man to another , with dark politics overhanging every conversation, deal and murder that occurs. Loyalty is everything for these men...the women here are symbolic, the mother, who loves her son but knows exactly where he's going to end up and almost can't bear to look, the wife, who becomes the passed on possession from one crook to a better crook, almost without her own voice as she follows the addicts route of almost total dependence into any hell scene , and the more challenging depiction of the sister, where we catch unnerving glimpses of almost Shakespearean , Hamlet style, tortuous , obsessive, possessive relationships, twisted from the biblical ideal and warped by addiction into something entirely on the other end of the spectrum. It's a cliche to say that this is a drugs gangsta film, but that's what it is, ultimately, but it's just that this one is probably one of the best for sheer clout. It's got it all...it's a showstopper. Just one of Pacino's jaw dropping scenes is full, packed to the hilt with every conceivable emotion, and much of this is from those eyes alone. Antihero he might well be, and much of this classic is hard to watch, but forgettable it certainly isn't. Tony's demise , his desire to succeed, and the outer ripples of corruption stemming from his inner circle of paranoid existence makes for a compelling, rightly iconic and legendary movie creation.",
459,30 January 2019,josh_lambert1991,5, I wanted more,I'd heard about this iconic film loads and decided it was time I watched it only to be so disappointed. Tony Montana's character was all over the place and I just didn't see it,
460,25 February 2008,emperor_bender,9," ""The only thing in this world that gives orders...is balls""","This is a classic movie that has aged very well. It's probably the oldest movie I know that people still consider mainstream. I always see people with Scarface T-Shirts, jackets, etc. When I watched this movie for the first time, I had found out why. This movie was excellent. Just about everything appealed to me and my attention was kept throughout the entire film. I guess it's partially because I really enjoy gangster movies, but that is not the only reason I enjoy this movie. The story line was chock full of interesting twists and turns. Aside from that, all of the characters were well played and fit in very well with the story. The action in this movie was never really overdone, except maybe once or twice. If you haven't seen Scarface yet, you need to go down to the video store and pick up a copy, this is one of those ""MUST see in your lifetime"" movies. 9/10.",
461,17 April 2014,Zeppelien,10," This is what you call a ""Movie""","This guy Al Pacino is a real legend,fits in every single kind of role.The best actor ever,I'm a big fan of clint eastwood & Leonardo dicaprio but this guy is beyond them.Showed you money isn't everything,yes it is but earn it through a respectable way,live your life without life threats all the time,nobody's out there in this world you could trust.""Don't talk to me about trust"".his dialogue delivery was superb,his acting was so awesome I can't express it in words here.Credit goes to the script writer,somebody go over him & give him Oscar.The movie was funny also,he made the dialogues look like he wrote them himself.Lessons in the end,& the jokes he made to his wife,I've been laughing all the time like an idiot.When he first met the girl in club & the comment he made on her was freaking funny,but after the movie finished,I forgot all the funny moments,in this line,you are never ever going to survive,you will die the other way.His comments ""what am I living for,drinking,eating,f'ing,sucking & the things he said to people in restaurant when he was drunk touched my heart.that's how the society is,this is how we all are.I'm gonna pay you 400000 more it'll make 800000 & you can buy the supreme court then.awesome dialogues in the end.awesome awesome movie,GTA Vice city was copied from this film I guess,first & last mission kind of thing in first & last scene.same setup.unbelievable,this guy is a real hero.nobody in this world is out there,whom you can trust,awesome",
462,16 January 2021,maidwell-45616,4, Aged like a fine milk.,"It's like watching a 3 hour X rated episode of The A Team, except the bad guys win. (And nowhere near as entertaining or fun as that premise sounds).",
