Review_Date,Author,Rating,Review_Title,Review,Review_Url
0,10 December 2016,Leofwine_draca,10," A stone cold, 100% gangster classic","Words alone cannot express how much I love this movie. The first time I saw it, it blew me away. When I watched it again recently it hadn't lost any of its impact. SCARFACE is, quite simply, one of the best films in the ""gangster"" genre that there is, if not the best. The simple tale tells of Tony Montana's journey from being a lowly refugee, to working in a cheap mobile café, to working for a drug lord's assistant, to working for a drug lord, to becoming a drug lord and then losing everything due to his own mistakes.",/
1,19 December 2005,Aditya_Gokhale,10," ""You wanna play rough?? OKAY!""","""Scarface"" has a major cult following even now, 22 years after its release.",r
2,12 September 2004,akpiggott,9, Exceed to Excess,"Every great gangster movie has under-currents of human drama. Don't expect an emotional story of guilt, retribution and despair from ""Scarface"". This is a tale of ferocious greed, corruption, and power. The darker side of the fabled ""American Dream"".",e
3,28 January 2007,TruPretender,10, The Real Scarface.,"""A Classic is something that everybody wants to have read but nobody wants to read. A classic is also something that everyone praises but no one has read."" -Mark Twain",v
4,21 February 2016,ankitbbd,9, Al Pacino made it unforgettable,"Scarface is surely one of the best crime movie ever made.Al Pacino's performance as a sharp minded,angry,dangerous and powerful criminal is phenomenal.Al Pacino is playing a character which is brutal,angry,fearless and at the same time has love for his sister. Although movie is 2 hours and 50 mins long,but you will not find any dull moment in the movie.Alhough Al Pacino is playing a drug dealer but you will still like him as a person.",i
5,22 June 2003,lambiepie-2,10, The 80's and how not to live them...,"Ya know when one looks at this Brian DePalma film today, I'm sure there has been a lot of criticism about how dated it is. Also, about the violence. When I looked at this film on VHS when I was 20, I thought it was ulta-violent and gritty as well. But I didn't get 'it'.",e
6,30 June 2001,jhclues,8, Dynamic Performance by Pacino,"In 1983, Director Brian De Palma set out to make a film about the rise and fall of an American gangster, and that he did-- with the help of a terrific screenplay by Oliver Stone and some impeccable work by an outstanding cast. The result was `Scarface,' starring Al Pacino in one of his most memorable roles.  The story begins in May of 1980, when Castro opened the harbor at Mariel, Cuba, to allow Cuban nationals to join their families in the United States.  125,000 left Cuba at that time, for the greener pastures of freedom in America, and most were honest, hard-working people, thankful for the opportunity they had been granted.  But not all.  Among the `Marielitos' who streamed into Florida, approximately 25,000 had criminal records and were nothing less than the dregs of Cuba's jails-- criminals considered beyond redemption, who Castro had merely wanted to be rid of.  And they, too, saw America as a land of opportunity, even as Al Capone had considered Chicago some fifty years earlier.  And among the most ambitious was a man named Tony Montana (Pacino), known to his associates as `Caracortada.' Scarface.",w
7,6 February 2011,murtaza_mma,9, A Potpourri of Vestiges Review: Pacino gives a heart-wrenching performance as the modern-day Macbeth,"Brian De Palma's Scarface depicts cinema at its most macabre, and not for a second does Stone's cut-throat screenplay go awry in its unforgiving attempt to limn the naked reality associated with drug mafia and the kingpins who govern it. Brian De Palma's unquenchable thirst to mimic the gore reality on the celluloid didn't go well with the MPAA, which rated even the highly censored third cut of the movie as 'X'. Brian De Palma and the producer Martin Bergman arranged a hearing with the MPAA and roped in a panel of experts including some narcotics officers, who testified the movie's verisimilitude to the conditions prevalent in the drug underworld. Their testimonies greatly convinced the members of the rating board, who eventually condescended to give an 'R' rating to the aforesaid third cut of the movie. Brian De Palma used the pervasive kerfuffle as a subterfuge to release the unedited original version of the movie instead of the curtailed one and kept this fact surreptitious for months until the movie was released on videocassettes. ",/
8,17 September 2011,Arcturus1980,10, My favorite crime film,"They improved on greatness for this remake of Howard Hawks' 1932 film of the same name. To my mind, this is more than a crime doesn't pay morality tale, just as Al Pacino's Tony Montana is an anti-villain rather than an anti-hero. This is deep filmmaking not to be dismissed in so superficial and parochial a manner.",r
9,24 May 2020,kosmasp,10, Say hello to my little friend,"One of the most recognized quote from a movie ever. Even to those who haven't seen the movie. It's sort of Pacinos equivalent to De Niro ""You talkin to me?"" scene from Taxi Driver. Not comparing those movies of course. If you want to compare movies, you could compare this to the 30s original with Paul Muni. A movie that Pacino watched in a cinema and made him want this movie. Made him want to be as mesmerizing and have a powerful role. Add Oliver Stone and others to make this happen and you have an amazing movie.",w
10,14 July 2008,alexkolokotronis,10," Loved, But For The Wrong Reasons","Many people like this movie and many more love it, but it seems that it is all for the wrong reasons. Scarface should be liked and loved but not in the way it has been or is.",1
11,18 December 2004,imdb-5032,10," Grandiose, bloodyminded and implacable",This is one of my all time favorites.,0
12,2 November 2020,auuwws,8, Scarface,Amazing movie and amazing performance by Al Pacino as Tony Montana,6
13,19 January 2013,ma-cortes,8, Violent chronicle about the rise and fall of a dangerous gangster and easily ranks as one of the very best in the mobster genre,"Remake from classical movie titled Scarface (1934) , in fact , De Palma's Scarface is dedicated to Ben Hecht and Howard Hawks. When Fidel Castro opens the harbor at Mariel, Cuba, he sends 125,000 Cuban refugees to reunite with their relatives in the United States. Among all the refugees, there is one who wants it all, his name is Tony Montana (Al Pacino reportedly stated that Tony was one of his favorites of all the characters he's played) but the world will remember him by another name , Scarface , being a fictional character . In 1980 Miami, a determined Cuban immigrant takes over a drug cartel while succumbing to greed . As Tony and his faithful friend Manny (John Travolta was considered for the role of Manny Ribera but was to Steven Bauer who is the only actual Cuban in the main cast and subsequently married Melanie Griffith) arrive in the U.S. and beginning working small time jobs importing and exporting cocaine. Soon, they are hired by Omar Suarez (during filming F. Murray Abraham was notified that he had won the part of Antonio Salieri in Amadeus) to do business to a group of Colombians. When the issue goes awry , Tony and Manny leave with the money and flee rapidly . Soon after , Tony meets with drug ringleader Frank Lopez (Robert Loggia , outstanding as a rival gangster) and falls for his boss's girl , Elvira (Michelle Pffeifer , Kay Lenz, Glenn Close , Kelly McGillis and Kristy McNichol both reportedly wanted the role , but De Palma turned them down). Later on , Tony reunites with his mother and sister (Mary Elizabeth Mastrantonio).",6
14,22 September 2020,Xstal,6," Scars & Torture, Visible & Unseen...","It's a story about a misogynistic psychopath with sister issues who develops drug and alcohol dependency and carries an exceptionally large chip on his shoulder: Al Pacino captures that character to perfection. Without him the film would probably have been forgotten some time ago, the rest of the cast are quite forgettable in comparison but so is the story which adds little or no value, unless you have aspirations along the lines of the scarred man or recognise some of his attributes in yourself or someone you know.",3
15,26 October 2021,melwinbauer,8, Gangster Classic,"Scarface - Crime, Drama - 1983 - 2h 50m",0
16,16 January 2005,slokes,4, Tony The Blow-Man,"""Scarface"" is a useful movie to have around. If you walk into someone's house for the first time, and he quotes ""Scarface"" twice in the first 15 minutes, you know it's time to leave.",1
17,14 June 2016,PredragReviews,10," ""The World Is Yours""","""Scarface"" is one of the greatest of all mob movies. It's an epic crime drama done with style and care. Brian De Palma presents a film that ignites the screen with a great screenplay by Oliver Stone and an amazing performance by Al Pacino. For those unfamiliar with the story, Scarface follows the path of Tony Montana, a charismatic Cuban refugee, who arrives in Miami looking for the American dream. Tony's up-front and tough personality makes him go right to the top of the cocaine underworld. However, no one, as they say, stays at the top forever. There are consequences to his success, and as Tony learns, money and power can't give you everything. A special mention should go to Michelle Pfeiffer, who superbly plays Tony's love, in what was her first major film role. This film is not for the faint at heart as directer Brian De Palma 3 times had the film rejected because it had and X-Rated certificate. He literally had to take the people who give the certificates out to court. Although grotesquely brutal this movie could teach kids good lessons that crime does not pay as when he gets to the top of the underworld his life corrupts through cocaine and he ends up killing the ones he loves and watching ones he loves die in crossfire.",/
18,6 September 2005,Nazi_Fighter_David,7, The Oliver Stone-scripted 'Scarface' is a change in genre...,"The story turns around Antonio 'Scarface' Montana, an ultra-violent Cuban refugee who comes to the United States with less than nothing, and makes a place for himself at the top of the cocaine trade...",?
19,5 January 2005,ed56,10," A Brutal, Uncompromising Masterpiece","Arguebly Al Pacino's best role. He plays Tony Montana, A small time hood from Cuba turned into a rich and powerful crime lord in Miami, and he does it with the only two things he's got in this world, his balls and his word, and he doesn't break'em for nobody. Starts as doing jobs for a big time Cuban dealer, Frank Lopez (Robert Loggia) and quickly goes up the ladder of the organization along with his long time friend Manny (Steven Bauer). Soon he has an eye for the boss's sexy wife Elvira (Michelle Pfeiffer). After Frank sees a threat from Tony to his position, he attempts to assassin Tony but with no luck. Tony is upset and nothing can stop him now. the film has a great supporting cast among them is F. Murray Abraham as a jumpy gangster, another familiar face is Harris Yulin as a crooked cop trying to shake down Tony, Marry Elizabeth Mastrantonio as Tony's young sister. Credits to the Ecxellent screenplay by Oliver Stone. This film is one of Brian DePalma's Brightest points in his long ups and downs career, you can see this guy is very talented. The movie has a magnificent look to it. Also pay attention for two memorable scenes: The one at the fancy restaurant (""Say goodnight to the bad guy""). the other is the final shootout where Tony shows that he still knows how to kick ass and kills about 20 assassins that invaded to his house. this is certainly one of the most impressive endings to a movie I have ever seen. For fans of Al Pacino and crime movies it's a must-see. For the rest of you it's highly recommended. 10/10",r
20,26 September 2001,michaelRokeefe,7, Taking advantage of the land of the free. Crime does have a price.,"Written by Oliver Stone and directed by Brian De Palma, SCARFACE paints a picture not easily forgotten. Al Pacino turns in a stunning performance as Tony Montana, a Cuban refugee than becomes a powerful player in the drug world as he ruthlessly runs his self made kingdom of crime in Florida. This gangster flick is harsh, violent, loud, gross, unpleasant and must hold the record for uttering the word ""f--k"" the most number of times. Almost three hours long, and yes it can get repulsive. A stout hearted constitution keeps you in your seat cheering for the demise of a ruthless crime lord.",e
21,3 January 2015,Hitchcoc,8, One Man Show,So many have already commented on this movie that I don't have much to add. I just want to say that this violent black comedy has one of the most memorable characters in all of movies. It's also one of the most quotable films of all time. As the immigrant Tony makes his way to the top by dropping people in huge quantities and manipulating a system that plays into his hands. He is a juggernaut and why he rises as he does when he is often clueless is quite amazing...and we buy it. Pacino takes his Corleone character to the Nth degree by pretty much taking the humanity out of him. We love him; we hate him; but we certainly can't ignore one of the most off-the-wall performances of all time.,f
22,18 July 2014,SnoopyStyle,8, Gangster violence to a whole new level,"In May 1980, Castro releases thousands of Cuban prisoners including Tony Montana (Al Pacino) from Mariel Harbor. His friend Manny Ribera (Steven Bauer) gets a contract to kill a political prisoner for green cards for both of them. They're soon working for drug dealer Omar Suarez (F. Murray Abraham) to double cross some Columbians. Tony takes advantage and becomes a hit-man for big boss Frank Lopez (Robert Loggia). He is after Lopez's girlfriend Elvira Hancock (Michelle Pfeiffer) and his whole empire. His mother (Miriam Colon) disapproves of his work and tries to separate him from his adoring sister Gina (Mary Elizabeth Mastrantonio).",_
23,4 August 2013,Mr-Fusion,5, Lays it on pretty thick,"Walking away from ""Scarface"", I can't shake the feeling this is an operatic comment on the American dream, by way of a gangster movie at least; that an immigrant can climb his way from societal dreg to drug kingpin and get the girl on the way. That's powerful cinematic stuff, and I can appreciate that. I guess my problem is in the execution; Pacino's cartoonish performance, the drawn-out narrative, the unbelievably overbearing score. It's got a good cast and the personnel behind the camera is accomplished, but subtlety and nuance are not its virtues. Which I guess is the point, but it gets old after a while.",=
24,13 August 2015,BA_Harrison,9, Make way for the bad guy.,"Recently, Calais has been under siege from refugees/immigrants fleeing Eastern Europe/Africa, desperate to get into the UK via the Channel Tunnel. This put me in mind of the opening scenes of Brian De Palma's Scarface, in which thousands of Cuban refugees flood into Florida looking for US citizenship. Time for a re-watch, methinks (any excuse).",t
25,22 March 2009,dbborroughs,6, 25 years on the film is now more a parody than reality,"Unintentionally Hilarious but viscerally moving about Tony Montana from Cuba who comes to the US, becomes a drug lord, a junkie and dies in a spectacular shoot out. Brian DePalma's film remaking the Howard Hawks film from the 1930's works on some levels despite being so silly as to become a comedy. Blame Oliver Stone who's script is overly ripe. And Blame the cast who over acts like there is no tomorrow.I saw the film on Christmas day 1983 and was floored by it, even though I knew some of it was silly.(I thought it was one of the best films ever made) Watching it again for the first time in a couple of years I was horrified at how bad the film is. Yea the underlying themes and such are there but its so jumbled I'm amazed that anyone takes the film seriously. I have no idea why Montana is an icon for the todays gangsters since he is such a joke, unless they don't see it that way, or perhaps its like a childhood friend who loved the Rise and Fall of the Third Reich, or rather the rise, he totally ignored the fall. An important movie in the history of film simply because its become such a cultural touch stone. I think its now a violent joke.",t
26,4 November 2010,Ziya90,10, A misunderstood and very unappreciated film,"Scarface is a very violent and bloody film? No, it is not, even in its time. There is a very famous chainsaw scene, of course there are killings and gunfights, but these do not make the movie so violent and bloody. Especially, if we live in 2000s when some movies with extreme violence and blood have been made. For the squeamish, Scarface might be pretty disturbing, but otherwise it is just as violent as a crime movie. Then, why do people call especially Scarface violent and bloody while Goodfellas or The Godfather are violent and bloody too? I don't know. Secondly, as I see, some hate Scarface because according to them, some people, especially wannabe youths imitate the character, Tony Montana. However, the question is does it make the movie awful? Then, let's put all the gangster movies including The Godfather into a basket and then burn it. Scarface is a masterfully directed, masterfully executed, masterfully acted and visually so stylish crime film by Brian De Palma. Scarface is a so stylish movie from the cinematography to the art direction. As for the script, I think it is Oliver Stone's one of the best works as writer (especially in terms of story editing in contrast with Heaven and Earth) I agree that the movie is shallow throughout, but not flawed even a moment. It is 170 minutes approx. so as it is understood, it is an epic! What is the advantage of the long duration then? We can see the life of Tony Montana, Scarface in detail which means satisfying. The movie or the characters are not deep at all, but personally, I did not even mind it while watching, because everything else was great? By the way, sorry, but why did you expect a deep character study? It is a crime epic and if Al Pacino is one of your all time favorite actors like me and if you like De Palma's style, then there is no possible way to dislike the movie. If you did, then congratulations, you are one of a kind. Personally, I like De Palma very much, for me, he has more than one masterpiece in his filmography like Body Double or Casualties of War and Scarface is one of them. Now, it is time to talk about Al Pacino. However, before that I want to say that this is a fast moving and ''event driven'' movie, not a character driven movie, but still Al Pacino is great in this movie and he gives a great performance. Tony Montana is not someone likable, because he is always angry, so angry and he trusts nobody, but Pacino makes him one of the most remarkable (and likable?) movie icons ever. Therefore, by Pacino, Scarface was a character who I hate and also like. And there is a gunfight sequence, one of the best parts of the movie for sure, it recalls John Woo movies and it is almost obvious that Brian De Palma was inspired by John Woo. We are talking about one of the best gunfight sequences ever. It was a 'edge of the seat' gunfight sequence and it does not happen often! so the importance of that sequence especially comes from that, but of course also it is impressive, stylish and entertaining, if entertainment is the right word in this case. Lastly, I have seen the original 1932 version and it was excellent too. Both movies are excellent in its own way. It was an early Warner Bros style gangster film and and this remake is one of the best movies of all time too.",_
27,20 July 2006,ccthemovieman-1,8, Being A Gangster - It's Not All Glamor!,"I found this to be an interesting character study of a Cuban who comes to Miami and becomes a big drug dealer, rising from little to become a big-shot and wealthy....and then destroy himself. The movie got panned at the time of its release for its excesses in profanity and violence....but now since we've all become desensitized with decades of this stuff, the film is now almost reaching ""cult status."" Amazing. The critics, meanwhile, loved ""Casino,"" which - profanity- wise, made ""Scarface"" sound like ""Mary Poppins."" Go figure.",u
28,15 February 2021,nafps,4, The Worst Acting Pacino Ever Did,"Pacino's accent is so bad, bands have put out whole albums mocking it, with titles like Fush Yu Mang. It's still the gold standard for awful, awful accents, right up there with Dick Van Dyke in Mary Poppins.",r
29,12 September 2022,TheFearmakers,1, The Godfather's Dimwitted Brother,"SCARFACE has... or had, since this post has been edited for a long time... returned to the theaters, mang. The one starring Al Pacino, written by Oliver Stone and directed by Brian De Palma...",v
30,12 January 2008,rmax304823,7, Things Go Better With Coke,"The visual imagery is strikingly different from Howard Hawks' early 1930s version, but the plot is fundamentally the same, transposed from Al Capone in Chicago in the 1920s, through Tony Camonte and prohibition in the 1930s, to Tony Montana (Al Pacino) and cocaine in Miami in the 1980s. The protagonist begins as an ethnic nobody and rises to the top before being undone by his own reach. There's a sub-plot. A Latin kid falls for a trophy blond before returning to the girl who reflects his own roots, though she may be his sister.",
31,21 February 2005,Antagonisten,3, Over the top,"I had a lot of fun reading all the comments about this movie here on IMDb. It seems almost everyone agrees that this movie is a classic, almost to the point of being underrated (and a movie loved by everyone that is STILL underrated must be amazing!). I must say that i am of a different opinion. I would rather have to say that this is one of the most overrated movies of our time.",
32,25 March 2005,ereinion,10, De Palma's finest work,"SCARFACE is definitely Brian De Palma's best film and the only one that isn't flawed or too violent and disturbing. It follows the story of a Cuban refugee in Florida who eventually becomes a major drug lord through connections with a powerful Columbian cartel boss. His best friend is Manny, played by Steven Bauer in his best performance yet, who is the more humorous of the two and is the only man Tony can always rely on. More strong supporting roles by Loggia as Montana's old boss, Michelle Pfeiffer as his love interest, Mary Elizabeth Mastrantonio as his sister whom he is sickly protective of and a fine cameo by F. Murray Abraham as his ill-fated partner who gets whacked in a memorable scene.",
33,6 August 1998,Maniac-9,10, Pacino is simply masterful,"Scarface wasn't quite the movie I was expecting to see, but that's not necessarily a bad thing either.  I had been watching all the Godfather movies a few days before I first saw Scarface so I was expecting a normal kind of mafia story.  It's a crime story and all but not a mafia story, I thought it was cool as hell.   Al Pacino is such a great actor, he does like a metabolic change in each role.  He doesn't even seem to be the same actor.  You actually believe he is Cuban refugee just as in Godfather you can believe he is an americanized son of a Sicilian mafia don.  Plus I don't think I have ever seen a movie with nearly as many cuss words as Scarface before.",
34,6 December 2013,AaronCapenBanner,7, Tony Montana,"Brian De Palma directed this updated remake of the 1932 film with Paul Muni. Here, Al Pacino plays Cuban immigrant(and Castro political exile) Tony Montana, who arrives in America with his friend Manny(played by Steven Bauer) and immediately goes to work for the drug cartels, nearly getting murdered at first, but Tony is a determined survivor, and gradually works his way to the top of the Miami underworld, where, despite his wealth and beautiful wife Elvira(played by Michele Pfeifer) he finds himself bored and dissatisfied, though a betrayal of a rival crime boss and obsession with his younger sister Gina will prove to be his downfall... Though extremely violent and profane, not to mention long, this film is still a guilty pleasure, with a most entertainingly over-the-top performance by Pacino and energetic direction, plus a most glorious go-for-broke ending.",
35,18 December 2021,sayandutta-01381,9, Say Hello To Tony Montana !!,Probably the most iconic character played by Al Pacino in this Brian De Palma classic.,
36,13 August 2020,cricketbat,7," Impressive at times, excessive the whole time","I know a lot of people like Scarface, but I wasn't blown away by it. It's a pretty standard rise-to-power story that's excessive in everything it does. From the acting to the violence to the language to the drug use to the sound to the runtime, everything's over-the-top. I get that excess is the point, but it's just unpleasant to watch at times. Still, there are some impressive moments, and I think this film sticks the landing in the third act. I'm glad I finally got to say hello to Scarface, but I doubt I'll watch it again.",
37,26 January 2005,ScaRface90,10, This is GREAT,"Directed by Brian De Palma and written by Oliver Stone, ""Scarface"" is a movie that will not be forgotten. A Cuban refugee named Tony Montana (Pacino) comes to America for the American Dream. Montana then becomes the ""king"" in the drug world as he ruthlessly runs his empire of crime in Miami, Florida. This gangster movie is very violent, and some scenes are unpleasant to watch. This movie has around 180+ F-words and is almost three hours long. This movie is entertaining and you will never get bored. You cheer for the Drug-lord, and in some scenes you find out that Montana isn't as evil as some other Crime Lords. This is a masterpiece and i recommend that you see this. You will not be disappointed. 9/10",
