Review_Date,Author,Rating,Review_Title,Review,Review_Url
146,2 March 2021,calyeager,7, Death to mate in 3,"This was my first Ingmar Bergman film. I am not familiar with contemporary Swedish cinema or even most foreign language film, but The Seventh Seal was an easy film to enjoy. Each character occupies their own niche: Antonius with his need to know if god exists; Jons with his cynical and dark thoughts and actions that encourage other members of the band; Jof and Mia, each living life in a carefree and wholesome routine; and Death, unapologetic but unrelenting. Chess is a precise game that was designed to represent war and battle and Antonius knows that sometimes there is a tactical advantage to losing. I give The Seventh Seal a 7/10.",
147,13 May 2013,YasheshJ,8," A Knight, Antonius Block, returns to his homeland Sweden with his squire (Jons) only to find his country in the clutches of infamous plague","Plot: A Knight, Antonius Block, returns to his homeland Sweden with his squire (Jons), from a ten year long Crusade, only to find his country in the clutches of infamous plague--the Black Death (mid-1300s). On his journey home, he encounters the physical form of death itself (Bengt Ekerot) and engages him in an intriguing game of Chess to actually buy some time for some purpose of his.",
148,19 January 2018,zianimustafa,9, Det sjunde inseglet(1957),"The film begins, and the sky rises on us, and two people fall near the beach, and while in this silent silence there is a terrifying guest coming to them soon, comes the guest quickly and suddenly, ask the hero of the film Antonius Black who are you? I answer death! This is how the film starts with a shocking and breathtaking scene, a scene that critics have rated as the best opening in the history of cinema. Not surprisingly, they brought together people and death together. The film revolves around the return of the crusader Antonius Block to his country, Which leads people to believe that the resurrection has approached and became imminent, and then goes to Antonius great battle with the self in an attempt to search for answers about life and man, and the Great God!
My story with this film is long, and it started two years ago. At that time I was bored to the limit of those classic and traditional Hollywood and European films. I was looking for films about life, dramatic human and philosophical films. , I saw the film for the first time and did not like it, I grew up in Bergman Cinema and watched its greatest movies and then became very familiar with the ideas and films of this man, I saw the film again, and it became the second best film I have ever seen! , This is the Bergman Cinema, the films of this man are different from all the films, and my words are only evidence that Bergman Cinema and others contain a great deal of ideas and novels deep, and certainly will not appreciate his work in just one view.
I love Bergman,",
149,25 July 2013,tomassparups,9, Bleak beauty.,"I have stated many times that Ingmar Bergman is one of my favorite film makers of all time. I, like many others, see him as a visionary, a shining example of an amazing film maker. His films are like no other's, there are layers beyond layers that can only hope to be unraveled in his works. Few film makers have achieved such artistic success as Bergman and few ever will. Though his films may share similar themes, they all bear their own drastically defining characteristics. ""The Seventh Seal"" is a film I first saw nearly a year ago and did not fully appreciate until I revisited it more recently. Bear in mind that this like most or Bergman's films require multiple viewings to even begin a discussion. In the first scenes of the film we see a vast seashore and a knight awaking on it. He is approached by a mysterious hooded figure that reveals himself as Death. The knight, Antonius Block (Max Von Sydow) has recently returned from the Crusades to a plague infested Sweden. Death claims that he has come for him and that his time in the world of the living is up. In order to hinder Death's deed, Antonius proposes a game of chess between the two. If he is to win the game, Death will set him free. The film also follows a wide variety of other character's that towards the end come together. When reviewing an Ingmar Bergman film, I don't care to greatly indulge on the plot, especially with this film, as I fear it will take away from the film's charm.",
150,4 July 2019,thinbeach,7, To play chess with death,"On the surface its a simple film - set in the Middle Ages, with the black plague rife, a knight returning from the crusades questions his faith after being approached by the reaper, called death. That much is compelling, relatable for anyone who has questioned the afterlife, and immersive for the historical journey. The cinematography is superb, and atmosphere rich.",
151,5 November 2005,km_poonacha,9," cryptic , superb",The best thing about a really cryptic movie is that it can fork numerous interpretations. This is what I thought the movie meant.,
152,31 December 2014,kekca,9, My rating: 9,"Talking specifically about this title we should mention first the serious part, which I see in the deep commitment to God's Word. It is not by chance that the time in which the action takes place is the Middle Ages - as if the only intelligible world of man then was then religious one. And I must mention the burdens finale in which death refers all.",
153,3 May 2019,mql21,9, The cold truth about Death,When a wave of consciousness hits your mind and all of a sudden you're aware of your finitude and your inevitable death you feel cold and confused. You definitely feel the fear flowing through your body. This exact same feeling is what The Seventh Seal evokes throughout its scenes.,
154,11 July 2020,Nate-48,6, Too pretentious and lack of believability -,If you are going to be a great epic movie like so many have called this - the first 30 minutes can't be dull and utterly pretentious.,
155,29 December 2005,jeremy-liebster,9, Genius. An unexpected treat,"I had absolutely no idea what to expect when I rented this from the video shop. I'd never seen a Bergman film before and only knew that they came highly recommended. I went out for the night, came back very late, and thought I'd put the film on for a few minutes before hitting the sack. From the opening scene I was spellbound. An hour and a half later when the credits rolled I had the sensation that I had just watched something truly special. I was captivated by the beautifully constructed, hauntingly quiet scenes and the understated sense of foreboding that lingered throughout. I am pleased I had never before heard of the scenes of the knight playing chess with Death as for me they took me by surprise and were a delight. This is a wonderful film and I'm looking forward to seeing it again soon.",
156,8 May 2023,Mymoviediscography,9," ""The Seventh Seal"" - A Classic Masterpiece","Ingmar Bergman's ""The Seventh Seal"" is a timeless classic that has stood the test of time. The film is a hauntingly beautiful exploration of life and death, and its themes continue to resonate with audiences today.",
157,13 February 2006,soblessed,3," 8.4/10! That is Crazy,this Movie IS NOT ALL THAT!","Got this from my library and just watched it last night. After reading the reviews full of praises for it,I am disappointed! It is only a ""so-so"" movie in my opinion,certainly nothing great or even ""special"" in my opinion.",
158,4 June 2021,yoveikivi,10, Ingmar Bergman's masterpiece.,"A strangely life affirming movie about death. A very well acted and amazingly directed film. The play on shadows and faces is definitely the most unique i've ever seen. There is heavy symbolism and some very uncomfortable scenes, but I enjoyed it alot nevertheless, wait till your old enough, and then WATCH IT.",
159,28 September 2008,wes-connors,8, Death Becomes Him,"In middle of the 14th century, knightly Max von Sydow (as Antonius Block) and squire Gunnar Björnstrand (as Jöns), ""after long years as Crusaders in the Holy Land, have at last returned to their native Sweden, a land ravaged by the Black Plague."" Mr. von Sydow is immediately confronted by creepy, black-cloaked Bengt Ekerot (as the Personification of Death), who has appeared to claim von Sydow's soul. Instead of going quietly into the final night, von Sydow challenges Mr. Ekerot to a game of chess. ""Death"" is in a playful mood, and accepts the contest; if von Sydow wins, he and his friends may avoid the Plague.",
160,3 July 2001,jeff_johnston,10, an interesting note,"There seem already to be a lot of good comments (although some may be overstated). The only thing I believe I can really add is an interesting note about the circumstances of the film: it's one of Bergman's earlier films, and Bergman later almost disowned it (along with ""Wild Strawberries"") because he believed that their subject matter was unimportant. He was ""much happier,"" he said, after he left behind the agony of the quest for God and became a secular humanist.",
161,19 May 2020,h-28658,8, One of Bergman's best.,Every time I watch Bergman's existentialist masterpiece I discover something that I've overlooked before or had understood differently the previous time I watched.,
162,20 July 2007,writers_reign,8, Righters Block,"I don't know about you but there are still several films that everyone and his Uncle Max seems to have seen but me. On the other hand I am gradually making headway via DVD, revivals, festivals, etc. Time was I felt deprived because I hadn't seen Citizen Kane, Casablanca, It's A Wonderful Life, The Wizard Of Oz, for God's sake but like I say they're all now safely under my belt and I feel the better for having caught up with them eventually. In the case of Bergman it's not just The Seventh Seal but practically everything he ever made that, for one reason or another, I haven't seen; in fact off the top of my head I can recall seeing only Smiles Of A Summer Night and Autumn Sonata. Nor, if I'm honest, have I made any great attempt to watch him, most of the films are now available on DVD but I'm not exactly breaking a leg rushing to Virgin, FNAC or HMV but now The Seventh Seal has just opened commercially in London so, along with 8 other people I checked it out, exactly 50 years after it was released. The first thing I noticed was that it's not quite as grim as I had supposed and nor is the celebrated chess game given that much screen time - from all I'd read over the years I'd imagined a fairly static movie with these two symbolic characters trading moves for 90 minutes. Taint, so, honey, taint so. Following some portentous music we find ourselves on a craggy beach where the knight, Antonius Block, is resting. Beside him on a piece of fairly flat rock a chess board has been set up. This is a pretty unrealistic image with which to kick off a non-comedy film because no normal person would set out a chessboard in such an inhospitable place where the more or less constant wind would scatter the pieces every which way in nothing flat. So now Bergman has to get us past this incongruity and I guess that having 'Death' appear in human form and accepting a challenge from Block - who can forestall his date with Death for the duration of the game and even cancel it altogether should he win - is as good a way as any. We then accompany Block and his squire as he returns home after ten years away from his wife - he's been to the Crusades if anybody asks you - which immediately reminds us of Agammemnon returning home to HIS wife after ten tough years in Troy and the Fall of the House of Atreus is as nought compared to the angst that visits Block. The images are striking at times, the acting is more than accomplished and in fact the only jarring note is just that, in fact not just one note but the several that make up the score which has a habit of SHOUTING at us when it wants to underline something instead of employing a more subtle approach. It's nice to be able to cross it off my list but I won't be breaking my neck to see it again and nor am I likely to buy the DVD.",
163,19 May 2019,Benjamin-M-Weilert,8, Much more than its famous scene.,"While the first 5 minutes is among the greatest scenes in film history, and has been referenced by a gamut of other films, ""The Seventh Seal"" is much more than this famous bit. In fact, this film about death has a lot to say, and even if some of it is pretty tongue in cheek, most of it is very poignant.",
164,13 July 2012,johnhirsch22,1, Do not waste your time,"It actually pains me to give this film a rating of 1/10. It truly deserves a negative number of stars. I did see a lot of potential, but it was simply not executed well. Most of the film is not at all interesting and the exciting scenes of interaction between Block and Death are very few and far between. I suspect that had I been high on every drug known to man during the time when I watched this, it probably would have been good. Perhaps I am not enough of a hipster/artist in order to truly enjoy this. I just thought I should post my response since I felt misled by the reviews, which were overwhelmingly positive. Also, I had issues with the quality of the film itself which repeatedly stalled and became pixilated. This did not affect my review in anyway, however, I want to give a heads up to all the Netflix users out there because I know that I am not the only person who had an issue with the quality of this film. Don't waste your time.",
165,15 January 2017,rafael_jaramillo_avellan,10," Deep, reflexive and thought provoking. Ingmar Bergman's eternal search shaped into motion picture.",The movie that gave us the Grim Reaper as we know it today. ,
166,7 April 2021,Gates82,1, One of the top 200 movies on IMDB??? More like the top 200 worst movies ever!,"I have no idea how anyone can give this movie a top rating to make it one of the top movies of all time. This was one of the worst movies that I have ever seen in my entire life. Actually, it may be the very worst. This movie made no sense, and was an absolute ludicrous depiction of the actual description of the movie; they showed no happenings of the possibility of judgement day being remotely close. If they are going to try and convince the audience about the 7th seal, add a plot that involves it. This movie reminds me of something that William Shakesphere would write, only it would make a little more sense than this. How can anyone call this movie a masterpiece? I cannot believe how bad this film is.",
167,25 April 2020,dommercaldi,9, A Near Ingmar Bergman Masterpiece Revolving Around Death,"Pros:
1. The soundtrack and score helps to smother the film in a heavenly and otherworldly atmosphere.
2. The costume and set design is done perfectly and they build up the medieval European world brilliantly.
3. The cinematography is beautiful, especially when the camera pulls back to show the viewer gorgeous shots.
4. The dialogue is mesmerisingly poetic and it flows elegantly.
5. Max von Sydow (Antonius Block), Gunnar Björnstrand (Jöns, squire), Nils Poppe (Jof / Joseph), and Bengt Ekerot (Death).
6. The to-and-fro between Death and Antonius Block is extremely enthralling to watch.
7. The humour is inserted sporadically, but it never fails to induce a chuckle without being overbearing.
8. The movie serves as a wonderful allegory on how humans respond to death, whether that be to sacrifice themselves for others; intensely fearing death; acting indifferent towards it; maybe even welcoming it; or even treating it with a good sense of humour.",
168,10 November 2013,jackasstrange,9, A classic of the European cinema,"Seventh Seal is another great work of the excellent Sweden director Ingmar Bergman. Not only it's deep discussions about the fear of the death are extremely interesting,actual themes(the middle age was used as a allegory of the world 'situation' in 1957, when all the persons feared an imminent death, due to the cold war), but is also vastly rich in meanings at every single shot. I mean, nothing in it seems to be there without any reasons or a deep meaning. Maybe i'm reading too much on it, but maybe not. Remember that we are talking about Ingmar Bergman. And technically it is, as well, a very well made film. A beautiful film, in fact. The cinematography is stunning, with some wonderful shots, it has an impressive work in the edition as well, a very macabre soundtrack, which adds a certain dark(even darker) atmosphere to the film. The acting is impressive, a bit over the top, but still good. It may be not 100% entertaining all the time, but I'm sure that it can be an easily watchable experience even for those who don't have that much interest in this kind of films. Also, we have one of the most remarkable moments in cinema history here, when the cross soldier plays chess against the death. Absolutely fantastic. If you haven't watched it yet, i highly recommend you to do so. Deserved 'classic' status. 8.8/10.",
169,29 March 2001,Colonel_Kurtz,10, Truely a Masterpiece,"In an age where special effects capture the eyes and screenplays are weak it is easy to overlook this masterpiece. Before ""Life is Beautiful"" and ""Crouching Tiger, Hidden Dragon"" where hailed as foreign masterpieces(and also terribly over-rated) there was ""The Seventh Seal"". This picture contains the greatest screenplay ever. The poetry and symbolizism that is hidden in this film amazes me. How people hail ""The Matrix"" as a movie that is able to do this confuses me(I hate The Matrix FYI)? The Seventh Seal proves that special effects are not needed nor will they ever will be to make a masterpiece. The image of death haunts me, with his pale white face and long black robe. This is picture filled with the horrors of life, the apocalypse, for the black death has come and few can accept that. Before you go out and cast your vote for modern films, it is suggested you see this, for it is truely the greatest foreign film ever made.",
170,2 February 2020,Easygoer10,9, Brilliant! Ingmar Bergman Directing 28 Year Old Max von Sydow,"A terrific film. As I wrote in my title, you have a 28 year old Maxwell von Sydow being directed by one of the greatest directors in history. 16 years later, von Sydow had a large role in what I believe to be the most profound role of his career: William Friedkin's masterpiece of horror, ""The Exorcist"" (1973). To this day, it is still the most terrifying film in cinema history. The second most terrifying is Ridley Scott's ""Alien"" (1979). I saw both when they were released on the big screen. People ran out screaming halfway through, in some showings. Regardless, this is an early example of von Sydow's brilliance. We get Ingmar Bergman directing Max von Sydow. What more can you ask for? A must see film.",
171,12 August 2002,WRVavra,10, Missing the point?,"Some previous comments have said that the knight attempts to cheat Death, but is ultimately cheated himself.  Maybe I'm wrong on this one, but from the church scene on I never got the impression that the knight intended to win.  When Death takes his knight as they play shortly after meeting Jof and his family, Block replies ""...as you were meant to.""  No one so far has commented on this line, but it seems to me to be talking about a bit more than one move in a chess game.",
172,1 November 2003,Flubin,10, Why is Bergman out of favor?,"Having discovered Bergman as a teenager in Philadelphia, in double-headers at the old TLA cinema on South Street, and having such a hard time these days ""selling"" him to my film history students, and why he seems to have come out of critical favor.  As for my students, it's more than the usual black and white, strange language problem that all film teachers now recognize.  It seems to me to be part of the post-modern ""understanding"" that all meaning is as random as any other meaning, and that the search for God is a fake.  In many ways I accept that notion, as it does fit in with the way the universe seems to be.  My students watch Antonious Blok, and don't understand what his problem.  (Bergman did understand that view, and created the character of Jons the squire, as a fill-in for the modern cynic.)  Each time I show the film, and see it again for myself, I ask myself if in really is more than my own 60's romanticism, when we were discovering life.  There are some films which I stop showing.  However, my appreciation for ""The Seventh Seal"", and for Bergman, grows, and I feel it is time for a renewed interest in his films, in spite of our post-modern cynicism.",
173,29 December 2010,idontknowiknowthatidontknow,1," oh, the horror!","this is one of the worst movies i have ever seen. i watched this with high expectations years back since it was rated incredibly high(above 8.5 i think). but it turned out to be crazy boring. BORING, LET ME SAY IT ONCE MORE B-O-R-I-N-G. oh my gosh, this movie was so boring i was stunned, i mean, oh my gosh. OK so there was a plague in Europe in ancient times, what of it? it's like the director is an opera director and is having trouble adapting the thing on film, hello, you're suppose to make the film interesting and emotional. horrible horrible. i get it, people are falling like flies during the black plague, is there anything else you want to show? death? a guy with a black robe? DON'T WATCH THIS, PLEASE DON'T. horrible! nothing happens, absolutely nothing.",
174,1 November 2008,paul2001sw-1,8, Death laughs last,"In a land ravaged by pestilence, superstition and death, Max von Sydow plays chess with a personification of the latter; this is what everyone knows about Ingmar Bergman's legendary film 'The Seventh Seal'. What comes as a surprise it that the movie's most iconic image comes in the very first scene; that the philosophical debates take the form of wisecracks; and that Max von Sydow's character is actually among the least interesting in the story. Indeed, with a measure of (deliberate) overplaying, a mediaeval setting and some surprisingly bawdy and direct humour, the film even resembles one of Shakespeare's comedies, albeit an unusually black one. The sub-plot about a group of actors making a play about death, a story within a story, seems especially Shakespearian. I'm not sure this is really a great film, but it manages to be consistently bold and surprisingly entertaining. Even though death, played with superb understatement by Bengt Ekerot, always gets the last laugh.",
175,27 August 2021,jack_o_hasanov_imdb,8, Very Good,It has an interesting subject. I don't regret watching.,
176,14 February 2010,Eumenides_0,10, Human Existence Inside a Movie,"In Ingmar Bergman's classic meditation on God, the viewer follow the return of knight Antonius Block and his squire, Jons, from the crusades. The world they return to is filled with death and ugliness, as the Black Plague rages through and flagellation has become a way of life. Block then meets Death and what follows is the now legendary game of chess between a mortal and the Grim Reaper. While the game lasts, Block remains alive, so he travels on.",
177,12 September 2005,flingebunt,7, The problems with legends,"There are some films that become legends. Few people see them, but many people know of them. The Seventh Seal is one of them. Full of images and iconography from medieval frescos, it tells the story of Knight and his squire returning from the crusades and their journey home across plague ridden medieval Sweden.",
178,7 September 1999,khnemu,10, This film makes me proud of being Swedish.,This is one of the best yet. It's one of the few things that makes me proud of being born in Sweden. It's Bergmans best maybe Nils Poppe could have been a little more serious but I guess that's how he acts. The grim reaper always send chills down my spine especially that scene when he's playing chess with Max Von Sydow (The Exorcist). So if you like Swedish black and white movies about the black death and the joy of life you should really.....you know the rest.,
179,18 July 2020,SAMTHEBESTEST,7," Bergman's depressive, Byzantine and intricate speech on ultimatum of Death","The Seventh Seal (1957) :
Brief Review -",
