Review_Date,Author,Rating,Review_Title,Review,Review_Url
0,25 July 2002,Quinoa1984,10, The Quintessential Bergman Picture,"One thing that can be certain after watching the Seventh Seal, outside of being thankful for living in this century, is that Bergman knows his film-making- and imagery.  He uses subliminal and not so subliminal techniques to convey a dying, frightened world, where making a living is almost impossible and the debate of god's control over life is discussed like un-rhyming yet fascinating poetry. ",/
1,1 January 2005,ACitizenCalledKane,10," Ingmar Bergman questions the meaning of life, death, faith, and the existence of God in this masterpiece of world cinema...","Antonius Block - ""Who are you?"" Death - ""I am Death."" Antonius Block - ""Have you come for me?"" Death - ""I have long walked by your side."" Antonius Block - ""So I have noticed.""",r
2,21 April 2020,Xstal,10, The Curse of Existence...,"An abstraction of your fears, conjured progressively through years, walks beside you every day, may cause some to halt, then pray; it's a demon that's passed on, through generations come and gone, as fixed and certain as the tide, nowhere for you to run, or hide; is there a game that you can play, that extends your time and stay, with instructions and some rules, that don't leave you, as the fool; can the clock that's counting down, tick half as fast before you frown, and gaze with stoical askance, as you begin, your macabre dance.",e
3,24 January 2003,RWiggum,10," Grim, but not entirely hopeless","Middle Ages: Antonius Blok, a Swedish knight, returns from the Crusades only to find his country dying of the plague, religious fundamentalists taking over and Death himself wanting him to come along. Antonius challenges Death to a game of chess and is meanwhile driven to desperation because of the absence of God. This description sounds like a very serious, philosophical and dour film, and actually it is serious, philosophical and dour; but there is also a little warmth, hope and humor, maybe not for Antonius, but for the viewer.",v
4,12 January 2017,elvircorhodzic,9," ""I want knowledge! Not faith, not assumptions, but knowledge.""",THE SEVENTH SEAL is a film that presents a dramatic fantasy game between meaning of life and fear of death. A knight and his squire have returned to their country after a ten-year crusade. Deadly disease ravaged country. Knight faces Death. He calls Death on the multi-day game of chess...,i
5,4 November 2000,jhclues,10, Compelling Drama From Ingmar Bergman,"A compelling contemplation of death and the nature of Man's existence, Ingmar Bergman's `The Seventh Seal' is uncompromising, riveting drama that is every bit as striking conceptually as it is philosophically.  In the Fourteenth Century a knight, Antonius Block (Max von Sydow), and his squire, Jons (Gunnar Bjornstrand), have returned after ten years away at the Crusades to their native Sweden, and are beginning their journey home.  For Block, it is a pensive time; he is troubled by what he perceives as God's silence, and thirsts for knowledge and some meaning to his life, as well as a resolution of faith, which has deserted him.  Jons, meanwhile, is a study in jaded indifference, who believes in nothing beyond the present and whatever his senses and current circumstances dictate.  Shortly after their arrival on the coast of Sweden, Death (Bengt Ekerot) comes for Block.  But Block strikes a bargain with him, challenging him to a game of chess, to be played as they continue on with their journey.  As long as Block prevails, they will go on; if he wins, he will be released.  And though Block knows what the outcome must inevitably be, he welcomes Death's acceptance of his challenge, for the game affords him perhaps enough time to fulfill his quest, while adding purpose to what promises to be an arduous trek through a land being ravaged by the Black Plague. 	Von Sydow brings a commanding presence to the screen as Block, his very countenance bespeaking strength and poise.  His subtle, stoic approach to this enigmatic character is captivating, and lends a depth and dignity that makes Block truly memorable.  By contrast, Jons' strength seems born of his indifference; he takes things as they come, and is governed by a somewhat fatalistic philosophy.  Bjornstrand, a gifted, eloquent actor (and veteran of numerous Bergman films), invests an earthy, gritty quality to Jons that plays effectively opposite von Sydow's more ethereal portrayal of Block.  It is significant that in the closing scene the final speech, in the presence of Death, is accorded to Jons; for it elevates the character to a station equal to, if not surpassing, that of the protagonist, Block. 	The supporting cast includes Nils Poppe (Jof), Bibi Andersson (Mia), Inga Gill (Lisa), Gunnel Lindblom (Girl), Anders Ek (The Monk), Ake Fridell (Plog) and Erik Strandmark (Skat).  Written and directed by Bergman, `The Seventh Seal' is a thought provoking, earnest meditation on faith and mortality that is filled with stunning metaphoric and visual images that will forever be indelibly inscribed in your memory.  One scene in particular, in which the players link hands and, silhouetted against a twilight sky are led by Death in a dance across the crest of a distant hill, is breathtaking in it's simplicity.  It stands (as does this entire film) as an example of why Ingmar Bergman is one of the greatest directors in the history of the cinema.  I rate this one 10/10.",e
6,6 September 2005,bsinc,6, Didn't like it but will definitely see it again in the distant future,"First of all, I have taken the time to read some posts on this movie before writing my review because I was searching for lots of answers. Didn't get many though, the popular thing fans like to say (and please, no pun intended) is that it just takes time to understand and appreciate this movie. To this I quickly reply that my perception of ""Det Sjunde Inseglet"" was that it is a rather dull, if not eventless, movie. It has some really nice moments (and for some reason I really liked the concept of a man playing chess with death itself) but in the end almost nothing is resolved except from the main protagonist who, at the brink of his death, discovers that it's love that makes people want to live ,very roughly put, I apologize, but even this revelation was hidden from the writer of this comment. And this is what bothered me the most, I couldn't read (for the lack of a better word) any of these important details, the movie very coldly rolled in front of my eyes and I just didn't get it! Now the easiest and dumbest thing to say is that this is all the fault of the director for not having a more universal way of film-making, rather the viewer has to decipher such information if he wants to fully appreciate his movies. I've just realized that I could say the same for Kubrick's visionary movies, I didn't like most, scratch that, none of them the first time around, they grew on me after a second viewing. And I dig Kubrick, a lot!!!",w
7,19 November 2003,Captain_Couth,10, Top ten favorites. The Seventh Seal.,"Seventh Seal (1957) is one of my favorite movies. I have to rank it up there with A Touch of Zen, Seven Samurai and Battleship Potemkin. If there ever was such a thing as a perfect film, this one would have to be a nominee. I've never seen such a picture (and I probably never will) that was so moving, well shot, written, acted and directed. The chess game between the knight and death is an all-time classic. Words cannot describe how great this film is. There will never be another one like it. Truly amazing piece of celluloid.",/
8,31 August 2012,TheLittleSongbird,10, Fully deserves its rep as a masterpiece,"This is one amazing film, and in my view Ingmar Bergman's best. Visually, The Seventh looks wonderful, the bleak scenery adds much to the mood, the cinematography is beautifully composed and skillful and the lighting is atmospheric. It also has many memorable images like with the flagellates, the hawk flying in the cloudless sky, Jof's vision of the Virgin Mary and the milk and strawberries in the dusk. Bergman's direction is superb, Erik Nordgren's score is resolutely haunting and the dialogue is some of the most thought-provoking I've heard with some nice bawdy humour with especially the squire that doesn't feel misplaced. The story is like an allegory and meditation of life, death, love and fear(amongst other things), and it is dealt with in a very intelligent and careful manner. Again there are some timeless scenes like the ending, the scene of the girl about to be burnt, Death being challenged to a game of chess and with the jester. The acting is also exemplary, Max Von Sydow gives one of cinema's finest performances, stoic yet always commanding with a face that speaks volumes about what he's thinking. Bengt Ekerot evokes chills as Death, while Gunner Bjornstrand is suitably dry as the squire. All in all, a really amazing film, fully deserving of its reputation. 10/10 Bethany Cox",r
9,5 September 2006,Doylenf,6, Death never takes a holiday...,"While I'm not going overboard in extolling the virtues of THE SEVENTH SEAL, I do think it has some striking imagery and had the potential to be the ultimate work of art Ingmar Bergman was obviously striving for. But do I think he achieved it? No...for the simple reason that it leaves us unenlightened on the subject with no new knowledge.",w
10,8 February 2009,JoeKarlosi,5, The Seventh Seal (1957) **,"Let me make this pretty quick -- a friend brought this Ingmar Bergman ""classic"" to the house last night (on Blu-ray), and it was my first experience with this acclaimed filmmaker. All I can say is, I was immediately struck by the cinematography, and I started getting interested in the idea of a knight (Max Von Sydow) playing chess with ""Death"" himself, as a means of deciding the fate of his own soul.... but that's as far as it went.",2
11,9 October 2014,Lejink,3," Death takes knight, checkmate.","I suppose one has to view the reputed great classics of cinema to sort of test one's critical faculties against established standards and coming to this iconic film I was certainly aware of some of its famous imagery, in particular that of the soldier playing chess with Death, but nothing more than this. It does make for an arresting start to the film but after that I found it rather heavy going I must say.",6
12,13 June 2005,planktonrules,9, Really weird but worth seeing for the experience,"This is a strange movie--period! However, it is also one of the most parodied films and for that reason alone it is worth seeing! Now, on to explain the part that is parodied: A man is returning from war in the time of the Reformation and the plague is about the countryside. The man meets the Angel of Death and is told it is him time to die. The man asks if he can first challenge him in a game of chess--if the man wins, then his life will be spared. The Grim Reaper, not wanting to be a spoilsport, agrees and they play a game that starts and stops again and again. This exact same contest has been used in Bill and Ted's Bogus Journey, the cartoon series The Grim Adventures of Billy and Mandy, and an experimental film De Düva: The Dove (starring Madeline Kahn among others). In the Bill and Ted movie, they did not play chess but a series of games including Battleship and Twister! In The Dove, it was a badminton game! I can't remember what the game was in the cartoon series, but instead of their deaths, the children played the Grim Reaper over the soul of their pet hamster! Isn't is weird how this art film has appeared again and again and in the silliest of places! Give it a try to see the FIRST death-match and because it is a good film--with excellent performances all around--from Max Von Sydow to all the supporting players. Also, do not give up on the film too quick--I did and only saw it all years later when my sister-in-law convinced me to give it another try!",1
13,23 April 2006,johnmbale,10, Bergman's Brilliance Abounds,"What makes The Seventh Seal - an apocryphal and uncompromising fable of medieval Sweden - one of the masterpieces of Cinema ? Ingmar Bergman creates a believable world of dark happenings, wherein Death can play chess with a Knight, witches burn at the stake, with flagellants, and plague ever present. Through superb black and white images, each carefully composed for maximum effect, sets and costumes, his fine actors seem to truly inhabit this frightening world. Max von Sydow, Gunnar Bjornstrand, and Bengt Ekerot lead a marvelous cast. But its not all doom and gloom, as the Knight tries to determine in his quest, the meaning of life, and if God exists at all. There are moments of sheer happiness and peace, such as the sequence of the milk and strawberries at dusk, and a number of bawdy comic moments throughout the film. Which balances the darker side. It is unforgettable and I still remember seeing it on its first release, being stunned by the quality of the photography, and the performances. A restored version on DVD is recommended. Bergman is one of the great film makers of our time. Seldom today do we see such precise and considered images on the screen. Not to be missed.",0
14,15 February 2002,snazel,8, A Very Personal Rejection of a Religious Childhood,The story of Antonius Block is the story of an agnostic who has begun to doubt. ,0
15,26 December 2016,classicsoncall,9," ""I live now in a world of phantoms, a prisoner of my own dreams.""","On the Criterion Collection interview with Ingmar Bergman, he relates that he wrote the chess scene over his own fear of dying. This would have been an immensely interesting idea to explore, but after he mentions it, the interview is practically over. That left me rather frustrated.",2
16,9 December 2004,FilmOtaku,8, Intelligent and accessible with incredible imagery,"'I live now in a world of ghosts, a prisoner in my dreams', a line spoken by Antonius Block (Max Von Sydow) in 'The Seventh Seal' is also a good descriptor of this critically lauded film. Directed by Ingmar Bergman, the film explores, through an allegorical fashion, human relationships and the struggle with ones own psyche. Block is a knight on his way home from the Crusades who becomes increasingly disillusioned while surveying his country, which has been ravaged by the Black Plague. Along the way he avers that he doesn't care about anyone, and questions the existence of a God who could allow these things to happen. In the beginning of the film he meets Death, who informs him that it is his time. Block manages to push off Death for a little while by distracting him with a chess game while he travels home; encountering several different characters, but Death is always following close behind until the inevitable end of the game. ",0
17,7 January 2010,kenjha,5, Everything but the Kitchen Sink,"It is said that one can't avoid death and taxes. In this much praised allegorical film, a man tries to avoid death. Perhaps a film about a man avoiding taxes would have been more amusing. This film is episodic rather than having a narrative flow. It seems Bergman made a checklist of all the important themes and made sure he touched each one: love, marriage, infidelity, family, society, crime, punishment, and, of course, god and death. It is populated with Bergman regulars, including von Sydow as a knight who spews platitudes every time he opens his mouth. The cinematography is impressive. Otherwise, it's tough going for those who are not Bible scholars.",/
18,21 May 2019,GiraffeDoor,3, I keep an open mind often enough. I'm calling this one out as superficial.,"For a movie in which a knight literally plays chess with death, this is pretty bland.",?
19,24 August 2014,marcin_kukuczka,9, Modern Disillusion Confronts Medieval Reality,"Ingmar Bergman's world acclaimed 'masterpiece' as a ""self written and self directed allegorical film"" (Bosley Crowther, New York Times) is among the most discussed movies that provokes controversies. Although more than half a century has passed since its premiere, we can bravely quote Peter Bradshaw (The Guardian) that it is still ""an untarnished gold standard of artistic and moral seriousness."" THE SEVENTH SEAL turns out to speak to the minds of modern viewers even more powerfully than it did in the late 1950s.",r
20,25 November 2016,Prismark10,6, The endgame,"The Seventh Seal has been influential to many filmmakers. Parodied in Bill & Ted's Bogus Journey, inspired Roger Corman's version of The Masque of the Red Death.",e
21,6 August 2012,Leofwine_draca,9, Thought-provoking and profound,"THE SEVENTH SEAL is Ingmar Bergman's meditation on Christianity and death, told through the tableau of a medieval setting and a mixed bunch of players on the stage. Max von Sydow headlines the cast as the Crusader knight who famously challenges Death to a game of chess, and the film follows his ruminations as well as the lives of others caught up in the same time and place.",f
22,2 July 2010,khanbaliq2,10, A skillful blend of realistic drama and the allegorical.,"Death comes for a knight (Max von Sydow), who challenges him to a game of chess while trying to postpone his end by showing him illustrations of goodness in mankind.",_
23,30 January 2007,ma-cortes,8, The SEVENTH SEAL is a breathtaking masterpiece with great international impact by the genius Bergman,"The film is developed in the Dark Ages , when a plague of pest sweeps throughout Europe , raging all around . A dreary , sad and disappointed knight (Max Von Sidow) is returning from the Crusades along with his squire (Gunnar Bjornstrand) . Meanwhile , he meets Death (Ekerot) who challenges him and they play a chess game . The stakes result to be the followings : If the knights wins , his life and his companies will be spared . Death offers him a reprieve where he deals with discussion of religion , God , his existence and personal demons . Besides , he knows a troupe of minstrels formed by a marriage called Joseph (Nils Poppe) and Mia(Bibi Andersson), among others .",=
24,7 January 2010,freemantle_uk,10, Film as an art-form,"The Seventh Seal is considered on of the best Swedish film ever, and Ingmar Bergman is certainly the most famous filmmaker out of that nation. The Seventh Seal is easily a great example of art-house film making done right.",t
25,21 February 2006,Polaris_DiB,9, Imaging Death,"This is one of those movies, like Seven Samurai, where you watch it for the first time, following one character, and suddenly not-quite-midway through you realize that every character is important and intricately linked into the progression and exposition of the story and themes, so you know before you've even finished that you need to watch it again.",t
26,6 October 2010,rmax304823,10," Eat, Drink, and Be Merry.","I remember seeing this for the first time in Los Angeles and emerging from the theater shocked, scared, and thrilled, as if I'd just viewed my first autopsy. There had never been anything like this allegory before, although there have been imitations and parodies since -- Monty Python, Woody Allen.",_
27,16 November 2015,Seraphion,4, It's quite a mediocre,"This may be because I've seen other 'talks with Death' movies such as Meet Joe Black, but I find this movie as mediocre at best. Yes the world depiction hit its mark very well, making the audience feel like they sunk into the gloomy world. But for me that's because the whole black and white color and the recurrence of the Death character. The main plot with Blok feels like it'll make this movie a challenging watch to those who pride their faith. What made me rate it a score f 4 is the sub plots that makes this movie look simply stupid. Again maybe this is a cultural gap issue between me and 1950s Sweden, but I fail to understand how Plog's stupidity can have a good impact to the whole story. One thing to add is that I tend to agree with the opinion about the acting. Max von Sydow and Bengt Ekerot did a splendid job in their roles here that helped a lot in setting up the movie's mood.",u
28,2 January 2017,moonspinner55,7," ""You are black."" .. ""It suits me well.""","Ingmar Bergman's career of brooding cinematic successes was practically borne here, in an amazing study of doomsday travelers in 14th century Sweden confronting their mortality. In the age of the Black Plague, the streets are filled with pagans, drunks, artisans, performers, religious zealots and volunteer witch-burners; a knight and his squire, home from the Crusades, stop at the ocean, where a most benign Grim Reaper tells the knight he has been at his side for a long while. They engage in a winner-take-all game of chess, though the knight is just biding time to save the friends he has made from Death's clutches. The barbarism and cruelty aside, writer-director Bergman does show a streak of pithy black humor, resulting in some amazing sequences (such as the juggler cut down from a tree by Death and his scythe). The overlay of brutality in the name of Christianity, the torment of faith and the heavy symbolism are often tough to wade through, while the metaphor of the chess game has left the picture open for parody. Still, ""The Seventh Seal"" is a must-see film, matching its iconic imagery with themes of the eternal struggle. *** from ****",r
29,8 September 2010,st-shot,8, Death match Medieval,After ten years of futility in the Crusades Antonious Block and Squire Jon return home to be greeted by the plague and Death in its most recognizable human form. He has come for Block and the disparate group he travels with but is held up from this task when Block proposes a game of chess to avoid annihilation. Encountering communal responses to the plague as they travel along Block buys time clumsily attempting to stall the match after unwittingly revealing his game plan. ,v
30,4 June 2007,Galina_movie_fan,8," Antonius Block: ""I met Death today. We are playing chess.""","Dark, beautiful, meaningful, exploring the most serious themes of faith and searching for God, ""The Seventh Seal"" is known as one of the landmark Bergman's movies. One of the film's inspirations was a painting that Bergman saw as a young boy and was transfixed by: ""There was everything that one's imagination could desire. Angels, saints, dragons, prophets, devils, humans. There were very frightening animals: serpents in paradise, Balaam's ass, Jonah's whale, the eagle of Revelation. All this was surrounded by heavenly, earthly and subterranean landscapes of strange yet familiar beauty. I remember Death playing chess with a Crusader, Death sawing at a tree to a branch of which clung a naked man with staring eyes, and across a gentle hill Death leading the final dance towards the dark lands"" (Bergman in Hart). The film follows the journey of a knight Antonius Block (Max Von Sydow) returning from Crusades through Sweden ravaged by plague. The knight has lost his faith in the blood and horrors of the battlefield, ""Faith is a torment. It is like loving someone who is out there in the darkness but never appears, no matter how loudly you call."" On his way home, he encountered people dying from starvation and disease, being burnt as witches as well as Mr. Death himself who challenged him to play a game of chess and the family of a happy juggler, his wife, and their infant son. This family is happy because they love each other. They represent the simple joys and hopes of ordinary life. ",
31,24 April 2010,JoeytheBrit,9, Medieval Road Movie,"Back from the Crusades (where he no doubt carried out some unspeakable acts in the name of God) Antonius Block (Max von Sydow), discovers his homeland ravaged by the plague as he struggles with a crisis of faith. As if that wasn't bad enough, he also runs into Death on the beach, and challenges the reaper to a game of chess to buy himself a little time as he wrestles with metaphysical conundrums. The duel, played on a beach beneath lowering skies, provides us with one of cinema's enduring images and, perhaps, misleads us about the true nature of Bergman's film. I'd always assumed it to be a grim, dour affair with dull, lengthy periods of intellectualising. Well, the film is certainly bleak, but it's also completely absorbing and rewarding.",
