Review_Date,Author,Rating,Review_Title,Review,Review_Url
252,14 August 2021,x_manicure_x,8, Memento Mori,"""The Seventh Seal"" was probably my worst nightmare during high school. Not just because our teacher would play it billions of times, but especially because it infected me with existential angst a little earlier than I hoped. It's a film that raises many questions but gives no answer. You could be the earthy and cynic squire; you could be the noble knight always seeking spiritual meaning in life - in the end, the only certainty will be death. Still, the ending feels strangely reassuring for a Bergman film, as if he was trying to convince himself that death is not to be feared but accepted as one inevitable part of life, that the world will keep going on after our time has come.",
253,14 November 2021,iracek,2, Pseudo Intellectual,"I ended up watching this because I was intrigued by the premise of a man playing chess with Death for his life and I frequently like old movies, especially classics. How disappointed I was to find everything good about the movie happens on the beach or surely thereafter.",
254,10 June 2015,joehemmings68,9, An Icon of Cinema History,"There are moments in the Seventh Seal that are as good as anything else in cinema history. Images so striking and memorable that they linger with you always. Moments of dialogue that fit absolutely perfectly that hit you with a sudden power. This film is one of the most poignant reflections on life, death, and Religion. The mood of the film reflects that, moving very swiftly from joy to dark fear.",
255,16 November 2015,singlespeedcheetah,10," First films were art, then sound was added. Now they are art again.","The film ""The Seventh Seal"", directed by the fantastic Ingmar Burgmann, is a film that is a long and moody rumination on religion and what occurs, if anything, when one no longer adheres to one's religion. Set in medieval Sweden the main protagonist is Antonius Block, a knight returning from the crusades, an ostensibly religiously pursuit. But this is the return trip and fighting shall not be found. Consider the opening scene: a close up of Block with his eyes closed, seemingly asleep at the coast. This is followed by the camera panning right to his squire Jon who is equally prone but making faint stirrings. Form here the camera is pointed towards their horses, albeit, briefly, only to return to Block who now strides to the ocean. It is this blending of reality and the fantastic that occurs repeatedly throughout the film. Consider the following dialog between Block and Death himself—gendered no less: Antonius Block: ""Who are you?"" Death: ""I am Death."" Antonius Block: ""Have you come for me?"" Death: ""I have long walked by your side."" Antonius Block: ""So I have noticed."" Death: ""Are you ready?"" Antonius Block: ""My body is ready, but I am not. "" Never had so much been said with such succinctness. But here in lies the problem with the film: so little is left out that the audience can become lost or disinterested as this is an art film and not subject to the usual film trope of problem and conflict resolution as is often found. This combined with music whose function is to invoke tension and foreboding in the extreme. All of this for the audience means one thing: work. This is a film requiring effort to view, understand and ultimately fully appreciate.",
256,25 June 2020,ssssgelojun,10, No country for old men,"The film documents the storms that an amoral force creates in the wilderness, in the town, and in People's Daily lives.",
257,31 March 2010,pratyush,7, Engrossing,"This is my first full Bergman film even though I have seen a couple of scenes of Cries and Whispers. The Seventh Seal is all about death. The only certainty in life is death and death escapes no one. I have been scared of death in my childhood, wondered even more in my teenage years and now I am numb about it.",
258,24 October 1999,iF....,10, The Scandinavian Masterpiece.,"A perfect movie in every aspect, words cannot even begin to describe this phenomenon. Seeing this movie was pure pleasure beyond understanding. Experience it for yourself. Do yourself a favor and see this, I guarantee it you wont be disappointed. Thank you, Sir Ingmar Bergman.",
259,1 January 2023,wumbi,10, Masterpiece,"Ingmar Bergman's The Seventh Seal is a classic of world cinema and a masterpiece of philosophical and existential contemplation. Set during the height of the Black Plague, the film follows a knight (Max von Sydow) who, upon returning home from the Crusades, finds his country ravaged by disease and death. As he travels, he encounters a range of characters, including a traveling troupe of players, a young couple struggling to survive, and, most notably, Death itself, personified as a hooded figure.",
260,9 May 2020,krational66,8, Azrael,"I pray, only death listens. I confessed that only Grim Reaper went to the appointment. I have the wisdom to always win the game against the god of death, but why? God always hides from me? He always hides behind half-truth promises and unrealizable miracles? I lost, and in the end I could only help myself dance the dance of death, and gradually went away in darkness. Leave those who never ask questions and enjoy the sweetness of God's creation in the warmth and light.",
261,14 May 2007,odysseydave,5," Harrowing Question, Harrowing Answers","50 years have passed since Ingmar Bergman's ""The Seventh Seal"" was released to worldwide critical acclaim. And after 50 years of cinema; how many films have tried to put into debate these same questions that ""The Seventh Seal"" did before. Some of these films have succeeded , others have fallen on their faces flat. But ""The Seventh Seal"" has not aged or it's power diminished a single bit after half a century. ",
262,11 November 2021,Filmdokter,6, A rather mainstream arthouse film,"The Seventh Seal is by no means a light popcorn-like easy watch. But it isn't the heavy arthouse-like hard watch either. Sure, its themes (life, death, religion) are pretty serious. But Bergman manages to tell his story in a rather watchable, understandable film of 90 minutes. Which isn't how it usually is. Off course this is not for the mainstream American cinema lovers. But it is worth a watch. Not all scenes are interesting. But the verbal battle between a young Von Sydow (always good) and Death are a great watch and the Swedish language adds to the flavor. A shame there is no more of it in the film. Looking to try something different and willing to give maestro Bergman a chance? This is an ideal starting point.",
263,18 September 2003,powwowdancer,10, Medieval/Cold War allegory that asks all the right questions.,"I've just bought this film on DVD after having seen it for the first time many years ago at Berea College.  (It was shown in a literature class called ""Romance Through The Ages,"" and yeah, I was one of about two other guys in the whole class... I took it because the Tolkien literature class was full.)  Having been forced to watch it, and fearing it would be pretentious art/crap, I was prepared for the worst and surprised by the very best.  It's allegory readily translates to any era, and it's characters are at once both sympathetic and engaging.  Bergman has Francis Ford Coppola's visual sense, (or vice versa... I've got my cart before my horse here!), and therefore, his movies are very artistic to watch.  (I've often said I could turn off the sound on any given Coppola film and just LOOK at it... same goes for this movie.)  Like most hapless folks of my generation, I was weaned on vapid hollywood tripe, testosterone engorged, brain-dead action and the usual bevy of unattractive splatter films.  Imagine my surprise at realizing that not only could a movie be moving and intelligent, but it could be ART!  What a treat!  This film should be on the ""must see"" list of everyone who has a philosophical bent or who has ever questioned the current ""conventional wisdom"" about life, death and meaning.  Thanks to this film, I've discovered other classic cinema greats like Alfred Hitchcock, Orson Welle's, Stanley Kubrick... the list goes on and on.  Movies are fine, but give your eyes and your brain something of substance and treat yourself to some real cinema every now and again.  More directly portrayed cold war films which I heartily recommend are Dr. Strangelove, Failsafe, Seven Days In May, The Manchurian Candidate and The Spy Who Came In From The Cold.",
264,20 February 2008,mexan-1,1, *,Oh my God!,
265,27 August 2000,RodReels-2,10, Wow!,"I saw this for the first time and was amazed that it had such power.  After all, I have seen it parodied hundreds of times.  But it is such a mind-blowing experience.  A simple yet original idea (playing chess with Death)is surrounded by more theological questions than could ever be unpacked in a lifetime's viewings. Nothing else out there like it!",
266,12 August 2021,Spartan_1_1_7,8, A Though-Provoking Classic by Ingmar Bergman About The Big Questions in Life,"The Seventh Seal (1957), wonderfully written and directed by Ingmar Bergman, is a Swedish film about a lot of things pertaining to BIG questions such as What is God? What is Death? What is the meaning of Life? And other philosophical and theological shizz that comes with it. It is told via a Chess Match between a Knight returning back from the Crusades and Death itself, with the Black Death/Bubonic Plague ravaging the country acting as the backdrop.",
267,15 January 2022,cesarat37,3, En film av Ingmar Bergman...,"What can be said about a thing like this? First of all, the verbosity and histerical characters depicted here make it quite an unpleasant and infuriating experience.",
268,22 May 2020,Dello_,9," ""The Seventh Seal"": an immortal movie that is able to speak to its audience in all eras","""The Seventh Seal"" is a superb movie rich of symbolism, that is able to provoke many thoughts in the viewer's mind. The movie is set during the plague of XIV century and the whole atmosphere is dark and oppressive and leads to a general sense of fear and uncertainty in the people of the time. In this setting everyone has to confront death, both as an idea and as a person. ""The Seventh Seal"" shows a variety of characters that have different faith as far as religion, life and death. There is the one who has a strong faith and thanks to this is able to be less anxious, there is an artist who has a special sensitivity about life and love, there is an atheist who is the most rational and the one who lives more freely than the others and there's the knight who fought in the crusade and at the time in which he has to confront his possible death loses all of his beliefs to became obsessed with the sense of life and what religion is. And his struggles are amplified by the fact that the Church at that time was corrupted and wasn't a real guidance for the believer's souls. The great thing about ""The Seventh Seal"" is that the answers are not definitive because life does not provide them. These important themes are supported by great cinematography, music, choreography and acting making it a very good movie in all of his aspects.
""The Seventh Seal"" is one of the ancestors of the modern cinema and everyone should watch it at least once.",
269,3 December 1999,bhicks56,10, One of my favorite foreign movies,"Foreign movies can be so cool. Being an 18-year-old film fanatic from America, and trying to rent the best imported movies from the local video store isn't as easy as I wished it would be. Not that foreign titles are hard to find, but you aren't always in the mood to read subtitles through-out a film, no matter how great it is (and I despise dubbing).",
270,17 May 2010,pontifikator,8, Bergman's best-known film is not all angst,"""The Seventh Seal"" is one of Ingmar Bergman's best-known films. It was released in 1957 and showcases the considerable talents of Max von Sydow as Antonius Block (the knight), Gunnar Bjornstrand as Jons (the squire), and Bengt Ekerot as death. I'm sure doctoral dissertations have been written about ""The Seventh Seal,"" but I'll see it as a movie. ",
271,9 May 2016,quinimdb,9, The Seventh Seal,"""The Seventh Seal"" is a film that stares death in the face (literally and figuratively) asking many questions but receiving no answers. It's a film not only about death, but life, love, suffering, and faith and how they all relate, and it does it with grace.",
272,18 October 2015,The_TJT,7, Existential angst from Bergman,Existential angst from Bergman; and a somewhat entertaining story of a knight (Max von Sydow) and his servant returning from crusades. A story which doesn't advance much but merely serves as a medieval backdrop for the protagonist's spiritual journey - in this film Bergman asks if God exists.,
273,24 November 2002,dracopticon,8," Life in Black, White and Grey","Only in such a film as this (and very few others), does the 'colors' of black, white and grey clearly define a whole spectrum of feelings.",
274,11 April 2021,SpaaceMonkee,9, A Moving Portrait of the Uncertainties of Faith,"The Seventh Seal tells the story of a jaded knight, Antonious Block, retuning home from the crusades (Von Sydow) accompanied by his equally cynical squire, Jons (Bjornstrand), only to find the homeland overcome by the plague. Early on, the knight finds himself in a chess game with Death, with Block's demise tabled pending the result of the game. This metaphorical backdrop sets the scene for the knight's journey back to his castle. Along the way, he is joined by a set of circus performers, Jof, his wife, and their infant son.",
275,24 September 2021,stefankrs,8, Dark and meaningful,"This movie is explains and portrays death realistically. Death comes to everyone and there is no mercy, there is no escape from death, death comes to everyone, suddenly or slowly. The movie deals with the doubt of a higher being, or god and the devil, and the existence of them. The fear of unknowing, and uncertainty. Really good movie with a good message. 8/10.",
276,15 April 2018,herrmanngoldsmithrozsa,10," The Seventh Seal: ""A Film of Visual Scope, of Imaginative Concept, of Powerful Content""","Ingmar Bergman is a director of unparalleled brilliance. Since his first script, 1944's Torment, Bergman has always delivered thoughtful and engaging films that delve deep into humanity. Be it relations between one another, our consciousness and subconsciousness, or any number of various facets of our existence, Bergman cuts to the very core of humanity and bring to light these many layers and elements in exceedingly artful ways. And one of the great tales told by the Swedish titan that demonstrates this well is his cherished and revered classic, The Seventh Seal.",
277,14 July 2020,CosentinoAran,8, A very good photography!,"Interesting film in some respects, such as death playing chess with the man who had gone to make the crusades. Photography is very well studied, the dialogues are interesting and intelligent. Maybe in some places it is slow.",
278,26 January 2021,denis-23791,7, Food for thought,"Unusual road movie in the middle of 15th century plague, pondering the meaning of life and death and what comes after it, mocking human kind's vices, and somehow mixing a parabola of Joseph, Mary and Son into the midst of it. Amusing in its exaggerations, both visually and in dialogue, but highly artistic, well played, photographed and directed.",
279,15 April 2008,imdbfriend,10, Bergman! Bergman!,"Bergman along with Andrei Tarkovsky is among few selected directors who engage themselves and the audiences in the deeper search of the soul, meaning of life, being human, and truth and this all through the medium of films and which for them are extreme form of art. In Bergman's own words ""No form of art goes beyond ordinary consciousness as film does, straight to our emotions, deep into the twilight room of the soul"". Through his art he made many thought provoking movies and The Seventh Seal is one supreme example among others. It is a movie about a knight who plays chess with the death king in order to avoid his own death and win life instead. The setting is medieval Sweden hit by the severe plague. So the knight sees death all around him and takes into a journey with his squire Jöns to get answers about God and life. He comes across some people like circus group and finds out how they are dealing with death and life, and witch all of them helping him in some way in his quest. In some way he even helps some to survive the death over them. The dialog's in the movie are really good, thought provoking which engages us in our own journey for answers about god and life, if not for long at least for some duration after the movie ends. I like many dialog's but the one I really love is the one when Jöns tell at almost end of the movie and is ""But feel, to the very end, the triumph of being alive."" Everything about the movie is very good be it acting, script, music, dialog's but Bergman's direction is astounding. This Bergman classic is a must watch for anyone wanting to enjoy art in its best form.",
280,21 February 2023,dholliday-imdb,6," Worth watching if curious, but don't expect much","I've been finally getting round to checking out old classics I've had on my radar for decades, after the somewhat-underwhelming Rashomon (6/10) and the very good early-60's chiller The Innocents (8/10) comes The Seventh Seal.",
281,1 December 2013,AbhiMathews,8, Seeking Light,"Death is an inevitable fate we will all succumb to. Learning to live life joyfully and seeking answers for the innumerable questions we have is what gives life its worth and essence. ""When"" our time ends is out of our hands but what we do with it is something we have control over. It is the dynamic idea of ""freedom of life, yet constraints of time"" that this movie explores. ",
282,2 May 2022,lso-soares,7, The Seventh Seal,"I started to be interested in films outside the Hollywood standards when I saw Ingmar Bergman in an exhibition at the cine club of the Faculty of Economic Sciences of the Federal University of Minas Gerais, in 1983, where I was studying. Many of my friends say that Bergman's films are sluggish, slow, and boring. It's not my opinion. I agree that some are not easy to see, but I like most of the ones I've seen so far.",
283,31 July 2021,MlleSedTortue,10, A portrait of faith and mortality,"Undoubtedly one of Bergman most well known a regard of masterpieces, The Seventh Seal certainty deserves it's distinction. The film masterfully conveys it's themes and ideas through striking Middle age imagery and great performances. It is all encompassed by the legendary Max von Sydow as the Knight and Bengt Ekerot, who's performance is with out question the definitive personification of Death.",
284,22 May 2020,JoshuaDysart,10, Death cheats at chess. Life cheats at death.,Max von Sydow was twenty-seven years old when he starred in one of the greatest films ever made. He died this year. He was ninety. This is a movie about death.,
285,9 January 2021,dannyrovira-38154,10, ONE OF THE GREATEST FILMS OF THE 20TH CENTURY,"Ingmar Bergman's audacious masterpiece is timeless cinematic classic which takes place in the Middle Ages where a brave blonde Swedish knight named Antonius Block, sensationally played by the late great Max von Sydow in one of the finest performances of his long and distinguish career, and his squire Jons, superbly played by Gunnar Bjornstrand, return from the crusades and discover their land ravaged by the Black Plague. As they approach home, Death, chillingly played with conviction by Bengt Ekerot in a scene-stealing performance, appears to them in human form as a hooded, black cloaked pale man with a piercing glance. Block challenges the omnipotent Death to a games of Chess, which he excepts, where If Block wins, he can live. Block will try to cheat Death, but at the end it will Death who cheats him. Masterful direction by Bergman who also wrote the compelling original screenplay, with extraordinarily beautiful black & white cinematography by Gunnar Fisher. One of the greatest films of the 20th century. In Swedish with English subtitles.",
286,1 February 2021,rtrnt,9," Bergman's stirring, thought-provoking take on religion, death and mortality","Max von Sydow's young knight who has just returned from the Crusades, fighting for a cause which he himself did not understand, let alone believe in, suddenly finds himself in a battle of wits with Death, which turns into a winding journey. The tremendous subtlety with which Bergman conveys this story is a testament to his extraordinary ability as one of the great directors in history. It's a rare film that might warrant more than one viewing to fully appreciate its depth and character.",
287,9 April 2006,Dyssonant,10, Maybe the greatest film ever,"An great, desperate yet unresigned, anthem to human condition. Many scenes are very, very powerful. The stunning opening with the appearance of Death is one the most impressive ever seen on the screens. The confession sequence is so simple and deep and moving: you feel the essence of your entire, small, brief life vanishing with Blok's words. The arrival of the flagellating pilgrims in the village is visually astonishing, like the unforgettable ending scene with the ""danse macabre"". Cinematography and acting are outstanding, and the transfigured Middle Age renders an angst sensation during all the film. Characters are very well assorted and the film has aged very well.",
288,5 September 2020,emresbf1,3, Waste of time,The idea behind the movie is original however there are many unnecessary scenes. Black Plague made a very crucial impact on European societies and this movie begins us the codes from the era. Plague affected the culture in religious terms. This was partially reflected on the scenes.,
289,26 July 2012,Filmnerd1984,8, Interesting and memorable.,"25.07.2012: A film that forces you to feel something about the concept of death and what it means. It is up to the viewer himself to make up their own minds to what that is. Personally i believe in the very thing Max von Sydows character is afraid of, ""nothingness"". But as far as the film is concerned isn't death appearing as a person proof of the afterlife? It is not just a bleak film since it has some genuine humor in it. For one i thought the blacksmith was utterly amusing in his acts and dialog. In fact all the characters was amusing in a sense in their own way. So far this is the best Bergman film i have seen. But i have only seen between 5-7 titles thus far.",
290,29 July 2017,haikela,6, Looks great but is boring,"I can see why this movie is a staple in film schools. It looks great, especially since it was made in 1957 with a budget much smaller than other gorgeous films of that time.",
291,10 January 2006,luzgannon,10, It Is Finished!,"OUTLINE. It is the year the Great Plague hits Scandinavia. A seasoned knight, Antonius Block (Max von Sydow) returns from some ten year's long late crusading venture to the Holy Land, to which he went out a Believer, where he became a Denier, and whence he now comes back a Seeker. He is followed by his loyal squire, the coarsely cynical, still brave and righteous Jöns (Gunnar Björnstand), with whom he keeps a strong bond and an implicit debate going on. During the journey, he encounters various people and events, all with a particular bearing on the Knight's all consuming Quest for God's Existence and the Meaning of Life; first of all he meets Death himself (Bengt Ekerot), but he contrives to postpone his end by challenging by his sinister opponent to a game of chess, which he intends to win, though he really can't, as he himself in the final analysis knows. Then, we see, among others, the naïvely charming family of entertainers, Jof (Nils Poppe), his loving pretty wife Mia (Bibi Andersson) and the infant Mikael, later we see the unrepenting Witch on her way to the stakes (Maud Hansson), the primitive blacksmith Plog (Åke Fridell) and his trampy wife (Inga Gill), the silent peasant girl (Gunnel Lindblom). Many join him to a following on the route. Finally they reach his home castle where his noble and faithful wife Karin (Inga Landgré) courteously receives them all. He has by now lost his game; and the same night Death comes to claim his harvest, and in the culminating scene they all confront Death with a display of their respective true personal nature. Then follows a short epilogue, where the juggler family, having escaped Death, moves away in a state of happy innocence.",
292,27 January 2008,ShiiStyle,9, Disagreed with philosophy but deserves no less than 9/10,"The Seventh Seal tackles death in a fashion which must have seemed horridly confrontational at the time but now seems too specifically Christian to me. The prince is gripped with existential angst about being unsure if he can meet God or Satan. In the world of the film, neither is there to comfort him; Death is the only sure thing. To some this may seem like a cause for despair, but to me it smacked of forcing the universe into small-minded Western forms. God, Satan, and Death are all names we have ascribed to the general metaphysical mish-mash; even the corpse they meet at the beginning of the movie is only ""dead"" insofar as it is clear from context that it was once a living being but is no more. When it becomes a fertilizer for the grass it will hardly be dead anymore. The judgments we make and feelings we attribute to these things are our own invention. If the prince were Buddhist he'd be handling this subject from quite a different approach.",
