Review_Date,Author,Rating,Review_Title,Review,Review_Url
148,30 November 2020,Kdosda_Hegen,2, Useless film.,I've read about Joan of Arc and this film was exacly how I imagined everything. I learned absolutely nothing new from this film and I had much more fun reading about her than watching a film about her. There's no point of watching this film if you can just read her story and you'll probably learn way more that way too.,
149,12 April 2001,Anglobilly_Feverson,8, It's a shame silent films are rarely shown anymore,"Groningen's movie scene is always up to unusual and interesting things. I've seen La Passion de Jeanne d'Arc in a church (Martinikerk), with an organ and a latin choir providing the music to this silent film.",
150,27 August 2000,motter1036,10, The beauty and innocence of Renne Falconetti[joan] will stay with you and those eyes!,"Eyes that you will never get out of your mind.This silent classic by Carl Dryer will also stay in your mind its unique camera angles quick cuts,starkness and close ups that will startle you.Based on the true transscripts of her trial the movie is almost an analogy to the trial and crucifixion of Christ.But don""t read about this movie go and see it.You will see a perfomance by an actress that may be the best even. A actress that never made another movie never got awards etc but in this movie it's like the spirit of Joan entered her. A moving perfomance to say the least. And those haunting innocencent eyes.",
151,4 August 2005,wendyjen,10, A must for film lovers!,Saw this on one of the classic movie channels and was astounded. If only there were actresses that could come close to Maria Falconetti. The lack of dialog keeps your attention to the performances of the actors and almost takes you back to the true events.,
152,22 May 2011,falloutboy72,10, The Passion of Joan of Arc,"The Passion of Joan of Arc is about a woman who is put on trial. Religion and corruption run amok in this classic movie, with Joan being a religious fanatic and The Church ironically putting her up for trial for that very reason. What unravels is a meticulously paced film that, hopefully, should delight viewers.",
153,23 August 2021,briancham1994,9, Pure emotions,"This film strips down the experience of Joan of Arc down to its purest emotional state. Harsh lights, uncomfortable close-ups and harrowing acting express the inner life of this prophet in her final days, oppressed by the clergy but supported by the people. The effect is extremely immersive, as the actress' inner life becomes merged with our emotional experience. The ambitious style of this film was well ahead of its time, ranking alongside other early masterpieces like The Battleship Potemkin and Metropolis. It's terrifying to see how close this masterpiece was to being lost forever.",
154,28 October 2021,pmtelefon,9, The eyes have it,"Norma Desmond was right. They did have faces then. The faces in ""The Passion of Joan of Arc"" are unbelievable. One face after another shows so much emotion it's terrific. This movie is an amazing experience. It's emotionally draining. ""The Passion of Joan of Arc"" doesn't feel like a movie that's almost 95 years old. It feels amazingly fresh. This movie packs a punch.",
155,9 October 2002,FogelNo1,10," Not my favorite silent film, but in my opinion, the greatest","It takes a real man to admit that his favorite item in a genre, is not the greatest. Such is with me and The Passion of Joan of Arc. My favorite silent film is, and always will be, Murnau's Nosferatu. It is amongst my very, very favorite films. And while Nosferatu IS a masterpiece, it is not as great as Dreyer's The Passion of Joan of Arc, which is easily the greatest silent film of all time. This is a truly magnificent film, and belongs amongst the ten greatest films of all time. Rich and detailed, with attention paid to historical authenticity. It is an artistic film, but not quite avant garde...the message and style of the film are crystal clear, and presented as such on Criterion's DVD. This is a must-see for cinema buffs, silent film lovers and artists.",
156,13 February 2019,xmdbx,7, The Groundwork for Cinematic Drama,"This movie feels holy. Like if a Bible story was shot on camera, that how it feels watching this (I know it's not a Bible story). Every frame is packed with so much drama that it seems as if it were portraying something truly world-changing. Any frame could be a painting, they're all so well thought out. The Passion of Joan of Arc is carried by not only the surgical camerawork but by the passion of Marie Falconetti. She acts exactly how you'd expect a saint to act. I read somewhere that this was the first film that let people know that film could be art and, while I don't necessarily agree that this was the first, it's influence is clear even today in more serious films.",
157,5 May 2022,springfieldrental,9, Dreyer's Masterpiece features Falconetti's Facial Expressions,"""You cannot know the history of silent film unless you know the face of Renee Maria Falconetti,"" wrote film reviewer Roger Ebert on the unique motion picture by director Carl Theador Dreyer in April 1928's ""The Passion of Joan of Arc.""",
158,24 October 2018,vccfvictoria,9, One of the best female performances in the cinema's history,"Everything is well done, but the most remarkable thing, doubtlessly, is Renée Falconetti's performance.",
159,21 May 2006,foreveralien,10, Thank god for mental institutions,"I was completely overthrown watching this film. The music and the stills:everything was almost out of this world.For me it was and is a metaphysical experience and I cannot explain why this film made such an impact on me. I guess this is what art is about. The acting of Renee Faconetti is beyond any acting boundaries. She IS the film and I never saw such good acting before. She is my personal favorite non-film star.The camera-work is so good, there is no shot that is not in place and the recent composition which was felt by Richard Einhorn so makes the movie complete. He knows all the secrets the film has in it. The best silent film I ever saw. Dreyer really made a piece of art here that hopefully will last for centuries to come. Once again:this is what art is about. Irrational, religious and emotional.And thank god for the Norwegian mental institutions. Without them nobody would ever be able to watch this masterpiece",
160,16 September 2001,GLSmyth,9, One of the better movies of the silent era,"This movie hangs primarily on the eyes of Maria Falconetti, who is able to reflect emotions successfully in this manner.  Carl Dreyer's direction heightens this transfer with thoughtful camera angles and character placement.  If one is to experience the best of the silent films, this movie provides one of the best examples.",
161,12 September 2018,drd-07217,2, Joan is played as a mental patient.,"Before I get into the movie it self I must pay my respects to the cinema photographer. Some of the shots are very innovative and unexpected. (1 of of my stars is for this aspect ) Now the movie, well in it self it's not bad but the woman playing Joan is quite obviously playing this part from a person with mental problems. Her never ending bug eyed frightened look and never ceasing crying are just plane irritating.
From what I read about the subject there are those that postulate that she did in fact have a mental disorder hence of 'visions'. Watch this for the photography but you have been warned about Joan!",
162,28 February 2005,bankcello,10, The best,I have read all the other comments and agree with all of the favorable ones. This is the best film I have ever seen. There is not much I can add to what has been said.,
163,27 October 2019,danjakubik-90443,10, An amazing film with a memorable powerful lead acting performance!,Directed by Danish cinema master Carl Theodor Dreyer,
164,20 September 2000,crimson bleach,10, You must see this.,"This film left me in awe.  I have seen better MOVIES, but I have never seen a better FILM.  I wouldn't know where to begin to describe how incredible this film is.  Carl Dreyer orchestrated the most amazing thing ever put on film, and to think it was thought to be lost for several decades.  Maria Falconetti delivers the foremost female performance ever in a silent film, if not any film.  This was the only film she ever appeared in, but she has certainly left an impression on me.  The tragedy of this movie lies in that most people will never get the chance to see it, will never know about it, or won't have the patience to watch it and appreciate it for what it is and what it means.",
165,14 June 2022,steiner-sam,9," A serious, albeit didactic, silent film","When the film opens, Joan of Arc (Renée Jeanne Falconetti) is about to go on trial. She was a girl of about 19 who through visions from the age of 13 she sought to help Charles VII during the Hundred Years War against the English. She had been captures and was on trial for heresy. We see many shots of the crowds and of the main players including the Bishop of Beauvais (Eugène Silvain), the prosecutor (André Berley), and the Dean of Rouen (Antonin Artaud).",
166,14 March 2021,lostcinematheq,4, The main actress gave a compelling performance but...,The experience of watching the film itself was the equivalent of being stuck in a courtroom watching a trial you have no emotional investment in.,
167,13 January 2021,danielgonjacob,9, A brief description of the beautiful,"Speechless. What about the angular planes of the camera, the backgrounds, the takes that complement the true dialogues, the painful features, the pleasant combination of fact and art, and liturgical music?
Watching this open leaves aside the simple fact of absorbing historical content, but it becomes, at the same time, an act of understanding the soul Carl T. Dreyer and especially Jeanne D'arc.",
168,3 June 2021,PCC0921,8," It's Not Just the Film, but the Whole Experience","This movie is hard to study just as a film, but is easier to study as a film-experience. The film itself, has a few problems and probably deserves a ""C"". It does have some great composition shots, great framing and excellent positioning of the characters. Some of it could have been highly influenced by the ""Cabinet of Dr. Caligari"" (1920). The best shot is the one of Joan in front of the cross during her second sentencing. In the finale, in the scene with the stake, the imagery is terrifying and believable too. There are some offshoot mistakes, where you can see the top or side or creases in the set walls, but nothing awful. The film itself probably would have been better if it was shortened just a little.",
169,14 July 2017,robbieclaravall,6, Passionate and expressive.,"Expressive eyes, tense lips, closed mouth, and the stare that just looks ahead and farther away from the desolate mundanity to settle to the glorious chants of heaven, Maria Falconetti easily and without a doubt gives one of the best performances found in the era of silent film. The Passion of Joan of Arc is one of the most influential French films of its time, and still continues to inspire today. It focuses on the last days of Joan of Arc's life, and dives right into her trial immediately after being captured and accused of being a heretic.",
170,8 May 2023,bretttaylor-04022,9, Possibly the best film made up to that point in time,This concentrates on just the trial and the subsequent burning at the stake of Jeanne d'arc.,
171,21 December 2005,jcsage,10, Beautiful,"I should preface my remarks by stating that I am not a devout Christian, nor a Catholic, nor a film scholar. Yet, I loved this movie. ""The Passion of Joan of Arc"" is one of the most visually arresting feature films ever made. As I understand it, the film follows the transcripts of the trial of Joan of Arc. It is fascinating to watch the angst and anguish of this young woman. You really feel the strength of spirit that Joan had. As this young woman faces down the church and political leaders of her country without wavering from her convictions one cannot help but be moved and struck by the power of her devotion. The cinematography alone makes this film worthwhile.",
172,12 June 2006,Carl_Dreyer,10, The Passion of Renee Falconetti,"Much has been written about this film, so I will give some of my own perceptions on it. Mimicking the quote from Paulene Kael, I also think this is ""perhaps the finest performance captured on film"". The face of Maria Falconetti in the movie is indelibly etched into my brain. At first, she is enlightened, sassy and doe-eyed, then after several interrogations, threats of torture, a real bloodletting (actually an extra was used for the stabbing), and having her own hair clipped off to the roots, her eye lids eventually droop until she is barely squinting. Her performance is almost beyond acting, as Carl Dreyer's gentle, but almost unbearably stubborn persistence made Renee demonstrate her true pain and suffering.",
173,19 February 2023,moritzherz,5, Great if you enjoy silent movies,"To be honest I only watched it because of it's place in the Top 250 movies list. I usually like silent movies but not too many of them. Jeanne d'Arc is not my favorite silent movie but I can understand why it is depicted as a great movie. The music is really good, being the only thing you can hear it has the most attention and that it uses great. Acting is also very good, especially because it is a silent movie and the story is a typical tragedy. For this year 1928 this is a masterpiece but nowadays it is a bit harder to watch but it is worth it. So if you want to experience the 20s filmmaking this can be your movie.",
174,19 October 2009,philipoffill-1,10, one of the finest works by a female lead in the history of Cinema,"Along side Marion Cotillard of la Vie en Rose, and Meryl Streep of Sophie's Choice, Rosaura Revueltas of Salt of the Earth and Jessica Lange of Rob Roy, Maria Falconetti's Joan of Arc is a masterwork of the cinematic arts.",
175,7 April 2021,ajkbiotech,10, Dreyer's Cinematic Masterpiece,"As may be well known, this silent film is by far one of the greatest films of the silent era.",
176,16 November 2005,SixtusXLIV,7," Cinema is the art of movement, theatre the art of words","It's a fact that, out of necessity, because he had no way of putting sound in the movie, at the time Carl Dreyer achieved a masterpiece, or better saying ""a tour de force"".",
177,14 March 2005,bigfilfy,10, The Eyes Have It (and the music helps too...),"I go to the movies to feel more human. I want to see on screen what I feel inside my heart, and when a film expresses emotion so authentically--so real--that I am moved to tears, then that is the highest praise I can give.",
178,15 September 2016,Foxxpix,2, A missed opportunity by a pompous filmmaker,"A number of challenges arise when attempting to produce a film based on historical events. The primary challenge being the decision of whose version of history is to be told. Another of the monumental challenges facing the filmmaker is deciding what resources to use in the design and execution of the film. By the late 1920's, advancements in cinematic equipment and technique were becoming more refined to include many of the basic cinematic innovations that are commonly used today. Careful filtering of different styles over the course of several decades led to these refinements. However, when it comes to methods of creating personal style, there are always those who want to spend time reinventing the wheel or those who decide that they know better than those that came before them. This often leads to artistic revolutions that last a short time before dying out and the art reverts to the basics. This essay will analyze the flaws in The Passion of Joan of Arc in both cinematic composition and narrative construction. ",
179,11 December 2021,wumbi,10, Masterpiece,"A disturbing and harrowing yet profoundly moving silent movie. Every scene is shot in close up, it emphasizes on the faces of the tormentors and of course Joan creating a haunting imageries that'll stuck in your head. One of the most afflicting and daunting silent movie and I surely won't forget this in a long time.",
180,4 February 2001,z_crito2001,4," Joan, we hardly know ya...","TPOJOA. What can I say. I saw this movie back in the summer of 1990 and I hate to sound like one of those people that always say a movie is boring unless there are lots of special effects, or predictable action every ten minutes, or if it was made before 1990.  But I'm not going to say it's boring - it's not -, to me it's something else: It's DEPRESSING!",
181,24 November 2001,thecornflakegirl,10, incredible camera work... a true original!,"The Passion of Joan of Arc is one of the most perfect movies ever made, if not the most perfect. Falconetti gives the most ecstatic, tormented performance of Joan that is undoubtedly the best acting ever caught on camera. The jarring style of editing, cuts and camera work defies all the known rules of shooting at the time, and you can see the influence this movie has had on filmmakers like Hitchcock and Fellini. This is also one of the only surviving filmed performances of Antonin Artaud, the 'enfant terrible' of French stage and cinema, and a fascinating poet and author as well. It is worth seeing for so many reasons! I highly recommend it, a perfect ten of a movie",
182,16 June 2005,Kurt_Cocaine,6, Excellent idea. mediocre execution,"I'd first like to state this comment is NOT religiously biased, I choose not to follow religion, so I'm not biased towards believing this story or finding it stupid.",
183,6 December 2022,freethinkingworld,6, After Thoughts,"I'm really glad I got to watch this film! I think it is really interesting for anyone really studying the art of cinematography. I don't know much about cinematography myself and don't want to pretend to half a great passion or knowledge of it. But the cinematography is very ahead of its time. It's so noticeable that someone like me with little to no experience or knowledge could tell that this was different than most movies of its Era or now Days. I love the angles of the trial, the camera always seem to be looking up. It gives the viewer and intimidating feeling and you almost find yourself squirming around like you yourself is on trial. The acting from Maria Falconetti was also quiet Moving and very expressive. I'm not quiet used to silent films but I thoroughly enjoyed this film myself!",
184,29 January 2021,mikemacisaac,10, Wow.,I watched the 24fps Criterion version with the Choir recording from 1994 and it was one of the best film experiences of my life.,
185,7 December 2020,ann_o-nyme,3, hardly watchable,"Haters gonna hate but here it goes.
Just to give some context, I'm watching all movies from the top 250, and this was one of the last remaining ones, so I am used to old and/or silent movies which I often like.
I believe the rating should reflect the audience's feeling ""as of today"" and honestly I had a hard time making it to the end.
The whole movie is basically close ups on over-playing actors flipping their lips, and from time to time some text with the questions and answers. The shortnes of the text doesn't do justice to the actual exanges that took place, which are very interesing.
Tackling this theme for a silent movie was ambitious, and might have been well recieved at the time, but I can't imagine anyone in their right mind enjoying it today.",
186,8 October 2009,unpopicakbill,10, Grossly underrated,"Given the title, you might think I wrote this just to praise the creation.",
187,14 February 2021,IamROCKAS,10," Just the score would be enough for a fantastic experience, but the story and the way it's portrayed is amazing too",I haven't heard such a good score in a movie since watching Sideways (2004). I had goosebumps throughout the whole duration of the movie and just the idea of seeing this in the 1920s with the live orchestra makes me envy those who had their chance in the past. Just the music was enough to get me invested in the film but combining that with a great and passionate plot just made the watching experience unforgettable.,
188,27 November 2021,fullthundermoon-36564,10, Genius theatre,"Jeanne D'arc was beatified on 16 May 1920. It is right that this film was made. And a 'miracle' that the film was even released. It tells the truthful testimony of events 500 years earlier. Yet, somehow, the film is a masterpiece. Maybe it is in the photography. Closeups are used extensively, and convey emotional twists and turns perfectly. Maybe it is shaven-haired Falconetti: for it is her film. Falconetti is inspirational, compelling. Without having seen this film, her picture hung on my wall for years, such was its power to provoke. No one else is as photogenic as is Falconetti in this role. The story is well known, suffice to say this film relies on original documents and historical records. Bergman made the best talkie, but, for curiosity's sake, see this silent and be blown away.",
189,2 October 2006,dkloch,10, The Best Silent Film Ever Made,"If Mel Gibson hasn't seen this movie, then the similarities between this film and Braveheart and the Passion of the Christ are some of the biggest cinematic coincidences of all time.",
190,30 December 2002,seventh_samurai54,7, A fantastic film.,WOW! What a fantastic movie. This is truly one of the great pieces of silent cinema. Maria Falconetti is amazing as Joan of Arc. Flawless direction from Danish director Carl Th. Dreyer. A must-see motion picture from the silent era of film.,
191,10 January 2021,KingProjector93,8, Mesmerizing silent classic,"The film focuses on the trial of French saint and icon, Joan of Arc, a young girl who helped France win several victories during The Hundred Years War in the Middle Ages.Now imprisoned by the English and on trial for heresy by a group of clergymen, Joan fights to justify and defend both her faith and her unique gift. However, the clergy are determined to break her at any cost.",
192,22 January 2021,lukecon-63436,9, The persistence of faith,"This is a beautiful film that I think everyone should see, mainly because of its interesting messages and Maria Falconetti's heartrendingly brilliant performance--Falconetti brings such emotional power in every scene she is in through her beautifully composed body language, how she uses her eyes to convey brilliant emotion, etc. All this adds up to the beauty of The Passion of Joan of Arc.
Secondly, the theme of the film is the persistence of one's faith, and how one can choose to persevere and persist in their beliefs. This perseverance is demonstrated through the Joan of Arc story, which brings this beautiful message to light. The themes of the film are very interesting in terms of the film's view of faith, and ultimately, the film leaves it up to the audience to draw its own conclusions.
Roger Ebert once stated the unforgettable eyes of Maria Falconetti, and how her eyes stick with you. Well, I can say that after watching this film, I agree.",
193,11 October 2020,ericlecorvec,10, The greatest film in cinema?,"""If Dreyer is equal to the greats in language, he is superior to the greats in his speech. And if it is vain and probably impossible to choose the second masterpiece of cinema, it is also impossible to hesitate regarding the first. The Passion of Joan of Arc is the most beautiful film in the world. ""Chris Marker""",
194,6 January 2023,xTkAx,10, This is a perfect film,"I love Jeanne d'Arc, the patron saint of soldiers.",
195,9 April 2022,martwiller-948-644122,9, Dreyer's Passion!,"This is Dreyer's best silent movie, and his fourth best overall (only topped by Ordet, Day of Wrath and Gertrud). A timeless classic, forever relevant with its powerful performances, impeccable direction, genius cinematograhy and flawless production design.",
196,16 April 2021,mcrpghk,10, This movie is Powerful!,"Before I even watched this film, I already knew joan's story, read her story, watched documentaries, saw priests and theologians talking about her, and as I got to know her I ended up creating more and more respect for her, regardless of her belief or disbelief I think we agree on the importance of this woman in the history of France, and why she is one of the greatest symbols of endurance and resilience.",
197,22 April 2020,Ned_And_Shall_Luvz_Filmzsh,6," Moving, educational and sad","I reccomend watching this with the lord of the rings in the background, I couldn't bare the silence.",
198,11 February 2022,frcata,10, What a directing!,This is truly a masterpiece: this movie gives a sense of anguish and pain almost unthinkable.,
199,19 February 2022,rjtv-51960,5, Horrible Performance by Falconetti,Hailed as a masterpiece but clearly exaggerated.,
200,30 January 2022,lowpolygon,10, A Stunning Performance,"Upon watching, its clear that there is a strong influence of theater. Theater is the art-form for the actor, whereas cinema is generally the art-form for the director or the cinematographer. This is because the film has an extraordinary emphasis on the performance which done by a poorer actor would have been less effective but Falconetti is stunning. Perhaps one of the best performances in cinema history. The set design is also amazing which being blank and almost featureless really emphasises and compliments the performance. That being said, some viewers may find the film to be taxing due to the incredibly slow pacing.",
201,21 November 2021,muratsalikk,3, Wish producers whould have wait until sounds arrived,"I think actors and camera angles was perfect, it is just boring watching a trial people talks a lot but you dont understand anything. Without any preknowledge about jeanne d'arc the movie gave me great emptiness and a lot of questions. After movie end, I look up some wikipedia pages and understood what is deal about her, and movie make sense much more.",
