Review_Date,Author,Rating,Review_Title,Review,Review_Url
70,25 May 2016,kylereid-186-650176,10," If Perfection Exists, This is it!!","Maria Falconetti's performance was life altering. If perfection in acting is possible, Falconetti would be the pioneer of perfection. I saw this movie the other day at an international cinema, having no prior knowledge about the film, just the fact that I love foreign films. I must say, it is now my all-time favorite movie. Period! The movie will stay with you forever. I was not merely watching the trial of Joan of Arc, I was experiencing it. ",
71,3 June 2001,EyeDunno,10, A silent film that speaks volumes (Criterion's Voices of Light version),"What a beautiful and yet startling movie. I am currently watching it on TCM (Turner Classic Movies). It's outstanding, from the acting and cinematography to the words and music (""Voices of Light,"" performed by Anonymous 4 which was composed by Richard Einhorn who was said to have been inspired by the movie). This is a gem that needs to be seen by real film buffs (who would opt to view the film without sound, as director Carl Theodor Dreyer preferred) and current directors and producers. When I first began viewing it, I thought it had been filmed very recently. All the techniques used, from the placement of lights and cameras to the intimate close-ups of the faces of actors are stunning, almost shocking. As a still photographer, I feel the camera work by Rudolph Mate is tremendous -- there were angles used during the filming of the 1928 movie that still aren't used today. It's so powerful yet also unsettling; even with today's cinematography, Rudolph Maté's lens forced the viewer to see the pain up close, the insensitivity of the judges and guards... Maté's compositions must have been kept off-center to give the viewer a sense of imbalance. And when the film climaxed, camera movements rocked back and forth, or were swept upside down and even trampled on.",
72,30 August 2007,Rufus-T,9, Beautifully shot work in the art of facial expression,"This movie is definitely worthy of appreciation in terms of the novelty of its movie making technique of its time. I would say it is a difficult movie to make since there is really not much to a story, so Dreyer had to refer to camera angles and closed up shots to evoke emotion.",
73,9 November 1999,Tequila-18,10, An intense masterpiece,"This is an emotional and intense masterpiece. This story of the trial of Joan of Arc is spellbinding. This is amazing because its essentially a collection of close ups. Dreyer's direction and editing is unbelievable. To make this bunch of close ups compelling is an astonishing feat. The editing reminded me a lot of Eisenstein, with his intercutting intensity. The performance of Falconetti is astonishing. She is compelling just by a tear or a slight tilt of her head. This cinema class staple which easily holds up today. Watch this to to witness the power of silent drama.",
74,10 March 2020,Marcyph3r,10, Tour de Force,"This movie is such an intense experience, and if you are in the mood it can have a lasting impact.",
75,29 April 2000,shrinkv,10, fabulous = a must see,"Maria Falconetti, almost always in extreme close-up and with no make-up gives a marvelous performance.  She offers a subtlety of expression that is moving in it's realism.  Many say this is THE greatest performance in movie history.  I don't think I could argue. Based on actual trial records. Director, Carl Theodor Dreyer demanded realism in costume, thus the absence of make-up.  Shot mostly in close-up the emotions are intense.  An excellent silent film.  The best I have ever seen.",
76,26 May 2019,Benjamin-M-Weilert,9, Breaking gender norms since the 1920's,"Perhaps the very first ""art film"", this movie uses a lot of close-ups to convey a sort of claustrophobia with the church, which spent the majority of the run-time trying to get Joan to conform to gender norms and to their standards of not being able to hear God. And while there is no music in this silent film, it almost accentuates the somber tone that parallels the final moments of Jesus' life as well.",
77,1 November 2009,marcin_kukuczka,10," Something Only Silent Era Could Execute, Something Only Silence Can Still Achieve...","When tormented by lots of noisy productions of modern cinema, blockbusters filled with effects and action so successful at the box office, it is easy to remain both blind and mute to true art that silently addresses human sensibility. However, though so often neglected, forgotten for years, considered 'lost', it appears to rise again after a few generations in order to overwhelm a totally different audience...",
78,12 October 2011,ElMaruecan82,10," If one picture is worth a thousand words, Maria Falconetti's eyes are worth a thousand frames ...","Never had the torment of a woman been as beautifully portrayed, inspiring nothing but pure sympathy, as in Dryer's silent masterpiece, ""The Passion of Joan of Arc"", pure sympathy in the Christian meaning of the word, and I'm not even Christian.",
79,7 January 2021,Thomas-Musings,2, Too much staring into space,Joan's wide-eyed stare off into space gets repetitive real-quick.,
80,26 February 2022,Jithindurden,9, Milestone,"As someone who's not a Christian or French, this was the story about the last day of a mentally unstable teenage girl who's being used and manipulated by people in power for their politics. Even though the institution that condemned her faced backlashes, they used the same half a millennium later for their own pleasure which really shows how the modern world really works.",
81,10 September 2016,donob,10, A couple od details...,"I simply agree that this is one of cinemas true masterpieces, I'm with those who consider it one of if not the greatest film.",
82,17 October 2005,royale_w_cheez44,10, The Most Powerful Film of All Time: Silent or Otherwise,"This is quite the film experience. Not only is it an emotional film with outstanding artistic quality, but it's the most powerful and moving experience ever on film. Falconetti plays Joan of Arc, and she gives an emotionally earth shattering performance, leaving anyone who watches this film absolutely memorized. I believe it when I hear that her performance is the best of all cinema; I have never seen an actress embody a person on film as much as she. Truly powerful and heartbreaking.",
83,17 January 2013,redrawn,9, Filled with visual power,"Carl Dreyer's skill in weaving this intense, abstract work, telling a story with a flow of images is genius. The towering figures of the priests, elongated by sharp camera angles evoke the works of El Greco. Renée Jeanne Falconetti's performance is of sublime power, her great eyes expressing so many emotions throughout the movie, we are simply hypnotised by those deep pools.",
84,18 October 2006,Cyke,9, Movie Odyssey Review #022.1: Passion of Joan of Arc,"022.1: Passion of Joan of Arc (1928) - released in Denmark 4/21/1928, viewed previously.",
85,7 April 2018,Colin-630-935811,10," Leaves you speechless,an emotional wreck.","It's Falconetti's face,somehow Dreyer managed to capture on film what seems impossible,such raw human emotion,a soul if you will,and the viewer is left drained at what they had just seen. I recommend the 24 frames a second with the 'Voices of Light' score,and watch it on the biggest screen you can find,because this is a life changing experience,transcendent even.Falconetti gives the greatest performance I've ever seen on film,and the director uses closeups for much of the movie,it's confrontational and brilliant,there is nowhere to look but at Joan,what she is going through,it's powerful stuff,your life will be elevated by just watching it.",
86,3 August 2008,wes-connors,7, Going to the Extreme Close-Up,"Here is a film which is easier to understand if you bring some prior knowledge to the viewing; most obviously, it helps if you know who ""Jeanne d'Arc"" (aka ""Joan of Arc"") was, because the film really only shows the last part of her story. It's like watching a stretched out final act of a movie; probably, the intended audience knew about the events preceding the drama. For film viewers not interested in doing homework, but possessing some familiarity with Christianity, it shouldn't be too hard to figure out what is happening. Think of it as a ""second coming"" Jesus Christ story, ""updated"" to a woman in France.",
87,7 June 2020,zzhhhqing,10, Great work,"Great work! ! ! From the hands of Dreyer, even the word ""great"" is not enough to praise it completely. Each actor's portrayal is unique and impressive, pure and profound interpretation, writer, actor, camera, everything. This is a great interpretation that only comes from the silent film era! ! !",
88,20 June 2020,h-28658,8," One of the most known, early films.","A gorgeous and deep character study that illuminates a powerful moment in history with the most moving performances, cinematography, and editing I've seen in a silent film.",
89,10 May 2020,XxEthanHuntxX,9, A Masterpiece by the Act of Despair,"Stunning in its power, importants, scenography and acting. Carl Theodor Dreyer's silent masterpiece from 1928, scorches a hole in the screen with Maria Falconetti's embodiment of the spiritual anguish worthy of a medieval Pietà. The martyrdom of Joan of Arc is represented in a series of close-ups with eyes widening and miraculously proficient in dropping single tears, her Joan is dazed yet resolute. Which the pain is not only understood by the audience but also experienced.",
90,10 February 2002,guido anselmi,10, rene falconetti gives the best performance in the history of cinema,"There's not much to say about this film, except that it is the perfect silent film. The visuals are stunning and haunting, most of all Rene Falconetti as Joan of Arc, with her huge eyes that go as deep as the soul. Her eyes say more than any writer ever could. It is as beautiful as it is disturbing. This simply cannot be missed.",
91,2 May 2020,dommercaldi,9, A Mind-Blowing Silent Film Masterpiece (Almost),"Pros:
1. There is not a weak performance in sight, with Maria Falconetti (Jeanne d'Arc), Eugene Silvain (Évêque Pierre Cauchon), and Antonin Artaud (Jean Massieu) standing out as exceptional.
2. The score wonderfully emulates and induces every emotion from: hope, despondency, sadness, fear, grief, and more.
3. The set and costume design are great and build up the 15th century world greatly.
4. The cinematography is fantastic. The framing is incredible, and the zoom-ins and close-ups help to add so much weight to every scene.
5. The long and intense pauses are incredibly powerful in hitting home the emotions to the viewer.
6. The dialogue, although it's in written form to be congruent with the silent film model, is captivating, and almost ethereal in its structure and delivery.
7. The pacing is perfect, despite the limited setting and constricting plot. The movie never once feels tired or outstays its welcome.
8. The death of Jeanne d'Arc is simultaneously enthralling, beautifully shot, and exceedingly sad.
9. The film serves as a fitting tribute to Jeanne d'Arc, by detailing her indomitable faith, the virulent church suppression, as well as her staunch French nationalism.",
92,9 June 2020,jonathanburns-ncl,8, A classic of the era and a non-traditional portrayal?,"Undoubtedly moving and claiming historical accuracy, Breyer's much lauded but seemingly polarising film provides the silent era with one of its best remembered and highly praised classics. Although the camera work is somewhat erratic, and Falconetti's performance gives out more fear and panic than has been traditionally attributed to this historical figure, the film provides an atmospheric and uncomfortable journey towards a surprisingly harrowing and graphic execution. Definitely one to watch, not sure I'll rush to watch again.",
93,25 August 2005,Aquilant,10, Tearing and cathartic report about every distortions in faith.,"The Tragedy is being consummated. The Passion is reaching its apex. ""You are burning a Saint!"", this is the scream of anguish of the people, witness of this poignant event, very deeply moved by the excruciating agony of Joan of Arc, flame beyond the flame. Very short hair, fine features in spite of her social condition of uncultured peasant, deep and large eyes burning of the same unquenchable fire bound to put an end to her life: this is our heroine, whose beauty is emphasized at once by her great faith in the infinite mercy of God.",
94,5 June 2020,ssssgelojun,8, The passion,"My mind is filled with stunning upshot angles and numerous close-ups, as well as the embellishments of diagonal shots. And finally Falconetti's perfect take on how few people go down in history with a single film in a lifetime: ""There's a soul behind a mask.",
95,30 September 2019,unclesamsavage,8, A Heart-wrenching Retelling of The Trial of a Saint,"St. Joan of Arc is one of the most badass Saints in the Catholic Church. She led armies before she was 20 years old. Imagine that. Burned at the stake at 19, driven by a fanatical love for God and country. It is hard to imagine the world today without her leadership, faith, perseverance, and martyrdom. France may never have unified which just sends the historic hypotheses spiraling. I wonder how the transcripts of her trial ended up in Scandinavia.",
96,30 April 1999,riddion,10, The greatest piece of film before Citizen Kane,"I saw it at Cinemateket in Oslo once and I was so captivated by the film that I was stunned for days after I saw it. I saw it with no background music, but when I saw it, I didn't even notice that. The camera work was SO tremendously magnificent, the cutting so exciting and the acting so good, that it passes Sunrise as my favorite silent film, which also made a tremendous impact on me. The extreme close-ups of the faces in the courtroom, the cutting during the torture scene are just two of my personal favorite things about this movie Falconetti's portrait of the french heroine was some of the most wonderful acting in a silent film I've ever seen. It even compares to the great Lillian Gish. I haven't been able to get it on Laserdisc or DVD yet though, but I hope it will be issued.",
97,28 August 2017,arturmachado-29588,4, Dogmatic religious fervor,"Silent film about the trial of Joan of Arc. The film begins with the description of the discovery of the records of her trial affirming that it is based on these. From there we are transported directly to the trial, from the trial to the torture and from there to the bonfire. In between we have many facial expressions close-ups from the various protagonists involved in the process, from the glumness and fury of the clerics who accuse her of heresy and witchcraft, to the passivity and lack of presence of mind from one or another monk and Joan herself. Scenarios and environment are relegated to a secondary plan practically nonexistent. At the end of the film, the population at first anxious for the inquisition circus, only and just after Joan is burned, begins a riot of redemption against the guard, a historically fantastical event without any source that proves it.",
98,25 March 2013,Artimidor,10, Timeless mysticism founded in stark realism,"The saint Maid of Orléans' legend has been filmed many times, but no version can hold a candle to Dreyer's groundbreaking silent take on the subject matter. What the ingenious Dane himself dubbed ""psychological realism"" and ""realized mysticism"" is a masterfully shot close-up feast generating an overwhelming flood of imagery, a lead that Dreyer called the ""martyr's reincarnation herself"" (the incomparable Renee Falconetti) and powerful re-enactment of original dialog transcribed at the trial in 1431. But it's also a forthright picture sans make-up, sound, not even a backstory is there, but all of it is lacking for a reason. ""The Passion of Joan of Arc"" is completely focused film-making, minimalism in its purest form, centering entirely on a core theme and thus radically eliminating all other elements that hinder the primary endeavor. Even the sets only seem to exist merely on the fringe of the spiritual drama and tragedy, which unfolds through the eyes of the actors via glimmers, flickers and stares. Confronted with piercing questions again and again circling like vultures above the torn state of mind of the famous maid, Joan's soul is revealed to us. Enlightened or a lunatic is not for the film-maker to decide. However, simplicity elevated to a film-making method makes our own observations a devastating and spellbinding journey at the same time, a journey into another world from where there is no escape. What we witness is indeed timeless mysticism founded in stark realism, and that's why it shakes us to the bone.",
99,17 May 2003,brtfnk1966,10, My thoughts on this film,"I had never watched a silent movie before today but when I saw this movie listed on cable and saw how old it was, I just had to check it out. I was not disappointed. This film had me hooked. It really showed the ordeal Joan must have gone through and also showed how, in all likelihood, no matter what she said, she was not going to be found innocent. Without one word, and only music in the background, this movie conveyed more feelings than alot of regular movies I have seen. I would recommend this film to anyone who wishes to understand her life, her faith and her amazing courage in the face of such adversity and the obvious hopelessness of her being found innocent. I would definitely watch this again, and again.",
100,28 July 2016,OliverBagshaw,10, A Film of Transcendental Beauty.,A truly beautiful and powerful film of such an influential and admirable status that not many films could ever achieve such praise. Dreyer's vision with The Passion Of Joan Of Arc is still recognised as one of the greatest pieces of filmmaking in existence.,
101,26 December 2022,filmbuff-05706,10, Silence That Speaks Louder Than Words.,"When it comes to religious films whose title's begin with ""The Passion"", most people will think of Mel Gibson's The Passion of the Christ. That is certainly a great movie, but another film should come to mind, that being Carl Dreyer's 1928 silent masterpiece, The Passion of Joan of Arc.",
102,5 January 2013,kurosawakira,9," The Nerve, The Vision","The  Masters of Cinema series released their long-awaited restoration of Dreyer's ""La passion de Jeanne d'Arc"" (1928) on Blu-ray last November. It includes the ""Oslo print"" in two different projection speeds, both 20fps and 24fps, as well as the ""Lo Duca"" bastardization. Highly recommended not only for the beautiful 1080p presentation but also for the booklet that comes with it.",
103,30 January 2008,mayesgcm7,10, An essential work of cinema,"Carl Dreyer is one of the first and true masters of the art. His direction is always exceptionally controlled and crafted and for me this film encapsulates succinctly his dual expressionistic and formalistic approach to cinema. Although Dreyer succeeds in creating an extremely credible depiction of the trial and tribulation of Joan of Arc, he knew the filmic medium was not, and never could be, knowledge, fact or reality, and so he presents experience, truth and authenticity.",
104,3 November 2013,zoroastre,10, best acting I ever saw,"I was introduced to this film in a cinema class as one of the greatest films of all times, so I watched it...",
105,12 September 2018,Amyth47,7, Falconetti is Immortalised in Dreyer's The Passion of Joan of Arc.,My Rating : 7/10,
106,3 April 2000,Andyh74,10," A Film That, Like Joan, Is Rebellious Yet Has a Soul",WARNING:  POSSIBLE SPOILERS!!!,
107,4 January 2003,SinjinSB,9, I am very impressed with the excellence of this 75 year old film,"I am very impressed with the excellence of this 75 year old film. It is very well directed by Carl Theodor Dreyer and extremely well acted. Maria Falconetti, as Joan of Arc, was superb. This was a silent movie, but her expressions and haunting eyes speak volumes as she reacts to her inquisition. This film has holds up and is extremely powerful telling the story of the trial of Joan of Arc. This film was thought lost as the original prints were burned in a fire. Fortunately for us, a great copy was found in a mental hospital in Norway in 1981. It was restored in 1985 and looks incredible for such an old movie. In 1988, Richard Einhorn, saw this movie and fell in love with this movie. He composed an excellent musical score, Voices of Light. He wrote it as a stand alone piece, but luckily we have the option of having it play along while watching the DVD. It perfectly accentuates the movie and makes it an even more powerful experience.",
108,22 December 2005,jameskinsman,10, An undeniable masterpiece,"What Dreyer has achieved with Le Passion De Jeanne D'Arc is nothing short of miraculous. Indeed, it is a miracle in itself that we are able to witness the brilliance of this film, as the original negative of it was destroyed in a fire. A second negative, re-edited by Dreyer from alternate takes was also thought lost to a fire. Then in 1981, after more than half a century, an original danish copy was discovered in a Norwegian mental institution, allowing us to view the film probably very close to its original form.",
109,18 June 2005,robbiedarkko,10, A Film For All Time,I watched this film in complete silence because I wanted no extraneous input into a film I'd heard so much about. I think that might have been the right decision because I came away with a very high regard for it.,
110,28 February 2014,jboothmillard,8, The Passion of Joan of Arc,"From director Carl Theodor Dreyer (Vampyr, Ordet, Gertrud), this is a Danish silent film I was really looking forward to watching because of all the critical acclaim I knew it had, including of course it's placing in the 100 Movies You Must See Before You Die book. Based on the real authentic records of the historic trial, this film depicts the last few days of Jeanne d'Arc, better known as Joan of Arc (Maria Renée Falconetti), on trial for the crime of heresy, because she believed it was her mission from God to support King Charles VII and fight or lead in the Hundred Years War, the battle between France and England. In court she is questioned by Bishop Pierre Cauchon (Eugène Silvain) and supported by some as a true saint, and she remains dedicated to her beliefs, and in her cell, while judges try to find evidence to convict her, she is interrogated by priests and attempts to convince her to change her views fail. These attempts include a false letter from the king, and she is denied a Mass, Jeanne does become visibly emotional during trial, with those speaking ill of her strong religious beliefs and the antagonism, she also faints at the sight of the torture chamber, but she does not give in to any demands of a change to her statements. However Jeanne is threatened with the penalty of being burned at the stake, and she finally breaks, allowing a priest to have her sign a document of confession, and she is given communion, but then again Jeanne recants and in the end as punishment is publicly executed in the courtyard at Rouen castle, burning at the stake while a crowd protests. Also starring André Berley as Jean d'Estivet, Maurice Schutz as Nicolas Loyseleur, Antonin Artaud as Jean Massieu, Michel Simon as Jean Lemaître, Jean d'Yd as Guillaume Evrard, Louis Ravet as Jean Beaupère and Gilbert Dalleu as Jean Lemaître. Falconetti gives an extraordinary performance as the title character, you can see all the emotions in her face with the many closeups, it is the only role she ever had as well, this film goes to show that not all films need sound or dialogue when you have a magnificent leading performer, and there are some really good camera angles, zooms, tilts and pans that create the intensity, this really is a compelling and must see classic silent drama. Very good!",
111,7 June 2014,Reverend3000,7, Cinematography ahead of its time. Interesting recovered film.,"This movie, restored for the present day, is visually appealing to the modern viewer. The portrayal of Joan with bright, open eyes stirs up a variety of feelings. It also gives off the vibe of mystique and wisdom well beyond her years, a girl ground in her conviction, always cornered by dark forces in the room, yet remains a light.",
112,12 April 2022,cesarat37,4," An ugly, grotesque film experience...","Artistic? Certainly. Beautiful? No. Well, maybe some people find ""beauty"" in a film like this; I envy them in that aspect. Still, the last 10-15 minutes I found very impressive (and expressive); this is mainly because the camera MOVES. But really, for the most part, I felt watching the same (static) shots over and over again (with slightly different angles).",
113,22 July 2019,VertigoOne,4, A Test of Patience,"One could say that this film functions as a sort of 'rite of passage' for art film aficionados. As they say, 'If you can make it through this, you can make it through anything.' However, ""Jeanne d'Arc"" does not function as an overall great film in its own right, at least in my opinion.",
114,29 April 2004,jazzest,8, Hard to Believe the Film was Made in 1928,"While director Carl Theodor Dreyer is probably religiously motivated, the persistent usage of Joan of Arc's and the evil judges' Close Ups, which must be exceptionally innovative and progressive at the time, suitably conveys Joan of Arc's emotional intensity. Towards the end, several incredible external panning/tilting shots from extreme angles culminate the audience's emotion to the apex. It is hard to believe that the film was made in 1928.",
