Review_Date,Author,Rating,Review_Title,Review,Review_Url
36,26 January 2010,Hitchcoc,10, Masterful Photography!,"Starting with Eisenstein's ""Ivan the Terrible,"" I began to be comfortable with these early films and their incredible focus on faces. This is like an 80 minute slide show, using some of the most wonderful expressiveness I have ever seen. I know this could be boring to some, but even in shots that seem repetitious, there are subtle differences that express the absolute summit of emotion. This story has been done so many times and it usually falls on the hopes of the character to express, usually in words, faith. Here Joan is so human and yet so saintly. She is devoted to her faith but also afraid. We need to remember that this person came from humble beginnings, unable to even read. Perhaps she was delusional. Personally, I have trouble with any of this, but she certainly could not be more heroic. When she recants her confession, she does so in the shadow of the stake. I was intrigued by the soldiers and the villagers at the end. Did this really happen? I don't recall this in other treatments though I may have forgotten. It is also wonderful that this film was restored. It is crisp and bright and needs to be to show every wrinkle of its characters.",
37,16 October 2002,Dockelektro,10, Overwhelming,"Strikingly beautiful, the movie delivers even if you see without any sound. Surprisingly simple (only a few scenes, most of the movie is made of close-ups and shot indoors) it has nevertheless the characteristic that elevates a director to the height of myth. And here the screaming yet peaceful expression of Maria Falconetti is pivotal - she conveys all the emotions that the viewer feels, and therefore nearly expenses the need of other characters in the picture. Magnificently shot, amazingly acted, this is a masterpiece in every sense of the word, that has the power to make you really develop feelings towards it. Unmissable.",
38,8 July 2022,sudhakaranakhilan,8, A French classic,"While I read some of the books related to world cinema I was just stuck on one name because of the pronunciation of it. That name is Carl Theodor Dryer and it was quite alien to me because I was just introduced to world cinemas at that time. When checking his filmography The Passion of Joan of Arc stood at the top position and it is surely a classical work. The film is a silent one, just passed a year since the first talkie enter the cinematic field (The Jazz Singer) but this film has its soul in it. Dryer adapted the story from the transcript of Joan of Arc and he just fits it into the story which has cinematic appeal. The movie is like a congested one in the sense it has a lot of close-up shots which are repetitive in the course of the movie's progression. Dryer framed up the characters in particular spaces without any movement for them and did their performance within that space. The film starts with the trial of Joan by the church and then it shifts to the crucifixion or burnt up of her (in another way from the Passion of Christ). In the end, the movie changes its track and goes into a speedy mood. This is a worth classic and good study material for those who dreamt about cinemas.",
39,20 November 2007,Boba_Fett1138,8," The trial of Jeanne d'Arc, very close up.","when you think of a Jeanne d'Arc movie, you don't expect to see a movie based purely- and focusing just on the trial of Jeanne d'Arc. considering the entire life-story of Jeanne d'Arc, it just doesn't seem like the most likely and interesting thing to focus on. It however of course works well for a more deep, serious and realistic approach and or course also in an original way of retelling the story of Jeanne d'Arc. So don't expect to see a strong heroic female lead but a betrayed, broken, emotional one instead.",
40,1 December 2019,barisayhan,10, Epic and Impressive!,"I think this film is one of the most impressive films of silent cinema. The actress, who played the role of ""Jeanne d'Arc"", performed at a high level. Although the film is silent, the orchestral music playing in the background increases the power of the film. One of the main points that make the film legend is the use of a camera. Close-up is often preferred. These close-up scenes are like a cinema course. The camera angles used in the film are very brave and the reference point for someone who will learn the camera angles today. It was the right choice to tell not the whole life of her, just a small part of her life. It is impossible for even a stranger like me to be impressed while watching this film about a French and Christian cultural figure like Jeanne d'Arc. For those of you who don't know, I suggest you find out who Jeanne d'Arc is before you watch the film.",
41,5 June 2007,jem132,10," Dreyer's ""Passion"" Has Rarely Been Equalled On Film...","One of the single greatest performances in film history came from Carl Dreyer's amazingly powerful THE PASSION OF JOAN OF ARC. Renee Falconetti, in the only performance she ever committed to film, is just about as flawless as an actress can be as the persecuted French woman who is sentenced to burn on the stake, accused of witchcraft, after a highly unjust trial.",
42,14 March 2011,ldavis-2,3, Raiders of the Lost Arc!,"After years of hearing this film praised to the skies, I finally got to see this last night, thanks to our buddies at TCM.",
43,13 March 2010,jazza923,10, Brilliant silent film...,"100/100. A brilliant, absolutely brilliant film. Breathtaking, with amazing performances from everyone in the cast. One of the greatest silent films ever made and among the greatest films of all time. Moving, unforgettable, and Maria Falconetti is mesmerizing. She is incredible, and lights up the screen in every frame. This is a must see film for anyone seriously interested in film and film history. Visually it is a remarkable achievement, especially the frequent close ups. Well edited and a film that is not easily forgotten, thanks to the extraordinary vision of director Carl Theodor Dreyer. He has created a cinematic piece of art.",
44,7 February 2006,KingM21,10, ...and hope and faith...,"This silent masterpiece, based off historical records, reveals the trial and execution of Joan of Arc. It was wonderfully acted, with Maria Falconetti giving a particularly moving performance as the lead. And director Carl Theodor Dreyer really captures the detailed expressions and emotions of all the actors through a constant use of close-ups, which also added to the sense of distress and torment, and hope and faith, this picture intended to convey. The film is also quite stylish, with sharp editing, reverse camera angles, quick montages, and multiple instances of symbolism. Set design, or at least what was shown of it, was sparse but believably so, and gave several nods to German expressionism. The Criterion DVD does justice to this once lost work of art, giving us the option to watch it completely silent or with the Voices of Light soundtrack, an operatic orchestration inspired by the film, which I found to be very fitting. Also included on the disc is a comprehensive commentary track, a feature on the history and many versions of the film, and several other worthwhile extras. All in all, this is the best silent film I've seen and I'm glad I went ahead and purchased it.",
45,23 December 2012,rmax304823,8, Horrifying Masterwork.,"There's no doubt about Dreyer's ""The Passion of Joan of Arc"" being a work of genuine poetry. Nothing like it had been seen before. The performances are nearly perfect, although Maria Falconetti as Joan of Arc has few light moments, as you can imagine. Dreyer's direction was all new to the screen, mostly low-angle close ups. The set direction was similarly innovative. All the rooms are spare and brightly lighted. Even the torture chamber is clean and uncluttered -- no pots of oil bubbling over a fire, no hairy greaseballs going grimly about their tasks. We get a hypnotic glimpse of a spool of spikes whirling, and what appears to be some sharp and jagged farm implements hanging on the wall.",
46,17 August 2017,tyson-hunsaker,10, A must-see for any lover of silent cinema.,It's a true blessing that The Passion of Joan of Arc was not lost forever and was miraculously restored for the world to behold the incredible wonder this film is. The Passion of Joan of Arc is a French silent film based on the true story of the real woman by the same name who claims experiences of visions from God which angers the church. The film centers on the trial itself and ultimately her death at the stake. ,
47,5 April 2010,bkoganbing,9, That Male Attire,For those who have seen Ingrid Bergman and later on Jean Seberg play the maid of Orleans in other interpretations of the Joan Of Arc story you might well do to take a look at what the French themselves have with their national heroine. The Passion Of Joan Of Arc made at the tail end of silent films give an actress normally associated with comedy a chance to give an astonishing interpretation of the maid. It also gives us the only recorded performance of Maria Falconetti to treasure.,
48,3 April 2017,grantss,8, Powerful silent era drama,The trial and execution of Joan of Arc. ,
49,23 May 2000,Boyo-2,10," ""Masterpiece"" hardly covers it","If there really was a camera at the trials of Joan of Arc, it would have looked like this movie.  I cannot even believe this movie, its so great and Maria Falconetti is amazing.  It deserves the place in movie history it has and Falconetti is unforgettable.  When I think of the intensity of the movie, I almost blush.  I couldn't even watch the whole thing is one sitting but I will remember this movie as long as I live.",
50,24 February 2019,luigicavaliere,10, shades in close-up,"Giovanna is taken to the Inquisition court. Her close-up is worried and pious at the same time. Giovanna in the close-up begins to cry. Then while she claims to be sent by God and the English will be driven out of France, the close-up takes a lateral angle, more painful and sharp as a knife that hits the viewer's heart. The editing alternates impassive close-ups of the inquisitors and the juxtaposition of Giovanna's close-up with the close-up close-up of a guard, which appears zoomed in his terrible look in the car: this is particularly disruptive. The process continues and Giovanna's eyes are estranged as if she were looking at angels and saints for whose vision she is also accused. After the accusation of blasphemy continues to pray in ecstasy as ""The ecstasy of Santa Cecilia"" by Bernini. A friar thinks that Giovanna is a saint, but is taken away by the soldiers. Giovanna sees a cross in the shadow and feels comforted. She is not considered a daughter of God but a daughter of the devil and is sentenced to torture. Giovanna D 'Arco says that even if she dies she will not deny anything. The eyes are twisted by terror in front of the torture wheel and faint. Giovanna is taken to a bed where they are bleeding. Giovanna feels that she is about to die and asks to be buried in a consecrated area. Giovanna says it is not true that she was sent by the devil but that they were sent to make her suffer. In a close-up, Giovanna turns her head in this ascetic and suffering moment and a quick, alternate editing correlates her with close-ups and details of the inquisitors, like their mouth whose words depend Giovanna's life. Giovanna suffers the final sentence while an image of a worm coming out of a skull in the common grave contrasts with the intensity of her close-up. Giovanna embraces death and on the gallows says she accepts death with a good heart. Giovanna burns at the stake while devoted ladies cry in a series of close-ups. The crowd rebels against burning a saint and the soldiers attack the people, who flee in an alternation of close-ups, filming from the top of the crowd that escapes attacked by soldiers and the silhouette of Giovanna burning on the stake.",
51,25 December 2008,Chance2000esl,10, Amazing Photography Carries the Film and Heightens Its Impact!,"This film is amazing on several counts. First, the cinematography is mind boggling: we've got tons of extreme closeups, lots of low angle shots, pans and swish pans, even upside down shots. Dreyer is using the camera to tell the story of Joan of Arc's trial for heresy and her being burned at the stake. ",
52,25 August 2013,lreynaert,10, Revolutionary,"'Joan of Arc' is stylistically a key work in the history of cinema, through its combination of close-ups, camera angles, framing and movements of the characters and of the camera on this characters. Dreyer created a masterful visual sequencing with the movements of the heads inside the screen and of camera panning and tilting on these same heads (of the judges of Joan of Arc). This sequencing suggests an inescapable iron encircling of Joan of Arc (whose close-ups were filmed with a fixed camera) by her vicious judges. All these shots created the same effect as that of the painting 'Christ Carrying the Cross' by Jheronimus Bosch, where the serene face of Christ contrasts sharply with the ferocity of the visages in the crowd around him. The camera angles and the decentered and canted framing further accentuate the contrast between Jeanne's face full of grace and the grim facial expressions of her corrupt judges, a bunch of perfidious theologians and dishonest lawyers.",
53,4 October 2007,r-c-s,9," extremely good, artsy but dated movie","this movie's drawback is that it gives no background. We are thrown right in the middle of the action. Perhaps the director wanted the public to take its autonomous stance, but when you start watching, you must either like/believe Joan or not. The quality of the film is excellent; by all means it might have been shot in the 1950s. Acting is very good for what it is (EG no outside action but a young woman tortured and then burnt alive ): the first few seconds hinted at Falconetti being a very brilliant actress; perhaps not the best of all times ever, but let's compare a few recent Hollywood big budget junk thrillers or psycho-movies to boot and this ages-old movie ends up winning. Scenes are careful and camera work innovative. ONE BIG GOOF: around the time Joan is taken out to be burnt, we see a priest WITH GLASSES. Now spectacles were centuries ahead of Joan's time. I tend to regard this movie as high theater on film, rather than a ""movie"". THE MESSENGER tries to psychoanalyze Joan too much, making her look like a complete fool. But face it, after all these centuries she is still a hero not because she might have (or have not ) heard god's voice (plenty of charlatans and hallucinating faddists claim they do everyday right now ), but because a young, illiterate peasant virgin could actually kick the enemy's hides and give her king a crown, being ready to die burnt alive to stand for her ideals. I wish I had a fraction of the balls she had, period. One might or might not sympathize with France, but her lesson is a lesson for everyone.",
54,20 August 2009,Irie212,10, The one thing everyone should know about this movie is...,"That the script was based on the transcripts of the actual trial of Jeanne d'Arc in Rouen in February and March of 1431. The same is true of much of George Bernard Shaw's play, ""Saint Joan."" ",
55,12 March 2018,strong-122-478885,6, A Hideously Bleak Freakshow,"With Danish director, Carl Dreyer clearly going against the grain here in direct defiance of glamour and beauty - I'd say that as a perceptive film-maker - He was also something of a sadist to deliberately drag his audience through such an unpleasant religious-based hell as this.",
56,15 April 2022,851222,8, Haunting experience,Greetings from Lithuania.,
57,12 September 2022,CinemaSerf,7, La passion de Jeanne d'Arc,"Maria Falconetti is superb as the eponymous tortured soul betrayed and tried for heresy in 15th century France. The history is well known, and Carl Theodor Dreyer sticks fairly faithfully to the more established, traditional, chronology which leaves us, the audience, to focus much more on the wonderfully emotive, gritty and poignant efforts from the cast and the wonderfully creative talent behind the camera. The combination of innovative, intimate and intense photography coupled with the beautifully expressive facial expressions from Miss Falconetti; the subtle but potent brutality of her persecutors - personified well by Eugene Silvain's Bishop Cauchon but also well exemplified by the cold and soul-less panel of judges all make this an effective and chilling film. The score - semi angelic, frequently intimidating but always powerful helps create an atmosphere that genuinely makes you feel fear and trepidation for this young woman, a pawn in things she little understands, but sticking faithfully to her beliefs of divine intervention and pureness of spirit. That emotional link is contagious, and even as a man of little faith myself, I found myself feeling an overwhelming pity for this person caught up in a trap of very much earthly ambition and deceit. It's a tough watch at times, especially as the chronicles remove even the slightest of chances for this woman. It is also pretty short - and that helps keep that momentum moving really well; there is no time for extended and sprawling cinematography to lessen the impact - it's a film about humanity, trauma and fear; and takes some beating...",
58,12 June 2003,Sinnerman,10, Profoundly Faithful. Spellbindingly Hypnotic. Hauntingly Overwhelming. One of the best films ever!,"Finally got round to see, ""The Passion Of Joan Of Arc"" yesterday night.",
59,5 September 2004,MarqKC,10, Simplicity of sets,The simplicity of the sets in this film are absolutely breathtaking. It is a film that captures the imagination not so much with what it shows as what it doesn't show.,
60,11 March 2015,SnoopyStyle,7, compelling closeup acting,"I watched the Criterion Collection from an original found in a Norwegian mental institution in 1981. The condition of the film looks crisp and perfect. It is based on the trial transcript of Joan of Arc. The film starts with Joan in prison. The religious authorities question and berate the young girl. They bring her to the torture chamber. At the breaking point, the priest guide her hand in signing a confession. She is eventually burnt at the stake. Renée Jeanne Falconetti stars as Joan. Her big eyes glow with passion. She is a bit old to play the teen martyr. Otherwise, this is an impressive acting performance from the silent era. The constant use of closeups is quite compelling. It's almost a piece of painting or art.",
61,5 February 2020,Vartiainen,8, One of the earliest masterpieces,"The Passion of Joan of Arc was a groundbreaking movie in its own time. Humongous set build just for the film, visionary camera techniques yet unseen, controversial subject matter, powerful role performances. Everything needed for a true classic.",
62,9 January 2004,desperateliving,10, 10/10,"Carl Dreyer presents us with one of the greatest tests of an audience in the history of the movies. He forces us to look at Joan's face in a hundred fragmented close-ups, gaze into her steely eyes permeated with God's destiny, never sure of our surroundings. He makes us those that would judge her, gawking at her facetiously. She's the greatest angel we've ever had, and Dreyer doesn't make the mistake of turning her into a device for sympathy: when she bends, it's not because she's weak, it's because she's overcome with God's power. As usual with Dreyer, his film is something that we reflect ourselves onto: are we Joan, or the onlookers? When Joan cries, do we blame ourselves?",
63,20 July 2020,MrLucasWarHero,10, True Passion and Genius,"This film moved me.
I mean, it really moved me. Witnessing the harrowing tale of this young, brave and feverishly passionate girl through the eye of ingenious director Carl Theodor Dreyer was so much more emotionally touching than just watching a film. It was a religious experience.
There is a fine line between madness and enlightenment. Renée Falconetti's performance brings that raw personage to life with an emblazoned look upon her face of the fervent young lady who has devoted her life to only God and expelling the English from France. Her gaze tells us that only she knows the truths that lie beyond the sight of mortal man and the complexity of her delivery makes it seem as if she also wonders why she should ever be put on trial for that which is an indisputable verity to her. Her gaze alone will grip you and hold you until the film is finished.
The cinematography of Rudolph Maté is astoundingly beautiful. The way the camera surveys the male judges, creeps along the courtroom and stalks the townspeople truly brings the film to life. Joan of Arc often appears in closeup during moments so intense that we see the hope inside her eyes. The motley crew of priests with their politically motivated religious regime always seem to have empty space in every frame alluding to their lack of awareness.
We're there with Joan. We feel for her. We yearn to help her. But she does not want absolution from an unenlightened gang of men who know nothing of her struggles. She only wants the love of God. She shows us how painful it is to know truth and beauty and live in a world that seems to be blind to it.
Do yourself a favor. Watch this film and know beauty.",
64,15 October 2009,jzappa,10, The Overwhelming Power of the Human Face,"You will not appreciate the experience of silent film until you know the face of Renee Maria Falconetti. In a medium without words, where the filmmakers conceived that the camera seized the heart of characters through their faces, to see Falconetti in Dreyer's landmark is to look into electric, almost extrasensory eyes that will never relinquish you. She also embodies Joan with an unrelenting monastic guilelessness, moving as if in a dream, her body language so slow and meditative. She answers questions in taut earnest.",
65,3 June 2001,moggy-4,10, each image is indelibly seared onto your mind,"happened onto this film while channel surfing, and was instantly mesmerized. and didn't even know the title or subject. this is what great film making is all about- the purity of great acting and great filming.   It doesn't ""feel"" like a silent film; indeed, you'll forget that it *is* a silent. Each shot is like a painting.  It is the equal of any film made today, and best silent I've seen- and I have no interest in the joan of arc legend",
66,8 December 2002,chexmix,10, on my desert island list,"I can well imagine that a lot of people might be (I shudder to type it) bored by this film. In my memory, it is all faces. And what faces! I don't know where one could find acting even close to this order of excellence today. It will give you an endless distaste -- if you don't already have one -- for the likes of Freddie Prinze Jr. Falconetti is simply beyond belief, and it is also fascinating to see one of Antonin Artaud's too-rare screen appearances. Absolutely an essential film for all time.",
67,21 May 2020,frankde-jong,9, A brilliant anomaly,"Ingmar Bergman once said that ""The close-up, the correctly illuminated, directed and acted close-up of an actor is and remains the height of cinematography."". Bergman said it, Dreyer did it. In his film ""La passion de Jeanne d'Arc"" he tells the story mainly through facial expressions. In this film their are no establishing shots, only close ups. Everything that could distract from the faces has been eliminated. No make up, a set consisting of only white walls (which in reality were painted pink so that the color in black and white would be right) , no music and last but not least a story that exclusively focuses on the trial of Jeanne d'Arc and not on the battles that preceded the trial. The Dryer film is something completely different than the ""Joan of Arc"" (1999) from Luc Besson.",
68,17 August 2003,sdl-2,10, The most powerful movie I've ever seen,"There is really nothing I can say about this movie other than to tell you to get a hold of a copy as soon as you can, and keep a few boxes of tissues nearby.  I've never seen any film, let alone another silent film, that sustains this level of emotional intensity for its entire duration.  The first ten seconds of this movie will show you why some directors chose to end their careers when talking-pictures became popular.  The expressions on the face of the incredible Maria Falconetti carry the drama in a way that no dialogue ever could hope to do.  My only warning is that this film is not entertainment; it is an overpowering work of artistic genius that could make a stone weep.  So make sure you are in the right frame of mind before watching it.",
69,7 February 2006,marissas75,10, Simply devastating,"In ""The Passion of Joan of Arc,"" Carl Theodor Dreyer elects to tell the story of Joan's trial not through action or dialogue (or title cards, as this a silent film), but through faces. His simple but mesmerizing technique is to place the actors in rooms with stark white walls, film them in extreme close-up, and assemble the film by alternating images of Joan with those of her interrogators. The bare white set contrasts with the actors' faces, which are filmed in such detail that their flesh almost becomes tangible, and reveals everything you need to know. The craggy, warty faces of Joan's interrogators suggest human menace and evil, without the actors ever assuming an overtly menacing expression.",
