Review_Date,Author,Rating,Review_Title,Review,Review_Url
80,26 November 2009,FilmCriticLalitRao,10, A great film which must be seen on a big screen.,"If there is anybody who has not seen any film by Alfred Hitchcock,it must be said that that person must start Alfred Hitchcock initiation course by attentively watching ""Rebecca"".It is one of those great black and white films which would surely please anybody who appreciates meaningful cinema as it is made in such a professional manner that one can enjoy many good cinematographic elements in a single film. However, Rebecca is not a regular,run of the mill Hitchcock film with a lot of suspense.This is because this master of suspense deliberately avoided suspense in order to remain faithful to the original book written by English writer Daphné du Maurier.In this manner a personal touch was added to a film which has been celebrated all over the world.A giant screen of an equally huge cinema hall would ideally be the best place to appreciate this film with one's family as one can appreciate superb black and white cinematography which brings out the best of a Gothic tale.It is true that Alfred Hitchcock made ""Rebecca"" in USA for an American producer but it is still very much a British film as most of the actors including Laurence Olivier portray genuine behavioral traits of an English society.",
81,17 June 2001,caspian1978,6, Citizen Kane's House ?????,"You can't help but wonder about the mansion they lived at in the film Rebecca. Take a good look at it in the opening of the film and ask yourself the question, Does this house look very similar to the one Charles Foster Kane lived at in Citizen Kane? Not only does it look very similar, but the film starts out exactly like Citizen Kane with the slow movement of the camera introducing the mansion. I wonder what Orson Welles was thinking when he made his masterpiece 1 year after Rebecca premiered in theaters?????",
82,6 April 2014,dglink,10, Hitchcock & Selznick's Superb du Maurier Adaptation,"""Last night I dreamed I went to Manderlay again..."" and so begins one of the most captivating films from Hollywood's golden era. A superb adaptation of Daphne du Maurier's best selling novel, ""Rebecca"" was Alfred Hitchcock's first American directorial assignment, although producer David O. Selznick's strong influence is evident. While lacking the color and historical spectacle of ""Gone with the Wind,"" Selznick's follow-up to his 1939 blockbuster shares lush production values, a thickly romantic atmosphere, and flawless performances with its illustrious predecessor. Both classics were adapted from popular novels, and both won Academy Awards for Best Picture.",
83,30 December 2015,SnoopyStyle,7, old-fashion Gothic suspense,A sweet shy woman (Joan Fontaine) is staying at a Monte Carlo hotel assisting her employer pompous Edythe Van Hopper. She falls for the wealthy Maxim de Winter (Laurence Olivier) and they are quickly married. His first wife supposedly drowned. They live in his country estate Manderley with strict housekeeper Mrs. Danvers (Judith Anderson) and other servants. She discovers that Rebecca still dominates Manderley.,
84,22 August 2021,jfgibson73,10, Tennis lessons my foot!,"This movie has one of the best written thrillers providing the script. Add to that one of the greatest directors of all time, and you have a perfect film. Of course, the performances are great, my favorite being George Sanders as Favell. This is one instance in which it doesn't matter if you read the book or see the movie first--they are both highly enjoyable.",
85,8 February 2006,EUyeshima,9, Overlooked Hitchcock Masterwork Remains a Classic Romantic Mystery in Wonderful Criterion Restoration,"Even though this film won the 1940 Best Picture Oscar, it does seem a shame that master director Alfred Hitchcock's adaptation of Daphne Du Maurier's classic mystery is hardly mentioned in the same breath as his later works like ""Notorious"", ""Rear Window"" or ""Vertigo"". I'm not sure why but it may be because at the time, it was a film more associated with David O. Selznick in the afterglow of ""Gone With the Wind"" than with Hitchcock who was making his first picture in Hollywood. Sixty-five years have elapsed and diminished the perception of Selznick's then-powerful influence. Suffice it to say that ""Rebecca"" survives as one of Hitchcock's most atmospheric masterworks, beautifully filmed by George Barnes and with two superb lead performances by Laurence Olivier and Joan Fontaine. Major credit needs to go yet again to the Criterion Collection for restoring the original beauty of the black-and-white film from a pristine print and resuscitating a clear soundtrack. The result is well worth revisiting even if you have already seen it in earlier forms.",
86,15 August 2000,Chris-268,10," ""Last night I dreamt I went to Manderly...""","One of Hitchcock's finest films, and in my top five of all time. What can I say about this movie? I'll start with Joan Fontaine- perfection. In her long career she never equaled her performance as the Second Mrs. De Winter. Incidentally, she was given an Oscar the following year for her role in Suspicion, a vastly inferior film. Obviously a make-up vote by the Academy. When I first saw Rebecca years ago I fell in love with Joan, and I remain so to this day. She proved everyone wrong, including Olivier himself (who incidentally wanted his fiancee Vivien Leigh to play the part) who said she couldn't handle the role. Could you imagine Leigh as the Second Mrs. De Winter? No, no one could have been better than Joan Fontaine.",
87,16 May 2021,ash_what_,8, Flawless,"Classic Hitchcock taut with suspense, psychological deep, thrill, romance and eerie music amidst great framing.",
88,22 May 2016,elvircorhodzic,10," ""Last night I dreamt I went to Manderley again.""",I can not help feeling that the hostility between the producer and director on the one hand and the main actors on the other hand resulted in such a unique and excellent film. REBECCA is a mystery drama with elements of Gothic style that captivates completely. The director deliberately provoked gloomy atmosphere on the set. Despite that the actors are perfectly done their job.,
89,20 November 2001,blu_cu,9, WONDERFUL!!!,"Rebecca was the second consecutive Best Picture produced by David O. Selznick. Selznick did the right thing in bringing Hitchcock to direct the film and in doing so, turned it into a classic. Hitchcock is a genius and throughly deserved an Oscar. Laurence Olivier plays the rich English owner of Manderly, Maxim De Winter. Olivier gives a fine and tortured performance of a man who is haunted by his dead wife, Rebecca. His performance was great but the only flaw is that his character is annoyingly unresponsive to his wife. Judith Anderson gives a chilling performance as Mrs. Danvers, the crazed housekeeper with a lunatic obsession to her dead mistress, Rebecca. Her lines are classic and it is she who gives the tense atmosphere to the movie-Hitchcock's dark and cold Manderly just enhanced Miss Anderson's performance. It is Joan Fontaine who really gave the stellar performance as the second Mrs. De Winter. She is a shy girl who suddenly marries the haunted Maxim of a great estate. Hitchcock originially wanted Fontaine's sister, Olivia De Havilland to play the part. Olivier wanted his wife, Vivien Leigh. Although both ladies are great actresses, I'm glad that Fontaine was cast because she made Rebecca what it is today. This was the movie that sprung Fontaine to stardom and her shyness of the camera was carefully inputed into the character of the lonely Mrs. De Winter. Her first words: ""Last night I dreamt we went to Manderly again"" sets context not only to the story but to the character of Mrs. De Winter. She is shy, unused to a formal life, desperate for Maxim's love and most of all, intimidated by the presence of the late Rebecca in Manderly. Mrs. De Winter was supposed to be a plain and mousy person and so, Fontaine had the misfortune of being a beautiful woman playing an unattractive one. However, Fontaine presents other ways of being unattractive--such as that Mrs. De Winter has absolutely no social skills. All in all, Fontaine gave a performance that deserved a Best Actress Oscar. Although she lost out to Ginger Rogers, the Academy gave a compensation Oscar the following year for her less impressive ""Suspicion"".",
90,29 February 2004,whpratt1,10, Classic Picture of ALL CLASSIC FILMS!,"Have not viewed this film in many years, however, when ever I need to see a great Classic Film with great Actors and a director like Alfred Hitchcock, I can really appreciate the great films from the past and the great gift Hollywood has given.  George Sanders(Jack Favell),""The Lodger"",'44 plays a horrible blackmailer, who is very hateful and tries very hard to destroy Laurence Olivier(Maxim 'de Winter),""The Jigsaw Man"",'83, and claims that he murdered his first wife. Judith Anderson(Mrs. Danvers),""The Red House"",'47, supports Jack Favell in his efforts to break up the marriage of Maxim'de Winter and rid him of the beautiful Mansion that he lives in. Judith Anderson was a great actress and played very evil and cruel roles through out her career and was given the highest award that England could present to an actress, naming her DAME in 1959.  If you look close enough, you will see Nigel Bruce(Maj.Giles Lacy),""Sherlock Holmes & the Spider Woman"",'44,who played a great supporting role.  He was Dr. Watson in the 1940's Sherlock Holmes series.   Alfred Hitchcock made this film into a masterpiece of fine acting,with great perfection, he even produced in later years a great horror picture, ""Psycho"", which cannot compare to ""Rebecca"", but  the film brought in a great deal more MONEY!",
91,1 May 2006,showgirl626,9, One of the most amazing movies of its day...,"I don't normally get into love stories, but this love story is so very different than most. All those Hitchcockian twists are great, Mrs. Danvers is deliciously wicked, and the on-screen interaction between Olivier and Fontaine (considering they hated each other when the cameras were turned off) was quite convincing. I have rarely enjoyed movies from this era because I thought the acting was wooden. Maybe it's just that I'm a big Hitchcock fan, but I don't think that's totally it. The lighting is wonderful, providing such crisp detail, the cinematography excellent, the set design marvelous (with the exception of a couple of cheesy fake backgrounds), and the miniature Manderley is exquisite. I would have to say that this movie is one of the best that Hitchcock ever directed, and definitely one of my favorite movies ever. I'll watch it again and again, and I'll recommend it to anyone.",
92,12 February 2009,akhilgenx2005,10, A bouquet of many senses,"Rebecca is a true classic movie..made in 1940.kind of mother of all thrillers..based on a classic novelI was astonished to see how they were able to make such technically good movies almost 70 years back. This is what I like most about movies..no matter you watch an old one or a new...the performance and the screenplay remain the backboneits not a science in true sense but a bouquet of many senses coming together..and Rebecca is a perfect exampleJoan Fontaine did a wonderful job ..her innocence was nicely built into her body language throughout the movie and it was just done to the level of perfection (without brushing the overdone level even momentarily). Olivier's dialog delivery was great and as fast as I have ever heard (in sports commentary) and it was all making sense too. The movie had romance, mystery, thriller..good cinematography.well thought dialogs.background musicand always on track and you could tell the director was very much in controlMrs. Danvers role is another major accomplishment in the movie because that character pretty much solely brings in the thriller elementI would probably rate it as Hitchcock's best, once again mainly because of the technical soundness, so long back",
93,5 August 2016,Horror-yo,8," Excellent, beautiful romanticism","A beautiful film very well directed, with very good acting, an excellent setting and decor, a very good screenplay, based on a very efficient story from the novel of the same name, 'Rebecca' is the real deal. This film is as much about story as atmosphere, and everything works in the way of the atmosphere transpiring evidently from this piece as one will surely keep at least some visual images and the overall feel from this film some time after viewing it. It's just about what one would expect of a Hitchock-directed picture rooted in a deep Gothic, dark romanticism. A few special mentions to Joan Fontaine who was arguably in her prime, absolutely gorgeous and attentive to play her role judiciously, as well as Olivier sometimes criticized who played his role of the constantly tormented, preoccupied but forgetting himself in the present moment male lead just right, and the actress portraying Mrs. Danvers who was simply exact with her performance.",
94,12 May 2021,acec-29548,9, A must see film,Alfred Hitchcock at his best. The book is extraordinary and he stays true to the book. You don't really understand the plot line and intense emotions of the characters until the very end. Well done!,
95,19 October 2020,zutterjp48,8, A very good story,"Based on the novel of Daphne du Maurier ""Rebecca"" is a very good story of drama and mystery.A widow, Maxim de Winter married a young woman that he met in France and goes back with her to Cornwall, in the house where he has lived with his first wife Rebecca.Immediaty the new Mrs . de Winter notices that something is going wrong in their relationship, his husband is haunted by the memory of his first wife , the housekeeper shows animosity against her.The death of Rebecca is quite a mystery,
A fine and interesting story about a family mystery.
The performances of Laurence Oliver and Joan Fontaine are ecellent.",
96,18 July 2012,loveballet12,8, A Magnificent Film,"Date: 18 July, 2012 -First Time Watch- I love old Hollywood movies, mostly because they had good story lines and fantastic acting. Alfred Hitchcock does an amazing job with this in almost every movie he did. 'Rebecca' is an example of a another amazing old Hollywood film. The story opens with Joan Fontaine finds Laurence Olivier (he was so young and I felt oddly attracted to him) on the ledge of a cliff, ready to jump in. She stops him and they met up again later that day. They spend lots of time with each other and soon marry, despite the fact that Ms. Fontaine is unprepared for her new role as Olivier's wife. Trouble only continues when Ms. Fontaine arrives at the large estate and finds that everyone, especially the head maid Miss. Danvers, compares her to the greatly loved Rebecca, Olivier's first wife who died tragically a year before when she took her boat out by herself and drowned. But, as always Mr. Hitchcock throws in several twists and turns with a surprising conclusion. Definitely a very well done film with plenty of action and suspense to keep you interested.",
97,4 February 2022,fluffchop,9, Great movie,"Thoroughly enjoyable viewing from beginning till end. Full of great characters and performances, suspense and intrigue abound. Great story, great movie.",
98,30 July 2010,slokes,7," Chick Flick ""Vertigo""","Nearly 20 years before ""Vertigo"", Alfred Hitchcock made another film featuring romantic atmosphere, social misfits, a possible ghost, and male-female frustration. Except in ""Rebecca's"" case, it was from the woman's point of view.",
99,1 November 2020,Cineanalyst,9," A Haunted House, Incest, Lesbians and Rosebud","The central romance and mystery may be the least interesting thing about ""Rebecca,"" but even that has its psychosexual perversity. It's a typical Hollywood coupling of an older man, Maxim de Winter (Laurence Olivier)--in this case a widower--with a younger and inexperienced woman (Joan Fontaine). She's presumably a virgin before they meet, but, more than that, for most of the picture, she's entirely submissive and unsure of herself. She has so little identity beyond constantly being afraid and her devotion to her husband that she's never even given a name until she's married, becoming the second Mrs. De Winter. Orphaned, she leaves the employ of one mother figure to marry a stand-in for her other deceased parent. This is precisely what Maxim adores about her, too, as he orders her to never be 36 years old and laments what a pity it is that she has to ""grow up."" The Oscar-nominated Fontaine nails ""that funny young lost look,"" too, that her fatherly husband wishes to preserve. The great mystery of this Gothic romance turns out to be that Maxim didn't love his first wife precisely because the gendered roles were reversed--him inexperienced and Rebecca unsubmissive and sexually promiscuous. It's the old chestnut of punishing women for sexual infidelity, which, as it involves her cousin (George Sanders), also takes on an incestuous quality this time--and not of the sort condoned in the father-and-child dynamic of the second marriage--to go along with a hint of gay panic and queer bashing over the subtextual lesbianism between Rebecca and Mrs. Danvers (Judith Anderson) and the threat thereof between Mrs. Danvers and the second Mrs. De Winter.",
100,8 January 2012,sumana-m21,8, Never seen a Rebecca,"You never see Rebecca throughout the movie, yet she captivates you as the audience for the most part. Her beauty, wits and most importantly how she had managed to admire so many people all at once while maintaining her solemnity with everyone except her husband. Without going into too much depth, this movie will captivate you, confuse you and still manage to not deprive you of the very curiosity you will crave for. But a vintage masterpiece you shouldn't pass by. There are some scenes however which I felt could have been dealt with in greater detail, but considering this is an old classic, one must realize there are some things better not to expect. Enjoy it as is. 8/10",
101,8 October 2000,kenandraf,1, Over rated!,This was an average movie.Not more not less.The camera angles and shadow techniques of Hitchcock saved the film and turned a bad movie into a fair one.Best picture Oscar?I don't think so.The acting was also good and the actors had to do as much as their skills would allow to bring life to a limited screenplay.......,
102,28 August 2006,thepartyoftea,10," Felt, not seen....",Rebecca (1940),
103,9 January 2009,PudgyPandaMan,9, An atmospheric masterpiece,"This was Hitchcock's only movie to win Best Picture. That still shocks me as he had so many good films. While I'm not sure I would rate this his best picture, there is so much to love here if you are a fan of Classic Film.",
104,31 December 2005,Igenlode Wordsmith,8," It's clever, but is it Art?","The tragedy of this film -- at least to anyone who knows the book, which is naturally a self-selecting and biased group -- is that the pacing is terribly uneven. It's almost as if the studio suddenly noticed that the picture was going to run twenty minutes over its allocated slot, and ordered the final scenes to be cut to the bone and run together at breakneck speed. The result, for me, is a curiously unsatisfying finale; why go to the trouble of altering the original plot to ensure that Maxim's wife is in the house when it is set on fire, for example, and then cut the sequence so quickly that there is no real element of suspense whatsoever? It's a tragedy precisely because the film was potentially so good. I've seen stage adaptations of the same story, and they totally failed to catch the book's mingled atmosphere of sunlit happiness and suspense -- the taint of Rebecca reaching up from the past to destroy the innocence of the present. Right up until the moment when the heroine descends the staircase, however, this version is almost flawless; the comedy, the romance, the crippling social humiliations, the country-house interiors, the monstrous Mrs van Hopper, kind and tactless Beatrice, insinuating Jack Favell, aloof Maxim... and, of course, Joan Fontaine, who might have been made for the part. I had no mental image at all of what the book's heroine looked like -- but the moment I saw Miss Fontaine I knew she was absolutely right. Arguably she is too beautiful, almost distractingly so at times; but her style, her body language, the schoolgirl simplicity of her face, are all exactly fitting to the mood of Daphne du Maurier's unnamed narrator.",
105,19 April 2014,l-seidel,9, Less is more,"Rebecca is a beautifully made film that, every time I watch it, sticks with me for some time after. Hitchcock masterfully uses the medium of film to mirror the story he is telling. The way the images flow across the screen is haunting, beautiful and adds so much to the emotional resonance of each moment. ",
106,28 May 2018,Darth_Osmosis,10, One of my favorites from Hitchcock,"I wish Hitchcock had done more movies like this. It's not his best, but the atmosphere and mood are incredible and virtually every other element is superb too. It's hard to see how this could have been done better really.",
107,29 June 2020,davidmvining,10, Hitchcock comes to Hollywood,"So, Alfred Hitchcock traded an out of control actor/producer in Charles Laughton for just an out of control producer in David O. Selznick. That honestly feels like a step in the right direction. Instead of having an egomaniac try to dictate Hitchcock's own movie to him on set, he only had the egomaniac on the phone and in the editing booth. Reading about Hitchcock up to this point in the timeline of his filmography, this is the first time I've seen his editing in the camera technique mentioned where he only shot exactly what he needed to edit together. So, he didn't have entire scenes playing out across multiple takes, instead he shot what he needed from a particular actor in an exchange at a particular angle and stopped filming. I have to imagine that this was a technique that he developed while working in the studio system in Britain where he had to be as economical as possible. It had the added advantage of preventing Selznick from completely remaking the film in the editing bay. So, despite the stories of how much Selznick wanted to mess with the film, Hitchcock made the film in a way that only minimal messing could happen.",
108,24 August 2005,vitaleralphlouis,8, Not exactly Gone With the Wind,"In 1939, David O. Selznick produced ""Gone With the Wind"" --- recognized as the greatest movie ever made until... until latter day Liberal Democrats decided it was politically incorrect as it depicted slavery during the Civil War era south --- when it was relegated by the libs to the scrap heap of history and slave-free ""Casablanca"" took GWTW'S place. Anyway Selznick was honored in 1939 by a ton of Oscars including Best Picture of the Year. Not satisfied with thus honoring Mr. Selznick, Hollywood bestowed another Best Picture Oscar on him in 1940 for ""Rebecca."" The difference being that GWTW is/was truly a great film, while ""Rebecca"" was boring enough to put a hyper-active into a coma of ZZZ's. ""Rebecca"" was an Alfred Hitchcock directed film, and I'd say there are at least 20 Hitchcock pictures of superior quality, not one of which took the Best Picture Oscar. This was perhaps the year, and the film, when Oscars became one big joke, having so many awful films having taken Best Picture. Boo! Hiss!",
109,10 June 2020,zzhhhqing,9, True priceless,"Love comes too fast like a tornado, but true love is so hard to find. Each lover always has another side. It is a lucky thing to meet the right one. Lovers should be honest with each other. If you trust each other, the love of the actor The second spring finally became a dependent. The horror and haze of the film are well rendered and the plot is compact. Finally, the housekeeper must be selected.",
110,24 October 2008,Boba_Fett1138,7, Good but also just one of those overrated Hitchcock movies.,"Not that this movie is horrible but it just also doesn't exactly lives up to its reputation. This is not the only Hitchcock movie with this problem and even though I absolute love most of Hitchcock's movies and he was an absolutely brilliant and a one of a kind director, he doesn't get a critical free pass from me. Needless to say this movie disappointed me even though it had plenty of redeeming qualities, which in the long run still makes this a perfectly good movie.",
111,5 May 2009,lisa-kevin3531,10, Stylishly Eerie And Amazingly Well Executed,"I've never been a big fan of Alfred Hitchcock, but his Rebecca is simply hard to fault. Even if you aren't a vintage movie buff, you owe it to yourself to see this film. Joan Fontaine is stunningly beautiful as the new Mrs. DeWinter and Laurence Olivier is charming but cold as her new husband. Judith Anderson as the sinister housekeeper is a performance that must be seen to be fully appreciated. The production is flawless and the trademark Hitchcock use of light and shadows to create an eerie atmosphere is truly a work of fine art. I first saw this movie on late night TV when I was a teenager, and I've seen it probably twenty times since then. This is one movie I will never tire of. There simply isn't enough praise for this film! This is a must-see motion picture. The mystery is enthralling, right up to the last frame.",
112,22 December 2017,ericrnolan,8," A very short review of ""Rebecca"" (1940)","Scratch one thing off the bucket list - I finally got around to watching Alfred Hitchcock's ""Rebecca."" (A cinephilic uncle introduced me to a handful of the director's better known classics when I was an adolescent - ""Rebecca"" was one that we never got around to.) Based on my own enjoyment of it, I'd rate this film an 8 out of 10.",
