Review_Date,Author,Rating,Review_Title,Review,Review_Url
255,6 June 2020,dr_clarke_2,6," Enjoyable, but not Hitchcock's finest work","Rebecca is notable for being Alfred Hitchcock's first American film, and his only film to win the Academy Award for Best Picture. Given that latter point, it's perhaps ironic that he would later go on to make much better films: Rebecca, despite its reputation, is not his finest work.
Rebecca is closely based on Daphne du Maurier's novel of the same name, and sees Joan Fontaine's otherwise unnamed second Mrs de Winter meet and marry rich widow Maxim de Winter, only to discover that the shadow of his deceased first wife Rebecca hangs over their marriage. Part romance and part psychological thriller, the story sees the second Mrs de Winter - through whom the plot is focalised - gradually discover the truth about Rebecca's death.
The problem with the plot is that it changes direction twice, resulting in an uneven feel to the film. The first half sees the second Mrs de Winter meet Maxim, fall in love, get married, and then find herself somewhat lost in his huge mansion Manderley, which is metaphorically haunted by the spectre of Rebecca. The plot shifts halfway through as we start to discover the truth about what happened to her, and then shifts again for the final quarter, as it transpires that Maxim actually hated his first wife and he ends up in the familiar Hitchcock territory of a man desperately trying to clear his name in the face of wrongful accusations about Rebecca's death. All of which makes the film feel top heavy, with a padded first half and a second half that suddenly introduces new characters, most notably George Sander's caddish Jack Favell.
The other problem here is the characterisation. The screenplay is credited to Robert E. Sherwood and Joan Harrison, with adaptation by Philip MacDonald and Michael Hogan, and the involvement of four writers (plus, technically, du Maurier) is perhaps why it is less focused than it could have been. The film's main protagonist the second Mrs de Winter is quite nervous, insecure and basically rather wet during the first half, but suddenly finds new reserves of confidence and determination once she discovers the truth about Rebecca; despite a strong performance from Joan Fontaine, this means she never quite rings true. Similarly, Laurence Olivier's Maxim is by turns cold, warm, distant and vulnerable as the story demands and thus feels less like a real person and more like a function of the plot. Likewise, icy housekeeper Mrs Danvers, who gradually and subtly undermines and persecutes the second Mrs de Winter, suddenly decides to burn Manderley down at the end and kill herself in the process (possibly accidentally) purely out of spite, which feels like a step too far for the character.
But despite these faults, there is much to enjoy and admire here. Hitchcock's characteristic directorial flare is apparent throughout, bringing an appropriately Gothic feel to the film which has aged well. Right from opening scenes, George Barnes' award winning cinematography impresses: the second Mrs de Winter's first view of Manderley is through a rain-sodden windscreen, and after the wide-angled, deep-focus shots of the French Riviera scenes, close-ups and other techniques at Manderley make the excellent sets seem oppressive, whilst at the same time enormous and labyrinthine. Franz Waxman's score - added in by producer Selznick during editing - is a bit intrusive at times, but for the most part is memorably atmospheric as the mood of the film darkens. And whatever the flaws of the characterisation, the acting is superb: there's a lengthy scene in which Maxim reveals the truth about Rebecca, and which consists largely of melodramatic dialogue: Olivier's performance and Hitchcock's direction make it tense and absorbing. Judith Anderson is well cast as the intimidating Mrs Danvers, as is George Sanders as Favell and Florence Bates as Mrs. Van Hopper, the second Mrs De Winter's battleaxe of an employer.
Overall then, Rebecca is perhaps not as a good as its reputation would suggest. Nevertheless, like most Hitchcock films it is worth watching, and is significant for bringing the director to America, where as history has proved, he would go on to make some of his very best films.",
256,22 June 2017,chaswe-28402,8, Sinister and Creepy,"The ending is more than a little ex machina. Very unpleasant types: Hecate van Hopper, Maximum de Winter, Deathly Danvers, Flakey Favell Foulenough, combine to bully a sweet, pretty, innocent, young girl with no name. But she slowly grows strong, takes Maxim in hand, and in the end sees off the others. This all takes place at Manderley, not Mandalay. Joan Fontaine is gorgeous.",
257,29 January 2019,fanan450,6," good to watch , but not great","Well , I must say I enjoyed watching this movie , despite it was too long but it's ok for me i used to watch old movies like this . the music was wonderful, the actors did a great job , the story was good , but in my humble opinion this kind of movies you gonna watch it only for once in your life , because you heard or read this movie is considered a great or top rated one's , that's the only reason , and after that you will be shocked it was normal , like I said before , it was good to watch but not great .",
258,8 August 2016,JoeKulik,7, Joan Fontaine portrays a pre-Feminist Clueless Doormat !!!,"I give this film a 7.5 on a 10 point scale. All of Hitch's films, though mostly good, have screenplays that are just unbelievable & improbable to some degree and ""Rebecca"" is certainly no exception. Fontaine's character is S-O-O Weak, Naïve, Passive, & Fragile that it lacks credibility. NO Woman, even in pre-Feminist times, could possibly be as much of a Clueless Doormat as the new Mrs de Winter. That as the new mistress of Mandalay she would have kept that witch Mrs Danvers as the housekeeper is at least very unlikely, especially when Danvers tricked the new Mrs de Winter to wear that dress for the ball. The Mrs Danvers character was rather unreal too. She was much more a caricature than a believable character. Otherwise, a very suspenseful, & well thought out storyline, with great dramatic tension, although the ""dramatic"" was much too ""melodramatic"" in my opinion. How a great director like Hitch got stuck with so many sub-par screenplays is beyond my comprehension.",
259,25 July 2022,xiaoli7377,9, Nice Early-ish Hitchcock,"He would perfect his craft by the late 50s, but ""Rebecca"" is still solid. I loved Laurence Olivier here, as well as Judith Anderson as Mrs. Danvers.",
260,25 July 2001,Mike-764,9, Enchantingly Eerie,"A young traveling companion of a wealthy dowager falls for the recently widowed Maxim de Winter. The two marry and return to Maxim's mansion Mandalay. What Mrs. de Winter doesn't realize is that the former Mrs. de Winter, Rebecca, still has a hold over the house and the people in it especially the servant Mrs. Danvers. Rebecca though still has her secrets as does Maxim. Its up to the second Mrs. de Winter to see that she is not destroyed by them. Even though it is very studioesque ( something rare in a Hitchcock film ), the movie is just sweeps you up into this romantic intrigue. Very good performances by Olivier and Fontaine, but Judith Anderson steals the show. Rating, 9 out of 10.",
261,10 November 2009,bragant,10," ""I am Mrs. de Winter NOW!""","Despite the fact that Hitchcock himself tended to be dismissive about this film (telling Truffaut, ""It has held up remarkably well. I have no idea why.""), REBECCA is undoubtedly one of his timeless classics - the kind of work which has become so embedded in the collective unconscious that certain scenes, lines and characters are mythic, to the point of parody (think of Carol Burnett's riffs on this story in her 1970s comedy show, or Stephen King's use of Mrs. Danvers' image in his ""Bag of Bones""). This is also one of Hitchcock's great crowd-pleasers - when first released, it played in New York for a year - held over repeatedly due to audience demand - and in England the movie went through the roof, running in London for virtually the length of World War II. It's been playing constantly since then in frequent revivals and television screenings. REBECCA's production was fraught with tension and pain: principal photography started only days before the outbreak of WWII, to the great personal distress of the nearly all-English cast and crew; Hitchcock exploited Joan's Fontaine's inexperience by telling her that she was terrible and everyone hated her so as to deliberately keep her in a near-constant state of defensiveness, fear and anxiety which was 100% appropriate for Fontaine's character; and it soon became quite obvious that Selznick and Hitchcock could not stand one another and would be unable to work together in the long run. The resulting motion picture, however, brought nothing but good fortune to everyone connected with it - Laurence Olivier's long-desired Hollywood career finally took off, Hitchcock's reputation in America was secured, Joan Fontaine became an international star overnight, Selznick won his second Best Picture Oscar in a row and dominated world box-office for another year, and Judith Anderson became an icon, just for starters. This is one of those rare instances where a fantastic book was brought to the screen and made into an equally good film. Miss DuMaurier's plot is legendary: On holiday in the south of France, the untitled Cornish nobleman Max de Winter meets and marries a sweet young girl (Fontaine) whose timely attention perhaps stops him from suicide in one of the best meet-and-greets of all time. Mr. de Winter's subsequent proposal (""I'm asking you marry me, you little fool."") rescues the girl from the hell of her life as a paid companion (""I didn't know companionship could be bought,"" says de Winter) to the Gorgon-like American socialite Edythe Van Hopper (Played with true verve by Florence Bates: ""Give me a chocolate quick!"" she cries as she stubs her umpteenth cigarette out in a jar of cold cream). After a whirlwind courtship and fast Italian honeymoon, de Winter brings his bride to the ancestral estate of Manderley. The second Mrs. de Winter is not happy in her new home, which seems to be overshadowed by the presence of Maxim's first wife Rebecca, dead for some time in a boating accident. Matters are not helped by her own complete ineptitude in her new position of Great Lady, or the hostility of the housekeeper, black-clad Mrs. Danvers (superbly incarnated by Dame Judith Anderson in the only successful one-note performance in movie history), who seems to have a strange fixation on her dead mistress, keeping Rebecca's clothes, personal possessions and rooms exactly as they were during Rebecca's lifetime. De Winter himself behaves like a different man - brooding, gloomy, temperamental and even verbally abusive. Poor Joan Fontaine blames herself for her predicament, contrasting her awkward plainness with Rebecca's alleged poise, grace and popularity...After a disastrous development during a costume ball, matters seem even more hopeless when Rebecca's previously-undiscovered body turns up out of nowhere, and it seems Mr. de Winter has a lot of explaining to do...Strong plot and performances aside, this film has a truly unique atmosphere - George Barnes' Oscar-winning cinematography transforms Manderley into a Gothic symphony of light and shadow where unseen forces seem about to manifest themselves at every turn. Perhaps the greatest bit of showmanship is the way the dead, absent Rebecca becomes a major character - in the stunning and very perverse sequence (""Feel this..."") where Mrs. Danvers shows the new Mrs. de Winter Rebecca's things, you can SEE Rebecca in your head while ""Danny"" speaks. While the film is quite long (over two hours), you won't want it to be shorter by one second! A classic for the ages which the whole family can watch and enjoy together.",
262,29 October 2014,tabbyharwood,3, Infatuation leads to Death,"Rebecca, a movie from 1940 directed by Alfred Hitchcock; starts of being told by a narrator from a dark gloomy outside setting. It quickly changes to the indoors of a wealthy home. A wealthy woman, Mrs. Van Hopper has a young lady that tends to her needs and young lady takes a liking to Maxim played by Laurence Olivier. They start spending a lot of secretive time together and they fall in love. Mrs. Van Hopper continually reminds her that Maxim had a wife named Rebecca Van Hopper's daughter is getting married in New York and she must leave Maxim. Maxim wants her to marry him and not go to New York but to go to Manderley with him.",
263,27 November 2022,OldieMovieFan,4, hitchcock's camera and then all the rest,"Nice production values can't keep this one above the bottom third of Hitchcock's films because of the dragging, endless lack of emotion on display for hour after dreary hour.",
264,14 July 2000,vvva,8, Wonderful Concept But The Movie Drags A Bit,"This definitely was a great picture, one of the 100 best ever but in the middle gets a bit boring and the end is quickly rapped up and the viewer sort of loses interest in the movie by the end. Everyone, especially Joan Fontaine and Judith Anderson give excellent performances. The idea of never showing Rebecca was ingenious as well not giving the new wife a name. Watch the movie, because it really is a classic though.",
265,12 April 2004,blackberrybabe,8, No wonder Hitchcock's movie won an Oscar!,"This movie is based on my favorite book. Joan Fontaine is excellent as the young bride, although the character annoyed me with all her crying. Laurence Olivier shines as Maxim de Winter. He is the perfect person to play the handsome, tortured widower. George Sanders is also perfect as Favell, combining both humor and menace to build a memorable character. When watching the film, it's easy to tell why this won the Oscar for Best Picture. ",
266,29 May 2021,Filmdokter,7, Intriguing plot but a bit heavy on the dialogues,The film kicks off quiet slowly and Hitchcock allows to get to know the two lead characters (Fontaine and Olivier). The plot really gets going once the newlyweds arrive at Manderlay. From there the film that's started rather as a romantic story turns into a thriller (what happened to Rebecca?) and a drama (Fontaine and her struggle as the new lady of the house). It is a bit of a shame that the great way in which Hitchcock tells this story visually is sort of abandoned in the final 40 minutes or so. There we have (really) long dialogue scenes that take the thriller bit out the film. A pity but nonetheless a film worthwhile checking out.,
267,10 October 2021,xan-the-crawford-fan,8, Dark atmosphere; fabulous film,"An unnamed heroine (Joan Fontaine) meets the charming, and much older, Maxim de Winter (Laurence Olivier). After a quick courtship, Maxim brings his new bride back to his home of Manderly, but the spirit of his first wife, as well as one servant's- Mrs. Danvers- inability to forget Rebecca. But what really happened to her? Where did she go, and why are some people unwilling to forget, yet others not wanting to remember? Watch the film.",
268,6 November 1998,Pat-54,9, Hitchcock's First American Film,"I read the book first and it was written in ""first person"" and the name of the main character is never revealed.  So when I saw the movie, I was very much amused to find that Hitchock never reveals the name either.  Typical of the Master!  This is his American debut and the only film of his to win the Oscar for Best Picture of the Year (1940).",
269,7 December 2017,huntermcintyre,8, Rebecca review,I really enjoyed this film like I usually enjoy Hitchcock films. This one is a bit different however. His suspense element is still here but the films true highlight is its directing. This films directing is truly special and Hitchcock really uses the camera to get every reaction and emotion out of the actors. Speaking of the actors they really do Hitchcock's directing a favor because each of these actor play their rolls excellently. This film is a little bit different from normal Hitchcock films but it is very good and I really enjoyed watching it.,
270,18 August 2002,Loring,9, chilling,"OK, so Joan Fontaine overemotes a bit.  But Olivier is excellent in his effort to act the carefree playboy haunted by his first wife, as is the spectacular supporting cast, the cream of British character acting of the 30's and 40's.  George Sanders plays the part George Sanders always plays (and it is irrelevant whether he is the good guy, as in the Falcon series, or the bad guy, as in most of his other films) and does it better than anyone else can.  Judith Anderson makes your blood curdle while she is being ever so proper and polite.  And then there is the first Mrs. De Winter -- ah, she is the scariest of all to poor, suffering Joan.  A simple but brilliant story by du Maurier directed masterfully by Hitchcock.  A horror movie where all the horror is in your mind, but then, aren't those the best kind?",
271,4 November 2011,BatBanks,6, Slow Story,"Rebecca is romantic mystery about a mousy girl meeting and married a wealthy older widower when she comes to his mansion. Discovers that she live in the shadow of her husband beautiful first wife, Rebecca discover family secrets and an obsessive housekeeper. The film is slow and takes too long to get to the point; you rather listen to Orson Welles radio version. The acting was all right, but Joan Fontaine was miscast as the nameless character but she got a cute face. The film is overrated and stupid, but it based on book by the same name and directed by Hitchcock himself before Rear Window and The Birds days. They cast the right actor to play Maxim DeWinter(played by more talented Sir Laurence Olivier).",
272,12 May 2015,lhug74,7, Rebecca,"I can see now why Alfred Hitchcock is such a well-respected and well known director. The movie, Rebecca, is about a young woman living in Monte Carlo with her mean employer. She met a very wealthy man by the name of Maxim de Winter. The two fall in love and move back to Maxim de Winter's large estate but it doesn't take long for his new wife to notice that the death of his first wife, Rebecca, still has an effect on everyone in the house. They all still miss her and it is obvious that they wanted the new wife to kind of take the place of Rebecca in a way that she just couldn't do. Rebecca had a huge effect on the housekeeper, Mrs. Danvers. She even set the house on fire at the end of the movie and ended up dying in the house. The movie had a very surprising ending which I liked. Hitchcock is a great director and you can see that through the movies lighting, camera-work, sounds, and editing.",
273,16 December 2013,mgruebel,8, Hitchcock waxing,"Rebecca is one of the transition films that took Hitchcock from his British period to his early US period. Joan Fontaine, who just died as I write this, really is someone to behold in this film. It is always amazing how Hitchcock starts with innocuous situation, like a young woman employed as company for an elderly lady, woven together with a chance encounter, and ends up with a tightening noose around his characters. He perfected this in Psycho, and in the late, lesser work Family Plot - which is still remarkable.",
274,2 November 1998,Caroseli,9, A Hitchcock Classic,"This is easily Hitchcock's most underrated film, although at the time it won Best Picture. Although Laurence Olivier and Joan Fontaine both turn in great performances, Judith Anderson steals every scene she is in as the psychotic housekeeper, and the plot turn in the middle is one of the best I've ever seen.",
275,27 July 2022,prabhavpradeep,10, Totally Chilling,"What A Brilliant Movie By Sir Alfred Hitchcock Again , OMG I was totally devoted into the movie for complete 2 hours , it's just brilliant. Beautiful Cinematography , Thrilling Music , Great Suspense . A very well made movie.",
276,15 August 1999,thniels,9," Not the best Hitchcock, but definitely the best of it's kind","I much prefer Hitchcock for his more light hearted movies, such as Strangers on a Train, North by Northwest and Rear Window, but while Rebecca may not be my favorite Hitchcock movie, it certainly is among my favorites (alongside movies like Gaslight) when it comes to this sort of dramatic mystery. It is brilliantly acted and beautifully shot. It's not exactly scary from the point of view of the audience, but you feel increasingly worried for Joan Fontaine as Rebecca's ghost eat it's way into the movie.",
277,8 December 2019,andrewmerritt-31652,9, A twisted fairy tale,"Rebecca stars Joan Fontaine, Laurence Olivier, and Judith Anderson. The story revolves around a young woman who meets Maxim De Winter and soon becomes his second wife. Later, he takes her to her place named Manderley where she learns a dark secret to his first wife. Rebecca is a twisted fairytale. At the beginning of the film we are introduced to Joan Fontaine who is a shy and insecure woman looking for love. She later meets Maxim De Winter who acts as her prince charming even though he is cruel towards her and she tries everything to escape her evil godmother and eventually the two fall in love and get married. She has this fantasy that he will to her to his palace called Manderley and live happily ever after, but it is far from happy. She is Snow White who wakes up from her coma with the imagination that she will live happily ever after with her prince charming, but once she sees Manderley up close her fairytale is an illusion. Mrs. Danvers is the Queen in the Snow White story who is the scariest woman in movie history. Mrs. Danvers loved the first Mrs. De Winter almost as she were the first wife before the second Mrs. De Winter took her place. All the other characters that we meet along the way are part of the second Mrs. De Winter's fairytale illusion. She's still wants that fairytale to be real and it's the only one living in that fantasy while everyone else is oblivious of the fact that they are also part of the story, but they don't realize it. By this point there is no hope for her as she refuses to be woken up from her dream as she believes that dreams can come true while the first wife was cruel to Maxim. Maxim at once believed that dreams do come true, but once he found out about her real intentions he woke up and realized that his dream was shattered. Alfred Hitchcock takes the beloved fairytale that we all know and turns it upside down and gives it a more gothic tone. Overall, this love story shows us that love is cruel and harsh even though we don't want to accept it. Rebecca took me completely by surprise as it showed me what love is truly about filled with tons of suspense that makes this a great film to watch.",
278,7 October 2001,jonathandoe_se7en,9, Hitchcock proves himself the Master,"With Rebecca, his first US film Hitchcock proved without a doubt that he was one of the truly talented and gifted film makers ever to pick up a camera. There are none of the bold plot devises and cranked up tension in this film, something that Hitch would later make his own throughout the rest of his career, Rebecca relies on performance. With the great acting, production design and cinematography Hitchcock creates an intensely dark mood.",
279,15 April 2020,Pooooh,7, Rececca,"The director rendered the movie very well, but the rhythm was a bit too fast.Personally,I think it was not normal story.There is no real protagonist from the beginning of the movie.The so-called protagonist has been living in other people's stories and memories.The whole movie is like a misty dream.",
280,29 July 2002,ajrabbits,9," Superb direction, acting, and story!",This is one of those movies you can watch over and over again and still be amazed and entertained.  There is not one bad scene nor one bad actor in it. The cinematography is exquisite and the locations are breathtaking.  Rent this movie...or even better...buy this movie!  You will watch it many times over and will definitely get the worth out of every buck you spent on it!,
281,4 October 1999,Rose-35,10, One of Hitchcock's best,"I only watched this movie because I had to read the book for school but it ended up being one of my favorites (movie and book). Joan Fontaine is wonderful is this but it's Judith Anderson who gives the best performance as Mrs. Danvers. Though the movie is a tad bit different from the book, it's still a good one to watch.",
282,27 December 2018,hennystruijk,10, Mesmerizing!,"A brilliant film--on every level. From screenplay to acting to cinematography - an amazing achievement! Everyone is wonderful in it--but the film belongs to Fontaine. Unbelievable that she didn't win the Oscar!
This is a rare film you can see many times and never tire of.",
283,28 August 2020,fionafarsi,6, Book was better,"I am a big fan of Hitchcock's work but I was quite disappointed with this one. The film lacks gothic and mysterious elements that are present in Daphne DuMaurier's novel. I feel as if this film was rushed and there was not enough depth to the characters. The build up to the big twist was underwhelming. While reading the book, there was a lot of build up towards the end, preparation. I will admit though, it is hard to fit a storyline that occurs over the course of 6 months into a 2 hour movie. The only reason I am giving this a higher rating is because I think that the the main characters are perfect in their roles.",
