Review_Date,Author,Rating,Review_Title,Review,Review_Url
145,27 June 2008,theconservativeliberal,2, Captain Misogynism or the master of predictability? Take your pick.,These lines of dialogue are a good summary of why Rebecca sucks.,
146,20 September 2020,HabibieHakim123,10, Another Hitchcock's Masterpiece,"""This movie is a masterpiece, this movie is genius, this movie is amazing, awesome, and fun, another unboring long movie, just follow the movie then you get the tense, the feeling, and the most important thing is the answer, what a great and amazing experience, the ending is perfect, highly recommend and i can't wait to see the remake""",
147,30 June 2005,jboothmillard,9, Rebecca,"Most people would think that Psycho would be the most financially successful at the cinema from director Sir Alfred Hitchcock (Suspicion, Rear Window, Vertigo, The Birds), but actually it was this one, based on the book by Daphne Du Maurier. Basically, on vacation in Monte Carlo, a self-conscious inexperienced young woman (Oscar nominated Joan Fontaine) meets aristocratic widower George Fortescue Maximilian ""Maxim"" de Winter (Oscar nominated Lord Sir Laurence Olivier). She works as a lady's companion to Mrs. Van Hopper (Florence Bates), and the two spend a good deal of time together, leading to love and marriage. Maxim takes his new bride back to Manderley, his grand mansion by the sea in south-western England. The housekeeper, Mrs. Danvers (Oscar nominated Judith Anderson), is domineering and cold, and is obsessed with the memory of the first Mrs. De Winter, the eponymous Rebecca. Mrs. Danvers has preserved Rebecca's former grand bedroom and continues to display various items that carry her monogram (the letter ""R""). The new Mrs. De Winter is overwhelmed and intimidated by the huge house and her newfound responsibilities. But more than anything the spiritual presence of Rebecca causes Mrs. De Winter to believe that Maxim is still in love with his first wife, which could explain his occasional outbursts of anger. It is only later, talking to others, Mrs. De Winter discovers what happened to Rebecca; she died out at sea after her vessel capsized, and her body was washed ashore a few months later. There is also the appearance of Rebecca's sleazy cousin Jack Favell (George Sanders) when Maxim is away. Wanting to please her husband, Mrs. De Winter suggests holding a costume party as he and Rebecca used to. Mrs. Danvers advises her to copy the dress worn by a young woman in one of the portraits displayed on the staircase, which she implies is one of Maxim's ancestors. But, when Mrs. De Winter comes down the staircase wearing the costume, Maxim is appalled as Rebecca wore an identical dress at her last ball, just before her death. He angrily orders her to remove the dress, and she runs upstairs in tears. Mrs. De Winter confronts Danvers about this, but Danvers tells her she can never take Rebecca's place. Feeling helpless and disturbed, Mrs. Danvers almost persuades her to jump to her death from the second story window in Rebecca's room. At that moment, however, the alarm is raised because a sunken boat has been discovered. Rebecca's body has been identified aboard the boat, and suspicions start to circulate, as Maxim identified her body previously. Maxim now confesses to his new wife that he misidentified another body as Rebecca's in order to conceal the truth. He hated Rebecca and the marriage had been a sham from the start. Rebecca told Maxim she intended to continue the promiscuous and perverse life she had led before they were married but pretended to be the perfect wife and hostess for the sake of appearances. Rebecca had an ongoing affair with her cousin Jack Favell, and one night she told Maxim that she was pregnant with Favell's child. During a heated argument, she fell, struck her head, and died. To conceal the truth, Maxim took the body out in a boat, which he then scuttled and identified another body as Rebecca's. The crisis causes the second Mrs. De Winter to shed her naïve ways as they both plan how to prove Maxim's innocence. Favell attempts to blackmail Maxim by threatening to reveal that she had never been suicidal, which is suggested by the police. When Maxim goes to the police, they suspect him of murder. However, further investigation reveals that Rebecca was not pregnant but terminally ill with an incurable cancer, and may have had only weeks to live, so the suicide verdict stands. Maxim realises that Rebecca had been trying to goad him into killing her via indirect suicide so that Maxim would be ruined. Maxim is freed and returns home. But returning to Manderley, the mansion is on fire, set ablaze by the deranged Mrs. Danvers. Mrs. De Winter and all the staff escape the fire, except Danvers, who dies when the ceiling collapses on her. Also starring Nigel Bruce as Major Giles Lacy, Reginald Denny as Frank Crawley, C. Aubrey Smith as Colonel Julyan, Gladys Cooper as Beatrice Lacy, Leo G. Carroll as Dr. Baker, and Hitchcock's cameo is as a man with his back turned to the audience walking past Sanders talking to a police officer after a phone call. Fontaine is highly convincing as the constantly nervous as the working-class woman thrown fast into marriage and the high life, Olivier does very well as the husband haunted by his past, and Anderson is highly memorable as the evil housekeeper with a sinister obsession (there is a possible lesbian subtext) with the dead wife of the title. It is a film of two halves, the first about the new wife trying and failing to fit in, and the second the truth about the first wife's death being exposed, it has terrific camerawork and a splendid score that adds to the eerie atmosphere, and it is engaging, an interesting classic romantic psychological thriller. It won the Oscars for Best Picture, and Best Cinematography, and it was nominated for Best Art Direction, Best Special Effects, Best Film Editing, Best Music for Franz Waxman, and Best Writing, Screenplay. Alfred Hitchcock was number 75 on The 100 Greatest Pop Culture Icons, Laurence Olivier was number 21 on The 50 Greatest British Actors, he was number 3 on Britain's Finest Actors, he was number 14 on 100 Years, 100 Stars - Men, and he was number 4 on The World's Greatest Actor, Mrs. Danvers was number 31 on 100 Years, 100 Heroes & Villains, the film was number 80 on 100 Years, 100 Thrills, and it was number 73 on The Ultimate Film. Very good!",
148,10 December 2003,BuRKi_,10, One of the greatest Film from Master,This is one of the greatest Classics in the Cinema History.Great Melodram.,
149,26 October 2003,DJAkin,10, very under rated hitchcock movie,"Why this movie didn't get more praise, I shall never know.  I loved this movie in every sense of the word.  I like the way Alfred HItchcock made us squirm in this movie over the way Rebecca was.  I rate this in my top ten Hitchcock movies of all time.",
150,26 December 2005,lee_eisenberg,10, Hitch comes to Hollywood,"Alfred Hitchcock's first Hollywood movie won Best Picture and Cinematography (unfortunately, he didn't take home a Best Director Oscar). ""Rebecca"" portrays widower Max de Winter (Laurence Olivier) and an unnamed woman (Joan Fontaine) getting married. But on their honeymoon, she discovers that the memory of Max's first wife is apparently haunting him in multiple ways. And servant Mrs. Danvers (Judith Anderson) isn't exactly what she seems.",
151,2 December 2002,telegonus,9, English Gothic,"Rebecca is a gorgeously mounted, opulent filming of Daphne du Maurier's runaway best-seller, and is at its core a Gothic romance of a high (but not that high) order. Joan Fontaine plays the unnamed, callow young woman who fulfills what seems to be every woman's dream, which is marrying a brooding, handsome English aristocrat. As her husband, Laurence Olivier glowers nobly, and while I wouldn't say that he throws away his lines, he does give the impression that he's better than his material he's given to work with, as indeed he is. ",
152,25 October 2003,MountainMan,8, Fontaine at her best ...,"Fontaine is probably one of the most gorgeous women ever from her time period.  What is so amazing is she acts as well as she looks.  Laurence Olivier always turns in a superior performance.  Dame Judith Anderson was inspirational in her role.  Her bio hints that this was probably a great typecasting of her in this movie.  Some 30-40's era movies can be tedious and boring, but this one kept me intrigued all the way through. NOT REALLY A SPOILER: I think the character of Laurence Olivier got off pretty easy toward the end of the movie.  Watch it yourself!!  It got my ""8"".",
153,30 October 2022,aradford57,10, I dreamt last night I went to Manderley.,"What a film. Still loved by millions, 82 years after it was released.",
154,8 February 2015,Thanos_Alfie,7, Mystery in the most out...,"""Rebecca"" is a mystery movie in which we watch a shy woman who was working as a companion girl of another woman. In a trip she and one rich man fall in love and they decide to marry. When they are returning to the main house of the man she understands that he is still troubled by the death of his first wife, Rebecca, who was killed in a boating accident the year before. And in that the mystery starts.",
155,15 October 2020,Lejink,8, Posh and Bec,"""Rebecca"" was among the first books I read as an adult and I've always had a soft spot for the story with its famous first line ""Last night I dreamt I went to Manderley again"", the lustre of which the film acknowledges by incorporating it into its spoken introduction. Coincidentally, Hitchcock's previous film, his last before crossing the Atlantic, was another adaptation of a Daphne Du Maurier novel, ""Jamaica Inn"", where it's fair to say the end result was far less satisfying.",
156,9 October 2015,kirubanithi005,9," Love, Guilt and Pride hidden in a silk cloth of Suspense.. Hitchcock's classic..","This review doesn't have the story line or any spoilers. 'Rebecca' is a recommended classic for all ardent fans of Hitchcock movies. Not only the suspense gives us chills, the film has soothing love sequences between Laurence Oliver and Joan Fontaine. Joan as Mrs. de Winter steals the show with her innocent love over her husband. Judith Anderson's portrayal as Mrs. Denvers is one which should be noted. She simply stuns the audience with her dark brooding body language and the tone she speaks. The sequence involving her and Joan in the old Mrs.de Winters room speaks the work of Hitchcock. Great direction, beautiful sets of Manderley with lovely performances adds feather to the classic mystery. Overall it is a must watch where Entertainment joins hand with Classic touch ..!!",
157,9 June 2018,dmataylor-43810,1, Boring.,"If there was an Oscar for most boring picture, Rebecca surely deserves it. Rebecca made my fall asleep. Besides being boring, the film had no story and a lack of suspense. Hitchcock at his worst. Again, this film is boring. Zzzzzzzzzzzzzzzz.",
158,24 June 2020,frankde-jong,9," Alfred Hitchcock and Daphne Du Maurier, a perfect combination","""Rebecca"" was the first American film of Alfred Hitchcock. Hitchcock still had to get used to the division of labor between the director and the producer in Hollywood, especially when the producer had the name of David Selznick.",
159,2 July 1999,chris-459,8, It's a masterpiece,"""Rebecca"" is a masterpiece. Alfred Hitchcock's direction is very good, the adaptation of the novel by Daphne Du Maurier is excellent, the performances of Joan Fontaine and Laurence Olivier are superb. If you like fascinating mystery stories you'll love ""Rebecca"" like I do.",
160,2 May 2016,reyesking,10," Rebecca, you b****!!!","The film ""Rebecca"" is directed by the incomparable Alfred Hitchcock. starring Joan Fontain and Laurence Oliver. This is perhaps one of Hitchcock's if not Hitchcock's most glorious of film productions. It is loaded with all of the intriguing mysteries of life and love yet suspenseful and thrilling(no surprise coming from Hitchcock that is). There is a twist at every corner as we slowly discover who ""Rebecca"" truly is and the honest means of her death. watching this film is like following a deranged child through a maze. Its psychological twists are heavy but severely entertaining providing any audience with genuine shock.",
161,23 October 2020,grahamvr,10, MASTERPIECE,Hitchcock's film of REBECCA is an absolute masterpiece compared with the new Netflix Version. The new one is entertaining but lacks the mystery and suspense that only Hitchcock can deliver. The music score in his adds so much to the mystery of the story and the black and white cinematography is excellent. Hitchcock's burning of Mandalay closes a magnificent story by a great gothic writer.,
162,7 June 2021,ashtonnepackaging,9, A must see!,This is by far one of my favorite stories! It's shocking twists and turns will keep you on high alert.,
163,16 November 2022,Jephy1,10, Across-the-Board Beautiful Movie,"It is difficult to add, at this late date, to the many excellent reviews of this motion picture. The whole thing is a tour-de-force. Its characters and timing and plot-pace all capture one's interest and hold it until yet another Hitchcockian turn or surprise arises. I will add that as a period piece, today it is an informative and exciting eye into a long-gone era of style and class. Against this backdrop perhaps is much of the atmosphere that surrounds and makes the noir elements of the film and story most realistic and believable and attention-holding. The screenplay comes full-circle, and ends with all loose ends succinctly tied-up. Best Picture, 1940: well worth it!",
164,7 June 2007,Kuba_D,10, Masterpiece,"After having succeeded in Europe, the master of spy films, Alfred Hitchcock was invited to Hollywood by David O. Selznick in the year 1939. This time the director reached for a novel 'Rebecca' by Daphne du Maunier. It is a story of a young woman (Joan Fontaine), who becomes a second wife of a British lord (Laurence Olivier), and his residence she meets with the cult of Rebecca. Rebecca was the lord's previous wife and she has died in very peculiar circumstances.",
165,16 June 2008,jetk-1,3, Fails,"This film is pretty much a disgrace to the book. It has terrible dialogue, music, and is very, very boring, not even in such a way that leaves you to hope for a climax, or some kind of abstract moral or psychological meaning, but in a way that makes you claw out your eyes with frustration that a movie can be so terrible.",
166,14 February 2004,rohitbajaj,10, Great movie!,"This is one of the finest movie I've ever seen, the cast was excellent and the acting especially Joan fontaine was top-notch: she missed the Oscar though. I've seen around 14 movies of Hitch and this comes close second to Vertigo. The atmosphere, the sceneries were all brilliant, the mystery in the atmosphere was handled well. Great!",
167,7 May 2023,Mymoviediscography,8," ""Rebecca (1940): A Classic Tale of Mystery, Romance, and Intrigue""","""Rebecca"" is a haunting and atmospheric film directed by Alfred Hitchcock, based on the novel by Daphne du Maurier. The story follows a young woman who marries a wealthy widower, only to find herself haunted by the memory of his first wife, the beautiful and enigmatic Rebecca.",
168,7 December 2016,fredschroeder-63011,9, Rebecca,"I loved this movie. An early Hitchcock film, it resembles the certain suspense accompanying his direction. The eeriness of the old ms Dewinter, Rebecca, room allowed for the plot to build, a certain tenseness overtime those double doors popped up. the lighting was dark, a lot of the time it kept a majority of the shot in deep shadow. the deep shadow allowed for the idea of the unknown to build, similar to the threat of the old Rebecca. she was never explained, just mentioned and there are only reminders of her around the home. the eeriness builds with the coldness of the maid, the entire movie just build slowly upon itself. it is an excellent movie to preface the films Hitchcock was about to make, a wonderful predecessor.",
169,16 April 1999,sabby,8, Perhaps the finest example of early Hitchcock,"""Rebecca"" was Alfred Hitchcock's first Hollywood picture (after a string of British made hits). This also gave Hitchcock his first (and only!!)Academy Award. This fabulous mystery has endless twists and turns and provides an amazing movie-going experience. Joan Fontaine(who was Oscar-nominated)plays a woman who marries a rich, dashing Englishman(Laurence Olivier), but she soon is haunted by the memories of his late wife, Rebecca. Adding to Fontaine's troubles is the evil and scary Mrs.Danvers(Judith Anderson)who is the housekeeper that is completely obsessed with Rebecca. Major lesbian overtones here. This is undoubtedly one of the greatest films of Hollywood's golden era and a Hitchcock triumph!",
170,28 February 2006,johno-21,9, A great film,"""Last night I dreamt I went to Manderley again."" So begins the Daphne de Maurier novel and so begins this film wonderfully adapted from it by Phillip MacDonald and brought to life by Director Alfred Hitchcock of the strange days of the life of the second Mrs. de Winter. Despite what it says here on IMDb about Hitchcock winning an Oscar for Best Director for this film he did not. John Ford won for Grapes of Wrath. Hitchcock was nominated five times including for Rebecca but amazingly he never won a Best Director.This did win the Best Picture for 1940 which of course is the big award to win but it was otherwise shutout from it's 11 nominations. This is a fine film with a great cast of Joan Fontaine as the 2nd Mrs. de Winter along with leading man Laurence Olivier as her husband and Judith Anderson as Mrs. Danvers. The film's title character Rebecca, the first Mrs. de Winters never appears in the movie except in a portrait. George Sanders, Nigel Bruce, Reginald Denny and Leo G. Carroll round out the fine cast. David O. Selznick showed with this film a preview of what great films would come from his studio in the 1940's following his monster hit the year before of Gone With The Wind and Hitchcock with this gave all a preview of what was to come from him. This is a beautifully done film and like the novel is now a classic. It's not as suspenseful as other Hitchcock films to come. It's sweeping landscapes and large interiors has the signature look of a Selznik produced film. I've seen this film several times and would rate it a 9.5 on a scale of 10 and highly recommend it.",
171,13 July 2010,khanbaliq2,10, Rebecca displayed Alfred Hitchcock's unparalleled talent for ominous atmosphere.,The naive young second wife (Joan Fontaine) of a Cornish landowner (Laurence Olivier) is haunted by the image of his glamorous first wife Rebecca.,
172,13 August 2004,appleimacdude,10, one of the best movies of all times!,"This movie has so many twists and turns - you may think you have it figured out very early on, but soon discover that things don't seem quite as they may appear - this is not a simple movie!  Very cleverly written, with superb acting on the part of the staff, both in the major and minor rolls!",
173,17 December 2015,saalehab,8, Haunted as the second woman,"Hitchcock movies are known around the world for a reason, they're really good, acting wise, director wise, and cinematography wise. The whole story was acted out wonderfully by Olivier and Fontaine, Oliver played the mysterious handsome man well, and Fontaine was believable as a naive girl who fell for the looks. There were so many instances of great cinematography unique to Hitchcock films, playing with light and shadow to really tell the story along with the dialogue to make everything come together. Alfred Hitchcock as the director definitely left his mark on this movie, since I saw it was adapted from a book, and not created by him, he made it his own with great directive vision.",
174,19 October 2003,FilmOtaku,8," Great melodrama that showcases the talents of a ""pre-thriller"" Hitchcock","Rebecca, based on the Daphne DuMaurier novel of the same name is a gothic melodrama about an average woman who becomes the second wife if an English widower, but lives among the affects and memories and in the shadow of his first wife, Rebecca.   This film was Hitchcock's first Hollywood venture and his first collaboration with David O. Selznick, a producer with whom he would grow to have a volatile relationship for many years.  It is also the first and only Hitchcock film to win a Best Picture Oscar. ",
175,16 August 1999,Philaura,6, A Good Example of Fine Film Making -As Good As It Got Back Then,"Not nearly as thrilling as I was expecting, today's movies have come so much further with script writing, actors are more natural, sets more spectacular, etc.",
176,22 February 2013,LeonLouisRicci,7, Melancholy Melodrama,A haunting tale of Gothic romance that is a time-stamped style that will forever be acclimated to those thick Female penned stories of love and longing when such things were expected as entertainment. This kind of heavy-handed story could not and would not be done today.,
177,29 March 2021,gavandaly,10, THis MAde my HUSband MarrY Me,"It was the long hot ssuummeerr of 40 and i went to see this film with my ma and ma pa at the ending only me and my husband were crying when we turned around and saw each other we knew this was the start of something ""Special"" we were married for 82 years until he died of the nits.",
178,2 September 2020,smatysia,8, Quite good,"An older film that has aged fairly well, thanks in no small part to director Alfred Hitchcock. I understand that it hews fairly closely to the book by Daphne du Maurier, but I have not read it. Outstanding acting from the leads, especially Joan Fontaine, whose character is forced to grow up quite suddenly, and Ms. Fontaine was able to emphasize this transformation through speech, expressions, and mannerisms. It may not be Hitchcock's best, but it is quite good nonetheless.",
179,4 March 2003,perfectbond,8, Patience is a virtue with this film,"With Alfred Hitchcock's Rebecca, the viewer's patience is rewarded once he or she has allowed the 'Master of Suspense' to set all the plot elements and back story in place before proceeding to the main thrust of the story. Regarding the acting, Joan Fontiane is absolutely believable as the young woman trying to discover and live up to the legend of Rebecca. Olivier has to convey a very complicated set of  emotions, often conflicting, and he succeeds in doing so. All the character actors whom I recognize (eg. Nigel Bruce) from other films are picture perfect in Rebecca as well. To me however the actor who leaves the most indelible impression is the actress who plays Ms. Danvers. She really comes across as loyal to her former mistress and tormenting towards the new lady of the house. I should also mention that all other aspects of the production are more than competent, especially the haunting voiceover at the start of the film. All in all, great classic picture, 8/10.",
180,30 September 1999,carmenv,10, Visually stunning and tragically beautiful.,"This is a classic film, not only because it was Hitch's first American film, but because the story and the idea of tragic romance is virtually non-existent in films today. The story centers around an wealthy English man who is suicidal and gloomy after the death of his wife.  This role is carried out brilliantly by Laurence Olivier.  He meets and falls in love with a young and very naive girl he meets in Monte Carlo. He marries her and brings her back to his boyhood home, called Manderley. This is when the trouble begins. The wife, played wonderfully by Joan Fontaine, is ill at ease as a mistress of the house and is intimidated and frightened at the idea of the first wife, Rebecca, haunting the house and the idea that she does not measure up to Rebecca, who was charming and beautiful to all who knew her. Rebecca allegedly died in a sailing accident, and when the wreck of her boat is found near the estate, all the past rises up again to destroy Maxim and his bride. Films like these are no longer made, which is why they are called classic. If you enjoy suspense, romance, or even Alfred Hitchcock films (Heaven knows I can't be the only Hitchcock fan around!), rent this film. It is rarely shown on cable, so don't look for it on TV. A Hitchock film celebration was recently held on Starz!, Turner Classic Movies (TCM), and AMC and none of these channel showed this film. I cannot recommend this film highly enough!",
181,6 February 2000,janesbit1,8," A masterpiece, filmed in beautiful black and white!","This is the only Hitchcock movie that won an Academy Award for Best Movie, preceeding Citizen Kane by one year.  There is much in Rebecca reminiscent of Kane--from the outstanding opening black and white cinematography of the tracking shot of Manderley to the final shot of the embroidered pillow surrounded by flames.",
182,23 August 2012,Dimitri44,10, Mrs. Danvers,"Notice: This may (perhaps to some extent) contain a spoiler, but then again, who wouldn't be familiar with a motion picture seventy years of age?",
