Review_Date,Author,Rating,Review_Title,Review,Review_Url
0,15 January 2017,AlsExGal,9, A film with a nameless protagonist and an invisible namesake,"This was Alfred Hitchcock's first American-made film. Quite frankly, I'm amazed at how well Hitchcock ""got"" what American audiences wanted in their suspense films, hitting them out of the park from the moment he began working in the US. ",/
1,10 July 2021,kosmasp,10, Place Holder,"Hitchcock - never won an Oscar - not in the Best Director department that is. He was nominated multiple times, but never got one. At least this movie right here won one for best movie. I know it is sometimes strange how a movie can win best movie, but the Director won't get one too.",r
2,5 March 2005,nycritic,10, What Atmospheric Gothic-horror Should Be.,"Alfred Hitchcock was and is still the undisputed Master of Suspense, and there is a lot of that here in his foray into Gothic horror, as the mystery surrounding the unseen yet omnipresent Rebecca will engage the viewer from its dreamy start to its bleak conclusion. This is exactly what atmospheric is supposed to be about, and in black and white, it shines. This is also what Gothic horror is in essence, and many have imitated yet come up short, most notably M. Night Shyamalan who, in trying to go for a shock twist and purported ""atmosphere"" only creates a bad aftertaste and a hangover the size of Mount Everest. This is, essentially, Hitchcock's first true masterpiece.",e
3,15 June 2009,TheLittleSongbird,10, Chilling and dramatic- a must see for Hitchcock fans!,"I am 17, and I love this movie. One definite positive of Rebecca is the masterful direction by Alfred Hitchcock, full of the usual twists and turns that make his films so pleasing. The chilling and suspenseful story, of a timid young woman marrying a man and finding herself in the shadow of his dead first wife, has many complex issues, such as the possibilities of suicide, murder and mistaken identity, all of which took me completely by surprise. Rebecca also has gorgeous black and white cinematography, and a beautifully atmospheric music score. But it's the performances from the distinguished cast that holds this film together. Laurence Olivier, one of Britain's finest stage and film actors(you only have to see him in Shakespeare to know the talent this man had), gives a towering performance as Maxim De Winter, a broken man haunted by his first wife's death. The lovely Joan Fontaine is the picture of innocence and vulnerability as the 2nd Mrs De Winter, giving a genuine sense of fright and emotion throughout. Also superb is the suave George Sanders as the rather loathsome blackmailing Favel, who smirks and makes acidic remarks as effortlessly as Clark Gable did in Gone With The wind. But stealing the acting honours is Judith Anderson as the housekeeper Mrs Danvers, a performance that is truly sinister, like the scene when she sets Manderly on fire, her facial expression looking out of the window gave me the shivers. The script was tense, dark and flawlessly delivered. Through the characters we hear that Rebecca was beautiful and possessed all the other positive virtues, so I was shocked when that wasn't to be. All in all, a chilling and dark film, that is a must see. 10/10 Bethany Cox.",v
4,3 December 2003,FiendishDramaturgy,10," All around, an excellent production.","his movie is a 10 from the very beginning. The casting is brilliant, the story is hauntingly beautiful, the performances are the best of what Hollywood once was, and the sets are of quality design and architecture. The direction is awesome, but it's Hitchcock, and I expect nothing less from his productions.",i
5,4 March 2008,hitchcockthelegend,10, Do you think the dead come back and watch the living?,"Rebecca is directed by Alfred Hitchcock and adapted to screen play from the Daphne du Maurier novel of the same name. It stars Laurence Olvier, Joan Fontaine and Judith Anderson. Cinematography is by George Barnes and music scored by Franz Waxman.",e
6,5 October 2006,ma-cortes,8, Hitchcock's first great American success in a classic story with a love story and suspense,"This is a Daphne Du Maurier's story (from a best-seller novel) concerning a prominent widower (Laurence Olivier) called Maxim De Winter who finds a gorgeous and timid young girl (Joan Fontaine) who is serving to an old Mistress (Florence Bates) . They are married and head to Manderley , the familiar mansion (in the exterior actually is a scale model). But Maxim is haunted by the ghost first wife , an enigmatic Rebecca , who died in mysterious circumstances . There works as a servant the creepy and obsessive housekeeper , Mrs Danvers (Judith Anderson,a famous stage actress in her most important role) and sh meets a cynic gentleman (George Sanders).",w
7,3 January 2005,sol-,10, My brief review of the film,"A stylishly directed and photographed film that examines a number of themes, such a deception, death and depression, and explores well the emotions of its characters. It is rare to find a film like this, as it tackles various genres, ranging from being a romance to a mystery to a drama to even a comedy at times, and all without seeming pretentious. The cast is truly magnificent. Judith Anderson is a stunner is a quiet but sinister role, and George Sanders is even more impressive in lively but also sinister performance. Laurence Olivier and Joan Fontaine are perfect for their roles too. The film won Academy Awards for Best Picture and Best Cinematography quite deservingly  this is one of the best films Hollywood has ever produced.",/
8,11 September 2020,Xstal,9, 'Happiness is something I know nothing about'...,"... and it's clear to see throughout that Maxim de Winter is not overwrought with joy as we witness a story tacking in one direction, gradually adjusting course to another and finally distorting and folding in on itself with magnificent Hitchcockian escalation towards the end.",r
9,1 May 2000,dave fitz,10, One of Hitchcock's best films,"In his long career, Alfred Hitchcock directed many great films. Rebecca ranks as one of the greatest. It was the only Hitchcock movie to win a Best Picture Oscar and it was his first Hollywood film after leaving England. This was also the first film in which he adapted someone else's work, the famous novel by de Maurier.",w
10,31 March 2010,secondtake,10, Sucks you in totally...a high romance with astonishing sets and photography,Rebecca (1940),2
11,5 June 2006,Quinoa1984,10," a producer/director combination that works, elegantly and to the best of abilities","David O. Selznick might have had more of an influence over this production than some might think- as with many of his films- and he is the one who ended up receiving the Oscar, not director Alfred Hitchcok, for the 1940 mystery-drama-romance Rebecca. But it is to the credit of both that, for the most part, it looks as if both tried to stay out of each other's way and just put up as good as film as they could. And it is a credit to Hitchcock that with a certain change from what one might see in his perhaps more entertaining films of the 50's and 60's also shows his knack at making great romantic Hollywood movie-making. ",9
12,18 December 2009,claudio_carvalho,9, Haunted by the Past,"In Monte Carlo, the shy and naive lady's companion (Joan Fontaine) of the snobbish Mrs. Edythe Van Hopper (Florence Bates) meets the wealthy widower aristocrat Maxim de Winter (Laurence Olivier) in the hotel while her employer is ill. They spend many days together and they fall in love for each other. When the youth is ready to travel to New York with Mrs. Van Hopper, Maxim proposes her and they get married to each other. The now Mrs. de Winter discovers that Maxim is disturbed with the loss of his first wife Rebecca, who died when her boat sank with her alone nearby his manor Manderlay. They travel to Manderlay, where Mrs. De Winter has a cold reception from the housekeeper, Mrs. Danvers (Judith Anderson), who worshiped Rebecca. Along the days, the humble Mrs. de Winter is frightened by the omnipresence of perfect Rebecca through the arrogant Mrs. Danvers. However, when the boat of Rebecca is found with her body trapped in the cabin, Mr. and Mrs. de Winter are haunted by the past.",5
13,12 April 2023,Sleepin_Dragon,10, A classic adaptation of the great novel.,"A shy, naive young woman travelling as a pair companion encounters powerful, handsome widower Maxim de Winter, the pair quickly fall in love, and she moves to his family home.",4
14,24 May 2006,ccthemovieman-1,4," Wonderful Visuals, But A Big Yawner Overall","This review won't be accepted gracefully on this website but at least I am honest in telling you this was a big disappointment to me, considering all the great reviews I read (not here) prior to seeing it. Some of that praise is simply because it's an Alfred Hitchcock movie with ""Hitch"" being a big favorite among national critics.",7
15,13 February 2020,BA_Harrison,8, Hitch's first hit from Hollywood.,"Director Alfred Hitchcock is renowned for his visual acuity, creating some of the most memorable shots in movie history; he also had a keen eye for beauty, casting some of Hollywood's most stunning actresses in iconic roles: Grace Kelly in Rear Window, Maureen O'Hara in Jamaica Inn, Tippi Hedren in The Birds, Ingrid Bergman in Spellbound, and Janet Leigh in Psycho, to name but a few. Perhaps his most enchanting leading lady was Joan Fontaine, who won an Oscar for her role in Suspicion (1941), but who was never more appealing than in her first film for Hitch, Rebecca, based on a novel by Daphne Du Maurier.",8
16,11 June 1999,Twillhead,10," A Classic on par with ""Citizen Kane""","In a line-up of great motion pictures, ""Rebecca"" stands as one of the giants. It is arguably Hitchcock's greatest film effort, replete with jolting, slap-in-the-face plot twists and gothic sets. Dark and moody, the film boasts Sir Laurence Olivier and Joan Fontaine in slam-dunk, dead on performances, George Sanders as the deliciously despicable Jack Favell, and Judith Anderson nearly stealing the show as the eerie, obsessed housekeeper, Mrs. Danvers. A perfect ""10"".",6
17,17 August 2006,bkoganbing,8, On The Road To Manderley,"I've always found it curious that of all the films Alfred Hitchcock directed Rebecca was the one that wound up with the Best Picture Oscar and that Hitchcock didn't receive Best Director for it. Usually those two go together. John Ford won his second Oscar for Best Director for The Grapes of Wrath that year instead. Also Laurence Olivier, Joan Fontaine and Judith Anderson were nominated and all came up short.",/
18,23 March 2018,LuuxeDelux,8, Answered Questions,"I'm not saying that this is one of my favorite Hitchcock films (it isn't), but it IS one of my favorite books. Because of the production code being in full swing in 1940, several main plot points are either much too subtle or were left out of the film altogether, and I want people who have seen ""Rebecca"" to understand some of the most important things in the story.",?
19,29 December 2006,Doylenf,8," This is a Daphne duMaurier story, not a typical Hitchcock film...","It's silly for those who complain that Hitchcock did not put his usual stamp on this film--and then they cite VERTIGO, MARNIE, SHADOW OF A DOUBT, etc., etc.--when all the time Hitchcock himself has said that this was not a typical Hitchcock film per se. He knew he had a Daphne duMaurier story to tell and he was not able to turn the whole thing into his kind of film because David O. Selznick insisted that they be as faithful as possible to the original material.",r
20,15 November 2005,JamesHitchcock,8, One of the Great Hitchcock Classics,"It is strange that after arriving in Hollywood from Britain, Alfred Hitchcock should have chosen to base his first film upon a novel by Daphne du Maurier, the same author, who had provided him with the material for the last film of his British period. ""Jamaica Inn"" was one of his few failures, a minor-league costume drama that is today of little interest except to Hitchcock completists. With ""Rebecca"", however, he achieved one of his greatest successes, even though the story is hardly typical of his work.",e
21,21 September 2001,Hitchcoc,9, I'm Glad He Made It,"I pretty much ignored this film when I first saw. Having gained a great appreciation for Hitchcock and having studied his films and read widely about his work, I have come to appreciate this more than some think I should. I bought a copy of the movie, but I forced myself to read the book again (it had been about 30 years, when, out of curiosity, I read it). It is a book full of wonderful atmosphere, a bit sappy in places, but has that Gothic appeal that I love. When I got the film out, I was ready, and found myself caught up in the wonderful story. Like Jane Eyre, there is that secret that becomes a part of the decay of Manderly. It can't become alive again until things have been resolved. With a masterful hand, Hitchcock delicately brings his camera around and around and peeks in the shadows, bringing threat from every corner of the mansion. I don't think the acting is average. Olivier is at his best, again, as in Wuthering Heights, standing above his ghosts. If there is a weakness, it's not in the film, but in the book. What are Olivier's motive sin marrying the girl if he was to resign her to the coldness of her new environment. How clueless was he about the hatred directed toward his young wife. Was he totally unaware that Rebecca could hold forth even in her death? Still, even though Sir Alfred didn't really like doing this film and probably butted heads with his producer, it is a work of incredible craftsmanship and when it is over, it makes one feel the great loss. Like ""The Fall of the House of Usher,"" the cracks in the foundation are what this story is all about. If it had been made today, it would probably have brought down the characters as well.",f
22,20 November 2005,Enchorde,5," Long, slow, good acting but far too little ""Hitchcock"",","Recap: Maxim de Winter remarries with ""Second Mrs de Winter"" after a short a quick romance at the hotel. Maxim is a very rich man from the top of society while Second Mrs de Winter is totally new to riches and her newfound status. Maxim takes his new wife to his mansion, the huge Manderlay, and they are booth greeted by the staff. But this is not the first time Maxim is married. His former wife, Rebecca, drowned a year ago and her memory lies heavy over the mansion. Mrs de Winter feels totally out of place, like an intruder, and it does not help that Mrs Danvers, the head of the staff, was very fond of the first Mrs de Winter and is acting very cold towards the new wife. And Maxim, when not leaving his new wife alone, acts very strange when anyone speaks of Rebecca. His new wife feels that she has to compete with an idol and does everything she can to please her husband, but as she misinterprets a lot of signs, she fails. And one fateful night, things are discovered that puts the death of Rebecca in question. Accident? Suicide? Murder?",_
23,20 September 2004,TBJCSKCNRRQTreviews,10," Fantastic Hitchcock, one of his best","This is Hitchcock at his best; just when you think that you've figured everything out, you are treated to a twist that completely turns your perception of the film around. This isn't the twists of modern movies, where you're immediately awe-struck by the sheer unlikeliness of them, but rather twists that send a chill down your spine and turn the movie in a direction you wouldn't have imagined possible. There is almost more suspense and tension in the entire last *half hour* than there is in the collective amount of supposedly suspenseful films of newer time. This is thriller, as it's supposed to be. Don't give us the husband-suddenly-turned-psychotic out to kill his wife, keep the face-less killer devoid of any real motive away, and please spare us the old cliché of the psychopath who rarely ever has a reason for his/her behavior. This is what a thriller is supposed to be like. Constantly hinting at something, hidden in the past, keep us guessing what it is, and just when we think we've figured everything out, pull the carpet out from under our feet. The one complaint I could come up with for this film is that the first half doesn't accomplish much, apart from build-up and character development, but, the more I think about it, the more I realize that that's what makes the impact of the second half; we *think* we know these people, these secretive and hidden people, we think we've figured out what they're hiding, why they are so secretive, and then we hear how different the truth is from what we had expected, and it is devastating, in a good way. To use a metaphor: Just the moment you're sure you've put together the puzzle, someone points out that you've missed a fourth of it, or, rather, points out that the picture is, while it seems logical at its current state, far from the real picture. The plot is excellent, and the way it slowly unravels is perfect. It keeps you guessing and watching, patiently and attentive, and once you're treated to the mind-blowing final half hour, full of twists, tension and suspense, you will not feel that you have wasted the time up to that point; quite the opposite, actually. The film has a very good pace, and is thoroughly interesting. The acting is great; Laurence Olivier as the mystical yet charming Maxim de Winter, Joan Fontaine as the nameless heroine who is humble and submissive, George Sanders as the sleazy, creepy Jack Favell and Judith Anderson as the cold character of Mrs. Danver, who is seemingly devoid of emotion. The characters are well-written and credible. The cinematography is defining of Hitchcock, with plenty of play on shadows and long, lingering pans that only increase the chill down your spine. The dialog is well-written and surprisingly sharp. The whole thing is just amazing as a film. Defining of Hitchcock and worth watching for any competent film viewer. One final note; the last few scenes involve so many twists, so much suspense and tension, that it puts just about every single other non-Hitchcock thriller to shame. I recommend it to any major fan of film in general, as most should find something enjoyable about it, any fan of Hitchcock, and big fans of the following genres: thriller, mystery, drama and romance. This certainly deserves its place on the Top 250(as I'm writing this, it's #105), and should be viewed by any major fan of films in general. 10/10",=
24,1 June 2000,zetes,10," The very definition of ""Haunting""","I was quite interested in the film while I was watching it, but when it ended, I didn't feel impacted. Very soon afterwards, however, my mind began to feel very heavy. The first words of the film came floating back to me: ""Last night I dreamt I went to Manderly again."" I ruminated over the events of the film, and I began to tear up a bit. It creates one of the most unsettling atmospheres ever to exist in a film. I still feel enshrouded in the mist and smoke that curled around Manderly. I can tell that this is going to be one of those films that, when I recall it to memory, I will fall back into its mood. I can't say this for too many films.",t
25,11 June 2005,blanche-2,10, one of the greats,"Rebecca is one film I could watch over and over. It is definitely one of Hitchcock's masterpieces. I recently saw the DVD version for the first time, which had the screen tests and some of Selznick's memos. My favorite was the memo that said, ""Please don't say anything to Larry and Vivien"" referring to the fact that Vivien Leigh wanted the Fontaine role so that she could be with Olivier. Though her second screen test was better than her first, in my mind, I've always pictured Leigh as the actual Rebecca, were she ever shown.",t
26,6 March 2008,onepotato2,4," Yep, that's a melodrama","In kissing off her nasty, disapproving guardian (Mrs. von Hoffstetter) and improbably marrying wealthy Maxim de Winter, nameless, socially-retarded servant Joan Fontaine leaps from the frying pan into the fire. Van Hoffstetter is instantly replaced by the awful, iron-willed, disdaining housekeeper at her new estate, Mrs. Danvers; some sort of nightmare embodiment of all that's wrong and masochistic about British servitude. Not able to get over her own mousiness, Fontaine develops a fear of Danvers, and a bizarre inverted power-dynamic develops. The plot (eventually) thickens...",_
27,27 August 2021,jack_o_hasanov_imdb,9, Classic,It had an interesting topic. Hitchcock did a great job as usual. Casting was so good. This movie doesn't need a reboot. It will always be a classic movie.,u
28,6 November 2006,moonspinner55,7, A sumptuous Gothic...,"Daphne Du Maurier's novel becomes a handsome romantic-thriller from director Alfred Hitchcock involving a naïve young woman (Joan Fontaine) who weds a wealthy, mysterious man (Laurence Olivier) and moves into his imposing castle filled with memories of his deceased first wife. Despite a stiff opening reel, ""Rebecca"" is a well-mounted psychological melodrama in the ""Jane Eyre"" vein. Judith Anderson's Mrs. Danvers has been interpreted (and misinterpreted) to death--she's indeed a little grandiose--though it's still a stunning characterization: a steely-eyed villainess who ranks right up there with the most enjoyable cinema-baddies. The movie gushes and flutters over Olivier almost as much as Fontaine does; he's quite good, but this turns out to be Joan's picture. Increasingly insecure, nervous, chatty and overeager, Fontaine runs the gamut of emotions and is never less than compelling. 11 Oscar nominations with two wins: George Barnes for hsi cinematography and for Best Picture. *** from ****",r
29,8 February 2007,planktonrules,9, Exceptional but perhaps a tad overrated,"While I have always thought this movie was a bit overrated, it is still an exceptional film and those on IMDb who gave it scores of 1 or 2 are way out of line. Overrated it might be, but it STILL is a very good and interesting film.",v
30,11 September 2021,briancham1994,9, Suspenseful and dark,"In true Alfred Hitchcock style, this film is full of suspense and darkness. The initial events seem innocent enough - a wealthy gentleman sweeps an insecure young woman off her feet while on a trip to Monaco - yet things go on a gradual downtown as the events of the past catch up to them. The atmosphere is one of extreme discomfort, as the protagonist is constantly under scrutiny and compared with her predecessor, a universal obsession that she eventually succumbs to. The stark monochrome cinematography suggests that many things are hidden in the mansion, and the emotional acting adds deep characterisation to everyone on screen, all culminating in some shocking twists.",
31,25 December 2007,ackstasis,9," ""She knew everyone that mattered. Everyone loved her.""","By the end of the 1930s, working for Michael Balcon at the Gaumont-British Picture Corporation , director Alfred Hitchcock was heading towards the peak of his artistic potential. Films such as 'The Man Who Knew Too Much (1934),' 'The 39 Steps (1935)' and 'The Lady Vanishes (1938)' became both critical and commercial successes, and so it was only a matter of time before he was tempted over to Hollywood to pursue even greater fame and fortune. Though his working relationship with independent producer David O. Selznick proved constantly frustrating  Selznick often demanded a large amount of creative control over his films  their very first collaboration proved one of Hitchcock's most successful, with 'Rebecca (1940)' becoming his only film to win Best Picture at the Academy Awards. Based on Daphne du Maurier's 1938 novel of the same name, 'Rebecca' is a tense, atmospheric Gothic melodrama about the lingering influence of the story's unseen title character, long after her own death.",
32,3 May 2008,wes-connors,10, Alfred Hitchcock Puts Hollywood on Edge,"What else can you say about Alfred Hitchcock's ""Rebecca""? It's still a startling production. Most obviously, it's one of the most perfect ""Gothic"" dramas produced; making a very steady transformation from Daphne du Maurier novel to film, it gives the genre refreshing celluloid life. Mr. Hitchcock directs star Joan Fontaine (as Mrs. De Winter) to the top of her profession; her guilty, frightened performance is a model for the reluctant Gothic heroine. Mysterious Laurence Olivier (as Maxim De Winter) and the supporting cast are perfect; with sinister Judith Anderson (as Mrs. Danvers) raising her character to striking icon status. Ms. Anderson's excessive fondness for ""Rebecca"", and the understated perverseness of sexuality between Mr. Olivier and both Mrs. De Winters, gives the film a edginess not permitted at the time. And, it was all enhanced by Hitchcock's expressive direction of George Barnes' camera. ",
33,14 August 2005,ShootingShark,7, Ultra-Classy Adaptation Of Classic Gothic-Romantic Mystery,"A young woman falls in love with the troubled Maxim DeWinter when they meet in Monte Carlo. They marry and he takes her to Manderley, his mansion in Cornwall. Once there however, she is overcome at every turn by the ghostly shadow of Rebecca, De Winter's first wife, who drowned under mysterious circumstances a year before.",
