Review_Date,Author,Rating,Review_Title,Review,Review_Url
425,17 February 2002,rossaw,5, Top 250? You have to be kidding ...,"I guess this is the Coen bros version of Dumb and Dumber. Dumb is Jeff Bridges as Lebowski, a middle-aged boozing and dope-smoking burnout, and dumber is John Goodman, an emotionally disturbed Vietnam vet. Throughout I was uncomfortable with not only the premise of the movie, which is that stupid and pathetic people are inherently funny, but with the portrayal of those characters, which was either accurate to the point of being unpleasant (Lebowski), or annoyingly unconvincing (Walter the vet).",
426,2 August 2006,aimless-46,10, No..No...He Has Health Problems,"""The Big Lebowski"" might actually be the funniest film of all time but only if you like its style of humor (parody and subtle off-kilter satire). Even then if you are anything like me you will find it only mildly funny during your first viewing. As others have said it really does get funnier each time you watch it, probably because you have to know the characters to appreciate much of the humor and because during the first viewing you are burning too much mental energy trying to follow the relatively complex plot (while not as complex as ""Miller's Crossing"" it still challenges viewers to pay close attention). ",
427,27 December 2021,barneyboii123,10, My Favourite Film,"This film never disappoints, rewatch ability factor is off the charts. Probably my all time favourite movie. It's just so much fun and a smile never leaves my face throughout its 2 hour run. Coen Brothers at there best. The Dude Abides.",
428,27 March 2007,RainDogJr,10, IN THE TOP 3 OF THE COEN BROTHERS............I'm the dude Man,"The BIg Lebowski is maybe my favorite film of the Coen brothers ( the others are O Brother Were Art Thou? and Raising Arizona.....also Fargo) because is one of the greatest American comedies ever made. For me The comedies of the Coen brothers are much better than the thrillers like Simple Blood or MIller's Crossing and in the Big Lebowski they create a very funny role that was excellent plays by Jeff Bridges. The story is kind of simple: a man is confused by other man that has the same name and he is in a big trouble. But whats makes great this films is the actors and the funny touch of the directors.... Jonh Goodman and Steve Buscemi are just excellent, also Phillip Seymor Hoffman in a little role is excellent and other fact that i love in this film is that Flea from the RHCP has a participation (very little) in the film and i love the music of the RHCP. About the funniest dialogs and scenes in the film: well there are a lot but i love the scene when Walter put his gun in Somkey's head and other of Walter in when he gets angry because of the Shomer Shabbos. Of The Dude, they are a lot but i love when he says his versions of the kidnapping to The big Lebowski and also when he crash in his car. Donny...well Donny is funny in all his scenes and dialogs but when he says Lennon about Lennin is just great. All this parts of the film are great but the best is when Walter throws the bottle to the air with the rest of Donny. Other great character is Jesus and Jonh Turturro is excellent..............let me tell you something pendejo (his best dialog).",
429,5 June 2021,steiner-sam,5," Entertaining, off-balance, and ultimately not satisfying","Jeff Lebowski, commonly known as ""The Dude"" (Jeff Bridges), is a blue-collar middle-aged guy who has accomplished little, though he appears to be a pretty good bowler. He goes with the flow of life, even when it turns into white water rapids. His best friend, Walter Sobchak (John Goodman) is a Vietnam vet who is an authority on everything, but with little understanding of anything. Donny (Steve Buscemi) is the third member of the bowling team who struggles to keep up with the other two guys in the fast-moving plot, and usually is told to shut the f--- up.",
430,7 May 2020,ethanbresnett,8, Mix Yourself a White Russian and Bask in Lebowski's Absurdity,"What a ludicrous story. Absolutely bizarre in every way, and all the better for it. It was an absolute farce and there no sense or logic to much of it. All of this makes it very hard not to love The Big Lebowski.",
431,27 May 2007,m1xer,10, Want to get lost in a great movie?,Unbelievable.,
432,30 April 2020,LeonardKniffel,6, The Occasional Acid Flashback,"The thing about movies made by the Coen Brothers is that I either love them (Fargo) or they leave me flat (The Big Lebowski). There is a thin line between comic and tragic, and here the lead characters never find it. As played by Jeff Bridges and John Goodman, two dumber Polacks have never graced the silver screen. Yet, there is nothing Polish or Polish-American about these losers---""The Dude"" Lebowski and Walter Sobchak-except their names, and ""Sobchak"" is a very un-Polish spelling. There are a couple of assumptions that you have to make to laugh at the jokes in this 1998 film. One is that Polish surnames are innately funny and you should laugh when you hear one, especially when it is associated with intelligent thought or combined with an American given name (""Bunny Lebowski""). The only time you hear the word ""Polish"" in the movie is when The Dude explains to Sobchak that he is ""not even Jewish"": ""You're f---ing Polish-Catholic."" So why see this film? Because it raises a lot of questions, such as: What's so funny about stupidity? Why does John Goodman seem to be doing an imitation of Roseanne Barr? Would this have worked better as a cartoon? Why is ""Lebowski"" considered a ""jerk-off name""? Another reason is to watch Julianne Moore deliver another bizarre but intriguing performance. As Maude Lebowski, she leads The Dude, a burned-out hippie, into the only one of his lines that made me laugh out loud by asking him post-coitally what he does for recreation. As if it's the first time he's ever been asked, he thinks for a second, then replies, ""Go bowling, drive around, and the occasional acid flashback.""",
433,2 August 2021,kostkyrolga,7, A bit overrated,"Despite its great reviews, in my opinion, this comedy is not a masterpiece. I laughed for sure, but it wasn't anything exceptional or super extraordinary in order to justify the critic reviews. The rankings here are kinda deceptive.",
434,24 April 2003,dcampb,1, sucked,"Can someone explain what was funny about this movie?  I know I am in the minority, but I just don't get it.  I found it predictable and annoying. I just wonder what I missed.  Anyone have a clear explanation ?",
435,1 December 2021,SPZMaxinema,9, John Goodman's lines....,"The dialogue in this film is some of the best and every scene with John Goodman is pure gold. I even thought Steve Buscemi did good with his role that he was given. The Dude can act as an inspiration to us all to just kick back and chill with whatever life brings our way and pull some wisdom out of thin air! Is it the best movie ever made as some have declared it to be? No...but you can't help but find it good for what it is attempting to be, simple yet worthy of praise and recognition in many ways! One of the funniest films ever made!",
436,20 February 2023,alg11297,1, A mess,"You really wonder what happened to the Coen's idea of a movie. This is a combination of bad acting, over acting and non-acting. The ""big"" in the title doesn't seem to refer to anything. It's apparently tipping off the audience that it's an homage or a satire on The Big Sleep: the two daughters, the father in a wheelchair, the blackmail. This film steals so many themes from so many movies I lost count. It doesn't work as a mystery, a comedy, or a satire and once you get through the first 40 minutes you really wonder what you watched. Symbolism is a good one. The three heroes could represent Jesus, the father and Holy Ghost only one of them is ultra violent and one of them dies of a heart attack. It really appears as if no matter how many rewrites they couldn't pull it together. And not enough of Tara Reid.",
437,18 November 2001,Howlin Wolf,10, An utter delight from beginning to end. (SLIGHT SPOILER),"Whilst I can't say it's the best FILM I've ever seen - there's a lot of competition for that title, and it's hard to pick just one - I CAN say that it's the best COMEDY I've ever seen. (Until 2005, when it was eclipsed by 1968's ""The Odd Couple""... ) The characters are just so eccentric yet superbly complex and detailed, as in all of the Coen's previous movies. The writing is treated with the same level of sophistication that the brothers bring to all their work, It's NOT dumbed down just by virtue of it being a comedy. Almost every line in the script is ripe for quotation.",
438,3 August 2009,sme_no_densetsu,8, The Dude abides,"Back in 1998 I rented ""The Big Lebowski"" based on the reputation of the Coen brothers's previous film (""Fargo""). Without any real expectations, my brother and I proceeded to watch it and by the end we were in agreement: We had just seen the funniest movie of all time. More than ten years later the film has aged gracefully and if it's not necessarily the funniest movie of all time then it's surely one of the top contenders.",
439,5 November 2018,paigeurquidi,5, I don't get the hype,"So much hype on this movie. So so much. I have been told by countless fans that ""I had to see this"" and ""I was missing out"" and ""why have you not seen it yet"" and ""go home and watch it right now!"".",
440,21 January 2016,Screen_Blitz,8, One of the most entertaining films by the Coen Brothers,"Joel and Ethan Coen have stood high in the ranking of some of the best directors in Hollywood for the last two decades, and still to this today continue to make some of the biggest masterpieces. This black comedy starring Jeff Bridges, John Goodman, and Steve Buscemi, is a movie that did not perform well with critics nor saw much sunshine at the box office,; but eventually went on to becoming a cult classic and one of the my favorite comedies to date. This film follows Jeff Lebowski (played by Jeff Bridges), a drifter who lives under the name ""The Dude"" as his name happens to be the same name as a billionaire. To matters worse, this billionaire is married to a woman who is in serious debt and owes money to some of the most dangerous individuals in Los Angeles. With The Dude mistaken as the billionaire (played by David Huddleston), the Lebowksi's wife Bunny Lebowski (played by Tara Reid) is kidnapped by the dangerous men and orders The Dude to get their money. With the help of his bowling buddies Walter Sobchak (played by John Goodman) and Donny Kerabatsos (played by Steve Buscemi), his plan makes a turn for the worst when he gets involved a series of dangerous schemes including corrupt police officers and Lebowkski's erotic daughter Maude (played by Julianne Moore).",
441,29 November 2019,michaeltrivedi,8, Perfect Movie?,"I think Big Lebowski could be a perfect movie. It's such a fun time, I don't think I could think of a movie better. Perhaps just as good, or on a different platform, but not better.",
442,23 January 2022,irinalaw,2, A movie that has absolutely no point,"You watch and watch and anticipate that a point will get made in this movie, and you walk about empty headed because you just realized that you just watched a pointless movie.",
443,27 April 2006,elkabong-dd,10, See it Again,"The Big Lebowski is without question, my favorite movie. ",
444,20 January 2008,KUAlum26,10, The Dude respects...and so do I.,"I was tempted to christen my summary line ""All he really wanted was his rug back"",but I came to the aesthetic decision that that would be a little too cute and arch. Or not. As such,I'm not even entirely sure what ""The Dude respects."" means,but I'm willing to take it as a good thing,and it seemed more fitting to preface a show so oddly appealing and unique.",
445,14 July 2021,shawnmikedryer,10, Coed Brothers Classic,"As it always goes for The Coen Brothers the visuals created are usually breathtaking, surprisingly for this dark comedy its no different. The subtly of their humor is always on point and they never seem to have to try that hard. No matter how many times i watch this i seem be wholly interested in the story. Jeff Bridges is here in his most iconic role and the addition of John Goodman is perfect, their chemistry is phenomenal. Its really the dialog and acting here that makes this film great and it never gets boring, some of the best writing The Coen Brothers have done. The Big Lebowski as a whole carries itself with such style thats really lacking in movies today.",
446,12 November 2007,xredgarnetx,6, Fun for the guys,"I am one of those who think the Coen Brothers have done better movies than THE BIG LEBOWSKI. But I will give it this: This satiric tale of mistaken identity, kidnap and death has a Raymond Chandler-esquire feel that should certainly appeal to male viewers. Jeff Bridges is Dude Lebowski, who ends up being mixed up with a millionaire with the same last name (David Huddleston) who owes money to some very bad men. The Dude's best buddy, Walter (John Goodman) helps The Dude in his quest to find the senior Lebowski's hormone-crazed child bride (Tara Reid), who has done a disappearing act and may or may not have been kidnapped. The film is bizarre, to say the least, with Busby Berkley-type fantasy sequences, Bridges as a '60s burnout with long, unkempt hair and Goodman as an individual with serious anger management issues. Bridges and Goodman make the film worth watching, although their constant use of expletives may turn off some. They are supported in their efforts by Steve Buscemi as their strange pal Donny and Julianne Moore as the even stranger Maude Lebowski. Sam Elliott serves as the film's narrator and shows up in a brief sequence. This is quite probably Goodman's finest film, by the way.",
447,20 July 2017,aforeginer,9, What makes this film so brilliant?,"If someone would ever pitch this film to me in a universe where I had not seen this film, I would've probably thought of it like a small, peculiar little film, that probably would've had my interest, but with not much more going for it. Never would I have conscidered a film like that be that kind of a film I would conscider one of my personal top ten favorite films of all time. So what is it that makes it so lovable? To be honest, I didn't truly get it the first time I saw it, that can be because how young I was the first time I saw it. I have though grown very fond of it later on, for now to be conscidered one of my all time favorites, and I think it has all to do with the deliverance. The acting is great, the scenario is ridiculous and the plot is overly complicated, yet that's the reason the film works that well. I am the type of person who loves roundedness in storytelling, where conflicts are resolved in a peculiar manner. This film offers this in a sense, yet also not at all. I was very confused about the ending the first time I saw the film because there are several story lines that are never further explored as the credits roll. I didn't really like this way to end the film the first time I saw it, but I have realized over the time how brilliant it really is. First of all because of our main character, Jeffrey ""The Dude"" Lebowski. We are following his story, yet as all of our stories, it will include the story of others. Throughout the film we meet sorts of different people, whom The Dude has something to do with, we get a glimpse of their stories, but not the resolution of them, this may be because it's not something The Dude actually cares about, because the rest of those stories are not something that involves him. To quote the dude, quoting Lenin; ""You look for the person who will benefit, and, uh, you know what I'm trying to say.""",
448,2 September 2021,Benjamin-M-Weilert,8, Another Coen Brothers cult classic.,"In the last year or so, I've tried to watch a few cult classics that had escaped my purview. I'm familiar with their cultural significance, and I can understand why they are beloved by many, but they aren't necessarily perfect films by any means. Movies like The Goonies (1985) and Mean Girls (2004) are mostly known via their memeable moments. This was why I already understood the gist of these movies before actually sitting down and watching them. The Big Lebowski (1998) was yet another cult classic that had these same strengths and weaknesses.",
449,30 April 2006,JimPearson,1, Why does a movie have to use such foul language?,"I only recall one movie which had as much foul language as this: "" Planes, Trains and Automobiles"". I walked out of both after about twenty minutes. (I am sure there are others but I try to avoid them.) It is a sad reflection on today's society that writers and producers think that it is not possible to yet a laugh without lacing the dialog with obscenities in place of conjunctions. Maybe there was a story to this movie because others seem to like it. But if there was then I completely missed it. I think Jeff Bridges and John Goodman are good actors and this is one reason I checked out this movie but this one did nothing to enhance my opinion of them.",
450,4 June 2004,teelbee,6," funny, but not altogether satisfying","I enjoyed many parts of the movie - quite a lot, in fact.  Jeff Bridges as the laid back ""luzer"" dude was brilliant. John Goodman, a 'Nam Vet', more than did his character justice. Some of the situations were really funny and made sense.  Some made no sense and were funny.  Other situations just made no sense. As a whole piece, it's a really flawed movie. ",
451,29 September 2018,aspergian,1, Painful to watch,"I had high hopes for this film. However, they were quickly dashed when I sat through this American drivel. The ""humour"" of the film consists of stilted acting, monotonous deliveries. All of these are probably deliberate and presented in a blatant sarcastic way that just passes as dull. It's way apparently really funny to focus your main character, who is a card board cut out dullard, to say mind numbingly unfunny things and all the banal phrases that are considered universal language to the club of a young generation at the time the film was released. ",
452,26 August 2008,Stampsfightclub,8, Stunning and bizarre drama with the best fantasies ever made,"Jeff Bridges (The fabulous baker boys) stars as the Dude Lebowski, who is mistaken for another Lebowski, which ultimately leaves his rug ruined. Taking this up with the Big Lebowski, the Dude is sent on a mission to recover his kidnapped wife.",
453,3 December 2018,nfragan,6," A Confusing, Yet Entertaining Satire","The Big Lebowski was a movie where going in all I knew was that it was a comedy, and it is definitely a hilarious movie. The story itself is what is so confusing, how nothing really matters and you just follow this plotline that was linear yet infrequent with seemingly random things occurring. The whole point of this is to satire crime dramas while also giving you some easy laughs mixed with the deep ones.",
454,19 March 2020,cianmulligan-06144,10, Well like that's your opinion man,"It's rare that I feel obliged to write a review after seeing a movie but for this I felt I had to. This film does have a decent plot although not one you'd consider to be sensational. The main reason behind this film's popularity is it's script and characters. The performances in this film are flawless. Each actor is sensational and it honestly baffles me how there was no Oscar nods for any performances, or Oscar nods for anything at all. The script is funny although it's not one that would have you on the floor crying with laughter. The comedy is enhanced with excellent delivery and such memorability. There was a few scenes that had me desperate for air from laughing. Particularly the ending scene and the scene in which the dude nails a block of wood to the floor and put a chair against it for protection. Only to find it's an out swinging door. I would live to quote this movie with friends with lines such as obviously you're not a golfer, the dude abides, I'm the walrus or no I don't think he was close to cracking, but because of my age (I'm 16) it's rare people would understand what I'm saying and would just end up looking at me like I'm insane.
Overall just a joy to watch. Each second is a pleasure and after each time I see it I find something new in the script that I'd missed before that makes it funnier. A true great that will forever be seen as one of the greatest cult movies of all time.",
455,18 January 2004,dndcullens,10, Coen Brothers next best.,"As a big fan of the brothers this ranks as my second favourite Coen brothers movie. It is absolutely superb. When I first saw it I was laughing so much that I found myself wondering just what the hell it was all about. Then I watched it a few more times and wondered just what the hell it was all about. Actually, it is a very finely crafted movie even if it looks as if they were running out of film and just tied everything up in the last reel. I am so glad it came out on DVD as it gives you the opportunity to pick up other bits and pieces that seem almost secondary (well, actually they are but who cares). Like in the opening scene where the Dude's head is shoved down the toilet after he bashed his bowling ball against the door jam. If you notice the dent left is still there all through the film. It's a small thing but one that make the whole movie a gem. Jeff Bridges IS the Dude (and a biliiant piece of acting to explain to the Big Labowski that she (Bunny) kidnaped herself). Both Goodman and Stevie are perfectly cast and Johnny T. is just perfect as the Jesus. Like Stone's ""Any Given Sunday"", this movie bases itself in a sport for which I have no interest but, boy, what a movie. I have to give this 9 out of 10 as it is only the Coen's second best movie. The first is, of course, Millers Crossing.",
456,7 February 2003,DukeEman,8, Lets go bowling with the Coens.,Coen brothers make something out of nothing in this crazy black comedy about a down and out loser who gets used and abused for being the nice guy who really doesn't give a hoot about the things that make life that little bit complicated and just wants to go bowling like everybody else in this forsaken world!!!,
457,8 August 2015,pkneer,4, Love the Coens But Didn't Get This One,"Maybe I was expecting too much. I read the reviews and so many were glowing. I watched and waited and hardly any of it was funny. Some of the predicaments were humorous, but the characters just weren't likable. I love John Goodman but his character was a psycho that didn't have very many great lines. Buscemi's talent was just wasted. I found The Dude to be stupid and clueless and how he survives each day is mind boggling.",
458,24 July 2022,patriots3428,1, Disappointing Waste of Immense Talent,"One of the worst movies ever written. I love Jeff Bridges and really wanted to like this movie, especially after Bridges evoked his Dude character in announcing that he had cancer. Expected so much more from such a powerhouse cast, but it was the script that ruined this movie. If you love movies with f bombs in literally every dialogue and enjoy low brow humor, this movie is for you, otherwise don't waste your time.",
459,9 January 2021,carlhchristiansen,5, Overhyped,"Watched it, laughed at 3 scenes, boring story, great characters, not my thing. Remember its a cult film not much more than that.",
460,11 March 2021,viaradar,1," A waste, no funny, a disappointment by the Coen brothers","I mistakenly believed the raving comments of some reviewers and watched this shabby movie. The story, or stories, are void and uninteresting, the dialogs are of illiterate people with small brains. You wait for something to happen that may catch your interest. You wait in vane.",
461,5 June 2021,ThomasColquith,7, Memorable unique comedy,"""The Big Lebowski"" has many scenes and lines that will stay with you. It has good cinematography and interesting characters, so it is fresh. I especially like the characters portrayed by Goodman and Bridges and their friendship. This movie is a reminder to me that for the many people out there without close family, your friends become your family. And these sorts of people, who you'll meet at the bar or bowling alley may have their own issues, such as Walter, but they are friends nonetheless, and even if you don't have a lot of assets, you can still have friends.",
462,6 February 2012,janus-20,10," Very rewarding, if you allow it to be, thats just......y'know, my opinion man.","The Big Lebowski is a movie which requires repeat viewings, to appreciate the characters situations and the humour which comes from their reactions or lack thereof, to these situations. ",
463,22 October 2015,Dan1863Sickles,9, Among The Greatest of American Comedies,"To me, the three funniest American movies ever made are A NIGHT AT THE OPERA, YOUNG FRANKENSTEIN, and THE BIG LEBOWSKI.",
464,22 December 2004,Comic_Book_Guy,10, Allegorical Genius,"The Big Lebowski is rare in the world of motion pictures. It's like a well written book (like Dune or LOTR) in that you can walk away with something new from it with each repeated viewing. The Cohen brothers put a lot of thought into their films, and the Big Lebowski is no exception.",
