Review_Date,Author,Rating,Review_Title,Review,Review_Url
215,5 December 2020,eliaaminii,10, YOU are the Mr. Lebowski. I'M the DUDE!,"How can you except a feeble artwork by the Coen Brothers? As always, they could make the most of every moment in their picture and also convey the meaning of life through their plot and characters.
The cast is pure perfection. Some of regular Coen movies actors are on board as always. Plus of course the mighty Jeff Bridges, with the great portrait of DUDISM he offers us, and his phenomenal supporting actor, John Goodman, who doesn't wait for his time to shine to pull out the big guns.
Speaking of plot, it might not be a kind of conventional comedy as we already know, and the beyond belief executions that it offers us through the movie will persuade you about my opinion.
I had attempted to be hard on this movie and bring up some negative points, but I have to admit that you can't find a movie as sharp and witty as this masterpiece. Not for one second should you doubt watching this extraordinary flick.",
216,17 May 2020,matthewjohnson-00951,10, The Big Lebowski (1998),Things I like about this movie:,
217,12 April 2015,lesleyharris30,8," Strange, Funny and Stronge Performances,","The Big Lebowski is a great movie with a well developed storyline and a terrific cast. With it's very goofy set up and even its characters, you wouldn't expect very big performances from the cast, but they all deliver superb acting, they were all taking a huge risk with this very unusual film, and they ended up making a good choice. My favourite scenes are definitely any one between Jeff Bridges and John Goodman, the chemistry between the two of them is terrific, they both play very unique characters, nothing like any of their previous roles. It's definitely longer than it needs to be, it's nearly too hours long, and with the story being as ridiculous as it is, this can get a little bit tiring after a while, but it is mostly entertaining and hilarious throughout. Very different and packs in plenty of laughs, I would recommend the Big Lebowski to anyone looking for a good comedy. ",
218,20 November 2008,TOMASBBloodhound,6," Suspicions confirmed, unfortunately.","There is a youtube.com video somebody laboriously strung together of all the numerous eff-words in this movie and the order in which they appear. The thing goes on for at least two full minutes. And it is very, very funny. Trouble is, the entire movie is little more amusing than this little clip. Only it lasts much longer. Too long, in fact. For years I had put off watching The Big Lebowski. After seeing various snippets of it, I began to develop suspicions that the entire ordeal might not be worth the time to watch it. Unfortunately, my suspicions were confirmed after a recent viewing of the whole thing.",
219,4 June 2007,Percivalx,4, The Big Dud,"I just had the unfortunate experience of watching The Big Lebowski for the first time. All I can say is that I'm amazed at its popularity. It's hard to comprehend people actually like this overrated dud and claim it's funny and entertaining. As if the muddled and overloaded script and plot weren't enough, the characters aren't the least bit interesting to watch. Jeff Bridges' character is an unemployed loser, and for that reason alone, we're suppose to think he's ""really cool"". I bet slacker misfits must be the only ones who could identify with such character. Moreover, John Goodman's character is downright obnoxious. Julianne Moore, Steve Buscemi, and John Turturro are wasted in nonsensical roles. Plus, the laughs are few and far between. The cliff scene when John Goodman scatters Steve Buscemi's ashes but the wind blows them on to Jeff Bridges' face, is probably the funniest bit in the whole movie. Everything else seems forced. The music is forgettable and if you want a better display of Roger Deakins' cinematography, I suggest you see a better Coen brothers' film - O Brother, Where Art Thou? To think this film came from the same people who brought us Fargo and Blood Simple.",
220,2 May 2020,DudeDawgLebowski,10, I'm the dude man,Where is big lebowski 2 at !!!!!!!!! Make a sequel,
221,23 November 2020,hassankhalafahmed,1, Not fully.. No story.. Upsetting,Don't ever try to watch this nonsense movie.. Reviewers high rates made watch this.. Too much frustrated,
222,24 February 2008,Movie_Muse_Reviews,9," Yes, it is possible for ridiculous humor to be meaningful","Some scenes are a bit too absurd, preposterous, but ""The Big Lebowski"" abides. That being so, the Coen brothers simply say to their critics, ""such is life.""",
223,11 July 2011,jzappa,8," A Bizarrely Winning Fargo Follow-Up Seen Best Through a Haze of Bong Smoke, Whether Yours or the Characters'","The Coen brothers' The Big Lebowski is a friendly, clumsy comedy about a man named Jeff Lebowski, who calls himself the Dude, and is illustrated by the narrator as ""the laziest man in Los Angeles County."" He lives merely to go bowling, but is taken for a millionaire named the Big Lebowski, with calamitous results. We all know people like the Dude, and so, supposedly, do the Coen brothers. They rooted the character in a producer named Jeff Dowd. Both dudes rely on lateral thinking much more than orderliness.",
224,2 August 2006,Smells_Like_Cheese,7," I'm not sure if it was top 250 good, but I still had a few good laughs","I'm not sure why, but lately, I have just been hearing reference after reference of The Big Lebowski lately. Not to mention my sister telling me how funny this movie is and that I should definitely watch it. Well, my sister just handed me the movie and said she would not speak to me until I watched it. Some ultimatum, huh? Well, I did watch it immediately.",
225,7 January 2020,EvanKevelson,10, The Movie filled with Deadbeat Bums! PURE GOLD,"1. I don't know how Jeff Bridges didn't get an Oscar for this incredibly convincing performance
2. The ""Big Lewbowski"" is a bumb who inherited his wife's Fortune, and is so materialistic and superficial that his rant on Jeff Bridges and his own hypocrisy are on a lower level as amusing as Walter and his Vietnam PTSD
3. Maude the Bumb with her ""Paintings"" and her video artist buddy also bumbs with money from her late mother, under the pretentiousness of Art like Andy Warhall's toilet bowl.
5. The Nihilist extortionist leader laying drunk in the pool ""Bumb""
6. Jackie Treehorn sleaze bag...he does have to work so one can argue his Bumb status
7. Walter the low income hard earning Security installer and lunatic to run contrast to all characters
This movie was hysterical ! the chase for what obviously was not ""The Money"" and the Underprivileged bum's concern for his Johnson and ""They're going to kill that poor woman""... And Jon Goodman's Judaic /Vietnam rants(Trauma from the War and again from Cynthia dumping him ""From 2000 years of beautiful tradition from Moses to Sandy Koufax your Damn Right I'm Jewish""! ""Donnie who in your wisdom you took in his youth like so many other young men in Kasion and Hill is 64"" lol.
This films writing, comedy, and chronology were done to perfection.",
226,2 August 2021,RevvedReview,4, Plot hits a brick wall halfway through and doesn't recover,SPOILERS IN THIS REVIEW,
227,14 March 2003,mrbisco,7, IS THIS YOUR HOMEWORK?,A very very funny film.  ,
228,27 January 2012,Magenta_Bob,9, The Big Lebowski abides,"Sometimes there's a film... I won't say a masterpiece, 'cause, what's a masterpiece? But sometimes, there's a film. And I'm talking' about The Big Lebowski here. Sometimes, there's a film, well, it's the film for its time and place. It fits right in there. Hardcore film nerd or not, many of us probably have a go-to film that we've seen countless times and know the lines almost by heart, but still enjoy it as much every time. Well, to me, The Big Lebowski is that film.",
229,1 July 2019,fred_loeper,3, what a mess,"I guess I have trouble appreciating the Coen brothers. Blood Simple and Raising Arizona were very good. The others...keep 'em. The Big Lebowski is a confusing mess that is, I presume, supposed to be funny. Steve Buscemi is completely wasted as is John Turturo. Jeff Bridges is all over the map. None of it makes any sense at all and if you insist that it does, then turn in your amateur movie critic card. I agree with so many others. What a waste of time.",
230,8 August 2019,truemythmedia,10, A Perfect Film,"It's extraordinarily rare for a movie to forever change the landscape of pop culture with a single blow, but ""The Big Lebowski"" did just that. I can't speak to the nature of how this was received when it came out- I was only eight when it hit theaters- but I can speak to the nature of how myself and many of those close to me feel about it, and I can speak to its increasing relevance of it today. This movie is a masterpiece that has no equal simply because there is absolutely nothing else like it under the sun. The Dude (Jeff Bridges, ""The Fisher King"") abides; he has since 1998 and he will until movies no longer are relevant.",
231,1 October 2010,VetteRanger,9, Brilliant laugh out loud comedy,"There have been a few movies over time which have portrayed private eye characters that are quirky, or losers, or both ... but this one takes that concept out into left field and then keeps going into some completely unexplored area way beyond left field.",
232,19 March 2022,killercharm,8, Turturro stole the show,"Iconic comedy that has been so ubiquitous that it took me 20 years to sit down and watch the whole flick. Until now it has been playing in the background so much that it interfered with my desire to watch it purposely. Thank god I got over that, cause this is one funny flick. The women are treated a tad sexistly but the men in the show are sufficiently arrogant to, I don't know, be funny. A prize slacker and bowling aficionado is mixed up with a namesake by a bunch of hoodlums.",
233,4 September 2021,reddiemurf81,7," Yeah, well, you know, that's just like, uh, your opinion, man.",Other quotes -,
234,18 May 2013,riteshshergill,2, The Big LetDownski,So its in the IMDb top 250.. I had to see it.. it was not funny at all. It actually is a movie about.. nothing! there are some characters thrown in for good measure that really do not serve any purpose (for eg Julianne Moore's character). It was boring and at no moment in the movie did I feel like laughing hard. Jeff Bridges is good in his role. If this movie can get an average rating of 8.2 then by that logic 'The Pineapple express' too should be up here within the confines of the IMDb top 250. The fact that it isn't and this movie is means that there is something horribly wrong with people's perceptions. My opinion is.. don't waste your time on this one.. instead go watch the pineapple express.. you wont be disappointed.,
235,29 December 2021,tennisboyn,6, The best of its kind,"Being a staunch opponent of drug use, this brand of humor doesn't usually suit my bill, but it is still one of the funniest movies I have seen recently. The camaraderie between Bridges, Goodman, and (kind of) Buscemi is excellent, although Buscemi's portrayal of the idiotic, unaware friend got old very quickly. Perhaps the funniest scene in the whole movie is Moore's character flying overhead to squirt paint on her abstract art... after reading that her character was influenced by Yoko Ono, it couldn't be more hilarious and true. I did love the cinematography and lighting, as well as the frequent dives into psychedelic episodes. The transitions into those scenes were especially well executed. All in all, the characters were casted near perfectly, and the constant juxtaposition of a stoner and Hollywood drama sequences was hilarious... that's what works with this movie. The bare concept is so hilarious that the entire movie is just soaking it all in, and even then it isn't overdone. The biggest surprise of this movie is that some of the humor is quite sophisticated, although there are plenty of the hackneyed stoner jokes as well. For those who appreciate a good comedy and can handle a boatload of profanity, this movie is for you.",
236,31 December 2007,emgasulla,2, Slackers of the world unite,"I can understand that our average bong-smoking, jobless, couch (or rug) potato American doesn't see himself represented too often in the movies, at least not in a favorable light, so The Big Lebowski must be appealing to a sizable portion of our population. But, for the rest of us, this movie is painful to watch. Have you ever tried to listen to a gang of complete idiots chitchatting for ten minutes? Then go figure what it is to watch it for a full length movie. The worst thing is, the fact this movie was done by the Coen bros. and has a well known cast gives it an aura of respectability it does not deserve. Forget for a second the names in the credits and you're watching standard Cheech & chong material. And that's not a good thing.",
237,22 December 2015,charliesonnyray,5, The Big Slap In The Face,"I don't hate this film. I don't like it either. For me, it just kind of exists. It's understandable though why so many people enjoy this picture. There are quite a few chuckle worthy moments and the characters are quite funny in how quirky they are.The actors are rather charming and the Coen brothers are good directors. However, that doesn't make up for the fact that this movie adds up to nothing. Random events happen for no good reason, many of the characters are completely pointless and even the story is unnecessary as well. It starts off with this unique crime plot about ""The Dude""-a lazy bum-who gets mistaken for a millionaire with the same name as him. The Dude then gets caught up in this convulted scheme by German nihilists to blackmail the millionaire by holding his trophy wife hostage. But by the end of the flick I realized that absolutely nothing was at stake. I don't want to spoil it so I will just leave it at that. I don't mind if a story just wants to meander around aimlessly. Alice in Wonderland does that but at least there's a reason for it, they are in a dream like world that makes no sense. Here, they set up this world like its flesh and blood reality where things are run by rules and regulations but then some things will happen out of nowhere and lead to nothing-like the plot. You can't have a world run by both chaos and order. It just doesn't make any sense. That's The Big Lebowski. It feels like the whole movie is a big joke the Coen brothers are pulling on the audience. You are given a tour of strange characters that are tied together by a overly complicated plot that meant nothing in the end. I wouldn't recommend this unless watching a bunch of walking character quirks stumble around for an hour and a half sounds like fun to you. And if you do, don't worry you aren't alone.",
238,27 June 2015,damos-39883,6, It is an OK movie,"I'm trying to be fair here and rating it 6/10. It's a descent movie, likely worth watching for most people. I watched it a few years back, before I really heard about it, and thought it was OK. I made it through the whole thing, but there were parts that dragged and it's also borderline depressing at times, but has enough humor sprinkled in to get me through. it IS quirky, and I can see how the 'cult classic' gets attached due to the repetition of certain comedic themes throughout. It's definitely not a 10/10 movie, and likewise the 1/10 reviews are basically just a reaction to it's overrating.",
239,27 November 2022,cyberknight,10, I won't forget to put roses on your grave,"This is a complicated story about a very simple man, who prefers to call himself and be called ""Dude"". He has two friends, one is a Chekov's gun, being there just to be used at some point on the film and nothing more, the other is a war veteran with a lot of issues and the enabler of most of the events.",
240,9 July 2021,moviegoo,4, A movie for stoners,And I'm not a stoner.,
241,8 August 2002,kawajust,9, A lifestyle film of the aging hippie,"The Big Lebowski is a rare comedy in that it makes you laugh at the reasons for the Dude's behavior rather than at the absurdity of the situations he is in.  It's not a detective/comedy and it sure as hell isn't a bowling comedy; it's a lifestyle movie with wonderfully written characters.  Jesus is a perfect example of comedic genius with a flat character.  He's a pedophile bowler that has the ability to intimidate guys like the Dude, who probably doesn't really even care enough to be intimidated. But that's the type of conflict that this movie deals with.  The Dude and Walter never really learn any lesson or go through any major character changes.  You must keep in mind that this movie is just a crazy story whose main purpose is to express the comedic traits within the characters.  Fans of character conflict should love this aspect.  Those looking for a buildup and climax may not appreciate the story so much.  The whole detective story is given to the audience blatantly.  But, like the Dude, you become wrapped up in the craziness of all the distractions from the cast of characters such as Autobahn that are thrown into the mix.  So when the story ends, you feel like the Dude; someone who just drifted along as everything sort of passed right by you. But worrying about all of it would be very un-Dude.",
242,29 August 2021,ChrisScreenwriter,4, Possibly the worst movie I've ever seen,"Finally watched it. What was all the hype about? Bridges did a good job. Except for that, what was the point? 4 stars is generous.",
243,27 January 2005,FrankBooth_DeLarge,10," A surefire comedy, this film is pure genius","The Big Lebowski is a brilliant comedy, but it also has a very unique plot. If you liked Fargo, you might also like this because it involves a simple plot, but involves several incidents that add to the story and make it funnier as it goes.",
244,12 August 2020,ArmandoManuelPereira,5, Not Really Consistently Entertaining.,"I have watched this film now at least three times. Yet, despite some humourous moments, and quirky characters, I cannot escape the fact that the movie is really not all that great. To be sure the character of The Dude is memorable, and Goodmans Walter is pathetically funny at times. But Buscemi is sadly under valued, while Turturro is too over the top in my opinion. Julianne Moore is quite good though, as are some of the supporting actors like Huddleston. The difficulty I have with it overall, is that its just not consistently entertaining. Though I wish it would have been. In the end this is not the classic screwball comedy many believe it to be.",
245,24 June 1999,baumer,9, Shut the **** up Donny!,"I have honestly never seen a film like the Big Lebowski before.  Just like I have never seen a film like Fargo before.  Both were done by the Coen brothers and both were funny and strange at the same time.  And both had roles in them for Steve Buscemi, who can make a good film great, a bad film good and a weird film watchable.",
246,17 June 2000,stevenfain,4," Although good comedic moments throughout, also slow and disjointed","I thought it slowed down.  There are good comedic moments throughout, but the script slows down a notch about a third of the way through.  It was not clear if slow moments were intentional, meant to be surrealistic, or what. The comedic moments are good, though, and I would not discourage anyone who appreciates humor from seeing it.",
247,5 April 2001,mattymatt4ever,8, Outstanding!!! Very very funny!!!,"There are so many movies that lack in originality, and there are so many comedies that fall flat.  ""The Big Lebowski"" is like an answer to my prayers.  This is a comedy that works in ALL aspects.  Sometimes you have a comedy that's funny, but the writing's terrible and the talented cast is pretty much the only asset that keeps it moving.  This movie not only has a great cast, but it's wonderfully written (by those genius Coen Brothers), lavishly directed and contains a remarkable soundtrack.  Each and every character has a quirky, notable personality.  My favorite, though he only appeared on screen for about 5 minutes, was Jesus Quintana (played masterfully by John Turturro).  He cracked me up so hard!!!  And I love that scene where Jesus goes up to bowl, licks the ball for good luck and we watch in slow-motion as he hits a strike.  He dances in the lane and rejoices, while we hear a Mariachi version of the famous ""Hotel California"" in the background.  Only the Coen Brothers can make a scene work that smoothly. There are other memorable sequences, like the musical number called ""Gutterballs"" with Jeff Bridges being handed a pair of bowling shoes by Sadam Hussein and flying under the skirts of beautiful women.  You watch a scene like that, and you wonder why this movie didn't nab an Oscar for Best Art Direction.      ",
248,21 October 2022,daoldiges,6, The Dude's Alright,"I didn't see The Big Lebowski upon its original release but more recently i decided it was time I checked out what seems to have become a major cult classic for many. In the folks I spoke with I think it's the actual character that inspires, excites, and evokes such devotion amongst them. This I can kind of understand. But with the film as a whole there's a bit of a divergence. The film itself is basically fine. With the exception of a few specifics the story isn't that original but what is unique in this story is the strong central characters (The Dude) reaction to/and handling of those situations and scenarios. Yes, Jeff Bridges does a great job create a unique and believable character in The Dude, but the film he inhabits is just fine. Check it out and see what you think.",
249,22 January 2021,FLASHP01NT,8, Review: The Big Lebowski (1998) - Interpretations,The movie represents a wisdom tale of original sin.,
250,29 August 2010,ajs-10,9, Almost perfect from the Coen Brothers...,"I'll admit I am a big fan of this film; I've loved it since I first saw it on a grainy rental video back in 2000. To me the Coen brothers have made two outstanding films, this one and Fargo (1996), and yes, I know there will be some disagreement out there about that, but it's only my opinion. Now, before I tell you why I think this is such a great film, here's a little bit about the plot.",
251,17 April 2020,marcferrantejr,10, Perfect Movie,The beauty of the Coen brothers The Big Lebowski is that they're able to make a movie that's basically about nothing and make it so watchable to the point where it's become a classic,
252,15 July 2012,ted_leanse,10," The Characters are great, But the actual film isn't.","I was really looking forward to watching 'The Big Lebowski' because i am a big fan of the Coen brothers work. Fargo was brilliant and they have done some other very good movies to, but The Big Lebowski is overrated. People tell me the whole plot is kind of a joke, well if thats so it's the equivalent of a 'knock' knock' joke. Although perhaps the dude is a great character... the plot doesn't really go anywhere even though i though it had a lot of potential, it just came off weird. Although the character 'Jesus' a strange man they go bowling with gave me a few laughs along with some other mildly amusing parts, The Big Lebowski should certainly not be on IMDb's top 250 because i was personally unimpressed by it.",
253,8 August 2003,FilmOtaku,9, A Hilarious Offering From the Coen Brothers,"There are very few comedies made after 1960 that can make me chuckle, much less laugh out loud but The Big Lebowski is one of them.  While I've owned the DVD and have seen this film many times I was able to catch a midnight showing last week at a local art house theater, and it was a hilarious experience.  The high hilarity was enhanced by the crowd literally chanting the lines (or that could have been the White Russians we all drank were flowing as freely as water), and the audience's obvious appreciation for this clever film.",
254,8 April 2007,mjg32,9, A great piece of cult movie making,"If you see any ""greatest film lists"" or if your looking for top award winners, you will never find The Big Lebowski. Film critics will not praise it, as it doesn't really have any underlying message on life, love or the dangers of drugs or whatever. They would feel ashamed to admit that this is one of the best films ever. Fortunately, thanks to the regular film viewers on IMDb, The Big Lebowski gets the praise it so rightfully deserves, and a cemented place in the top #250.",
255,10 December 2018,beller-61993,7," You call me the Dude, or his Dudeness, or El Duderino","The story of the Dude (Jeff Bridges) is a strange one indeed. Content to spend his days drinking white Russians and bowling with his buddies Walter (John Goodman) and Donny (Steve Buscemi), the Dude is the alpha bum and ultimate passivist. A case of mistaken identity is what forces the Dude to react (first to get reparations for his soiled rug and secondly to assist in the recovery of Bunny Lebowski) and a torrid tale of plot twists ensues. The Coen brothers are master story tellers that love to tell dark tales that focus on the internal truths of human nature. They do not give us heroes, but instead present us with realistic characters that possess questionable morals as seen in some of their other films like No Country for Old Men, Fargo and more recently The Ballad of Buster Scruggs. The Big Lebowski is no exception as every character introduced possesses some form of character flaw. Ultimately what the Coen brothers are trying to show us (Theme) is that nobody is perfect and that even a bum like the Dude can own the moral high ground over those of higher stature.",
256,9 May 2020,philfeeley,1, Not as good as everyone says it is,I read a recent ranking of the Cohen brothers' films and this one was very high on their list. So I thought I'd put in my 2cents worth and pour some water on the fire. I think this is a terrible film.,
