Review_Date,Author,Rating,Review_Title,Review,Review_Url
0,17 October 2005,ebiros2,10, Awesome,"The movie started out pretty innocently, and for the first 20 minutes, I was wondering where the movie was going. Then it started to happen. The horrible cruelty of concentration camps. Oskar Schindler is an example of a man that no matter what the situation, there are people who won't go along with the cruelty of society. I'm sure it took courage to do what he did, because one wrong move and you'll be dead.",/
1,9 September 2013,Fella_shibby,10," Bring me the heads of Hitler, Himmler, Eichmann n Mengele.","Schindler's List is undoubtedly the best Holocaust film ever made. There just isn't anything like this film. Various other films have tried to show the true horrors of the Holocaust, but none of them succeeded the way that Schindler's List did. Schindler's List is a difficult film to watch. When you see the true atrocities of the Holocaust, your jaw drops. When you see the pain that all of the innocent people were going through, the only thing you can do is cry. The true goal of all Holocaust films is to make you feel sorrowful, and Schindler's List did that to me. If you want to see the best depiction of the Holocaust, make your way towards Schindler's List.
Me n my kids cried during the pit scene.",r
2,2 March 2023,EVON1TY,10," Whoever saves one life, saves the world entirely. ⭐","As you may know there is lots of World War II movies. Some of them shows you the worst parts of war, this one is doing something better.",e
3,16 August 2017,padawanmovies,9, What he hell is wrong with the people that commented on the 1st 4 pages of reviews???,"To all the ppl on the 1st four review pages, u r all idiots... To say that this movie's overrated and one sided makes u all seem naive. This is an emotional movie that emphasizes one of the worst periods in the history of mankind. I'm a big list person so anytime there's a list of the 10, 20, 50 best(fill in the blank) I must check it out. Now usually I'll take a gander at something jus so I can try to understand y it's considered great: 2 in particular I'm not a fan of include Pulp Fiction and Annie Hall. But I digress, this movie was well worth the years it took me to finally watch, had it on the DVR since March. All of the acting is absolutely stellar. I would say I hope an amazing story told on celluloid would encourage people to treat one another better, but given the state of things in parts of the world I'll say we're a long way from that. ONE OF THE MOST GUT WRENCHING MOVIES I'VE EVER SEEN",v
4,29 August 2014,mark.waltz,10, You don't have to be Jewish to be touched by this response to inhumanity.,"History has proved that the old saying, ""God makes mad first whom he intends to destroy"", and in the case of Nazi Ralph Fiennes in this Steven Spielberg masterpiece, that is oh, so true. Unfortunately, a lot of innocent people have to pay for that madness in the meanwhile, and that truly adds to the intensity of his madness as it increases and his vileness just gets more and more out of control.",i
5,23 March 2014,SnoopyStyle,10, Spielberg's most important work,"Oskar Schindler (Liam Neeson) is a social climbing opportunistic womanizing German businessman. He charms important Nazis, and gets access to limitless Jewish labor. He gets Itzhak Stern (Ben Kingsley) as his right hand man, and Jewish money to pay for his business. He provides the front. Using black market deals and advantageous connections, he becomes rich and powerful. Stern works tirelessly to save people. Even as the Jews are rounded up to Plaszow labor camp under the command of unstable Amon Goeth (Ralph Fiennes), Schindler is able to befriend the mad commander.",e
6,26 January 2023,Sleepin_Dragon,10, One of the best movies ever made.,"Businessman Oskar Schindler saved the lives of many Jews, by employing them in his factories, this saving them from going to The Concentration Camps.",w
7,10 April 2022,Instant_Palmer,10, Stunning - Spielberg's Greatest Film & Top 💯 All Time Best,"Leaves one speechless - Moving, somber, and horrifying. One of Humankind's worst moments - Something no one should ever forget.",/
8,29 June 2016,troy-manatunga,9," Profound Beauty! If you appreciate art, this is a masterpiece.",SCHINDLERS LIST is Jewel.,r
9,20 June 2017,o-31546,9, Based on a true story,"Schindler's List is one of the most critically acclaimed films in the 1990s. This Steven Spielberg historical movie, based on the life of Oskar Schindler, an ethnic German businessman who saved the lives of more than a thousand mostly Polish-Jewish refugees during the Holocaust by employing them in his factories. ",w
10,10 February 2022,Moah-505q,10," fabulous, should save in movies history","""The List Is Life""",7
11,4 June 2009,TheLittleSongbird,10," Incredibly moving and visually disturbing, Spielburg's best by far!","Some of Schindler's List is very disturbing indeed, with very graphic images on the screen. I thought this film is outstanding. True, it is very long, but the Holocaust was a very long and epic event, and the movie needed a long length to convey the harsh realities of the Nazi's treatment of the Jews. The cinematography was truly excellent, and some of the close ups of people being tortured or dying was enough to make you look away. The direction was taut and focused, most Spielburg's movies are good, but don't quite always have an impact on the whole audience. Schindler's List is visually disturbing and incredibly moving, and because of this, this is definitely Spielburg's best. The acting was phenomenal. Both Liam Neeson and Ben Kingsley give superb performances, and Ralph Fiennes is also very chilling in his role. The music by John Williams is not only haunting, but also unbearably sad, believe me I was in tears for a lot of this movie. All in all, a truly moving film, that deserves a 10/10. Bethany Cox.",6
12,18 October 2006,classicsoncall,10," ""The list is an absolute good, the list is life...""","Probably the most powerful and important film one can watch in this or any lifetime. The Nazi atrocity is presented in stark images of horror beyond comprehension and even the power of one's own imagination. The scene that brought that all home to me was the one in which the young Jewish boy made his way down into the latrine to escape the nightmare of separation from his family, only to find others had beaten him to it. Such desperation, such will to survival.",0
13,28 March 2006,Hitchcoc,10, It's About Our Humanity,"We need to look at a work of art like this to see ourselves in this movie. This is the result of a regime that no longer saw the worth of the human being. It politicize life. This leads to monstrous treatment of people (because they are not people in their eyes). I saw this film the first week it came out. We were on vacation on Hilton Head Island in South Carolina. I remember my wife and I not being able to talk for almost 15 minutes after it was over and then we needed to talk about something else. There are few experiences that can do that to someone. Since that time, I've had many others tell me the same thing. Why is this movie so much more effective than other Holocaust films. First of all, there's something personal about it. We get to know the people, even the bad guys. Secondly, the recreation of the death camps is so accurate. Then there is a spot of genius, the little girl in the red coat. If anyone wants to complain about black and white, watch this film. We get to see what can be done with shades and shadows. The work of Schindler is the work of the heart against great odds. The scene at the end when the holocaust survivors visit the graveyard, is what moves the film. I think that everyone should see this film at some time. Then sit down and think about what is being done to people here in our own country.",4
14,18 May 2016,miguelneto-74936,9, the best of the Spielberg I watched,"Schindler 's List is the best film about Nazism that I 've seen so far , the script is great , the cast is amazing, Liam Neeson , Ralph Fiennes , Ben Kingsley and etc. , the direction is Steven Spielberg , I admit that surprised me , you do not believe that the director of Jurassic Park , Jaws and É.T , directed this film is very different from the ones I mentioned , is only a proof that Spielberg is excellent and versatile, the photography is excellent , the film is all black and white, and the costumes and excellent performances are great, Liam Neeson ta great , plus the highlight in my view is Ralph Fiennes who is impeccable , the soundtrack is good, and the end is excellent , the film has a rhythm reasonable , I did not find it tiring , but many can become bored , Schindler 's List is so far in my opinion the best of Spielberg, who has exciting moments and a great cast. Note 9.4",3
15,16 May 2014,RossRivero99,10, Spielberg at his best,"Steven Spielberg's Schindler's List tells what the holocaust was really like from the perspective of the Jewish people when they got sent into the concentration camps until a man named Oskar Schindler saves them from the concentration camps. Schindler is played by Liam Neeson who gives the best performance of his career as a true real life hero for the German people even though he was a member of the Nazi party in real life. What Spielberg tries to prove with this movie is that he is not only capable of making swashbuckling epics like Raiders of the Lost Ark, or Science fiction classics like E.T, Minority Report, Close Encounter of the Third Kind, or Hitchcockian thrillers like Jaws, but what he did with this movie is that he set a new movie genre to his movie-making vocabulary that got Oscar buzz as soon as it came out into theaters and was a total smash at the box office. Also not only Liam Neeson gives the best performance of his career, but so does Ralph Fiennes who plays a Nazi soldier named Amon Goeth a soldier who five no mercy at all. In order for Schindler to save the Jews from getting persecuted what he does is that the talks to his accountant named Itzhak Stern (played by Ben Kingsley) into making a list of the names of the 1200 Jewish people that he has to save. This was a remarkable movie that will stay in my memory for as long as i live and what a masterpiece Spielberg has created.",1
16,16 June 2017,ASuiGeneris,10, Color Choice = Genius,"'Schindler's List' is one of the most important, illuminating, admirable, and beautiful films ever made. It is also one of the most enigmatic, unnerving, and demoralizing ones ever made. This makes for a most interesting combination. What this translated into for me was that it took me several viewings to finish the film, finding it necessary to pause to recollect my thoughts, both wishing to remember emotionally overwhelming scenes and to let myself realize that this is history. And quite recent history. As much as I wish this were another story of some fictional premise, I would be in denial, which is exactly what this film aims to alter. Because of these very reasons, Holocaust films are usually not very successful. 'Schindler's List' remains as a preeminent exception to this. ",1
17,23 October 2017,zaremskya-23761,10, Devastating,"The Holocaust is a dark and touchy subject for many. Many believed it never happened, despite meticulous records kept by the Nazis themselves. Those who lived through it were scarred forever, and even now can barely bring themselves to discuss its horrors. Despite the controversy around the event, there is one thing for certain, Steven Spielberg created a masterpiece with Schindler's List. It is a film that will find no equal in terms of bleak, crushing drama. It sets out what it intends to do marvelously and leaves the viewer emotionally drained and questioning humanity itself.",/
18,25 September 2022,and_mikkelsen,10, So real i forgot i was watching a movie!,At this point everyone knows this movie is a masterpiece! Spielberg crafted one of his greatest and most important works to date! The importance of this movie can not be denied!,?
19,3 May 2002,crawdidd424,10, Amazing!,"This Movie was sensational. It was a piece of art along with being informational. It told people about the holocaust, and it also told people about the human spirit. It shows how people can just triumph over anything with just some help from one person The things that Spielberg did with the movie was incredible too. The black and white was genius, and how he had the little girl in red and the fire was phenuminal. I have never seen anything like it, Schindler's List is beyond all words.",r
20,24 September 2017,Come-and-Review,9, The worrying amount of 1/10s is why we still need this film and holocaust movies in general,"The first time I've seen it, Schindler's list didn't give me much of an impression. It was horrific, black and white, and I was 15. Now, after I got myself quite a cinematographic culture, feeling the urge to identify Spieblerg's masterpiece, I came back to this movie. I knew it was rated as one of the best films generally, ever, but when I took a look at the reviews, I became really worried. Most of the 1/10 ratings bring reasonless motivations for this film's criticism. ",e
21,16 May 2017,Leofwine_draca,8, One of the ultimate anti-war movies,"SCHINDLER'S LIST is perhaps one of the ultimate anti-war movies in existence. Directed by Steven Spielberg in a naturalistic, unfussy style, it's a harsh, black and white epic that looks at the extermination of the Jews at the hands of the Nazis. Some humanity is brought to the fold by an excellent Liam Neeson who plays Oskar Schindler, a businessman who somehow found himself involved in the situation and who did the right thing. Like many Spielberg films, this is shamelessly sentimental, but then it can hope to be nothing else given the subject matter. The stirring music combines with the expert direction to make this an effortless watch, complemented by Ralph Fiennes whose role is the personification of evil.",f
22,5 August 1998,ving13,9, Excellent - Spielberg's Best,"An incredible movie.  One thing that stands out in my mind about this classic film is the great characterization of all the players due to superb acting, directing, and scripting.  Ralph Fiennes character is especially vile but at the same time human.  He may be 95% evil but to not present a stereotypical and archetypical 100% bad character makes him infinately more realistic.  Filmed in black and white, this story certainly shows the shades of gray that is the duality of man.  This is further exemplified by Schindler's own declaration of being a bad person because he could have done more good and saved more lives.",_
23,7 August 2005,lee_eisenberg,10, Possibly THE BEST example of a Best Picture winner,"I can't possibly describe with words how great ""Schindler's List"" is. You can't realize it unless you watch it. Spielberg not only makes you feel like you're in the middle of it, but you continue feeling that way for hours after watching the movie. Liam Neeson does a top-notch job as Oskar Schindler, a man caught between loyalty to his government and the desire to save over 1,000 people. Equally good is Ben Kingsley as Itzhak Stern, whom Schindler saves from getting exterminated, and then helps Schindler save more people. And Ralph Fiennes as Amon Goeth, a Nazi Kommandant with plans to rape a Jewish woman. Like I said, I can't possibly describe how great this movie is. YOU HAVE TO SEE IT TO UNDERSTAND IT. 11/10.",=
24,16 November 2008,bkoganbing,10, When The State Dehumanizes A People,"It would not have been possible to have made Schindler's List immediately after World War II. The public was just taking in the magnitude of the Holocaust, they might not have believed it. Fortunately for the prosecutors at Nuremberg and for history the Nazis being the anal retentives that they were, made these incredibly meticulous records which scholars and historians have sifted through and we have the whole thing incredibly documented by the perpetrator's own hand. With a fifty year perspective now and the very existence of the state of Israel questioned by those who ought to know better, Steven Spielberg has given us a work for the ages.",t
25,9 February 2007,ackstasis,10," ""This list... is an absolute good. The list is life. All around its margins lies the gulf.""","The Holocaust is undoubtedly one of the most significant and horrifying events of the twentieth century. Between 1938 and 1945, the Jewish population was segregated and persecuted, culminating in the merciless slaughter of approximately six million Jews (this figure is quoted in the film, though most historical estimates vary between five and seven million). Amidst all this butchery, one man decided to make a difference, famously saving the lives of more than 1100 Jews- men, women and children who would otherwise have been killed.",t
26,24 September 1999,KFL,9, Difficult...but very necessary,"This is, after all, one of the more...for lack of a better word...*necessary* films to appear in recent years. Yes, humans can fall to such depths. Yes, such rampant disregard for all we hold sacred--for life, for simple virtues--is possible. Yes, such bestiality has been, is today, will be again. ...entertaining??? Perish the thought. Nothing, absolutely NOTHING about this movie is entertaining. If you want entertainment this evening, watch something else. A Cary Grant comedy, a Mel Brooks film...anything else.",_
27,12 October 2017,safenoe,10, This ain't Hogan's Heroes...,"...nor is it Allo' Allo' or The Producers. Schindler's List deserves viewing especially in light of the 2016 election, and it's an antidote to the light-hearted and even jocular view of Nazis and their role in the Holocaust. If you're expecting Hogan's Heroes, then please give up your seat for someone else.",u
28,2 April 2002,Anonymous_Maxine,10, Arguably Steven Spielberg's greatest film ever.,"Steven Spielberg's epic portrayal of the Nazi Holocaust is one of the most powerful films ever brought to the big screen. During production, Spielberg is said to have stood in the cold on location in Austria and cried, being partly Jewish, as he imagined the horrors that all of those people suffered during the second World War under the oppression of the Nazis. It is clear that at least some of this emotion transferred over into the film, and the end result is startlingly effective and moving. Sure, Spielberg has had several other films that have been amazing and memorable, not the least of which, obviously, are ones like Saving Private Ryan and Amistad (oh shut up, Amistad rocked), but in my opinion, the shocking realism achieved in large part through the documentary style filmmaking gives Schindler's List the boost needed to surpass the also brutally realistic Saving Private Ryan.",r
29,22 January 2022,justinwest-14208,10, One of Very Few Movies That Has Ever Made Me Cry,I don't think I need to explain why this is a ten. Every moment in this film is there for a reason. It's just a masterpiece. Liam Neeson does an amazing job as usual. This movie is one of the most moving pictures ever put on a screen. It should be required to watch in school.,v
30,2 June 2016,the-fearless-america,10," Its gonna be our next generation's classic. Deep, solid, and undoubtedly immutable !","Schindlers list is one of movie which depict the true skill of our legendary Spielberg. Shot in black and white, Spielberg want to present the classic vintage and dramatically dark of world war 2 history. I should say this is the best movie which Spielberg made from perspective of cinematography, casting, and art direction. Yes, this is a near perfect movie.",
31,23 October 2007,rmax304823,8, A moving story.,"Steven Spielberg, until the appearance of this film, was rightly noted mainly for his child's view of movies, fast action, easy sentiment, and a generally accurate sense of appeal to fantasy and wish fulfillment. He pretty much discarded that sort of innocence here, without leaving behind his appreciation of the commercial value of a story.",
32,25 December 2006,ccthemovieman-1,9," Harrowing, Disturbing & Beautifully Filmed","This isn't much I can add to what hasn't been said or written some dozen years after this was released. It's still one of the most powerful stories ever put on film, mainly because it's based on fact. Since it's Hollywood, you don't know how much of this is true but the Holocaust certainly is and that's enough. The little details don't matter.",
33,13 February 2000,Quinoa1984,10, One of the Best Films Ever Made. Spielberg's Best,Steven Spielberg has his best masterpiece here with Schindler's list.  It is also his most personal work to say the least.  And what he brings to the screen is like nothing the world has ever seen before- a true to life depiction of the horror known as the holocaust.,
34,25 January 2018,Andres-Camara,9, If I could give a serious 10 for this movie,"Too bad you can not give a ten because I think nothing is perfect, if I would not give it without hesitation. Spielberg shows again that directing is the best. Narrates like no one and as always uses the camera to make the best shots of the story in every way. With the plans, with the camera tells the story.",
35,18 August 2017,ispaseugen,10, Best movie,This is the best movie i've ever seen.I liked very much how an ethnic German businessman saved the lives of more than a thousand mostly Polish-Jewish refugees from the Holocaust by employing them in his factories during World War II.And the best part is that the movie is black and white with only 1 color for specifically reasons.,
36,8 January 2005,sol-,10, My brief review of the film,"The most amazing thing about this film is that it was not made to be an epic or an acclaimed film. Spielberg made it as a personal film for himself and other Jews affected by the Holocaust. There is nothing flashy about the film except for Neeson's bravura performance. Spielberg's usual style is invisible, and the cinematography and editing, although excellent, are not shown off to make a spectacle of the film or give it an epic feel. Yet it is still a compulsive, involving, and utterly heart-wrenchingly moving filming of a part of history that should not be forgotten. The screenplay is one of the best ever written: it captures the stories of so many Holocaust survivors but without distracting from the main story at hand. The black and white photography and editing is perfect, and John Williams provides a perfectly subtle but nice music score. The acting is simply brilliant, with Liam Neeson towering as Oskar Schindler, and Ralph Fiennes bringing out the Nazi character Amon Goeth into full flesh. And Ben Kingsley and Embeth Davidtz give off excellent performances too. The film also has a lot to say about absolute power corrupting and spiraling out of control, and such a message of the film can be applied to any time and crisis, not just the Holocaust. This is not just one of the the ten best films ever produced, but it shall remain so for years to come, because its messages in terms of power and racism are applicable in any age.",
37,22 August 2016,jay-techie2007,9," A must-watch movie, if you love a little heavy but a top quality cinema.","It is only twice that I have watched this movie and it definitely is one of the classics of Hollywood. Probably the finest work (and undoubtedly one of the finest) of Steven Spielberg till date. In the backdrop of Nazi-occupied Poland, Schindler's List comprises of Jews who are to be saved by an otherwise greedy and flamboyant businessman but a transformed humanitarian, Oskar Schindler. ",
