Review_Date,Author,Rating,Review_Title,Review,Review_Url
897,20 September 2021,mutanthunter-95753,10, A Great Movie You can Hardly Watch Ones!,"A movie thats shows us the darkest period of the Modern Human History, to an extreme limit. It's extremely hard to watch millions of people die like this.",
898,22 February 2017,fanstrikerblog,9, superb acting,Spoiler ALERT!!!! this review may contain some/partial spoiler... ,
899,26 March 2022,henrikkarlsson-65459,10, The best movie about the WW2,"Movies like ""Come and See"", ""Inglorious Basterds"" and ""the boy in the striped pyjamas"" are other great movies from the WW2 but this one is the best in my opinion.",
900,19 January 2022,pavelhrenov,10, 11,"I can't possibly describe with words how great ""Schindler's List"" is. You can't realize it unless you watch it. Spielberg not only makes you feel like you're in the middle of it, but you continue feeling that way for hours after watching the movie. Liam Neeson does a top-notch job as Oskar Schindler, a man caught between loyalty to his government and the desire to save over 1,000 people. Equally good is Ben Kingsley as Itzhak Stern, whom Schindler saves from getting exterminated, and then helps Schindler save more people. And Ralph Fiennes as Amon Goeth, a Nazi Kommandant with plans to rape a Jewish woman. Like I said, I can't possibly describe how great this movie is. YOU HAVE TO SEE IT TO UNDERSTAND IT. 11/10.",
901,27 September 2020,neonblade-2,10, Flawless,"It's 2020 and I've finally watched this film.
What a masterpiece.
The cinematography is a masterclass in the art, the acting superb, enhanced by a beautiful soundtrack.
Devastatingly bleak, shocking, sad and uplifting.
Schindler's farewell to the workers at the end is one of the most moving scenes I've seen on screen.",
902,12 July 2004,rrenati,10, Amazing Movie,"I don't know how I waited eleven years to see this film. This was one of the most amazing works of art I have ever seen. The cinematography, the music, the acting are monumental. I can't remember the last time I have felt so touched by a movie. The scene in which Schindler is leaving the camp to flee the allies is emotionally gut wrenching. He is truly a man transformed. The plight of the children in the camps as depicted in the film is particularly awe inspiring. To see them separated from their mothers and while others hid in the toilets was almost too much too bear watching. This movie should be watched by everyone for generations as a reminder of the evil that man can perpetrate on man but that one person can make a difference if they are willing to be ruled by love.",
903,27 August 2020,ZaidKarimSlopek,8, Beautiful movie with one of the best endings,Begging to end this movie tells one of the greatest stories ever told on the screen and in history. A truly touching and emotional movie,
904,27 December 2005,dany999,10, One of the most beautiful movie I have ever seen,"One of the most beautiful movie I have ever seen. I'm a Spielberg's fan since i was little and i can say it is one of his most beautiful movies. The scenography so good and the music too, it expresses well every moment of the story. The movie is in black and white but we can notice only one ""point of color"": a child, (the one with the red small coat among the crowd of other Jewish) after killed by the Nazi. The innocence that dies. The actors are all good and appropriate in personifying their character. I think it's a movie everyone should see for ""understading"", for how much possible,the tragedy of those times, and to know well the great figure of Oscar Shindler. The first time i saw it i was too young and maybe i did not comprehended it totally, also because for some strong scenes. But now, at distance of time, i can say to love this movie.",
905,13 May 2008,haolu9850,9, history cannot be forgotten,"War is always a heavy topic. This world has been darkened by two world wide wars, and there are so many lessons we need to learn from them. Schindler's List, Steven Spielberg's masterpiece, has once again brings us back to the vivid scene of the most disastrous holocaust that ever happened in human history. This is really a good movie. Watching the movie is a mental process of seeking what is human nature. Strong emotion aroused in me when I watch it for the first time in class. For lacking of a better word to express, I only find the feelings choked in my throat. In the beginning of the film, the Jewish people around a table were having their traditional religious ceremony. A candle light sparks amid them. With the light diminishes and finally goes out, the film turns into black and white, and the evil darkness falls upon the Jews. Then this film goes on in black and white. Someone may wander why the director had to make it a black and white film. In my opinion the director made it on purpose. The gray pictures show audience a kind of depression and seriousness. At that period, the dark clouds of death covered the Jews' sky. The color of life has gone; the color of civilization has gone. To be frank, watching this three hours long film in black and white makes me feel uncomfortable, but is this feeling just like what the victims felt in those days? Being in the darkness for so long, they are really eager to see light---the light of hope, and they are longing for color---the color of life. The film let the audience experience this feeling in these black and white pictures. Based on the true story in World WarⅡ, this film tells us a story about a German business man, Oscar Schindler, tried to save more than one thousand Jews and other victims from the Nazi Germans. Oscar Schindler used to live a luxurious life with great ambitions in his business. He was a devoted member of the Nazi party and was in close touch with the Nazi officers. The war provided him a good opportunity for his business, thus he wanted to get every possible benefit from it and decided to manufacture military need products. Just because the Jews are the lest costly labors available, they were brought to work for him. At first when his Jewish workers were killed by the soldiers, he was just angry because it made him lose money. One day, with the words ""today is history"", of Amen, the chief officer of the German troop, the holocaust began. The noise of machine guns was never stopped in that day. The blood of the Jews flooded the streets. Oscar Schindler, who was riding a horse in the wood, happened to saw the killing from the hill. In the mess, he saw a Jewish girl running in the street. In this black and white film, only the girl was in red. This color makes her different. I think the director must indicate something to us. What does this color mean? Does it represent blood and anger of killing, or passion and hope of life? I kindly thought it was hope, but in the later part of the film, we saw the girl in red again among the bodies to be burnt. When I watched the film for the second time, I realize that had not for some good people like Schindler, no one can survive under the beast like Nazi. After seeing the holocaust, Schindler changed. He tried his best to save the Jews. He bought over 1000 lives from the devil. Through the long list with the type machine clicking, we see the light of hope again. In the final of the film, the war ended, and the picture turned to color again. The world is bright again. This is a movie worthies watching for everyone. We should never forget history. Keeping history in mind does not mean keeping hatred in heart and revenging, while forgetting history means betrayal to all humankind.",
906,7 June 2008,wendy0422,9, Director has an equivocal attitude.,"the director's point of view shown in the film is something more than that of the Jews. Rather his point includes that of the Germans at the same time by focusing mainly on the storyline of the German hero 'Oscar Schindler'. This whole plot clarifies his intention to make the film hold a balanced view of two sides. Thus, It escapes from a dichotomy which the Jewish people as the victim may easily fall into; beautification of the Jews and demonization of the Germans.",
907,3 February 2018,KajdizJaka,10, A history classic,"One of the best movie ever made. It's remind us how cruel the war has been. Where to start, this movie is one of mayor reasons why i love movies, it was one of the first i ever watch it. I cry a lot during the movie, especially at the end, when of the my favorite scene of all time happens. ""I've could it got more"" Schindler (Liam). What a soundtrack by John William, this is just masterpiece, i felt that all of the members, with director Spielberg on the board, who has been part of this, movie show the highest respect to holocaust, to such a black stain to modern history.",
908,21 December 2018,miawatrs,10, Perfection,Nothing to say about it. I just watched it and I'm speechless.,
909,4 February 2018,rnmatthews9,8, Must see,This is one of the most powerful movies I've ever seen.,
910,7 March 2021,jyhn86,10, Cinema at his best,"When I say this is the best movie ever done, I mean it. An all time classic.",
911,18 November 2018,pahvou,10, Masterpiece,"This is a movie everyone should see once, but too difficult to see twice.",
912,22 March 2017,fc_raptors,10, one of the best movies ever,"Probably I watched it 3 times with different friends. Every single time I discovered new impacts on me. Im sure if I would watch it again, it would certainly hit me in the heart again. Liam Neeson's acting was unforgettable and the last scene of the movie with this dialogues: "" I could have gotten one more person and I didn't ..."" it's gonna be always remembered by me. Highly Recommended ;)",
913,16 December 2009,DavidBrown1963,10," Powerful, Moving","Schindler's List is easily one of Spielberg's finest efforts as a filmmaker, the horrors of the holocaust are portrayed in full unrelenting detail guided by Spielberg's visionary directorial hand and this film most definitely deserved the 7 Oscars it received. Performances by Neeson, Fiennes and Kingsly are fantastic and memorable but I think Fiennes delivered the best performance of his career as the heartless, psychotic nazi officer Amon Goeth, his scenes steal the screen and are the ones you won't soon forget after the credits roll. Schindler's List is the work of master and is masterfully crafted on all counts, this is an unforgettable, iconic film that simply cannot be missed.",
914,12 December 2005,GPSpilot,10, The most moving work of art in history. No kidding,"Every scene in Schindler's List is a thread being woven into a tapestry of pure humanity. The film has a conventional climax, but only in the final scene do we reach the emotional climax, where the tapestry attains completion and perfection. Per Jewish tradition, many stones are placed upon Oskar Schindler's grave, and then -- while you hear Itzhak Perlman's violin soar to its most sorrowful note -- a single rose.",
915,5 June 2015,renardariel,9, Oscar Schindler's legacy,"This movie explains what happened to so many of the Jews during World War II. It takes an inside look at what really happened while they were in the camps. Also, how disrespect to any German soldier or any one that was loyal to Hitler resulted in extreme punishment. Extreme punishments such as death were not uncommon. Schindler, in the beginning, was only trying to make money. As the war went on he realized what was really going on in the factor. As he grew closer to his workers in his factory, he didn't want to make money anymore, he just wanted to save them from the death of the war. He began to spend the money he had to buy the workers back from the camps and tried to save as many as possible, he became broke by the end of the war. Before leaving his workers at he end of the war, he cried because he felt guilty because he felt like if he sold his car and some of his belongings, he cold have saved even more lives. Oscar Schindler, was known as a savior to the Jews during and long after the war.",
916,16 July 2001,Jack T Ripper,10, EXCELLENT!!!!!!!!!!!,What a wonderful movie. Steven is the best. Nobody could have filmed it beat. I love this movie.,
917,17 July 2001,y2kbombsu,10, ALL OTHER MOVIES FALL SHORT!,This movie proves that True Stories really are the best stories! When I first saw this movie I was shocked not because of the,
918,31 May 2020,ylshu-06641,9, Schindler's List,"This is not just a Jewish tragedy, but a tragedy of the entire human race.",
919,17 December 2017,youcefbritel,10, Big Movie,"The reel power of this movie is that changing my life, and gives me a lesson of jewish community during the nazi period.",
920,9 February 2018,nnikakhorguashvili,10, The Best Movie,Amazing movie and the best in the world. Schindler is a person that should be imitated by rich people in help of poor people.,
921,19 April 2010,subingeorge,10, Great film and great direction,"This movie is one of the greatest movie that I have ever watched. The director is one of my favorite. It talk about a man who has no work but used his work in saving the Jews. The director has used different colors and different shots. it also shows us and tries to remember us the holocaust day. The acting of the actors where great and they did their best. Liam Neeson and Ben Kingsley acted very nicely.The director tries to use colors to show us some pity towards the characters. I don't know about the research that they did, but it sounded as if true. when i saw Spielberg(director)in one shot I also felt that how nice would it be when we get freedom",
922,29 May 2020,m-91886,9, Schindler's List,"When Schindler took off his brooch and said that he could have saved another person, I was crying. From any point of view of the film, Schindler has achieved the power of directly striking people's hearts. In the face of human nature and life, Schindler has made the choice to let history remember. It's a classic. It's moving.",
923,3 April 1999,marie23,10, Beautiful a masterpiece.,It is a rare occasion for me to cry during a movie. However this movie moved me to tears. I believe everyone in the world should see this film. Liam Neeson does a wonderful job in the portrayal of Oskar Schindler. Ralph Fiennes does an excellent job as the Nazi Amon Goeth which he has said is one of his toughest roles because of the complexity of the character. One of the scenes that stays with me is the one with the little girl in the scarlet clothes walking down the street in the middle of a Nazi Aktion. It really shows you that these horrors must not be forgotten. There are many people who deny the Holocaust or just don't care. I believe that we should try our best to keep these memories alive if we are to have hope for the future. That is what this film does thank you Steven Spielberg.,
924,9 January 2020,ritish-32028,10, Must watch!,"The story revolves around a businessman who helps in saving jews during World War II. The movie takes you back in time and potrays the barbaric horrors faced by jews in Nazi Germany.
Oskar Schindler is deeply impacted by horrors being inflicted on jews; and tried to save as many jew employees of his. Oskar Schindler slowly morphs from an astute businessman to an altruistic considerate human.
Liam Neeson is well, Liam Neeson at his best. Performances delvered by actors are impeccable.",
925,13 April 1999,Kaiser-18,10, The finest film ever made.,"In terms of cinematic craftsmanship, no other movie comes close.  Nobody involved in making this film gave anything less than everything they had. And it shows.",
926,24 December 2021,sayandutta-01381,10, Provoking beyond words !!,No review is enough to express the emotional turmoil that one goes through while seeing this masterpiece by Spielberg.,
927,24 July 2016,fjona22,10, speechless...such a brilliant movie to me,"it was a very sad movie but i can say a beautiful one ...one of the most beautiful movies ever made. i saw it one of these nights , when i was scrolling in a Facebook page. i saw a photo and the caption intrigued me . Later i saw it was Spielberg's movie so i thought i must see it,I'm so sorry i did n hear of it earlier before.",
928,12 September 2013,ychdesign,10, A Must See!!,Everything about this film is amazing.,
929,31 May 2020,ylshu,9, Schindler's List,It's a must for people who like movies. The little girl in red in black and white and the warm candlelight are particularly impressive. The director knows how we need to be shocked and touched.,
930,10 November 2018,felixpabst,10, My favorite movie of all time,"In this movie everything great comes together. One of the best soundtracks, brilliant acting and a depressing but equally interesting and exciting story about the magnificent part of Oskar Schindlers life we all know. I would rate it a 20/10 if only it would be possible. And more than a masterpiece in movie history has Spielberg created and founded the Shoah foundation. I don't think there will ever be a this great and important movie in the future.",
931,18 September 2003,SMAhm2003,9, Great!,"I think this is absolutely a great movie! There are definitely things in this movie that are not good to see.  I think that this is probably one of the most informational movies of all time.  The sad part about it is that Oskar Shindler really did help the Jews, but only for his own personal gain.  The German leaders knew this, but the tiny number of Jews that he saved did not constitute an emergency on their part.  Good movie!",
932,1 July 2013,atanastsonev,10, One of the best movies of all time!,"This move is shocking with its brutality but also made me cry, because of the people's motivation to survive! every aspect of this film is innovative and the one who's watching it cannon see anything even close to what this film is about. another masterpiece of King- the King of directing. Main roles and extras are playing like never before. This is a must see film, involving every aspect of life and death itself. The war is bad but also beautiful with its strange aspects and turns. The situation and all the scenes in the film are unique and the atmosphere catches you from the first moment on. In one moment you will stop realizing this is a film and will totally dive into the whole feeling of being a part of that altered reality. Definitely a film, that should be watched with a nice party- from beginning till the end! Happy watching! Enjoy!",
933,8 April 2006,ladyblondebex835,9, A brilliant way to capture the moment,"I have visited Krakow in Poland where the film was mainly made, the atmosphere there was distressing and to be able to capture that equally as emotive through a camera shows genius. I loved the entire film straight through, it promises to draw tears every time without fail. A must see. The film also portrays the sadness of the camps better than being in the camp in person; i have been to auschwitz and berkenau myself. I think Neeson plays schindler excellently, he has the charm to demonstrate the real Schindlers nature with women. I also thought at first that black and white films were not appreciated in the modern age, however, this film shows that black and white can work, you would not get the same effect from the film if it were in colour.",
934,13 February 2014,hlorsi,10, Great movie!,"It's great classic. It portrays the Jews history in WWII in a very dark, severe and emotional way. I recommend. It's great classic. It portrays the Jews history in WWII in a very dark, severe and emotional way. I recommend. It's great classic. It portrays the Jews history in WWII in a very dark, severe and emotional way. I recommend. It's great classic. It portrays the Jews history in WWII in a very dark, severe and emotional way. I recommend. It's great classic. It portrays the Jews history in WWII in a very dark, severe and emotional way. I recommend. It's great classic. It portrays the Jews history in WWII in a very dark, severe and emotional way. I recommend. It's great classic. It portrays the Jews history in WWII in a very dark, severe and emotional way. I recommend. It's great classic. It portrays the Jews history in WWII in a very dark, severe and emotional way. I recommend.",
935,7 July 2022,nirvana0wns,10, Perfection,"Just pure excellence, no spoilers needed. Just watch it if you haven't. This is a masterpiece. Gives an amazing viewpoint on the holocaust which is so sad.",
936,1 June 2000,riverdavis12,10," With Schindler's List, Spielberg completely shattered the limits of what I thought film can do.","Schindler's List is by far the most powerful and profound movie going experience I've ever had.  No other film I have seen even comes close to the kind of power generated by Schindler's List.  Spielberg did things with the medium of film that I never dreamed were possible.  Somehow he managed to raise the artform to a transcendant, supernatural level - something that no other film in history (at least that I have seen) has accomplished. Citizen Kane may have set the standard for film, but Schindler's List completely shattered it - breaking free of the realm of normal movie making.  Viewing Schindler's List went far beyond a merely passive experience of viewing a poweful film - for the first and only time I can remember, I was living the experience in a way that is almost inexplicable to me.  It was a truly awesome existential and spiritual experience.  There are single scenes in Schindler's List that are more brilliant, profound and powerful than entire films I have seen. There are sequences and images that haunted me for years afterwards and still haunt me.  To this day I get choked up and tearie-eyed when I recall certain scenes or images to memory.  Apart from that, the film is brilliantly shot with the best black and white cinematography I have seen since Citizen Kane.  The screenplay is remarkably subtle and the performances are first rate all around.  Liam Neeson, who has amazing screen presence, was the perfect choice to play the character of Oskar Schindler - a man who is likeable and charasmatic, but ultimately mysterious.  And Ralph Fiennes was mesmerizing as the evil and complex Amon Goeth character.",
937,1 August 2000,deepfocusart,10, A compelling cinematic experience,"A masterpiece.  Quite simply one of the finest films ever produced. Touching a subject that most viewers cannot even comprehend Spielberg weaves a moving tale that informs, shocks and ultimately illuminates the audience. A compelling experience.",
938,17 April 2004,allie-hearts-canada,10, Best portrayal of the Holocaust,"I've researched the holocaust greatly, and have watched numerous movies about the Holocaust. Schindler's List has to be the best movie I've seen on the topic. The frank presentation of the violence and indifference of the nazi officers is amazing. Perhaps the most intense scene is when the Schindler's Female workers are sent to Auschwitz instead of his camp. The presentation, music, and cinematography make it one of the best scenes in any movie I have seen. All of the acting is fantastic, but I find Ralph Fiennes' portrayal of Nazi Camp commandant Amon Goeth stunning. Also well acted is Embeth Davidtz in the role of Helena Hirsch, the jewish made of Goeth. He shows both the evil and human sides of the man, and acts them incredibly well. The cinematography is wonderful. Overall, this is a must see movie for all people interested in history.",
939,10 March 2004,linkinwinchester,10," Of all the films the '90's produced, this is the best","To watch this film, you must be prepared to be horrified. By horrified, I don't mean that all of a sudden, a killer comes from out of nowhere and hacks off someone's limb, with blood and guts all over. No, I mean the true horror... from the fact that what you watch really happened sixty years ago. It is a film that just leaves you without the ability to speak. To walk away from this film dry-eyed is to not be human. Many 'Best Picture' winners are actually overrated... Chicago?... A Beautiful Mind??... The English Patient???... to name a few recent ones. Yet Schindler's List is not overblown, and for all its praise, is still underrated, for it deserves better than the best recognition. This is not just a film... not just three hours to while away your time. This is a lesson in humanity. Schools everywhere should make this part of their curriculum for High School, to teach the future leaders of the world what mankind is capable of. It's not what we could do. It's what mankind DID.",
940,7 March 2004,allergysim,10, Horrifying and true.,"Steven Speilberg's Masterpiece is a real eye opener into human evil, and the triumph of the human sprit. An accurate account of the inhumanity of people who would rather blame and condemn those who are of different religious background, and to condone their hatred with unspeakable acts of violence and cruelty.  I glad that this film is finally coming to DVD, because it time to reeducate the public of the most horrifying time in human history. Especially now when people really needed to see it to know the danger of misconception and the horror of misleading propaganda where power does corrupt, even when it involves religion.",
941,21 June 2013,s-pallav,10, A surreal & invigorating experience !,"Steven Spielberg, through this movie has portrayed holocaust in a picturesque and surreal manner. The screenplay is brilliant and in all its grandeur. The story-line has been woven to instigate a sense of empathy and faith in the viewers and it sure excels at doing so. The utmost of detail and scrutiny has been given on the setup and the props used, giving it an authentic WWII feel. All these combined with the acting delivered by some of the legends concocts a ensemble of drama. This is one of those movies that is sure to leave you pondering into the abyss of humanity. Pretty lengthy movie, but totally justified. Definitely a must watch.",
