Review_Date,Author,Rating,Review_Title,Review,Review_Url
600,20 June 2003,Mr_Villmark,10, Oscar's List,I have chosen this headline because it has a double meaning; 1.The person this is about is Mr.Oscar Schindler 2.This film was awarded with 7 Academy Awards (Oscar).,
601,15 September 2019,Zegronix,10, Amazing,Great movie I've seen it for 5 times and I still enjoy it Masterpiece.,
602,20 February 2016,aurora7459,10," Schindler's List"" Review = Perfection.",Perfection.,
603,13 September 2020,jmtsund,10, The greatest movie of all time - period!,"Direction: Superb!
The script: Excellent!
The acting: Top notch!
Cinematography: Masterful!
The music score: Heart breaking and wonderful at the same time.",
604,10 April 2007,jumakdd,10, my brief review about the movie,"Schindler's List is an Academy Award, Golden Globe, BAFTA and Grammy winning 1993 movie based on the book Schindler's Ark by Thomas Keneally. The movie, adapted by Steven Zaillian and directed by Steven Spielberg, relates the tale of Oskar Schindler, a Sudeten-German Catholic businessman who was instrumental in saving the lives of over one thousand Polish Jews during the Holocaust. The title refers to a list of the names of 1,100 Jews whom Schindler hired to work in his factory and kept from being sent to the Nazi concentration camp.",
605,5 October 2018,ventery,10, A True Depiction of an Unspeakable Horror,"So I watched Schindlers' List on Saturday and must admit while I found it rather disturbing, I could not look away for the whole duration of the film. It is no secret that I have always been drawn to movies with a powerful message and find myself searching for existential meaning in almost everything I am exposed to, however, the Holocaust did not only mark a pivotal point in our human history but symbolised the most disturbing and darkest side of our human nature; our insatiable appetite for power and control, and the hateful disregard for human life.",
606,8 September 2007,bernie-122,4, The Truth,"I have no trouble agreeing that this is Spielberg's best film. That's not as much of a compliment as you might think, because the majority of them have been embarrassingly awful.",
607,20 February 2022,Midget_1414,10, Easily one of the best movies about the holocaust,"This movie is really for everyone wheather you like history, drama movies, war movies etc. It shows ww2 from a different perspective with a lot of details, which was pretty uncommon at the time. You definitely won't be bored while watching this movie.",
608,6 July 1999,Eric-37,10, Most incredible movie I have ever seen.,"To me this is why movies exist.  This is my favorite movie of all time. It does not matter what your background is, the story that was told and the way in which it was portrayed moved me more than I ever thought I could be moved.  Spielberg directed his best film and I would recommend every person to watch this movie.",
609,14 March 2002,hreife,10, Filmmaking at its best!,"Schindler's List captures the emotions, the heartbreak, and the physical attrocities of war and the Holocaust. By using black and white photography and European actors, and filming on European soil, Steven Spielberg has created his masterpiece. The movie is a poignant and tragic look at mankind at its worst. It also shows how one person can make a difference. The film has an excellent cast, amazing photography, wonderful sets and location shooting and a compelling score by John Williams.",
610,3 February 2021,briancham1994,10, Brutal,"This film blew me away and left me breathless. Despite its three hour length, it totally drew me in and left me spellbound for the whole time. It is very violent and bloody but also very emotional. Spielberg is a master of emotion and this film puts the viewer through everything the characters are feeling - intense fear, desperation and tension. The technical aspects of the film are perfect and achieve a timeless and realistic feel as if the viewer were really there. This is one of the best films I have ever seen.",
611,28 March 2018,MariaValentinaFusari,9, Steven Spielberg is the best,Love his movies and this flix is one of the best ever!!!!,
612,10 August 1999,conrado,10, A movie of perfection in every way,"The most powerful and most well done movie in history, Schindler's List was immediately called a masterpiece.  Number 9 on AFI's Top 100 List, Schindler's List is Steven Spielberg's greatest work and John Williams greatest music. Liam Neeson's portrayal of Oskar Schindler, Ben Kingsley's performance as Itshak Stern, and Ralph Fiennes as the villain Amon Goeth you are put in the middle of the most accurate and true portrayal of the holocaust.",
613,10 August 1999,u2shay,10, It moved me...,"A must see, so we don't forget. And in forgetting, grow apathetic. And in apathy, repeat history.  Emotionally moving, has to be the best film I have ever seen. I wept when I saw it, and I still weep when I think of it.",
614,8 November 2008,CboyMovieFan,10, The movie that make me like movies...,"First Time i saw this movie i was thirteen, back in 1998, until then my favorite movies where action flick, Shwarzie, Stalone, Van damme, cool guys, lots off explosions, martial arts, and always no scratches in the ""heroes"", lol, taken to like them by the people that surrounding me, so when i turned up the TV to see, this black and white, i kind off stayed ""better shutdown the TV and go to bed"", fortunately, i gave it a chance, and till today my strongest memory about a movie is that red dressed little girl that gets caught in a place that no kid should be, an tragic war.",
615,2 October 2006,raya165,10, A Prayer for Peace,"I was in awe when I saw this film, how extraordinary it is. Steven Spielberg has become a directing phenomeon after his work on Schindler's List. The acting is superb, Ralph Fiennes acting should deserve the Oscar, as the villain of this film, he became an hero like no other. Liam Neeson's acting was extraordinary and Ben Kingsly's acting is great. The score of this film is haunting and connects to the Holocaust and the death of the Jews in the Concentration. What really blew it away was the little girl in the red which was a symbol to the film. After she became murdered was a huge irony to this film and how it became so frightening, Ralph Fiennes's reaction to the little girl's death blew me away and left me in tears how this film. Eric Roth's screenplay really did deserve the Oscar, and I was shocked how this film ended when Ralph became a good character after the deaths and cry from the Jewish people. Steven Spielberg had made art, a film masterpiece since ""Star Wars"", ""Casablanca"", ""The Godfather"", ""Gone with the Wind"", and ""Lord of the Rings Trilogy"". I recommend to everyone to watch this film and learn how disasterful and frightening to be in the Holocaust.",
616,10 January 2018,Rudiger-Vocals,10, Life can be more scary than fantasy . This movie was needed to expose Humanity,Life can be more scary than fantasy . This movie was needed to expose Humanity,
617,26 August 1999,TrishB,8, A movie that had to be made and has to be seen,I only saw 'Schindler's List' for the first time in April 1999. I had dismissed it as an attempt to tug at heartstrings.,
618,4 September 1999,Mulder-57,10, One of the best movies I've ever seen,"This movie has got to be one of the best movies ever made. It's so gripping and powerful. I cried through the whole movie. It has to be the best movie Steven Spielberg has ever made, aside from Saving Private Ryan.",
619,22 August 2008,gaja_jezernik,10, One of the best movies ever made,I have to give this movie a 10. It is absolutely brilliant in every way. The cast and crew couldn't have done a better job. It's the kind of movie where you can't help but to shed a tear and yet everything is showed in a shocking but beautiful way. I wanted to see this movie for ages and I finally got a grip on it last year. And since then I have seen it too many times to count. It's a masterpiece and my favorite 'Nazi' movie next to Der Untergang. It is difficult to make a film about such a sensitive subject. I have seen many failed attempts and I can't express my satisfaction with this one. It truly is a must-see and I don't regret watching it all those times. It still amazes me.,
620,27 June 2000,Hasslen-2,10," Spielberg's amazing WW2 classic, which tells the true story of a Nazi, Oskar Schindler, who saved the lives of hundreds of Jews.","Everyone who's seen SCHINDLER'S LIST, Steven Spielberg's Oscar-winning 1993 film distributed by Universal, has loved it. Most even cried (myself included), due to the realistic Holocaust story. The film takes place, of course, in WW2. Starting in 1939, a German man named Oskar Schindler (Liam Neeson) comes into quick fame at a Nazi private party, using only his money and suave manor. With help from high-ranking Nazi officers, he starts up a pots and pans factory to help the Jews work. After a few years, when we have seen many Jews massacred and shot, Schindler makes a list of Jews, to be escorted to a German arms factory in his home town, and saves them from a trigger-happy, power-mad Nazi officer (portrayed by Ralph Fiennes). After YOU (who haven't seen it) see it, you will agree that it will not soon be a forgotten masterpiece.",
621,21 April 2011,afolalat,9, Greatest List of All Time,"I just saw this movie and tears rolled down my face unconsciously. I could not hold back my feelings especially when Oskar Schindler said ""I could have saved more"". He said his car could have saved 10 more lives and the badge another 2. One can imagine how valuable the funds spent on intangibles can actually save lives if channeled the right way. He saved so many, the list is the creation of generations, the novel ascribed the list as ""Ark"" similar to the biblical Noah's Ark. This movie is the definition for all movies of its kind. No wonder the director keeps winning Oscars and no wonder great movies are rated by Oscars because one of the greatest men is ""Oskar"".",
622,16 September 2003,rhettrospective,10, The Greatest Film Made,"Is this the perfect film ? I believe so. So film has more astonishing acting than Ralph Fiennes and Ben Kingsley (no acting oscars!) The most extraordinary handling of this subject, wonderful cinematography, editing superb andthe overall look of the film is something that stays with you.",
623,28 December 2010,mi286,8, The possibility that one simple idea can change your life and the lives around you.,"The connection between the people in the film and the audience is almost incomparable with any other film. Even the people who are not regulars, you feel that you know who they are, that you've experienced what they have been through but also realising that how bad this film portrays the war the experience of the Jews will never be displayed to its full effect on the people involved. Spanning through the workers at the end brings to light what a good job Spielberg has done with this connection.",
624,28 April 2004,arch_angel_bleed,10, Meticulously crafted!,"Astoundingly magnificent, meticulously great, as this is one of the greatest movie ever done. Boasting seven Academy Awards and taking home two of the major Oscars in Best Picture & Best Director respectively. Blockbuster mighty Steven Spielberg won his first of two Oscars, he will go on to win his second five years onwards for 'Saving Private Ryan', has crafted one of the most mesmerizing and importantly structured movie in the history of motion pictures. With a screenplay by Steven Zaillian which earn him an Oscar for his in-depth accuracy and depictions. With a wonderful array of art and set direction done by Allan Starski and Ewa Braun provides the perfect tones to the screenplay. John Williams harrowing original score garnered him an Oscar also, while Michael Kahn whose previous collaboration with Spielberg on 'Raiders Of The Lost Ark' will also carry him home an Oscar for Best Editing. It was the flawless cinematography though by Janusz Kaminski that stands out, his first of two Oscars was well appreciated to this master, who took his game to a higher level when he won his second Oscar for his collaboration with Spielberg's 'Saving Private Ryan'. With a great performing cast that includes Liam Neeson, Ralph Fiennes and Ben Kingsley just help attributes the films well rounded orchestrated extravagance. Schindler's List is the only movie from the 90's that made the top ten list by the American Film Institute",
625,21 April 2009,txdiscgolfer,10, Even after 15+ yrs...,"...this is an astonishing, incredible, magnificent...and I have many, many more adjectives to use...film.",
626,28 May 2013,nwestwood-697-780556,10, A film to watch over and over again,"The feelings I experienced while viewing this film are almost indescribable. I am an avid fan in World War II history but more specifically Holocaust history. It is my belief that humanity has a huge lesson to be learned from cowardly acts such as the Holocaust, and this movie has an uncanny way of helping pass the message along. This film shows human compassion even in the darkest of times. I do not think my eyes were dry at all during the movie-I found it so deeply moving. My rating of 10/10 originates from both the acting as well as the message gained. The movie will have a place not only on my shelf but also in my heart.",
627,30 November 2012,tooraj-jamal,10, Summary of others reviews in my opinion,"1. Oskar Schindler (played brilliantly by Liam Neeson, ""Batman Begins"") was a Sudeten German industrialist, a wealthy womanizer who wasn't afraid to throw his money around. Always bearing his Nazi Party badge proudly, Schindler would often frequent nightclubs, extravagantly showering high-ranked Nazi officers and their girlfriends with champagne and caviar. With impeccable connections in the black-market, there was little that he couldn't get his hands on, and he was a good person to know. Buying friends was something that Schindler could do well, and he would often use these newfound alliances to aid his own business ventures. When thousands of the Polish Jew population was relegated to the Kraków Ghetto in 1941, Schindler saw an opportunity for further success, enlisting desperate Jewish investors and employing Jewish workers (who were substantially cheaper to employ) to open an enamelware factory. His connections in high places ensured lucrative army contracts, and Schindler need only have watched as his personal fortune grew, despite doing little to run the company beyond offering it ""a certain panache.""",
628,25 February 2017,Vasko_petroff,10, You HaVe To Watch ThIs MoVie,"One of the best second world war story-movie ever made.The movie makes you think about stuff that man have to think more often about.brilliant acting and screenplay.Liam Neeson is perfectly chosen to play this role.A movie makes you cry ,feel joy ,be sad.Its an example for Humannity,sacrifice,heroism.You HaVe To Watch ThIs MoVie.For me is a clear 10 of 10.",
629,26 June 2013,gladys_fox12,10, Powerful Statement about our Times,"This is not just about the past, it is about our present as well. We need to look at a work of art like this to see ourselves in this movie. This is the result of a regime that no longer saw the worth of the human being. It politicize life. This leads to monstrous treatment of people (because they are not people in their eyes). I saw this film the first week it came out. We were on vacation on Hilton Head Island in South Carolina. I remember my wife and I not being able to talk for almost 15 minutes after it was over and then we needed to talk about something else. There are few experiences that can do that to someone. Since that time, I've had many others tell me the same thing. Why is this movie so much more effective than other Holocaust films. First of all, there's something personal about it. We get to know the people, even the bad guys. Secondly, the recreation of the death camps is so accurate. Then there is a spot of genius, the little girl in the red coat. If anyone wants to complain about black and white, watch this film. We get to see what can be done with shades and shadows. The work of Schindler is the work of the heart against great odds. The scene at the end when the holocaust survivors visit the graveyard, is what moves the film. I think that everyone should see this film at some time. Then sit down and think about what is being done to people here in our own country.",
630,11 April 2010,rjm11,9, There is no word to describe this,"A well made and well thought out piece of work. Overall, I can say this worked in black and white when it's been done to death in other films. Direction, Production value and the Acting is nearly unparalleled. I will not mention names as all deserve equal credit for an outstanding performance. The most interesting bi-play for me was between Schindler and Goeth. As the story progresses Schindler tries to suppress his humanity for the sake of profit and Goeth tries to suppress his evil for profit. Throughout this Schindler cannot deny humanity and tries to force barbarity out as this is the only way he will survive. Goeth, perhaps, realizes the evil and tries to force out his humanity only to realize that his barbarity is the only way to survive in the regime he is in. The struggle goes on, and, I think at the end both men realize they have lost. By far for me the most interesting character is Goeth, as you can see sputters and sparks of enlightenment trying to come through, only to be dismissed. If you can watch this movie and not shed a tear, let me know, I will check you for a pulse. This film, while perhaps not a documentary is still a testament about something that should never be forgotten, much the same as Saving Private Ryan is about the combat troops (Schindler's list is not a war movie IMHO) in the European Theatre of WWII. This movie never lets up on you, there are no moments of levity to save you from an account of a dreadful time in history. Not to be missed.",
631,4 September 2018,igormontenegro,10, 10/10,"Masterpiece! Cant be discribed with words how good this movie really is, absolute reccomedation to everyone!",
632,13 January 2020,davidmvining,10, A film of contrasts that hits the gut,"This movie is built on contrasts, and it includes one of the most devastating single cuts in movies. It's a dual narrative that almost feels separated for a while before the two become completely intertwined in the final hour. It's impeccably made, acted, scored, and assembled. It is one of, if not the, greatest single film by Steven Spielberg, and it's the best example of an ""important"" film.",
633,13 March 2023,Reviews_of_the_Dead,10, Powerful and Heartbreaking,"This is a movie that I remember coming out. My parents rented it if memory serves and I know they ended up buying the two VHS box as well. It is one that they let me catch a glimpse of so I knew about the girl in the red coat. It wasn't until much later, after college, that I sat down to watch this start to finish. What I will say is that it is a heavy watch. Jaime and I also watched this as we are working through the Internet Movie Database Top 100 movies poster.",
634,29 September 2019,moshedyandorf,10, U ain't no human if u do not come out crying after watching this art.,"Everything is top notch here. From the direction, acting, screenplay, cinematography n editing.
This movie shud be re-released in theatres.
This film is still relevant today.",
635,15 May 2006,xtreme_at_everything,10, Spielberg's Masterpiece,"Does abusing the system make a man a hero? In ""Schindler's List"" it certainly does. This movie is one of the classic movies of all time and is a must-see for any movie fan. It gives its reader a harsh image of the Holocaust while still respecting the people who were affected by it. While this movie may not be an enjoyable one, it is certainly a very important one. It is beautifully directed, amazingly acted, and heart-wrenching to the core. I highly recommend this movie. It is not just a movie; it is a journey for its viewers.",
636,20 February 2009,retasulover,10, Steven Spielberg At His Best!!!,"It's difficult for any one person to pick ONE movie by Spielberg that stands above all his others. However, if i had to choose his greatest movie when it came to sentimental value, and pure power, Schindler's List is THAT movie.",
637,1 February 2014,skepticrunner-912-349677,9," Great, touching movie","Short & sweet: It's Realistic. It's Heart-wrenching. It's dramatic.
It's honest. It connects you to the protagonist's character.",
638,9 February 2022,whiskeyinabowlerhat,8, Epic,"Great movie still holds up well today. Cinematography top notch, acting amazing from whole cast, directing on point, casting fantastic. Couldn't ask for anything better.",
639,6 January 2001,bkingpin,10, An outstanding movie for anyone interested in WWII.,"This is an outstanding movie. In my opinion, this is Steven Spielbergs finest work. The film does an outstanding job in showing the lives of the Jewish people and what it must have been like to have to live during World War II. It also does a great job in showing how Schindler lived and changed the lives of so many Jewish people.",
640,14 November 2022,leonsott,10, Disturbing but needed,"This disturbing true story on the holocaust and Oskar Schindler is one I will never forget. It has such a powerful message and one that needs to be understood better. The film itself is brilliant, the acting is superb and the music is so moving. The film doesn't hold back at all and includes everything that the Jews has to go through back then. It really gives you a clear image of the pain and struggle they went through. I admit that watching this film was very difficult and struggled to reach the end but it was well worth it. I had to pause and just think of something happy mid way because it started getting really depressing. Steven Speilburg truly is an artist and really captured the realism of the holocaust. I would like to watch this movie again and it is definitely one of my favourites. However I would not recommend this movie for young children. If you are a teen you might be able to handle it but anyone under shouldn't watch it as some of the scenes are pretty horrific and I'm a little bit surprised it isn't an 18 but I can see why it's a 15.",
641,30 October 2006,notperfect_justloved,10, Powerful Movie!,"This movie was jaw-dropping. It was so blatant and direct, it was painful to watch, and even more painful to think about the fact that these things really did happen.",
642,17 June 2005,hmdwgf,10," Brilliant, absolutely incredible film is Spielberg's best","This film does not have one error in anything in it: This film is absolutely brilliant in any standard, it is flawless, perfectly executed, shocking (REALLY SHOCKING), extremely violent (the many scenes of Jews being executed are definitely the most graphically realistic, totally believable brutal killings ever put on film, AND I MEAN THAT.) and extremely intense, in every sense of the word. This film does not have a false note in it's execution scenes, storytelling or acting. And this film is so moving (especially for Jews) and so engrossing that it felt like this whole film was really happening around me when I watched it (and I was dead scared, don't get me wrong) There is no way anybody will be offended by this film. The last great, unforgettable, internationally critically acclaimed 5-star and classic film of the ages. And it is all based on a true story.",
643,18 November 2002,Patrik16,9," ""sometimes movies are needed to make people open their eyes""","This movie shows why people need to understand each others behaviors. Culture colissions have been reason to many traumatic events in history and this is a film showing what will happen. By just showing when Nazi soldiers shoots a jewish worker through the head because of this old mans culture and his handicap (one arm) gives people a hint of the cruelty that enrages when misunderstanding takes place. Seven Spielberg is a master of filmproductions and shows that sometimes movies are needed to make people open their eyes. The story is great, and it's special effects too. This beutifull masterpiece also is filled out by John Williams fantastic score that touches your heart. If you don't like this movie (or find it boring) you do not have any compassion to fellow man. A movie like this, entertaining and a lecture, is hard to find. It is one of the best movies ever. 10.",
644,29 August 2021,jfgibson73,10, One of the best,"Amazing movie. Hard to watch in some places, heartbreaking in others. One of the great achievements in film.",
645,11 December 2001,corsario_negro4,8, A good movie,"A good movie, a movie that everybody must watch for know a sad reality of the 20th century. A history full of life, Everybody wish be alive. A story about a man who fight against men without reason.  The best movie about Second War World with Jewish like main theme.",
646,13 July 2001,Andrew Hopper,9, A very powerful and emotional film.,"The movie, Schindler's list is a very powerful and emotional film. It had great casting by Liam Neeson, who played Oskar and excellent acting by the fellow cast. The script couldn't have been wrote any better, and together with the horrible facts produced a film which is both informative and moving. You'll never see another one like it. However, as it was filmed in black and white it wasn't as clear I would have liked, although it makes it seem a little ore realistic.",
647,21 January 1999,braco,10, GREAT,"""Schindler's List"" is one of the absolutely greatest movies ever made. I've seen it so many times now (I believe it is five or six), and it still has such an amazing impact on me. The closing scene of the film is so heartbreaking that I (like another user on this list) cried every time I saw it. This is an amazing classic.",
