Review_Date,Author,Rating,Review_Title,Review,Review_Url
599,22 April 2020,zeekwunlau,8, There are no two words in the English language more harmful than good job.,"This film mainly tells the story of a teenager who is determined to become a top drummer when he meets a strict teacher. Under the teacher's devil training, his skills and willpower continue to improve, and he finally completes a perfect work on the music stage.
The director is very skilled in the use of light. Different lights further explain the situation and inner emotions of the characters in the film like the audience.
At the beginning of the film, the method of pushing the lens is used. At the end of the dark corridor is a practice room. As the lens continues to move forward, the scene of the picture gradually becomes only the practice room. A white light illuminates the The teenager who is seriously practicing alone in the practice room is completely immersed in his own world. He is the best drummer here. At this time, the teenager has some pride. The teenager suddenly stopped the drum hammer, as if he found something. As soon as the picture turned to the teacher standing opposite the teenager, let the audience know that the promotion of the camera was actually the promotion of the teacher 's perspective, and the teacher stepped forward step by step. As I walked, my slow steps seemed to imply an examination of the teenager. The teacher stood in the dark and asked the teenager to walk. The light was shining from the top of the teacher's head. The solemn and majestic image came out. At this time, the light on the teenager was not as bright as before. Leaning forward, subconsciously swallowing, and anxiously answering questions before the saliva is fully swallowed, all show less emotional tension and anxiety. After thinking that he had received the teacher's acquiescence, he showed himself in front of the teacher, and the teenager's face showed bright lights. He was to be praised by the teacher, but he got a ridicule from the teacher. When the teenager concentrated on drumming Close the door and leave, so that the light on the teenager's face dimmed again. They suddenly opened, and the teacher came in. The young man thought that the teacher had changed his mind. Maybe he still had a chance, and the lights appeared on his face again, but the teacher just came in to get the coat. The young man 's face was bleak again ... After the teacher left, the angle of view switched, for everyone It shows a panoramic view of the practice room. The whole color is turquoise. The large practice room is only a young man sitting next to the drum, and the thousands of lights outside the window make the younger more lonely. In just four minutes, the director not only explained the identity, relationship and personality traits of the two, but also showed the psychological changes of the teenager through the lighting, showing the ups and downs of the character 's innermost heart, and tightening the audience 's heartstrings and tense atmosphere Come out spontaneously.
The film also appeared dark green light tones many times. The first time when I was alone in the practice room, the feeling of loneliness and disappointment blended with the green. The second time was when the three drummers were trained by the teacher in turns and blamed for nearly three hours. On the way home, the dark green light shone on the tired face of the teenager. The third time was when the teenager went to the show, the bus tire of the bus punctured. When the rental car arrived, it was discovered that the drum hammer had forgotten to the car rental company. On the way back to the drum hammer, a car accident occurred. The teenager struggled to climb out of the car, regardless of the car over the ground. Disregarding it, he ran to the scene of the performance in a bloody head. When playing on the stage, the screen lights were dark green, and the teenager was unable to complete the performance normally due to physical injuries and was unable to handle it. The film was edited at a fast pace on the way to the scene when driving to the scene and on the road back to the car rental company. The young man's heart was like a tight drum surface, nervous and hesitant. The use of the green light three times showed the uneasiness and depression of the teenagers, all of which appeared when the teenagers experienced negative emotions, and could cooperate with the psychological feelings of the teenagers.
At first, the teenager was very self-respecting, with a little pride in his heart. He kept the videotape where he was playing drums when he was a kid, and choked with his family at the table, saying that he would rather live a successful life, even if he could only live to the age of 53 Asked to live to the age of 90, he thinks he can be a great and top drummer. He is a confident and confident child. But when he joins the teacher 's orchestra, he always receives insults and abuse from the teacher when he trains with the teacher. He even beats him and throws him a chair. The teenager slowly begins to recognize himself, but he is unwilling to accept the spirit of losing and wants to correct his name. The wish made the teenager work harder. The arrogance of the teenager was dulled. He wanted to be a strong person like a teacher. The light on the teenager shone on the teacher. After reconciling with the teacher in the bar, the teenager was invited by the teacher to board the performance stage again, only to find that this was just a conspiracy. It was the trap set by the teacher for reporting his own revenge. After a long period of training by the teacher, the teenager's willpower increased. Not only did he not leave in a hurry, but instead he went on stage to forget to play, and brought his level to the extreme. The teacher was gradually shocked by the teenager. At this time, the bright lights were transferred from the teacher's body to the teenager's body, and the teachers and students also resonated. This video uses a camera shake to quickly express the passion of the teacher and the students, and the success of the teenager's performance with the teacher's excited movements and expression.
The theme of this movie is that there is no madness and no survival. Finally, the hearty performance of the male host and the teacher's expression all indicate that the male host has reached a kind of ecstasy, a kind of ecstasy.",
600,15 October 2016,FallenEye,8," A Beat Down, for a Drum Up.","An emotional roller coaster ride, that has you vouching for in one minute, then routing against in the next, leaving you with, well, inner whiplash... And this is one of the reasons I give this film an 8/10.",
601,21 May 2018,MJB784,9, It was wonderful!,"The story pulls you in right from the start and builds with lots of intensity and moments or humor. The story deals with this drummer who is offered by the music teacher to join his band and even though he agrees, the band leader is an overly hostile tough-as-nails guy who realizes he might have met his match in terms of who's more demanding. Very exciting and well paced.",
602,27 January 2020,rdsOLDschool,10, A suprising sleeper.,Until you see it you have no idea that this well made movie can deliver the emotions that a person with strong determination & convictions from within can dish out and take to push oneself for acceptance to be the best as teacher to student and student to teacher.,
603,27 February 2015,saschakrieger,9," Blood, sweat and music","No, this will not be fun and games. This much is clear as the camera moves slowly through a dark corridor towards a similarly dark and bare room with a sole drum kid behind which a young man is sweating. Relentlessly – against his instrument and himself – he is repeating the same patterns and rhythms, again and again. The distant view of him becomes intimate and then dissolves – into partial glimpses of his face, hands, drumsticks. There will be much sweat, tears, blood, the drumsticks will become instruments of torture inflicted by the young man to himself. If love for music was the initial motivation to take up this strenuous activity, he has moved far beyond it at the film's outset. Miles Teller plays Andrew, an ambitious young musical student moving into the dark realm of obsession, willing to throw away family, friendship, love in pursuit of that elusive dream and nightmare of being someone special, being remembered, not fading into oblivion when his tombstone is erected. His face will harden and shut and distort itself as he will learn to play the game.",
604,8 March 2018,Ariaaanrex,8," Blood, sweat and tears.","WHIPLASH is directed by Damien Chazelle and stars lead actor Miles Teller and supporting actor J.K. Simmons. The story is about Andrew Neiman (Miles Teller), an aspiring drummer who is discovered by Terence Fletcher (J.K. Simmons), a highly praised conductor of a jazz band. Fletcher invites Andrew to his class after hearing him play. While in the band Andrew discovers how Fletcher teaches his musicians with what some would see it as, abuse (Mostly mental abuse but also physical as one might understand from one scene in the film).",
605,27 August 2020,ssssgelojun,10, Whiplash,"The story, the ups and downs, it's all good. The rhythm of the screen switch, the close-up in the clean background and the interpretation of the characters by the actors are all very expressive. There is no progressive foreshadowing, but the direct links can experience the complex connotation. It captures the emotional impact and weakens the film's technique.",
606,13 April 2022,emryse,10, A Masterpiece,"This was a masterpiece. It took a fairly simple concept, a student striving to be the best and a teacher pushing his students to breaking point, and executed it to perfection. Powered by this premise and a strong central duo it's simple but brilliant. The central duo are the team of Miles Teller and J. K. Simmons. Simmons is already a distinguished actor but Miles Teller is much younger, he'd only been in a couple films when he made this but he holds his own against his distinguished co-star. Both performances are excellent taking you on a journey with them. They vary between angry, sad, ecstatic, the two actors are doing fantastically and their performances help take you into a world you may know nothing about and have you feeling completely at home by the end.",
607,24 August 2020,Stephan_fr,5," ""Funny games"", music edition.","It's extremely popular these days in the silicon valley to claim , regardless of how much success you have yet to have, that it was the result of 'hard work' and certainly not luck. You know, these TED x talks encouraging your fellow man or woman to put in 19h days in front of the PC every day or be 'a sore loser'. Replace your meals with pre-made smoothies, don't socialize, it will all be worth in the end when you eat caviar at Harrods.",
608,28 June 2020,unclesamsavage,9, Succinct in Sixteen,"The journey of a jazz drummer made as thrilling as a thrilling, underdog sports film. Exhilarating!",
609,2 February 2019,mardalsfossen01,9, Brutal movie about ambition and tenacity,"This movie hits you like a truck, impressive and memorable!",
610,18 January 2015,Jerghal,9, I was wrong,At first I was thinking: another one of those overrated films that gets hyped everywhere but probably won't live up to it once I see it. Well I was wrong. This movie is pretty awesome. Truly great movies can be about a (on paper boring) subject like a Jazz drum player and still be amazing. J.K. Simmons plays a demonic music instructor (he makes Gny. Sgt. Hartman from Full Metal Jacket seem like a sweet little angel) who drills conservatory students to become masters in their craft. Whiplash got 5 Oscar nominations and 'Best Performance by an Actor in a Supporting Role' can certainly go the J.K. for me. I highly recommend you check this movie out!,
611,20 May 2018,keithboyce-82228,1, Rubbish!,As a professional drummer all my working life I had high hopes for this film. I am sorry as I could only stomach 15 minutes of this totally unrealistic load of rubbish! Music can't be created in some sort of boot camp fear school. Other people are saying this is a great film? Maybe if you are not a musician you might think it is realistic but really within five minutes I wanted to puke.,
612,1 May 2018,asifahsankhan,8, One of the very best films of the 21st Century.,"Teacher-student relationships have always been heavily romanticized in movies for years; the ability to inspire young minds to believe in themselves in order to accomplish great things is no easy task. As expounded on, a year before Whiplash, in Blue is the Warmest Color, we all want guidance, a mentor, in this unknowable world and we try to find that in various outlets; one of those being our teachers and educators. Damien Chazelle's sophomore feature Whiplash begins with Andrew (Miles Teller) coming to think he has found that person in the demanding, hot-tempered and never-satisfied force-of-nature that is enigmatic Jazz Band Conductor Terrance Fletcher (J.K Simmons). There is the old introspective exercise of listing the most difficult teachers to get through their classes, then listing the teachers you got the most out of when you were their student, most of the time with those lists coinciding with one another one-to-one. It speaks to the things that push our limits actually in fact come to define who we are.",
613,21 August 2015,pratyush-03848,10, Definitely Deserved an Oscar Nomination,"Wow!!! That is the first thing that came to my mind when I finished watching this film. A great film is one which still leaves you thinking about it after it is over, and that is exactly what this film did for me. The film is about a student (Miles Teller) in a musical boarding school who gets a chance to play in the school's best conductor's (J.K. Simmons) band. The problem though lies with the instructor as he is very abusive towards his students. How the student plays in the band is what forms the plot of the film. Miles Teller is great as Andrew, the student who gets a chance to play in the band. He showcases in this movie why he is one actor we should pay attention to in the future as he has the potential to be one of the best actors of his time. The director Chazelle has done a fantastic job in keeping the audience glued to their seats and keeps us guessing what the next move by one of the character's will be. But at the end of the day, the film belongs to one person and one person only: J.K. Simmons. Simmons plays Terrence Fletcher, the abusive music conductor in the band. His intense performance leaves you in awe just by the intensity of his character. It is no surprise he got the Academy Award for Best Supporting Actor. It almost seemed he was destined to play this role. In the end of the day, Whiplash is an excellent movie and one in which no one should ignore. Watch it for the story as well as the performances.",
614,2 April 2018,user-164-801886,10, Not as far wrong as people seem to think,"Minor spoilers
I know there are already plenty of reviews for this film, but a lot of the low scores are from people who say they don't believe the very premise of the story.
I have also studied music. In fact, I am also a drummer. Music school wasn't like this for me, but high school really was. I was never physically struck, but the threat of it was real enough, and the humiliation suffered in front of the other musicians was traumatic and the memory is painful enough more than 30 years later now that this was a hard movie to watch and yet I couldn't look away. This was so close to what I went through in high school that I would easily believe it if someone were to tell me that my high school band career was the source material.
J.K. Simmons, amazing in everything, was easily as good here and I could only wish that I could have had the strength of character and self confidence that Miles Teller's character demonstrates in this film. I loved the relationship he has with his father (pleasant surprise performance by Paul Reiser), but the general lack of support from a family that mostly doesn't understand his dream is also totally believable and is pretty common for musicians from a non-musical family. This was one of my favorite movies in a while. I just kept yelling at the screen, ""I KNOW!! Right???"" See this movie, and BELIEVE it.",
615,9 July 2021,yashdubey-84644,10, A legend will never be discouraged!,"""Hardwork, determination, hustle and patience will make impossible, possible.""",
616,1 January 2020,hadleyc,10, What a film!!!,I never thought a film about a drummer could be this good. I have never been so tense!!! I was literally on the edge of my seat.,
617,23 January 2015,philthegreatone-786-63058,10, great film,"Great film about the lengths and obsession with wanting to achieve greatness. Miles Teller plays a young guy who plays the drums in a band. He is being taught by a hard has nails teacher. Played brilliantly by J.K Simmons. His performance reminded me of the drill sergeant in Full Metal Jacket. You really get to see what it takes to make it in a cut throat world of competitive music. J.K Simmons as the teacher is amazing. Harsh, but you can see where is coming from. That anger, and desire to help students succeed. If you've ever wanted to achieve something in the arts, or in anything. This film will inspire you. It is a great movie. One of the best of 2014. I Highly recommend it",
618,11 May 2019,harrylosborne,7, Visceral and abrasive to the point of disbelief,"Following its critical acclaim, Whiplash was one of the films to see in 2014, a storied account of a promising orchestral drummer in over his head. On paper, this movie sounds like an excellent premise, non-conventional and darker than almost any other musically-oriented productions. However, the result didn't quite have the magic I was expecting; the aggression displayed by J.K. Simmons (who deservedly won numerous awards for his role) seemed misplaced given the nature of his job, and the film around him doesn't offer much else.",
619,24 October 2019,MrPupkin,9, A modern day classic and JK Simmons is nothing short of brilliant !,In this movie we can see the spectacular performance of Teller and Simmons in a drama jazz movie. The Big Band music an the performance of the musicians makes you want more from this movie.This movie reminds you how hard can the life be with you and how you can beat this challenges no matter how difficult it could be.,
620,28 January 2015,CleveMan66,7," ""Whiplash"" is exceptional filmmaking, but is just about one minute too long.","What price success? That's basically the question asked in ""Whiplash"" (R, 1:47). Is there such a thing as being TOO focused on a goal? How about pushing someone too hard to reach his potential? When does motivation become abuse? We've probably all either had a goal for which we were willing to sacrifice nearly everything, or had a parent, a coach, a teacher or a boss push us to the point where we wondered if it was all worth it. Well, what happens when those last two conditions are present in the same situation? Can we expect the result to be excellence – or tragedy – or both? Miles Teller plays Andrew Neimann, a freshman at an extremely prestigious (but fictional) music school in New York City, called the Shaffer Conservatory. Miles is a jazz drummer who is determined not just to BE great, but to be one of THE greats. His only friend is the single father (Paul Reiser) who raised him. He doesn't have friends or girlfriends. He needs to be free to focus on his music. He practices obsessively and things only get worse when he comes to the attention of Shaffer's most demanding professor, Terence Fletcher (J.K. Simmons), who picks Andrew for the school's very exclusive Studio Band. Fletcher makes the drill sergeant in 1987's ""Full Metal Jacket"" look like a purring kitten. Andrew literally gives Fletcher his blood, sweat and tears, but he never seems to be able to fully please his mentor. Fletcher regularly abuses all his students – emotionally and even physically – especially Andrew. It's Fletcher's idea of motivation. He sees it as necessary to bring out greatness, and greatness is what Andrew covets, but this relationship is not exactly mutually beneficial. It's toxic. And combustible. As the tension builds, Andrew even seems on the path to becoming as rude and cruel as Fletcher – if Fletcher doesn't destroy him in the process. It seems just a matter of time before someone snaps. Inevitable.",
621,4 March 2021,aleksanderk-95350,8, J K Simmons crushed it,This film has some amazing acting. J K Simmons presence created a nervous tension. His dialouge in the film is incredible. Miles Teller also does a great job in this film. The ending is very powerful and phenomenal scene as well.,
622,8 February 2015,newmailbrendan,10, A Masterful Masterpiece,A young drummer Andrew (played by Miles Teller) is determined to do everything in order to achieve his goal. Becoming one of the greats. But when his dream becomes influenced by an instructor named Fletcher (played by J.K. Simmons) who isn't easy on anything and that let Andrew stand on the edge.,
623,17 January 2015,santiagocosme,9, The most inspiring movie I have seen this year!,"I watched the trailer for this movie prior to seeing Interstellar. While I enjoyed Interstellar, when the movie finished, all I could think of was how much I wanted to see Whiplash. Finally, I just did, and I can happily say it was well worth the wait. What an unbelievable feeling when the movie finished!",
624,27 June 2022,katherine-thomas-301-406094,2," Pointless, plotless, boring",Clearly I watched a different film to everyone else. I came away with only one feeling: boredom. Hardly anything happened. I felt no emotional connection to any of the characters. I didn't care that the teacher was an arse and I didn't care about the kid. Almost the entire film was kids drumming in a room. I must've missed the point entirely because I finished it and just thought what a pointless waste of time.,
625,24 October 2020,brooksrob1,10, FLAMDIDDLEQUETASTIC!,"A very fun movie, JK and Miles are beast...As a drummer for 40 years, it's impossible not to appreciate the talent the REAL musicians, that played in the movie exhibit. I learned some new things about Jazz and really loved the pieces played...I understand the sacrifices and time you must surrender to become a known Great...Many are called, few are chosen...I've seen it a few times and each time you can get some deeper appreciation...",
626,19 November 2016,cdjh-81125,9, A Powerful Film That Anyone Can Relate To,"First thing to know before reading this review: I am not a fan of music, I have never seen the appeal of it and have never been a musician, but despite that I loved this movie, mainly because it's not just a movie about music, it's a movie about a man trying to find his place in life and everything that gets in his way. The way in which this film explore, dreams and ambitions is what makes this movie relatable because we've all had passions in our lives, things we've wanted to achieve and the way this film addresses that is beautiful and allows us to get behind the main character more. Miles Teller as Andrew in this movie gives the greatest performance of his entire career, not only is he excellent in the drumming scenes but he was also great at portraying his characters drive to be the best and his inner demons and struggles. But really JK Simmons performance stole this movie. Simmons won The Academy Award For Best Supporting Actor for this film and I've seen few performances more deserving of such an Honor, he's absolutely terrifying in this movie, but he doesn't just rely on some quick dialogue and one liners to carry his performance, the character is also a deep one, while you never agree with his actions you understand why he goes to such extreme lengths to motivate his students. I also was surprised at how much I loved the romance in this movie, the love story is a way for us to see how much drumming is effecting Tellers character and I also thought Melissa Beniost was really good in this film. You wouldn't think it but this movie is incredibly intense mainly because of Simmons amazing performance but because you understand the stakes of getting every note and key right. Few movies have had a more perfect ending than this one, the stakes are high but thanks to the perfectly developed characters and everything coming full circle the physiological warfare that goes on between these two characters comes to a perfect and satisfying end that left me in amazement. I only have a few flaws with this film and is mainly some of the minor characters they're just horrible people for no reason and tear Andrew down just for the sake of it and they could have been given more depth. ",
627,21 June 2022,ThereelscoopwithKK,9, A Special Film,When you consider how there isn't actually that much of a story in this film outside of Teller's characters undying perseverance it only makes you realize how truly outstanding the performances of Teller and Simmons truly was.,
628,28 September 2020,DogeGamer2015,10, WONDERFUL,"An excellent musical and dramatic experience, with great performances and iconic moments. TOTALLY RECOMMENDED!",
629,11 January 2015,abouhelier-r,10, Whiplash,A promising young drummer enrolls at a cutthroat music conservatory where his dreams of greatness are mentored by an instructor who will stop at nothing to realise a student's potential. ,
630,2 April 2017,grnhair2001,5, Ultimately unsatisfying,"Admittedly, Simmons's performance riveted me and frightened me more than once in the first half of the film  Until it didn't because it was too much one note, played too often.",
