Review_Date,Author,Rating,Review_Title,Review,Review_Url
418,7 April 2020,jerrodklein,8, great movie,"If you are a drummer you will love this movie. If you are a person who likes good films, you will love this movie. Just excellent and Miles is fantastic. Damien Chazelle shows his directing chops here which also shined in his follow up film LaLa Land.",
419,6 February 2015,frozman-541-190280,5, Highly overrated,"Not really a review but I just wanted to be one of the few in here to state that this movie is actually not so great. In fact, it's pretty average and this is coming from someone who loves movies ánd drums! That some people claim this to be the movie of the year is beyond me, really. The storyline is far from original and brought in a far from original way, the acting is o-k-ish (just Simmons though, Teller is as weak as ever), the little love-angle that was put in might as well have been skipped and the story itself with the dictator-like teacher who, although the school principal said he was being watched, can do what he wants is just totally implausible. The only good thing was the end scene with the solo and all...but just over the speakers, with the screen turned off.",
420,5 February 2015,rebecca-ry,9, A Very Well-Made Film,"Whiplash follows a first year music student who is talent spotted by the school's most fearsome teachers. Now one of the drummers in his class, Andrew (Miles Teller) is under pressure to become the best he can be, and more.",
421,25 June 2019,FeastMode,6, my notes,Pretty good movie. good acting. feeds my interest in music and makes me pay even more attention to the drummer in a band (1 viewing),
422,20 November 2014,StevePulaski,9," Blood, sweat, and bangs","Damien Chazelle's ""Whiplash"" is a film that left me breathless and physically exhausted when I got up to walk out of the theater, and all I had done for the past hour and forty minutes was lounge in a theater recliner and watch somebody else work themselves into a sweaty mess. A good film about motivation and determination leaves you humbled, but a great film about the same subjects leaves you emotionally drained and even enraged; enraged from watching others bring the lead character down and even attempt to compromise his or her dreams. The film may even leave you determined to exercise your own dreams out to a fuller extent, not compromising your talents or adhering to requirements, and realizing what makes you happy may not make others happy, but those others aren't you or likely sleeping in the same bed as you.",
423,12 February 2017,ElMaruecan82,10, Ba dumb bumb cheshhh!,"""Whiplash"" tells the story of Andrew Neiman (Miles Teller), a young drummer whose obsession is to become ""one of the greatest"" and who finds his match in Terence Fletcher, a conductor who put the ""mentor"" in ""monster"" and ""monster"" ""in maestro"" and will push Andrew to heights of unsuspected greatness and to the edge. ",
424,13 October 2015,idanvinter123,9, Probably My Favorite Drama/Music Movie Ever,"Let me first start off by saying that Drama is one of my favorite movie genres. The only other film I saw that includes music and Drama is Grand Piano, which is also a fun film. Now let's talk about this film: Great opening scene, really good comedy, action-packed, excellent story, really terrific performances and awesome new actors I'll be keeping an eye on them from now on. This movie has a great message to it, which is to never quit practicing and keep working until you reach your target, and it delivers it so well. Now let's talk a little about why I didn't give it 10/10: Sometimes there are moments in the film which you're not so sure about what you just saw, and times when you're like- Why ? So apart from those things, overall I had a really good time watching this film, and I'll definitely say you should check it out if you're into Drama movies, with musical elements and an important message executed very well.",
425,16 January 2019,ealesnj,1, Headache Abound !!,"What an absolute non sense film.
What a pretentious load of baloney.
I would rather take a horned cactus up my arse and jump on it repeatedly rather than watching this stupid movie.",
426,11 June 2022,mansravald,8, JK Simmons ladies and gents,"A great movie for those who like drama. JK Simmons acting is outstanding, pure emotions! The way he switched from beeing humble to become a complete dickhead was stunning and also the fact that you never saw it coming. A movie worth the time!",
427,24 February 2015,aghayman,10, One of the greats,"This movie deserves all the Oscars it got. I saw it and I was speechless. At first I didn't know what to think, but it was one of the best movies I have ever seen. As a musician myself I know how hard and time consuming it is, but this movie brought it to new heights. ",
428,9 August 2015,KineticSeoul,9, Sensational!,"This has got to be one of the most impactful, inspiring and humanistic film I have seen in a long time. From the start to finish, it was breathtaking and emotional to sit through. Because of the cinematography that builds tension and the direction that brings about that captivating and compelling feeling. You can almost literally feel the emotions poring out of the characters. This movie revolves around the human ambition for greatness and how not everyone is how they seem. This is just simply a sensation film making from start to finish and it really had my attention all the way through. Certain people need that kick in the rear to focus and get started, but the question is how much pushing can some people take. I guess if they want it enough they can handle it, because the end justify the means for them. Watching this film was sort of like a more artistic and powerful portrayal of how Gordon Ramsay treats his chefs on television. Except Ramsay is probably doing it for rating and publicity stunt. Although certain portion of him makes him do that, it's mostly for the ratings. Overall, this is a film that really hits the core with it's emotions and intensity. I highly recommend it. The techinical aspect of this film when it comes to the music, instruments, direction and cinematography with some fantastic acting trutly brings this film to life.",
429,31 October 2018,cricketbat,8, I was completely drawn in by the movie and felt all sorts of emotions,"Whiplash is a story without a real hero. J.K. Simmons is a terrifying villain and Miles Teller is a self-absorbed masochist. That being said, this movie is absolutely compelling. I've never been in a band and I'm not a jazz fan, yet I was completely drawn in by the movie and felt all sorts of emotions - mostly fear, panic and anxiety. I hope to never encounter someone like Terence Fletcher in my lifetime.",
430,16 May 2015,Sidd_The_Movie_Slayer,10, Toe Tappingly Entertaining,"Whiplash, Whiplash, Whiplash. You make me ever so happy. It is mind boggling how good this movie is, not was. This was my personal favorite of the year and for good reason. Lets start with performances, J.K. Simmons is well the bright and shining star of this movie. I will have no arguments on that. He gives a Heath Ledger level performance and completely earned his Oscar. Miles Teller gave a perfect performance and was an inspirational lead in an inspirational movie. Next up is directing. Damien Chazelle's direction and writing is flawless to say the least. The smart overhead shots of instruments really show that the actors know how to play them. This movie is a must see for everyone who likes good music, great performances, and great directing. 100% or A+",
431,12 March 2023,UniqueParticle,10, Among one of the best nominated movies over the years!,"I probably could've reviewed sooner just haven't watched since before I started reviewing a few years ago; now I happily own this gem in 4K. Miles Teller and JK Simmons are electrifying throughout! Whiplash is focused on music, dedication, the right tempo, sweat, harshness, and astounding performances! I love the intensity of the music and the way JK Simmons character behaves he's so tense he's perfect at that in any role. Damien Chazelle has become a legendary filmmaker at a young age of mid 30's which is impressive. I love Whiplash it is a great magnificent movie very worthy of the awards at the time.",
432,9 August 2019,dpg-87522,8, I love J.K Simmons:,"Wiplash is a movie that was praised by critics, and i´m agree, is a very good movie,and the J.K Simmons performeance is amazing, J.K Simmons is one of my favorite actors.The movie is about a young drummer, maybe this could sound boring,but is not,something that i like very much is that the movie is very realistic to some extent,give you the message that without pain there is no gain,and that is 100 porcent true.The main character suffer ,and you don't realize,because the movie doesn't victimize the characters and that´s something good. It's very different movie than the ones I've seen, I loved this movie,but the problem is that the movie sometimes is a little exaggerated, like when Andrew is crashed by a car and even though this bleeding is going to touch the concert. Look i don´t have any trouble in which the movie has only two main characters, the problem is that they doesn't have much personality,we know that both like music and well thats it.In conclusion Whiplash it's an outstanding movie but it's not perfect",
433,17 November 2014,Hellmant,10, One of the most epic showdowns in cinematic history!,'WHIPLASH': Five Stars (Out of Five) ,
434,18 January 2015,MOscarbradley,9, Totally riveting.,"Who would have thought that a movie about a young musician training to the the drumming world's equivalent of Charlie 'Bird' Parker could be this gripping but Damien Chazelle's ""Whiplash"", (it's only his second film and he both wrote and directed), works both as a study about a pupil/teacher relationship and as a film about obsession as well as being a superlative jazz 'musical' and it's a film that confounds expectations at every turn. Only once does it go slightly off the rails in a melodramatic sequence leading up to a crucial concert but it recovers from this blip building to an incredible musical climax in Carnegie Hall.",
435,15 January 2018,Tweetienator,9, Great,"I don't love jazz much but this movie I love. A story about the fine line between passion and madness, about freedom through commitment. Great movie. Great acting. Like Black Swan a fine movie about art and being an artist and the sacrifices it takes.",
436,15 May 2020,mister_bateman,3, Stupid and absolutely ridiculous movie,"I'm not even one of those people who think bullying is categorically wrong or useless. I even think it's important in some areas. But it makes absolutely no sense when artistic creation and music is involved. The fact that the movie is about jazz, which is urban meltingpot garbage, makes the entire drill instructor routine even more ridiculous.
If you see it as a satire/comedy, it's quite funny though.",
437,31 January 2015,Robert_duder,10, Where did this movie come from...doesn't matter...you won't ever forget it...period.,"This was the final film I needed to see for a couple of reasons. One it is the last of the Academy Award Best Picture nominees that I needed to see. It is also the last film I wanted to see before I went ahead and did my personal best of 2014 list. Good thing I waited because guess what? Whiplash is on it. Whiplash is headlining it. In the last three weeks of trying to see the best of 2014, I found THREE films that I am giving a huge ten to without hesitation. I suspected Whiplash would be good, I just don't understand where it came from. I may have seen a trailer once but for it to show up as a best picture nominee was perplexing. I didn't hear it doing particularly well or even any reviews on it. Whiplash is mesmerizing. Whiplash is an instant classic. Whiplash is probably the best film of 2014. I was entranced. My jaw was dropped for much of it and it is one of the best performances in a film I have ever seen. Whiplash is phenomenal and that doesn't do it justice. It is gut wrenching and expressive and explosive and if you are any kind of musician you will adore this film and if you love jazz or percussion music...well you'll just explode with joy. I could literally go back and watch this again as soon as the credits are done rolling and be blown away all over. Whiplash is a must see film in every sense of the word.",
438,8 March 2015,Rox73,10, Big Boy Tempo,"As a student of classical music for 20 years I have always been in AWE of jazz musicians. I love jazz, I love listening to it, love the sense of humor it has, the style, the spirit and yes, the tempo - jazz is way more complex than your normal, every day music whether it's classical, rock or whatever. Whatever people think about the brutality or how music teachers push their students towards greatness is really not the point to me. The point is that it takes extreme discipline to reach perfection. How does one measure perfection? The only measure I know myself is if I get goosebumps when listening to a performance and if I hear that Big Boy Tempo without any hiccups. This movie and its music gave me goosebumps. Simple as that.",
439,7 February 2015,851222,10," Great and not a typical ""drama"" / ""music"" genre picture",Greetings from Lithuania.,
440,25 January 2015,ThomasDrufke,8, Not Quite My Tempo,"I don't think anyone can question Miles Teller's acting talent after watching Whiplash. Matter of fact it should have never been in question, especially after The Spectacular Now or even Divergent. He is getting better with every role and it's only a matter of time before he is also being nominated for an Oscar. J.K. Simmons plays the ultimate jacka** teacher, who looks to other means of educating the Jazz band, abuse. When I say, I don't think there has ever been more of a despicable character I mean it. I can't even describe his character without cursing and wanting to yell in this review. Whiplash is truly an exhilarating experience that anyone with a superior who pushed them too far, can relate to.",
441,24 August 2020,damianphelps,9, Intense Authenticity,There are times when watching this movie that you find yourself holding your breath as the tension pounds along with each beat of the drum.,
442,29 January 2023,lousha-1,1, Predictable load of rubbish,"I've been avoiding this movie for years because its synopsis sounded like a warning. I could imagine almost from scene to scene a really terrible film that I would hate. But the tons of raving reviews always bugged me. It can't be that bad, can it?",
443,17 November 2014,rubin-7,6, Stretched the bounds of believability,"It is often taught that a screenwriter can do anything in the first five minutes of the script and the audience will go with it. Unfortunately, the same does not hold for the first 30 minutes of the film. This film really stretched the believability quotient for me. It was over-the-top absurd at times and I didn't ""buy"" much of the action. The music school was preposterous, people simply wouldn't let this behavior fly in this century. Miles Teller was quite good as the student, but I felt JK Simmons was miscast. Not because he is not a good actor, but because his TV persona is so memorable and opposite, that I just couldn't believe him in this role, unfortunately. The role was just ridiculous at times, so it's not just the actor. I'm happy to say that the film does get better in the second half, but not enough that I would recommend it.",
444,12 February 2015,naveensankaran18,9, one of the best movies of 2014,"Without any expectations, without any cue I went onto seeing this movie but I wasn't prepared for a Jazz thing which I never experienced before. J.K.Simmons nailed it.",
445,22 January 2022,Moah-505q,9, my fav musical movie everrrrrrrrr!!!!!!!!!!,Insane performance by J. K,
446,4 April 2018,stk974,9, You are either the best or you are not to be remembered at all and that's the whole point of this miserable life.,"This is my second review and English is not my mother tongue, so keep that in mind, would you?
This movie has affected me in so many ways that I am not sure I am good enough to express each and every one of them. First of all, anyone who gave 1-5 star to this movie, really?! Go see some chick flicks and entertain yourselves. This movie is absolutely not for such people.
Secondly, J.K. Simmons and Miles Teller were so good that I cannot decide which one is the best and the other follows so this movie, as in its original story has two marvelous characters played by most talented actors, one junior and one senior and they deliver and convey every single note of this story perfectly. They actually painted a very difficult yet beautiful ""The Master and his student, meant to be one soon"" story for us in this film.
Yes, the scenes were pretty rough, I did not like them either. There are some disturbing scenes and yes, there is certainly abuse, both verbal and physical in the relationships between Fletcher and his students but that's all about folks. This movie intends to make us see that either you take everything and endure to become perfect in this life or you simply submit to loose. As Andrew says: ""I do not want to be great. I wanna be one of the greats"". If you just aim to be one great person, find a cuddly thoughtful teacher and dance with him/her. If you want to become legend, find a legendary master who takes no sh.t from you whatsoever. That is the only way you will be molded and become a dazzling sculpture out of an amorph piece of stone.",
447,13 February 2015,Tanay_LKO,9," Intense, Surreal, Sublime!","Never thought that a casual browsing through a film, could turn out to be much more - storming, nerve- shattering, reminiscing horrors of the past, lift above them, and then becoming someone stronger than imaginable.",
448,1 February 2015,asterhune,10, You'll never look at drums the same way again,"This film is what the movie experience is all about. You must see this in a theater to get the benefit of the sound - which is key - and the immersion of being in a room where the story is the only thing going on without distractions. Simmons and Miles ""inhabited"" their roles. The tension in this story began in the first five minutes, and did not relent until the credits rolled. As the lights came up, we three viewers turned to each other and said ""WOW"" simultaneously. We went to this film with no expectations, but had read other reviews that were glowing. Based on them alone, we took a chance. SO MUST YOU.",
449,13 June 2015,lesleyharris30,9," An Intense Piece of Film that is sure to Delight all Moviegoers,","Whiplash is an fantastic movie with a really well developed storyline and an outstanding cast. I was in shock and awe throughout, it is a very intense film as we get a very deep look inside the life of a young man wanting to make a career in playing the drums, there are many scenes that are so powerful that I found myself not taking my face away from the screen for one second, not even blinking, I don't want to spoil any of these but I will just say that there is nothing like them in any other movie. I think we could have been given information about Fletcher, I know that we are following Andrew, but I would have liked to known some more about Fletcher's past and what made him turn out this way, it would have made J.K. Simmons performance even more substantial than it already is. The performances made this movie, as it is one that would have been terrible without great acting, J.K. Simmons and Miles Teller hit it out of the park, I was always saw Simmons as a versatile actor, but he was never really given roles where he could really shine, he is given that opportunity in this and uses it to full effect, he is terrifying and in a strange way very likable, Teller also delivers a spectacular performance, particularly in parts where his character lashes out, and he clearly put in some serious drum lessons, which is very impressive. Dramatic, intense and all around outstanding, three Oscars dosen't lie, I would recommend Whiplash to all moviegoers. ",
450,20 October 2014,Likes_Ninjas90,6, The film is based on Chazelle's life but is fiction because reality is realising not everything is possible if we're willing to try,"Reality television shows like The X-Factor and American Idol have created a culture of humiliation where it is as fun to watch people fail stardom as it is to discover the next great talent. But the behaviour of J.K. Simmons's character in Whiplash is so extreme and over the top it would make Simon Cowell wilt in disbelief. Imagine an episode of The X- Factor where Redfoo repeatedly slaps one of his contestants in the face or Ronan Keating lays down a homophobic slur. That said, the vision of Delta Goodrem in previews of The Voice screaming at young children ""I need you on my team!"" and telling kids they're mega stars amplifies the pressure and expectations placed on young people to be successful today. The stakes are higher than before because technology like the Internet and Youtube has increased the volume of global talent and shortened the waiting time. With his second feature film Whiplash, writer-director Damien Chazelle addresses the culture of fear and expectations he suffered firsthand. As a drummer in a high school jazz orchestra, his anxiety grew from not playing for fun but necessity. He was isolated by a desire to succeed and pushed by the encouragement of his school conductor, which became the basis of a short film and this feature produced by Jason Reitman. ",
451,1 June 2020,briancham1994,7, Terrific and terrifying actor,J.K. Simmons really steals the show here. This film puts a horrific twist on the usual aspiring artist plot by throwing in a very alarming figure who distresses and abuses his students. Yet they stick around because they feel this is their only path to greatness. Is it worth it? This film explores the consequences.,
452,2 March 2015,capone666,8, The Vidiot Reviews...,Whiplash,
453,25 May 2022,HotHamlet,3, Poor.,Coming from a non-musician.,
454,6 June 2015,BiplavAcharya,9, High quality low budget movie,"I am not fond of Music related movies, but this one became one of my bests.",
455,11 January 2017,ungratefulwhelp,2, Utterly mystified by the high rating for what is a terrible film,The only thing I can find to recommend this is the acting of both principles and possibly the drumming skills of Teller. ,
456,10 January 2015,nairtejas,8," A ""Very Good Job."" ♦ 75%","When jazz and cinema go for a date together, it usually ends with bitterness. While in Damien Chazelle's Whiplash the date goes fine, there still remains gaps that could've been filled.",
457,2 May 2020,jokanovicselena,1, an insult for anyone with any common sense,"I'd like to know what's wrong with people who liked this movie? Besides from being totally unrealistic (I mean the scene where he gets hit by a truck and barely suffers any injury and that's not all - he isn't even in a state of shock or something and is only worried about coming on time to perform like he gets hit by a truck everyday! Hahahahaa ridiculous... ) , I think this story is wrong on so many levels... We don't get to see his LOVE for music , all we see is a sad, pathetic, disrespectful , neurotic human being obessesed with an idea of ""becoming great"" and the movie tells us that there's nothing wrong with that...",
458,20 May 2015,tomgillespie2002,9, Dizzying and intense,"For a film primarily focused on the relationship between teacher and student at a prestigious music school, Whiplash actually feels like one of the best American thrillers in years. Yes, it is about one young man's struggle for absolute greatness in his field and poses questions about how hard one should push themselves to achieve artistic integrity, but it is the verbal sparring between lead Miles Teller and the scene-stealing J.K. Simmons, and the sight of Teller pounding his drums to dizzying effect while his palms gush with blood, that really causes the heart to race.",
459,4 September 2020,gardnernrg,10, Perfection.,"Chazelle, Teller, and Simmons made a perfect film. This film is the embodiment of tension, of suspense, of anxiety, of gratification. Everything, it hits every single ball out of the park. Chazelle's directing is flawless, and the color is absolutely perfect. I found myself pausing this movie very often to just look at the shots and colors that Chazelle had composed on the screen. Teller acts the HELL out of this role, and he does it perfectly. Simmons acts the HELL out of this role, and he does it perfectly. I may not have said perfect enough, but as a longtime band member and avid film lover, this film is perfect.",
460,15 August 2016,MasterShifu,10, Great movie,I loved this but the movie is underrated. ,
461,17 January 2015,billcr12,8, J K Simmons Deserves Oscar,"JK Simmons is a teacher at a prestigious music school in New York City; obviously Julliard, but the name is changed here, but it doesn't matter, the story is a compelling one with Miles Teller as an aspiring drummer who falls under the wrath of Simmons(Mr. Fletcher). The man is a Vince Lombardi type of instructor who treats everyone with equal contempt in order to get the best out of them. I am not a fan of jazz, but I as a music lover, I was able to appreciate the struggles of musicians of any kind. Teller is excellent as the kid who plays so hard that his hands bleed, and Paul Reiser appears as his supportive father. Simmons has been nominated for best supporting actor and he should take home the Oscar. I remember him playing a neo Nazi on the HBO series ""Oz"" and he is clearly a great character actor. Whiplash is one of the best movies of 2014.",
462,5 January 2015,Pomplemoose-Pass,8, Freakin' WILD!!!!,*******Spoiler Alert*******,
