Review_Date,Author,Rating,Review_Title,Review,Review_Url
201,28 March 2015,kingbk-2,9," The two harmful words in the English language are ""good job""","Geniuses. There are only a handful of them in the universe. They live life on a completely different planet than everyone else. In the process, they make sacrifices that most people wouldn't be willing to make. Sacrifices in relationships, social interaction, in any possibility of living a ""normal life."" Whether that's Einstein, or Bill Gates, or Steve Jobs, Mozart, Michael Jordan, Lennon-McCartney, etc, these people lived a life that wasn't normal. In all honesty, normal to them, like Andrew Neimann and Terrence Fletcher in Whiplash, is insufferable and for the weak. ",
202,30 July 2021,lazyaceuk,8, Drum roll please,Whiplash sat on my hard drive for a while longer than most. There was no real reason for this. I was aware that J. K. Simmons had claimed his Oscar and that the film was well regarded on release. Sometimes films have to age like a wine and your palette needs to be ready.,
203,25 January 2015,legend-is-alive,2," If you don't like Jazz stay away, if you like Jazz definitely stay away !!!","if you have seen black swan then you are going to watch it again but this time the main actor is male and instead of bale this time it is jazz or should say only drums !!! The acting is on the top that is for sure, but the plot is sometimes very unrealistic so it is difficult to believe what is going on !!! After time the music becomes annoying (I mean really annoying) The movie is a musical yes but that does not mean it has to have music all the time sometimes it is too long and drums are not to instrument that you want to listen all the time !!! Anyways for me it was another black swan movie which was a pointless boring movie, this movie was way better that black swan but still not a good movie !!! I gave it 2 out of 10 just because of the acting nothing else !!!",
204,22 February 2015,dudekabob,1," Abuse, Envy, Betrayal and ""Jazz?"" Oh, my!","""A promising young drummer enrolls at a cut-throat music conservatory where his dreams of greatness are mentored by an instructor who will stop at nothing to realize a student's potential..."" or so the description goes. ",
205,30 October 2014,michaellouie-146-155967,3, Appalled at all of the Spectacular reviews.,"No need for a long review here. I am disappointed and amazed at the overwhelmingly 9 and 10 star reviews for Whiplash from Users and Critics alike. I agree that the performances are great, and for them I give some stars. In spite of the acting the film/screenplay ultimately glorifies cruelty and abuse to achieve success. I mourn the fact that we have become so insensitive to traumatic, inhuman treatment. ",
206,18 January 2015,cordenw,7, Like my old gym school teacher,"The bullying nature of the bandmaster had me reliving those horrible days at school where a gym teacher had much the same approach to bringing out the best in his charges. Fifty five years on and I have grudging respect for the tactics of achievement by fear, but I still recall him as a rectal aperture who could have used more tender methods. J.K. Simmons plays the ""rear exit"" role to perfection, totally uncompromising in his almost unattainable standards (and a person who would be doing jail time under today's parameters). ",
207,3 February 2015,gavin6942,8, An Emotional Punch to the Gut,A promising young drummer (Miles Teller) enrolls at a cut-throat music conservatory where his dreams of greatness are mentored by an instructor (J. K. Simmons) who will stop at nothing to realize a student's potential.,
208,11 April 2016,davidmendo,1, Music is never a competition.,"The main argument of this film is that music is like a sport. You have to put yourself to the limit to be a top player. And this is not true for music. Music is all about feeling and soul and touch audience with the performance, not to be able to play at 400 BPM. Being a musician is an inner path to lead to a self discover. Virtuousness come with the practice and talent, but not being assaulted physical and emotionally. Music is an art, not a competition, so is subject to be interpreted in many ways, so being a best musician is not matter of math or time clock. Jazz is a language, not a race. Photography and editing are superb in the film, that's the only thing I liked.",
209,17 January 2015,juanmartinrevilla,3, Jazz fiction,(biased but educated review from a jazz drummer student),
210,11 June 2020,hskywrh,10, 1st Ever Review,"Astonishing film, even without an interest in jazz or drumming I found this film totally captivating. Actors are amazing and I don't hesitate to give this 10/10",
211,26 March 2016,sendmejunk-nie,8, I don't want to be great. I want to be one of the Great.,"I like when Hollywood dares to cast a young actor that doesn't fit their standards of beauty. The lead worked extremely well with his character and quite frankly, I think that's what kept me riveted. Adversity fuels him, exhaustion is merely an obstacle in his path. The actor's nervousness and receptivity is mesmerizing and will entrap you in his world. The camera could have pulled a Lars Von Trier, standing just behind his shoulder and it would have felt the same.",
212,7 January 2015,venom-dushyant,9, Mind-Blowing Jazz Music Harmonising with Some of the Most Amazing Acting,"Miles Teller being an up and coming actor along with JK Simmons who is a well-established underrated actor, whose performances have often been spell-bounding, together have made one of the best movies I've ever seen in the music genre (and I've seen Inside Llewyn Davis). Miles, who plays Andrew, a young drummer studying at one of the top schools of music, shows us his passion in every frame, every single time, whilst delivering a performance. His anger, temper, rise, fall, and everything else in between worked so well with the movie, that he caught my attention with every single frame passing by. As time passes, I am sure he will take the industry by storm along with all the other young up-and-coming actors and actresses. Simmons, who plays Fletcher, delivers a performance worthy of his name. Actually I might actually go ahead and say that this is the best I've ever seen him act. He convinces me completely that Fletcher is an insane perfectionist, so much so that he can forget that the performers were even human, until he gets the beat, tempo and rhythm he needs. Insanity suited his character and he delivered that in an extraordinary fashion. Both the actors showed their passion on screen, but I must give props to the director, who made the film go at the right pace, pushed the actors to show insane amounts of passion, and not allow the audience to divert their attention from these captivating performances. I love jazz music, but don't have much knowledge. But whatever I saw in this movie and heard as well, made me love it even more. Whiplash and Caravan were two genius compositions, and they were so amazingly beautiful. I actually don't know the right adjectives here to help me show how much I loved the score. All the other characters also played their part quite well making this movie one well-rounded show of art. All in all, this is one movie that even the non-jazz lovers will love. If you want passion on screen, you see it delivered in aces.",
213,16 March 2022,heyarnaldoqt,10, Drumsticks,"There are already more than 1,400 reviews before this one and I'm not trying to say everything that's good about the film, and less try to analyze some supposed philosophy behind Whiplash.",
214,9 March 2019,jadongarcia,10, Major oscar snub here,I was really hoping this movie had won the academy award for 2014's Best Motion Picture. But of course it didn't and instead lost to Birdman. I still haven't seen that film to this day. Whiplash was the only film in that category that I had actually watched.,
215,9 April 2022,tomjreynolds-20414,8, Well done TikTok and most of all well done JK Simmons,Everyone on my TikTok was telling me to watch this and am I glad I did. I didnt even know the name of the guy JK Simmons played cos I was so distracted by how good his acting was. I'm almost sure he won an Oscar for this and if he did it is so well deserved. I didnt even care about Andrew. Simmons blew him out of the water.,
216,28 March 2016,jean-say-hi,10, Electrifying,"At first it was not the synopsis of the movie that captured my attention but the IMDb score. I thought ""it's just a movie about drumming, how compelling can it be?"". I was an ignorant fool. This movie rocks (or jazzes). From start to end. Your eyes are glued to the screen, you keep guessing what will happen next. I anticipated how the characters would react to one another, not how the story unfolds. The sheer brutality is both refreshing and terrifying. Coming from all characters. They did a splendid job on building original characters. I salute you. It was also an eye-opener for me and my friend. It was enthralling to learn more about the world of orchestras and jazz. Still, it was awesome. A thousand out of ten.",
217,29 April 2015,kchini,1, Promoting fascistic perfectionism.,It amazes me that a movie that promotes such level of fascistic perfectionism gets so much praise. I say fascistic because the sick perfectionism of Nazis was one of the main reasons they thought it is OK to gas millions of people. If you are not perfect based on our standards you don't deserve to live. ,
218,6 February 2015,user-152-956403,1, Good Job,"First of all, English is not my mother tongue. Excuse me for the mistake I made in this review.",
219,20 February 2019,yoggwork,7," I don't like this devil mentor, and I don't like this kind of devil's struggle","It's really inspiring, but unfortunately I don't like this devil mentor, and I don't like this kind of devil's struggle. This may be the choice of ordinary people.",
220,6 April 2022,FilmFinatic062817,10, A story of where passion meets drive,"This film, which I learnt is somewhat biographical, was great, it truly was. Nineteen year old Andrew Niemann wants to be the greatest jazz drummer in the world. Andrew is starting his first year at Shaffer Conservatory of Music, the best music school in the United States. At Shaffer, being the best means being accepted to study under Terence Fletcher and being asked to play in his studio band, which represents the school at jazz competitions. I thought that a reason that I enjoyed this film so much was because of the editing, it truly and effectively created an atmosphere where the audience would become immersed within the either stressful, tense or calm atmosphere that Niemann was experiencing. J. K Simons plays Terence Fletcher, a conductor with a terrifying thirst to bring the best out of the best in his students. I'm going to say this, he most definitely earned that oscar. His performance was absolutely pertifying, the students cowering away in his presence and fearful of rebelling against him. This film, almost a character study, explores Andrew Niemen's passion and drive to be the greatest drummer of all time and I thought the gradual changes that can be seen were well and truly very well done, it allowed the audience to see where his prior mistakes and the changes he had to make mentally. Furthermore I just want to touch on the sound design, it was amazing and actually led me to listen to some jazz. It was a beautiful culmination of the instruments, the audience slowly realizing the difficulty of the pieces and the recurring melodies. I would definitely recommend this film.",
221,18 March 2015,Horst_In_Translation,8," Mindblowing, our generation's ""Amadeus""","And it does not even need a Best Picture win for this description. Damien Chazelle's ""Whiplash"" was one of the big players this awards season mounting in three Academy Award wins. J.K. Simmons basically dominated the supporting actor (so happy for him, he is such a likable guy, but was he really supporting?) category from start to finish and Chazelle himself managed a writing nomination with the Academy. Given he just turned 30 and has a bright future ahead of him, I am sure he can live without the director nomination. ""Whiplash"" is a great film. It starts off good, but quickly has you on the edge of your seat for the rest of the film. They kept it at clearly under 2 hours, which helped a lot as it would have sucked if they had filled the film with unnecessary scenes. This way now, it's really all essential from start to finish.",
222,30 April 2019,Mr-Fusion,9, Clawing to the top with blood-stained drumsticks,"Tape your fingers now or else those nails will be bitten down to nubs when this is over. Equally unbearable and exhilarating, Whiplash turns the teacher-student relationship right on its head; far more Full Metal Jacket than anything inspirational. To that end, this is the best I've ever seen from J.K. Simmons, spewing venom as Miles Teller strains under his withering abuse. This is psychological thriller against the backdrop of jazz (a sentence I never thought I'd see myself typing), and Simmons is the emotional terrorist you just do not see coming. That goes for the whole movie, one that I've never seen anything like. There's a wealth to appreciate here, from the masterful editing and direction to the music, and the hype is absolutely warranted.",
223,11 July 2016,rmax304823,6, Drum Boogie.,"Damien Chazelle directed this story of a talented young drummer (Miles Teller) at an elite music school in New York who is browbeaten mercilessly by his instructor (Dr. Emil Skoda, I mean J. K. Simmons). As unpromising as the material sounds, and as autobiographical, it's better than I'd expected.",
224,1 October 2015,siderite,8, Interesting take on the classic story of getting through by effort,"You've seen this before, usually in sports movies, where some guy or girl is set to get through some very difficult competition and works their ass off to make it. Whiplash is not really about the finishing competition, but about the mindset of the person wanting to ""get there"" and of the teacher who needs to find a prodigy to validate their own efforts. Most of all, the film is extraordinary for making the viewers ask themselves if there is a line and when can you consider it crossed, in both pupil and teacher.",
225,16 April 2016,luminesce,10, So. Much. Tension. and without guns.,An absolutely riveting movie. ,
226,25 February 2015,ericbobg,9, Edge of your seat intensity,Read my full review here: http://ericsgoodstuff.blogspot.com/2015/02/whiplash.html,
227,13 March 2016,stonedraim,8, Boom....shackalack... frecka...fadish!,**** May contain strong spoilers ****,
228,13 February 2018,mazzobr,9, Icarus with melting wings,"Let´s think together: to what extent human beings can go to achieve greatness in a craft? I am not talking about a search for happiness, flowing, and connection. Crossing history since Icarus, to be a human being is also dreaming with a power to take things suspended for a moment or to run the show and the attention for while. This film shows what ambition can make to those who want to pay the price of it. The screenplay brings a music student and his terrible mentor, one that is looking for a new Icarus. Humiliating his students taking them to the limits of sanity that's the price his students pay to make him feel great again. Charlie Park, the bird, is used by the teacher as the perfect student, the role model, that could bare everything because a genius never give up this talent. Even with the sun meltings the glue which makes wings attached to his body, Icarus continue to go up. This film is about a musical dream of flying high melting ambitions.",
229,13 November 2015,squalk_birdie,1, Fails to understand what it means to be a musician,Seems to me the only people who like this movie are people who know nothing about music. ,
230,11 April 2020,a-65018,8, Incredibly and powerful!,This movie was far better than the trailer made it look.,
231,17 May 2020,Lovegood13,10, Exactly my tempo!,"This is one of my favorite movies of all time. I remember the first time I watched it I was so captivated that I wished the movie would go on and on and never end. Especially during the solo at the end, I was so completely mesmerized I forgot to breathe. The main character, played by Miles Teller, is very relatable. The character is everyone of us who are ambitious and driven, and have a thirst to prove ourselves. Miles Teller was able to play that part so perfectly, you forget you're watching a movie. It is almost like watching someone in real life. He is such an amazing actor, it is sad that he is so underrated. I hope he gets more good roles like this in the future.",
232,29 September 2018,charlestraphagan,1, Heed Eckhart Tolle,This is a perfect example of Echart Tolle speaking of the Ego spreading destructive energy for years on end to justify the means and calling it at the end success.,
233,3 June 2015,anuradhamax7,8, A movie not for the simple minded,"A movie not for the simple minded, Whiplash is a film which revolves around the lives of a passionate 19 year old musician Andrew (Miles Teller) and his perfectionist professor Fletcher (JK Simmons). The intense story begins when Andrew enrols into the 'Shaffer Conservatory of Music-a prestigious music college' as a drummer and almost immediately 'impresses' Fletcher enough for him to be selected as a member of the sound team under him. From there on starts the clash of two musical egos; one of Andrew who with all his hard work and dedication does his best to impress Fletcher and Fletcher himself who holds no bar when it comes to pushing his students at all length to get the best out of them and to help him win every music competition. If you think from there on movie moves to a typical storyline where a student becomes a musical prodigy or the professors mends his ways and becomes a less harsh and better tutor, then you are so wrong and this is exactly where Whiplash differs from any other music related movie. The movie in turn sticks with much more believable reality and showcases pure raw emotions of revenge, loathing and pure determination to prove oneself. Both Teller and Simmons have done justice to their respective roles and have carried the movie with their brilliant performance and Damien Chazelle as a writer and a director has kept the story simple while bringing a new prospective of looking at a story. Chazelle also needs to be credited for paying special attention to visual details and getting into the mind of a musician, but the place where he lacks and yet differs from everyone else is not going into too much detail and not trying to justify a character in any way. The pure brilliance of this makes the viewer engrossed as to why a character is certain way and yet makes him also wonder why certain people in the movie even existed. In the end I would say watch the movie for its pure raw brilliance and if for nothing else for Teller's and Simmon's brilliant acting.",
234,5 January 2021,benbhodgson,10, Never stop chasing your dream!,"When you have think you have worked hard at something watch this and think again! Whiplash shows you that to get to the top you really have to shed blood, sweat and tears. This is a film was brilliant!",
235,12 February 2015,PeterToo,1, how to kill a teenager! a new Milgram experiment! Bullying presented as a good thing to motivate a teen! it's criminal,"Homophobic and antisemitic insults, psychological and physical torture presented as working methods to motivate a teenager! Do I really need to write more to express how wrong this movie is, despite all the good acting and amazing editing? Since when geniuses and talented artists have all been mentored by a sadistic psychotic maniac that should be locked up straight from the very first slap or insults? it is a SCHOOL. S-C-H-O-O-L.",
236,26 August 2021,danielmullin,8, My take ....,"I found the whole drumming aspect of the film to be quite clear symbolism for the war against breast reduction surgery. The cinematic parallels between the intense drumming scenes and surgically removing big bouncy boobies is uncanny and is clearly Chazelle's way of expressing the opinion, that he likes big juicy honkers. The fact that Chazelle is willing to be brutally honest and not shy away from the subject matter is honestly empowering and I am internally grateful to have seen someone address this in film. As Abraham Lincoln once said ""God gave you big badonky donk boobies, why would you want to make them smaller?"" this quote directly captures the message that Chazelle was attempting to convey with this film.",
237,3 July 2020,sauravjoshi85,9, Whiplash Movie Review,"Whiplash is a drama movie directed by Damien Chazelle and stars J.K. Simmons, Miles Teller, Melissa Benoist and Paul Reiser.",
238,2 March 2015,Aodhanrooney,10, Best achievement in Sound Editing of the year!,"Whiplash is an extraordinary achievement in filmmaking and totally unmissable! Who thought J.K Simmons would have been offered a role eligible for an Oscar win? Nobody - but that's not the point; the movie is mesmerising to its own extent and outweighs the boundaries of sound editing to a unique and powerhouse level. With so much pleasure to keep the audience glued to their seats, Whiplash is a fascinating tale about a passionate drummer called Andrew (played by Miles Teller) - who's undying dream is to become a musician as a drummer, even if he has to go off the deep end by severely injuring himself, in practise, which he, ultimately, does, when music professor, Fletcher, abusively doubts his talents. It's a careers best for J.K Simmons, whom delivers a masterful performance as Fletcher, as he horribly abuses the students in his music class, in order to make them successful and talented musicians - but Fletcher is not to be messed with. Miles Teller also delivers a mesmerising performance as the young master drummer, Andrew, whom will stop at nothing and will cross boundaries, even with Fletcher, to achieve his dream. It's one of my favourite movies of the year and of all time - and an extraordinary new achievement in filmmaking!",
239,8 June 2015,leonblackwood,8, Original and thoroughly entertaining! 8/10,"Review: I was really looking forward to watching this film because I have been drumming since I was a little boy and I know that jazz drumming is one of the hardest methods to master. The movie is about an inspiring drummer who tries his utmost to impress the top instructor in his school. After showing him his determination and dedication to his art, he gets promoted to be the head drummer in his orchestra but the teachers ruthless methods and constant search for perfection, takes his toll. The movie is original and entertaining from beginning to end. The drumming from Miles Teller is superb but it's J.K. Simmons nasty methods that impressed me. The storyline is quite basic and it seemed really short, for some unknown reason but it's very entertaining and I'm glad that it got the recognition that it deserved. If your not into drumming or jazz music, the relationship between the teacher and student is worth a watch because it shows how far a person will go to achieve perfection. Enjoyable!",
240,18 January 2015,BeneCumb,7, Too ill-natured and rough for a movie about jazz,"Yelling and foul-mouthed superiors/teachers are still seen here and there, but I can hardly imagine them ""flourish"" in the field of ""mild"" arts; I myself have collaborated in several choirs and bands, my close relative worked for decades in a theater, so I know that artistic people are very thin-skinned and soft-hearted, certainly not ready to tolerate crudity for years, even by someone with contacts and talents. This sort of person we saw in Terence Fletcher is more fitting to sports or war-zone.",
241,3 March 2018,Yann_nnick,9, In 1 word... Orgasmic,"An incredible duel between a drummer student and a bandmaster teacher.
Exciting, passionating, orgasmic !",
242,19 July 2022,jaydenmccagh,10," ""Not quite my tempo.""","This film is a cautionary tale of the path to success and the extremities that come with it. J. K Simmons & Miles Teller were both amazing in this film and the direction from Damien Chazelle was also great! The portrayal of Fletcher by J. K Simmons was so ruthless and made me hate him, and then in the third act the movie made me see where he was coming from and I hated the fact I was agreeing with him. The determination throughout from Andrew was great and I loved that ending but also felt Fletcher should've taken a loss at some point.",
243,15 June 2021,ethlaid,9, Unorthodoxly Thrilling and Engaging,Powerfully intense that is made superiorly by Simmons and his tyrannical performance as Terence Fletcher. Perfectly paced to immediately hook the viewer and keep them in place as they watch.,
244,23 October 2021,theo-57528,3, Whiplash is more painful than whiplash,"Much loved movie by IMDB users, but I am baffled as to why. Much of the dialogue felt like improvisation. There are no characters remotely likeable. The underlying concept that musicians play better under duress is ridiculous... and that the best musicians became that way as a result of being traumatised is absurd. I don't think Jimi Hendrix rolled out those licks in a state of mind of high tension.",
245,15 January 2015,AudioFileZ,8, Is Greatness Achievable Without Adversity?,"That J.K Simmons is a versatile character actor is a given. Simmons, as a kind of ""second banana"" comedic foil has elevated just about everything he has been used in this guise for. But, Simmons is also an exceptional dramatic actor too when given the right part. Whiplash gives Simmons the part that should remove any doubt about him being able to bring a character you love to hate to a kind of artistic visceral reality. Simply put, Whiplash couldn't rise to the rare air the story aspires for without such a performance.",
