Review_Date,Author,Rating,Review_Title,Review,Review_Url
583,23 December 2017,nayeemrs0,10, A Masterpiece & Must See,Forrest Gump 1994 is really a good show for two hours.You will not want your two hours back after seeing this film.It is just awesome.Though this film depiction is quite as comedy but that doesn't matters anyway.This film will give you hope.,
584,28 August 2018,areatw,10, A special film that everybody should see at least once,"I must have seen 'Forrest Gump' 4 or 5 times now and it seems to get better with every watch. Few people would dispute that this film is a classic, with many memorable individual scenes and lines, but it's more than that for me. This is a film with heart and soul, with meaning and purpose - a film that is just as effective and moving the second or third time you watch it as it is the first. There aren't many films that can achieve that and that's what makes it so special.",
585,14 September 2018,Amyth47,1, I hate Forrest Gump!,My Rating : 0/10,
586,17 January 2021,thebigpapi_28,10, Masterpiece,Best Movie Ever!! Period...,
587,28 August 2022,rockmetokyo,1, Whack Arrested Development Gump in the head with the feather....PLEASE!!!!!!!!!:),"Seriously, this idiot character should've been dead in the first 5 minutes of the movie give or take about 4 minutes of overly long opening credits while we the viewers are subjected to getting dizzy and comatose watching the silly CGI feather blow around in the wind.",
588,17 March 2020,b-62377,10, He ran for a lifetime and won a lifetime.,"The correct life generally goes through ""running"". When you are constantly running, you can see the end point, you can't see the end point, you are moving forward as much as possible. Every time you encounter a station on the way, you can choose to pass or Staying, each choice may lead to countless results, just as it is impossible to predict the taste of the next piece of chocolate, and every time you think, there may not be an answer. Like the doubts described in the movie, do we each have our own destiny, or Like a feather, fluttering in the wind.",
589,12 April 2020,niconotnixon,10, A epic kind of like a greek myth,This movie is a journey and it just picks you up and takes you for a ride. It is heartfelt and enjoyable. One of the best movie ever made.,
590,12 September 2020,person-52076,10, Epic,Best film ever. I can't believe that it isn't more highly rated,
591,17 April 2020,pkeck-57815,10, Love this!,I love this movie. It just reminds us that sometimes the underdog can win!,
592,7 December 2018,tawfiksafi,10, Every Single Time I Watch This Movie...,I'm a grown ass man and every time I watch this movie it gets me emotionally hooked like no other movie could.,
593,28 September 2020,yudhaon,9," Touching, Funny, Inspiring, Entertaining",A unique movie about a life journey of a boy who has low IQ but becomes successful in a strange way.,
594,20 September 2002,madheed,9, Brilliant Film,I have seen this film X amount of times and find it brilliant every time i watch it.  It'a a mixture of all genre's of film rolled into 1. It's One of the many films in which i love!!!!  If i was to give a summary of this film i would just say fantastic!!!,
595,24 November 2005,rebeljenn,7, good but over-rated,"While 'Forrest Gump' is a good movie, it is a victim of being an over-rated movie. It was one of those films that was in the public eye for a few years, and people quoted it until it became less than a novelty. Finally, it died down, and it is nearly forgotten by the fickle mainstream now.",
596,27 June 2021,alexsnower,5, Not a fan,"I watched this movie for the first time about 5 years ago and thought it was decent. I still thought it was overrated then but I understood why people loved it. Yet, rewatching this I realized I must have been in my younger and more vulnerable in those days. Anyone with a 6th grade knowledge on history between 1950-1985 could have pieced this plot together. Playing with Bear Bryant (check), Vietnam war (Check), Meeting JFK and John Lennon (Check), Someone getting HIV (Check). I hate how they try to make Forrest sympathetic by giving him and unknown mental disorder. At least you shouldn't cop out and prescribe his illness. Not to mention Jenny. The worst character ever I feel no sympathy for her. She manipulates a war hero and millionaire with special needs. She only commits to him when she is dying. The funniest thing is again they couldn't diagnose her disease. This movie is lame watch literally any other movie on the top 250 list and movies that aren't on their but very good before watching this waste of time. At least Robert Zemeckis gave us Back to the future and who framed roger rabbit though.",
597,4 March 2019,nobuyuki_shinoh,10, The Real movie,"I would say within all the movies I have been watching, the movie Forest Gump is the one and only movie that I feel it is the real movie, to be honest, this movie should have been Oscar winner.
Except for the amazing war scenes on the movie, Forest Gump also succeeded in illustrating the whole development of the character from his childhood to his adult.",
598,8 December 2015,harveybdickens,8," An enjoyable, cultural, and emotional experience","In recent years this movie has received a lot of backlash. Why? Because apparently it beat Pulp Fiction, and The Shawshank Redemption, at the Oscars or something. Well yes...it shouldn't have been chosen over those two, but does that make it a bad movie? Absolutely not! The premise of Forrest Gump, is the character Forrest Gump. He is rather simple minded, but has many hidden talents, and has accidentally been at many significant events in history.",
599,21 March 2009,jkebttn71,10, 'There's something in my eye',"Will be every man's excuse to cry at this film (I accepted the fact I cried at this and I'm a guy). What doesn't help is the music, so emotionally moving and make you get a lump in your throat every time you here it. who is forrest gump? Forrest Gump is the clear representation that everyone can love, good or bad, smart or dumb we all can find it. I'm not gonna go on about the fantastic script, directing, cinematography or musical score. But I will say that every actor/ actress in the film 'is' the character they portray. Tom Hanks gives a performance which will make you laugh and cry (one of the top 5 greatest performances ever). the story is about his life and how he happens to run into every major event of the past 50 years. A truly moving story, one of the best films ever. so what if its very Hollywood, still beautiful",
600,16 April 2007,Cloud20,10, Probably the most enjoyable film made in the 90's...,Forrest Gump (1994)- 5/5 ,
601,29 March 2018,abain-44683,10, Masterclass of filmmaking,"I have to say that almost 25 years after this film came out it still holds up to any film made to date,tom hanks is quite possibly the most talented actor I've ever seen on screen,the writing is pure excellence from the comedic lines to the more hard hitting parts,pure excellence",
602,7 June 2017,onestephenis,9, Probably deserves a ten,On the very rare occasion that I give a movie a ten I always feel the need to add a little line about how no movie is perfect. Sometimes I slap that ten with a qualifier and leave it at that.,
603,20 September 2019,chriscase200,10, First watch!!,"Heaven knows why I have waited 25 years to watch this film, but I just did....for the first time. What an experience! I loved it from beginning to end, wonderfully heartwarming story with ups and downs along the way. Fabulous, fabulous, fabulous!",
604,20 August 2018,maxwellhayden,8, run?,He runnnnnnnnnnnnnnnnnnnnnnnnnnnnnnnnnnnnnnnnnnnnnnnnnnnnnnnnnnnnnnnnnnnn,
605,19 May 2008,jilena008,10, Everything a movie should be!,"If Eric Roth looks at this -- would be honored to say thank you for ""Forest Gump"". I know several more remote and esoteric films, but every time I see Forest Gump I come apart at the seams, more Kleenex each time... and it's so worth it! Love is woven alongside tragedy it in a way that makes me feel I'm riding one big crane shot of life. Gump strips down what it means to be human in such a pure and heartbreaking way. I know film is a collaborative medium (and though I'm pretty sure Tom Hanks is our best bargaining chip for sparing the planet if we ever have negotiate with hostile aliens, but his brilliance aside...) as a screenwriter, I want to thank writers like Eric Roth and Winston Groom for being the creating inception of a film so beautiful, it inspires the rest of us -- especially me -- to keep aspiring to make something good and to believe it's worth it to try.",
606,9 June 2022,bretttaylor-04022,9, Sentimental and somehow catches me out every time,I feel like this film tries every technique in the book to pull on your heartstrings and although you know its doing it you allow it. The best quality Forrest as a person has is that he never judges anyone. It is at times over the top with the history but that is usually dealt with humour. It also looks great and hasn't aged at all. This film is timeless.,
607,11 February 2002,Mr.Flick-3,8, Quite possibly my favorite film,"This film was wonderful mainly because of Tom Hank's excellent performance, Robert Zemeckis' great job of directing and the beautiful score by Alan Silvestri. Forrest reminded me of an child--someone innocent--exposed to the cruelties of the real world. As a man who was honest, caring, and with high morals, he's stepped on by others who engage in their own selfish pursuits. Forrest Gump may not have been the brightest person of all time, but his loving heart more than made up for what he lacked in his IQ. This is a great movie. I strongly advise you rent it.",
608,24 June 2006,native_girl333,10, Lovable Local Crazy-person,"""Forrest Gump"" is a heart-warming and always enjoyable drama about a little clueless Forrest (outstanding Tom Hanks) who thinks with his heart, not with his head. And that is why the audiences love him so much.",
609,12 May 2019,MyselfLILY,8, It is regarded as one of the best movies of all time,"Wow! 'Forrest Gump' is such an exhilarating and saddening film featuring such a lovable lead in Tom Hanks. The film is able to hit nearly every note exactly and compact so much story and emotion into just 2 hours and 20 minutes, which results in such a fulfilling film.",
610,20 September 2019,damiandimitrov-68829,10, Simply Incredible and Relatable 15 years After Its Release,This was the most human and emotional movie I have ever watched. It really shows God's way and the wonderful life of a great human being. I will not spoil anything and could only recommend to people to watch this masterpiece. I cried 10 times. It is the first time I have felt such humanity and emotion. Forrest Gump could warm even my cold heart.,
611,2 April 2020,j-88061-99297,10, The warmest movie in my life,Mama always said life was like a box of chocolates. You never know what you're gonna get,
612,22 April 2023,dopamaxnootropics,5, Is criticizing this movie a sin?,"No matter what I say here, it won't matter. People see this movie as a classic, and I respect that. But despite the raving reviews, I was not in love with the concept; Forrest Gump is a ridiculous series of events, portrayed seriously.",
613,6 March 2010,nikibabs,10, Robert Zemeckiz's Masterpiece.,"I just recently saw this film and I gotta say, it had to be one of the best movies I've ever seen! This film has everything you could want in a film, humor, sadness, drama, action, etc. The actors were fantastic, especially Tom Hanks, who's performance is one of the best ever. This film also explores a short glimpse of the horror and loss of friends in the infamous Vietnam War, which just added to the film's greatness. Overall, Mr. Zemeckiz has created a film that will live inside everyone's hearts for the years to come. I have never, nor ever will, see a more emotional, gripping, and inspirational film than Forrest Gump!",
614,16 January 2006,LoneWolfAndCub,9, A Lovely Movie,"Forrest Gump, starring Tom Hanks, Sally Field, Robin Wright Penn and Gary Sinise and directed by Robert Zemeckis, is a lovely tale of one man who tells his life story at a bus stop while waiting for the bus that will take him to the woman he has loved for most of his life.",
615,13 February 2022,larrydisstockholmtappin,10, Forrest is smart in the way of life.,"Great Movie.. I like how it portrays the stupidity of the ""average people"" that are supposedly smarter than Forrest... The way they care about dumb things, arbitrary causes and silly narratives.. He just listens to them and they look like absolute fools.. He understand the simple way of living, he follows his heart.",
616,23 December 2009,RohitRajkumar,9, Forrest Gump has Oscar written all over it,The concept of the movie at the first instant might seem a bit absurd because you might seem to wonder how a man can be intelligent and act stupid at the same time. But this is exactly what Tom Hanks manages to do and do it perfectly.,
617,7 June 2002,euro-501-502,9, wonderful movie,1994 was a decent year for movies.I don't think they could have chosen a better person for the part. This film is a great modern fable but it is very namby pamby.This movie has some of the most memorable characters in history!,
618,16 February 2023,Mysterygeneration,9, Memorable,"In the film ""Forrest Gump,"" Tom Hanks plays Forrest and Robin Wright portrays Jenny, a young lady who is a waitress, hippie, stripper, and radical '60s groupie. Forrest smashes the violent radical to a pulp when Jenny's egotistic student lover hits her in the face. Forrest offers his sincere apologies to the stunned leftists and Black Panthers who were present during this disaster. With the assistance of his normal staff, Zemeckis, who is known for the ""Back to the Future"" series, ""Who Framed Roger Rabbit,"" ""Romancing the Stone,"" and ""Death Becomes Her,"" uses his toolbox of showy filmmaking. Not one more!",
619,11 May 2014,jbirls21,9, The best film in history,"Tom Hanks, hands down, gives one of the best performances by any actor. Ever. Forrest Gump is such a compelling, historically based, dramatic and even light hearted film that I believe is the greatest film of all time. Gary Sinise, or Lt. Dan, definitely should have won for Best Supporting Actor. He plays a man with no legs for more than half of the movie and he is such a harrowing character at large. Moreover, Forrest Gump, undoubtedly, has some of the best lines in movie history (Run Forrest Run, Life is like a box of chocolates, etc), but the morality behind the film is incredible. Forrest Gump, when he runs across the country for literally no reason, is such an inspirational moment in the film. What I enjoy most about Forrest Gump is that he unwittingly gets caught up in some of the most key moments in the 20th century. Watergate, Kennedy, Civil Rights, Vietnam, Alabama Football - he's there. And because Forrest is such a simple man, these scenes are that much more captivating. An absolute 10/10, Forrest Gump, driven by the once-in-a-lifetime performance by Tom Hanks, followed by a forceful performance by Gary Sinise, is the greatest film in history in my opinion. If you haven't watched it, you are missing out big time. Myself, it is one of those few movies that never gets old. Fantastic every time.",
620,11 December 2012,dotwatts-543-201073,9, The feel-good film of the decade,"*****WARNING: THIS REVIEW MAY CONTAIN SPOILERS**** Adapted from the novel of the same name by Winston Groom, ""Forrest Gump"" is unlike any movie I've ever seen. For the duration of its two-hour run, it enchants and moves, amazes and inspires, seamlessly blending comedy and drama, history and fantasy, threading its spellbinding yarn against the backdrop of some of the defining events in modern American history.",
621,3 July 2014,sonusingh-zeus,10, A Masterpiece. Amazing Story Teller.,"We watch movies because of the stories, right? This is a masterpiece,one of the best movies I have ever watched. Many people would think its old and boring, Let me tell something I thought the same. One day maybe five years back, I was going through my movies and I found this, first I thought it would be a good movie but boring, then I started to watch just little bit of the movie than little bit more and more and MORE.. I didn't stop till the movie was over, the story telling in this movie is beyond your grandma use to tell you. YES! I'M SERIOUS. NO KIDDING. The acting, direction, characters, story, the chemistry and everything is just indefinable in words. And Tom Hanks live up-to his reputation of a legendary actor. MUST WATCH. 10 out of 10 from my side.",
622,20 December 2012,lagudafuad,8, Forest Gump,"""Mama always said life was like a box of chocolates. You never know what you're gonna get."" – Forest Gump.",
623,24 February 2020,tomflinn123,10, I gotta find BUBBA!!!,I really love this one. Thom Hanks is amazing as the simple yet lovable Forrest Gump.,
624,7 April 2023,xiaoli7377,10, THE Comfort Movie,"""Forrest Gump"" is probably a little bit overrated, in my personal opinion. It's not one of my favorite movies, but I still really enjoy it and think it's quite good. It gets a high score from me because I think that it's so well made. Everything from the excellent screenplay to the soundtrack to Tom Hanks's performance as Forrest Gump. It's all wonderful. It's very hard to find a movie so wholesome and yet so depressing and sad at times. Gary Sinise is also very good as Lieutenant Dan.",
625,14 March 2020,mmdxmz_jane,10, Some thoughts after watching this movie,Life is like the feather in this movie. It floats in the wind and doesn't know the end. Only by finding the faith and perseverance of life can we grow. Forrest Gump's spirit is worth learning for all of us.,
626,5 March 2020,vimallohith,10, Most touching film ever seen in my life. Period,I was about 11 when I first saw this movie. I was very touched by the movie emotionally. I have never had such mixed feelings after I saw any movie. I was filled with with feel goodness joy sadness life lessons etc. Any one who wants to learn the lessons of life and its essence it's a must watch movie for them.,
627,15 July 2018,adamdalton-60317,10, Lovely Film,First Watched It On Sky TV In 1997. Bought In On DVD In 2010. Excellent Film It Was. Tom Hanks One Of My Favourite Actors. The Film Is Full Of Memorable Scenes and Dialogues Still Talked About To This Day. Robert Zemeckis Excellent Director Who Did Back To The Future Trilogy and Who Framed Roger Rabbit,
628,1 April 2019,NEONSOLISALPHA,10, One of the best movies I've ever watched,"This movie is the sum total of all things that I like in a movie. Great narrative ,engaging story,out of the world acting by Tom Hanks (who is my fav actor), the innocence in forrests actions all makes this one of the best movies I have ever watched .I whole hearted lay recommend this masterpiece",
629,11 May 2016,jimmyst-75481,10, The best film for me,"The best film I have ever seen. If you are looking for something meaningful here's the stuff!!! Cinema is all about how it makes you feel. I think I felt in every possible way during this film at the right guantities the perfect moment. After this unsurpassed experience I became a better person or more specifically I knew how I wanted to be as a person. Life is all about goodness and how you can help your fellowman. You don't have to be smart, talented, gifted, handsome, tall. You only have to be hopeful. Have belief in your actions. Have belief in the world, even in the darkest hours. When you have witnessed pure love, affection, kindness there is only one thing to do. Share it, share it to the rest of the people. Even if people believe you're wrong and nothing will change. It will.",
630,4 June 2007,yooeun228-1,8," everyman,,,","Robert Zemeckis directed this movie, Forrest Gump, in 1994. It well maintained the theme from the original version of book, ""Life is like a box of chocolates"" and ""Stupid is as stupid does"" This movie contains a lot of great actors and actresses who could act their own characters very well and showed the theme or plot. The reason why this film became so popular is because this story isn't just for the certain period or certain people, but for everyone.",
631,27 December 2000,grandmalop911,10," Wow, good movie.",I can not believe 1100 people gave this movie a vote of 1(awful). The plot might have been a little shaky and it might have dragged on a little bit but it was so good and so loaded with drama and adventure it didn't bother me at all that it dragged on a little. The people I know who didn't like it didn't like it mainly because they thought it went a little overboard with all his achievements but I think it was to bring out some important things in history and what a way to do it. By sticking a made up character through it all. It got my attention. I love the soundtrack to. I day before I saw this I had said Tom Hanks was a bad actor boy did those words come back to haunt me. I had never seen such good acting in my life at the time. Not only do I think everyone should see this movie I think they should own it and the soundtrack. Matter a fact I'm gonna go watch it right now.,
632,9 April 2020,Emre-kyncu68,8, ONE OF THE BEST DRAMA FILMS,"Forrest Gump, one of the best films in the world, starring Tom Hanks, offers the viewer a good movie experience throughout his life. Tom Hanks gives life to Forrest Gump, the movie's owner. It is still one of the best drama movies, even after many years since the film was released. Forrest Gump has a 75 IQ rating, a bit behind normal people, but it's actually a character that does what most people can't. While watching Forrest's story, I am sure that most viewers have a smile on their face. Although the movie is a drama movie, it can make people laugh. He also makes an effort to get the girl he loves. The movie contains both action, comedy and drama. A movie that everyone should watch. While some parts are absurd, everyone should watch. To me the best part was the end. It has a very dramatic end. My score for the movie is 100/82",
633,20 March 2020,j-97569,9, Live like Gump,"This is a very inspirational movie, It gave me a lot of courage to overcome the difficulties in life. Keeping kindness is what everyone should do.I envy Jenny, Gump always waiting for her .Oh,no,I want to cry again now.",
634,29 November 2004,SonicStuart,10, An enjoyable film with an outstanding performance by Tom Hanks!,Genre: Drama/Comedy,
635,21 June 2001,torturedsoul,10, One of the best of the 90's,"I have seen Forrest Gump about 15 times, and every time it drives me to tears. It shows how a man who is not exactly ""right"" can be very successful and lead a full life. I hear people all the time criticize this movie, but why? How can't you love this movie? Forrest is so likeable and the filmmakers even succeed in making some humorous parts which is not normal in most dramas. Tom Hanks pulls in a great acting performance as Forrest and their are other great performances, also. Too many of them to name. It deserved that Oscar. I feel that wholeheartedly. I give it an A+.",
636,14 July 2009,PeterPPK,10," ""You said it all, man""","This is one of my favorite movies that I've ever seen. It's heartwarming, beautiful, charming, funny, and just overall great. The acting is superb, the story is excellent, and music is probably the best I've ever heard. Mostly because of the genius song selection for this movie. Every single song in this movie that you will hear(not including the original score)will perfectly some up the 50's - 90's era.",
637,18 March 2008,SmileysWorld,5, On second thought..............I like it.,"This is one film that I have to say did not leave a lasting impression on me all of those years ago,but since many factors play a part in whether or not you enjoy a film,and since it is obviously an Oscar winner loved by many,I recently decided to give it a second chance viewing.I am happy to report that I have had a total change of heart.We have here a story about a young man who is,to say the least,seemingly a bit slower than you and I.Yet,unlike many who are slow,he gains fame and prestige.The sweet thing about Forrest Gump is that none of that fame and prestige ever seemed to be that important to him.True love is the only thing that he ever really wanted,yet it always seemed to evade him because the girl he loved was always running away to find herself.Foolishly,she couldn't see that where she belonged was where she always seemed to be when she failed to find herself elsewhere:right there with Forrest.With Forrest Gump,you will laugh at the way he stumbles his way through the history books,yet you will be touched at the way he touches those around him,and will cheer for him to find the love he deserves.You will ultimately learn that you don't have to have that much book smarts to know what is important in life.",
638,5 August 2022,ahmadsmalik,10, Bittersweet yet Entertaining,"Forrest Gump really delves deep into the emotions of human beings and explains how emotional attachment leads to relationships, that, if toxic, can completely devastate a person. It also shows us how society's ruthless and mocking attitude really does leave scars on a person and why everyone deserves to be respected. On the other hand, Tom Hanks's mesmerizing performance as Forrest also makes one realize that people why honesty, sincerity, dedication and respect can go a long way towards making the world a better place. A 10/10 for a classic that is definitely both heartwarming and entertaining.",
