Review_Date,Author,Rating,Review_Title,Review,Review_Url
233,12 March 2020,Mnemosyne15,10, Stupid is as stupid does,"Forrest's mother often encourages him to ""stupid is as stupid does"". She is a strong-character woman. She also gives Forrest a heart of pure integrity and no evil thoughts.",
234,14 July 2018,El-Ak,8, Forrest Gump!,Tom Hanks was superb you can't really differentiate him from the character of Forrest Gump. The story is unique and the direction was good. The movie's music wasn't helpful at all could have added more greatness to the scenes. The rhythm of the movie slowed at some parts and was quick at others but the only thing that bothers is that a character like Forrest after all of that could have been used better and had better situations and more effective and I really thought of it as a great performance by Hanks although I don't feel most of the scenes were the ones that could show us the character and make it way more epic but you will be taken by hank's performance which was the spine of the movie. His love Jenny I suppose wasn't that serious character that fits to guide him or help him and should have been another character that makes that great effect in his life. The telling of the story and camera movements were absolutely gorgeous and Robert Zemeckis did a great job in it along side with the scenario which reflected the characters so well.In the end a great movie! 8.5/10,
235,16 March 2020,InlyCii,9, run for yourself,"Many people watched Forrest Gump, and they felt that it was an inspirational movie. People like Gump who didn't have anything in the beginning can succeed. In fact, the director's sigh of helplessness in life can be interpreted from this movie. Each step of A-Gump is adhering forward, but each step is not arranged by him, but a force in the meditation pushes him into such a situation.",
236,27 May 2018,NikkoFranco,10," The most beautiful, unusual love story","Did I cry at the theater with a friend while watching Forrest ? Yes, we did . Did we laugh loudly at him during the ping pong game? Yes , we did. Did we feel his pain and struggles as a child and when Jenny died later on ? Yes, we did. My friend and me are one of those many millions who know Forrest Gump line per line. This film is not exclusive to the ladies only as a chick flick for I also happen to know many men who love Forrest Gump as we do. We can put the blame to Tom Hanks' majestic acting , or to Robert Zemeckis for his out of this planet directing, or just because this is the most beautiful, unusual story of love we have seen of this caliber. A brilliant film that needs no further introduction as it shines like the sun in our universe with its honesty and simplicity.",
237,16 March 2020,Lily_hoho,10, My love,"I still remember the first time I saw this movie, I was moved by forrest gump, he is always so sincere. He is kind to all people, his dedication to one thing, hard work, hard work. Keep it in my mind. Every time I feel unhappy, I will watch the movie again. It will encourage me to overcome the hardship. I will always love him.",
238,2 January 2002,Watchalot,1, Patronising Rubbish,"This must be one of the most offensive movies ever made and I am truly appalled at the central theme, namely that being stupid makes you a better person.  Everything about this film is patronising and overwrought.  Can't believe that Tom Hanks (surely the most over-rated actor on the planet) won an Oscar for this pulp and if this was the best film of 1994 then god help us all.",
239,15 October 2020,harishmadireddi,10," Worth Watching, Its Like a Biopic of a Free Flowing Soul.","The ideology of forrest gump is a kind of package, one have to inculcate in his or her life, like not to bother too much about the outcome of the efforts one puts in or hoping for the return for the investment of feelings to fetch you the successful outcome and instead give your best you could be it efforts or feelings you feel about your loved ones. The way he doesnt bother running after winning the rugby match, the way he doesnt bother letting go her girl throughout his life no matter how many times she couldnt restrict herself to him. Yes he might not be a smart man but he knows how to love for sure. Be it his mom, running, ping pong, his friend and his shrimping business and finally his girl breaking him into pieces which makes him run and be the wanderer of happiness or peace. Forrest Gump is certainly a must watch. The direction, the story even though its apparantly based on the book forrest gump, performance of tam hanks everything fell into place and its nearly 26 years from its release but still it has its soul which makes us own forrest gump in 2020 and it continues to be undying everytime to watch.",
240,14 January 2000,Chookboy,5," The most overrated film, possibly ever","This movie is okay, but seriously folks, come on...... It's not that good. It sure as hell didn't deserve the academy awards. Forrest Gump and Titanic are the two (in my opinion, and hey, that's all it is) most overrated movies ever made. Ever!!!",
241,6 November 2002,Jerry Ables,10, A dynamic movie triumph,There is so much to love about this dynamic movie and I think it very richly deserved every Academy Award that it won.  It takes us on such an excellent trip through three decades of history and tells an extremely entertaining and inspiring story of how a simple minded man went on to accomplish so much.  This is one movie that I never get tired of watching and is most definitely an all time favorite on my list.,
242,8 May 2001,MadReviewer,6," Great Film, Horrible Message","I have a difficult time watching (and reviewing) `Forrest Gump'.  Despite the brilliance of its actors, of director Robert Zemeckis, and of certain powerful scenes, I find that the overall film itself is a cynical lie.  On the surface, `Gump' is a cheerful film about the perseverance of its genuinely sweet title character.  Under that sweetness, though is a disturbing, uncomfortable message that says daring to dream is a bad idea.",
243,31 May 2005,jofitz27,5, Heartwarming? As if,"This is a truly patriotic movie, and guess what: not even half of America probably likes it. It's got a dunce as the protagonist, who, for sentimentality reasons talks slowly, he's got your typical, advice-giving all-American mother, references to the Vietnam war and America's greatness and, of course, an all to frequently appearing love story.",
244,11 October 2020,epicbrowniez,10, Amazing,One of the best films ever made very memorable and powerful,
245,5 September 2012,raulbora,10, Life is so beautiful..,"Never wrote a review before but every time I watched Forrest Gump I got the urge to do it.. This time I couldn't resist it and here I am sharing a few lines with you folks :) FG is one of my favourite movies. I think that if I had to choose a word to described this movie that would be LIFE. Forrest shows me how simple, beautiful and basic life is and how easy is to miss it and let it pass you by. The movie is very detailed and keeps you hooked in until the end. Towards the end though it touches you, puts a knott in your throat and even squeezes some tears out of you. I am sure I have absolutely nothing new to add but I wanted to show and share my appreciation for this wonderful and brilliant movie. Beautiful, beautiful, beautiful ...",
246,31 July 2001,mrbluto,8, Forrest Gump is a winner,"Forrest Gump is a kind honest sweet movie with edges of real life sadness. Forrest takes us back to old days of movies when every other word did not have to be cursing,Forrest is a simple man making his way through an unsimple life,the entire cast was brilliant. A wonderful movie and well deserved an oscar. We will never see the likes of this kind of movie again. 9 out of 10",
247,31 August 2001,wobelix,8," ""The Lord will take care of the ignorant ones""",The bus stop. John Savage gets in and goes to Milos Forman's New York in his equally breathtaking HAIR. ,
248,25 February 2004,Jarv1,1, A poisonous pill with a sugar coating (loads of spoilers),I loathe and despise this film on so many different levels.,
249,19 March 2020,g-87877,10, more sincere and strong feelings,"I still remember watching this movie in class, I was deeply touched by forrest gump's persistence, positive energy and his love for Jenny.I still think that it was forrest's love for Jenny that saved her time and time again. I wrote an article about it, but I can't find it now.The passage of time, the disappearance of words, more sincere and strong feelings.",
250,8 February 2021,Seb_3,10, Appreciation of life,"""Life is like a box of chocolates, you never know what you are going to get""
This is one of the first lines spoken in the movie, in one of the first conversations with one of the many people Forrest talks to while he waits for the bus. (Which is also rare these days, with everybody looking at their phones in their own little bubble)",
251,8 January 2015,beauzee,7, he better run...after all them chocolates!!!,"ho did he ever manage to enlist in the Army? okay, okay...",
252,9 February 2016,royadityax,10, An amazing sweet story of a stupid man....,Watched Forrest Gump .... It's beautiful. It's just amazing. A concept very few movies have successfully stood up to....,
253,24 March 2020,r-48240,9, Inspirational and educational films,"It's certainly an inspirational film, but I also think it's an educational film. Forrest Gump's intelligence quotient is simple, so his growth environment is very important. He needs people to guide him. Obviously, he is lucky. His mother and his girlfriend give him enough love, encourage him, support him, and let him distinguish good from evil in the process of his growth, which makes him successful.",
254,3 January 2019,ytoshiya,10, My favorite movie,"I learned three important things from this movie.
Firstly, ""Difference is no difference"". That's truly true. What is wrong with difference? Everyone has each difference so that having differences in yourself is not different.
Secondary, ""True love"". I could see true love from this movie. Even if you see your feelings to the one you love impossible love, continue to care. That love would come true trult someday.
Finally, ""Continuing to challenge untill the end"". If you challenged something untill the end without giving up, your dream would come true though there would be a lot of walls you would face at. What I could see from this movie was ""Never give up"".",
255,3 August 2022,jonflottorp,10, This movie is like a box of chocolate you never know what your Gonna get.,Forrest gump is one of the best movies i've ever seen.,
256,6 January 2021,bignuts-06245,9, A Tom Hanks classic.,Forrest Gump is a boy with impaired legs & a low IQ but a big heart. At school he is bullied by the other kids but finds love in a girl named Jenny.,
257,11 April 2002,careax,1, More corn than Kelloggs,"This has to be one of the worst films I've ever seen. Despite the best efforts of the actors, most of whom are very talented, the ridiculous and corny plot makes this a real chore to watch.",
258,1 April 2020,y-26698,10, pure emotion,"Each of his twelve ships was her name. After she left, he had to run to every lake and desert in the world to miss her, waiting for her to call and then return to her heart. Hollywood makes up such a pure story to show us how broken the relationships we have are. This is simply cruel and immoral.",
259,25 December 2010,claudemercure,7, entertaining but shallow,"Entertaining comedy/drama/fantasy has a lot to keep you busy (and excellent special effects), but doesn't measure up to its epic pretensions. It would've benefited from sticking to comedy and eschewing sentiment. Instead it pushes every button imaginable to jerk a reaction out of the viewer, and tries to dictate your emotions with a pushy music score. The movie lapses into silliness at times, and is self-indulgent for the last hour. Director Robert Zemeckis attempts to evoke each era by illustrating its clichés and by scoring it to a procession of over-familiar songs that serve as lazy, embarrassingly obvious signifiers of their times (Sweet Home Alabama, Hound Dog, Blowin' in the Wind, California Dreamin', For What it's Worth, On the Road Again, Mrs. Robinson, etc.). I love a lot of those songs, but they've become clichés themselves by now. Tom Hanks is funny and convincing in the title role, but Forrest is too much of an invincible saint to be very interesting.",
260,10 December 2019,lbruhnca,10," A legend, a classic, heartfelt good movie","Tom Hanks showed us in Forrest Gump what a fantastic actor he is, if anyone had any doubt. But the story, the other characters, and the directing, made this movie overall a heartfelt classic. This is one you can watch again and again and get new things out of it each time. How can you not feel for Gump, who struggles with issue, which really aren't even the issues that others see. We are drawn into him, his mom, his life path, and his desires.",
261,18 October 2002,csjlong,2, Stupid is... anyone who thinks this is a good film.,Only saved from all-time worst status by a good soundtrack and Tom Hanks' best effort to turn a truly awful character into someone vaguely palatable.,
262,30 March 2020,g-96059,8, Great,"""Life is like all kinds of chocolates. You never know which one belongs to you."" Forrest gump's mother's words, to clarify to us: each person's life path is there, and is unique. Forrest gump, it is listening to such teachings, step by step step out of the miracle of their own life.
From an IQ of 75 and having to go to a special school, to a football player, to a Vietnam war hero, to a shrimp boat captain, to all over America... With a body with a birth defect, forrest gump reached a height that many mentally sound people may not reach in their lifetime.Although Forrest Gump seems to be very lucky in this life, but Forrest Gump is through their own efforts in exchange for.",
263,11 April 2020,a-78738,10, How to hold happiness,"After watching this movie, many people will feel lighter, but more people will feel heavier. Because although forrest gump is a very low IQ, but finally can get so many good opportunities. And look at the reality of our own, we in the vast world, they can do the Lord of the things is not much, if you can make their own master of the moment are held, it is the happiness of life.",
264,15 March 2005,stepstosand,1, Bring your puke bag,"This is one of the worse movies I've ever seen. An insult to one's intelligence. Unbelievable and just plain moronic, I could barely watch. Tom Hanks was stiff and gave his worse performance ever. The directing was dreadful. Only a five year old could come close to believing any of this could ever happen. All the money spent on a turkey like this is shameful. And to think that it was actually successful is mind boggling. I was embarrassed watching it. The producers and director involved should have been barred from the industry for five years. The script should have been thrown away on half a reading. To suggest that a retarded person could play football is completely ignorant.",
265,23 January 2005,funky_cherry86,10, Wonderful Film,"When I first watched this film ten years ago it was a wonderful and captivating story and has still remained a favorite in my top ten list of movies. Forrest Gump (Hanks) is a man with a low I.Q. whose been involved in many historical events. While at a bus stop he tells numerous people about the story of his life starting from when he was a boy growing up in Alabama.Along the way he talks about meeting his childhood sweetheart Jenny Curran (Penn) , being a football player, a Vietnam war hero, a professional ping pong player and shrimp boat captain. But nothing compared to the love he had for Jenny who always managed to elude him over the years. Towards the end she tells him that he has a son Forrst Gump Jr.(Osment) and that she has a virus and doesn't have much time left. They get married and Jenny dies not too long after wards. Forrest Gump is one of the best dramatic films of all time Tom Hanks gave an academy award winning performance that captured the eyes of viewers everywhere. The rest of the cast Mykelti Williamson, Gary Sinise, Robin Wright Penn and Sally Field also did a phenomenal job",
266,13 January 2023,Aroura64,6, A feel good film for those that take things at face value.,"I have to find 600 characters to write a review for this film, but I could make some observations in a few sentences. Firstly the film consists of various scenes, where Tom Hanks interacts with historical figures of the era. I was surprised that a scene with Rosa Parks wasn't included, as some of the story is set in Alabama.",
267,9 May 2000,ulalame,1, Celebration of Mediocrity,"Perhaps one of the most overrated movies I have ever seen.  I fear for a society that adores and embraces a movie without looking beyond the surface. This movie is, at its core, a celebration of mediocrity.  Sort of like the current popularity of ""Who Wants to Be a Millionaire,"" (which lets the average person feel smart because they can answer easy questions) this movie is designed to make the average person feel great about themselves for being nothing more than average, just like Forrest.",
268,27 May 2016,vili1509,10, Really good movie!,"We just watch this movie in school and I thought that this movie was so good! I have never seen so good movie as this is. This is not my favorite movie but I would like to put it one of the best movie of all time list. Tom Hanks was good actor and deserved his Oscar. The actress of Jenny was really good too and I would like to give her the Oscar too. If you want so see this movie then watch it! This movie gives me some chills and some power of the excellent movie. Robert Zemeckis is one of the greatest director I know. Haven't you seen it? Then buy it for your DVD or Blu-Ray. Watch it, watch it, watch it, watch it, watch it!!",
269,23 April 2020,Paranoid_Indifference,8, Eggs on the Barley,The part where Bubba is running through all the different egg dishes with Gump. And eventually they both settle with eggs on the barley. That part just heats my heart up to death.,
270,29 March 2020,w-08323,8," If this is not love, where is the true love?","There is no bondage, no demand for return, in love with each other at the same time can withstand his or her betrayal and escape. This is true love.",
271,14 January 2000,Tyler-Durden,10," This movie deserves a nice comment, but not a summary.","The moment I saw that Tom Hanks made a movie called Forrest Gump, I knew it was about some person's life, as all movies whose names are the name of a person.",
272,5 February 2019,CubsandCulture,5, Reactionary Nonsense,"Let me start with the aspects of the film I like. Hanks' performance is utterly believable and touching. He makes Forrest seem utterly believable and sympathetic in spite of the cognitive challenges the man faces. The emotional climax of the story-Forrest visiting a person's grave-is very moving and it gives the appearance of grace to the entire film. Likewise, Forrest the character is a unique take on an American life and at least on the basic level of nostalgia I can get beyond his story. Lt. Dan and Jenny, to a far lesser degree, are also good characters. Apart from that there isn't much to like about this film.",
273,28 June 2022,pickle-92642,10," One of my favorite films, an experience you'll never forget. Long Live Forrest Gump.","One of the most entertaining, enjoyable, happy, sad, heartwarming experiences in the entire world. Forrest Gump is EASILY one of my favorite films of all time and (in my opinion) one of the best. It's clever in its storytelling, its humor, and its depiction of the time period is just amazing. This movie will never fail to make me feel the highest of emotions. All of life's lessons in one movie. This also has the best soundtrack of all time, and the score is incredible as well. I don't understand how you could not like this film just a little bit. I've seen some recent hate for this film, and I can't see where these people are coming from.",
274,14 January 2002,Ron-204,5, Could've Been,"This movie has several elements for success in the right place, and could have been a true classic.  Ultimately, however, it is undermined by its own thinly-veiled moralizing and its whitewashing of social institutions and history.  This confection has an inviting, sugary coating of the sweetness of love and the matters of the heart, but has at its center the preaching of the ""moral value"" of social conformity.",
275,23 May 2021,sina_bahoosh,10, Forrest Gump,Tom Hanks played very well in this movie.,
276,17 July 2019,FluffyPantsReviews,10, A Perfect Movie,"Forrest Gump is a movie that everybody needs to watch at least once in a lifetime.
From everything from Vietnam, to the shrimp sequence, to the iconic running sequence this movie is so amazing!",
277,24 March 2020,kiradykesky,9, Precious feelings.,"1.Each of his twelve ships is her name. After she had gone, he had to run across every lake and desert in the world to miss her, and waited for her to call her back to her heart. With such a pure story, let us see how dire the feelings we have are. This is simply cruel and immoral.2.Mama always said life was like a box of chocolates . You never know what you're gonna get .",
278,27 June 2019,dcoydcoy,7, Clever Yet Missing It's Purpose,"The clever yet disappointing thing about Forrest Gump, is that it's an obvious fantasy story. A story in which characters and the situations they're put in cannot possibly be real. Yet the story is told and acted as if it's an actual biography of a socially inept individual's life, who is successful with below average thinking faculties. Never revealing it's pure fantasy!",
279,25 April 2022,anardio-47232,10, Better now that I'm older.,I was born in 1983. This movie came out in 1994. I really liked it back then. Had to fast forward some parts in the early movie(like the girls dorm). Nothing taken away to the story. I loved it back then. I've always been a Tom Hanks fan. I always will.,
280,25 June 2014,Rainey-Dawn,9, One of the best romantic films made!,"I am not a big fan of the romance genre generally speaking because I get my romance in side-stories in other film types like sci-fi, action, adventure, fantasy etc. But when the movie is labeled ""romance"" as a main theme then I usually will not like it... most of the ""romance"" films are icky chick-flicks *ewe*! I usually need more to make the movie interesting. Forrest Gump is one of those rare romance films that I thoroughly enjoyed! ",
281,5 March 2014,Just-Being-Me,10, One of the best movies ever,"Brilliant. Is there any part Tom Hanks can not play? i mean c'mon this man is amazing, every role he plays in any film is just spot on, perfect, he is a true actor and many should learn from him. This is how to act!.",
282,8 April 2020,titonsahashuvo,9, A Mind Refreshing Masterpiece,"Wondered throughout the movie. It is very inspiring & mind refreshing. Life is really beautiful. Those who're in frustration always & have lose interest in his life; please go through it. Life is very beautiful & might be waiting with some gifts which you want. Don't loss a moment thinking of other people's shit saying! Go, go, go & enjoy.... :-)",
283,9 May 2022,Xarx117,10, An Emotional Masterpiece.,Forrest Gump is one of the best movie ever. The simple story is incredibly brought togheter portraying the best aspects of the world we live in. All of this trough the eyes of one of the best movie character of all time. It makes you feel the journey of Forrest Gump. And Tom Hanks acting is just... THE BEST ACTING PERFORMANCE IN HISTORY. Yes Tom Hanks is a genius actor and just the fact he played the role of Forrest Gump makes him one of the best actor ever. The movie has a lot of really funny moments that are timeless. This movie is extremly powerful in portraying what our lifes could be if we stopped masking our emotions and the good in us. It makes us rethink about the good we can do in life. Its definitly one of the best overall story of all time.,
284,28 July 2002,norwood34,1, Don't waste your time with this stupid movie.,"Forrest Gump (Tom Hanks) has an IQ of 75 and plays a role in many aspects of American history, everything from Elvis to Watergate to the smiley face to the integration of the University of Alabama.  The message of the movie is that if you are stupid and you always do as you are told, then great things will just fall into your lap.  The movie is beyond farfetched.  The movie is absolutely ridiculous and unbelievable.  The basic premise of the movie is ludicrous.  There is no way to make it work.  This movie is a real insult to the intelligence of the viewer.  Tom Hanks is totally obnoxious in this movie.  I never liked him anyway.",
285,15 December 2018,miawatrs,9, Gooooood film,This is amazing! I watched it yesterday and it is already one of my favourite films ever!! You MUST give it a go!,
286,13 June 2018,paulclaassen,6," Well made, but overlong and ultimately boring.","This was an interesting trip through the eyes of an idiot, as he is referred to by most in the film. I loved the music during the particular events, as well. Yes, this was an excellent film and yes, Tom Hanks is brilliant. The film is ultimately a talkie, though, and I'm not into talkies. I also found the film overlong with possibly too much information crammed into it. The visual effects were very good, especially the war scenes. The film does teach us a few lessons, e.g. never to judge a person by appearance, and never going back on promises made, and probably also not to give up on your dreams.",
