Review_Date,Author,Rating,Review_Title,Review,Review_Url
0,10 June 2002,Smells_Like_Cheese,10, Let's see the world through the eyes of Forrest Gump,"""I've made about 20 films and 5 of them are pretty good""-Tom Hanks.",/
1,14 May 2007,thomas-hardcastle-2,10," In my opinion, no film has touched me more than this one.....","Quite simply, the greatest film ever made.",r
2,8 April 2002,Zonieboy,10, A beautiful fable for now and the future,"I believe everyone has a right to their opinion about films or other topics. However from a lot of the comments I have read about this film, I do not think many got the gist of the message from the author and the film maker. This film is a great modern fable, a fable in the dictionary is defined as a brief fictitious story that teaches a moral. There are many morals defined in this film but foremost is integrity and a simple goodness.",e
3,7 April 2006,Hitchcoc,10, Pure Charm,"Every once in a while, something comes along that hasn't been done before. This movie is one of those things. First of all, we have a principal character whose take on life is one where you don't judge it; you live it. I know he's a film character. It doesn't matter because we use images such as these to inspire us and to give us our own way of treating each day. Forrest lets no grass grow under his feet. He is the consummate optimist. He doesn't complain because he sees early on that it does you no good. His life is one adventure after another, in and out of the public eye, but his shyness and demeanor don't ever get to his head. He is the epitome of patience, something sadly lacking in the lives of most Americans. He is pushed around by the gusts of time and always lands on his feet. His relationship with a troubled girl is the one consistent thing in his life, and that is also shows his pugnaciousness. There are some commentators and reviewers who call this character stupid. He is a slow processor, but his stability lies in his morality and his consistency. His mother raised him well.",v
4,19 May 2016,inspectors71,9, Dropping My Keys,"I remember John Byner, the stand-up comic and impressionist of the 1970s talking about guys crying at movies, how it's not an acceptable behavior. He advised the men in his audience to drop their keys, do something that gets them to lean forward, wipe their faces, and get things under control.",i
5,15 December 2007,blairgallop7,10, Forrest Gump is a movie masterpiece that won't be forgotten and will continue to inspire,"He may have been good in Philadelphia but be is excellent in Forrest Gump.Tom Hanks delivers another great performance in his career by portraying the lovable,king yet not so intelligent character Forrest Gump.It is also Tom Hanks' second straight win for the Best Actor Oscar which he becomes the second man to do said accomplishment after Spencer Tracy.Whilst not as dramatic as Philadelphia,Tom Hanks' performance is just as great in this movie and this movie could possibly be the film of Tom Hanks' career as he used to be a comedy guy who turned to drama in a way which would paved for future stars such as Jim Carrey(The Truman Show),Reese Witherspoon(Walk the Line) and Will Ferrell(Stranger Than Fiction) to name a few.Also staring in this great movie classic are Robin Wright-Penn who plays Jenny,Gary Sinise who was nominated for an Academy Award for his portrayal of Lieutenant Dan Taylor,Mykelti Williamson as Forrest's best friend and shrimper Benjamin Buford""Bubba"" Blue and Sally Field as Mrs.Gump.This film was nominated for a total of thirteen Academy Awards but won six of them which include Best Film Editing,Best Visual Effects,Best Adapted Screenplay,Best Picture,Best Director-Robert Zemeckis and Best Actor-Tom Hanks.This is one masterpiece of a movie that will not be forgotten about in a long time.Bravo!",e
6,13 March 2003,george.schmidt,10, Contemporary classic: one of my all-time faves,"FORREST GUMP (1994) **** Tom Hanks, Sally Field, Robin Wright, Gary Sinise, Mykelti Williamson. Brilliantly directed and inspiring comic drama about the truly extraordinary life and times of mentally challenged Forrest Gump (Hanks in the best role of his career won his second Best Actor Oscar in back-to-back winning roles), a simple, honest, and decent man whose childlike innocence is his lucky charm through his altering experiences that span the past two decades flawlessly. Mind-boggling Oscar-winning computerized effects by Industrial Light & Magic has Gump meeting the famous and infamous. Hanks is a wonder (dare you not to get a lump in your throat when it finally registers that he has a child {yes, that's Haley Joel Osment}- watch his face!) and gets fine support especially Wright as the love of his life and Sinise as his best friend (Best Supporting Actor nominee) superior adaptation of Winston Groom's novel by Eric Roth (also an Academy Award recepient) that truly captures lightning in a bottle. Oscars also went to director Robert Zemeckis and for Best Picture. *** One of my all-time favorite flicks. I still cry, particularly Forrest telling Jenny why he loves her so much (""You're my girl!"") and at the gravesite when the birds fly overhead.",w
7,31 May 2004,kenhe,10, Purity and innocence retained,"I have seen this movie easily a half a dozen times, and I find that the beauty of the film is how Forrest Gump not only shares his innocence and purity with others, including the audience, he also manages to retain that innocence and purity through some very difficult times. As a Viet Nam veteran, and a college graduate of the late Sixties, I could of course personally relate to the various periods that Forrest Gump endures. I would only mention that the skillful and seamless blending of music, action, and period costume was enthralling. And yet it was so perfectly understated that Forrest Gump's travels through thirty five years of the stormiest and most meaningful years of American history only became clearly defined for the viewer. Even more so than the well known chocolates quote as a metaphor for life, I felt that the remark that stupid is what you do is probably more workable for most of us.",/
8,22 December 2012,AlsExGal,10, The role of innocence in positive thinking and thus success ...,"... seems to be the theme of this film. Forrest Gump has an IQ of 70, is being raised by a single mom, lives in a remote part of the Deep South where there are few opportunities, and has legs that require that he wear braces as a child. Sounds like the recipe for a sad tale or at least a slow death from mediocrity right? No, instead, because Forrest isn't really bright enough to realize the situation he is in, he simply does what he's told to do or what occurs to him to be the right thing at the time and succeeds due to a lack of self doubt. He's told to run and he becomes the star of the Crimson Tide and an All American. When recovering from a war wound, he's taught ping-pong and winds up competing at the global level in China itself. He promises his dying friend Bubba that he'll go ahead with their plans and become a shrimp boat captain and his brand of seafood products becomes a household name.All along the way he never learns the lessons in life that tend to make the rest of us cynical.",r
9,23 April 2005,schmimic,10, Tom Hanks delivers an astounding performance as Forrest Gump.,"Starring: Tom Hanks, Robin Wright, Gary Sinise, Sally Field This was flat out one of the best movies of 1994. It won best picture for a reason, along with a few other Academy Awards. I think one of the tag lines for the movie was, ""The world will never be the same once you've seen it through the eyes of Forrest Gump."" How true. The movie is basically one simple man's journey through life. And what a journey.",w
10,1 December 2007,john in missouri,10, Quite possibly the best movie ever made.,"I've seen most of the top-voted 30 or 40 movies here at IMDb, and Forrest Gump probably wins my vote for the single best movie ever made.",3
11,12 February 2021,kosmasp,10, Mama said ...,"Take this with a grain of salt and don't be mad about certain things. Like one of the first flashbacks to the very beginning that does not come over preachy when it talks about the Klan (Ku Klux Klan that is, just in case you think I'm talking about any other Klan). Maybe sometime in the near future there will be a disclaimer and someone giving this context. But until then, you have to be educated enough yourself to understand and comprehend certain things. And you have to have a certain sense of humor to dig all the coincidences that Gump comes across at. It's alike a marathon through many landmarks of the short US history we have behind us. Like the Watergate scandal, Vietnam War, Black Panthers and so much more.",3
12,25 December 2020,Xstal,10, Encapsulating...,"... all that is, all that was and all that will ever be, through the life experiences of the titular character performed to perfection by Tom Hanks whose generous performance leaves us humbled and in awe of what we can achieve, how we can achieve it and why we would want that achievement in the first instance. A piece of cinematic storytelling that will perpetually resonate no matter who or what you are, where you are going or who you are going with - timeless.",8
13,22 November 2009,TheLittleSongbird,9, Beautiful film,"Forrest Gump, I think is a beautiful film. Never too schmaltzy, but there are some genuine tearjerkers like Forrest at Jenny's grave. The cinematography is stunning, the costumes are lovely and the scenery is gorgeous. The music is also very calm and relaxing, perhaps adding to the tone of this film. The screenplay is well crafted, and the story is simple. But what made this movie was its simplicity; it never tries to be too complex and is consequently moving. The acting is just as impressive; whilst Tom Hanks's accent is a little awkward in places, my only real criticism of this movie, he gives a truly remarkable performance, though I do think Morgan Freeman deserved the Oscar more for Shawshank. Robin Wright gives possibly the best performance of her career, and Sally Field is very dignified as Forrest's mother. The scene stealer though is Gary Sinise as Lieutenant Dan, a very moving and insightful performance. Overall, an extremely good movie, I will admit I wasn't sure whether I would like it, but the simple answer is this, I do. 9/10 Bethany Cox",4
14,1 April 2000,Quinoa1984,10, One of the best films of the 90's,"Winston Groom's Forrest Gump was a novel that was complicated, but (Oscar winning) director Robert Zemeckis brings events together with visual effects that boggle even George Lucas. ",5
15,13 February 2010,bkoganbing,10, The Hand Of An Unseen Providence,When Tom Hanks won his first Oscar for Philadelphia in 1993 the film received a total of five nominations. His second Oscar for Forrest Gump came in a film that received more than double that in nominations and awards. If Forrest Gump did nothing else it solidified Hanks's credentials as a serious actor. He would never be doing imitations of his Bosom Buddies character in films again.,4
16,14 February 2005,adinutzza2001,10, why such a low rating???,"What I find completely ridiculous is why this movie, in my opinion one of the best ever, has such a low rating, so I've tried to figure out what some found against it.I noticed that the haters of this movie who make it have a lower rating than it actually deserves mainly argue that it promotes the government's politics of submission: the idea that ""if you're an idiot but you do what you're told then you will be rewarded, but, if you experience life then you're going to die a miserable death."" I'm not an American myself so i don't have any intention to defend the government or anyone else, but I think that the political events witnessed by the character in the movie make many miss the whole substance of the film. I think these bits of history only add to the magic of the film, making Forrest part of a fantastic world that seems so incredibly real though. ",9
17,20 June 2005,sundrymules,10, The zen of Forrest Gump.,"This is a powerful yet charming movie; fun for its special effects and profound in how it keeps you thinking long after it's over. Like others, I've seen this movie more than once. One comment I've never heard is that Forrest's simplicity is almost zen-like. I should read the novel to get the author's intention (I remember some people preferring the book and complaining that no one at the Academy Awards gave him any credit.) But rather than an implication that you should do what you're supposed to do and believe in God and you'll win in the end, I see it as zen-like, i.e., living in the moment and not having expectations or particular cravings (other than his loving Jenny.) So he ends up just stumbling into all the major historical events of the time. Granted, he achieves this only because he doesn't have the brains to think otherwise and actually have expectations, but so many of our problems are because we do have higher intellect and desires, which ironically makes us unhappy because we know what we are missing. We love our cats and dogs for the same simplicity and always being in the moment. There's a line in the movie wondering if everything is predestined or happens randomly or it's a combination of both. It is something to mull over for a long time.",/
18,25 May 2005,lacey_joeskip7,10, Life's Lessons in one Movie...,When I first saw this movie I didn't appreciate it like I do now. I think it may have been because I was so young when I first saw it. Just recently I saw the movie again. What an amazing story and moving meaning. That movie teaches you so much about life and the meaning of it. That life isn't as bad as most people make it seem. That an innocent man can impact so many lives with his innocence. The meaning of the movie to me is that everyone needs to have a better outlook on life. That we need to appreciate more of the little things and not let the big things hold us back. That truly although life may throw us trials and tribulations like a box of chocolates but that we have to just bite into it and get through it even if we don't like it. That we all need to hold true to our values and not sink into a place that feels like there's no hope... I just love this movie. And anyone who hasn't seen it or who thinks that don't like it I seriously suggest seeing it or seeing it again. It truly is amazing...,?
19,30 July 2016,ironhorse_iv,9, Life is like a box of chocolates. You never truly know what you're gonna get. Forrest Gump is amazing!,"Based on the 1986 novel by Winston Groom of the same name; Forrest Gump is about a simple man, named Forrest (Tom Hanks) whom with a low I.Q. who goes through life, accidentally being present at many historic moments, while building success for himself, however, never getting with his true love, Jenny Curran (Robin Wright) which mostly seems to be the only thing, that is eluding him. Without spoiling the movie, too much, this feel-good, financial blockbuster was indeed one of my favorite movies from the 1990s. I still quote, act out, & rewatch this movie, even with the downer tragic ending, this film has. I just can't help, loving it, despite the film changing a lot from the source material, like Gump's core personality and size. I kinda like that, he's not an autistic savant. In my opinion, it would be, too jarring. It would be, really too odd and unrealistic to see him, play chess, while being an astronaut, while people still thinking that he's an idiot. I kinda like that the film primarily focuses on the first eleven chapters of the novel, before skipping ahead to the end of the book. The middle part of the book is truly outrageous with Gump fighting off, cannibals, and becoming a pro-wrestler. That was way too out there to be taken seriously! The careers, he got in the film, seems more grounded with the reality of his character and the story. In addition to skipping some parts of the novel, the film adds several aspects to Gump's life that do not occur in the novel, such as his needing leg braces as a child and his run across the United States. Those changes really did help the film, a lot. This movie was also well shot by Robert Zemeckis. It made great use of its locations. I also love the use of CGI techniques to make it look like Tom Hanks was in some of the archive footage with various historical figures. Most of the visual effects in this film were pretty impressing at the time. Yet, I just wish the voice-dubbing was a little better. It doesn't really match well, with the movement of the long-dead historical figure's lips! While, the movie does have a lot of profanity, sex/nudity, drug use and violence for a PG-13. I think it somewhat works with the rebellions style of the 1960s. I also dig the film soundtrack. Great use of many well-known artists of the 1950s & 1960s. It's really does fit with that era of time. Also, the original music that Alan Silvestri made for the film was also beautiful. It fits some well in the film. Not only did that work, but the acting was outstanding. Tom Hanks was amazing as the title character. In other hands, this dim-witted, guileless, Southern-drawling simpleton hero could had turn into a bumbling yet annoying unlikeable offensive mental retarded stereotype. Instead, Hanks makes the fictional character, Gump seem like a real person with real motives and feelings. He really did deserve the Oscar, despite what some critics make say about his performance. Even the supporting cast was well-done. I love all of the characters ranging from 'Bubba' Blue (Mykelti Williamson) to Mrs. Gump (Sally Fields). I even kinda like Jenny, even when the writers made her, somewhat a horrible selfish trouble-person, who leaves Gump with a kid that grew up to be Haley Joan Osment in one of his first movie roles. Then- who can ever forget, Lt. Dan Taylor? This was Gary Sinise finest role. The character development that they gave him, was heart-breaking, yet hopeful. I love his redemption story. The film has this 'ignorance is bliss' philosophy to it; that makes the movie, fun to watch. The satire on contemporary values, during America's mid-20th century accomplishments is truly funny. The historic 'zelig' style jokes are mostly a hit than a miss to the funny. I also like how ambiguous, Forrest's story, as some people believe that he might be an unreliable narrator who whitewashing American history. Yet, I don't think, it's as racist or sexist as some people think, it is. The film is a lot more positive than that. Forrest is a represented of what is innocence and good about the world. He has this, out right decency about himself. He helps his friends if they're in need, even if some of them, take advanced of his hospitality. Forrest Gump is also a surprisingly spiritual story, well-told. A lot of people has stated out, the relationship between Forrest and Jenny echoes the relationship of Hosea and Gomer in the Old Testament; which in return is about, the relationship between God and man. Hints, the white feather that floats through Forrest's life. The movie is about the question of whether we are masters of our own fate or on a path to a predetermined destiny. Another thing, interesting, is how some people has been noted to see some political interpretations which I kinda have to disagree with. While, it seem like Gump follows a very conservative lifestyle, Jenny's life is full of counter-cultural embrace, complete with drug usage, promiscuity, and antiwar rallies, and that their eventual marriage might be a kind of reconciliation between America's extremes political points; I agree with Hanks, the film was non-political and non-judgmental. Forrest Gump isn't about liberal or conservative values. It's about learning to live with your limitations, while also giving it, everything you got. About the film winning best picture in 1994 over films like 'The Shawshank Redemption' & 'Pulp Fiction', I think the movie deserve it. While, on the surface, those other two films look superior better and more mature. In true, 'Forrest Gump' has just as much to give as those films. Also, it's by far, the more entertaining film of the three. Overall: Forrest Gump is like a box of chocolates. It's super sweet.",r
20,9 September 2014,tavm,10," After 20 years, I still love Forrest Gump!","When I originally watched this with my mom 20 years ago, we both were pretty touched by the events of Forrest Gump's life and the way he handled things. So now, watching this in IMAX with my movie theatre-working friend, it's the same feelings all over again but now having some additional life experiences, one notices things one hadn't thought of before. Like how the first person who sits with Forrest on the park bench is so uninterested in his story she takes the wrong bus and admits it to him while the last one who sits with him doesn't take her scheduled one because she's so immersed in hearing about his life! Or how Jenny realizes how much she truly loves him despite the way she sometimes treated him. Robert Zemeckis truly made a very compelling picture. And Tom Hanks delivered a wonderful performance worthy of a second Oscar win. Nice humorous stuff involving Hanks mixed in real news footage of the various presidents. And great music soundtrack to mark the times they lived in. Oh, and I loved the supporting cast of Mykelti Williamson, Sally Field, Gary Sinise, and Robin Wright as Jenny. With all that said, I'll now just say that Forrest Gump is worth all the praise and adulation it has gotten over the years.",e
21,13 October 2018,jjacques1,10, Forrest Gump (Negative Reviewers are Missing the Point),"I am a long time IMDb fan and first time reviewer. When I am reading through fellow user reviews, I generally find myself gravitating towards reading reviews that hold the opposite of my opinion. If I loved a film, I read the poor reviews and vice versa on the films that didn't resonate with me. I like finding value in an opposite viewpoint.",f
22,12 June 2011,classicsoncall,10," ""I just felt like running"".","For anyone who grew up in the turbulent Sixties, ""Forrest Gump"" delivers a clever blend of nostalgia mixed with a uniquely creative view of history as experienced by a presumed to be simpleton. While Tom Hanks' character recalls his life with a slow tangy drawl, he variously entertains and educates a host of passengers waiting for the next bus to their intended destination. Some ignore him, some show interest, one even scorns Gump's tale of getting rich in the shrimping business, only to depart before Forrest has a chance to pull out his copy of Fortune Magazine. Life can be like that for those unwilling to listen and learn, casting doubt instead of exploring the truth and keeping an open mind.",_
23,19 November 2008,tightspotkilo,10, An Amazing Movie,"I saw this movie in the theaters back in 1994. When it was released on VHS I obtained that version. I've watched the movie about once every two years since then. This is an amazing movie in any number of ways. One big way it amazes me, is the way which it, as a simple and guileless little story, like a feather wafting in the breeze, nevertheless evokes raw rank hatred and eyeball-bulging, forehead vein-popping, spittle-spewing vitriol from liberals and so-called ""intellectuals"" who are absolutely certain that, like a guided missile, it is seeking them out, intentionally, personally, to insult them with rightwing thoughts and ideas, and by a nitwit character no less. Hahahaha. As if.",=
24,22 January 2023,Sleepin_Dragon,10," Thirty years on, and it's still as wonderful.","A very eventful time in America's history, seen through the eyes of one man, Forest Gump, a man who has a very low IQ, a score of just 75.",t
25,18 December 2003,Hairy_Lime,7, Neither as good or as bad...,"People seem of two minds about this film: it either moves them to tears or to nausea.  But in reality, it is a well-made film with some strong performances but not more than that.  The core of this movie that is as simple minded as the title character; the facile speciousness of the movie's reactionary attacks on matters I agreed with made me realize just how shallow the movie's entire argument is.",t
26,27 November 2014,Horst_In_Translation,8," Timeless masterpiece, very unique","20 years after ""Forrest Gump"" came out, I decided to rewatch this one and it was even better than what I remembered from watching it the first time. The film won 6 Academy awards in 1995, including Best Picture, Best Director (Robert Zemeckis, ""Back to the Future""-trilogy, ""Cast Away"" again with Hanks later on) and Best Actor (2nd win in a row for Hanks after ""Philadelphia""). And even if it lost ""Best Score"" to ""The Lion King"", the music, especially the main theme, is nothing short of brilliant. It starts right away as we watch a feather fly towards the film's central character. Visually and acoustically a feast from minute one.",_
27,13 April 2021,simelemontolomeo-56461,10, You need to watch it again and again.,"I just watched Forrest Gump again, and I didn't unlock my phone like I do with every series or movie I watch. The part where he tells Jenny every magical moment he lived alone and she wanted to be with him and Forrest says ""there you were"", what a movie.",u
28,18 January 2020,nicholls905-280-546911,10, Impressive film,"It's a feel good film, that's not a bad thing. In this modern era of sequels and reboots, films like Forrest Gump offer an escape. I still believe Pulp Fiction was the better film for the best picture Oscar, but this is still an incredible film. Touching and heartwarming storyline leads our central character through some important moments in history. One of a kind film, that was not followed by a sequel. Tom Hanks is the foundation here, but is surrounded by a great support cast.",r
