Review_Date,Author,Rating,Review_Title,Review,Review_Url
72,18 October 2021,ksf-2,7, good telling of fight for independence,"Depicting the battle(s) for algerian independence from france, in the late 1950s. Recognized for the accurate settings, use of everyday people, and realistic scenes and action, the film is highly regarded in the industry. Stars Brahim Hadjadj and Jean Martin as the resisitance and the colonizing force. Because there are so many extras being used in various roles, some of it is over the top. They talk about the casbah, which we know from Algiers, made in 1938, is dangerous, and off limits to most people not born there. Much talk of the FLN, the Front Liberation Nationale, the name of the resistance group, testing new members, and carrying out the actions to free themselves of french rule. Because it was actually filmed in various locations in algeria, we get a great sense of the scenery , even ten years later. It's over two hours long, and gets a bit repetitious. Probably could have been done in a shorter time. A telling moment when the arab women remove their burkas and change their hair and appearance to plant bombs around town, as french women. Up to that point, they had really been following the arabian customs for appearance and propriety. Very well done. The torture scenes get pretty rough, so not for the children! Directed by Gillo Pontecorvo. Some weirdness over the academy awards... nominated for best foreign film of 1967, and was also nominated for best director and best writing in 1969.",
73,12 October 2002,kyle_c,9, **** out of ****,"Brutally honest look at the Algierian uprising against the French remains powerful to this day, and even more pertinent in light of concerns about terrorism.  It takes an objective view of a bloody and tragic situation, looking at the fact that each side was right and wrong, creating a cycle of violence not unlike that in Israel today.  Lots of raw power, due to the documentary-style filming.  History buffs will get a lot out of this, as will fans of politics-heavy films.  No matter what your tastes are, this movie remains an important movie - one which everybody would benefit from watching.",
74,2 April 2021,filipemanuelneto,1," A documentary film, tiring to the eyes and with a bad script.","Personally, I can't see the beauty and quality of this film. I recognize the ability to be objective and rigorous in the report made, and it is quite unusual to find a film that resembles both a documentary or a major journalistic report. However, the way it was conceived and its high-contrast cinematography make the experience of watching the film truly tiring.",
75,7 December 2007,vovazhd,9, A stunning view on Algeria's struggle for independence,"The Battle of Algiers is a multi-layered film describing the attempts of Algerian rebels to gain independence from France in the 1950's. The French bring in military might, but the guerrilla tactics of the rebels prevent direct assault. Thus the French officials are left with an unclear path of bringing order to the city. The film chronicles individual terrorist plots and attacks, while also describing the attempts of the French army to react and hunt down rebel power. The small attacks slowly build up into a brilliant, touching conclusion.",
76,28 July 2020,SAMTHEBESTEST,8," A disturbing, hard-hitting and extraordinary tale of Freedom Fight.","The Battle Of Algiers (1966) :
Brief Review -",
77,15 May 2021,briancham1994,7, Realistic and absorbing portrayal of insurrection,"This film's main strength is in its documentary-like portrayal of a violent underground movement. To be clear, it is not strictly a mockumentary, but the way it shows naturalistic settings and cinematography makes the audience feel as if they are witnessing a historical event in progress. It depicts the oppression of colonialism as well as the brutal tactics used by both sides, with a lingering focus on the effects of the attacks on the bystanders and the public consciousness. It deals with the historical events of the Algerian war head-on without any embellishments nor any stylisation. No wonder it has been influential for civil insurrection since then - both military institutions and revolutionary groups have found inspiration in its honest portrayal of a divided society in conflict.",
78,17 December 2004,colettesplace,8, Black-and-white cinematography as haunting as any fiction epic of the era - very interesting indeed,"This is a new print of the celebrated documentary about the 195462 Algerian war of independence. Although made in 1965, the Pentagon screened it last year to demonstrate what soldiers might face during occupation of Iraq. And organisations like the Black Panthers have used it as a training video in guerrilla-style warfare.",
79,24 August 2020,jamesrupert2014,10, Outstanding pseudo-documentary about a pivotal point in recent colonial history,"Hyper-realistic depiction of the events leading up to the 1957 'Battle of Algiers', which was fought between FLN (Front de libération nationale) and elite French airborne troops. The film primarily follows FLN leader Ali La Pointe (Brahim Hadjadj) as he organises terrorist attacks, initially on French police and later on European civilians, and his nemesis Colonel Mathieu (Jean Martin), a composite character representing the French military authority. Although clearly sympathetic to the Algerian separatists, the film is surprisingly even-handed, with neither side refraining from targeting non-combatants. The paratroopers use torture to extract the whereabouts of the FLN leadership while the terrorists enlist women and their children to smuggle bombs out of the Muslim controlled Casbah with which to blow-up 'soft targets' such as Cafes in the European quarter. At times the film is almost a didactic documentary on how to set up a resistance movement and how to fight it (at least at the tactical level). Ironically, the back-story of Mathieu includes serving with the French resistance in WW2, as did one of the real-life men on whom he was based (Marcel ""Bruno"" Bigeard)). Other than Martin, the cast are non-professionals and is universally excellent. The footage the paratroopers arriving in Algiers and later riots and street battles with the police is outstanding (the film is so real looking that the U.S. release came with assurances that no 'news-reel' footage was used). The music is excellent, with tradition Algerian music interspersed with a score by Gillo Pontecorvo and Ennio Morricone. One-of-a-kind and highly recommended.",
80,8 June 2020,henry8-3,8, The Battle of Algiers,The titular battle takes place In the Algerian capital city between the so called terrorists and the French army.,
81,20 May 2003,tasgal,10," Politically, tactically, socially astute. Also, a thrilling movie.","Most war movies are peopled by overgrown children, or technicians, or cartoon heroes and villains.  ""The Battle of Algiers"" is nearly alone in its fully believable depiction of adults at a particular time and place being molded by wartime experience.  Only ""Band of Brothers,"" in my opinion and to my knowledge, is worthy of comparison.  In the other direction, the formulaic leftism and phony pretensions to knowingness in Pontecorvo's ""Queimada"" result, I guess, from its subservience to the director's thoughts rather than close contact with real events.",
82,1 July 2020,marmar-69780,10, the battle of algiers,"The battle of algiers was great historical war film with a big dose of realism and scenes that are very hard to watch but also very moving and inspiring,story shows how algerian people tried to achieve their freedom under french occupation and in end they were finally able to achieve it,the scenes when the women planted bombs in a coffee shops and other places was build with a lot of tension and it felt like none of that was acted,also the way how bomb exploded and its destraction after it looked very real and paintful to watch,acting was also very good ,i mean it was so good that it didnt felt like they are acting,the battle of algiers was a very strong anti war movie with a lot of messages in it that will impact many people and for that movie deserves huge praise",
83,17 February 2007,ewarn-1,8, Raises Too Many Questions,"It must be impossible today to discuss this film without branching out into broader political observations. The Battle Of Algiers may be more relevant today than it was in 1966, though the situations we face today are different to some degree, it's uncomfortably close to what we're seeing every night on cable news. This is one of those movies that everyone has heard about, but fewer have seen.",
84,28 January 1999,DukeEman,8, A nation rises.,A powerful account of Algeria's fight for independence against the nasty French. This Doco style of film making never really focuses on the one character but draws our attention to the uprising of a nation.,
85,23 July 2011,freemantle_uk,10, The Brutality of War,"The Battle of Algiers is recognised as a classic film, having a high IMDb and Rotten Tomatoes scores and being placed 120th on Empire's 500 Greatest Movies of All Time in 2008. There is a great reason why it is so regarded, getting all areas of filmmaking right and having such an impact that the French banned it: the French need to learn to accept criticism.",
86,3 March 2006,lebensraum-1,10, An ignored classic,"All I want to add is some more background behind the conflict. Again the main source is Alistair Horne's book ""A savage war of peace"". Alistair Horne wrote a trilogy of books on 20th century French history incorporating Verdun, the fall of France in 1940 and the Algerian war. Although Britain also had an empire it seemed to be able to extricate itself from it in a less bloody manner and those colonies that did see conflict did not see the kind of bloodshed France experienced in Vietnam and Algeria. I think Britain was able to see that the concept of empire was politically, militarily, economically and morally unviable. The French did not seem to see it that way. Alistair Horne wrote that the French seemed to think that if the rebellion was repressed they could carry on ruling Algeria like Ian Smith's Rhodesia or apartheid era South Africa, a totally unrealistic option. I suppose all whites have to accept that attitudes were much more racist in that era which explains a lot. Also I suspect that after the humiliation of 1940 the French military were determined to win a battle. What is not generally known is that most of the Free French troops that fought in Italy and France in 1943/45 were from French north Africa. The brutal battle of Cassino in Italy was brought to a conclusion by these colonial troops making an outflanking manoeuvre over mountainous terraine. Most of the troops liberating Paris were colonial. The natives were liberating the mother country and many of them later led the FLN. French dissatisfaction with the ongoing war led in 1958 to General Charles De Gaulle being called out of 12 years of retirement. Most Frenchmen expected De Gaulle to crush the FLN but De Gaulle was a statesman not a 3rd rate politician and could see that long term France had to let Algeria go. When this became clear the French military in Algeria felt betrayed and astonishly tried to stage a coup d'etat in mainland France. It failed of course and many rebel officers went underground and formed a terrorist group called the OAS which murdered people in both mainland France and Algeria. The coup attempt was a PR disaster and most French people now wanted out of Algeria.",
87,21 March 2011,st-shot,9, Battle still rages with power.,"Four decades after its release The Battle of Algiers remains as emotionally powerful and timely as ever. Its semi documentary look and universal theme addressing a people's right to run their own country and not some foreign colonizer or more pertinent to today's front page, despotic dictator, has not lost an ounce of its urgency or punch as the same part of the world including Algeria itself wrestles with self determination. ",
88,6 April 2009,Polaris_DiB,10, Classic and Document,"This is one of those movies that has not only become a classic of world cinema, but has become a historical document and technical discourse in its own right. While audiences around the globe cringe at its tragic narrative, military personnel watch it in order to understand the nature of urban-based guerilla warfare. Either way, the end result is the same: Empire is a Sisyphean business.",
89,24 January 2005,stephen-357,9, A masterpiece of documentary style film making.,"This film should be required viewing for anyone who wants to understand specifically what we're up against in our ""war on terrorism."" Even though Gillo Pontecorvo's film was made in 1966 and documents events that took place in Algiers four years earlier, little has changed in terms of the mindset, structure, strategy and implementation by terrorist organizations, almost as if they've been in a vacuum all these years; indeed, this is the major cause of the ""Arab Predicament"" today. Watching THE BATTLE OF ALGIERS, it would seem this film is more documentary than cinematic fiction, and with Marcello Gatti's grainy B&W photography (many scenes filmed with a hand-held camera), this impression is not that far off the mark. Since the struggle for independence from France was so fresh in the minds of most Algerians, the participants in the actual events were used in the film, and once Pontecorvo and his team recreated the atmosphere and visuals, the emotions of the people were ignited again and suddenly they were no longer acting. While THE BATTLE OF ALGIERS does take a position on the conflict, Pontecorvo is remarkably even handed in his approach and does not shy away from difficult questions, but confronts them with brutal clarity and honesty. Watching THE BATTLE OF ALGIERS is an intense, powerful experience, and Ennio Morricone's subdued but emotive score gives the images a resonance that will haunt the viewer long after they've dissolved into closing credits.",
90,14 June 2011,yutofilm,7, I don't understand war,"As a Japanese student I am not old enough to remember my country's own experience with war and after watching this movie I am glad that I know little of war. It is different than many of the American war movies that seem to glorify battles. This movie does not make a statement about whether war is good or not, it just shows the sadness of war. ",
91,28 June 2006,darienwerfhorst,9, Classic War Film,"This is a great movie, shot in ""semi-documentary"" style..It manages to maintain a very balanced view...the rebels are sympathetic, even as they blow up civilians and the colonel is clearly moved by their commitment to their cause even as he tries to stop them and save Algeria ""for France."" There are some really unforgettable moments: rebels being tortured against a quiet background, the look on one of the rebel women's face when she realizes that the child eating ice cream in the café may well be her next victim.",
92,14 November 2005,lulu18,10, Must be seen by all Americans.,"Americans do not seem to learn from history of the French: first in Vietnam (we lost, as did the French who were smart enough to give up earlier) and now in Iraq (an unwinnable war, which the French knew would not be winnable).",
93,18 June 2020,frankde-jong,8," A prequel for ""The day of the Jackal""","Director Gillo Pontecorvo had a strong political awareness. He always took the side of the oppressed. In 1960 he made a film about Jews in a concentration camp (""Kapo""), in 1969 he made a fim about a slave revolt (""Queimada"") and in 1979 he made a film about the oppression of the Basque bij the Franco dictatorship (""Operacion Ogro"").",
94,7 February 2012,derdriui,10, One of the greatest movies ever made,"Is there another film that compares? I hope so. This is an inspiring and brilliant work, taking the side of truth and humanity rather than any particular side of a war.",
95,15 August 2007,hereontheoutside,10," Brilliant synthesis of historically accurate drama, Italian neo-realism, and cinema verite","Gillo Pontecorvo's 'The Battle of Algiers' is a masterpiece in the finest sense of the word. Few films are as emotionally and intellectually stirring, and complex. The film follows Ali La Pointe (Brahim Hadjadj) as he joins and eventually attempts to lead the FLN in the Algerian revolt against French colonial power. Opening with the end we see La Pointe hiding in the wall of a FLN hideout as an FLN member tips off the French army as to where he is hiding. The French Colonel Mathieu (Jean Martin) is standing on the other side of the wall he is hiding in warning him that he has to come out or he will be forced to blow up the building, killing everyone inside. Then Pontecorvo brings the audience back to before La Pointe joined the FLN. This gives the film a hunting residue of looming failure, a pure sense of hopelessness for the rebels you are pulling for. Or at least the rebels I was pulling for. Part of the beauty of Pontecorvo's portrayal of the rebellion is that it isn't one-sided; it doesn't attempt to say the rebels were right and deserved their independence and the French were occupying dictators. It tends to lean that way, but the portrayal is much more complex than that. Both sides kill innocents in an attempt to seek revenge against those who have injured innocents on their side. The audience relates to, and respects, La Pointe and the FLN, while despising their methods. At the same time you can respect Mathieu and the French for their attempts to end things peacefully and the respect Mathieu shows for the FLN leaders he captures, in private and in the press. Taking in equal parts from the Italian Neo-Realistic tradition and the 60s cinema verite school, the film alternates between gritty footage of the FLN roaming the city streets, plotting and planning their revolt. Humanizing and immortalizing them. Then the footage jarringly rotates to more documentary style footage of Algerians in the streets, striking, protesting or roaming the markets of Algiers. Shot in a, sometimes, grainy black and white the film finds beauty in rawness and jarring, rough shots, finds beauty in the hideous and the luscious. Every bombing, interview, jail, city street or hole in the wall carries a dark, sweeping, beauty that the audience doesn't have to search to find. Easily one of the best films on wartime politics and on revolutionaries ever made. It's haunting, the kind of film that will stick with you for days, leaving you grappling with moral complexities and desiring to determine a more definite sense of self. This is what cinema should be. It can be hard to communicate when a film is this good in an era when criticism lends itself towards the sensational and the linguistically fluid for even the tritest trash film, but this, this is a powerfully moving film. A mix of the raw and harsh eye of Cassavetes, the violently prophetic scenarios of Scorsese and the morally marginalizing notions of Kubrick at his best. An absolute must-see for anyone who considers himself, or herself, a fan, not of film, but of cinema. A film that has never been more apt for America, contemplating the moral complexities of war, and the utter lack of that proverbial line where right and wrong collide.",
96,19 September 2006,gonzagaext,10, Still Highly RelevantIf Not More SoIconic Resistance Film Attacks Colonialism,"It feels redundant to talk about a film as iconic as Gillo Pontecorvo's ""The Battle of Algiers"". Still, as a descendant of the colonized (and quite possibly the colonizer, too) it's hard not to get affected by what could very well be the greatest anti-colonialism film ever made. Something as potent and political as this demands a reaction. ""Algiers"" is among a handful of films that are so exceptional and humanistic they ought to qualify as required viewing for a better humanity: Mira Nair's ""Salaam Bombay"", Koreeda Hirokazu's ""Nobody Knows"", Kieslowski's ""The Decalogues"", and Lee Chang-Dong's ""Oasis"", to cite a few.",
97,8 February 2020,alansabljakovic-39044,8, Give me more of this,"Finally finished 2015's imdb top 250. Really good film, had some issues with getting into the story but after 20 minutes I got sucked in. The movie did justice to these events.",
98,10 June 2021,doomedmac,8," A brutal, draining movie","The Battle Of Algiers is a extremely good movie, but it's not an easy watch. I felt kind of terrible by the end.",
99,13 May 2018,cianlyons-18565,8, Great and Conflicting Movie,"A really well made and fascinating film about the beginning of the big anti-imperialist war that took place Algeria against France. A conflict which would be incredibly contentious war in France, especially in regard to torture of enemy militants. This film is really well done about what is essentially a terrorist group in Algiers fighting for their freedom against their French oppressors. While I think this group is largely sympathetic they also commit some fairly grotesque acts towards French people living in Algiers. In terms of filmmaking this makes the dynamic between the French forces and insurgent group very interesting.",
100,21 November 2022,steiner-sam,7," Significant historically, though its cinematic effects are not especially strong","It's an interpretation of the battle in 1956-1957 between members of the Front de libération nationale (FLN) and French troops in the early years of the Algerian War of 1954-1962. It primarily follows one of the FLN leaders and the French Colonel who led the paratroopers brought in to crush a general strike and to ""behead"" the FLN leadership.",
101,14 November 2001,whatdoes1know,10, single most important movie about terrorists and counter-terrorists.,"This is the single most important movie I have seen recently, and it illustrates with unbelievable parallels situations in the U.S. and Afghanistan since September 11th 2001. This movie is as impartial and rationally thought-out as every movie should be. Instead in Hollywood we get Pearl Harbor and The Patriot. And soon Black Hawk Down. That one looks like a downer already. Terrorists aren't mere mobs of fanatics who don't have anything better to do. The soldiers fighting them aren't a bunch of patriotic morons who got drafted as they walked out of a war movie. And this movie masterfully reveals both. The direction is superb, and the footage is incredibly convincing--so much that the movie opens with credits emphasizing that news footage wasn't used in the making of the film. But what is even more gripping is the imagery that is used before terrorist acts and military raids--men, women, and children, families, lives about to be destroyed. Don't blink. This movie has nothing to be missed.",
102,2 February 2008,bandw,10, An anatomy of an occupation and revolution,"This movie about the Algerian's fight for independence from over one hundred years of French occupation is a serious undertaking. If you are looking for a pleasant evening's entertainment, then you should put off seeing this until you are in a more solemn mood.",
103,10 February 2014,jackbanister16,8, Stumbled across this gem!,"I was scanning channels and happened upon La ""Battaglia di Algeri,"" on TCM. I usually don't watch TCM (I should), but there really wasn't anything else on so I gave it a shot! All I can say is that the acting, plot, and cinematography are among the best I've seen. ",
104,13 May 2020,willeasyer,10, when you recreate reality!,"I grew up watching this movie. where I came from it's considered as a nationalist artifact, it's shown each national and independence day. So for me, it was only a revolutionary and national film that depicts the cruelty f the french colonization in Algeria that I memorized scene by scene. it was only until recently that I decided to see the film for what it really is and getting a restored copy of it. After not watching it for almost 10 years, I tried to stay unbiased and take it for what it is, and to my surprise, I was in trance. it's one of the best movies ever made, why? Because it readapts the truth so meticulously it feels like a documentation of the reality itself. the film doesn't take sides, it doesn't try to give the right to any side on the expense of the other, this movie doesn't play ethics, it just shows the terror that goes on both sides and the story flow to the rhythm of these true events perfectly restaged, to the point it can be considered as a minute by minute reportage of the events. The war of Algiers was so eventful on itself, the Algerian revolutionaries so complex they didn't need writing and it was made 3 years after the Algerian independence so the memories were fresh, the feelings and terror still lived and felt, it's impossible to make such movie nowadays, Every scene is perfect and felt intensely. this movie is cinema witnessing history. perfection",
