Review_Date,Author,Rating,Review_Title,Review,Review_Url
143,22 July 2011,dhruvasomayaji,7, Perfect Balance,"I'd imagined the movie to be just another war movie, but it was not so. It had a great stuff in it and it is perhaps one of the best war movies ever made and needless to say it is not a fictitious story but a true story from the pages of history.",
144,22 December 2005,jameskinsman,9," A unique film, and one that everyone should see","The Battle Of Algiers documents the Algerian peoples fight for independence from the French in the 50's and 60's. Heavily inspired by the Italian neo-realist movement, Director Pontecorvo used hundreds of non-actors and shot the entire film on location. This all adds to the documentary like photography with which the account is presented, setting it apart from all other war films, imbuing the action with a shocking sense of realism comparable to a news report of a real terrorist demonstration. Despite being a docu-film on the Algerian insurrection against the French, a conflict that has long been resolved, the film still remains extremely significant today, particularly due to the current American occupation of Iraq.",
145,4 March 2011,clevelander,10, History and cinema collide,"No need to add to the assessment of this film's quality, but I can throw some light on aspects of the film. Someone who was present at the making of this film clarified to me what the significance of this film was, and why certain things are as they are.",
146,24 November 2002,theyukon,10, You have to see this masterpiece to believe it!,"I saw this movie last year. Everything from the french army, the french, algerians, terrorists is so realistic that you will ask yourself, is it even possible to make such a movie? Pontecorvo's study highlights the Algerian guerrilla struggle against the French colonialists in the 1950's. this movie eventually put international pressure on the french to grant independence to the algerians. This movie is the pinnacle of documentaries. A must watch.",
147,23 June 2013,bell-benn,9, Battle of Algiers is relevant today.,"The Battle of Algiers is an Italian film directed by Gillo Pontecorvco, which was produced in 1966. It depicts true events which occurred during the Algerian war of independence from France, which was fought from 1955 – 1962. The events depicted in the movie occurred during the Battle of Algiers which took place from 1954-1957. This film has been ranked in the top 100 films ever made. It was banned in France for five years where it was finally released in 1974. The Battle of Algiers is an important commentary on guerilla warfare. Revolutionary guerilla fighters holed up and grouped together in cells in the Casbah section of Algiers. French paratroopers attempted to wipe them out. The movie is about this struggle and the methods used by both sides. The tactics of the National Liberation Front (FLN) guerilla insurgency and the French counter-insurgency are shown in the film. The French colonial power committed atrocities against the civilian population of their Algerian colony and the colonized insurgents committed atrocities against the civilian population of their oppressors in a spiraling escalation of violence. The FLN engaged in acts of terrorism by placing bombs in public places such as restaurants, nightclubs, and airports, indiscriminately killing civilians in the European Quarter. The French paratroopers tortured, intimidated, and murdered members of the FLN. The use of waterboarding as an interrogation technique is depicted. Algeria eventually won its independence in 1962. Some of the scenes that really struck me were the incidents of waterboarding by the French Paratroopers, the men of the FLN covering themselves in burqas like women to disguise themselves and escape detection, FLN women dressing like European women and carrying bombs in baskets, and in the end the women ululating in victory when Algeria won its independence. The Battle Algiers is as relevant today as it was in 1965.The film was screened by the Pentagon in August 2003 as a field guide to fighting terrorism. Former National Security Adviser, Zbigniew Brezezinski, said: ""If you want to understand what is happening right now in Iraq, I recommend The Battle of Algiers."" This film was also used by the Black Panthers as a training film. I am sure there are other terrorists groups that have been influenced by the film as well. The Boson Bombing suspects come immediately to mind. The film, shot in black and white, is a triumph of realistic production values and heavily influence by Italian Neorealism of the 1950's. It was filmed on location in Algiers using the real locations in the European quarters and the Casbah. It was so realistic that Pontecorvo had to issue a disclaimer that not one foot of documentary or newsreel footage was used in his two hours of film. Everything was shot live. The film was nominated for AcademyAwards for Best Foreign Film, Best Screen Play, and Best Director. It was the winner of the Venice Film Festival Golden Lion Award.",
148,24 December 2020,garwoodsara,10, 10/10,"A film commissioned by the Algerian government, showing the Algerian revolution from both sides. The French Foreign Legion has something to defeat and prove Vietnam. Algerians want independence. Two collisions. The torture used by the French is in contrast to the Algerians using bombs in soda shops. We see war as a nuisance that hurt and defiles everyone who participates in it.
10/10",
149,6 March 2021,aahn-36338,10, 10/10,"Film commissioned by the Algerian government that shows the Algerian revolution on both sides, The French foreign legion defeated Vietnam and has something to prove, Algerians are looking for independence, The two clash. The torture used by the French is contrasted with the use of bombs by the Algerians in soft drink stores, A look at war as an unpleasant thing that harms and stains everyone who participates in it,",
150,11 December 2011,username-taken,8, A film that truly achieves neutrality for an artistic purpose,"In ""Battle of Algiers"", Pontecorvo makes a conscious effort to present an impartial dramatization of the events that took place in Algeria in 1957 by neither demonizing, nor idealizing the Algerian resistance. The film delivers an unapologetic perspective on the injustices faced by the Algerian people, as well as their radical backlash against the French army. ",
151,16 December 2008,eric_mejia,9, A foreign masterpiece unlike any other!,"Gillo Pontecorvos portrayal of the Algerian war against the French paratroopers carefully studies conflict of war and how violence, through escalation, only brings sorrow to those surrounding communities. Pontecorvo's and Franco Salinas' screenplay is very well articulated with memorable quotes and a dramatic structure which that continue to keep the picture tense yet emotionally intriguing. Both Pontecorvo and Salinas chose an interaction of characters from both sides of the war to feel passionate about their stance, thus leaving the picture to sympathize for both peoples, the FLN and the French civilians. Through the deaths of innocents, violence begins to escalate from the beginning, all the way to an explosive ending. Though no protagonist took the film by storm, Pontecorvo weaved a film where all the characters were equally felt for. His structure feels like a race of increasing violent acts, beginning with small gun battles and moving into the direction of time-bombs as acts of terrorism and revenge came soaring. Ennio Morricone's score couldn't help the picture anymore than make it an emotional driven roller-coaster, providing a tear or two in the process. When tension could be felt, Morricone exploded the scene with what sounds like a score of haunting rattling noises that get louder and louder. And finally, when tragedy strikes, like the scene when the Algerians begin looking for their loved ones in the bombs ruffle, Morricone goes into a haunting notion of a score driving one to feel sympathy for the Algerians. Overall, The Battle of Algiers is a foreign right masterpiece telling the horrors of terrorism, without creating a protagonist to sympathize for. It does for what real war does, incorporate a viewpoint from both sides and showcase the peoples pride each side has. It is a haunting story about sacrifices, pride and justice all told to portray freedom as something not so free.",
152,18 December 2011,mocha777,8, Political Movie,"""The battle of Algiers"" 1966 by Gillo Pontecorvo was a great movie that portrayed the struggles of the Algerians for their freedom. This film is also very realistic not only Algeria but relates to those Nations that fight for their freedom. The most unforgettable seine was that three Algerian women had bomb in their basket to kill French people for protect their country and revenge. This film should be shown to many people to know what happens in some countries to get their freedom even it happens now in some countries. ",
153,13 September 2005,visene,10, a perfect docudrama with no equals,"It would be a mistake to think that what you see in Battle of Algiers is an unbiased account of Algerian history, and it would probably be an even bigger mistake to use the events of this film as your sole guide for understanding, say, the US occupation of Iraq. That said, I think this is one of the best films ever made about the nature of war--why people fight, and what they become by fighting.",
154,13 June 2011,gutierrez_garrett_an,10, Excellent,"As far as great movies are concerned, this film is the crème de la crème. Its been watched countless times as an example of what to expect when the state or a foreign power is forced into conflict with a civilian population armed with their wits, their intelligence, and what little weapons and technology they can get their hands on. It's not difficult to see how the current conflicts in the Middle East and the American reaction to them relates to this film. In fact, the story of this film relates to any major conflict between an invading force that is more technologically advanced and seemingly more powerful than the population it seeks to control. Both struggling ""freedom fighters"" and the governments that seek to eliminate ""terrorism"" appreciate the film, as it was filmed in a way that creates no sense of hidden variables or any sort of a Manichaean world view. The film is one of the best examples of a world where black and white concepts simply do not exist. At one point, one of the French colonels in charge of stopping the Algerian resistance movement explains that the French government has only two options, and that any concept of right or wrong simply has nothing to do with the task at hand; that if the French want to stay in Algeria, they must accept what must be done, and that entails putting up with brutality and torture as the means to accomplish their end. This film can best be described as ""real."" Nothing about it seems contrived, everything mirrors real life and the gray areas of the world that so much suffering seems to thrive in. Whether you feel that the French are in the right or the Algerians have the moral high ground, Pontecorvo's film will leave you with a better understanding of the other side, despite the fact that you may loathe everything that they stand for. For every act of violence in the film, one cannot find true justification, only explanation, but perhaps that is Pontecorvo's point; that explanation and understanding is enough to get humanity towards whatever sort of peace it tries to attain. Even if you can't appreciate the film for its style, drama, music, or any cinematic aspects, the message is one that all humans can learn from and appreciate.",
155,12 December 2011,lizandro_melean,9, The thin blurry line between documentary and fiction,"This is one of the best war films ever. You'll feel watching a documentary, that grainy look is impressively real and it enhances the overall visual experience. You'll feel you're watching footage from the Algerian war and not a movie, this is enhanced by the acting and how the camera becomes almost invisible (only a great director can make this, thank you Pontecorvo) and it's a way to understand the people and the culture behind Algerians after 9/11, where everyone coming from that side of the world, were called ""terrorists"" without a logical reason.",
156,17 December 2007,Prophet-9,9, Self examination,"Many other reviews here will give you a plot synopsis of this film, tell how realistic the cinematic feel is or how it can help you to understand a culture so different (or not so different from your own). But what impresses me the most about this film is what it tells you about yourself. ",
157,15 June 2009,angie-51,9, So Real,"The portrayal of the battle for Algeria by the colonizing French and the native Algerians is almost as real as it can get in the movie ""The Battle of Algiers"". At times it is so realistic, it seems like you're watching a documentary. The scene that depicts this best is a shot of a raid of an Algerian community by the French military. During all of the commotion you see a naked baby boy crying outside its doorI wanted to reach through the screen and pick him up.",
158,10 January 2021,sweetcharlie-65630,10, 10/10,A film made by the Algerian government depicting the Algerian revolution from both sides. France's foreign forces have left Vietnam in defeat and there is something to prove it. Algeria is demanding independence. Two skirmishes. The torture used by the French is in stark contrast to the use of bombs in Algerian soda shops. Seeing war as a bad thing that harms and harms everyone who takes part in it.,
159,16 December 2011,StephenBradleyJones,8, Realistic Film,"Battle for Algiers is a realistic film. It doesn't do the disservice of making it a simplistic goodies and baddies type of flick. Instead of insulting the viewing audience, it gives the characters complexity. This makes it much easier to see things and just go along for the ride. The uprising against the French, just like any other conflict, would be impossible to simplify each group as being 'all this way'. During this film, it objectively shows the 'why' characters choose their paths. It doesn't advocate heavily one way or another. It leaves the viewer the option to make their own conclusions. Despite the documentary style imagery, no stock footage of the uprising was used.",
160,13 June 2011,slatergrey,10, Battle of Algiers,This is a very powerful film that basically is asking how far will you go to fight back against you're oppressor and how will you do it. This film is so powerful because we see the view of both sides. We see the French side of the army taking over these people and we see the Algerians side and them doing whatever they can to survive. Neither of them is good or bad. They both commit horrible acts on each other and never seem to fins a peace until after the story of the film is over. This film just makes you feel for the Algerians so much that you can't help be on their side but they go about their objective the wrong way sometimes. You attain so much respect for them though for fighting back as they do. In the end their whole purpose was to get their whole community to fight back and they finally did. Instead of bombing and killing they come together and march on the French. The film is all about the power of resistance and how far you can take it.,
161,27 January 2021,commentary-710-473948,2, Just a massive drag,"I'm going to start with this - I am a fan of bleak films, and films that have something to say. Something to commentate on, or make a statement about. This film is just....boring.",
162,15 December 2011,tianafeghali,10, Dignity brought to life,"At the same time I watched Battle of Algers I was taking a Political Science class, which was mostly related with comparative politics around the world. Coincidently, we happened to have just discussed in depth France and their past. Battle of Algers is a beautifully crafted film. I especially appreciated the fact that the director Gillo Pontecorvo was neither Algerian nor French because he really humanizes both, rather than favors one over the other. The issue of colonization has been in our history since the beginning and a film like this really opened my eyes to the broad picture. It allow me to see the difficulties of the resistance and their reasoning and the colonizers purposes. My favorite scenes would have to be when the Arab women were walking through town going to plant bombs and while they were there the camera cuts to different people that are in the locations that are about to blow up. This shows the humanity of each of those people and how they all have a story. For a minute or two I thought that possibly the women were not going to go through with their plan, but after realizing what the French had done to their people they didn't think twice. Being that I am a big De Sica fan, I was really satisfied by this film. Neo Realism is my favorite type of films; no professional actors, all on location, no sound stages, real light, and not thoroughly scripted really capture the dignity of the people. I really felt as if it was a documentary but it was all staged. This is a true film and now one of my favorites.",
163,9 March 2018,sullivanday,9, Amazing look at terrorism,"This is great film-making, you truly believe you are watching a documentary. The pacing is just right, the action seems real and the performances are wonderful. It is just fascinating to watch. But in this post-9/11 world, it does put this film in a different light. Are we to admire the characters that shoot people in the back and plant bombs in crowded cafes? Ironically, Algeria struggled for many years with its own internal civil war with terrorist groups.",
164,1 August 2021,shroomhq,10, Prime example of why in 2021 we still have terrorists,This movie clearly shows why every person that was involved in the Algerian invasion & tortures requires IMMEDIATE extermination. The entire country of France needs to be charged with heinous war crimes over what they did in Algeria without exception.,
165,14 December 2011,asweetmargarita,9, Why we do what we do,"A timely movie for the time in which it was done. Considering what America was involved in during this period of time. This is a movie that shows that oppression occurs all over the world. Even today this movie is still applicable to how power is and how we perceive power. This movie can also cause the viewer to question their stereotypical view of who is bad and who his not. The passion in the characters cause creates a tensive compassion for the audience. Especially in a time when many people view people from certain countries as evil. The battle fought in this movie is more than for Algiers, it is for oppressed people and societies worldwide. Personally I found it to be a movie that is perfect for discussion (not debate) on modern day issues of why we do what we do.",
166,12 June 2011,atehtoya,6, Battle of Algiers,"Considering that none of the actors in the movie are professional, except Colonel Mathieu, Gillo Pontecorvo did a wonderful job shooting this film as if it was a documentary. It was very tolerable to watch. In this movie, the civil unrest between the French and Algerians was a tragic one. Many innocent people had to die as each group set out bombs in the Kasbahs and French cafés. No one deserved it and yet it happened because they both wanted to retaliate with each other. After watching this movie, I was appreciative to learn about the history of Algeria and France, but I felt indifferent on who was at fault. I though both the Algerians and French had a part in the unrest and they took it out on each other through violence. I was neither on the Arab side nor was I on the French side and the director of the film director made this movie just that...unbiased and to simply raise awareness.",
167,10 December 2007,vahdani3,10, conflict between native Algerians and European settlers,"The Battle of Algiers, a film by Gillo Pontecorvo is based on events during the 1954-1962 Algerian War of Independence against French rule. It depicts the conflict between native Algerians and European settlers in which the two sides exchange acts of increasing violence, leading to the introduction of French paratroopers, under the direction of General Massu and then Colonel Bigeard, to root out the National Liberation Front (FLN). The paratroops are depicted as ""winning"" the battle by neutralizing the whole FLN leadership through assassination or capture. However, the film ends with a coda, depicting demonstrations and rioting by native Algerians for independence, in which it suggested that though the French have won the Battle of Algiers, they have lost the war. The movie reminds me of the current situation in Iraq. In May 1, 2003 President Bush announced ""Mission Accomplished""; however, four years after his announcement, the battle has been intensified. Children shoot soldiers, women plant bombs in restaurants and suicide bomber are increasing. This movie is about independence and fighting for belief. The belief is profoundly rooted in people of Algeria that brought independence to Algeria. It is a lesson that US must learn, military action does not work against strong, deep rooted belief. History is repeating!",
168,11 December 2010,rhyter369,8, A Gripping Film,"Battle for Algiers offers a chilling depiction of the Algerian struggle against French colonization. Tensions mount as a cauldron of violence erupts, leaving both physical and psychological scars in its wake. This is a story of a people overrun by foreigners, who refuse to lose their homes, country, and identity. This is a story about a cause in which people believe so deeply, that they are willing to sacrifice not only their lives, but the lives of innocent people. ",
169,12 December 2010,StompingJoe,9, Romania hears you loud and clear.,"This strongly reminded me of the Romanian Revolution in Timisoara in 1989, so it was well received, especially by me. It did pose a strange (yet convincing to some) justification behind people who bomb public areas to make a statement. Side note on the special effects- they were extremely realistic, I can imagine that it would be the equivalent of today's Avatar status CGI. This film had a LOT of thought put into it, acting was convincing especially because it was done with people that indeed participated in the revolution in Algiers. On a historical note, whole thing that was going on with France was extremely hypocritical considering that France had their own revolution against the high ruling class, so it's rather interesting to see them acting like the ruling class over another COUNTRY and find absolutely nothing wrong with it. As far as the ending goes, I can see how it promotes peaceful protest, in the end bombs didn't solve the problem. One of the people I saw this with commented that if it wasn't for the violence beforehand, there wouldn't have been a peaceful revolution in the first place... However I'd reference the Romanian revolution. It was peaceful on our side, yet the communists did not only respond with rifle fire upon the protesting crowds, but also made use of tanks and killed many more that way. I love this work of art and I can totally see why it's one of Spike Lee's favorites.",
170,13 December 2010,Nbacher,10," The Battle of Algiers focuses on the events of 1957, a key year in Algeria's struggle for independence from France.","This movie is an excellent artifact of the Algerian revolt against their French Colonists in the late 50's early 60's. Many reviews have mentioned how the story of this movie parallels what is going on in Iraq in 2004. It is odd that the policymakers did not notice the slight things that can turn a normal citizen into a terrorist/insurgent. It is how this country was founded There are no faults with this movie. The transfer from Criterion is perfect. It shows how an occupying force wins the battles but loses the war. This film is honest, and balanced, it's so real it's almost like a documentary. As this was made more than 40 years ago, I think a younger audience would benefit greatly from this masterpiece. The movie mentions a relative calm between 1957-1960 before demonstrations and further activism finally forced the French to leave. Though not explicitly stated, I would not be surprised if being aware of other African colonial states gaining their independence in that same time period served as inspirational catalyst to inspire a new leadership to take the place of the individuals primarily the focus of this movie focused mainly in the 1950s. Done in a near newsreel documentary style this film does show the power of struggle for independence on one hand, and the desire to maintain colonial authority on the other. I highly recommend this film.",
171,20 December 2010,amonamarthyigit,7, A guide for Iraq and Afghanistan,"The movie battle of Algiers is so realistic that one may think that the movie is actually a documentary. The filmmaker is so unbiased, he does not take any side that I can't really tell who is the protagonist, the baddie of the movie? The Algerian resisters, who make terrorism to achieve their goal, or the French, who colonized the Algerians. Filmmaker does not make the mistake to portray the terrorists as caricature characters. Movie does not make a mistake like romanticizing the terrorists neither. It just shows the mindset of terrorism, under what circumstances a person would commit such crime? ",
