Review_Date,Author,Rating,Review_Title,Review,Review_Url
0,3 August 2021,Fella_shibby,10," It's hard to make a good movie, even harder 2 make a good movie wth historical authenticity bt the hardest of all is 2 make a good movie with non-professional actors who had..",..who had lived through the real battle.,/
1,11 August 1999,Sigmund,8, Excellent movie,"I ask myself why we never see these kind of movies on TV, instead of airing again and again the same old lethal weapons, jurassic parks, and other similar stuff? This is real cinema, this is why it is considered a form of art!",r
2,27 October 2020,Xstal,9, The Hypocrisy of Occupation...,"You will struggle to find a better argument to dissuade budding and existing occupiers of territory they have no legitimate claim to embarking on, or continuing with their despotic occupations of populations and their lands. The people of Algiers demonstrate as determined a will to overthrow their oppressors as their oppressors had demonstrated just over a decade previously in their fight to regain their freedom from tyranny. It is however, the gripping presentation of a reality into a thoroughly convincing and believable portrayal of that reality that grabs the audiences attention, giving it longevity, linking it to future conflicts, keeping it relevant. It leaves you questioning what you would have done under the same or similar circumstance, while juggling the difference in semantics between freedom fighter and terrorist and considering the situational similarities that currently exist in the world today.",e
3,7 September 1999,Spuzzlightyear,10, A Brilliant War Film...,"Just when I thought I was starting to hate every movie in sight, I had the amazing priveledge to watch ""the Battle Of Algiers"" which is this amazing account of the oppression of the Algierian people by the French in the 1950's. ",v
4,21 February 2000,ryzzard,10, A savage war of peace.,"An historian writing about the Algerian war against the French colonial authorities entitled his book ""A Savage War of Peace"". ""The Battle of Algiers"" provides many answers to that enigmatic title. It does not attempt to show us the entire war but centers on the city of Algiers. Even though you are told at the beginning that no documentary footage is used it is at times hard to believe as many of the images you see have a stark and often unsettling reality to them. Considering that this was a co production between Algeria and Italy the film is remarkable in that it does not turn itself a political tirade by taking sides. Instead the camera is a sort of neutral observer allowing us to witness events that spiraled from individual demonstrations to a full scale war of savage intensity. French officers who fought the Nazis a few years before degenerated into the mode of their former enemy while Algerians had no problems exploding bombs that would kill their own people. The camera shows no heros or villains but humanity in its darkest forms. This is a powerful film with superb direction and cinematography. It truly is one of a kind and once seen will never be forgotten.",i
5,31 May 2008,claudio_carvalho,10, Powerful and Impressive Masterpiece,"In 1954, the National Liberation Front of Algiers shots many French policemen beginning a movement for the independence of their country; in return, the Chief of Police plants a bomb in the Arab quarter, killing many dwellers. The NLF sends three women with bombs to two bars and the Air France office in the European quarter, killing many people. The French government sends the military forces under the command of the abusive Colonel Mathieu (Jean Martin) that does not respect the human rights and uses torture to destroy the NLF command. In 1962, the Algerians finally achieve their aimed independence.",e
6,4 October 2003,jazzest,8, Masterpiece with Historical Accuracy,"Capturing a historic incident/moment with extraordinary accuracy makes a film truly beautiful, painful, and masterful. With the tradition of Italian Neo Realism and French New Wave - i.e. shooting in location and casting nonprofessional actors, The Battle of Algiers harshly seals the ugly realities of both French Legion and Algerian Guerillas - i.e. indiscriminate bombs, tortures, and scapegoats. Ennio Morricone composed one of his early successful scores.",w
7,14 March 2010,lastliberal,9," We aren't madmen or sadists, gentlemen. We are soldiers and our only duty is to win.",This film received Oscar nominations in 1967 and 1969. First time I have ever seen that.,/
8,27 December 2004,Epaminondas,10, Best historical film ever?,"Battle of Algiers might well be the best historical film ever. It stands out as a splendid work of art, as an extremely accurate depiction of a specific time and place, as a political hymn to independence, and as a thought-provoking philosophical reflection on violence, and on the relationship between ends and means.",r
9,29 June 2015,mbouchagour,9, I can't be objective !,"As Algerian, I watched this movie 2 times a year for 20 years, this movie is a part of my story. It helped me to put imagines and sounds to stories I heard from my teachers, cousins, as my grand-parents and my parents still can't talk about that horrible war.",w
10,21 February 2014,SnoopyStyle,9, Great and important movie,"It's from 1954 onwards in Algeria and there's revolution in the air. This docudrama takes on history from both sides. Col. Mathieu leads the french forces. They are using all methods to try to stop this french colony from the hands of the revolutionaries. On the other side, Ali is an illiterate hustler always in trouble with the cops. He is recruited into the revolutionaries after spending 5 months in prison.",4
11,16 March 2010,Hitchcoc,10, Much Like Today,"As this film unfolds, we have a sense that things are happening before our very eyes. The movie is so documentary-like as to seem like a stationary camera has been set up in the midst of turmoil. The French imperialists are the reason all this is happening. Obviously, years of ""rule"" make the day to day existence hard to change. Do all the Algerians want an overthrow of French rule? Probably not. Maybe not even a majority. As the rebels blow up restaurants and airport waiting rooms, the police are torturing the rebels. It becomes a cesspool of the lowest form of human degradation. And yet, what else can be the answer when a single entity has such a foothold and ultimate military power. As is usually the case, attrition does the job. With our current situation in the Mideast and Afghanistan, will we find ourselves reproducing what happened to the Russians? Unfortunately, there are no easy answers because the fight is against oppression. The kicker is that there is so much human and economic expense involved in these situations that often it takes centuries. We need to ask ourselves what is gained and one cannot put a price on the human soul. This is a masterpiece of movie-making should be seen by any who think revolutions are clean and the enemy is easy to define.",7
12,14 April 2005,The_Void,4," Cold, brutal and hard to connect with","The problem with films like The Battle of Algiers is that while they offer a stark portrait of a true-life event, they also lack any kind of emotion and so connecting with the film is not easy. The film follows the events of the revolution in Algiers, but doesn't give you much of a story as to why it happened and so prior knowledge of the event is required from the viewer. I know practically nothing about Algiers, so this wasn't a very good aspect of the movie for me; and through it's lack of emotional connection; I can't help but think I'd have been better off watching the news or a documentary on the subject. The Battle of Algiers is unpleasant throughout, and we watch as coffee shops are blown up and the French Foreign Legion tortures the locals. Like Henry: Portrait of a Serial Killer, this film begs a question of it's viewer - namely, why are you watching this? However, while Henry had the whole 'slasher' craze on it's side to help answer the question - the events in this film are far more brutal than those in Henry, and are also on a far larger scale. Not to mention far more tragic, as they definitely did actually happen. Couple this with it's lack of an emotional side; and we have the question; indeed, why ARE you watching this? It's not entertainment, that's for sure.",2
13,22 September 2012,Theo Robertson,10, Can A Mere Movie From 1966 Influence The 21st Century ? Maybe,"What everyone forgets nowadays is that the French contribution to counter insurgency warfare was "" The ink spot strategy "" which was very effective against the Viet Minh in the early stages of the French Indo-China conflict 1946-54 . The same strategy was used most effectively by the British in Malaya in the 1950s where it crushed a communist insurrection , though it was painfully ineffective when the Brits used it in Afghanistan 50 years later . We can all remember the hurtful comments about France being shouted from The White House during Dubya's era but didn't stop the irony - if not out and out hypocrisy - of the same politicians watching this film in order to pick up a few tips on counter insurgency warfare in Iraq and Afghanistan ",3
14,11 March 2005,rosscinema,9, This film attains a level of importance that has never been achieved before,We all go to the movies because we love to be entertained and it's hard to argue that it's the greatest form of entertainment but when serious viewers talk about film in terms of being important you would have to expect this title to be instantly brought up. This film covers the years from 1954 to 1962 in Algeria when the Arab section of Algiers started an uprising to fight the French and gain their own independence. Ali La Pointe (Brahim Haggiag) is a petty thief and hustler and when he gets out of jail he teams up with El-hadi Jaffar (Saadi Yacef) and together they form the Algerian National Liberation Front (FLN) in which they start terrorist attacks.,8
15,7 July 2019,bkoganbing,8, France's illusion,"Told in a brutally realistic style The Battle For Algeria is the ultimate in docudrama. Italian director Gillo Pontecorvo made this film with a bit of distance
between the French-Algerian War post World War II. Pontecorvo skillfully uses
documentary footage to blend in nicely with the story he shot. You think you
are getting an inside look at the war.",2
16,9 May 2005,osteodude,10, learn from the history it conveys,"If one has not seen this film, one cannot begin to imagine Pontecorvo's extraordinary achievement. The acting is so natural and convincing that many viewers and even some critics assumed that the movie was a documentary. Only a master director could have taken this raw acting material and gotten such performances out of it. And despite his leftist viewpoint, Pontecorvo neither ridicules or demonizes the French, as does Michael Moore the Americans in his recent putative documentaries Bowling at Columbine and Farenheit 9-11 - though I do a disservice to Pontecorvo to compare his work to that of Moore.",8
17,29 August 2022,christopher-underwood,8, the two hours go fast,Although most of Gillo Portecorvo's films are usually documentaries and in this fantastic one it is clearly reconstructed and with the grainy newsreel looks as if it is real. The two hours go fast and because the story is so well told that we watch the amazing streets and alleys and steps of the wretched white buildings and the Casbah. There is also the rather brutal French occupiers and their torture methods. The Italian style we know as neorealist and it works so well that we think that even of the thousands of people we can hardly imagine it was not really we have actual seen in the streets. It is all so terrible that we begin that maybe the bombings and shootings by the Muslims have our sympathies and we certain have the wonderful music of Morricone.,/
18,28 February 2023,jordondave-28085,8, Groundbreaking docu-drama,"(1966)The Battle of Algiers/ La battaglia di Algeri
(In Italian, French, Arabic with English subtitles) POLITICAL DRAMA/ DOCUMENTARY",?
19,3 June 2006,Quinoa1984,10," as fitting a tip-of-the-hat to Rossellini's post-WW2 work made in the 60's, and them some","A couple of times here and there watching Gillo Pontecorvo's The Battle of Algiers, winner of the 1966 Golden Lion at Venice, I thought off-handedly (maybe with a smidgen of sarcasm), 'this is probably one of the top 5 favorite films of like Rage Against the Machine or something'. It's not without saying though that once the film was over, and watching a bit more on the extra features on the DVD (with other directors shining light on their opinions on the film), that most of what I saw sunk in a little deeper. This is one of the best kinds of documentary-style dramas made in its time and place in the world, and goes a bit further in the right direction from Roberto Rossellini's post-war trilogy. While it's not unlikely to see Pontecorvo's own influence from the neorealist maverick, it's also likely to see how Pontecorvo takes this very emotionally charged, as-factual-as-possible story of Algiers versus France in the mid 1950s with an assured balance of pathos and style. It also works tremendously as a kind of 'statement' movie, without at all pushing it down the viewer's throats. It does have a viewpoint, as do most films, and here and there it definitely does drive home the point of the Algiers' need for freedom from the militant oppression of France.",r
20,6 September 1998,pecci,10, astonishing...,"Just a few words for 'La battaglia di Algeri'. Watch it! It's astonishing, fast, dramatic, crude, real, touching, historically accurate. To everybody who wants to know more about Algerian civil war: buy it, find it..!",e
21,16 February 2001,Anonymous_Maxine,10, The Birth of an Algerian Nation.,"The Battle of Algiers is a very unique war film. It is a documentary-style depiction of an uprising in Algiers against the French, and has the rare distinction of being told partly from the point of view of the radicals who, in this case, were terrorists. The film is very informative because, unlike most war films, it is told alternately from multiple points of view. This switching back and forth between several different perspectives provides a unique experience in watching the suffering that went on in Algeria during that nation's struggle for independence. ",f
22,19 November 2017,classicsoncall,8," ""...it's hard enough to start a revolution, even harder to sustain it, and hardest of all to win it.""","Once you become absorbed in this film, there are times when you accept it almost as a documentary. Having no knowledge of this aspect of history, I thought the picture did a good job of setting the table regarding the French-Algerian conflict with a roughly decade long running history of violence and terrorism involved on both sides. What seemed overwhelming was the amount of destruction. Though obviously staged for the film, it looked like the events were real and lent a surreal quality to one's viewing. More than anything, one can't help feeling that what we see in the world today in the Middle East or in terrorist affected locations around the world, that there's nothing new about war and conflict. Violence sparks retaliation in a never ending cycle while the ideologies that drive that violence is never compromised by opposing forces. It doesn't make for a lot of hopefulness for the human condition.",_
23,16 April 2007,evanston_dad,9, An Astonishing and Authentic Examination of Terrorism,"Wow, ""The Battle of Algiers"" really could have been made today, couldn't it? ",=
24,14 June 2022,gajthi,8, Who is good or bad?,I feel without pretext it's hard to side on anyone's side immediately.,t
25,23 February 2007,DKosty123,9, Blueprint For the United States Future?,"Usually, films in foreign language with sub-titles are not something I'd watch. I am sure glad I watched this one. The film is based upon a true story.",t
26,14 December 2021,calspers,8," It's hard to start a revolution, harder to continue it, and hardest of all to win it","""La battaglia di Algeri"" (1966) directed by Gillo Pontecorvo is a deeply impressive and entertaining film.",_
27,23 October 2007,ackstasis,8," ""We aren't madmen or sadists, gentlemen we are soldiers and our only duty is to win.""","When 'La Battaglia di Algeri {The Battle of Algiers}' premiered in the United States in 1967, it carried a disclaimer, assuring the audience that ""not one foot"" of actual newsreel footage was used in the compilation of the film. This should give you some idea of the picture's startling documentary-realism. It's plain that director Gillo Pontecorvo began his career producing documentaries, and it is thoroughly exciting to see him exploit his knowledge of the medium to achieve incredible resonance through its brutal and frank depiction of an anti-colonial revolution. There are countless moments when you could swear that Pontecorvo made use of historical footage; surely such a passionate rally comprising hundreds of people could not be recreated so flawlessly for the screen. The camera sits amid the protesting civilians, is jostled by the crowd, reacts frantically to the spatter of machine gun fire, and trembles with each horrific street bombing. Accompanying these images booms a suspenseful musical score, composed by both the director and the great Ennio Morricone.",u
28,24 January 2003,chthon2,10, Surprisingly Unbiased,"As a second generation Algerian immigrant to the states, I am familiar with Algeria's history.  So, when I heard this way made by the Algerian government, I was expecting a typically biased propaganda film.  I was wrong - very wrong.",r
29,20 October 2020,brogmiller,9, To win the battle but lose the war.,"The list of those who signed the 'Manifesto of the 121' of September 1960 calling upon the French government to recognise Algeria's right to independence is impressive indeed. One of the lesser known signatories is Jean Martin, an actor who had fought in the French Resistance and served as a paratrooper in Indochina. Putting his name to the Manifesto cost him his job at the Theatre National Populaire.",v
30,9 July 2006,planktonrules,8, very good but oddly filmed,"This is a documentary-like film about the Algerian revolution against the French in the 1950s and 60s--though 95% of the movie is set between 1956 and 1957. At first, it appears to be a documentary-like film about a revolutionary named Ali Le Pointe. It follows him episodically from his teenage years, to his joining the FLA (the Algerian Independence group) and follows many of his terrorist exploits as well as those of his compatriots. However, despite this being the focus, the film then diverges towards other characters and even after Ali's death, the film continues--giving spotty accounts all the way up until their independence in 1962. While the film is greatly admired and it does seem to show both sides of the equation, it looks as if the film was made by two or more directors and then pieced together, as the focus and style of the film changed repeatedly. While this doesn't undermine its overall impact, this keeps it from being a truly great film.",
31,16 December 2004,FilmSnobby,7, Scandalously relevant.,"I disagree with the comments here stating that Gillo Pontecorvo's *The Battle of Algiers* is an even-handed account of the Algerian uprising in the Fifties. I had always thought, perhaps simple-mindedly, that the movie was clearly on the side of the denizens of the Kasbah. After all, the script was inspired by the life and activities of a FLN leader who also literally acts in an important role in the movie. Seeing the movie again -- via Criterion's absurdly lavish 3-disc (!) edition -- did nothing to alter my opinion, though it DID provoke some new perspective on why the movie may SEEM even-handed.",
32,13 January 2004,sol-kay,9, Algeria 1954-62: A history lesson on film,"******SPOILERS****** The place is Algiers, the time is August 26, 1957 and the person involved is Ali La Pointe an FLN, National Liberation Front, leader trapped in a building with his men and given an ultimatum to surrender by the French military or end up being killed.",
33,7 July 2019,drjgardner,7," Photography yes, Character development no.","The film has some of the finest photography anywhere, making it look like a documentary instead of a film. But where it break down is in the character development.There is no one to whom we can feel much of a connection, partly because the film virtually follows no one and what we do get are mere sketches of people.",
34,27 February 2014,gavin6942,8, The Battle For Algiers,An account of the bloodiest revolution in modern history.,
35,30 November 2007,dwpollar,6, Fascinating portrayal of Algerian revolution...,"1st watched 11/30/2007, 6 out of 10(Dir-Gillo Pontecorvo): Fascinating portrayal of Algerian revolution in the late 50's and early 60's from France's occupied police-rule. This is one of those movies that takes you places American audiences aren't used to seeing and brings you a perspective that is sometimes hard to swallow. This is a very good recreation of a true story about a country of people who will go to all means to bring about their independence including terrorist bombings on innocent people to get their point across. For us, it's initially hard to determine who are the good guys and who are the bad guys because both groups use similar methods to try and control the other group. The movie starts in the middle of the conflict(it's really not a typical battle) at a point where a member of the rebellion after being tortured gives away the hiding place of the last leaders in the city of Algiers. It then goes backwards to the beginnings of the rebellion and kind of shows how the main core of the group is formed and where they came from. There is an obvious slant toward the Algerian rebels despite some of their not so kosher cleansing process and terrorism tactics, but their oppression from the French government is shown as needed to be toppled at any means. The movie then continues up through the initial scene until the eventual independence that occurs, but not without many casualties. This realistic, documentary-like movie does not back away from actual violence and it's after-effects, but keeps us interested with a linear American-like story. There is definitely a little lacking in the portrayal of the characters at the expense of the story but overall it keeps your interest. The movie is definitely not like most battles, but instead is a calculated series of incidents done by both sides until someone has to give in. Eventually the French find all the leaders in the rebellion in the city, but the rebellion leaks to the countryside where it wins out in 1962. Again, the interest of this movie for me was learning a new society, it's history and it's ways more so than seeing an action-filled movie experience.",
36,15 December 2011,nanana-batman,5, Terrorism,"I'll be the first one to knock this film off its pedestal. Though, it may be under the context of which I was watching this film that made me unable to connect with it. 1966 neo-realistic film that had a very specific feel to it. Something I could appreciate was that no actual documentary footage was used in this film, but some scenes sure felt very real in a way that put the viewer right in the middle of the action. Based on the Algerian revolution of 1962. But the grit and grim of this film never brought me to sympathize for the rebel Algerians. I never managed to be won over by the ""others"". At least not whilst bombing innocent civilians. I felt no remorse for any of the fugitives and therefore couldn't find myself enjoying this film.",
37,14 June 2017,Vartiainen,5, Arouses interest,"The French have controlled Algeria since the 1800s, but things finally boil over in the 1950s and the French army has to be called in the quell the uprising of terrorism, led by the FLN (Front de Liberation Nationale). And yet the movie is not about the fight against terrorism. Or, it is, but it's also about the fight against foreign invaders and occupiers.",
38,7 July 2019,Mike_Yike,6, A Review For the Average Movie Buff,"I was completely unfamiliar with The Battle of Algiers until I saw it on TCM, and watched their hosts give it a glowing appraisal. My review will be for the average, amateur movie buff. Here it goes...",
