Review_Date,Author,Rating,Review_Title,Review,Review_Url
201,15 June 2009,TiiuLoigu,8, Neo-Realism at it's best.....,"This is an awesome film we watched in my Film Studies Class. I learned about the French Colonization of Algeria, which I never studied before. This is one of those educational films that can be mistaken for a documentary. One could be fooled that there is no stock footage whatsoever in this movie. Director Pontecorvo was very successful in creating a Neo-Realism classic. The tone of the movie is a balance between rational for resistance and rational for colonization. There is no controversy, but plain historical facts. A nice change from all the controversy in the media. What an excellent movie to show in History classes worldwide.",
202,5 March 2007,amertaj,10, justice with work,"The excellent execution of the movement in the moment of cinema, the director knows how to do justice with the film, Masterpiece no doubt about it, the statement is so bold , he play neutral and shows both sides very wisely, and viewers get involved in all moments without knowing....EXCELLENT my compliments to the great director Mr.Gillo Pontecorvo , i think every new director should study the movie . The Film is so real that sometimes viewer think that some scenes are original,hundreds of people marching, tanks, police and the blast scenes are very original when there was no green screens and VFX at that time, the story the performance of non-actors from directors point of view is excellent, the expressions of people, the mood, the scenario, the music its a combination of all art forms together. Gillo Pontecorvo is one of the great director in the history of film making no question about it.",
203,15 December 2011,migueljennifer,10, Objective filmmaking,"Interesting film, maybe a little confusing for audiences unfamiliar with ""independent filmmaking"". The story is so well told that you don't even need to understand the language to get it.",
204,15 June 2009,simoneawalters,8, Rich in the struggle for culture and complexity,"The Battle of Algiers is a deep and enlightening film that shows the struggle of the Algerian people fighting for equality and the freedom to maintain their culture. Even though the French brought technology and civilization in a so-called ""peaceful"" way, the need to control another culture is never a great idea and that is truly displayed in this film. The film had a new realism style created in the most authentic manner possible and many of the actors were actually citizens that had experienced the struggle that the French brought to Algeria. Ali La Pointe, the main character of the film, is illiterate and displayed as a criminal in the beginning of the film, but ends up being one of the main leaders of the Algerian civilians revolt against the French as they fought for freedom.",
205,13 June 2011,noelleuytuazon,10," ""Survival of the fittest"" -- the driving force of terrorism","It is so critical to be the leader irregardless of which side you are on. I felt as if both the French in particular Col. Mathieu and the FLN leaders, the Algerians were forced to engage in evil in order to create some form of good that is deeply rooted with freedom as well as cultural identity. Behind the uprising for the Algerians lies nationalism and behind the French lies the ideals of colonialism.",
206,15 December 2011,kaliteyart,9, Interesting point of veiw,"I enjoyed this film because I finally was able to witness the other side to our never ending battle on terrorism. Although this depicts Algiers revolt from the French it's similar to the what's being played out in the Middle East. Living in America, the word terrorist is now associated with people who want to destroy American freedom. I've never been a fan of this idea and always was interested to learn more about the other side, the people who never get a voice. Although I didn't agree with either side in this film, it was interesting to see a more objective stance that almost felt like a documentary. There are shots that feel so real, it's a little uncomfortable, which I guess is how it should be. This film isn't for everyone; it doesn't have an obvious bad or good guy and also doesn't have a set protagonist. Although Ali La Pointe is supposed to be the protagonist, it's more about the people as a whole and their struggle for freedom. It's an interesting film that definitely sheds light on present matters as well as historical ones.",
207,20 December 2010,itzpencil,8, Great movie,"Battle of Algiers was a great movie that portrayed the struggles of the Algerians for their freedom. The way the movie was filmed made it so that I couldn't tell who the bad guy and the victim was. The movie equally showed the destructions that each side caused without much bias on each side.The scenes where each side were bombed by the opposition, they were both filmed in a way that you would sympathize who ever was on the receiving side. This made it even harder to pick a side, which let me really question the justice of the uses violence in those circumstances on either side. Even so, I sympathized with the Algerians because, I am an Korean-American, and because Korea went through similar oppression by the Japanese. Another great aspect about this movie was how realistic the shots of the attacks were. For example the scene where the racing track was blown up it was so realistic that it made people think that the movie was a documentary. A scene that caught my eyes the most was the scene where Ali is tripped by a Caucasian man and they exchange a very intriguing stare. Even though Ali was on the floor, his did not waiver as he stare into the Caucasian man's eyes. I thought that this scene was a great metaphor of the relations between the Algerian and the Americans as a whole. Because even though the Algerians (Ali) is oppressed by the Americans (Caucasian man), the Algerians don't lose their pride and fight on to regain their freedom.",
208,13 June 2011,alessiopeterson-990-834100,10, Great Film,"""The Battle of Algiers"" is one of the most realistic film portrayals of war that I have ever seen. The story accurately portrays both the atrocities committed by the French colonizers and the horrors of modern terrorism used by the Algerians. The film is so important because of its unbiased approach, which is most likely a direct result of hiring the Italian director, Gillo Pontecorvo, to shoot the film. Pontecorvo shot the film as realistically as possible and it more closely resembles a documentary film rather than a war film. The recreation of the events in Algeria feels more authentic than any film I'd seen. Since the film uses mostly local and unknown Algerian actors in the streets of Algiers, you truly feel that in some moments you are apart of the film.",
209,15 March 2019,jannyk-52236,4, Battle of Algiers,"The second half of the movie that I saw was alright. It was mostly in French with some Arabic and English subtitles which was annoying but I'm glad it wasn't dubbed? I think this film was a useful educational resource which is probably why Mr Scafidi made us watch it. He also made us watch is because our current unit is on decolonization, more specifically the decolonization of Africa, and this film is about decolonization.",
210,10 June 2011,bigblu-77-926509,7, Review of Battle of Algiers,"Watching this movie, I felt an emotional disconnect. I had no empathy for the plight of the Algerians because the movie made very little attempt to show their plight. You are thrown some facts about Algerians being unhappy with French rule, given a flavor of their mistreatment at the checkpoints, but beyond that, one sees little of what is causing the unrest and cannot make an emotional connection with the characters. In fact, for me, the main character was not likable. At the end of the movie when it states that the Algerians won their independence, it is a purely intellectual process where you think, ""that's good,"" and have zero emotional response. On the other hand, you wonder why the Algerians chose violence as the first resort instead of a peaceful strike, and you are left with a feeling of disdain at the barbaric nature of their resistance. Violence should always be the last resort and should only be in self defense. Of course, one could argue that the French placed the first bomb, but that was a rogue bomb placed for the sole purpose of inciting the Algerians to violence so that the French would respond in kind. For me, the takeaway is the age old message that two wrongs do not make a right.",
211,11 June 2011,sotoduel,9, A movie that hits close to home,"The greatest irony of this film is how similar it is to our ""war on terrorism."" If you think of the french as Americans and the Algiers as the citizens of Iraq, one can't help but to realize that we're doing the exact same thing as the French and that the terrorism being brought upon our soldiers is nothing more than retaliation from a people that refused to be conquered. If Bush had watched this movie from beginning to end, he might have revised his invasion of Iraq. This film does a brilliant job of telling us what happens when you try to dominate people. The Battle of Algiers doesn't favor either side in the film, as both are doing some deplorable things, but the message that reached me in the end was that people can't be conquered. The film doesn't shy away from its realism as it confronts the conflict with brutal honesty. None can say that either side is truly good, when you see the evils they both commit, but you can at least realize that there's a reason for every action and to not label things as good or evil. The movie is an intense experience that will make you question what's right and wrong.",
212,13 June 2011,ce_petit_coeur,9, Clever depicts the vicious cycle of war,"Gillo Pontecorvo cleverly and calculating depicts the Algerian War. War is an endless cycle and a tough subject to depict. It is anything but glamorous, and should be understood by both sides. Ali is a depiction of a strong character that would stop at nothing for the freedom of his people. Our eyes are opened to the vicious cycle of war and what goes on in a country seeking independence. Other countries and cultures can relate. It is no surprise women and children participate in the Algerian resistance. ",
213,5 March 2006,rckspnn,10," Riveting, passionate, a love letter to revolution!","There will probably never be a more compelling film about revolution than Battle Of Algiers, and if you haven't seen this masterpiece then run out and get a copy of the Criterion DVD. Part of what makes it so incredible is that it was shot in Algeria soon after the revolution with members of the revolutionary party in the development team and in the cast, so it's a narrative film with a documentary's realness. What makes the film so powerful is the city and the people itself, you can sense the anger and the hope. And strangely the film can even make you empathize with the most diabolical acts of terrorism. Now, is it as unbiased as everyone makes it out to be? I don't think so. I think it is pretty favorable to the revolutionaries. Even though it shows sympathetic characters on the side of the French colonial forces, the presentation is still weighted heavily on the side of the revolutionaries. Regardless, it is a marvelous film.",
214,13 June 2011,binasandrew,8, great film!,"Amazing storytelling and editing throughout this entire movie. It made me feel like half of what I was watching was real, even though it said that these images were fake. The way this film is made you can see the tension in the air as each power hungry country does whatever they can to gain control. ",
215,23 November 2006,dherbtucker,10, Long live!,"BATTLE OF ALGIERS (1966) So much has been said about this already and there are some excellent, insightful reviews on IMDb. But I'm here to urge anyone who's not seen this to do so, and soon, for four reasons: 1. The obvious relevance in 2006 - an Arab nation fighting against occupation (I mean Palestine as well as Iraq), vivid depictions of terrorist attacks and military torture, reminding us of what is going on every day in these countries. But also. . .",
216,13 June 2011,RADmovies,10, Right To Revolution,"An explosion of revolt from years of underlying religious persecution, racial discrimination and attempts at cultural colonization. Battle Of Algiers showcases the pulse of racial tension as the Algerian people begin to fight for their independence from French occupation. It is a true test of character to give up control for another's freedom and the French are definitely not portrayed as compassionate people in this film, but rather rational when the Algerians are left to act irrationally out of desperation and a place of extreme emotions. The actions of both sides heinous but the really atrocity comes from the act of insubordination. Making others feel dehumanized and inferior alone would be cause for revolt. This film speaks to a person's soul and truly makes me appreciate freedom to choose my religion and carry out the traditions pertaining to, without judgment or persecution. Shot as if it could've taken place in real life, you see both sides take a stand, who would you side with? Watch this film to experience a fight for the right to life!",
217,19 June 2011,beyzasahin-79-531417,10, either freedom or death,"Even tough the director of the movie neither french nor Algerian it is more on the Algerian sight since I felt more empathy towards Algerian sight. Yet some parts of the movie gives tips about the Algerian culture but it doesn't fulfill the theme or philosophy under it for example when Ali la Pointe says Hasan ""I only afraid god"" it is because Muslims are taught to be afraid of god but it is not the afraid in literal meaning. To be afraid of god is if one do something wrong he/she looses the god's compassion and consent . The earth born people are not the subject of to be afraid of so you don't have to lie or do wrong on a purpose of being threatened feelings. how these people kill the french then? because it is permissible to kill to defend your country in Islam. Further more it is the highest rank to die as a veteran for your country. Veterans are the most respectable and sensitive points of Muslim cultures. More over, the reporter's voice saying that that the Muslim's echoing with those unintelligible and frightening rhythmic cries is actually called ""zilgit"" . conversely what reporter defines zilgit , it is actually thrown at the weddings or folk dancing . it is basically the sound of the excitement of happiness or ecstasy of being together or celebrating something with other people. it is the sound of sharing a common excitement together. the french reporter saying about zilgit as unintelligible sound is very alien definition . Eastern Muslim people act mostly emotionally and so called"" unintelligibly by western mentality. Algerian people is absolutely oppressing at the casbah and being torched at the prisons Algerian people is considered as an ignorant and uncivilized people by french . Soldiers laughs at the man drooping mouses out of his box .it is obvious that they are less developed in technology and science as other Muslim countries but their immaterial world is more developed than french even tough french don't realize it. such as their pride and woman's dignity is their dignity either they know that woman or not it's a divine matter. These people live for their dignity . that's the reason Ali la Pointe hit the guy instead of running away police. They have a sad state of freedom in casbah and considered as a link or number but human by french. they are torched killed oppressed. The psychological battle is as intense as physical one. french mostly announce or dictate that NFL is nonfunctional and announce the names who were captured. on the other hand even a child believes their freedom battle he sneaks and takes the microphone and courage people. NFL was been dissolved but they throw themselves to the roads with the cloth flags and making their body a bulwark because It's this way: being captured is beside the point, the point is not to surrender.",
218,13 June 2011,paigehester92,7," ""The Battle of Algiers""","Luis Bunuel's ""Los Olvidados"" is the perfect portrayal of how redeeming souls can slip through the cracks of a bankrupt society and neglectful parents. Pedro wanders the streets of his desolate village, making friends with local thugs and is openly abandoned by his mother who conceived him out of a rape. Bunuel effectively creates a character that has no redeeming qualities until he lands in the hands of a caring principal who runs a rehabilitation center. Near the pinnacle of ""The Forgotten Ones,"" Pedro finds himself on a path to possible self-actualization. While in the confines of ""the farm,"" Pedro fosters goodness that lives within. He's sent on an errand for the caring principal outside the confines of the rehabilitation center, and it is at this point that Bunuel sends the strongest message: we are victims of our society  at least some of us are; others simply stand by and witness the raping of salvation, which is one of the more poignant scenes. Bunuel breaks the fourth wall and flips the camera onto the viewer, forcing the question ""How many redeeming souls have you seen fall prey to world around you?""",
219,13 June 2011,lqtran,8, The Perseverance of a Minority,"The Battle of Algiers displays a minority's will to preserve its traditional way of life. The Algerians live in a Casbah, a native Arab quarter. The French engages in the colonization of Algeria, which in turn leads the Algerians to form the FLN, the Algerian resistance of French colonization. The UN has the power to enforce the French patrol to leave or stay. Both the Algerians and French fight for the side of the UN. The Algerians revolt by planting bombs in public places and gunning down French officers. The Algerians are angered that they can't live the way they would like in their own native land. The Algerians can't even marry outside their community. The movie ends with the death of Ali La Pointe and others, but the creation of the FLN sparked the beginning of Algerian independence that would come a few years later.",
220,7 March 2017,zcbensel,8, Masterful Work of Politically Minded Filmaking,"A well structured, written and performed piece of cinematic legend. The lack of familiar faces in the cast permits great immersion and sense of realism. Shot choices and composition are fantastic and tonally perfect for the film. Editing is tight and gives depth to the script. Shows the good vs evil dynamic of rebellion and the cost of ""doing whatever it takes"" for freedom, and the fine line between governance and fascism. ",
221,14 June 2011,sweetsamry,10, A learning experience,"I learned so much from this movie. I learned how revolution is started and kept up, I learned what Algeria went through to gain there Independence, I learned how the French tortured people to gain information that would bring the revolutionists down. To me this was a very educational movie. I really liked that the movie had a feel of an real life shots it made the experience very real for me. Message was very clear, all the people wanted was there freedom. Politics was never my strongest point in life, could never really understand it, but this movies made a few things clear for me and educated me. I enjoyed watching the movie and would recommend it to anyone.",
222,17 August 2004,Pvt_Joker,10, The best revolutionary epic ever made! **** out of ****,This is simply the best revolutionary epic ever made. It got 3 Oscar nominations and the top prize in Venise festival. Even the Pentagon screened it in 2003 to study how revolutionary movements start and see how they develop.,
223,15 December 2011,Samantha_Ross,6, Not For Me,"Perhaps it was the black and white, or the content, but this film was just not for me. I struggled to stay awake during the film,( though that might have been due to a long week and too much to do). I could not relate to it in any way, and, in my opinion, films should be relatable. In addition, it was difficult to watch the violence. The story did not interest me, as most other historical films do. It was meant for an audience that did not include me. ",
224,21 March 2005,ccctander,10, Like Iraq,"Iraq has a long history of being subject to colonial occupation and exploitation, since the 1920's. England and France carved up the Middle East at the time, Western oil companies started moving in. Saddam Hussein was supported by the Pentagon in his war against Iran.",
225,15 December 2011,kwaaade,8, very relevant film.,"The Battle of Algiers is a film which should really be seen by everyone. This year's Arab Spring and Occupy protests make the themes which were presented in the film just as relevant today. An aspect of the film that I really appreciated was its unbiased presentation of the conflict between the French colonizers and the Algerians that they were going to great extents to oppress. Another aspect which I found astounding was that there was not any documentary footage that was used. The unbiased presentation of the issue led me to have an unbiased opinion on the matter as well; sure, the French were definitely wrong for colonizing Algeria, but I also feel that Algeria was going about things the wrong way. Viewing the film can be beneficial in the sense that it would help others in their pursuit of revolution.",
226,12 March 2005,icemandylan,10, Amazing!!!,This may be the most realistic movie I've ever seen. The acting and cinematography make it seem like it was filmed while it the actual events occurred. Pontecorvo couldn't have made a better film. Forget Spielberg and Scorsese. Forget Hollywood. This is real cinema.,
227,16 December 2011,dwejbe,5, Hard to understand,"The film ""The Battle of Algiers"" was just hard to understand. It was hard to stay awake to watch this I did not find it interesting at all.I think the Laugauge was a big part of it, I do not like reading subtitle when I watch a film, I feel like I am reading a book and i am not watching a film. I spend the whole timing reading the film then watching it so I could focus on what was going on in the film. I'm not the biggest history film guy, so if you do not like reading subtitles and you do not like history this film is not for you. I would recommend this film to someone who speaks the language which is French because it seemed like a interesting topic which was not taking any crap from anyone.",
228,13 November 2007,crushtv-1,8, Marvelous Propaganda!,"As I said, this is great propaganda, but not *perfect* propaganda. Perfect propaganda works on you without you realizing its propaganda. ""Pan's Labyrinth"" is perfect propaganda. ",
229,22 April 2019,Casual-Critic,9, Paramount Product of Third Cinema,"Considering it's European Director, La battaglia Alegeri doesn't fall into the category of a standard 1960s Hollywood Film given it's real life story, subject matter and minds behind the project.. The visceral nature of the film showing the atrocities committed by the French Military and the FLN can be quite difficult to watch. The way in which the film does not take sides or portray either of them to be 'Good' or 'Bad' shows how committed the Director (Gillo Pontecorvo) was to giving the audience a realistic account of the Revolution. With strong acting, special effects and stunning cinematography La battaglia di Algeri stands the test of time and is still one of the most important Third Cinema products and Influential films of the 1960s.",
230,15 March 2019,staciel-38432,6, Historical View,"I watched ""The Battle of Algiers"" to learn and have an insight of how Algeria got its independence in 1962. It looks realistic but the point of view of Algerians has been represented, so it might not be entirely true. I enjoyed watching it as a movie. It is a useful educational resource to discover what Algerians did and how they felt about their path to their independence.",
231,7 June 2010,psycofidget,9, The Battle of Algiers,A two sided story to the conflict in Algiers during the French occupation. A documentary style that captures the essence of the era astonishingly. Taking place in the early 60's the tale follows Ali Lapont on his route to becoming a revolutionary leader. ,
232,31 January 2021,zakimctlemcen,10, Best Algerian movie,"I watched this movie many times, it's a great movie. The best Algerian movie I have ever seen",
233,6 June 2010,MarGoLuv,9, For the ones that were lost in the battle.,"This Film depicts the French Colonization in Algeria in the 1950's. Its director Gillo Pontecorvo uses Neo-Italian Realism and a monochromatic setting to show the racial tension between the French and the Algerians. The actors are mostly Algerians, and the film is spoken 95% of the time in French. It maybe fair to say that this movie is another Conquest movie of how people of a different belief are ruled under European Ideology. This movie shows the tactics the Gorillas used to slowly one by one take down French officers. However, there is on thing that will impact you is the involvement of children throughout the film. We see children from the Gorilla side being used by their mothers as a decoyed to smuggle bombs to French own/run places. We also see the children in the places where the Gorillas bombed, and also where the French set gun fire or bombed. The Director did this to show the innocent people that lost their lives for independence. This is a movie that makes you think about the price of Freedom and who really does suffer. It's sad once you think of it.",
