Review_Date,Author,Rating,Review_Title,Review,Review_Url
910,14 December 2005,EvLauster,10," A heartwarming, uplifting take on human nature, Hanks and Zemeckis create sure magic","**** Tom Hanks, Gary Sinise, Robin Wright, Sally Fields, Mykelti Williamsin. Directed by Robert Zemeckis. Zemeckis again takes you to a magical world of heart warming devotion and true human spirit as Forrest Gump (Gentle Hanks) a slightly gifted man sees the world through one magical experience after another.Through the heart of Vietnam with Lt. Dan (Shining Sinise) and around the world to his teenage sweetheart Jenny (Wright). Hanks leading this ensemble cast that is one of the 90's greatest films and one of the most devoted films and brilliantly written by Eric Roth based on the novel by Winston Groom. Of course in the creative mind of Zemeckis the movie was bound for greatness, and showing a Tim Burton like creativity escalating to six academy awards (Best Picture non the less). My final rating 10/10",
911,19 June 2021,dhauff78,1, Most overrated movie of all time,"Tom Hanks is a wonderful actor but he didn't deserve the Oscar. Anyone could have done that. In fact, it's blasphemy this movie won best picture especially over Shawshank Redemption or Pulp Fiction. Forrest Gump is too saccharine and the quotes are too annoying and simple.",
912,12 October 2017,chissysweetz,8, Great Film,"A brilliant, inspiring film that speaks of courage, happiness, sorrow, love and loss. I liked the transition of events that took place in the film, the symbols and the ideologies. We are shown amazing character growth; it was portrayed beautifully. If you're looking for a movie that can make you laugh and cry, too, Forrest Gump is the one for you.",
913,12 November 2017,kryptoniteblaster,10, An American Classic,"Forrest Gump is a movie that everyone must watch as it reveals an accurate chronology of all the important events in the history of the United States. A good knowledge of American History helps to identify profound ideas that further strengthen the audiences idea of the movie. The story plot is developed through a series of life lessons that changes the character into being a more responsible and mature adult. The Story revolves around Forrest Gump(Tom Hanks) who is often bullied for his leg brace and his egregiousness in society. This compassionate young boy falls in love with Jenny(Robin Wright) from a very young age. One of the key points in the movie is when Forrest joins the military where the director(Robert Zemeckis)accurately portrays the mixed feelings everyone had about the Vietnam war and the consequent events that pursued after it such as the Watergate Scandal. The movie teaches a lot about the essence of American History and the events that have shaped modern society today. The story depicts an accurate representation of the rural setting and the challenges that each character had to face due to their background, identity and ethnicity. Overall, the movie is a must watch for every American and those who wish to learn the importance of American history and its implication on their lives today.",
914,10 May 2002,akon5,9, Intelligence,"One thing I wanted to get straight, the movie Forrest Gump is an intelligent film. Many of you will disagree, but that is because you are not seeing this film in the light of its full potential. I can name tons of scenes which trigger in one way or another a philosophical ideology. And I mean TONS!",
915,5 January 2023,gcbeaton-87178,10," Lifes like a box of chocolates,run and a shrimp sandwich","This film is one of the most wholesome movies I have ever watched I couldn't think of a single bad thing in this movies from the characters to the plot I could go into so much detail why forest gump is the biggest sigma of all time. My favourite part of this movie is kinda like paperman did he give up on love no matter how many times he was ditched?... no. Other than forest my favourite performance was from Gary who played lutenite Dan the character development of Dan was insane he went from a war hero to a lazy idiot to a great freind. I love how forest went from a ""stupid kid"" to a war hero to a world class ping pong champion to a shrimp fisherman to a millionaire to a person who ran across to a father just because Jenny said run.",
916,26 January 2021,NijazBaBs,5, worse than CSI tv series,"This movie is comparable to, but worse than CSI tv series like ",
917,28 January 2018,e-07239,9, ..,"I've seen this masterpiece for more than twice.I think the man's loyal, humble, honest deserve all of us to learn.Another one is that we need to appreciate more of the little things and be proactive no matter what happen in our life.",
918,24 April 2018,namanwal,7, Great storyline but not a great value promoted,"It has one of the best screenplay, storyline, acting, direction,casting. Tom hanks was at his prime as he won an oscar again next year. All the cast delivers and fulfils the character's requirements. But it actually promotes the value of giving up and run away. Run away is the main highlight of movie. The character's girlfriend tells him to run whenever he faces a problem. Thats a wrong thing according to me, as it promotes giving up. I won't support it.
But one can watch the movie for a good story, acting and screenplay.",
919,2 August 2005,SeminolePhenom,10, History has never been as much fun as Forrest Gump made it!,"The humorous, but yet heartwarming tale of a man named Forrest Gump(Tom Hanks) who tells the story of his life to random people waiting for the bus. Forrest Gump, who has an IQ of 75, lived the life that can only be imagined but yet still finds his greatest joy with his childhood friend Jenny(Robin Wright Penn).",
920,11 June 2021,thejcowboy22,6, You know they let me cut the grass for free.,"My Grandmother took joy in gardening. I mean she really took joy in gardening/puttering. There she stood in my backyard with a rake in hand 5' tall and 85 lbs in a sundress and apron ready to work. As a youngster, I asked my Granny why she would work all day in the hot sun when she was in the leisure years of life? Forrest Gump is one of those films that is a fairy tale of a mentally challenged man who we follow from childhood to adulthood. What makes this movie appealing is the events in his life, whether it be historical or circumstantial. The scene starts with Forrest Gump sitting at a bus stop in Savannah, Georgia waiting for the #9 bus to arrive. Gump is accompanied by strangers on the bus stop bench. He begins his life's story and his early years growing up in a huge boarding house. His mother, played by Sally Field Is a single woman who runs the estate. She is a take-charge type who emphasizes to young Forest that he can do anything if he puts his mind to it. She takes no gruff from the locals which reminds me a little of the Norma Rae character that Sally perfected in winning an Oscar a few years earlier. Gump had health problems being born with a curved spine and limited intelligence. Despite his afflictions, Gump attends regular school as he meets his first friend Jenny on the school bus. I must say I was taken by the performances of the child actors. Michael Conner Humphreys and Hanna Hall look so adorable sitting together on the bus (like Peas and Carrots.) We follow Gump's life meeting famous people from the boarding house and then fast-forwarding into his teen years with a penchant of running at record speed or as Gump puts it, ""Runs like the wind blows."" We follow Forrest, who ends up in College as an All-American Kick returner. While in college Gump has front-row seat to the end of segregated schooling and a trip to the White House. Next Forrest enlists in the Army and ends up in Vietnam. There he meets on the bus Bubba Blue who seems a little off, but constantly promotes his idea for his post-service plans of being a shrimping boat captain. The scenes from the jungle are captivating and rival some of the greatest war movies on the screen to date plus the musical soundtrack with songs from Jimmie Hendricks and Buffalo Springfield. There Gump meets his commander, Lieutenant Dan Taylor (Gary Sinise) who he becomes entangled in a heroic way. Gump gets wounded and while recovering, he takes up Ping pong and becomes an expert player. Gump represents the U. S. in the sport and visits mainland China. With his tournament money he earned plus a sneaker endorsement, Gump takes the money and buys a run-down Shrimping boat. While all this is going on, Gump would always keep up with Jenny (Robin Wright). The love of his life, Jenny strayed off to the hippie culture scene as the camera follows her experience experimenting in magazine modeling, showbusiness, anti-war protesting, and drugs. Gump and Jenny's paths cross a couple of times but only for a moment. More historical moments and famous people are edited throughout the movie. Multiple landscapes and urban dwellings fill the story as Gump's journey continues as Hanks's narration using a southern drawl underlines each scene. A potpourri of historical events well-edited putting Gump in the center. The visual and special effects are barely noticeable. When viewing I personally want to just run out of my home in the open country, but that only happens in the movies. As for my title, with all of Gump's accomplishments, the only time you see him truly at ease, besides keeping Jenny company, was when he rode his lawnmower over his personal acreage. Gary Sinise does quite a job physically and Sally Field a Mother Gump mentoring her deficient child should be a benchmark for parenting. Also, the undertones and subliminal messages of historical events past fill the story. Just another improbable journey that seems probable under the direction of Robert Zemeckis. As for my dear Grandmother, she always got the yard in order. Just one thing less to worry about!",
921,22 March 2019,esmetxanim,10," A hilarious, large-spirited and tender epic.","A dark and driven work, haunted by violence, cruelty and a sense of the tragically absurd. So afraid to dredge up debate that when Forrest is handed a mic at an antiwar rally, someone unplugs the speakers so we can't hear him - fitting for a movie with nothing to say. Hanks' power as an actor makes us believe in Forrest. He also draws us into Forrest's mind and morality system. And he sets out a singular film persona who will be watched and loved as long as people embrace movies.",
922,31 December 2021,Maxivillain,4, Weird morality,"I don't get along with the messaging of this film although I'm sure its mostly harmless. It does kind of exploit scenarios and marginalized people in order to create sympathy to push its narrative. However, I guess it has a hopeful undertone at the same time. I don't enjoy this film and the acting is very uncanny and uncomfortable from Hanks playing someone with a disability he himself does not have. Its terrible acting to be frank.",
923,19 May 2019,rattansingh-54598,10, One of the greatest movies in Hollywood,"This movie starts with a promising note and shows us what kind of a person Forest is. The movie has many small stories that we see through the eyes of Forest and definitely it will raise even your opinion for situation as well and when you compare your opinion and Forest's you understand what's the difference. This is an eye opener, a motivational and a very good love story. Tom Hanks is at his best in this movie. His acting takes you to the core of character and binds you to the screen for entire movie. I surely recommend everyone to watch this movie. This is a movie that you definitely should watch before you die.
Cheers",
924,28 April 2019,soniabakshi,9, Nice,"This film is one of my all time favorite film. He goes through life on a cloud, which could be each of us. He had a good life, only thing he couldn't figure out why she just didn't love him. I really loved the comedy, also didn't know Tom had it in him. This film had some very powerful moments, that are life lessons. The story is truly a ride of a life time. Very powerful film.",
925,25 February 2019,megansalisbury,9, Best Movie Eva,Fantastic... That's all I can say... Wish I could have been on the set of this movie and watched the whole process. Tom Hanks is a genius that will live on in fantastic movies forever. His dedication and willingness to dive into intense roles is unheard of and I am always excited to witness the next adventure he is going to take me on! What a life! What roles! What a genius! What else can I say?!?,
926,22 December 2022,AnalyticalFilmCritic,1, Low IQ film,This film is likely the most overrated film ever.,
927,22 January 2022,safenoe,9, Forrest,"If there's a film of the 90s then it's Forrest Gump. It has it all, and it's incredibly moving. Tom Hanks nails the role as Forrest Gump, although I think Billy Bob Thornton could have stepped in if Tom wasn't available.",
928,22 December 2006,IshtiaqAhmed,10," If you haven't watched the FORREST GUMP,you r unknown to what ""Movie Magic"" is...","Forrest (TOM HANKS)was unlucky when he was child...weak legs,weak mind,weak social life...when his father was not with him and every body use to ignore him....he then got his legs strong and proved the world that he can achieve as much as anyone can-----but the world still call him stupid and use to ignore him because of his simplicity and naive behavior. The love of Forrest,his struggle in life will make you cry,I bet...",
929,13 April 2016,Jamil_Farraj,10, Forrest Gump review,"Excuse me for the bad English. I want to start by saying this, WHAT A GREAT MOVIE. Since the first second of the movie I was mesmerized by how amazing this movie is, I mean how often do you see a movie that has it all, it's not based on a true story but it contains history elements, like the Vietnam war, the Watergate scandal etc. It's also not biographical but you can see John Lennon& JFK, it's also a romance and a comedy at the same time and of course DRAMA. It's brilliant to be in a movie that was a huge success both commercially with more than 600M$(second most in 1994 behind only THE LION KING)and critically with six Oscars (including Best Picture). Tom Hanks(Oscar winning role)excelled in this movie, and he made the whole world cry with him in the scene when Jenny dies, he did the same thing six years later in Cast Away when he made the whole world cry over a volleyball !!! . ""My momma always said: ""Life is like a box of chocolates, you'll never know what you're gonna get"""", what a quote",
930,15 May 2002,cliffd-1,2, Life is a box of chocolates!,"Absolutely awful concatenation of lachrymose sentimentality and right-wing politics.  I hated this movie with an intensity that cannot be measured. This was one of the most inward looking American movies to be seen in a long time.  Americans seem to believe that there is no other country outside ""Godzone""",
931,17 August 2022,kevin_robbins,10, Everything about this movie is perfect,"Forrest Gump (1994) is a movie in my DVD collection that I recently watched on Netflix. The storyline follows a young autistic man who learns goodness and kindness from his mother in a simple upbringing in Birmingham, Alabama. As he ventures out into the world he touches people's lives in special ways while also trying to protect the people he loves.",
932,13 January 2023,alexanderliljefors,10, Best movie ever,This got to be one of the best movie ever in cinematic history - with one of the most greatest actors ever Tom Hanks. With a humble introction and woth some major classic scene - this is a must seen iconic film.,
933,25 December 2009,ThunderStrike,10, Maybe the best movie ever?,"I lost count of the number of times i watched this movie. It must have been a dozen times at least. However, every time i'm viewing this movie, it's like seeing it for the first time. It's still as brilliant, cheerful and emotional without losing any of its glance or beauty, and the story stays as powerful as it truly is and keeps you interested till the end. Seeing it for just a few seconds makes you stick to the screen till the end-music stops. The dialogues are perfect, the timing is as a swiss watch, the story-twists are more than one could imagine, and the setting in the enduring storyline of the 60's, 70's and 80's of last century, placing the movie inside the main events of that era, just gives you the idea that this almost could be a real-life story. It at least makes me wish it really was.",
934,10 August 2019,ElaineElizabethPresley,10, Slow Down Life Lessons,"Slow down is the life lesson, to let everything happen naturally.",
935,5 March 2020,AmirH_JimmyN,10, Inspirational and motivational,"Great is all that needs be said. An unusual look at War American history.
This is best movie in 90s for me (((:
must see the movie",
936,18 January 2000,Chuck-149,6, The biggest thief I've ever seen.,"I know my one line summary might not be that clear so I'm going to explain it to you.  In  1994, we had classics like ""The Shawshank redemption"" and ""Pulp fiction"" who were in nomination at the Oscars and were stolen in every category in which they were nominated.  They were all stolen by ""Forrest Gump"".  These two other movies which were completely different in their style from the movies of the same genre as them but who came before them were completely over-looked.  And the worst part is ""Forrest Gump"" is simply the biography of Forest Gump.  Also, it robbed every movie in the best actor category.  Of course it isn't that easy to play someone who is mentally ill but it's easier than playing just some ordinary person and playing it well.",
937,12 April 2019,nataliagunnlaugs,9, One of my favorites,"This movie reminds me to live in the moment, be grateful and appreciate everyone and everything you have.",
938,5 May 2019,majidmk-44371,10, The Most inspiring movie,"The most inspiring movie of cinema history which you can never forget it !
Forrest is pure like water , innocent like a child and firm like a mountain .",
939,7 November 2022,cknorton-82131,9, An icon of American cinema the day it came out. It's not a perfect movie and has some flaws but it might just be the most heartfelt and irreplaceable movie of all time.,Overall: 9.37,
940,9 August 2005,gottogorunning,10, Classic!,"Goodness gracious, I discovered that I hadn't commented on this movie yet! Well, it's to be rectified.",
941,15 August 2019,maartenvercauteren,10, One of the best ever,"Even after 25 years, still one of the best movies ever made!",
942,4 May 2019,istvanvincze,10, That box of chocolate,"Amazing movie. One of my favs.
Loveable characters, simple and perfect storyline, memorable lines (who doesn't know this one with the box of chocolate?!)
One of those movies which worth to watch multiple times to discover something new every time.
10/10",
943,4 May 2019,istvanvincze,10, That box of chocolate,"One of the best movies of all time. Unforgottable performances, loveable characters and lines to remember easily (how doesn't know the one with the box of chocolate?!)
Movie about lifelong values and hope and simplicity. Life's never gonna be easy but it also shouldn't.
10/10",
944,7 February 2006,IkuharaKunihiko,10, A story of ChanceBeing There,"Forrest Gump, born in the 1940s, has a limited intelligence, but an unlimited heart. By following his heart he accidentally became successful : he managed to go to college because he could run fast and was dragged into playing football, go to the Vietnam war, meet John F. Kennedy, win Ping Pong championship in China, become rich by fishing shrimps and buying stocks from the Microsoft company. Yet all that time he didn't care about that at all. He only wanted to gain the love from his childhood love, Jenny. Evidently, she appears one day at his door step, desperate for money ",
945,9 May 2019,pariscristinabrown,10, Never judge a book by its cover,Amazing!! One of a kind. It really brings you back to each decade as if you are really there. Phenomenal!,
946,23 January 2018,lorelaj2002,5, sad,"Tom Hank's performance is top. But what I disslike about this movie is that there is so much violence towards women. The is not a single woman in this movies that leads a normal life, and I find that disturbing.",
947,23 May 2019,jenefarr,10, Timeless,One of my all time top 5 movies to watch. Hanks is his usual self and deserves all that came his way from his one.,
948,31 May 2019,06moss,10, Brilliant Movie,"Long story short.
When you finished watching this movie you just feel touched and you also feel like youve just watched 10 hrs of movie.",
949,29 March 2015,rinna-loves-you,1," Poorly written, and horrendous acting.","This movie is unrealistic and personally I didn't enjoy it in the slightest. I hate this movie and have never been impressed. There are plot holes and many scenes where you just want to punch the main characters. The script is atrocious and the acting is horrendous. I have never been more disappointed in a movie. This movie is thought to be touching and classic, but all you see is Tom Hanks and a lot of pointless of love. For once the movie focuses on male love rather than female but it never shows real love. Basically if given the chance I would take this movie off the market because it sets such unrealistic ideas for society.",
950,19 February 2003,emfern13,8, OVERRATED,"Dont get me wrong this is a good movie but it is way overrated. Sure, it has Great performances by Tom Hanks and Gary Sinise but It just didnt do as much for me as it did for other people. It has a pretty good script and pretty well directed but the movie is too long and can get a little boring. Overall I give it an 8 out of 10. Its a good movie, just not one of my favorites.",
951,9 October 2018,billskoutelias,10, MASTERPIECE,ONE OF THE BEST MOVIES EVER MADE AND ONE OF THE BEST PERFORMANCES BY TOM HANKS!!!,
952,10 August 2019,Wise_Otherwisee,8, Simple man's extraordinary story,"Forrest Gump is a story that shows how good intentions and simplicity can sometimes lead to the zentihs of success and happiness, how giving up upon rationale can be sometime indeed helpful, how pure love gets reciprocated and what it actually stands for. It's the life story of the protagonist as narrated by him, giving totally his view on him yet letting enough space for the viewers to make out the other side of it.",
953,4 March 2005,ctrout,8, The Best Picture Winner of the Great Year That Was 1994,Forrest Gump is about a man with the name of the title who is played by Tom Hanks. Forrest's only problem is the fact that his I.Q. isn't up to par with most of America. But that doesn't stop him from taking part in some of the greatest moments of the USA. He just might not know that he's doing it.,
954,26 July 2019,koprivaziga,9," An incredible story of a man, who manages to overcome the dificulties that life throws at him on his journey.",This film manages to explore some of the defining events of the 20. century alongside a more personal story of a simple man from Alabama. The story of Forrest Gump is an emotional one managing to create a protagonist that anyone could cheer for. This is in no small part thanks to Tom Hanks's incredible performance.,
955,23 October 2020,adarshthewinner,10, Awesome movie,It is one good movie if one wants to dive into the past of US. Really inspiring guy who didn't give up. He keeps up with the pace of development around him.,
956,28 July 2021,jack_o_hasanov_imdb,10, Run Forrest Run,"Actually it was fun, though it is kind of drama. Actress and actors did great job.",
957,12 August 2019,waziful,8, the smart simpleton,I really like him because he really has the thing on him.,
958,15 August 2019,oppioantonio,10, Beautiful,Beautiful story!The actors are fantastics.Tom Hanks good job!,
959,25 August 2019,tylerlozano-43801,10, A movie that is good to watch even even today over and over again,This movie came out when I was 4 years old and I remember the first time I saw in when it came out on VHS and this was a movie that made me want to become an actor and I say for the kids today if they are going to watch this movie for the first time don't spoil the movie for them because when I was a kid I learned a little bit of history as well and what I also learned too was Disability especially my disability witch was what Forrest Gump had Asperger's Syndrome and it's important to learn about this disability,
960,25 September 2020,annamarajuvenu,10, Just awesome don't know how I missed this movie,"The one thing this lockdown did good for me was introducing me to world cinema. Can't even count how many movies and shows I have completed. The best thing about this movie is you won't feel bored for even a minute. Portrayal of forrest gump by Tom Hanks was exceptional. Loved every character in the movie the climax of the movie made me very emotional. I was connected to forrest gump character as he never backed off always moving forward gave me hope and motivation.
Just watch the movie u will love it",
