Review_Date,Author,Rating,Review_Title,Review,Review_Url
478,13 July 2010,john-souray,3, Losing the plot,"This could have been a good film, a great one even. The ingredients are all here. An imaginative director, wonderful location and sets, actors that are never less than competent and sometimes a lot better (I was particularly struck by Ruffalo, an actor I've not previously taken notice of). There is a promising premise – an Alcatraz of Hannibal Lecters, the island asylum where they send everyone that nobody else wants or can cope with. And potentially great themes; the excesses of American psychiatry in the early fifties, the disputes between the advocates of surgery, the advocates of medication, and the advocates of therapy. And something even darker still, something touching on the character of evil (or what we call evil) itself. Can someone be driven mad simply by witnessing too much? But the film bungles it, horribly. And it's not too hard to work out why. The script just isn't good enough. Actually, not even the script; the plot is not good enough. To be fair, I may have been in a good mood, and the film engaged my attention throughout. It's only afterwards, thinking about what you've just seen, that it all starts to come apart.",
479,16 March 2012,benjameshodges,7, A Potentially Great Mystery Spoilt by a Predictable Second Half,"Opening with some rather amateur special effects to create a ferry trip was an unusually, off-putting experience, especially from the likes of Scorsese. But as 'Shutter Island' progressed, I was soon immersed into the mystery of the missing suspect. ",
480,31 March 2010,boyd1955,2, Cliché ridden waste of time rehashing overused and obvious plot,Never been a fan of Scorsese but the trailer for this made it look interesting and the guy is really praised as a great filmmaker so I thought I must be missing something and should give it a go What a mistake ... Awful cliché ridden film making ... Not an original idea in the whole thing ... Even the basic premise has been used so many times before that it is obvious from the first 5 minutes where it is all leading The only thing that made this watchable was the cinematography ... Its all beautifully shot and framed ... But along with that there's some of the worst blue/green screen work that has been seen in decades !!! Go figure Its release was postponed a number of times and it looks like they realised they had a right turkey so the green screen stuff may have been re-shoots ... Who knows ... And who cares ... Cos in the end it just ain't very good,
481,27 July 2012,BeneCumb,7," Too mind-twisting, Scorsese has made better stuff","Actors are excellent (DiCaprio has pleasantly surprised me again), but the plot has its shortcomings -- there are so many issues unsolved or unexplained, e.g. whom did the main character meet in reality or why he suffered his illnesses. The movie itself is a bit lengthy (suspense is sometimes lost), and the ending is too sophisticated as well.",
482,16 March 2010,sharmari1,1, Shutter Island ...the truth,"This movie was absolute rubbish, from start to finish. The trailers and all the hype concerning this movie, lead the public to believe that it would be worth seeing. With which, I firmly disagree. I could tell you all the reasons, but quite frankly I feel I have wasted enough time on this movie by even watching it. I will tell you that the movie was predictable, depressing, and in very bad taste. It reminded me of one of those old black & white foreign flicks that wreak of morbidity and extremely bad taste. If you like that sort of thing, then by all means go see it. However, if you do not enjoy wasting your time on rubbish flicks,then don't waste your time on this one. I have always personally liked Leonardo, but I think I must chalk this one down as one of his worst acting role ever. Sorry Leo, just giving it to you straight. Of course there will always be someone of notoriety who will swear that the flick is fantastic. Let's be honest. There will be a lot of people that will go along with that. Simply because they think it impresses people to agree with someone of importance. However, people that are easily led around by their noses, rarely make any impressions ...other than being moronic idiots that cannot think for themselves. Needless-to say, I have this extremely annoying habit of thinking for myself, and this movie was absolute rubbish, from start to finish, no matter how many expert reviews to the contrary. Of course, you can always go see it for yourself. If you have time to waste ...why not. Now, I must apologize for wasting your time, as well as my own, to write this ridiculously lengthy way to say the movie was rubbish. However, IMDb does not allow us to just write a 'few' words. If a review does not contain enough words, then you will be prohibited from submitting it. Personally, I would have been quite happy with just saying, 'Shutter Island was Rubbish, from start to finish.' Thank you for reading my review, and have a nice day.",
483,17 August 2021,VinceGambini,1," No folks, this is not a 10 Star Movie","There are bad movies, boring ones, ridiculous ones, and then there's Shutter Island: a league of its own. It's hard to believe this is a film by one of the greatest directors of all time. This 'psychological thriller' is strangely overrated, badly written, dragged out and utterly boring. ""But, but, but the twist at the end"". Yeah, the twist. It's foreseeable for at least an hour. I never read the novel but would judge it's simply not movie material. Why Scorsese touched this remains a mystery. The script is packed with way too many characters no one cares about. The most annoying of all: Leo Di Caprio. It's all so slow moving and sleep inducing, made worse by that lame soundtrack. And everyone in this movie seems bored. No wonder.",
484,7 January 2011,RCWjr,9, Wow,"I am one who is hot/cold when it comes to Martin Scorsese. More times than not I am on the cold side. However, with Shutter Island, for me, this is one of Scorsese's best ever. Decaprio was in two of the best films that were put out this year. Inception, and this early year gem. Decaprio is absolutely brilliant, as is everyone in this film.",
485,10 April 2018,andreas-sellfors,8, A great adaptation of the book Shutter Island,"It's just as well that I recognize this directly - I'm a real ""sucker"" for stylistically strong movies and in Shutter Island there's a lot of it. It are also going to make people happy (at least from my point of view) who read the book by Dennis Lehane that the movie are based of.. Yes, the film follows the book very carefully. So If you then agree that the film must follow the book, the director Scorsese is a pure genius in how he treated the material. His constant photographer Robert Richardson does a great job of getting that rainforest island to look magnificent and Teddys dreams and flashbacks are nothing but adorable beautiful.",
486,29 May 2010,jignesh568,2, Way above my Head,"I honestly admit I didn't understood the movie,though I watch lots of movies regularly but these is beyond my limits.I never enjoyed it,whole of the whole movie.",
487,20 December 2010,cstotlar-1,9, Shutters and Shudders,This film works well in a number of ways: It is gorgeously photographed It is beautifully acted It is intriguingly well-plotted,
488,6 August 2010,timothymcclenaghan,2, Way Too Long and Done Before,"This film is just another twist on an already told tale. I think a similar plot was used in an old Twilight Zone or Alfred Hitchcock TV series show, except they were able to tell the story in less than 30 minutes. This movie is just way too long. If they edited out all of the scenery shots, it could have been pared down to under 90 minutes.",
489,9 June 2010,jazza923,6," Good, but not Scorsese at his best.","The cinematography is very impressive and the supporting cast is exceptionally good. Patricia Clarkson and Mark Ruffalo stand out. Ben Kingsley's role is very stereotypically him, perhaps a little offbeat casting would have made the role more interesting. Very well produced in all areas, and the attention to period detail is exceptionally well done. But I have to agree with the critics on this one, although it is good, it is not up with most Scorsese films, it is distant emotionally and has one too many dream fantasy sequences for it's own good. The two hour and eighteen minute length is a bit excessive and unnecessary. Still, along the way there is much to entertain.",
490,27 February 2010,PWNYCNY,7, Better than mediocre but not great.,"It's hard to knock a movie with a good ending even if the bulk of the movie stinks, which is case for this over-hyped thriller. Much of the movie is exceedingly underwhelming and at times outright boring. The gloomy sets, the hackneyed acting, the dumb dialog all combine to make the first two-thirds of this movie quite bland, the stuff that makes the eyelids feel heavy as you are sinking into slumber-land. Yet something amazing happens. The movie actually turns itself around and becomes an engaging and exciting cinematic event, marked by strong acting by Leonardo Di Caprio as his confused character struggles to unravel the riddle of his very identity. How this movie manages to avoid creative oblivion is fascinating. Somewhere, some how, the director must have realized that he had to turn this movie around to avoid flop-ville. Two problems with the movie is that the sinister characters aren't really all that sinister and that the setting, a psychiatric hospital is, well, a psychiatric hospital. One must remember that when a story is based in a hospital, drama can be taken just so far because along with the doctors and nurses who interact with patients, there is also a virtual army of clerks, housekeepers, accountants and other support staff who actually keep the hospital running. So when watching Shutter Island, one should ask: who is paying the bills, mopping the floor, dealing with account payable and receivables and maintaining the phones? They have a story too but once again it goes untold.",
491,3 October 2017,myriamlenys,9, excellent,"Truly original movie, based on a truly original book. The novel was a master class in deception and misdirection ; the same goes for the movie, which shuffles twists and clues with all the talent of a professional card shark. ",
492,24 June 2021,cliffvose,1, mystery,"The only mysteries in this generic celebrity vehicle are why didn't Kingsley persuade the producers, directors, ensemble cast, and scriptwriters to call him 'Sir' and why is there no smoke from the knight of the realm's pipe?",
493,30 March 2019,andrewchristianjr,9, ALL TIME FAVE PSYCHOLOGICAL THRILLER MOVIE.,"What can I say. This is mind-blowing film. The ending was genius, you never saw that coming.",
494,13 February 2023,Dan_W_Reviews,8," Brilliantly Suspenseful & Twisting Story, Extremely Creepy Atmosphere, A Scorsese-DiCaprio Great",Shutter Island is set on a mysterious island where U. S. Marshals are sent to investigate the disappearance of a patient from an asylum.,
495,4 October 2020,joiningjt,10, Flawless masterpiece!! Leo's gem!! Real oscar winner!!,"This was truly the oscar winning movie of 2010!! I dont listen to the actual Oscar's that are wrong 90 percent of the time. It's also Scorsese's best, this and gangs of New York. I'm not a true Scorsese fan his movies tend to be to long and drawn out for me, especially the boring aviator!! Omg was that movie terrible, but when he hits one it's a home run!! Goodfellas was amazing. gangs, and this gem!! Leonardo DiCaprio absolutely destroys it in this movie, his acting is beyond compare, the supporting cast is tremendous as well. This is why we have 1 out of 10 so we can glorify a masterpiece like this to be a TRUE 10!!!!",
496,26 February 2010,kylehodgdon,8," If You Like A Good Mystery, You'll Like This","Just when it seems like Hollywood is out of good, original movie plots, a film such as ""Shutter Island"" comes out and proves me wrong. I know that it was a book originally, but they did a wonderful job adapting it to fit the big screen.",
497,13 July 2010,peter-bruck,7, Deja vu all over again,"It isn't even a real spoiler anymore to state that a modern mystery thriller has got another ""alter ego""- plot point in the end. Oh, how surprising. The main character finds out that the he himself is Tyler Durden/a dead guy with a hole in the stomach/a bunch of people in a motel/the author of the mysterious book/the house ghost/the invisible friend of his daughter/John Turturro wearing a stupid head... Yeah, it's deja vu all over again. Shutter Island is a decent, exciting horror thriller. Scorsese and all the fine actors from Leo to Ted Levine, from Mark Ruffalo to Max von Sydow, from Carol Lynch to Patricia Clarkson, they did a damn fine job. The only flaw is that it ends the same way thrillers end since 1998. So one more time, let's say it all together: BORING!",
498,27 March 2010,tassos3,8, Mediocre and disappointing,"I am sorry to say but this movie is not worth your time. There is nothing sensible, nothing clear, nothing solid, nothing interesting (at the end), no poetic license, no license for anything, this movie or the story behind it is nothing to be excited about. You will leave the theater, wondering who the real nut in the movie is, and what's really going on. I hate leaving a theater not having a clue what has happened in the movie, no matter how promising the plot is, and how wonderful the photography is. I wish somebody gave me a clue of what is going on. Maybe I am dumb, but I don;t have a freaking clue where de Caprio is walking to in the last scene of the movie. A big waste of resources, good actors, brilliant photography. This is a movie you will never get a clue of what really happened. Where the h@ll is de Caprio going to die as a good man? In lobotomy? in post-Nazi experiments? getting the chair out of the island? why does a director as brilliant as scorchese builds something so big only to make me feel like an idiot when the end titles start?",
499,6 September 2022,vengeance20,8, Great Film With A Surprising Twist!,Another film I heard of but never saw in Cinemas (somehow) & have recently watched & thought was pretty good!,
500,1 March 2010,blackmamba99971,10, Nice twisted movie,"Martin Scorcese really surprised me with this film. Having a patient who thought of himself as a state Marshall trying to find a woman who has a name much like his dead daughter. The twists and turns in this film made me think that the staff of shutter island were the patients portraying themselves as the staff. Gaurds, orderlies, nurses, even Ben Kingsley as the head director of the asylum. But what got me going was the fact that a few of DiCaprio's past memories kept clashing within himself giving away small clues which made re-think the story altogether. I loved how Martin used some very exquisite Avante Garde' memory flashbacks to the second world war or his home, being with his wife. But the fact that made me think he was the patient, was the good Doctor Rachel Solondez. When he found her in a cave who was portrayed by just a nurse. This was what done it, when she started to explain the procedures of psychotropic drugs being used on patients. And how using orbital lobotomies to sullen the insane people so they can be controlled better, how she explained this was too factual almost as if she was telling him too much in detail. And also the fact that the staff on the island tried to keep away from the caves because of the so called poison ivy or other plant life. This is pretty much a lame excuse for finding someone on a remote island. I loved this movie, what a great refreshing approach from a great director of mob films. the attention to clue details was astonishing. A must see.",
501,16 September 2010,estebangonzalez10,8, Scorsese + Di Caprio = Must See,"¨Which would be worse, to live as a monster or to die as a good man? ¨ Shutter Island has all the right ingredients for everyone to enjoy this movie. First of all, it is directed by Martin Scorsese, the guy who brought us such masterpieces as Goodfellas, Taxi Driver, Raging Bull, Gangs of New York, and The Departed. Martin Scorsese is one of the best directors and he is always trying different genres, being original, standing out, but with his classic trademark direction in every film. This time he brings us this dark suspense thriller that traps us from the very beginning and hooks our attention up to the very end. Shutter Island is based on Dennis Lehanes's novel of the same name. His previous two novels, Mystic River and Gone Baby Gone have also been made into feature films, and are among my favorite movies, especially the first one. If those two names alone are not enough for you to want to go see this film, then perhaps this might convince you: Leonardo Di Caprio, Mark Ruffalo, and Ben Kingsley star in this thriller and give great performances. I did not have to see the trailer to know that I wanted to watch this film because I really admire each of the people involved in making Shutter Island. The weakest link perhaps is the screenplay writer Laeta Kalogridis who wrote Alexander and Pathfinder, two movies that bombed in the box office. The script does have its flaws, but the performances and the direction are what stand out in this dark thriller. The atmosphere and the mystery that Scorsese masterfully creates are worth the ticket price plus some really good performances from the lead characters make this a very enjoyable movie experience. This is not one of Scorsese's best films, but that does not mean it is a bad movie either. Scorsese knows how to make movies and he does not fail with Shutter Island although he did take a huge risk with this film.",
502,28 April 2017,Kingslaay,8, Great thriller,This was a really enjoyable thriller and honestly it's a lot simpler than people make it out to be. ,
503,24 February 2010,ciscokid1970,7, Interesting story twists overdone and too long,"If you liked Kafka, Identity or Slaughterhouse 5, you will probably dig this movie. This movie starts out with DiCaprio's character going to some nut house island jail to investigate some escaped criminal. People working in the criminally insane jail start to become uncooperative and suspicious. The story is mostly a ""what is going on here"" after that.",
504,20 July 2020,dillylamar,10, Shutter Island,"Shutter Island is a 2010 film directed by Martin Scorsese, and stars Leonardo DiCaprio. This film is absolutely amazing on every aspect. Leonardo Dicaprio gives one of best performances in this film, along with good performances from Ben Kingsley, Michelle Willams, Jackie Earle Haley and Mark Ruffalo. The script is complicated, well written, and after a second viewing, makes you realize that clues were left behind all along. But the best thing about this film is its atmosphere. The island is designed in an absolute perfect way. With telling Cinematography and symbolism sprinkled across its entirety. The films editing and sound are very commendable as well. The film contains a lot of symbolism. The fire and water complex, and the multiple subtle hints of dialogue and action throughout. The film's score is brillant. I didn't even know that ""On The Nature Of Daylight"", was originally from this film. This film creates a grand illusion to the protagonist and the viewer. For most of the film, you are left believing in a fake character created by a real person. The viewer is just like Andrew in the fact that the world around them (the film) is set up, staged, and an elaborate attempt to get them to accept their doing and regain sanity. I'll have to watch this film more times to get every context clue. Spoiler Alert: Andrew killed his wife after she killed his kids. He was sent there, and created a fake U.S. Marshal named Teddy Daniels, and created the disappearance of Rachel to have something to investigate. He is also looking for Andrew Laeddis. The man he says killed his wife, when it was actual him. In ""reality"", he was doing this to take the blame and guilt from himself, and not face reality. The doctors played along, and set up the entire story. He begins to believe that he was set it up by the Doctors, and that this place was a Nazi brain experimental camp, and begins to hallucinate. He eventually finds out about the scheme, and this is the second time its happend. In fact all of the dreams and nightmares he have, feature a girl saying save me, who we first belive to a jew prisoner, but is actually his daughter. He wakes up and appears to have accepted reality, but later, it is revealed that he hasnt, or has he. He walks off, presumably getting a lobotomy, so his memory and feeling will be evaporated. This is the way I interpret this.He has accepted what he has done, but cant live with it, so he pretends to still be Teddy, in order to get his brain washed. Basically, his self dies without having killed anymore people. Terrific film, haunting, disturbing, thrilling, perplexing and a reality mind bender. ""we have the ability to deny reality even when it staring right back at it us, we always want to hold to what we want to be true."" The denial of reality, the creation of blame on someone else, the guilt and the trauma from killing or doing something or someone you cant get rid of that feeling. Perspective is everything in the interpretation of this film.",
505,1 April 2017,davispittman,10, Excellent mystery/thriller DiCaprio film,"Shutter Island (2010) is one of my absolute favorite mystery thrillers. Leonardo DiCaprio is great in the lead role. And Michelle Williams is good too, you can hardly tell she's even acting, it all just seems so natural. Ben Kingsley plays his role very well. The script is well written and it keeps you very invested the entire way through. The visuals in the film also contribute to the eerie/creepy feeling the whole movie gives the audience. This feeling is what makes you want to keep watching, this is NOT a film that anyone will be checking the time during. The movie is kind of long but you never feel like it's slow or dragging, they make every minute count. When you put the awesome visuals, impeccable dialogue, and great masterful acting all together, it makes for a great film, course when has Martin Scorsese ever disappointed? His directing is very precise and very careful. If you like scary movies, I think you'll enjoy this one, as long as you like scary movies that give you a bit of a challenge, ones that are more then just cheap slashers. On the other hand, if you just want a piece of escapist entertainment, something simple like a Friday the 13th, then try something else. I 100% suggest this film! It's just so well made in every aspect and incredibly entertaining.",
506,16 March 2010,paske2001,9, Don't believe in the doctors' lies!!,It is one of those movies which forces you to think.. probably better watched in the second time.. it is because we are not used to think in the Hollywood's cinema. ,
507,12 July 2021,billsalichos,4, A big disappointment for me,"I understand the big secret of the movie in the first 10 minutes, it feels like a colaz of bad scenes put together.",
508,23 February 2010,d_art,8," 'Shutter Island' is an unsettling, haunting journey","In the Martin Scorsese's new film Shutter Island, Leonardo Di Caprio plays U.S. Marshal Teddy Daniels, who is assigned to investigate a disappearance of a female patient in a mental hospital for the criminally insane on the remote Shutter Island. As he uncovers clues, he suspects a conspiracy involving the doctors performing mind-altering experiments on patients. When a hurricane cuts off communication from the mainland and many dangerous criminals escape, Teddy finds out that the happenings on Shutter Island are a lot more twisted than he realized.",
509,22 February 2010,Ric-7,10," It's not ""like"" anything","Please, please do not read this if you have not seen the film already. I am not going to disclose anything major, but the less you know about the plot, the more I think you'd enjoy it.",
510,22 July 2010,axismladen,7, A good movie with an ending that lacks some imagination.,"The movie alone is good. It's not great but it's good and well worth watching. The script is well structured and the story really draws you in. The characters are well placed and the entire course of the story development is nicely done and it definitely keeps your interest going all the way until the end. Unfortunately, the ending makes it way too usual and clichéd. We've seen it a hundred times before and obviously we'll see it a hundred times again. The movie would have been worth a lot more if the ending was done with a bit more imagination. I mean, really, what where they thinking? The entire movie is brilliant and than they ruin it just like that. Come on! As i said, it's seen a hundred times before and i really have no need to see it again.",
