Review_Date,Author,Rating,Review_Title,Review,Review_Url
229,18 March 2010,bifties,1," Oh my God, what a huge horrendous pile of poo!","I always fear that preconceptions and/or high expectations can cause a film to do worse than it deserves. For instance, walk in to a movie that you know nothing about, and more often than not it will surprise you. On the other hand, walk into a film directed by Martin Scorsese, starring Leonardo DiCaprio, based on a novel written by Dennis Lehane (who wrote ""Gone Baby Gone"" and ""Mystic River"") and a supporting cast that includes Mark Ruffalo, Max Von Sydow, Sir Ben Kingsley and Emily Mortimer, you are almost certain to be disappointed. However, this may have been true with other films but when it comes to a Scorsese/DiCaprio collaboration (for example Gangs of New York, The Departed and The Aviator)I expect a little bit more, and I expect the film to deliver something. This film sadly does not deliver, it does not excite and it does not deserve to be in IMDb's top 250 (which at the time of writing it does). I can only conclude that the masses have decided not to bet against a previously assumed sure thing, and instead vote along with everyone else rather than question the latest Scorsese/DiCaprio collaboration. The film opens on a boat, and within minutes we see DiCaprio and Ruffalo standing on the deck talking. It was from this point onwards that I was disappointed and began to expect very little from the rest of the film. Blue screen? Green screen? Whatever they use, they used it here and it looked horrible. And if nothing else, I have always found that of the Scorsese films I didn't necessarily enjoy in the past I would at least walk out at the end saying how beautiful and authentic everything looked. Well not here. Seriously disappointing. Don't waste ya time!",
230,10 July 2010,thebogofeternalstench,4, Predictable,Wow so he turned out to be a mental patient in the end? No $hit.,
231,5 March 2010,kunalkhandwala,8," Chilling Thriller, distinct with Scorcese-DiCaprio combination","As the U.S. Marshals depart from Boston Harbor towards the isolated island that houses the Ashecliffe hospital for the criminally insane, the background music of the vessel's horns, the eerie mist and the uneasy countenance on them confirms that Martin Scorcese is going to squirm our thrill seeking minds....",
232,19 August 2013,Maziun,5, Botchered thriller by Scorsese,"I didn't read the book on which the movie is based. From what I've heard it's a great book . This movie is definitively not great . Anyway , the movie had advantage on me with the fact that I didn't knew anything about the story. The basic facts I knew sounded promising and despite that Scorsese in last years haven't been in good shape , I was still hoping for a good movie. It seems that not always you get what you wish for.",
233,23 April 2010,blacklist-1,10, A masterpiece. A conspiracy and psychological thriller that will have you hooked.,"Shutter Island for me is the years best film so far. Leonardo Decaprio gives an outstanding performance as US Marshall Teddy Daniels set in 1954. Him and his partner Chuck Aule played excellently by Mark Ruffalo are on their way to Shutter Island, a closed off psychiatric prison for the criminally insane. Teddy and Chuck have been set to investigate the disappearance of a female prisoner who has escaped though the guards or doctors don't know how she escaped from the room. Arriving at the prison Scorsese sets up the tone of a dark, disturbing and mysterious place using non-diegetic sound and a haunting music score (one of the scariest I have heard) to deliberately unsettle us and it dosen't help when Teddy and Chuck have to surrender their firearms at the main gate. As Teddy and Chuck investigate the prisoner's disappearance their investigation leads them to believe there may be a sixty seventh (being only sixty sixth) in the first place. He begins to believe that the doctors and guards are conspiring in a conspiracy when they prove less than co-operative particularly the head doctor Crawley a superb part played by Ben Kingsley.",
234,27 February 2010,WinningAtLife,1, Where do I apply for a refund,"I am unsure of where all the reviews are coming from, I saw several people in the same screening as mine with the same opinion as mine - terrible/waste of money.",
235,19 October 2015,prince_c3,8," Which would be worse - to live as a monster, or to die as a good man?","Well, pretty much good, better, best and worst has been said about this movie in 950+ reviews and it's kind of rare that reviews are somehow divided because as it happened after watching this movie my friend and I was totally engrossed and left the theater not knowing what really hit us. Because we were not prepared for anything like this from Scorsese or Dicaprio, we know they both are capable but not on this scale. At the same time two other friends outrightly rejected this movie as anything but great. So, that's how the audience would be divided you either liked it or you hate it. Also, those who don't like it much doesn't mean they don't get this movie or they don't know how to decide the movie, I believe they don't want something this hard to take it easy. They must enjoy comedy and light tragedy, but not something of this scale. Because I know my friends they can't digest dark movies with lots of emotions, emotions that involve tragedy, not some dog got killed and like that. And, by GOD from first shot to last shot this movie getting bleaker and bleaker until the last line which not only sums up the entire movie, but, it was so sad and bleak that I couldn't able to get off the seat even after it finished for few Min's.",
236,22 February 2010,george.schmidt,8, DiCapro & Scorsese's teamwork continues to be well respected in this crafty red-herring ghost story/suspense thriller.,"SHUTTER ISLAND (2010) *** Leonardo DiCaprio, Mark Ruffalo, Ben Kingsley, Max von Sydow, Michelle Williams, Emily Mortimer, Patricia Clarkson, Jackie Earle Haley, Ted Levine, John Carroll Lynch, Elias Koteas. Well crafted but loaded with red herrings/MacGuffins galore adaptation of Dennis Lehane's novel about a pair of US Federal Marshals (DiCaprio and Ruffalo) investigating the escape of a patient on a remote island prison for the criminally insane circa 1954 where all is not it appears to be (and then some!) in maestro filmmaker Martin Scorsese's well-checked salute to Hitchcock with some Lynchian underpinnings to make things all oogie-woogie in this at-times-edge-of-your-seat suspenser/ghost story until the exposition choked final act (which becomes tiresome and drawn out for those that might not get the 'gotcha' that's been leading up to its cliffhanger climax). DiCaprio, who gives one of his most exhaustingly expert turns here running the gamut of practically every emotion know to mankind, heads a crackerjack ensemble cast running on all-cylinders (too bad the same can't be said of Laeta Kalogridis' script which becomes a tad redundant). Yet all the same perfect viewing for a dark-and-stormy night.",
237,21 February 2010,DonFishies,8, The trip to Shutter Island is worthwhile if only for DiCaprio's amazing performance,"There are only a handful of filmmakers whose work I compulsively follow and run out instantaneously on or near their film's release date to see. But there are very few filmmakers who can make a movie, not a predetermined blockbuster, feel like an event. Yet somehow, Martin Scorsese manages to do it every time. And when Shutter Island was delayed from October 2009 until February 2010, you can imagine how disappointed I felt. But it helped build the anticipation even greater.",
238,2 March 2010,bob-benoit,4, Did I miss something?,Did I end up seeing a different movie than everyone else? I was shocked when I saw that Scorsese had directed this (I was unaware.) I think was by far his worst movie.,
239,1 August 2014,edwagreen,6, Shut off Shutter Island **1/2,Brooding plot with a wonderful atmosphere of heavy rain and doom mark this film.,
240,6 February 2022,fernandoschiavi,8," Tense, provocative and practically impeccable from a technical point of view, ""Island of Fear"" is one of the most underrated films in the exceptional career of Martin Scorsese","Based on a novel by Dennis Lehane, author of other literary works that resulted in film adaptations of good caliber such as About Boys and Wolves, Isle of Fear is a crime thriller with an extremely macabre tone to the point of being sometimes even difficult to watch, but which challenges, under the guise of suspense, our perception of reality. In 1954, federal police officers Teddy Daniels (DiCaprio) and Chuck Aule (Ruffalo) set out to investigate the mysterious disappearance of Rachel Solando, an inmate/patient at an island's psychiatric unit - actually a large boulder, a ""bombed"" version of the famous Alcatraz - on the coast of Massachusetts, finding a hostile environment both from the psychiatrists, Drs. John Cawley and Jeremiah Naehring, played by Ben Kingsley and Max von Sydow, and from the prison officers and criminals interned there. And that's not counting the violence of nature itself, with a very strong storm that doesn't take long to start and that reflects all of Teddy's mental confusion that already starts with his discomfort on the ferry on the way to the island and that only gets worse.",
241,28 March 2021,charlotteemmajonesuk,10, incredible,My favourite film of all time. I could watch it 100+ times and never be bored.,
242,3 January 2020,brett-76260,1, You gotta be kidding...,"You gotta be kidding on all the high reviews. I watched this utter stupidity based on All the high ratings. I cant begin to explain what a complete hot mess of a movie this was. How it received so many good reviews is completely beyond me. Ug what a disaster and a complete waste of time. Hey if you want to watch a movie that is complete nonsense, have at it cha chi cause its another Scorsese turd.",
243,25 February 2010,barbara-czarniawska,5," Sinking in the middle, rescued in the end","The middle of the movie is so pathetically bad, that one really wants to leave the movie theater (I did). I expected a Godzilla or a vampire to crawl out of a hole at any time (this is NOT a spoiler!) Luckily, it pivots and arrives at the end as a fairly interesting attempt. ""Fairly"": in general, the movie needed a cruel editor, who would have cut out the middle, or most of it. My suggestion would be to cut out all so-called Dachau scenes (so-called, because the picture of the gate shows Auschwitz). The Disneyization of the concentration camps continues, although one could have hoped that Scorsese would know better. He didn't, but perhaps this is common to all the US directors. They do not seem to believe it was real, and as a result treat it completely disrespectfully.Think about ""Letters from Iwo Jima"" done in the same manner: the protests would never cease. DiCaprio was good, no doubt about it: shouldn't he be given a better chance?",
244,24 March 2010,doctorsmoothlove,5, Studder Island,"Shutter Island is the newest reference point for why I hate movie trailers. Ever since September I was berated with flashing images of ""an asylum for the criminally insane"" while simultaneously watching some crazy person attack Leonardo DiCaprio. This had the effect of making me think I would enjoy a high budget horror or thriller from Scorsese. What I got was actually a noir film. Not that I am too angry, but why was the film advertised in a way that an audience could misinterpret its genre? As a homage pic, the film gushes with both stylistic and story references to the heyday noir films. It's even set in the early '50s.",
245,29 August 2015,yashrajs536,10, Shutter Island!!!,"I watched ""Shutter Island"" today and it was awesome I never expected much from it but it turned out to be one of my best movies till date...",
246,13 February 2010,sunnnz,10, an absolute masterpiece,i was one of the lucky ones to sit and watch the pre release of the shutter island in the opening with the director himself.,
247,17 April 2010,jonnyfendi,8, Scorsese Scores Again! (Thiz Review Contains Spoiler),"""Shutter Island"" seems to be an appropriate vessel for Leonardo DiCaprio to explore his acting skill. It's quite good, but yet it's not the finest, but I still can say thiz performance might be one of his best works so far. DiCaprio collaborates the fourth time with the Director Martin Scorsese, the last three are ""Gangs of New York"" (2002), ""The Aviator"" (2004) and ""The Departed"" (2006). Scorsese himself is a very good drama Director. His previous memorable classics are ""Taxi Driver"" (1976), ""Raging Bull"" (1980) and ""Goodfellas"" (1990). It's about US Marshall named Teddy Daniels (DiCaprio) comes to an island to investigate a mysterious case. The island is actually a prison facility for mental illness. Thiz movie is supported by heavy caliber Cast members such as Ben Kingsley, Mark Rufallo, Mark Von Sydow, Jackie Earle Haley and Michelle Williams. The script of thiz movie is very fine with several twist and turns. Scorsese with all his experiences successfully arranges every scene effectively. The exploration is classic, we even could see ""Hitchcock"" atmosphere here. The Score also helps a lot to build such an intensive tension. The great example when is on the opening scene, when Daniels and his partner just arrive on the island for the first time. When they observe the surrounding that is preserved with maximum securities, the gates is opened one by one. At a glance it's just an ordinary scene, but the Score multiplies it into ten times more thrill. The twist ending is meant to be shocking. But unfortunately (Spoiler Alert!), I already see the pattern where the story might goes even in the middle of the movie. When a conversation between Daniels and Rachel (Patricia Clarkson) that takes place in a cave, Daniels said angrily, ""I am an US Marshall. No one can stop me!"". That is the first time when I clearly know that he is actually one of the patients. In the end, if we have a movie that every scene is put in for a reason. That is the time when you got yourself an effective and flawless movie. Scorsese scores again! ",
248,28 October 2022,MatthewMichaelHoffman,10, This wasn't directed by Christopher Nolan?,SCORE: 10/10,
249,2 March 2010,j-burke-2,1," Over-hyped, wretched refuse",I really don't know what to say.,
250,19 November 2021,view_and_review,8, Scorsese on Top of His Game,"""Shutter Island"" was intense. I knew it was a psychological thriller, so I was on my toes.",
251,5 February 2012,writers_reign,6, To Play With Mamets,"In scene III, Act II of Henry IV Part One, Hotspur, a fiery, plain-speaking and uncomplicated man tells his wife, Kate that 'this is no world to play with mammets and to tilt with lips; we must have bloody noses and cracked crowns'. It would take, I would argue, someone like Hotspur to sever this Gordian knot which is as complex as anything David Mamet ever wrote. Usually where labyrinthine plots are involved most, if not all inconsistencies are explained in the last reel but unless I missed something that is not the case here. This is what I saw. An opening scene in which a Federal marshall, awaiting a ferry to transport him to Shutter Island, meets for the first time, his assistant. Both men are in civilian clothes and carrying both i.d. and guns. Having reached the island, which houses an asylum for the criminally insane - they are going there specifically to investigate the 'escape' of a female patient - they show their i.d. at the gate of the prison and surrender their weapons. The best part of two hours later the psychiatrist in charge tells the Federal marshall that he is, in fact, a patient and has been for the past two years, further, his 'assistant' identifies himself as the psychiatrist in charge of the Federal marshall's case. If this is in fact the case, why allow an insane man to leave the prison in civilian clothes - all inmates wear white uniforms - and furnish him with (presumably) fake i.d. and a gun? If this is ever explained to my satisfaction I'll return and re-review it.",
252,13 July 2010,brandon_lee420,8, Stays true to the book.,"While the film was in theatres, I took my chance to read the book that made this film come alive. The book was fantastic and puzzles and twists were very surprising. When the film reached my local video store, I took my chance to grab it off the shelf and view it. The film does a good job of having the same atmosphere and dialog as the book while also staying true to it, as well. The cast did an excellent job of portraying the characters in the book and their performances were over the top. If I hadn't read the book, I would've given this film a perfect ten but that could, sadly, not happen since I already knew what was going to happen and it made the film a bit more boring. The dialog in Shutter Island is mostly what you read in the book but the people who say those lines do a really good job. Two particular lines that were used in both the film and books were, ""Thorns as big as my d*ck."" and ""Pull yourself together, Teddy."" and I remember them a bit more than the others because one was funny and the other one was cool. So cool in fact is that I wake up every morning and splash water onto my face and stare at the mirror and exactly say that line. The acting was top notch in this motion picture with Leonardo DiCaprio, Ben Kingsley, Mark Ruffalo, and Jackie Earle Haley taking the top four spots. Leonardo DiCaprio, in my opinion, did a superb job of portraying Teddy Daniels and my vision of Teddy was what Leonardo gave us. He plays a U.S. marshal who is investigating the disappearance of one of the patients from the Ashcliff Hospital for the criminally insane. Along the way he discovers puzzles and finds out that everybody is keeping a secret from him. He really gave a convincing act. Ben Kingsley does a well done job of Dr. John Cawley, who is the somewhat mysterious, and his accent is really cool. Mark Ruffalo plays the partner of Teddy, Chuck Aule, as they are sent to the hospital where a mystery plagues the entire hospital. Ruffalo impressed me a lot in this film and he does a good job of knowing nothing when he really does. The best and by the far most impressive actor has to be Jackie Earle Haley for his wonderful role as George Noyce, a mental nutcase who speaks in riddles. Haley knows how to act in a good, realistic way and that is what separated him from everyone else and made him the king of Shutter Island. A lot of people are saying that this isn't one of the Scorsese's best works but I have to disagree and say that this his second best film after, of course, ""The Departed"". I suggest that you stop listening to these remarks and just be immersed into this complex yet fascinating mystery/thriller/horror. The wardrobe for this film matches the year it was set in and it does give the film a 1954 feeling. The makeup is quite good as well from the hairstyles to the facial makeup.",
253,28 February 2010,moviemanMA,8, Scorsese thrills and chills,"Shutter Island is based on the book of the same name by Dennis Lehane, the man who penned Mystic River and Gone Baby Gone. Needless to say this film too takes place in Boston, Lehane's stomping grounds, but this time we go outside of the city limits and into Boston Harbor. Federal Marshall Teddy Daniels (Leonardo DiCaprio) has been sent to investigate the disappearance of a patient at a hospital for the criminally insane on Shutter Island. He and his partner Chuck Aule (Mark Ruffalo) must gather the facts, find some clues, and see what exactly happened to this missing patient.",
254,21 February 2010,CaptRon-2,5, Same old story,"It is hard to review this movie without giving away certain plot elements which would lead the reader to a final conclusion. Being sensitive to those that have not seen this movie, I will endeavor not to disclose such details.",
255,9 February 2021,RobTheWatcher,9, Exceptional Movie,This movie is all around genius. The story is original and it's well written and somehow even better executed by acting. Leo is flawless again,
256,13 January 2022,kevin_robbins,10, This is another Scorsese masterpiece,Shutter Island (2010) is a movie in my DVD collection that I recently rewatched on Netflix. The storyline follows an asylum in the 1950s that suddenly lost a patient. Two detectives are sent from the mainland onto the island to investigate the missing persons. They quickly discover a series of strange behaviors and practices by the staff that once they understand better may explain the missing person.,
257,11 May 2015,anaconda-40658,9, Scorsese Island.,"Shutter Island (2010): Dir: Martin Scorsese / Cast: Leonardo DiCapro, Mark Ruffalo, Ben Kingsley, Michelle Williams, Max von Sydow: Psychological thriller about isolation. It stars Leonardo DiCaprio as a federal Marshall who arrives by fairy with his partner to Shutter Island where he is to investigate the disappearance of a dangerous inmate. Things are not as they seem as DiCaprio questions the methods of the institution as well as confront his own visions. Director Martin Scorsese's fourth collaboration with DiCaprio. Previously they were responsible for Gangs of New York, The Aviator, and The Departed. It is no surprise that Shutter Island carries on the trend. Great performance by DiCaprio who grows haunted and suspicious with every clue he discovers. Mark Ruffalo plays his partner who goes for reason when DiCaprio becomes frustrated and heated. Ben Kingsley steals scenes as the head doctor at the institution. DiCaprio doesn't trust the doctor due to lack of cooperation nor is the staff any help. Michelle Williams is seen in flashbacks as DiCaprio's deceased wife. We learn through DiCaprio that she died by an intentional fire where the guilty wasn't found. Her flashback scenes are bright with life while the rest of the film deals with dark shadows and lighting that enhance the corridors of the prison. Max von Sydow is featured briefly as a mysterious doctor who dominates his scenes. With the exception of its ending, this film presents the eerie side of the human animal as well as present the reality of gloom within a prison. It is enough to make you shutter. Score: 9 / 10",
258,27 June 2010,E-un,2, Very Poor Effort,"I don't have much to say about this movie at all. I felt that the storytelling was amateurish at best. The scenes were hacked together in such a poor fashion, and the clues to the ending were so blatant. I worked out the premise of the movie about 8-15 minutes in. Sure, I wasn't absolutely certain at that point, but once I reached my conclusion the 'clues' came thicker, faster, and so blatant they were right in my face. After 30 minutes I had no further doubts that I'd nailed it. It's not so much that I'm so awesome at guessing movie plots, but more about how badly put together this story happens to be.",
259,20 March 2010,FlashCallahan,9, 'Run........',"It's 1954, and up-and-coming U.S. marshal Teddy Daniels is assigned to investigate the disappearance of a patient from Boston's Shutter Island Ashecliffe Hospital.",
260,21 February 2010,TamPalm,6, Blah,"I was ambivalent before going into this movie. I read some great reviews on IMDb and I love Leo Dicaprio as an actor so that made me excited to see it. However, I am not a big Scorce fan--I thought ""Departed"" was overrated--so that made me kind-of leery. Unfortunately, just like ""Departed,"" this movie was overly morbid and the r.o.i (return on investment) was insufficient.",
261,6 December 2011,Bolly_Boba_Booboo,1, What on earth were they thinking?,"I'm about as far away from a Scorcese fan as you can get. In my book he targets the lowest common denominator via a combination of foul language and violence. True, there have been exceptions. I went to see New York, New York, despite antipathy to the two leads, because it was about Jazz in the immediate post-war years; verdict: ho-hum.",
262,16 May 2010,wolverinesforever,8," Live a monster, or die a good man...","There seems to be a divide among critics and audiences on the twist and ending to ""Shutter Island,"" with some calling it brilliant, and others calling it cheap. I found the ending to be effective, and here's why.",
263,19 December 2021,zac-04879,6," Very Slow, But Super Twisted","Shutter Island is certainly worthwhile when you're truly able to concentrate closely on its very slow-moving but immensely complex twist. It's probably not the best movie we've received from such a talented director, Martin Scorsese, but his execution of Dennis Lehane's psychologically thrilling story is still brilliant.",
264,14 March 2010,eahoulie,1, Boring,"I will admit, for the first hour I was riveted. Not because I didn't know what was going on, sorry this movie is predictable. No, I was riveted by the atmosphere of this darkened, storm-secluded island, cold and windy and ripe for something suspicious (similar to the Ring's Moesko Island) and Leonardo Dicapro working his crafted Boston accent. Little quirky behaviors and denial to cooperate do well to induce paranoia. ",
