Review_Date,Author,Rating,Review_Title,Review,Review_Url
697,24 February 2010,DaveDiggler,7, A World of Confusion,"Martin Scorsese has set out to make a film in a genre he's never attempted with ""Shutter Island."" As usual, the greatest director to ever live brings new life into the psychology thriller genre. ""Shutter Island"" is essential Scorsese. At the heart of the movie is Andrew Leadis. Leadis is brought to us by US Marshall, Teddy Daniels. Scorsese takes ""American Psycho"" to a whole new level of insanity by depicting the film through the eyes of a delusional man. It is an unrelenting character study and one of Scorsese's finest. One cannot review the film without talking about the second act, which means there are going to be spoilers. ",
698,20 May 2020,alanpuzey,10, Scorsese's best,I've just watched this movie for the fourth time. It's definitely in my top ten - and tonight I hoped to find the answer for myself. I've just read the most-read review of the film:,
699,13 June 2010,wakemeup36,9, Psychological thrillers don't get much better than this,"I've always believed that within piles and piles of crap, no matter how big the piles, gems can definitely be found. This movie has proved this in respect to modern Hollywood. Where most movies mostly turn out to be generic, rehashed, remakes or just plain stupid, movies like this show some hope for the future of Hollywood.",
700,19 June 2021,a-84775,10, A Martin Scorsese magic,What a movie . Especially the cinematography and the great actor DiCaprio everything was outstanding and spectacular . The facial expressions of DiCaprio that was very nice.one of my favourite movie in Hollywood.,
701,17 February 2018,parameswaranrajendran,9, One of DiCaprio's best film till date,Shutter Island - Leonardo DiCaprio played a complex mind problematic character in this movie which was released in 2010. It was directed by Martin Scorsese. The way he brings up the character from a cop through his delusion to the real life as a mental asylum patient is really a psychological task for our brain to understand. Although the movie is from the novel but Director Martin Scorsese will be the best in this kind of genre which are mystery & thriller.,
702,20 June 2021,anshumoydit,10, No one likes to be messed with.,"Shutter Island. A film that will divide the film community. A film that will leave many upset, and hating it. A film that has already completely split the critics. A movie that messes with you. And no one likes to be messed with. And that is exactly where it exceeds. Think I'm contradicting myself?",
703,20 February 2010,mflems,5, Very disappointed,"I'm actually very surprised at the number of favorable reviews attached to this movie. Perhaps, my expectations were a tad too high before walking into the theater, but it's difficult not to expect a phenomenal film with Scorsese at the helm. I must admit, my problem with the movie is based solely on the actual story line, since I am able to recognize that the cinematography and Scorsese's ""Hitchcockian"" approach to the film are definitely its highlights. If you and I have anything in common, initially, you base whether or not you like a film on the script, the actual story being told, with the director's vision, their angle for telling the story, following close behind. Long story short, while I was able to see the positives while watching Shutter Island (the acting and the film's direction will not disappoint), I found the film to be predictable and just simply, nothing special at all.",
704,28 January 2019,motionlessinblack,9, Excellent twist to an already good movie,"Excellent movie, suspense and trills and an actual explanation. DiCaprio shines in this sorrow tale as does Ruffalo.",
705,8 July 2021,cinarhuseyin-13422,10, Excellent movie,"The movie is excellent, I remember every scene. Worth watching 10 times.",
706,26 December 2018,PhilippBR0,10, There are 2 words to describe this movie,"As you watch it, it's intriguing.
When you discover the truth, it is fascinating.",
707,31 July 2022,Polotovar,8, It starts to make more sense after the second watching,"Interesting film with a good setting. I was a bit confused after it was over so I had to look up some information. Although there is a reveal that tells you something, there are a few moments before it that you probably won't even notice. It will probably start to make more sense if you watch this movie more than once. Anyway, to summarize. It was interesting and mostly because of the reveal. A great movie that I recommend to fans of the mystery genre.",
708,4 September 2019,hassanlu,5, Good movie very bad ending,The story was good and excited but the end donot make any sense and waht the meaning of being stubid,
709,20 February 2010,joecarroll-632-588318,9," A thriller produced for an intelligent audience, imagine that. Absolutely a superb film.","Visually, Martin Scorsese is unparalleled. But, if you know anything about cinema, you already knew that. This film isn't a masterpiece, or a storyline we haven't seen before (think along the lines of Identity [2003]), what this film is, is a beautifully crafted thriller. If you enjoy thrillers, you will enjoy this movie, period. I'm not just referring to the twists and turns in the plot either. When you deal with Scorsese, you get quality, and this film is no different. The acting was phenomenal; DiCaprio, Rufallo, and Kinsley delivered, big time. This flick reads like a great novel, and yet, it refuses to take on that distinctive and predictable Hollywood style (that we have all too often been gratuitously subjected to.) In addition, this film has such a realistic quality to it, that never once did I feel as though I had been cheated out of my money. If anything, the previews for the film don't do it justice, they have promoted it as a ""scary movie"", and that couldn't be further from the truth. I can assure you that Mr. Scorsese isn't looking for the cheap ""Boo! I got you!"" moment. It's just simply not one of those kinds of movies. He realizes he is dealing with an intelligent audience, and thus, he provide us (the audience) with a clever intellectually stimulating film..",
710,17 July 2020,riadmsh,9, Surreal portrayal,Surreal portrayal and music accompanied the suspense better enough....scorsese moves were as delusional as his originals...a new good book,
711,14 March 2010,ecstatic-tickle,8, You won't forget your stay at this particular island resort,"Not gonna lie, this movie scared the sh*t out of me. As once he did back in the 80s with the lesser known After Hours, Scorsese has ramped up the tension in a warped cinematic world of high tension, albeit in a very different location. From the ultra psychedelic dream visions to the blustery heart of the island itself, he uses eerier device possible to enrapture the audience in this camp Gothic hell. DiCaprio is on very good form, more vulnerable than in Revolutionary Road, more blistering than in The Departed - and he is ably supported by a stellar ensemble - featuring some great names...Kinglsey. Ruffalo. Clarkson. Williams...they all shine in their respective warped roles, not to mention Jackie Earle Haley and Emily Mortimor as two seemingly broken souls. For nothing is as it's seems on Shutter Island. This story, my god...the definition of a mindf!ck.",
712,13 December 2019,AgustinCesaratti,10, On the nature of daylight,"What to say about ""Shutter Island""?",
713,1 March 2010,davdecrane,6," You saw the trailer, you know what it's like...","A guilty pleasure to be sure, but worth genuine kudos for attempting and succeeding in lurid B-movie, drive-in fashion the almost-always baroque tale (in movies at least) told by an unreliable narrator. The movie offers strong acting, especially from De Caprio, but little else in the way of real production pleasures. Music, production design and Scorsese's look-at- me camera work are all over the top. ",
714,13 November 2022,hefo-64558,8, You start questioning your own mind,"In the beginning this film seems a bit like some boring '1940's gangster' movie. I had trouble getting into the story. But along the way, stuff keeps getting more and more strange and you start to suspect things aren't as black and white as the seems in the beginning. Disturbing images run through the story without apparent reason. In the last scenes you start questioning your own sanity and after the last lines you've just sitting there baffled. The acting skills are somewhat thin now and then and I think the story is sometimes unnecessarily overly complex, but over all you get more then two hours of skincrawling craziness. Enjoy!",
715,10 December 2022,StarWarsMoviesSuck,8," Very good, but not great","Shutter Island has a amazing atmosphere and the acting is done well, but Scorcese is too overbearing with it. The fugue imagery sequences have the subtlety of a canon, and some of the interactions just seem overblown and spoon-fed. I'll credit Scorcese with some great camera work to establish the mood, and the story itself is engaging although seemingly supernatural as far as psychology goes.",
716,21 March 2010,v_savin2000,2," looks like an anecdote... laughable, sad","after the trailer i nearly expected something as insightful as the ""Green Mile"" by Frank Darabont...",
717,11 October 2019,barashka23,10, I LOVE IT!,"It's one of my favorite movies! Interesting story, awesome acting of all actors. This film should be first in your watchlist!",
718,4 February 2017,MaesterFilm,5, Not a great film,"As a fan of the Scorsese-DiCaprio partnership (Departed, Aviator, Gangs of New York, etc) as well as their separate works (Casino, Goodfellas) (Inception, Blood Diamond, Catch Me If You Can) I thought this film would be a slam dunk success. The ratings show that it is, but it simply isn't.",
719,27 February 2010,paloaltodad-1,1, Unjustifiable Trivialization of the Holocaust,"This film left me with a strong desire to seek out Martin Scorsese and personally escort him to the rice paddies for re-education. When Godard defined film as truth 29 times a second, or something like that, he obviously didn't have this in mind.",
720,28 December 2021,grinningelvis,4, Embarrassing,"Easily the worst film of Scorsese's career, ""Shutter Island"" is difficult to sit through. The ""twist"" is not only sitting in broad daylight, it's completely anti-logical. That leaves the audience with two-plus hours of Leo Dicaprio's secular character du jour - the grieving husband. We know that ugly separations have powered the actor's ascendency to box office king, but with a plot as broad as ""Shutter Island"", one would hope some of the heavy lifting could be done by an actual actress instead of just another sullen, scowling, sweaty Leo. Like ""Inception"", the movie is a fetish piece about men who recently discovered emotional responsibility. These are films that exist wholly in the mind of the scorned, whereby every other character is an obstacle for the hero. It makes for a thrilling screenplay and an utterly flat finished product. What's truly on display here is Thelma Schoonmaker's ability to make even the weakest of conceits a viable product. Too bad the only visible female influence here is behind the camera.",
721,6 April 2020,The_Celluloid_Sage,9, Scorsese masterclass!,"From the opening shot of the ferry coming out of the fog, you know this is going to be a masterpiece of film-making from Scorsese. I've personally had my ups and downs with him, he can be mediocre in my opinion, but when he is brilliant, he truly is brilliant. Scorsese assembled an enviable cast of actors for this film. While that in itself is always a bonus, without a skilled and talented director (as has been seen numerous timed over the years) it is not a guaranteed recipe for success.",
722,21 February 2010,jmvincent02,1, Terrible movie,"Another terrible horror/Drama, not worthy of a ""B"" rating. Do not waste your time on this movie. I expected Martin Scorsese to provide a somewhat entertaining movie but this movie went from bad to worse. Leonardo Dicaprio was definitely not at his best in this role but I'm not sure anyone else could have done any better with this script. Getting back to the movie, I have to say that if the ending was changed it would have been a somewhat bearable film to sit through. I can't believe it has a positive rating on IMDb, although IMDb ratings have let me down before more than once. I don't put much faith in them anymore. Again if your looking for some entertainment this weekend don't waste your time/money on this movie.",
723,1 January 2011,eonbluedan-1,7," Twisted fun, and Scorsese knows it","This is Scorsese's first real step into the horror genre, or rather a step closer to it, as in reality this isn't so much a horror as it is a psychological thriller. It is based on the book by Dennis Lehane; it tells the story of U.S. Marshall Teddy Daniels and his new partner Chuck Aule, assigned to the case of an escaped patient at Boston's Shutter Island Ashecliffe Hospital for the criminally insane. Having arrived, it becomes apparent to Teddy that there is more to this escape than anybody on the island is letting on, and when he is refused access to the hospital records, he becomes convinced there is a conspiracy at work. With a storm cutting communications and transport off the island, the scene is set for a compelling, exciting, and rather mind-bending thriller.",
724,14 September 2012,Manal1987,8, One View Is Just Not Enough,"Could any Scorsese/DiCaprio movie possibly go wrong?! I loved every minute of Shutter Island. The brilliant script is brought to perfection by DiCaprio's exquisite, getting-maturer-by-the-day performance and Scorsese's unfailing ability to entertain both your eye and mind.",
725,22 April 2020,waynehorrorshow,9, Blows you mind really does,This film wow what a mind set of confusing and confusing and a little more confusing amazing way of making a film and makes you think about the film hours later trying to get you head round it Bravo,
726,26 January 2021,khokanbaidya,10," If you think you're a smart person, this movie will prove you wrong.","I watched this movie as a 17year old. This is the movie that developed my interest in this genre.
There are more than 1 twist and you wouldn't get it in the first time.
After you understand the film, you'll feel like you've discovered something wonderful.
The film is well put. Leonardo DiCaprio 's acting is a delight.
I won't give spoilers. Just watch it.",
727,21 February 2010,daryl42-1,9," Bold around the edges, Scorsese paints another fine picture.",8.9,
728,2 June 2014,Reverend3000,5," Far too long, slow-moving",I expected much better for another Scorsese-DiCaprio collaboration.,
729,22 February 2010,grinchbkb,7," Above average, but a worrying lack of ambition from Scorsese","Almost two decades after the release of Cape Fear, it seems that this minor opus from a major American director was more of a turning point than anybody would have thought at the time. Considered as a slight bow to the mainstream, it was in fact an entire new direction. ",
730,12 June 2021,ethlaid,9, Bizarrely Fantastic,A very engaging and twisting story that really gets you thinking. DiCaprio hand delivering a ground breaking performance that enhances his strange character and just emphasises the pure bizarreness of the story.,
731,9 April 2010,minhal92,10, Amazing!,"I have to say, this movie was excelling, it was mind blowing to say the least, amongst the top 20 movies I've ever watched and I've watched quite a few. Brilliant movie making small hints about the plot were dropped through out like subliminal messages, making the movie just the more brilliant. The actors acted really well, another hit movie by Leonardo DiCaprio who's movies always seem to be brilliant. One thing that must be said is that this movie must be watched with concentration and in one go, its not worth it watching it in parts cause if you miss any of the plot and fail to get it the whole movie won't make any sense.. Try not to get spoilers about the plot of the movie, it'll ruin it.",
732,22 October 2010,thegoodman-1,8," I'd rather die a hero, than live as a monster","Shutter island really is a great film, and could be my favourite film of all time, which is why it's so hard to review, everything in the film is superb. The storyline really is original and fascinating, but the acting and chemistry between the characters is what gripped me. Dicaprio steals the show in this with his stunning performance as the Marshall. I just couldn't keep my eyes off Dicaprio every time he was put with another character, how he reacted around them, what things he would say. The way he slowly unravels the case and digs up clues at a calm and cool pace makes the movie smooth and well put together. Dicaprio's character acts just how you'd expect a (MASSIVE SPOILER) mentally ill person thinking they're a federal Marshall to act. How you get to see everything pieced together at the end as well is so satisfying and you don't look back at how things were done and think 'well that seemed a bit far-fetched' in fact you think 'how did i miss all that!' Shutter island really is a brilliant film and delivers an important message, if you haven't seen it yet then what are you waiting for?",
733,8 December 2020,BatBanks,7, Are Dom Cobbs and Teddy Daniels Are the Same Person?,Shutter Island set in the 1950s about a U.S. Marshall trying find a missing murderess at insane asylum on the island. He discover this place is not all this seems.,
734,23 February 2010,sacker-669-579932,1, Gawd Awful,"I don't understand why anyone thought this was a good movie. It was two and a half hours too long...and the movie was two and a half hours long! It was awful! And predictable...I was practically tearing my own eyes out by the end...the best part about it was the credits...I kept thinking it would have to get better, to get scary, to get deep...it didn't. Waste of time!I think some people thought it had a really twisted plot, full of turns and ooooh, scary. Not! It was completely predictable and only nominally well acted. If either of them win an Oscar for this, then the entertainment industry will have met an all time low. Titanic was better than this, and that's saying something, cuz that movie sucked too.",
735,17 March 2021,bignuts-06245,8, Good Scorsese film...,"Leonardo DiCaprio, Mark Ruffalo, Ben Kingsley & Ted Levine star in the story of a couple of U.S. marshals who go to an asylum in search of a missing patient & one of them gets a lot more than he bargains for.",
736,28 February 2010,randolphpat,6, Good job with tough material,"This was a tough film to watch and, I'm guessing, an even tougher film to make.",
737,5 March 2022,liamshirazi,10, Bend before this insane movie,"Toooo much....so amazing 👏 😍 🙌 loved every moment of it. Very well written and directed, the acting was superb amazing twist....scorsese films have and will always be awesome 👌",
738,4 January 2011,skelator666,1," I wanted more than my money back, I wanted my 2 hours back","This was the second worst ""A"" list movie ever made. Pearl Harbor still reigns supreme and the new clash came in a close third. This movie Had some of the most gorgeous sets and music imaginable, but the plot was lame and the ""twist ending"" was so apparent that I figured it out in the first five minutes. This is yet another movie with Leo that I will never watch again. Funny how I never rewatch his movies. Is it him or the crap movies he chooses to be in. Scorsese is a brilliant director, but this movie is proof that he may be past his prime. Skip this one, but if you must see it, feel free to go to the bathroom during the cave scene because less than nothing happens for almost 20 minutes",
739,20 February 2010,MatthewLong23,8, Awesome confusing movie,This was a very good movie to watch. I wouldn't consider it one of Martin Scorsese's best but it's up there. It tells the story about a mental institution where a patient has escaped and 2 US Marshalls have come to investigate. They find themselves not finding more answers but questions as they figure out how she escaped and who may have been involved. Early on you find out that Leo Dicaprio mainly took on this case as the man who set the fire who killed his wife is on the island and wants to confront him. In his mind you see him thinking about his wife and she gives him clues as to what he needs to do to find this missing person. The movie takes a crazy turn in the last bit as to what is real and what isn't. The twist in the end was awesome and made the whole film great. The last bit where Leo and his supposed partner are talking makes you think about what was really up with that but unfortunately the film just ends right there.,
740,22 February 2010,loyolite,8," A must-watch movie , after a loooong time",Just saw this one yesterday.,
741,20 March 2010,EchoMaRinE,10, certainly beyond imagination,"This is a movie I can recommend anyone without hesitation. I haven't seen such a strong movie for a long time. A great atmosphere combined with great acting, great story and great directing. Especially if you don't know the book, you are very likely to enjoy it till the very end. A mental hospital is a quite good place for strange stories and Shutter Island is a prison for mentally sick people that are casting great danger for the society. The story is about an investigation of a marshal on mysterious disappearance of a murderess who is believed to be on the island. A chain of unexpected events reveals the truth that one would have difficulties to imagine. A remarkably good movie indeed, don' miss it.",
742,7 August 2019,gokselll,9, A great psychological drama,"I've watched many movies of Scorsese. He loves picturing inner worlds of characters. Psychological context is a major element of his storytelling style.
Beyond Scorsese's general storytelling preferences, Shutter Island not only focuses on psycohological motivations of characters, but also it is a movie that directly deals with psychology.",
743,10 January 2016,dil_i,9, Surrealism,"Even to begin explaining details of the plot and how everything comes to fruition causes me to feel migraines alike the ones Teddy gets in the movie, therefore I won't ruin anything for you now. Take my honest word that if you enjoyed any Scorsese movie in the past or have enjoyed movies that include surrealism, Shutter Island combines the two into an intense thriller that boggles the mind and possibly even ""corrode it, rusts it"". Also, if you are hesitant to watch this film because the trailer perceives it as a horror film with a lot of ""jumpy"" scenes, ignore that. I had the same feeling entering it, and there was only one towards the very end, but it was worth the shock. You will miss so much detail trying to cover your eyes for a few minutes sporadically throughout that it's not worth it. Take the risk of jumping out of your seat for once, because it was the best scare I could ask for.",
744,6 April 2010,yellowporpoise,9, Great frightening atmosphere,"This movie is amazing. When I watched it, I could feel the terror of schizophrenia, I could smell it, nearly touch it. The atmosphere was so close, just amazing. The pictures were great and you wanted Teddy Daniels to be successful with his investigation. The first couple of minutes I thought that Teddy Daniels was to young and the music was annoying, but the story was so great, that I got sucked into it and stayed there for the rest of the movie. At any moment of the movie I was insecure whom I should trust. Paranoia was everywhere. Every character was well designed and the actors did a great job. You could believe those characters, even if you did not like them. Go and watch this movie. It deserves a place in the top 50.",
745,13 March 2010,CowboyDan32,3, This movie has one huge problem,*This review may also spoil the Sixth Sense*,
746,24 May 2020,adeckofcards,8, Constant confusion,"Martin Scorsese ventured to tell an unusual story in his filmography with 'Shutter Island'.
The film tells how a man (played by Leonardo Dicaprio), who is a police officer, must investigate a patient's escape from a mentally ill asylum on a remote island. With this premise, Scorsese transports the viewer to a story that constantly changes between reality and dream, creating a dreamlike and disturbing atmosphere. Through this atmosphere and added to his usual mastery of directing, moments of absolute suspense are created and presents total confusion for the protagonist, which surpasses the screen when the same audience falls into confusion and uncertainty. So the entire film could be considered as an exercise by the director to generate such confusion.
In general terms, it could not be said that 'Shutter Island' is the best film by Martin Scorsese, rather it could be said that it is a film that departs completely from the stories it usually tells. But that nevertheless, is very captivating and attractive for its visual aesthetics and its particular narrative.",
747,7 January 2019,sonofdale,10, This movie is a masterpiece!!,"When I rented this movie for the first time I honestly didn't know what to think. But as soon as it was over I was sitting up in my seat, heart pounding and eyes filled with tears. Truly a movie worth watching!! What a masterpiece!!",
748,15 April 2020,drmuhammedsamiduru,9, this movie should be watched to understand patient psychology.,A movie that connects and drags the viewer to the screen. The in-game play in the movie has been used successfully in telling the audience what healthy people look like through the eyes of sick people and added a mystery to the movie. This arouses curiosity in the audience and makes the audience more concentrated on the film. I liked the film in terms of psychological functionality by watching it through the eyes of a doctor.,
