Review_Date,Author,Rating,Review_Title,Review,Review_Url
0,30 August 2010,classicsoncall,10," ""Men like you are my specialty, you know?""","There are a number of films I've seen more than once, and if they're good (the only reason really, to watch them again), they become a richer experience and one gains a greater appreciation of them. ""Shutter Island"" might be the only picture that on subsequent viewings, becomes a DIFFERENT film from the one originally seen. I say this because the first time around, there's no way to take the character of Teddy Daniels (Leonardo DiCaprio) other than at face value. He's a detective investigating a missing person case on an island. Not your normal island, but one that's home to an institution for the criminally insane. Every interaction he has with a character in the picture is one between himself, Detective Daniels, and that character. As we come to learn, all that changes when Dr. Cawley (Ben Kingsley) reveals the twist near the end of the story, at which point, one is left either totally disillusioned or utterly blown away.",/
1,22 July 2019,jackgdemoss,9, One of the most memorable plot twists of this decade,"I originally saw this film when it came out but couldn't remember it well enough to give it a rating or write a review, so a rewatch was in order. I viewed the film through the lens of already knowing the plot twist, which made it a whole different experience. The ending will be remembered throughout film history as one that showed just how viciously a well written script can flip an audience over. This really is a film you should see twice.",r
2,24 September 2017,ruhsa,10, The movie is perfect psycho drama,"Shutter Island is the story of Teddy Daniels, A U.S. federal marshal sent to the island with his partner Chuck Aule to search for the disappearance of a patient. Each scene provides a turn against their leads and compels them to look for more whilst searching in places we couldn't comprehend, including their minds. Leonardo DiCaprio and Mark Ruffalo feed off each other and supply great performances for their characters as expected, but some of the other characters whose names are riveted on the posters or marquees are sensational as well. The two that stuck out to me most were Ben Kingsley (Dr. Cawley) and Michelle Williams (Dolores, Teddy's wife), each of whom brought so much dramatics and new questions to the movie, developing plot twists and controversy. I don't think this film would be the same without them.",e
3,22 May 2010,napierslogs,9, Shutter Island is at the top of its genre,"Martin Scorsese has done it again. He pays attention to every detail in this film, making ""Shutter Island"" one of the best suspense thrillers of all time.",v
4,29 July 2018,NpMoviez,10, Movie of the decade.,"It is one of the best movies made by director Martin Scorsese. It is perhaps the best movie starring Leonardo DiCaprio. Honestly speaking, it is one of the greatest films of the decade. DiCaprio featured in two movies in 2010, the other one being ""Inception"". Both were excellent. To this day, they are some of the best cinematic experience I have ever had. That being said, I found ""Shutter Island"" to be much more superior, as ""Inception"" feels a little bit of a mumbo jumbo many times.",i
5,27 February 2010,Tania_Chesala_R,8, Don't be side tracked by the obvious twist.......there is more than one,I know there is already a spoiler warning up top but I am going to warn you again. Don't read this because I am going to give everything away.,e
6,8 July 2011,planktonrules,9," I know it's convoluted and slow, but stick with this one...really.","2010 was very good to Leonardo DiCaprio. Shedding his pretty little boy image, he played in two very gritty and similar films, ""Shutter Island"" and ""Inception"". I saw them both and enjoyed them both. And, to buck the tide, I'd have to say I actually liked ""Shutter Island"" a little more...really. Now do NOT just rush out to rent this one, as I can't see this film appealing to everyone. It IS confusing. The plot can feel a bit tiresome and slow. But, if you are very patient, it all comes together perfectly--with the last 15 minutes totally enthralling me. I think part of it is because I am a retired psychotherapist and psychology teacher--and the film is a great psychological drama. And, the story actually is consistent psychologically and is actually plausible.",w
7,16 April 2010,dvc5159,8, I can't look away...,"Finally, a horror/thriller that actually, genuinely scares the crap out of you. Not because it has fancy villains in masks or sadistic buckets of gore throughout. No, it scares you because it messes with your mind. Most will hate this movie, they don't like their brains being tampered with. I loved it. It's what we needed after all those gory R-rated and sometimes lame-duck PG-13 horror crap-fests.",/
8,29 March 2021,davidmvining,10, One of Scorsese's best,"This movie's ending is a case study in how to read movies. If you consider what was said before, what was done before, and the basics of the character's journey, there is literally only one way to read the movie's final moments. Everything up to that moment builds to the finale is designed to feed a specific end point, and it helps the movie as a whole that everything up to that point is incredibly well done. Scorsese had one early foray into big budget filmmaking with New York, New York, which wasn't really any kind of success, but his turn into big budget filmmaking with another two decades of experience under his belt has been far more successful as he is able to still coax quality performances from his actors while working with more traditionally narrative based scripts (this time based on a novel by Dennis Lehane) and much more intricate and larger production design.",r
9,23 February 2010,TheDeadMayTasteBad,9, All it Takes is One Line of Dialogue to Make an Impact...,"There is one line of dialogue, right at the end of Shutter Island before the credits roll, that elevates the emotion of the film and makes it much more powerful. For those of you, like me, who read and enjoyed the novel before seeing the film and felt that the trailers and advertisements for this film were leading you to believe there wouldn't be any narrative surprises in store, think again! Scorsese's film features that one brief piece of dialogue at the films conclusion that results in an entirely different perception of the final act. The rest of the film, however, is very faithful to Dennis Lehane's already great story.",w
10,9 March 2020,Ch4ndler_B1ng,10, Best Film of the Decade...,"68% on Rotten Tomatoes, really?",2
11,21 February 2010,stednitzrules250,10, No one likes to be messed with.,"Shutter Island. A film that will divide the film community. A film that will leave many upset, and hating it. A film that has already completely split the critics. A movie that messes with you. And no one likes to be messed with. And that is exactly where it exceeds. Think I'm contradicting myself? ",2
12,6 August 2010,TheLittleSongbird,9, Atmospheric and clever- really makes you think deep,"I like Martin Scorsesse a lot, and I was interested in seeing Shutter Island. It had a truly intriguing concept and my 17-year old sister was raving about how brilliant the film was. Shutter Island is not Scorsesse's best, but it was atmospheric, clever, incredibly thought-provoking and somewhat disturbing too.",1
13,29 December 2015,Irishchatter,9, A fantastic film with DiCapro,"I thought this film was fantastic, i wouldn't call it scary or easily frightening, I would call it a mystery thriller masterpiece. As usual with Leonardo DiCapro, he was always excellent at playing the right roles. Gee, he had to play two characters - Ted and Andrew which could make you confused to which one is he really acting as. That must be really challenging but i say Leonardo is well able to do any role at the same time!",0
14,14 May 2010,talkymeat,10, A Dark Brooding Masterpiece.,"Shutter Island centers around two U.S. Marshalls who must search for a missing patient on said island, which has a large complex specifically designed for harboring the most violent and disturbed mental patients. Agent Teddy Daniels and his partner must try to understand the mysteries of Shutter Island while attempting to unearth a plot that may go all the way up to the men who run it.",2
15,17 February 2010,slothhead54,9," Of all the movies in theatres to see, this is worth your time","I just saw Shutter Island this evening, just prior to its American release. I have to say this film was full of intrigue. Prior to viewing this film I had built a preconceived notion of what this thriller was going to be like because I was fooled yet again by good marketing when watching the trailer. This is probably not the movie for your average film-goer who wants an easy plot line to follow and little thought required. This movie does challenge the viewer physchologically and definitely holds your attention all the way through. For someone who was never much of a Leonardo fan, his performance is brilliant, so much range to his character. In fact all of the acting in this film is excellent. The directing is probably the best quality to this film. I always enjoy watching a film that is as unpredicatable as this film and where the director has turned the plot line on to his viewer.",4
16,19 February 2010,bain0038,10, Don't miss this one - review from a skeptic.,"From the look of the trailer, Martin Scorsese's ""Shutter Island"" looks more like a horror film This is a dangerous place where isolation rules under fascist control. A U.S Marshall is sent to an asylum to investigate a missing patient but discovers so much more. A demon? A ghost? Something more? Is this going to be as disappointing as I think it is?",2
17,19 February 2010,IamtheRegalTreatment,9, Counting down the days until I can add this to my DVD collection...,"Similar to my rating for this film, you can argue that 9 out of 10 people who watch this movie, it will not be their first Scorsese film. Most of us know the genius that he is and coming into this showing we should expect brilliance, and gladly he delivers a captivating storyline driven by great acting. Unfortunately with the release of Shutter Island was also a press release that Taxi Driver may be remade, so that news made me hesitant to care, but I'm glad I was wrong.",/
18,30 August 2010,Hitchcoc,8," OK, Play with My Mind!","I was told on several occasions to skip this film. While I felt it took a long way to get to the point, I found it intriguing and engaging. I've really grown to like DeCaprio and find him to be an interesting actor. One reviewer did criticize him for hanging around the dark side a bit much, but that could be said about Nicholson and a host of others. This is one of those mind puzzles that force one to guess a good deal. Because of the pace, I eventually figured it out. Nevertheless, it is told in a very interesting way. With ""Inception"" capturing the box office recently, this seems a mild effort to explore the subconscious. It is multi-layered and complex. It throws curves and red herrings, but I never felt toyed with. This is certainly worth a shot.",?
19,29 September 2021,Rainey-Dawn,10, Mystery Fans Must See!,This is by far one of the best mystery-thrillers ever written! Twists and turns that will shock and a story that will keep you on the edge of your seat - a must watch!,r
20,16 February 2010,blackmambamark,8," Once again, Scorsese has helped redefine a genre'","Sure everyone knows the typical Scorsese film. Normally there is a mob present, or in most cases, a tough brute who loves to flash the ""F"" bomb in almost every sentence. But what about a thriller? I mean sure, we have seen it in ""Cape Fear"", probably one of my personal favorite remakes. But what about a top notch mind bending thriller that really makes you think. Something the likes of which we have never seen Mr. Scorsese do. But given his previous works of art, its really hard to doubt that he cannot pull this off.",e
21,25 July 2013,lesleyharris30,9," Shocking and Brilliant,","Shutter Island is an absolute breathtaking movie with a tremendous storyline that will keep you interested all the way through and a brilliant cast that all follow through with their performances in an overall terrific film once again from the great Martin Scorsese.The movie sounded pretty plain to me,I thought it would be an average thriller that I would enjoy but it would be pretty forgettable,but it totally wasn't,the movie had me curious and also confused,and the twist was one of the greatest,most surprising and most shocking twists i've ever seen in a movie,I literally never suspected it,not even once,and when it did happen I still didn't believe it.Shutter Island is a must see for all fans of Leonardo DiCaprio,Martin Scorsese,thriller and mystery.",f
22,12 June 2018,ComedyFan2010,10, Wonderful movie,I guess when looking at the names of director and the cast one knows that it can't go wrong. And it didn't. I loved this movie through it's 138 minutes and it didn't even seem that long.,_
23,31 December 2015,Screen_Blitz,8," Twisted, somber, but hugely entertaining Scorcese thriller","Martin Scorcese has laid many cinematic landmarks in crime genre, and as a result, has earned a spot as one of the most influential directors to ever step foot in Hollywood. He has been met with much critical acclaim with his gritty portrayal of the gangster life in his film such as Taxi Driver, Goodfellas, Casino, Gangs of New York, and The Departed. Teaming up with his frequent collaborator Leonardo Dicaprio, Scorcese takes a more dark and surreal direction in this psychological thriller set with plenty of twists and turns. Leonardo Dicaprio plays U.S Marshal Teddy Daniels, who travels across seas to investigate a mysterious and deserted island along with his partner Chucke Aule (played by Mark Ruffalo). There lies a hospital run by Dr. Cawley (played by Ben Kingsley) and Dr. Neahring (played by Max Von Sydow) holding mentally insane prisoners, where Daniels and Aule are in search of a patient named Rachel who has mysteriously disappeared. Going further into their investigation, the two quickly turn the dark and sinister secrets behind the wretched prison of a hospital, soon to the point where Daniels deteriorating of his mental state and his identity all together. ",=
24,13 March 2010,bkoganbing,7, Mind Games,Shutter Island is a body of land in Boston Harbor which has a hospital for the criminally insane. It's run by a pair of doctors played by Ben Kingsley and Max Von Sydow who have certainly essayed roles of some very deep villainy. Couple that with the fact that this film is set in post World War II where America has just been fighting with people who have mysterious accents like Von Sydow and Kingsley. It's a recipe for a Hitchcock like thriller.,t
25,23 February 2010,czavaleta73,9, Great a must watch !!,"I saw this and I knew what to expect going in to the film as I had already read about half of the book but never got the chance to finish it. But I was surprised at how faithful the film was to the original material.The directing was also masterfully done and pretty cool I saw some cool camera tricks I hadn't seen since Martin Scorsese directed Bringing Out The Dead, Martin Scorsese did one great job and everyone was top notch especially Ben Kingsley and DiCaprio and I never though I would jump out of fright especially in a Scorsese film but I did. All in all a solid thriller with a good story and some great performances and for me it's the best film I've seen in 2010 so far.",t
26,15 February 2010,naman-avastol,8, Another Martin-Leo Masterpiece!!!,"Martin Scorsese returns to film making after winning the academy award for The Departed with his fav star Leonardo DiCaprio.. This time he move to a completely different script which keeps the audience humored and thrilled from the first scene till the last! The movie( which i saw at the Berlin film festival!) blew away the minds of many people, the plot being so strong and thrilling which kept the audiences guessing! ",_
27,15 January 2011,Theo Robertson,7, A Disappointment From A Master Director,"Martin Scorsese is in my opinion the greatest living movie maker . He started off during the New Hollywood era in the late 1960s and is described as a "" movie brat "" , a film maker who was brought up on a fine diet of cinema during his formative years and it shows . He is very much an aficionado of cinema and this in depth knowledge shows in SHUTTER ISLAND ",u
28,8 May 2010,hitchcockthelegend,7, Don't you get it? You're a rat in a maze.,"US Marshal Teddy Daniels (Leonardo DiCaprio) travels to an island asylum facility for the criminally insane with his newly assigned partner Chuck Aule (Mark Ruffalo). Their reason for being at Ashecliff Hospital is to investigate the mysterious disappearance of murderess Rachel Solando. But Teddy has another issue to deal with at Ashecliff, namely a meeting with Andrew Laeddis (Elias Koteas), the man he believes responsible for the death of his wife (Michelle Williams). Nothing is what it seems at the facility though, and the further Teddy & Chuck investigate, the murkier the truths of Ashecliff become.",r
29,24 February 2010,gregeichelberger,4, Scorsese throws a curve ball; audience strikes out,"Last year, I lamented the fact that Martin Scorsese's long-await psychological thriller ""Shutter Island"" was relegated to the dead movie month of February, especially when it was receiving serious Oscar buzz at the time.",v
30,14 October 2011,ElMaruecan82,5, A savor-less salad of cinematic tricks ...,"Guess who praised Martin Scorsese's ""Shutter Island""? Roger Ebert! The cinematography, the spooky atmosphere, the film noir's overtones, the whole psychological torment, the ""buried trauma"" to quote him, as so many voices speaking in favor of ""Shutter Island"", another great achievement from the greatest director of his generation.",
31,28 March 2010,mrcibubur,8, No Hitchcock horror but a brilliant chiller thriller from Scorcese!,"I watched this in the cinema on a Friday night and expected a horror film because it was hyped as a horror film. Make no mistake, this is a chilling psychological thriller and I can quite see why Scorcese likes to work with Leonardo (from 'The Departed') and with Robert Richardson from the cinematography for 'Inglorious Basterds'.",
32,16 February 2010,tsquared226,10, Another Excellent Film by Scorsese...,"Really, Scorsese should just give it away for anyone. The man is one of the most brilliant directors of our time. Anyway, let me get to the actual movie; I just saw it at a early screening and have to write this while I'm thinking about how stunning it was. Shutter Island is certainly not a typical film, not even for Scorsese. It is a different take for the director, and he does it, as he does every film, perfectly, so much as to be in his own league of film-making. I don't want to give anything away, but I will say this: Shutter Island was completely unexpected, and a great start to 2010. It had all the components of a great film, and then some. The acting is spot on from every character; none of it seems forged or out of place. The script is fantastic; it has one of the most intriguing plots I have seen in a while (exception being Tarantino's Basterds). Everything, down to the set's lighting, was perfectly executed. I will say that not everyone will like this; Shutter Island, again, isn't your typical movie. To those, though, who do choose to see this film, be ready for a compelling, gripping, thought-provoking experience, so much so that you might think to see it again for further clarity (I know I will; it was so entertaining and my mind was blown!). Don't be surprised if you see this at the next Oscars...",
33,19 February 2010,gavin6942,8, Scorsese and DiCaprio Do It Again,"US Marshal Teddy Daniels (Leonardo DiCaprio) and his partner Chuck Aule (Mark Ruffalo) are dispatched to Shutter Island, a facility that combines mental health treatment and criminal detention. One patient, Rachel Solando, is missing and has slipped through the walls as if through evaporation. Where on the island could she have gone?",
34,10 June 2010,gradyharp,10, The Mind as Prison,"Too rarely are we offered films that are so well written (Laeta Kalogidis does a marvelous adaptation of Dennis Lahane's mesmerizing novel) that after viewing the audience is almost afraid to leave the theater or home screen for fear they may have missed some important information that will help them figure out why the story is so successfully enigmatic. Such is the case for Martin Scorsese's brilliant film, SHUTTER ISLAND. It is only in retrospect, after the shock of the film is over, that the magic of quality cinematic achievement can be appreciated. Then in rethinking the events the film portrays so well the story is as straightforward as Scorsese's vision. ",
35,7 June 2020,gayan-27516,10, movie ending complicated,"Teddy is refusing to accept the fact that he killed his wife after she murdered their children and has become delusional and violent. The role-play was the last effort to force him to accept his crimes or he would be lobotomised. The final moment suggests he has finally understood it but pretends he hasn't, in order to be lobotomised, to avoid living with grief",
36,29 April 2020,masonsaul,9, Incredible psychological thiller,"Despite some brief but weak CG, Shutter Island is an incredible psychological thiller that's extremely suspenseful, atmospheric and unpredictable. Leonardo DiCaprio is incredible and both Mark Ruffalo and Ben Kingsley are great. It's extremely well paced and the music Robbie Robertson is amazing. Martin Scorsese's direction is excellent and it's beautifully filmed.",
37,14 February 2010,tbmforclasstsar,10, Shutter Island Lives Up to the Name,"From the first note of the score, to the last shot on the screen I was completely enthralled by Martin Scorsese's latest Picture. Shutter Island, the story of two federal marshals investigating a patient escape at a maximum security hospital for the criminally insane, is very simply put: an experience. Shutter Island works because it pulls at all different emotions. An audience is both humored, and on the edge of tears; jumping out of their seat, and sinking deep within it. For 2 hours and 18 minutes, one is completely submerged into a Gothic, noir like world that is intriguing and horrifying at the same time. ",
38,8 January 2021,eva3si0n,9, Shuttle Island is a great thriller with a strong cast,"Shuttle Island is a great thriller with a strong cast. It may seem that DiCaprio 's acting obscures everything else, so cool he plays. And the climax of the film completely turns it 180 degrees, now there are not many films that manage this moment.",
39,15 March 2011,moonspinner55,5," Artistic curlicues decorate a thin, derivative script...","Once director Martin Scorsese attained widespread acceptance from moviegoers (and mainstream critics) with the massive commercial success of ""Cape Fear"" in 1991, he quickly turned into a 'blockbuster' filmmaker, one who had his pick of top-rank collaborators. The Scorsese name became a brand--like Spielberg's--however, the movies he has chosen to work on since do not always echo the interests of the young, raw Scorsese. With ""Shutter Island"", an adaptation of a novel by Dennis Lehane, the stamp of Scorsese becomes interchangeable with that of Shyamalan, De Palma, Polanski...even the ghost of Stanley Kubrick, whose ""The Shining"" seems to be an inspirational starting point for this thin, shuddery yarn. Leonard DiCaprio plays a U. S. Federal Marshal in 1954 investigating the disappearance of a female mental patient from a locked-down asylum in the Boston Harbor. Elements of other films keep turning up in Laeta Kalogridis' poor script, which incorporates (at various intervals) concentration camp detail with a triple homicide that is both exploitative and distasteful. The large cast is solid, for the most part--Scorsese has retained his uncanny ability to bring out the best in his actors--though I'm not sure how deeply DiCaprio is feeling his role. His frequent scowl doesn't reveal anything but a petulant nature, which, coupled with his youthful appearance, doesn't lend much conviction to a character who is alternately a soldier, a family man, and a government employee. DiCaprio is making a career out of seeming miscast; since this entire house-of-cards plot rests on the star's shoulders, the final denouement isn't the heart-breaker it should have been. The picture is vividly atmospheric and features excellent technical detail, yet it is a glum undertaking burdened with overwrought profanities ill-suited to the era. This is what Martin Scorsese wants to bide his time with? ** from ****",
40,30 August 2021,AnnaPagrati,10, OH MY GOD!,One of the best movies of the century! Loved every little plot twist!,
41,19 August 2014,begob,4, Unconvincing,"The first half of this movie is a fantasy, which gets solved in the second half by old-fashioned psychological here's-what-really-happened.",
42,10 April 2010,LeoCrow2002,10," Which Would Be Worse, To Live As A Monster Or To Die As A Good Man?","If Paramount Pictures had released Martin Scorsese's Shutter Island last year – the original release date was October 2nd, 2009 – I would have considered the film the best movie of the year. As it stands, the rest of 2010 has a long way to go in terms of matching the quality and effectiveness of Scorsese's new picture. It's a fascinating character drama, an exciting and almost experimental exploration of the human mind, a reinvention of the horror genre and a dynamic acting showcase for its star, the incredible and still very underrated Leonardo DiCaprio.",
